config,run_id,file,group,question,ground_truth,answer,retrieved_contexts,faithfulness,context_recall
A_single_pipeline,1,(사)벤처기업협회_2024년 벤처확인종합관리시스템 기능 고도화 용역사업 .hwp,extreme,이 사업의 계약방식(입찰방식)은 무엇인가?,제한경쟁입찰(협상에 의한 계약),□ (계약방식) 제한경쟁입찰(협상에 의한 계약)에 의한 선정*,"[""□ (계약방식) 제한경쟁입찰(협상에 의한 계약)에 의한 선정*"", ""※ 공공기관의 개인정보 취급 시 준수해야 하는 공통법규(법률, 지침, 매뉴얼 고시 등) 및 평가대상 사업의 특성에 따라 적용되는 관련 법 등을 참고하여 평가기준을 수립해야 함""]",,
B_rule_single_route,1,(사)벤처기업협회_2024년 벤처확인종합관리시스템 기능 고도화 용역사업 .hwp,extreme,이 사업의 계약방식(입찰방식)은 무엇인가?,제한경쟁입찰(협상에 의한 계약),"◦ 협상대상자 선정은 제안서 평가결과 기술평가 점수 총점 100점 기준으로 각 평가항목에 대한 점수를 합산하여 평가하고 최종점수는 90점 만점으로 환산하여 적용하며, 최종 평가점수 기준으로 일정비율(85%) 이상인 자를 협상적격자로 선정함","[""◦ 협상대상자 선정은 제안서 평가결과 기술평가 점수 총점 100점 기준으로 각 평가항목에 대한 점수를 합산하여 평가하고 최종점수는 90점 만점으로 환산하여 적용하며, 최종 평가점수 기준으로 일정비율(85%) 이상인 자를 협상적격자로 선정함"", ""◦ 기술평가점수도 동일한 경우 기술능력의 세부평가항목 중 배점이 큰 평가항목에서 점수가 높은 업체\n[ 기술성 평가 기준표 ]"", ""제1조 [목적] 이 협정서는 아래 계약을 공동수급체의 구성원이 재정, 경영, 기술능력, 인원 및 기자재를 동원하여 아래의 공사, 물품 또는 용역에 대한 계획, 입찰, 시공 등을 위하여 출자비율에 따라 공동연대하여 계약을 이행할 것을 약속하는 협약을 정함에 있다.\n  1. 계약건명  :\n  2. 계약금액 :\n  3. 발주자명 :\n제2조 [공동수급체] 공동수급체의 명칭, 사업소의 소재지, 대표자는 다음과 같다.\n  1. 명          칭 : ○○○\n  2. 주사무소소재지 :\n  3. 대 표 자 성 명 :\n제3조 [공동수급체의 구성원] ①공동수급체의 구성원은 다음과 같다.\n  1.○○○회사(대표자 :         소재지 :                )\n  2.○○○회사(대표자 :         소재지 :                )\n  ②공동수급체 대표자는 ○○○로 한다.\n  ③공동수급체 대표자는 발주자 및 제3자에 대하여 공동수급체를 대표하며, 공동수급체의 재산관리 및 대금청구 등의 권한을 가진다.\n제4조 [효력기간] 본 협정서는 당사자간의 서명과 동시에 발효하며, 당해계약의 이행으로 종결된다. 다만, 발주자 또는 제3자에 대하여 당해 계약과 관련한 권리의무 관계가 남아있는 한 본 협정서의 효력은 존속된다.\n제5조 [의무] 공동수급체의 구성원은 제1조에서 정한 목적을 수행하기 위하여 성실, 근면 및 신의를 바탕으로 하여 필요한 모든 지식과 기술을 활용할 것을 약속한다.\n제6조 [책임] 공동수급체의 구성원은 발주기관에 대한 계약상의 의무이행에 대하여 연대하여 책임을 진다.\n제7조 [하도급] 공동수급체 구성원 중 일부 구성원이 하도급계약을 체결하고자 하는 경우에는 다른 구성원의 동의를 받아야 한다.\n제8조 [거래계좌] 예규「지방자치단체 공동계약 운영요령」Ⅲ-7 대가의 지급 규정에 정한 바에 의한 선금, 기성대가 등은 다음 계좌로 지급받는다.\n  1. ○○○회사(공동수급체대표자) : ○○은행, 계좌번호○○○, 예금주○○○\n  2. ○○○회사 : ○○은행, 계""]",,
C_rule_multi_route,1,(사)벤처기업협회_2024년 벤처확인종합관리시스템 기능 고도화 용역사업 .hwp,extreme,이 사업의 계약방식(입찰방식)은 무엇인가?,제한경쟁입찰(협상에 의한 계약),"◦ 협상대상자 선정은 제안서 평가결과 기술평가 점수 총점 100점 기준으로 각 평가항목에 대한 점수를 합산하여 평가하고 최종점수는 90점 만점으로 환산하여 적용하며, 최종 평가점수 기준으로 일정비율(85%) 이상인 자를 협상적격자로 선정함","[""◦ 협상대상자 선정은 제안서 평가결과 기술평가 점수 총점 100점 기준으로 각 평가항목에 대한 점수를 합산하여 평가하고 최종점수는 90점 만점으로 환산하여 적용하며, 최종 평가점수 기준으로 일정비율(85%) 이상인 자를 협상적격자로 선정함"", ""◦ 기술평가점수도 동일한 경우 기술능력의 세부평가항목 중 배점이 큰 평가항목에서 점수가 높은 업체\n[ 기술성 평가 기준표 ]"", ""제1조 [목적] 이 협정서는 아래 계약을 공동수급체의 구성원이 재정, 경영, 기술능력, 인원 및 기자재를 동원하여 아래의 공사, 물품 또는 용역에 대한 계획, 입찰, 시공 등을 위하여 출자비율에 따라 공동연대하여 계약을 이행할 것을 약속하는 협약을 정함에 있다.\n  1. 계약건명  :\n  2. 계약금액 :\n  3. 발주자명 :\n제2조 [공동수급체] 공동수급체의 명칭, 사업소의 소재지, 대표자는 다음과 같다.\n  1. 명          칭 : ○○○\n  2. 주사무소소재지 :\n  3. 대 표 자 성 명 :\n제3조 [공동수급체의 구성원] ①공동수급체의 구성원은 다음과 같다.\n  1.○○○회사(대표자 :         소재지 :                )\n  2.○○○회사(대표자 :         소재지 :                )\n  ②공동수급체 대표자는 ○○○로 한다.\n  ③공동수급체 대표자는 발주자 및 제3자에 대하여 공동수급체를 대표하며, 공동수급체의 재산관리 및 대금청구 등의 권한을 가진다.\n제4조 [효력기간] 본 협정서는 당사자간의 서명과 동시에 발효하며, 당해계약의 이행으로 종결된다. 다만, 발주자 또는 제3자에 대하여 당해 계약과 관련한 권리의무 관계가 남아있는 한 본 협정서의 효력은 존속된다.\n제5조 [의무] 공동수급체의 구성원은 제1조에서 정한 목적을 수행하기 위하여 성실, 근면 및 신의를 바탕으로 하여 필요한 모든 지식과 기술을 활용할 것을 약속한다.\n제6조 [책임] 공동수급체의 구성원은 발주기관에 대한 계약상의 의무이행에 대하여 연대하여 책임을 진다.\n제7조 [하도급] 공동수급체 구성원 중 일부 구성원이 하도급계약을 체결하고자 하는 경우에는 다른 구성원의 동의를 받아야 한다.\n제8조 [거래계좌] 예규「지방자치단체 공동계약 운영요령」Ⅲ-7 대가의 지급 규정에 정한 바에 의한 선금, 기성대가 등은 다음 계좌로 지급받는다.\n  1. ○○○회사(공동수급체대표자) : ○○은행, 계좌번호○○○, 예금주○○○\n  2. ○○○회사 : ○○은행, 계""]",,
A_single_pipeline,1,(사)부산국제영화제_2024년 BIFF & ACFM 온라인서비스 재개발 및 행사지원시.hwp,central,이 사업의 입찰방식은 무엇인가?,제한 경쟁입찰(지역 제한),"- 주관기관은 접수된 제안서에 대한 기술평가를 위해 5인 이상으로 구성된 평가위원회를 구성하고, 소프트웨어 기술성 평가기준을 기초로 하되 본 사업의 특성을 고려한 평가기준에 의거하여 평가를 실시한다","[""3. 주관사업자 선정방식(제안서 평가)\n가. 기본방침 및 적용규정, 절차\n     1) 기본방침\n- 객관적이고 공정한 기준과 절차를 적용하여 경쟁에 의한 우수사업자 선정\n- 공모를 통하여 많은 사업자에게 참여기회 부여\n     2) 적용규정\n- 지방자치단체를 당사자로 하는 계약에 관한 법률 및 동 시행령\n- 지방자치단체를 당사자로 하는 계약에 관한 법률 시행규칙\n     3) 입찰에 있어서의 주관사업자 선정절차\n- 입찰공고 된 사업에 응찰하고자 하는 자는 주관기관이 요청하는 제안요청서에 따라 제안서를 작성하여 주관기관에 기일 내 제출\n- 주관기관은 접수된 제안서에 대한 기술평가를 위해 5인 이상으로 구성된 평가위원회를 구성하고, 소프트웨어 기술성 평가기준을 기초로 하되 본 사업의 특성을 고려한 평가기준에 의거하여 평가를 실시한다.\n- 주관기관은 낙찰자를 결정하여 주관사업자를 확정하고 그 결과를 전담기관에 통보\n- 평가위원회의 결정에 따라 일부 또는 전체 제안사업자에 대해 보완자료와 현장 확인을 요청할 수 있음.\n나. 우선협상대상자 및 낙찰자 결정 방법\n- 제안서 평가결과의 기술능력평가 점수가 기술능력평가분야 배점한도의 85% 이상인 자를 협상적격자로 선정한다. \n- 협상순서는 협상적격자의 기술능력평가 점수와 입찰가격평가 점수를 합산하여 합산점수의 고득점순에 따라 결정한다. \n- 다만, 합산점수가 동일한 제안자가 2인 이상일 경우에는 기술능력 평가점수가 높은 제안자를 선순위자로 하고, 기술능력 평가점수도 동일한 경우에는 기술능력의 세부평가항목 중 배점이 큰 항목에서 높은 점수를 얻은 자를 선순위자로 한다.""]",,
B_rule_single_route,1,(사)부산국제영화제_2024년 BIFF & ACFM 온라인서비스 재개발 및 행사지원시.hwp,central,이 사업의 입찰방식은 무엇인가?,제한 경쟁입찰(지역 제한),"- 주관기관은 접수된 제안서에 대한 기술평가를 위해 5인 이상으로 구성된 평가위원회를 구성하고, 소프트웨어 기술성 평가기준을 기초로 하되 본 사업의 특성을 고려한 평가기준에 의거하여 평가를 실시한다","[""3. 주관사업자 선정방식(제안서 평가)\n가. 기본방침 및 적용규정, 절차\n     1) 기본방침\n- 객관적이고 공정한 기준과 절차를 적용하여 경쟁에 의한 우수사업자 선정\n- 공모를 통하여 많은 사업자에게 참여기회 부여\n     2) 적용규정\n- 지방자치단체를 당사자로 하는 계약에 관한 법률 및 동 시행령\n- 지방자치단체를 당사자로 하는 계약에 관한 법률 시행규칙\n     3) 입찰에 있어서의 주관사업자 선정절차\n- 입찰공고 된 사업에 응찰하고자 하는 자는 주관기관이 요청하는 제안요청서에 따라 제안서를 작성하여 주관기관에 기일 내 제출\n- 주관기관은 접수된 제안서에 대한 기술평가를 위해 5인 이상으로 구성된 평가위원회를 구성하고, 소프트웨어 기술성 평가기준을 기초로 하되 본 사업의 특성을 고려한 평가기준에 의거하여 평가를 실시한다.\n- 주관기관은 낙찰자를 결정하여 주관사업자를 확정하고 그 결과를 전담기관에 통보\n- 평가위원회의 결정에 따라 일부 또는 전체 제안사업자에 대해 보완자료와 현장 확인을 요청할 수 있음.\n나. 우선협상대상자 및 낙찰자 결정 방법\n- 제안서 평가결과의 기술능력평가 점수가 기술능력평가분야 배점한도의 85% 이상인 자를 협상적격자로 선정한다. \n- 협상순서는 협상적격자의 기술능력평가 점수와 입찰가격평가 점수를 합산하여 합산점수의 고득점순에 따라 결정한다. \n- 다만, 합산점수가 동일한 제안자가 2인 이상일 경우에는 기술능력 평가점수가 높은 제안자를 선순위자로 하고, 기술능력 평가점수도 동일한 경우에는 기술능력의 세부평가항목 중 배점이 큰 항목에서 높은 점수를 얻은 자를 선순위자로 한다."", ""<표>\n가. 제안서의 평가항목 및 배점한도 : 100점 만점기준"", ""2. 사업목표\n  ○ 웹 표준, 웹 접근성 및 웹 UI에 대한 기능개선으로 사용자 중심의 웹서비스를 제공한다.\n  ○ BIFF, ACFM에서 운영 중인 웹사이트에 대하여, 당해 연도의 독창적인 디자인 UI 적용, 최신 트렌트를 반영하여 브랜드 가치 제고.\n  ○ BIFF, ACFM 각종 접수 및 참가 시스템을 당해 연도 정책에 따라 개선하여 참가자와 관리자의 편의성을 제고 한다.\n  ○ 당해 연도 생산되는 콘텐츠를 운영 중인 웹사이트의 각종 페이지로 제작하고, 내부 업무관리시스템과의 데이터 연동, 서버 연계를 통해 반영되는 모든 정보를 실시간 제공한다.\n  ○ 채용시스템, 티켓시스템, 각종 스크리닝 서비스(CDN) 등을 외부 솔루션과 연계한 다양한 서비스 개발을 통해 웹사이트의 확장성을 제고 하고, 관리자와 사용자의 편의성을 도모한다.\n  ○ 다양한 디바이스에서 동일한 콘텐츠를 제공할 수 있도록 반응형 웹 페이지를 제작하여 양질의 서비스를 제공한다.\n  ○ 각종 커뮤니티 플랫폼과 SNS를 연동하여 콘텐츠의 허브 역할 도모한다.\n  ○ 출입관리시스템, 의전관리시스템, 폐쇄형 온라인 스크리닝 시스템, 실시간 채팅 시스템 등 내부 행사 지원을 위한 각종 시스템 공급을 통해 관리자의 편의성 제고 한다.\n  ○ 행사 지원시스템에 대하여, 행사 진행 공간의 유동성을 위해 요청에 따라 모바일 웹 또는 앱 형태로 제공하여 휴대성과 편의성을 제고한다.\n  ○ 영화제 임박기간 전문 인력을 파견하여, 생성되는 각종 콘텐츠와 페이지 제작 업무를 진행하며, 발생하는 다양한 변수를 신속하고 안정적으로 해결한다.\n  ○ 개발 및 제공하는 모든 사이트의 사용자 수, 이벤트 수, 페이지뷰 수 등의 접속 통계 자료를 제공한다.\n  ○ 각종 웹사이트와 시스템 기획 및 개발, 디자인 요청 등의 다양한 전산요청을 위해 상태 체크(전체, 접수, 진행, 완료) 및 파일 첨부가 가능한 온라인 헬프데스크를 공급, 운영하여 부서별 발생하는 요청사항을 빠르고 효과적으로 처리한다.""]",,
C_rule_multi_route,1,(사)부산국제영화제_2024년 BIFF & ACFM 온라인서비스 재개발 및 행사지원시.hwp,central,이 사업의 입찰방식은 무엇인가?,제한 경쟁입찰(지역 제한),"- 주관기관은 접수된 제안서에 대한 기술평가를 위해 5인 이상으로 구성된 평가위원회를 구성하고, 소프트웨어 기술성 평가기준을 기초로 하되 본 사업의 특성을 고려한 평가기준에 의거하여 평가를 실시한다","[""3. 주관사업자 선정방식(제안서 평가)\n가. 기본방침 및 적용규정, 절차\n     1) 기본방침\n- 객관적이고 공정한 기준과 절차를 적용하여 경쟁에 의한 우수사업자 선정\n- 공모를 통하여 많은 사업자에게 참여기회 부여\n     2) 적용규정\n- 지방자치단체를 당사자로 하는 계약에 관한 법률 및 동 시행령\n- 지방자치단체를 당사자로 하는 계약에 관한 법률 시행규칙\n     3) 입찰에 있어서의 주관사업자 선정절차\n- 입찰공고 된 사업에 응찰하고자 하는 자는 주관기관이 요청하는 제안요청서에 따라 제안서를 작성하여 주관기관에 기일 내 제출\n- 주관기관은 접수된 제안서에 대한 기술평가를 위해 5인 이상으로 구성된 평가위원회를 구성하고, 소프트웨어 기술성 평가기준을 기초로 하되 본 사업의 특성을 고려한 평가기준에 의거하여 평가를 실시한다.\n- 주관기관은 낙찰자를 결정하여 주관사업자를 확정하고 그 결과를 전담기관에 통보\n- 평가위원회의 결정에 따라 일부 또는 전체 제안사업자에 대해 보완자료와 현장 확인을 요청할 수 있음.\n나. 우선협상대상자 및 낙찰자 결정 방법\n- 제안서 평가결과의 기술능력평가 점수가 기술능력평가분야 배점한도의 85% 이상인 자를 협상적격자로 선정한다. \n- 협상순서는 협상적격자의 기술능력평가 점수와 입찰가격평가 점수를 합산하여 합산점수의 고득점순에 따라 결정한다. \n- 다만, 합산점수가 동일한 제안자가 2인 이상일 경우에는 기술능력 평가점수가 높은 제안자를 선순위자로 하고, 기술능력 평가점수도 동일한 경우에는 기술능력의 세부평가항목 중 배점이 큰 항목에서 높은 점수를 얻은 자를 선순위자로 한다."", ""<표>\n가. 제안서의 평가항목 및 배점한도 : 100점 만점기준"", ""2. 사업목표\n  ○ 웹 표준, 웹 접근성 및 웹 UI에 대한 기능개선으로 사용자 중심의 웹서비스를 제공한다.\n  ○ BIFF, ACFM에서 운영 중인 웹사이트에 대하여, 당해 연도의 독창적인 디자인 UI 적용, 최신 트렌트를 반영하여 브랜드 가치 제고.\n  ○ BIFF, ACFM 각종 접수 및 참가 시스템을 당해 연도 정책에 따라 개선하여 참가자와 관리자의 편의성을 제고 한다.\n  ○ 당해 연도 생산되는 콘텐츠를 운영 중인 웹사이트의 각종 페이지로 제작하고, 내부 업무관리시스템과의 데이터 연동, 서버 연계를 통해 반영되는 모든 정보를 실시간 제공한다.\n  ○ 채용시스템, 티켓시스템, 각종 스크리닝 서비스(CDN) 등을 외부 솔루션과 연계한 다양한 서비스 개발을 통해 웹사이트의 확장성을 제고 하고, 관리자와 사용자의 편의성을 도모한다.\n  ○ 다양한 디바이스에서 동일한 콘텐츠를 제공할 수 있도록 반응형 웹 페이지를 제작하여 양질의 서비스를 제공한다.\n  ○ 각종 커뮤니티 플랫폼과 SNS를 연동하여 콘텐츠의 허브 역할 도모한다.\n  ○ 출입관리시스템, 의전관리시스템, 폐쇄형 온라인 스크리닝 시스템, 실시간 채팅 시스템 등 내부 행사 지원을 위한 각종 시스템 공급을 통해 관리자의 편의성 제고 한다.\n  ○ 행사 지원시스템에 대하여, 행사 진행 공간의 유동성을 위해 요청에 따라 모바일 웹 또는 앱 형태로 제공하여 휴대성과 편의성을 제고한다.\n  ○ 영화제 임박기간 전문 인력을 파견하여, 생성되는 각종 콘텐츠와 페이지 제작 업무를 진행하며, 발생하는 다양한 변수를 신속하고 안정적으로 해결한다.\n  ○ 개발 및 제공하는 모든 사이트의 사용자 수, 이벤트 수, 페이지뷰 수 등의 접속 통계 자료를 제공한다.\n  ○ 각종 웹사이트와 시스템 기획 및 개발, 디자인 요청 등의 다양한 전산요청을 위해 상태 체크(전체, 접수, 진행, 완료) 및 파일 첨부가 가능한 온라인 헬프데스크를 공급, 운영하여 부서별 발생하는 요청사항을 빠르고 효과적으로 처리한다."", ""2. 과업의 내용\n  가. BIFF 온라인 서비스 재개발 및 유지관리 (공식 및 패밀리 사이트)\n    1) 웹 표준, 웹 접근성 UI에 대한 기능 개선으로 사용자 중심의 웹서비스 제공\n    2) 공식 웹사이트에 대하여 당해 연도 부산국제영화제에 걸맞은 최신 웹 트렌드와 독창적인 디자인 UI 적용, 전체 리뉴얼을 통해 브랜드 가치를 제고\n    3) 패밀리 웹사이트에 대하여 각 사이트별 통일성 있는 디자인과 구성을 적용한 패밀리 룩을 통해 사용자의 신뢰성을 제고\n    4) 공식 웹사이트 및 패밀리 웹사이트 각종 페이지 개편 및 제작하며, 통합업무관리시스템 데이터 연계를 통해 입력 및 변경되는 데이터를 실시간으로 제공 (서버 연동형 페이지)\n    5) 채용시스템, 티켓 시스템, 등 ASP 시스템을 공식 웹사이트에 연계하여 제공함에 사용자의 접근성과 신뢰성을 제고\n    6) 반응형 웹 페이지 제작을 통해 양질의 콘텐츠를 다양한 디바이스에서도 동일하게 제공\n    7) 각종 커뮤니티 플랫폼 및 SNS를 연동하여 콘텐츠의 허브 역할 도모\n    8) 각 사이트별 서비스 내용 분석을 통해 콘텐츠 공동 활용 및 유사한 내용 등 방문자 이용 만족도 제고를 위한 콘텐츠 정비 및 활용 방안을 정립하여 개편\n    9) Analytics 등 웹사이트 트래킹 시스템 연계하여 페이지 접속량 등 통계·분석 자료 제공\n    10) 웹 개발자 및 웹디자이너 각 1명 전문 인력 파견을 통해 영화제 임박기간 발생하는   다양한 변수를 신속하고 안정적으로 해결""]",,
A_single_pipeline,1,(사）한국대학스포츠협의회_KUSF 체육특기자 경기기록 관리시스템 개발.hwp,central,사업기간은 언제까지인가?,계약체결 후 2024년 12월 31일까지,해당 정보를 찾을 수 없습니다.,[],,
B_rule_single_route,1,(사）한국대학스포츠협의회_KUSF 체육특기자 경기기록 관리시스템 개발.hwp,central,사업기간은 언제까지인가?,계약체결 후 2024년 12월 31일까지,해당 정보를 찾을 수 없습니다.,[],,
C_rule_multi_route,1,(사）한국대학스포츠협의회_KUSF 체육특기자 경기기록 관리시스템 개발.hwp,central,사업기간은 언제까지인가?,계약체결 후 2024년 12월 31일까지,해당 정보를 찾을 수 없습니다.,[],,
A_single_pipeline,1,(재)예술경영지원센터_통합 정보시스템 구축 사전 컨설팅.hwp,central,입찰방식은 무엇인가?,제한경쟁입찰(협상에 의한 계약),해당 정보를 찾을 수 없습니다.,[],,
B_rule_single_route,1,(재)예술경영지원센터_통합 정보시스템 구축 사전 컨설팅.hwp,central,입찰방식은 무엇인가?,제한경쟁입찰(협상에 의한 계약),"- 행정기관 및 공공기관 정보시스템 구축·운영 지침 제18조에 의거, 평가비율은 기술평가 90%와 가격평가 10%로 하며, 기술평가점수와 가격평가점수를 합산하여 종합평가점수를 산출함","[""<표>\n    - 행정기관 및 공공기관 정보시스템 구축·운영 지침 제18조에 의거, 평가비율은 기술평가 90%와 가격평가 10%로 하며, 기술평가점수와 가격평가점수를 합산하여 종합평가점수를 산출함"", ""* 등급별 평점이 소수점 이하의 숫자가 있는 경우 소수점 다섯째자리에서 반올림 함\n[주]\n 1.「신용정보의 이용 및 보호에 관한 법률」제2조 제8의3에 해당하는 신용조회사  또는「자본시장과 금융투자업에 관한 법률」제335조의3에 따라 업무를 영위하는 신용평가사가 입찰공고일 이전에 평가하고 유효기간 내에 있는 회사채, 기업어음 및 기업신용평가등급을 국가종합전자조달시스템에 조회된 신용평가등급으로 평가하되, 가장 최근의 신용평가등급으로 평가한다. 다만, 가장 최근의 신용평가등급이 다수가 있으며 그 결과가 서로 다른 경우에는 가장 낮은 등급으로 평가한다.\n 2. 국가종합전자조달시스템에서 신용평가등급 확인서가 확인되지 않은 경우에는 최저등급으로 평가하며, 유효기간 시작일 또는 만료일이 입찰공고일인 경우에도 유효한 것으로 평가한다. 다만, 입찰공고일 다음날 이후에 발생 또는 수정된 자료는 평가에서 제외한다.\n 3. 주 1에도 불구하고, 합병 또는 분할한 자가 입찰공고일 이전에 평가한 신용평가등급이 없는 경우에는 입찰서 제출 마감일 전일까지 발급된 유효기간 내에 있는 가장 최근의 신용평가등급으로 평가한다. 다만, 합병 후 새로운 신용평가등급이 없는 경우에는 입찰공고일 이전에 평가하고 유효기간 내에 있는 신용평가등급으로서 합병 대상자 중 가장 낮은 신용평가등급을 받은 자의 신용평가등급으로 평가한다.\n 4. 추정가격이 고시금액 미만인 입찰에서 입찰공고일을 기준으로 최근 7년 이내에 사업을 개시한 창업기업에 대해서는 신용평가등급 점수상의 배점 한도를 부여한다. 이 경우 창업기업에 대한 확인은 「중소기업제품공공구매 종합정보망」에 등재된 자료로 확인하며, 창업기업확인서의 유효기간 내에 있어야 한다. 다만, 제안서 평가일 전일까지 발급된 자료도 심사에 포함하며, 이 경우 입찰공고일 이전 창업을 확인 할 수 있는 자료(법인인 경우 법인등기부상 법인설립등기일, 개인사업자인 경우에는 사업자등록증명서 상 사업자등록일)를 제출하여야 한다.(이하 창업기업에 대한 확인방법은 같다)\n 5. 공동수"", ""업수행기관이 사업종료시 발주자가 최초 제시한 과업지시서의 목표치와 일치하는 것을 원칙으로 한다.\n   ㅇ 용역사업 수행 기간 중 실제 업무담당자(실제업무 총괄담당자)가 교체될 경우 발주처의 승인을 얻어야 한다.\n 12) 보안사항\n   ㅇ 모든 성과품은 발주처와 계약상대자가 공동 소유하며, 임의로 복사하거나 외부로 유출하여서는 안된다.\n   ㅇ 과업 폐기물은 소각처리 하여야 한다.\n   ㅇ 기타 보안상 결함이 없도록 하여야 하며, 보안사항 불이행으로 발생하는 모든 책임은 수급인이 진다.\n  13) 과업변경 조건\n   ㅇ 발주처가 필요하다고 인정할 때\n   ㅇ 위의 사유로 과업변경 요인이 발생할 경우 또는 계약체결후 예정가격 또는 계약금액의 결정에 하자 또는 착오가 발생하였을 때에는 계약금액에서 정산 조치한다.\n  14) 과업 결과물의 보관, 권리 소유 및 저작권\n   ㅇ 과업과 관련된 결과물과 문서는 2년 이상 수급업체에 보관하여야 하며 폐기 시 센터에 확인 후 처리해야 함\n   ㅇ 성과품의 저작권 일체와 2차적 저작물 및 편집저작물의 작성권 등 일체의 소유권은 발주처와 계약상대자가 공동 소유하며, 센터는 필요시 성과품의 내용을 일부 보완, 수정할 수 있음\n   ㅇ 수급자가 개발한 모든 결과물은 국내외를 막론하고 저작권, 특허권, 의장등록권, 실용신안권, 상표권 또는 이와 유사한 타인의 권리를 침해하지 않는 창작품으로 하여야 하며, 특히 기존에 수행했던 유사 용역에서 기 고안되었던 성과물은 본 용역과정에서 배제되어야 하며, 순수한 창작품만을 대안으로 제시하여야 함\n   ㅇ 성과품과 관련 제3자와의 권리분쟁 등이 발생할 경우에는 모든 책임은 수급자가 부담하고, 그로 인한 센터의 물적, 심적 피해에 대하여 센터가 정하는 바에 따라 보상하여야 함""]",,
C_rule_multi_route,1,(재)예술경영지원센터_통합 정보시스템 구축 사전 컨설팅.hwp,central,입찰방식은 무엇인가?,제한경쟁입찰(협상에 의한 계약),"- 행정기관 및 공공기관 정보시스템 구축·운영 지침 제18조에 의거, 평가비율은 기술평가 90%와 가격평가 10%로 하며, 기술평가점수와 가격평가점수를 합산하여 종합평가점수를 산출함","[""<표>\n    - 행정기관 및 공공기관 정보시스템 구축·운영 지침 제18조에 의거, 평가비율은 기술평가 90%와 가격평가 10%로 하며, 기술평가점수와 가격평가점수를 합산하여 종합평가점수를 산출함"", ""* 등급별 평점이 소수점 이하의 숫자가 있는 경우 소수점 다섯째자리에서 반올림 함\n[주]\n 1.「신용정보의 이용 및 보호에 관한 법률」제2조 제8의3에 해당하는 신용조회사  또는「자본시장과 금융투자업에 관한 법률」제335조의3에 따라 업무를 영위하는 신용평가사가 입찰공고일 이전에 평가하고 유효기간 내에 있는 회사채, 기업어음 및 기업신용평가등급을 국가종합전자조달시스템에 조회된 신용평가등급으로 평가하되, 가장 최근의 신용평가등급으로 평가한다. 다만, 가장 최근의 신용평가등급이 다수가 있으며 그 결과가 서로 다른 경우에는 가장 낮은 등급으로 평가한다.\n 2. 국가종합전자조달시스템에서 신용평가등급 확인서가 확인되지 않은 경우에는 최저등급으로 평가하며, 유효기간 시작일 또는 만료일이 입찰공고일인 경우에도 유효한 것으로 평가한다. 다만, 입찰공고일 다음날 이후에 발생 또는 수정된 자료는 평가에서 제외한다.\n 3. 주 1에도 불구하고, 합병 또는 분할한 자가 입찰공고일 이전에 평가한 신용평가등급이 없는 경우에는 입찰서 제출 마감일 전일까지 발급된 유효기간 내에 있는 가장 최근의 신용평가등급으로 평가한다. 다만, 합병 후 새로운 신용평가등급이 없는 경우에는 입찰공고일 이전에 평가하고 유효기간 내에 있는 신용평가등급으로서 합병 대상자 중 가장 낮은 신용평가등급을 받은 자의 신용평가등급으로 평가한다.\n 4. 추정가격이 고시금액 미만인 입찰에서 입찰공고일을 기준으로 최근 7년 이내에 사업을 개시한 창업기업에 대해서는 신용평가등급 점수상의 배점 한도를 부여한다. 이 경우 창업기업에 대한 확인은 「중소기업제품공공구매 종합정보망」에 등재된 자료로 확인하며, 창업기업확인서의 유효기간 내에 있어야 한다. 다만, 제안서 평가일 전일까지 발급된 자료도 심사에 포함하며, 이 경우 입찰공고일 이전 창업을 확인 할 수 있는 자료(법인인 경우 법인등기부상 법인설립등기일, 개인사업자인 경우에는 사업자등록증명서 상 사업자등록일)를 제출하여야 한다.(이하 창업기업에 대한 확인방법은 같다)\n 5. 공동수"", ""업수행기관이 사업종료시 발주자가 최초 제시한 과업지시서의 목표치와 일치하는 것을 원칙으로 한다.\n   ㅇ 용역사업 수행 기간 중 실제 업무담당자(실제업무 총괄담당자)가 교체될 경우 발주처의 승인을 얻어야 한다.\n 12) 보안사항\n   ㅇ 모든 성과품은 발주처와 계약상대자가 공동 소유하며, 임의로 복사하거나 외부로 유출하여서는 안된다.\n   ㅇ 과업 폐기물은 소각처리 하여야 한다.\n   ㅇ 기타 보안상 결함이 없도록 하여야 하며, 보안사항 불이행으로 발생하는 모든 책임은 수급인이 진다.\n  13) 과업변경 조건\n   ㅇ 발주처가 필요하다고 인정할 때\n   ㅇ 위의 사유로 과업변경 요인이 발생할 경우 또는 계약체결후 예정가격 또는 계약금액의 결정에 하자 또는 착오가 발생하였을 때에는 계약금액에서 정산 조치한다.\n  14) 과업 결과물의 보관, 권리 소유 및 저작권\n   ㅇ 과업과 관련된 결과물과 문서는 2년 이상 수급업체에 보관하여야 하며 폐기 시 센터에 확인 후 처리해야 함\n   ㅇ 성과품의 저작권 일체와 2차적 저작물 및 편집저작물의 작성권 등 일체의 소유권은 발주처와 계약상대자가 공동 소유하며, 센터는 필요시 성과품의 내용을 일부 보완, 수정할 수 있음\n   ㅇ 수급자가 개발한 모든 결과물은 국내외를 막론하고 저작권, 특허권, 의장등록권, 실용신안권, 상표권 또는 이와 유사한 타인의 권리를 침해하지 않는 창작품으로 하여야 하며, 특히 기존에 수행했던 유사 용역에서 기 고안되었던 성과물은 본 용역과정에서 배제되어야 하며, 순수한 창작품만을 대안으로 제시하여야 함\n   ㅇ 성과품과 관련 제3자와의 권리분쟁 등이 발생할 경우에는 모든 책임은 수급자가 부담하고, 그로 인한 센터의 물적, 심적 피해에 대하여 센터가 정하는 바에 따라 보상하여야 함"", ""□ 정성적 평가분야 세부 평가 기준\n ㅇ 평가항목별 등급을 5단계 등급(매우우수ㆍ우수ㆍ보통ㆍ미흡ㆍ매우미흡) 으로 구분하여 평가하고 항목별 배점에 따라 등급점수 부여\n     * 등급별로 적용하는 점수 분포""]",,
A_single_pipeline,1,2025 구미 아시아육상경기선수권대회 조직위원회_2025 구미아시아육상경.hwp,central,사업예산(사업비)은 얼마인가?,"260,000,000원 (부가가치세 포함)",제출부수 : 1부(가격제안서 및 사업비 산출내역서),"[""2. 가격제안서 \n  가. 제출부수 : 1부(가격제안서 및 사업비 산출내역서)\n  나. 제출방법 : 밀봉 및 봉합날인\n  다. 작성방법\n    - 산출내역서는 시설별, 시스템별, 프로그램별, 운영별 등 세분하여 작성\n    - 가격제안서와 산출내역서상의 금액이 상이한 경우 가격제안서의 금액을 우선으로 적용\n< 가격제안서 봉투 작성 방법 >\n  (앞면)\n   \n<표>""]",,
B_rule_single_route,1,2025 구미 아시아육상경기선수권대회 조직위원회_2025 구미아시아육상경.hwp,central,사업예산(사업비)은 얼마인가?,"260,000,000원 (부가가치세 포함)",제출부수 : 1부(가격제안서 및 사업비 산출내역서),"[""ㅇ (협상적격자 선정(평가) 방법)\n   󰋯 제안서 내용에 대한 평가는 제출된 자료에 한해 평가하며, 제안서에 기재되지 않은 사항은 평가하지 않는다.\n   󰋯 제안서의 평가는 가격평가와 기술능력 평가로 구분하며 기술능력 평가는 정량적 지표에 의한 평가와 정성적 평가로 구분한다.\n   󰋯 S/W사업의 경우 제안서 평가결과 기술능력 평가점수가 기술능력 평가분야 배점한도의 85% 이상인 자를 협상적격자로 선정\n   󰋯 제안서 평가결과 기술능력 평가점수가 기술능력 평가분야 배점한도의 85% 이상인 자가 없는 경우에는 재공고 입찰에 부칠 수 있다.\n   󰋯 정성적 평가는 위원별 정성적 평가분야 합계점수 중에서 최고점수와 최저점수를 준 위원을 제외하고 나머지 위원의 평가점수를 합산하여 산술 평균한 점수로 한다. 최고점수 또는 최저점수가 2개 이상인 경우는 하나만 제외한다.\n   󰋯 협상순서는 합산점수의 고득점순에 의하여 결정하되 합산점수가 동일한 제안자가 2인 이상일 경우에는 기술능력 평가점수가 높은 제안자를 선순위자로 하고, 기술능력 평가점수도 동일한 경우에는 추첨으로 정한다. \n   󰋯 제안발표에 참가하지 않을 경우에는 발표 없이 제안서에 대한 서면평가로만 진행한다."", ""2. 가격제안서 \n  가. 제출부수 : 1부(가격제안서 및 사업비 산출내역서)\n  나. 제출방법 : 밀봉 및 봉합날인\n  다. 작성방법\n    - 산출내역서는 시설별, 시스템별, 프로그램별, 운영별 등 세분하여 작성\n    - 가격제안서와 산출내역서상의 금액이 상이한 경우 가격제안서의 금액을 우선으로 적용\n< 가격제안서 봉투 작성 방법 >\n  (앞면)\n   \n<표>"", ""ㅇ (가격평가 10점)\n  ① 입찰가격이 예정가격(예정가격을 작성하지 않은 경우에는 추정가격에 부가가치세를 포함한 금액으로 한다. “이하같다”)의 100분의 80 이상인 경우 평점\n     = 입찰가격평가 배점한도 × ( 최저입찰가격 / 해당입찰가격 )\n  ② 입찰가격이 예정가격의 100분의 80 미만인 경우 평점  \n     = [입찰가격평가 배점한도 × (최저입찰가격 / 예정가격의 80% 상당가격)]＋[2×(예정가격의 80% 상당가격 - 해당입찰가격)/(예정가격의 80% 상당가격-예정가격의70%)\n   ※ 1. 최저입찰가격은 유효한 입찰자중 최저입찰가격으로 하되, 입찰가격이 예정가격의 100분의 70미만일 경우에는 100분의 70으로 계산한다. 다만, SW사업과 「소방장비관리법」제2조 1호의 보호장비 및 「경찰장비관리규칙」 제68조 제2호의 안전· 보호장비 관련 계약의 경우 100분의 80미만인 경우 100분의 80으로 계산한다.\n      2. 해당입찰가격이 예정가격의 100분의 70미만(SW사업과 「소방장비관리법」제2조 1호의 보호장비 및 「경찰장비관리규칙」 제68조 제2호의 안전·보호장비 관련 계약은 100분의 80)일 경우에는 배점한도의 30%에 해당하는 평점을 부여한다.""]",,
C_rule_multi_route,1,2025 구미 아시아육상경기선수권대회 조직위원회_2025 구미아시아육상경.hwp,central,사업예산(사업비)은 얼마인가?,"260,000,000원 (부가가치세 포함)",제출부수 : 1부(가격제안서 및 사업비 산출내역서),"[""ㅇ (협상적격자 선정(평가) 방법)\n   󰋯 제안서 내용에 대한 평가는 제출된 자료에 한해 평가하며, 제안서에 기재되지 않은 사항은 평가하지 않는다.\n   󰋯 제안서의 평가는 가격평가와 기술능력 평가로 구분하며 기술능력 평가는 정량적 지표에 의한 평가와 정성적 평가로 구분한다.\n   󰋯 S/W사업의 경우 제안서 평가결과 기술능력 평가점수가 기술능력 평가분야 배점한도의 85% 이상인 자를 협상적격자로 선정\n   󰋯 제안서 평가결과 기술능력 평가점수가 기술능력 평가분야 배점한도의 85% 이상인 자가 없는 경우에는 재공고 입찰에 부칠 수 있다.\n   󰋯 정성적 평가는 위원별 정성적 평가분야 합계점수 중에서 최고점수와 최저점수를 준 위원을 제외하고 나머지 위원의 평가점수를 합산하여 산술 평균한 점수로 한다. 최고점수 또는 최저점수가 2개 이상인 경우는 하나만 제외한다.\n   󰋯 협상순서는 합산점수의 고득점순에 의하여 결정하되 합산점수가 동일한 제안자가 2인 이상일 경우에는 기술능력 평가점수가 높은 제안자를 선순위자로 하고, 기술능력 평가점수도 동일한 경우에는 추첨으로 정한다. \n   󰋯 제안발표에 참가하지 않을 경우에는 발표 없이 제안서에 대한 서면평가로만 진행한다."", ""2. 가격제안서 \n  가. 제출부수 : 1부(가격제안서 및 사업비 산출내역서)\n  나. 제출방법 : 밀봉 및 봉합날인\n  다. 작성방법\n    - 산출내역서는 시설별, 시스템별, 프로그램별, 운영별 등 세분하여 작성\n    - 가격제안서와 산출내역서상의 금액이 상이한 경우 가격제안서의 금액을 우선으로 적용\n< 가격제안서 봉투 작성 방법 >\n  (앞면)\n   \n<표>"", ""ㅇ (가격평가 10점)\n  ① 입찰가격이 예정가격(예정가격을 작성하지 않은 경우에는 추정가격에 부가가치세를 포함한 금액으로 한다. “이하같다”)의 100분의 80 이상인 경우 평점\n     = 입찰가격평가 배점한도 × ( 최저입찰가격 / 해당입찰가격 )\n  ② 입찰가격이 예정가격의 100분의 80 미만인 경우 평점  \n     = [입찰가격평가 배점한도 × (최저입찰가격 / 예정가격의 80% 상당가격)]＋[2×(예정가격의 80% 상당가격 - 해당입찰가격)/(예정가격의 80% 상당가격-예정가격의70%)\n   ※ 1. 최저입찰가격은 유효한 입찰자중 최저입찰가격으로 하되, 입찰가격이 예정가격의 100분의 70미만일 경우에는 100분의 70으로 계산한다. 다만, SW사업과 「소방장비관리법」제2조 1호의 보호장비 및 「경찰장비관리규칙」 제68조 제2호의 안전· 보호장비 관련 계약의 경우 100분의 80미만인 경우 100분의 80으로 계산한다.\n      2. 해당입찰가격이 예정가격의 100분의 70미만(SW사업과 「소방장비관리법」제2조 1호의 보호장비 및 「경찰장비관리규칙」 제68조 제2호의 안전·보호장비 관련 계약은 100분의 80)일 경우에는 배점한도의 30%에 해당하는 평점을 부여한다."", ""1. 제안사 평가항목 및 배점\n ㅇ 제출기한 내 접수된 제안서는 입찰가격평가(10점)와 기술능력평가(90점) 중 정량적 평가분야(20점)는 발주부서에서 평가하고, 기술능력평가(90점) 중 정성적 평가분야(70점)는 제안서 평가위원회를 구성하여 평가함\n ㅇ 정성적 평가는 위원별 정성적 평가분야 합계점수 중에서 최고점수와 최저 점수를 준 위원을 제외하고 나머지 위원의 평가점수를 합산하여 산술평균한 점수로 한다. 최고 점수 또는 최저점수가 2개 이상인 경우는 하나만 제외한다.\n ㅇ 발주부서는 제안서 평가에 있어 필요한 서류가 첨부되어 있지 않거나 제출된 서류가 불명확하여 인지할 수 없는 경우에는 제안서 내용의 변경이 없는 경미한 사항에 한하여 보완제출을 요구할 수 있으며, 1일 이내 보완서류가 제출되지 아니한 경우에는 당초 제출서류만으로 평가하고 당초 제출된 서류가 불명확하여 심사가 불가능한 경우에는 제외하고 평가함""]",,
A_single_pipeline,1,BioIN_의료기기산업 종합정보시스템(정보관리기관) 기능개선 사업(2차).hwp,central,이 사업의 입찰방식은 무엇인가?,제한경쟁(긴급입찰),○ 제안 사업의 수행이 가능한 업체로서 다음 요건을 모두 갖춘 사업자,"[""○ 제안 사업의 수행이 가능한 업체로서 다음 요건을 모두 갖춘 사업자"", ""- 총 배점한도는 90점이며, 사업의 유형 및 특성 등에 따라 항목별로 배점한도를 정하고 평가항목의 합인 각 평가부문별 배점한도는 30점을 초과하지 못함""]",,
B_rule_single_route,1,BioIN_의료기기산업 종합정보시스템(정보관리기관) 기능개선 사업(2차).hwp,central,이 사업의 입찰방식은 무엇인가?,제한경쟁(긴급입찰),"- 총 배점한도는 90점이며, 사업의 유형 및 특성 등에 따라 항목별로 배점한도를 정하고 평가항목의 합인 각 평가부문별 배점한도는 30점을 초과하지 못함","[""* 세부평가항목 ①~②는 중복하여 평가하며, 배점한도를 초과하여 감점하지 않는다.\n  * 모든 세부평가항목에 해당하지 않는 경우, 해당 평가항목의 배점한도를 부여한다.\n  * 공동수급체를 평가하는 경우 해당 사유가 있는 구성원의 출자비율 또는 분담비율에 해당하는 점수(소수점 다섯째 자리에서 반올림하여 산출)만큼 감점한다.\n  * 중소기업협동조합이 입찰에 참여하는 경우 해당 사유가 있는 조합원의 출자비율 또는 분담비율에 해당하는 점수(소수점 다섯째 자리에서 반올림하여 산출)만큼 감점한다.\n  * ① 임금체불 평가는 입찰공고일을 기준으로 고용노동부장관이 공개중인 체불사업주 명단의 사업장에 대하여 적용한다.\n  * ② 고용개선조치 미이행 평가는 입찰공고일을 기준으로 최근 2년 이내에 고용노동부장관이 공표한 적극적 고용개선조치 미이행 사업주 명단의 자료에 표시된 사업장을 기준으로 적용한다. 다만, 2017년 5월 1일 이후 공표된 자부터 적용한다.\n<별첨 1>"", ""* 「신용정보의 이용 및 보호에 관한 법률」제2조 제8의3에 해당하는 신용조회사  또는「자본시장과 금융투자업에 관한 법률」제335조의3에 따라 업무를 영위하는 신용평가사가 입찰공고일 이전에 평가하고 유효기간 내에 있는 회사채, 기업어음 및 기업신용평가등급을 국가종합전자조달시스템에 조회된 신용평가등급으로 평가하되, 가장 최근의 신용평가등급으로 평가한다. 다만, 가장 최근의 신용평가등급이 다수가 있으며 그 결과가 서로 다른 경우에는 가장 낮은 등급으로 평가한다.\n  * 국가종합전자조달시스템에서 신용평가등급 확인서가 확인되지 않은 경우에는 최저등급으로 평가하며, 유효기간 시작일 또는 만료일이 입찰공고일인 경우에도 유효한 것으로 평가한다. 다만, 입찰공고일 다음날 이후에 발생 또는 수정된 자료는 평가에서 제외한다.\n  * 주 1에도 불구하고, 합병 또는 분할한 자가 입찰공고일 이전에 평가한 신용평가등급이 없는 경우에는 입찰서 제출 마감일 전일까지 발급된 유효기간 내에 있는 가장 최근의 신용평가등급으로 평가한다. 다만, 합병 후 새로운 신용평가등급이 없는 경우에는 입찰공고일 이전에 평가하고 유효기간 내에 있는 신용평가등급으로서 합병 대상자 중 가장 낮은 신용평가등급을 받은 자의 신용평가등급으로 평가한다.\n  * 추정가격이 고시금액 미만인 입찰에서 입찰공고일을 기준으로 최근 7년 이내에 사업을 개시한 창업기업에 대해서는 신용평가등급 점수상의 배점 한도를 부여한다. 이 경우 창업기업에 대한 확인은 「중소기업제품공공구매 종합정보망」에 등재된 자료로 확인하며, 창업기업확인서의 유효기간 내에 있어야 한다. 다만, 제안서 평가일 전일까지 발급된 자료도 심사에 포함하며, 이 경우 입찰공고일 이전 창업을 확인 할 수 있는 자료(법인인 경우 법인등기부상 법인설립등기일, 개인사업자인 경우에는 사업자등록증명서 상 사업자등록일)를 제출하여야 한다.(이하 창업기업에 대한 확인방법은 같다)\n  * 공동수급체의 경우 구성원별 해당 점수에 지분율을 곱한 후 그 점수들을 합산하여 최종 평가하고, 평"", ""- 총 배점한도는 90점이며, 사업의 유형 및 특성 등에 따라 항목별로 배점한도를 정하고 평가항목의 합인 각 평가부문별 배점한도는 30점을 초과하지 못함""]",,
C_rule_multi_route,1,BioIN_의료기기산업 종합정보시스템(정보관리기관) 기능개선 사업(2차).hwp,central,이 사업의 입찰방식은 무엇인가?,제한경쟁(긴급입찰),"- 총 배점한도는 90점이며, 사업의 유형 및 특성 등에 따라 항목별로 배점한도를 정하고 평가항목의 합인 각 평가부문별 배점한도는 30점을 초과하지 못함","[""* 세부평가항목 ①~②는 중복하여 평가하며, 배점한도를 초과하여 감점하지 않는다.\n  * 모든 세부평가항목에 해당하지 않는 경우, 해당 평가항목의 배점한도를 부여한다.\n  * 공동수급체를 평가하는 경우 해당 사유가 있는 구성원의 출자비율 또는 분담비율에 해당하는 점수(소수점 다섯째 자리에서 반올림하여 산출)만큼 감점한다.\n  * 중소기업협동조합이 입찰에 참여하는 경우 해당 사유가 있는 조합원의 출자비율 또는 분담비율에 해당하는 점수(소수점 다섯째 자리에서 반올림하여 산출)만큼 감점한다.\n  * ① 임금체불 평가는 입찰공고일을 기준으로 고용노동부장관이 공개중인 체불사업주 명단의 사업장에 대하여 적용한다.\n  * ② 고용개선조치 미이행 평가는 입찰공고일을 기준으로 최근 2년 이내에 고용노동부장관이 공표한 적극적 고용개선조치 미이행 사업주 명단의 자료에 표시된 사업장을 기준으로 적용한다. 다만, 2017년 5월 1일 이후 공표된 자부터 적용한다.\n<별첨 1>"", ""* 「신용정보의 이용 및 보호에 관한 법률」제2조 제8의3에 해당하는 신용조회사  또는「자본시장과 금융투자업에 관한 법률」제335조의3에 따라 업무를 영위하는 신용평가사가 입찰공고일 이전에 평가하고 유효기간 내에 있는 회사채, 기업어음 및 기업신용평가등급을 국가종합전자조달시스템에 조회된 신용평가등급으로 평가하되, 가장 최근의 신용평가등급으로 평가한다. 다만, 가장 최근의 신용평가등급이 다수가 있으며 그 결과가 서로 다른 경우에는 가장 낮은 등급으로 평가한다.\n  * 국가종합전자조달시스템에서 신용평가등급 확인서가 확인되지 않은 경우에는 최저등급으로 평가하며, 유효기간 시작일 또는 만료일이 입찰공고일인 경우에도 유효한 것으로 평가한다. 다만, 입찰공고일 다음날 이후에 발생 또는 수정된 자료는 평가에서 제외한다.\n  * 주 1에도 불구하고, 합병 또는 분할한 자가 입찰공고일 이전에 평가한 신용평가등급이 없는 경우에는 입찰서 제출 마감일 전일까지 발급된 유효기간 내에 있는 가장 최근의 신용평가등급으로 평가한다. 다만, 합병 후 새로운 신용평가등급이 없는 경우에는 입찰공고일 이전에 평가하고 유효기간 내에 있는 신용평가등급으로서 합병 대상자 중 가장 낮은 신용평가등급을 받은 자의 신용평가등급으로 평가한다.\n  * 추정가격이 고시금액 미만인 입찰에서 입찰공고일을 기준으로 최근 7년 이내에 사업을 개시한 창업기업에 대해서는 신용평가등급 점수상의 배점 한도를 부여한다. 이 경우 창업기업에 대한 확인은 「중소기업제품공공구매 종합정보망」에 등재된 자료로 확인하며, 창업기업확인서의 유효기간 내에 있어야 한다. 다만, 제안서 평가일 전일까지 발급된 자료도 심사에 포함하며, 이 경우 입찰공고일 이전 창업을 확인 할 수 있는 자료(법인인 경우 법인등기부상 법인설립등기일, 개인사업자인 경우에는 사업자등록증명서 상 사업자등록일)를 제출하여야 한다.(이하 창업기업에 대한 확인방법은 같다)\n  * 공동수급체의 경우 구성원별 해당 점수에 지분율을 곱한 후 그 점수들을 합산하여 최종 평가하고, 평"", ""- 총 배점한도는 90점이며, 사업의 유형 및 특성 등에 따라 항목별로 배점한도를 정하고 평가항목의 합인 각 평가부문별 배점한도는 30점을 초과하지 못함"", ""○ 평가방식 : 각 평가위원의 평가점수 중 최고점수 1개, 최저점수 1개를 제외한 나머지 점수를 합산 후 평균을(소수점 다섯째 자리 반올림) 내어 획득점수를 산출하며, 배점 한도의 85% 미만은 협상대상에서 제외""]",,
A_single_pipeline,1,KOICA 전자조달_[긴급] [지문] [국제] 우즈베키스탄 열린 의정활동 상하원 .hwp,extreme,이 용역의 사업기간(계약체결일부터 종료일)은 언제까지인가?,계약체결일로부터 2027년 9월 30일까지,ㅇ 협력단 : 본 용역의 발주기관인 한국국제협력단(KOICA)의 약어,"[""ㅇ 발주기관 : 해당 발주예정 사업을 추진하는 공공기관\nㅇ 협력단 : 본 용역의 발주기관인 한국국제협력단(KOICA)의 약어\nㅇ 제안요청서(RfP, Request for Proposal) : 제안서의 제출을 요청하기 위하여 작성하는 서식 \nㅇ 사업관리기관(Project Management Consultant) : 사업수행기관의 사업산출물이 사업의 목적과 범위에 부합하게 생산 및 전달되는 지 관리, 협력단을 대신하여 사업 전반의 일정, 예산, 품질, 범위, 성과 및 위험 관리 진행(사업의 특성에 따라 사업수행기관을 사업관리기관과 통합하여 운영 가능)\nㅇ 사업수행기관(Project Contractor) : 사업산출물의 생산 및 전달 역할 수행, 사업 구성요소에 따라 기술용역, 물품공급용역, 정보시스템개발용역, 건설관리용역, 시공용역, 감리용역 등으로 명명\nㅇ PM(Project Manager) : 동 용역을 총괄 책임을 맡는 사업관리자 \nㅇ PAO(Project Action Officer) : 협력단 프로젝트 및 개발컨설팅사업 수행을 위해 계약체결업체 소속으로 투입되는 4~6급 실무전문가 중 PAO 제도에서 규정하는 조건에 부합하는 자\nㅇ PDM(Project Design Matrix) : 프로젝트 계획의 개념적 구성을 한 장의 표로 정리한 사업논리모형\nㅇ R/D(Record of Discussion) : 협력대상국가의 사업시행기관 또는 주무부처와 해당사업에 대하여 체결하는 합의 문서\nㅇ 타당성조사(F/S, Feasibility Study) : 개발도상국에 대해서 실시하는 개발조사사업으로써 사전실행여부조사와 실행여부조사를 포괄하는 개념\nㅇ PSC(Project Steering Committee) : 동 프로젝트 사업의 성과를 제고하기 위한 현지 자문위원회\nㅇ 분리발주 : 상용 소프트웨어 등을 일괄하여 계약하지 않고 각각 구분하여 발주 및 계약하는 형태\nㅇ 소프트웨어 공급자 : 분리발주된 소프트웨어를 공급 및 납품하는 업체 \nㅇ PMO(Project Manageme"", ""ㅇ 성과관리\n    - 동 과업은 KOICA 성과관리 가이드라인에 따라 사업의 성과 및 품질을 모니터링하고 목표달성도를 측정하는 것임.\n    - (PDM 검토 및 보완) 착수조사 이후 기존 PDM(논리구조, 지표, 지표입증수단, 주요 가정)에 대한 수정·보완 의견 제시 및 KOICA와 상호협의 수행\n    - (기초선 조사(Baseline Survey)) KOICA의 기초선조사 가이드라인에 따라, 제시된 PDM을 기준으로 기초선 조사를 수행함.\n    - (시기별 모니터링) 사업기간 중 성과점검양식을 활용하여 성과 관리를 위한 정기적인 모니터링을 수행하고, 반기/연차 보고서를 제출함.\n    - (관리문서 제출 및 결과보고) 아래 표를 참고하여 필수 관리문서, 선택 관리문서를 작성하고 대면보고 및 보고회 등을 통한 성과 결과 공유\n      \n<표>\n  \n \n다. 사업수행체계 및 상세 요구사항""]",,
B_rule_single_route,1,KOICA 전자조달_[긴급] [지문] [국제] 우즈베키스탄 열린 의정활동 상하원 .hwp,extreme,이 용역의 사업기간(계약체결일부터 종료일)은 언제까지인가?,계약체결일로부터 2027년 9월 30일까지,한국국제협력단,"[""한국국제협력단\n<그림>"", ""<그림>"", ""<그림>""]",,
C_rule_multi_route,1,KOICA 전자조달_[긴급] [지문] [국제] 우즈베키스탄 열린 의정활동 상하원 .hwp,extreme,이 용역의 사업기간(계약체결일부터 종료일)은 언제까지인가?,계약체결일로부터 2027년 9월 30일까지,한국국제협력단,"[""한국국제협력단\n<그림>"", ""<그림>"", ""<그림>""]",,
A_single_pipeline,1,경기도 안양시_호계체육관 배드민턴장 및 탁구장 예약시스템 구축 용역.hwp,central,사업기간은 어떻게 되나요?,계약 후 120일,해당 정보를 찾을 수 없습니다.,[],,
B_rule_single_route,1,경기도 안양시_호계체육관 배드민턴장 및 탁구장 예약시스템 구축 용역.hwp,central,사업기간은 어떻게 되나요?,계약 후 120일,입찰 및 낙찰방식,"[""4. 추진방안\n  가. 입찰 및 낙찰방식\n    1) 사업자 선정방식 : 제한경쟁 입찰 후 협상에 의한 계약\n      ­「지방자치단체를 당사자로 하는 계약에 관한 법률 시행령」제43조\n      ­「지방자치단체 입찰시 낙찰자 결정기준」(행정안전부 예규) “협상에 의한 계약체결기준”\n    2) 기술평가(90%)와 가격평가(10%)를 실시하여 종합평가점수(100점)로 평가\n  나. 협상\n    1) 협상은 제안서 기술평가(90%)와 가격평가(10%)를 종합평가한 결과 고득점자순으로 \n       합니다. 다만, 제안서 평가결과 기술능력평가 점수가 기술능력평가분야 배점한도\n       의 85% 이상인 자를 협상적격자로 선정"", ""3. 과업 수행 제반사항\n  󰏅 과업수행 방법\n   - 과업 추진 시 표준화, 확장성 및 재사용성을 충분히 고려하여 유지보수 및 하자보수가 용이한 형태로 구현하여야 한다.\n   - 과업진행 중 관련법령 및 제도 및 관련기술이 변경되었을 경우 기존 과업범위에 포함하여 추진한다.\n   - 소프트웨어를 개발 시 전자정부표준개발프레임워크의 적용을 우선적으로 고려하여야 한다.\n  󰏅 과업수행 관련서류 제출\n   - 사업자는 과업수행 과정에서 발생하는 각종 성과품(계획서·보고서 등)을 발주자에게 제출하여야 한다.\n   - 성과품 제작에 소요되는 모든 경비는 사업자 부담으로 한다.\n  󰏅 개발SW의 공동활용 사전 명시\n   - 본 사업을 통해 개발되는 소프트웨어는 물품구매계약일반조건 제29조의2(계약목적물의 지식재산권 귀속 등)에 따라 타 기관과 공동 활용할 계획이 없다.\n  󰏅 과업내용 변경\n    - 본 사업은 「소프트웨어 진흥법」 제50조, 같은 법 시행령 제47조 제1항 제2호, 제3호에 따른 과업내용 변경 및 그에 따른 계약금액·계약기간 조정이 필요한 경우, 계약상대자는 국가기관 등의 장에게 소프트웨어사업 과업변경요청서를 제출하여 과업심의위원회의 개최를 요청할 수 있다.\n  󰏅 작업장소 상호협의\n   - 사업자는 SW사업 수행을 위해 필요한 작업장소 등(장소, 설비, 기타 작업환경)을 상호협의하여 결정하며, 핵심 개발인력이 아닌 지원인력의 근무장소는 보안 등 특별한 사유가 있는 경우를 제외하고는 사업자가 달리 정할 수 있다.\n  󰏅 원격개발 장소 제시·검토\n     사업자는 작업장소 상호협의 시 제안요청서 내 명시된 보안요구사항을 준수한 작업장소를 제시할 수 있으며, 발주자는 제시된 작업장소에 관하여 우선 검토한다. 다만, 발주자는 사업자가 제시한 작업장소가 보안요구사항을 준수하지 못한 경우 거부할 수 있으며, 사업자가 유효한 정보보호체계 인증 또는 소프트웨어프로세스 품질인증을 보유하고 있는 경우 사업자 제시안을 검토 시 우대 할 수 있다.\n  󰏅 원격지에서의 온"", ""<표>\n  \n 나. 우선협상대상자 선정 및 계약체결\n    - 협상대상자 중 기술평가점수와 가격평가점수를 합한 점수가 1위인 제안사를 우선협상대상자로 선정하여 기타 지원조건 등을 협상\n    - 우선 협상자와의 협상이 결렬되면 동일한 기준과 절차에 따라 차순위 협상 대상자와 협상을 실시하고, 이 경우에도 협상이 결렬되면 순차적으로 차 순위 협상대상자와의 협상을 실시\n    - 협상대상자가 제안한 사업내용, 이행방법, 이행일정, 제안가격 등 제안서의 내용을 대상으로 협상을 실시\n    - 협상대상자와 협상을 통해 제안서 내용의 일부를 조정할 수 있음\n    - 가격협상에서는 당해 사업예산 이하로서 협상대상자가 제안한 가격을 기준으로 함\n    - 기타 규정되지 않은 사항은 조달청 규정에 의함\n 다. 제안업체 준수사항\n    1) 제안업체는 본 사업과 관련하여 취득한 업무내용에 대하여 제3자에게 누설할 수 없음.\n    2) 제안업체는 발주기관에서 요구하는 보안사항을 철저히 준수하여야 함.\n    3) 제안요청서 및 관련 자료는 제안서 작성 이외의 목적으로 사용할 수 없음.""]",,
C_rule_multi_route,1,경기도 안양시_호계체육관 배드민턴장 및 탁구장 예약시스템 구축 용역.hwp,central,사업기간은 어떻게 되나요?,계약 후 120일,입찰 및 낙찰방식,"[""4. 추진방안\n  가. 입찰 및 낙찰방식\n    1) 사업자 선정방식 : 제한경쟁 입찰 후 협상에 의한 계약\n      ­「지방자치단체를 당사자로 하는 계약에 관한 법률 시행령」제43조\n      ­「지방자치단체 입찰시 낙찰자 결정기준」(행정안전부 예규) “협상에 의한 계약체결기준”\n    2) 기술평가(90%)와 가격평가(10%)를 실시하여 종합평가점수(100점)로 평가\n  나. 협상\n    1) 협상은 제안서 기술평가(90%)와 가격평가(10%)를 종합평가한 결과 고득점자순으로 \n       합니다. 다만, 제안서 평가결과 기술능력평가 점수가 기술능력평가분야 배점한도\n       의 85% 이상인 자를 협상적격자로 선정"", ""3. 과업 수행 제반사항\n  󰏅 과업수행 방법\n   - 과업 추진 시 표준화, 확장성 및 재사용성을 충분히 고려하여 유지보수 및 하자보수가 용이한 형태로 구현하여야 한다.\n   - 과업진행 중 관련법령 및 제도 및 관련기술이 변경되었을 경우 기존 과업범위에 포함하여 추진한다.\n   - 소프트웨어를 개발 시 전자정부표준개발프레임워크의 적용을 우선적으로 고려하여야 한다.\n  󰏅 과업수행 관련서류 제출\n   - 사업자는 과업수행 과정에서 발생하는 각종 성과품(계획서·보고서 등)을 발주자에게 제출하여야 한다.\n   - 성과품 제작에 소요되는 모든 경비는 사업자 부담으로 한다.\n  󰏅 개발SW의 공동활용 사전 명시\n   - 본 사업을 통해 개발되는 소프트웨어는 물품구매계약일반조건 제29조의2(계약목적물의 지식재산권 귀속 등)에 따라 타 기관과 공동 활용할 계획이 없다.\n  󰏅 과업내용 변경\n    - 본 사업은 「소프트웨어 진흥법」 제50조, 같은 법 시행령 제47조 제1항 제2호, 제3호에 따른 과업내용 변경 및 그에 따른 계약금액·계약기간 조정이 필요한 경우, 계약상대자는 국가기관 등의 장에게 소프트웨어사업 과업변경요청서를 제출하여 과업심의위원회의 개최를 요청할 수 있다.\n  󰏅 작업장소 상호협의\n   - 사업자는 SW사업 수행을 위해 필요한 작업장소 등(장소, 설비, 기타 작업환경)을 상호협의하여 결정하며, 핵심 개발인력이 아닌 지원인력의 근무장소는 보안 등 특별한 사유가 있는 경우를 제외하고는 사업자가 달리 정할 수 있다.\n  󰏅 원격개발 장소 제시·검토\n     사업자는 작업장소 상호협의 시 제안요청서 내 명시된 보안요구사항을 준수한 작업장소를 제시할 수 있으며, 발주자는 제시된 작업장소에 관하여 우선 검토한다. 다만, 발주자는 사업자가 제시한 작업장소가 보안요구사항을 준수하지 못한 경우 거부할 수 있으며, 사업자가 유효한 정보보호체계 인증 또는 소프트웨어프로세스 품질인증을 보유하고 있는 경우 사업자 제시안을 검토 시 우대 할 수 있다.\n  󰏅 원격지에서의 온"", ""<표>\n  \n 나. 우선협상대상자 선정 및 계약체결\n    - 협상대상자 중 기술평가점수와 가격평가점수를 합한 점수가 1위인 제안사를 우선협상대상자로 선정하여 기타 지원조건 등을 협상\n    - 우선 협상자와의 협상이 결렬되면 동일한 기준과 절차에 따라 차순위 협상 대상자와 협상을 실시하고, 이 경우에도 협상이 결렬되면 순차적으로 차 순위 협상대상자와의 협상을 실시\n    - 협상대상자가 제안한 사업내용, 이행방법, 이행일정, 제안가격 등 제안서의 내용을 대상으로 협상을 실시\n    - 협상대상자와 협상을 통해 제안서 내용의 일부를 조정할 수 있음\n    - 가격협상에서는 당해 사업예산 이하로서 협상대상자가 제안한 가격을 기준으로 함\n    - 기타 규정되지 않은 사항은 조달청 규정에 의함\n 다. 제안업체 준수사항\n    1) 제안업체는 본 사업과 관련하여 취득한 업무내용에 대하여 제3자에게 누설할 수 없음.\n    2) 제안업체는 발주기관에서 요구하는 보안사항을 철저히 준수하여야 함.\n    3) 제안요청서 및 관련 자료는 제안서 작성 이외의 목적으로 사용할 수 없음."", ""1. 제안서 제출\n  ○ 제출기간 : 입찰공고서 참조 \n  ○ 제출장소 : 안양시 체육과\n  ○ 제출수량 : 제본하여 10부 제출(업체명은 원본 1부만 표기함, 본드·링·바인더 등 방식 \n                 무관함), 제안서 수록 USB 1개\n  ○ 제출방법 : 참가자격을 갖춘 업체의 대표 또는 위임장을 소지한 대리인 직접 방문 제출           (우편, 팩스, e-mail 등 기타접수 불가) \n2. 제안서의 효력\n  - 제출된 제안서의 내용은 변경할 수 없으며 추후 사업수행자 선정 시 계약 조건의 일부로 간주한다.\n  - 제안서에 제시된 내용과 발주기관 요구에 의하여 수정, 보완, 변경된 제안내용은 계약서에 명시하지 아니하더라도 계약서와 동일한 효력을 갖습니다. 다만, 계약서에 명시된 경우는 계약서가 우선한다.\n  - 계약서 및 부속서류(제안서, 협상결과 등)에 명시되지 않았거나 불분명한 사항은 수요기관과 계약상대자 간 협의를 통하여 결정 한다\n  - 발주기관는 필요시 제안사에 대하여 자료를 요구할 수 있으며, 이에 따라 제출된 자료는 제안서와 동일한 효력을 갖는다.\n3. 제안서의 작성방법(권장사항) 및 유의사항\n  가. 작성방법\n    - 제안서는 제안요청서에서 요구하는 모든 사항이 기술되어야 하며, 향상된 내용으로 제안할 수 있음\n    - 제안서의 내용을 객관적으로 입증할 수 있는 관련 자료는 제안서의 별첨으로 제출하여야 함\n    - 제안서는 정량제안서, 정성제안서, 요약본을 각 1부 작성하여 제출한다.\n    - 제안서 규격\n    ▸제안서는 A4 세로방향으로 하며, 부득이한 경우 A4 가로방향 또는 기타용지를 일부 사용할 수 있음\n    ▸제안서는 200쪽 내외로 작성 권고\n    ▸ 제안서의 각 페이지는 하단 중앙에 일련번호를 부여하여야 함\n    - 제안서는 제시된 제안서 목차 및 제안서 세부작성지침을 준용하여 각각 세분하여  누락 없이 작성하고, 제안요청서의 요구항목들이 제안서의 어느 부분에 기술되었는지 참조표를 제시하여야 함""]",,
A_single_pipeline,1,경기도사회서비스원_2024년 통합사회정보시스템 운영지원.hwp,central,이 사업의 입찰방식(계약방법)은 무엇인가?,제한경쟁입찰(협상에 의한 계약),❍ 계약방법 : 제한경쟁입찰(협상에 의한 계약),"[""사업개요\n ❍ 사 업 명 : 2024년 통합사회정보시스템 운영 지원\n ❍ 사업기간 : 계약일로부터 ′24. 12. 31.까지\n ❍ 사업예산 : 금133,812,000원(금일억삼천삼백팔십일만이천원) / 부가세 포함\n ❍ 계약방법 : 제한경쟁입찰(협상에 의한 계약)\n   - 제안사 평가 시 기술능력 90%와 가격평가 10% 점수 합산하여 협상 적격자 선정\n      ※ 계약 관련법령 : 「지방자치단체를 당사자로 하는 계약에 관한 법률 시행령」 제20조, 제43조, 제44조, 「지방자치단체 입찰시 낙찰자 결정기준(행정안전부예규)」\n      ※ 기술능력 평가기준 : 「소프트웨어 기술성 평가기준(과학기술정보통신부고시)」, 「행정기관 및 공공기관 정보시스템 구축‧운영 지침(행정안전부고시)」"", ""1. 계약방법\n 가. 계약방법: 제한경쟁입찰\n 나. 낙찰자결정방법: 협상에 의한 계약\n 다. 계약종류: 단년도계약""]",,
B_rule_single_route,1,경기도사회서비스원_2024년 통합사회정보시스템 운영지원.hwp,central,이 사업의 입찰방식(계약방법)은 무엇인가?,제한경쟁입찰(협상에 의한 계약),❍ 계약방법 : 제한경쟁입찰(협상에 의한 계약),"[""사업개요\n ❍ 사 업 명 : 2024년 통합사회정보시스템 운영 지원\n ❍ 사업기간 : 계약일로부터 ′24. 12. 31.까지\n ❍ 사업예산 : 금133,812,000원(금일억삼천삼백팔십일만이천원) / 부가세 포함\n ❍ 계약방법 : 제한경쟁입찰(협상에 의한 계약)\n   - 제안사 평가 시 기술능력 90%와 가격평가 10% 점수 합산하여 협상 적격자 선정\n      ※ 계약 관련법령 : 「지방자치단체를 당사자로 하는 계약에 관한 법률 시행령」 제20조, 제43조, 제44조, 「지방자치단체 입찰시 낙찰자 결정기준(행정안전부예규)」\n      ※ 기술능력 평가기준 : 「소프트웨어 기술성 평가기준(과학기술정보통신부고시)」, 「행정기관 및 공공기관 정보시스템 구축‧운영 지침(행정안전부고시)」"", ""3) 본 사업참여인력(6점)  \n   기술인력(투입인력) 상태 : 사업관리자(PM) 점수 + 투입인력 점수\n   본 사업을 추진하는 인력의 업무수행 능력 적정성을 평가한다.\n    [사업관리자(PM) 점수(3점)]\n    ‣ 사업관리자(PM)의 관련분야 경력 기간에 따라 평가한다.      \n<표>"", ""나. 협상적격자 및 협상대상자 지정\n     - 종합평가점수 : 기술능력평가(90점) + 입찰가격평가(10점)\n     - 제안서 평가만으로 85% 이상인 업체를 협상적격자로 선정하며, 협상적격자를 대상으로 입찰가격 평가를 실시하여 제안서 평가 점수와 입찰가격 평가 점수를 합한 종합평가 점수를 획득한 업체를 협상대상자로 함\n     - 종합평가점수가 최고점수인 협상대상자부터 협상순위에 따라 협상을 실시\n     - 합산점수가 동일한 제안자가 2인 이상일 경우에는 기술능력 평가점수가 높은 제안자를 선순위자로 한다.\n     - 협상대상자 중 종합평점이 가장 높은 자를 우선협상 대상자로 지정하여 기술 및 가격을 협상하고 협상 결렬 시 차 순위와 협상한다.\n 3. 협상절차\n 가. 협상절차 및 방법\n   - 협상은 발주기관이 정하는 절차와 일정에 따라 진행된다.\n   - 협상순위에 따라 협상대상자와 협상을 실시하며, 협상기간 내에 협상대상자와 협상이 성립된 경우 최종낙찰자로 선정하고 다른 협상적격자와 협상을 실시하지 아니한다.\n   - 협상 중 발주기관이 어떠한 자료를 요구하더라도, 협상대상자는 발주기관이 요구한 자료를 제출할 수 있도록 준비되어 있어야 한다. \n   - 협상대상자가 협상에 불성실하게 임하거나 협상을 고의로 지연 시키는 등 문제가 있다고 판단될 경우 발주기관은 협상이 결렬된 것으로 간주한다.\n   - 협상이 성립되지 않을시 차 순위 협상적격자와 협상 실시한다.\n 나. 협상내용과 범위\n   - 협상대상자가 제안한 사업추진 계획 및 이행방법, 이행일정, 입찰가격 등 제안서 내용을 대상으로 협상을 실시하며, 기타 사항은 상호협의에 의하여 결정한다.\n   - 가격협상 기준 가격은 발주기관 예정가격 이하로서 협상대상자가 제안한 가격으로 하되, 기술협상에서 제안내용의 가감조정이 있는 경우 제안가격을 가감 조정할 수 있다.""]",,
C_rule_multi_route,1,경기도사회서비스원_2024년 통합사회정보시스템 운영지원.hwp,central,이 사업의 입찰방식(계약방법)은 무엇인가?,제한경쟁입찰(협상에 의한 계약),❍ 계약방법 : 제한경쟁입찰(협상에 의한 계약),"[""사업개요\n ❍ 사 업 명 : 2024년 통합사회정보시스템 운영 지원\n ❍ 사업기간 : 계약일로부터 ′24. 12. 31.까지\n ❍ 사업예산 : 금133,812,000원(금일억삼천삼백팔십일만이천원) / 부가세 포함\n ❍ 계약방법 : 제한경쟁입찰(협상에 의한 계약)\n   - 제안사 평가 시 기술능력 90%와 가격평가 10% 점수 합산하여 협상 적격자 선정\n      ※ 계약 관련법령 : 「지방자치단체를 당사자로 하는 계약에 관한 법률 시행령」 제20조, 제43조, 제44조, 「지방자치단체 입찰시 낙찰자 결정기준(행정안전부예규)」\n      ※ 기술능력 평가기준 : 「소프트웨어 기술성 평가기준(과학기술정보통신부고시)」, 「행정기관 및 공공기관 정보시스템 구축‧운영 지침(행정안전부고시)」"", ""3) 본 사업참여인력(6점)  \n   기술인력(투입인력) 상태 : 사업관리자(PM) 점수 + 투입인력 점수\n   본 사업을 추진하는 인력의 업무수행 능력 적정성을 평가한다.\n    [사업관리자(PM) 점수(3점)]\n    ‣ 사업관리자(PM)의 관련분야 경력 기간에 따라 평가한다.      \n<표>"", ""나. 협상적격자 및 협상대상자 지정\n     - 종합평가점수 : 기술능력평가(90점) + 입찰가격평가(10점)\n     - 제안서 평가만으로 85% 이상인 업체를 협상적격자로 선정하며, 협상적격자를 대상으로 입찰가격 평가를 실시하여 제안서 평가 점수와 입찰가격 평가 점수를 합한 종합평가 점수를 획득한 업체를 협상대상자로 함\n     - 종합평가점수가 최고점수인 협상대상자부터 협상순위에 따라 협상을 실시\n     - 합산점수가 동일한 제안자가 2인 이상일 경우에는 기술능력 평가점수가 높은 제안자를 선순위자로 한다.\n     - 협상대상자 중 종합평점이 가장 높은 자를 우선협상 대상자로 지정하여 기술 및 가격을 협상하고 협상 결렬 시 차 순위와 협상한다.\n 3. 협상절차\n 가. 협상절차 및 방법\n   - 협상은 발주기관이 정하는 절차와 일정에 따라 진행된다.\n   - 협상순위에 따라 협상대상자와 협상을 실시하며, 협상기간 내에 협상대상자와 협상이 성립된 경우 최종낙찰자로 선정하고 다른 협상적격자와 협상을 실시하지 아니한다.\n   - 협상 중 발주기관이 어떠한 자료를 요구하더라도, 협상대상자는 발주기관이 요구한 자료를 제출할 수 있도록 준비되어 있어야 한다. \n   - 협상대상자가 협상에 불성실하게 임하거나 협상을 고의로 지연 시키는 등 문제가 있다고 판단될 경우 발주기관은 협상이 결렬된 것으로 간주한다.\n   - 협상이 성립되지 않을시 차 순위 협상적격자와 협상 실시한다.\n 나. 협상내용과 범위\n   - 협상대상자가 제안한 사업추진 계획 및 이행방법, 이행일정, 입찰가격 등 제안서 내용을 대상으로 협상을 실시하며, 기타 사항은 상호협의에 의하여 결정한다.\n   - 가격협상 기준 가격은 발주기관 예정가격 이하로서 협상대상자가 제안한 가격으로 하되, 기술협상에서 제안내용의 가감조정이 있는 경우 제안가격을 가감 조정할 수 있다."", ""3. 입찰참가자격\n 가. 중소기업자(중기업, 소기업, 소상공인)\n   -「소프트웨어 진흥법」제48조(중소 소프트웨어사업자의 사업 참여 지원) 제2항 및「중소 소프트웨어사업자의 사업 참여 지원에 관한 지침」제2조[별표1] 및 제3조의 규정에 따라 대기업의 참여 제한\n     ※ 연차별 예산 20억 미만인 사업으로 중소 소프트웨어사업자만 입찰 참가 가능\n 나.「소프트웨어 진흥법」제48조 제4항에 의거「독점규제 및 공정거래에 관한 법률」제31조의 상호출자제한기업집단에 해당하는 경우 본 사업에 참여 불가\n 다. 직접생산확인증명서 소지업체\n   -「판로지원법」제8조 및 동법 시행령 제9조에 의한 요건을 갖춘 중소기업자로서 동법 제9조 및 동법 시행령 제10조에 의한 다음의 직접생산확인증명서를 모두 소지한 업체\n     * 세부품명 : 정보시스템유지관리서비스, 세부품명번호 : 8111189901\n     * 세부품명 : 소프트웨어유지및지원서비스, 세부품명번호 : 8111229901\n 라. 입찰참가등록일 현재「국가를 당사자로 하는 계약에 관한 법률」시행령 제12조 및 동법 시행규칙 제14조 규정에 따라 자격을 갖춘업체\n 마. 입찰참가등록일 현재「국가를 당사자로 하는 계약에 관한 법률」시행령 제76조(부정당업자의 입찰참가자격 제한)의 규정에 의한 부정당업자로 입찰참가를 제한받는 자는 제외\n 바. ｢소프트웨어 진흥법｣ 제24조에 의한 소프트웨어사업자(컴퓨터관련서비스사업)로 등록되어 있는 업체\n 사. 국가종합전자조달시스템 입찰참가자격등록규정에 의하여 반드시 나라장터(G2B) 입찰마감일 전일까지 소프트웨어사업자(컴퓨터관련서비스사업, 업종코드 1468)로 입찰참가자격 등록한 업체\n 아. 하도급 불허\n 자. 공동 수급 불허""]",,
A_single_pipeline,1,경기도평택시_2024년도 평택시 버스정보시스템(BIS) 구축사업.hwp,central,이 사업의 명칭(사업명)은 무엇인가?,2024년도 평택시 버스정보시스템(BIS) 구축사업 용역,1.2 사업의 배경 및 목적,"[""1.2 사업의 배경 및 목적\n○ 본 사업은 평택시 전역을 대상으로 버스정류장 안내단말기를 확충하고, 운행하는 모든 버스의 정보를 시․공간의 제약 없이 버스이용자에게 제공함으로써 대중교통 서비스의 질을 향상시키며, 향후 인접 교통권역을 포함한 광역 버스정보시스템 구축사업의 호환성과 상호 운영성을 확보하는 실현방안 제시를 목적으로 한다."", ""1.5 소요예산 및 사업내용\n가. 소요예산 :  ￦999,494,600원(부가세 포함)\n나. 사업내용\n   사업내용(BIT 설치물량)은 현장 및 교통현황조사 후 변동될 수 있으며, 변동은 해당분야의 예산범위 내에서만 가능하며, 본 사업의 사업내용은 다음과 같다.\n○ 버스정보 안내단말기(BIT) 55개소 55대\n— LCD 32인치 : 06대\n— LED 단면형 3단 12열 : 40대\n— LED 단면형 4단 12열 : 05대\n— LED 양면형 4단 12열 : 04대""]",,
B_rule_single_route,1,경기도평택시_2024년도 평택시 버스정보시스템(BIS) 구축사업.hwp,central,이 사업의 명칭(사업명)은 무엇인가?,2024년도 평택시 버스정보시스템(BIS) 구축사업 용역,"제2조 (공동수급체) 공동수급체의 명칭, 사업소의 소재지, 대표자는 다음과 같다","[""나. 입찰참가자격\n1) 지방자치단체를 당사자로 하는 계약에 관한 법률 시행령 제13조 및 동법시행규칙 제14조 규정에 의한 자격을 구비한 업체\n2) 소프트웨어진흥법 제24조 및 제58조 규정한 소프트웨어사업자(컴퓨터관련 서비스업 분야)로 신고한 업체\n3) 중소기업제품 구매촉진 및 판로지원에 관한 법률 제9조에 의한 직접생산확인  증명서 [전산업무(소프트웨어개발)분야의 ‘정보시스템개발서비스’]를 소지한 자  (전자입찰서 제출 마감일 전일까지 발급된 것으로 유효기간 내에 있어야 함)\n4) 직접생산확인증명서[버스및차량정보안내장치(4321151403)]를 소지한 자\n   (전자입찰서 제출 마감일 전일까지 발급된 것으로 유효기간 내에 있어야 함)\n5) 전자입찰서 제출 마감일 전일까지 정보통신공사업법 제14조에 따른 정보통신공사업 등록업체\n6) 상기항의 요건을 동시에 만족하지 못할 경우에는 공동도급이 가능하며, 입찰참가등록 신청 시 공동수급표준협정서(공동이행 또는 분담이행방식)를 제출하여야 한다. (단, 2개 업체 이내로 제한함)\n7) 본 사업은 사업금액이 20억원 미만인 사업으로서,「대기업인 소프트웨어사업자가 참여할 수 있는 사업금액의 하한」(과학기술정보통신부고시)에 의거 대기업 및 중견기업 소프트웨어 사업자는 본 입찰에 참여할 수 없음\n다. 사업자 선정방법 및 협상절차\n1)『지방자치단체 입찰시 낙찰자 결정기준』에 의거 종합배점기준을 기술제안서 80%, 가격제안서 20%로 배분ㆍ평가하여 고득점자부터 협상을 실시한다.\n2) 종합평가결과 기술능력과 가격 평가점수의 합산점수가 70점 이상인 자(기술능력 평가 점수가 기술능력 평가분야 배점한도의 85% 이상인 자)를 우선협상대상자를 선정하며, 종합 평가점수가 동일할 때에는 기술평가의 배점이 큰 항목에서 높은 점수를 받은 업체가 우선한다.\n3) 종합평가결과 70점 미만(기술능력 평가 점수가 기술능력 평가분야 배점한도의 85% 미만인 자)은 협상대상에서 제외한다."", ""주) 1. 해당사항이 없으면 “해당 없음” 으로 표기\n    2. 최근 2년간 제안사가 관계법령에 의해 입찰참가 제한 처분된 사실을 기재\n      - 대표자 직인 반드시 날인\n    3. 공동수급의 경우 1개 업체만 해당되더라도 배점은 “0점” 처리\n    4. 대표자 직인 날인하지 아니한 경우는 실적에서 제외되며, 허위로 작성한 사실이 판명될 시\n       평가대상에서 제외됨\n[양식 13] 공동수급 표준협정서(공동이행방식)\n공동수급표준협정서 (공동이행방식)\n제1조 (목적) 이 협정서는 공동수급체의 구성원이 재정, 경영, 기술능력, 인원 및 기자재를 동원하여 아래의 공사, 물품 또는 용역에 대한 계획, 입찰, 시공 등을 위하여 출자비율에 따라 공동 연대하여 계약을 이행할 것을 약속하는 협약을 정함에 있다.\n  1. 계약건명 :\n  2. 계약금액 :\n  3. 발주기관명 :\n제2조 (공동수급체) 공동수급체의 명칭, 사업소의 소재지, 대표자는 다음과 같다.\n  1. 명          칭 : ○○○\n  2. 주사무소소재지 :\n  3. 대 표 자 성 명 :\n제3조 (공동수급체의 구성원) ① 공동수급체의 구성원은 다음과 같다.\n  1. ○○○회사(대표자 :         소재지 :                )\n  2. ○○○회사(대표자 :         소재지 :                )\n  ② 공동수급체 대표자는 ○○○로 한다.\n  ③ 공동수급체 대표자는 발주기관과 제3자에 대하여 공동수급체를 대표하며, 공동수급체의 재산관리와 대금청구 등의 권한을 가진다.\n제4조 (효력기간) 이 협정서는 당사자간의 기명(서명)․날인과 동시에 발효하며, 해당 계약의 이행으로 종결된다. 다만, 발주기관이나 제3자에 대하여 해당 계약과 관련한 권리․의무 관계가 남아있는 한 이 협정서의 효력은 존속된다.\n제5조 (의무) 공동수급체의 구성원은 제1조에서 정한 목적을 수행하기 위하여 성실, 근면 및 신의를 바탕으로 하여 필요한 모든 지식과 기술을 활용할 것을 약속한다.\n제6조 (책임"", ""상 공동참여인 경우 각각의 대표자가 서명 날인하여 제출하고 제안서 내용은 각 업체별로 해당사항에 대해 내용을 빠짐없이 작성하여 제출한다.\n13) 본 사업의 성공적인 추진을 위해서 컨소시엄의 사업추진 조직도를 제출하여야 한다. 사업추진 조직도에는 컨소시엄의 도급을 받아서 사업을 수행하는 참여업체까지 포함하여야 하며, 해당 참여업체를 변경할 경우 발주기관과 협의하여야 한다. \n14) 하도급의 경우「소프트웨어 진흥법 시행규칙」제14조 및「소프트웨어사업 계약 및 관리감독에 관한 지침」(과학기술정보통신부 고시)의 규정에 의하여 반드시 하도급계약 전에 발주기관으로부터 사전승인을 받아야함.\n15)  본 사업 과업의 일부를 하도급하려는 경우「소프트웨어 진흥법」제51제1항에 따라 소프트에서 사업금액의 100분의 50을 초과할 수 없다, 다만, 제2항에 따라 하도급이 가능하며, 제3항에 따라 재하도급을 할 수 있음\n16)  본 사업 과업의 일부를 하도급하려는 경우 입찰 시 및 계약체결 시 「소프트웨어사업 계약 및 관리감독에 관한 지침」(과학기술정보통신부 고시)의 별지 7호의 소프트웨어사업 하도급계획서를 제출하여야 함.\n17) 하도급계약의 승인을 신청하는 경우,「소프트웨어사업 계약 및 관리감독에 관한 지침」에 따른 [하도급계약의 적정성 판단 세부기준]에 따라 적정성 여부를 판단하며, 평가점수가 85점 이상인 경우에 한하여 하도급계약을 승인함. 다만, 85점 이상인 경우라 하더라도 하도급 계약의 세부조건 등으로 인하여 사업의 원활한 수행이 불가능하다고 인정되는 경우 그 사유를 기재하여 하도급 승인 거절을 통보할 수 있음.\n18)  하도급 사전승인제와 관련하여 허도급을 허용할 경우 하도급거래 공정화에 관한 법률 제4조에 규정한바와 같이 원도급자가 부당한 하도급대금을 결정하지 않도록 하기 위하여 원도급자의 제안가격 대비 하도급 지급비율을 제안서에 명시하여야 한다.\n19) 본 사업은 「소프트웨어 진흥법」 제50조, 같은 법 시행령 제47조 제1항 제2호, 제3호에 따른 과업내용 변경 및""]",,
C_rule_multi_route,1,경기도평택시_2024년도 평택시 버스정보시스템(BIS) 구축사업.hwp,central,이 사업의 명칭(사업명)은 무엇인가?,2024년도 평택시 버스정보시스템(BIS) 구축사업 용역,"제2조 (공동수급체) 공동수급체의 명칭, 사업소의 소재지, 대표자는 다음과 같다","[""나. 입찰참가자격\n1) 지방자치단체를 당사자로 하는 계약에 관한 법률 시행령 제13조 및 동법시행규칙 제14조 규정에 의한 자격을 구비한 업체\n2) 소프트웨어진흥법 제24조 및 제58조 규정한 소프트웨어사업자(컴퓨터관련 서비스업 분야)로 신고한 업체\n3) 중소기업제품 구매촉진 및 판로지원에 관한 법률 제9조에 의한 직접생산확인  증명서 [전산업무(소프트웨어개발)분야의 ‘정보시스템개발서비스’]를 소지한 자  (전자입찰서 제출 마감일 전일까지 발급된 것으로 유효기간 내에 있어야 함)\n4) 직접생산확인증명서[버스및차량정보안내장치(4321151403)]를 소지한 자\n   (전자입찰서 제출 마감일 전일까지 발급된 것으로 유효기간 내에 있어야 함)\n5) 전자입찰서 제출 마감일 전일까지 정보통신공사업법 제14조에 따른 정보통신공사업 등록업체\n6) 상기항의 요건을 동시에 만족하지 못할 경우에는 공동도급이 가능하며, 입찰참가등록 신청 시 공동수급표준협정서(공동이행 또는 분담이행방식)를 제출하여야 한다. (단, 2개 업체 이내로 제한함)\n7) 본 사업은 사업금액이 20억원 미만인 사업으로서,「대기업인 소프트웨어사업자가 참여할 수 있는 사업금액의 하한」(과학기술정보통신부고시)에 의거 대기업 및 중견기업 소프트웨어 사업자는 본 입찰에 참여할 수 없음\n다. 사업자 선정방법 및 협상절차\n1)『지방자치단체 입찰시 낙찰자 결정기준』에 의거 종합배점기준을 기술제안서 80%, 가격제안서 20%로 배분ㆍ평가하여 고득점자부터 협상을 실시한다.\n2) 종합평가결과 기술능력과 가격 평가점수의 합산점수가 70점 이상인 자(기술능력 평가 점수가 기술능력 평가분야 배점한도의 85% 이상인 자)를 우선협상대상자를 선정하며, 종합 평가점수가 동일할 때에는 기술평가의 배점이 큰 항목에서 높은 점수를 받은 업체가 우선한다.\n3) 종합평가결과 70점 미만(기술능력 평가 점수가 기술능력 평가분야 배점한도의 85% 미만인 자)은 협상대상에서 제외한다."", ""주) 1. 해당사항이 없으면 “해당 없음” 으로 표기\n    2. 최근 2년간 제안사가 관계법령에 의해 입찰참가 제한 처분된 사실을 기재\n      - 대표자 직인 반드시 날인\n    3. 공동수급의 경우 1개 업체만 해당되더라도 배점은 “0점” 처리\n    4. 대표자 직인 날인하지 아니한 경우는 실적에서 제외되며, 허위로 작성한 사실이 판명될 시\n       평가대상에서 제외됨\n[양식 13] 공동수급 표준협정서(공동이행방식)\n공동수급표준협정서 (공동이행방식)\n제1조 (목적) 이 협정서는 공동수급체의 구성원이 재정, 경영, 기술능력, 인원 및 기자재를 동원하여 아래의 공사, 물품 또는 용역에 대한 계획, 입찰, 시공 등을 위하여 출자비율에 따라 공동 연대하여 계약을 이행할 것을 약속하는 협약을 정함에 있다.\n  1. 계약건명 :\n  2. 계약금액 :\n  3. 발주기관명 :\n제2조 (공동수급체) 공동수급체의 명칭, 사업소의 소재지, 대표자는 다음과 같다.\n  1. 명          칭 : ○○○\n  2. 주사무소소재지 :\n  3. 대 표 자 성 명 :\n제3조 (공동수급체의 구성원) ① 공동수급체의 구성원은 다음과 같다.\n  1. ○○○회사(대표자 :         소재지 :                )\n  2. ○○○회사(대표자 :         소재지 :                )\n  ② 공동수급체 대표자는 ○○○로 한다.\n  ③ 공동수급체 대표자는 발주기관과 제3자에 대하여 공동수급체를 대표하며, 공동수급체의 재산관리와 대금청구 등의 권한을 가진다.\n제4조 (효력기간) 이 협정서는 당사자간의 기명(서명)․날인과 동시에 발효하며, 해당 계약의 이행으로 종결된다. 다만, 발주기관이나 제3자에 대하여 해당 계약과 관련한 권리․의무 관계가 남아있는 한 이 협정서의 효력은 존속된다.\n제5조 (의무) 공동수급체의 구성원은 제1조에서 정한 목적을 수행하기 위하여 성실, 근면 및 신의를 바탕으로 하여 필요한 모든 지식과 기술을 활용할 것을 약속한다.\n제6조 (책임"", ""상 공동참여인 경우 각각의 대표자가 서명 날인하여 제출하고 제안서 내용은 각 업체별로 해당사항에 대해 내용을 빠짐없이 작성하여 제출한다.\n13) 본 사업의 성공적인 추진을 위해서 컨소시엄의 사업추진 조직도를 제출하여야 한다. 사업추진 조직도에는 컨소시엄의 도급을 받아서 사업을 수행하는 참여업체까지 포함하여야 하며, 해당 참여업체를 변경할 경우 발주기관과 협의하여야 한다. \n14) 하도급의 경우「소프트웨어 진흥법 시행규칙」제14조 및「소프트웨어사업 계약 및 관리감독에 관한 지침」(과학기술정보통신부 고시)의 규정에 의하여 반드시 하도급계약 전에 발주기관으로부터 사전승인을 받아야함.\n15)  본 사업 과업의 일부를 하도급하려는 경우「소프트웨어 진흥법」제51제1항에 따라 소프트에서 사업금액의 100분의 50을 초과할 수 없다, 다만, 제2항에 따라 하도급이 가능하며, 제3항에 따라 재하도급을 할 수 있음\n16)  본 사업 과업의 일부를 하도급하려는 경우 입찰 시 및 계약체결 시 「소프트웨어사업 계약 및 관리감독에 관한 지침」(과학기술정보통신부 고시)의 별지 7호의 소프트웨어사업 하도급계획서를 제출하여야 함.\n17) 하도급계약의 승인을 신청하는 경우,「소프트웨어사업 계약 및 관리감독에 관한 지침」에 따른 [하도급계약의 적정성 판단 세부기준]에 따라 적정성 여부를 판단하며, 평가점수가 85점 이상인 경우에 한하여 하도급계약을 승인함. 다만, 85점 이상인 경우라 하더라도 하도급 계약의 세부조건 등으로 인하여 사업의 원활한 수행이 불가능하다고 인정되는 경우 그 사유를 기재하여 하도급 승인 거절을 통보할 수 있음.\n18)  하도급 사전승인제와 관련하여 허도급을 허용할 경우 하도급거래 공정화에 관한 법률 제4조에 규정한바와 같이 원도급자가 부당한 하도급대금을 결정하지 않도록 하기 위하여 원도급자의 제안가격 대비 하도급 지급비율을 제안서에 명시하여야 한다.\n19) 본 사업은 「소프트웨어 진흥법」 제50조, 같은 법 시행령 제47조 제1항 제2호, 제3호에 따른 과업내용 변경 및"", "") 공동수급체의 구성원은 발주기관에 대한 계약의 의무이행에 대하여 연대하여 책임을 진다.\n제7조 (하도급) 공동수급체 구성원 중 일부 구성원이 하도급계약을 체결하려는 경우에는 다른 구성원의 동의를 받아야 한다.\n제8조 (거래계좌) 행정자치부 예규「지방자치단체 입찰 및 계약 집행기준」제7장 공동계약 운영요령 제3절 7. 대가의 지급에 정한 바에 따라 선금, 기성대가 등은 다음 계좌로 지급받는다.\n  1. ○○○회사(공동수급체대표자) : ○○은행, 계좌번호○○○, 예금주○○○\n  2. ○○○회사 : ○○은행, 계좌번호○○○, 예금주○○○\n제9조 (구성원의 출자비율) ① 각 구성원의 출자비율은 다음과 같이 정한다.\n  1. ○○○:     %\n  2. ○○○:     %\n  ② 제1항의 출자비율은 다음 각 호의 어느 하나에 해당하는 경우에 변경할 수 있다. 다만, 출자비율을 변경함에 있어 일부 구성원의 출자지분 전부를 다른 구성원에게 이전할 수 없다.\n  1. 발주기관과의 계약내용 변경에 따라 계약금액이 증감되었을 경우\n  2. 공동수급체의 구성원 중 파산, 해산, 부도 등의 사유로 인하여 당초 협정서의 내용대로 계약이행이 곤란한 구성원이 발생하여 공동수급체의 구성원 연명으로 출자비율의 변경을 요청한 경우\n  ③ 현금 이외의 출자는 시가를 참작, 구성원이 협의 평가하는 것으로 한다.\n제10조 (손익의 배분) 계약을 이행한 후 이익․손실이 발생한 경우에는 제9조에서 정한 비율에 따라 배당하거나 분담한다.\n제11조 (권리․의무의 양도제한) 구성원은 이 협정서에 따른 권리의무를 제3자에게 양도할 수 없다.\n제12조 (중도탈퇴에 대한 조치) ① 공동수급체의 구성원은 다음 각 호의 어느 하나에 해당하는 경우 외에는 입찰과 해당계약의 이행을 완료하는 날까지 탈퇴할 수 없다. 다만, 제3호에 해당하는 경우에는 다른 구성원이 반드시 탈퇴조치를 해야 한다. \n  1. 발주기관과 구성원 전원이 동의하는 경우\n  2. 파산, 해산, 부도 그밖의 정당한 이유없이 해당 계약을 이행하지 아""]",,
A_single_pipeline,1,경상북도 봉화군_봉화군 재난통합관리시스템 고도화 사업(협상)(긴급).hwp,central,입찰방식(계약방법)은 무엇인가요?,제한경쟁입찰(협상에 의한 계약),❍ 계약방법 : 제한경쟁입찰(협상에 의한 계약),"[""1. 사업일반\n ❍ 사 업 명 : 봉화군 재난통합관리시스템 고도화 사업\n ❍ 사업기간 : 착수일로부터 7개월(210일)\n ❍ 사업금액 : 900,000,000원(부가세 포함)\n ❍ 계약방법 : 제한경쟁입찰(협상에 의한 계약)\n   -「지방자치단체를 당사자로 하는 계약에 관한 법률 시행령」 제43조에 의하여 제안서를 평가한 후 협상절차를 통하여 선정\n ❍ 관련법령\n   - ｢재난 및 안전관리기본법｣ 제38조의2(재난 예보‧경보체계 구축‧운영 등)""]",,
B_rule_single_route,1,경상북도 봉화군_봉화군 재난통합관리시스템 고도화 사업(협상)(긴급).hwp,central,입찰방식(계약방법)은 무엇인가요?,제한경쟁입찰(협상에 의한 계약),❍ 계약방법 : 제한경쟁입찰(협상에 의한 계약),"[""제1조 (목적) 이 협정서는 공동수급체의 구성원이 재정, 경영, 기술능력, 인원 및 기자재를 동원하여 아래의 공사, 물품 또는 용역에 대한 계획, 입찰, 시공 등을 위하여 출자비율에 따라 공동 연대하여 계약을 이행할 것을 약속하는 협약을 정함에 있다.\n  1. 계약건명 :\n  2. 계약금액 :\n  3. 발주기관명 :\n제2조 (공동수급체) 공동수급체의 명칭, 사업소의 소재지, 대표자는 다음과 같다.\n  1. 명          칭 : ○○○\n  2. 주사무소소재지 :\n  3. 대 표 자 성 명 :\n제3조 (공동수급체의 구성원) ① 공동수급체의 구성원은 다음과 같다.\n  1. ○○○회사(대표자 :         소재지 :                )\n  2. ○○○회사(대표자 :         소재지 :                )\n  ② 공동수급체 대표자는 ○○○로 한다.\n  ③ 공동수급체 대표자는 발주기관과 제3자에 대하여 공동수급체를 대표하며, 공동수급체의 재산관리와 대금청구 등의 권한을 가진다.\n제4조 (효력기간) 이 협정서는 당사자간의 기명(서명)․날인과 동시에 발효하며, 해당 계약의 이행으로 종결된다. 다만, 발주기관이나 제3자에 대하여 해당 계약과 관련한 권리․의무 관계가 남아있는 한 이 협정서의 효력은 존속된다.\n제5조 (의무) 공동수급체의 구성원은 제1조에서 정한 목적을 수행하기 위하여 성실, 근면 및 신의를 바탕으로 하여 필요한 모든 지식과 기술을 활용할 것을 약속한다.\n제6조 (책임) 공동수급체의 구성원은 발주기관에 대한 계약의 의무이행에 대하여 연대하여 책임을 진다.\n제7조 (하도급) 공동수급체 구성원 중 일부 구성원이 하도급계약을 체결하려는 경우에는 다른 구성원의 동의를 받아야 한다.\n제8조 (거래계좌) 행정자치부 예규「지방자치단체 입찰 및 계약 집행기준」제7장 공동계약 운영요령 제3절 7. 대가의 지급에 정한 바에 따라 선금, 기성대가 등은 다음 계좌로 지급받는다.\n  1. ○○○회사(공동수급체대표자) : ○○은행, 계좌번호○○○, 예"", ""1. 사업일반\n ❍ 사 업 명 : 봉화군 재난통합관리시스템 고도화 사업\n ❍ 사업기간 : 착수일로부터 7개월(210일)\n ❍ 사업금액 : 900,000,000원(부가세 포함)\n ❍ 계약방법 : 제한경쟁입찰(협상에 의한 계약)\n   -「지방자치단체를 당사자로 하는 계약에 관한 법률 시행령」 제43조에 의하여 제안서를 평가한 후 협상절차를 통하여 선정\n ❍ 관련법령\n   - ｢재난 및 안전관리기본법｣ 제38조의2(재난 예보‧경보체계 구축‧운영 등)"", ""1. 제안요청 개요\n 가. 사 업 명 : 봉화군 재난통합관리시스템 고도화 사업\n 나. 사업기간 : 계약 후 ～ 210일(7개월)\n 다. 사업금액 : 900,000,000원(부가세 포함)\n 라. 사업범위\n ❍ 재난통합관리시스템 구축\n   - GIS기반의 계측‧관측정보 통합 수집 및 관리\n   - 계측‧관측장비, 재난예경보시설 위치 및 상태 정보 관리\n   - 기상정보, 유관기관 수집정보 수집, 표출 및 통합관리\n   - 유관기관 연계 정보는 활용정보 및 사용자 편의성을 고려하여  표출\n   - 재난통합관리시스템 정보 관리 및 운영\n ❍ 통합상황전파시스템 구축\n   - 기 운영중인 재난 예경보시설 연계 및 재난방송(통합상황전파)\n   - 계측‧관측장비, 재난예경보시설 위치 및 상태 정보 관리\n   - 재난예경보(방송) 발령 및 위기상황 경보방송 전파\n   - 모바일 앱 연계 정보 제공 및 홍수모형분석 서비스\n   - 안정적인 경보발령체계를 구현을 위한 디지털 데이터방송기술(DMB EWS) 및 LTE를 통한 무선방식의 경보방송 구축\n ❍ 통합연계시스템 구축\n   - 계측기(수위계 등), 재난예경보장치 등 상황전파시스템 연계 운영\n   - 수집 데이터 기반 현장 운영시스템 원격 제어 및 관리\n   - 이기종 시스템과 안정적인 연계를 위한 네트워크 구성\n   - 시험운영을 통한 재난통합관리시스템 연계 및 상시운영체계 마련\n   - 기상청, 행정안전부 등 유관기관 연계를 통한 데이터 수집 및  관리""]",,
C_rule_multi_route,1,경상북도 봉화군_봉화군 재난통합관리시스템 고도화 사업(협상)(긴급).hwp,central,입찰방식(계약방법)은 무엇인가요?,제한경쟁입찰(협상에 의한 계약),❍ 계약방법 : 제한경쟁입찰(협상에 의한 계약),"[""제1조 (목적) 이 협정서는 공동수급체의 구성원이 재정, 경영, 기술능력, 인원 및 기자재를 동원하여 아래의 공사, 물품 또는 용역에 대한 계획, 입찰, 시공 등을 위하여 출자비율에 따라 공동 연대하여 계약을 이행할 것을 약속하는 협약을 정함에 있다.\n  1. 계약건명 :\n  2. 계약금액 :\n  3. 발주기관명 :\n제2조 (공동수급체) 공동수급체의 명칭, 사업소의 소재지, 대표자는 다음과 같다.\n  1. 명          칭 : ○○○\n  2. 주사무소소재지 :\n  3. 대 표 자 성 명 :\n제3조 (공동수급체의 구성원) ① 공동수급체의 구성원은 다음과 같다.\n  1. ○○○회사(대표자 :         소재지 :                )\n  2. ○○○회사(대표자 :         소재지 :                )\n  ② 공동수급체 대표자는 ○○○로 한다.\n  ③ 공동수급체 대표자는 발주기관과 제3자에 대하여 공동수급체를 대표하며, 공동수급체의 재산관리와 대금청구 등의 권한을 가진다.\n제4조 (효력기간) 이 협정서는 당사자간의 기명(서명)․날인과 동시에 발효하며, 해당 계약의 이행으로 종결된다. 다만, 발주기관이나 제3자에 대하여 해당 계약과 관련한 권리․의무 관계가 남아있는 한 이 협정서의 효력은 존속된다.\n제5조 (의무) 공동수급체의 구성원은 제1조에서 정한 목적을 수행하기 위하여 성실, 근면 및 신의를 바탕으로 하여 필요한 모든 지식과 기술을 활용할 것을 약속한다.\n제6조 (책임) 공동수급체의 구성원은 발주기관에 대한 계약의 의무이행에 대하여 연대하여 책임을 진다.\n제7조 (하도급) 공동수급체 구성원 중 일부 구성원이 하도급계약을 체결하려는 경우에는 다른 구성원의 동의를 받아야 한다.\n제8조 (거래계좌) 행정자치부 예규「지방자치단체 입찰 및 계약 집행기준」제7장 공동계약 운영요령 제3절 7. 대가의 지급에 정한 바에 따라 선금, 기성대가 등은 다음 계좌로 지급받는다.\n  1. ○○○회사(공동수급체대표자) : ○○은행, 계좌번호○○○, 예"", ""1. 사업일반\n ❍ 사 업 명 : 봉화군 재난통합관리시스템 고도화 사업\n ❍ 사업기간 : 착수일로부터 7개월(210일)\n ❍ 사업금액 : 900,000,000원(부가세 포함)\n ❍ 계약방법 : 제한경쟁입찰(협상에 의한 계약)\n   -「지방자치단체를 당사자로 하는 계약에 관한 법률 시행령」 제43조에 의하여 제안서를 평가한 후 협상절차를 통하여 선정\n ❍ 관련법령\n   - ｢재난 및 안전관리기본법｣ 제38조의2(재난 예보‧경보체계 구축‧운영 등)"", ""1. 제안요청 개요\n 가. 사 업 명 : 봉화군 재난통합관리시스템 고도화 사업\n 나. 사업기간 : 계약 후 ～ 210일(7개월)\n 다. 사업금액 : 900,000,000원(부가세 포함)\n 라. 사업범위\n ❍ 재난통합관리시스템 구축\n   - GIS기반의 계측‧관측정보 통합 수집 및 관리\n   - 계측‧관측장비, 재난예경보시설 위치 및 상태 정보 관리\n   - 기상정보, 유관기관 수집정보 수집, 표출 및 통합관리\n   - 유관기관 연계 정보는 활용정보 및 사용자 편의성을 고려하여  표출\n   - 재난통합관리시스템 정보 관리 및 운영\n ❍ 통합상황전파시스템 구축\n   - 기 운영중인 재난 예경보시설 연계 및 재난방송(통합상황전파)\n   - 계측‧관측장비, 재난예경보시설 위치 및 상태 정보 관리\n   - 재난예경보(방송) 발령 및 위기상황 경보방송 전파\n   - 모바일 앱 연계 정보 제공 및 홍수모형분석 서비스\n   - 안정적인 경보발령체계를 구현을 위한 디지털 데이터방송기술(DMB EWS) 및 LTE를 통한 무선방식의 경보방송 구축\n ❍ 통합연계시스템 구축\n   - 계측기(수위계 등), 재난예경보장치 등 상황전파시스템 연계 운영\n   - 수집 데이터 기반 현장 운영시스템 원격 제어 및 관리\n   - 이기종 시스템과 안정적인 연계를 위한 네트워크 구성\n   - 시험운영을 통한 재난통합관리시스템 연계 및 상시운영체계 마련\n   - 기상청, 행정안전부 등 유관기관 연계를 통한 데이터 수집 및  관리"", ""금주○○○\n  2. ○○○회사 : ○○은행, 계좌번호○○○, 예금주○○○\n제9조 (구성원의 출자비율) ① 각 구성원의 출자비율은 다음과 같이 정한다.\n  1. ○○○:     %\n  2. ○○○:     %\n  ② 제1항의 출자비율은 다음 각 호의 어느 하나에 해당하는 경우에 변경할 수 있다. 다만, 출자비율을 변경함에 있어 일부 구성원의 출자지분 전부를 다른 구성원에게 이전할 수 없다.\n  1. 발주기관과의 계약내용 변경에 따라 계약금액이 증감되었을 경우\n  2. 공동수급체의 구성원 중 파산, 해산, 부도 등의 사유로 인하여 당초 협정서의 내용대로 계약이행이 곤란한 구성원이 발생하여 공동수급체의 구성원 연명으로 출자비율의 변경을 요청한 경우\n  ③ 현금 이외의 출자는 시가를 참작, 구성원이 협의 평가하는 것으로 한다.\n제10조 (손익의 배분) 계약을 이행한 후 이익․손실이 발생한 경우에는 제9조에서 정한 비율에 따라 배당하거나 분담한다.\n제11조 (권리․의무의 양도제한) 구성원은 이 협정서에 따른 권리의무를 제3자에게 양도할 수 없다.\n제12조 (중도탈퇴에 대한 조치) ① 공동수급체의 구성원은 다음 각 호의 어느 하나에 해당하는 경우 외에는 입찰과 해당계약의 이행을 완료하는 날까지 탈퇴할 수 없다. 다만, 제3호에 해당하는 경우에는 다른 구성원이 반드시 탈퇴조치를 해야 한다. \n  1. 발주기관과 구성원 전원이 동의하는 경우\n  2. 파산, 해산, 부도 그밖의 정당한 이유없이 해당 계약을 이행하지 아니하여 공동수급체의 다른 구성원이 발주기관의 동의를 얻어 탈퇴조치를 하는 경우\n  3. 공동수급체의 구성원 중 파산, 해산, 부도 그밖의 정당한 이유없이 해당 계약을 이행하지 아니하여 시행령 제92조 제1항 제6호에 따라 입찰참가자격 제한조치를 받은 경우\n  ② 제1항에 따라 구성원 중 일부가 탈퇴한 경우에는 잔존구성원이 공동 연대하여 해당계약을 이행한다. 다만, 잔존구성원만으로 면허, 실적, 시공능력평가액 등 잔여계약이행에 필요한 요건을 갖추지 못할 경우에는 잔""]",,
A_single_pipeline,1,경희대학교_[입찰공고] 산학협력단 정보시스템 운영 용역업체 선정.hwp,central,이 제안요청서의 사업명은 무엇인가?,경희대학교 산학협력단 정보시스템(인포21 등) 운영 용역사업,1) 제안요청서의 내용 및 붙임자료를 기준으로 하여 그 사항을 최대한 충족하도록 작성함,"[""1. 제안서 작성요령\n    가. 제안서의 효력\n       1) 제안서에 게시된 내용 및 의뢰기관의 요구에 의하여 수정·보완 및 변경된 제안 내용은 제안사가 사업자로 선정된 후 계약서에 명시되지 않더라도 계약서와 동일한 효력을 가짐. 단, 계약서에 명시한 경우는 계약서 사항이 우선함\n       2) 제출서류 및 제안서의 내용이 부정,허위로 작성된 사실이 발견될 시에는 심사대상에서 제외됨. 계약체결 이후 제안내용이 충족되지 못할 경우에는 손해배상 책임을 져야 하며, 계약체결 후 부정,허위 적성으로 판결 시 계약을 해제 또는 해지하며 의뢰기관은 계약상대자를 부정당업체로 제재할 수 있음\n       3) 필요시 제안사에 대하여 추가제안 또는 자료를 요청할 수 있으며, 이에 따라 제출된 자료는 제안서와 동일한 효력을 가짐\n       4) 제안서 및 계약서에 대하여 이견이 발생할 경우 또는 계약상에 정하지 아니한 사항에 대하여는 쌍방의 협의에 의하여 결정하되, 해석상 문제가 발생 시 의뢰기관의 지시에 따름\n       5) 제안서의 내용에 기술되지 않은 사항일지라도 향후 사업 추진 시 필요하다고 인정될 경우에는 발주자의 요청에 의해 수정될 수 있음\n       6) 제출된 제안서의 내용은 의뢰기관이 요청하지 않는 한 변경할 수 없음\n       7) 본 제안요청서와 공고에 명시하지 아니한 사항은 ｢국가를 당사자로 하는 계약에 관한 법률｣ 등 국가 계약 관련 법률과 의뢰기관의 관련 규정에 따름\n    나. 제안서 작성지침 및 유의사항\n       1) 제안요청서의 내용 및 붙임자료를 기준으로 하여 그 사항을 최대한 충족하도록 작성함\n       2) 작성 목차와 서식에 맞추어 작성하고, 본 제안요청서에 명시되지 않은 사항이라도 본 사업 수행에 필요하다고 인정되는 항목 및 내용 등을 별도의 항목으로 추가하여 제안 가능함 \n       3) 내용은 객관적으로 입증할 수 있어야 하며, 그 내용이 허위로 확인될 경우 평가대상에서 제외됨\n       4) 작성 내용에 대한 "", ""시까지 제안사는 본 사업에 관하여 어떠한 권리도 행사할 수 없고 본 사업과 관련하여 나온 모든 산출물은 산학협력단의 허가 없이 제3자에게 공개, 양도, 활용, 기타 영리 목적으로 이용할 수 없음. 또한, 제안내용의 전부 또는 일부에 대하여 담합한 사실이 발견되거나 담합하였다고 판단될 때에는 제안을 무효로 함\n   차.  본 사업의 수행에 필요한 모든 비용은 가격입찰금액에 포함시켜야 함\n   카. 낙찰자가 정당한 사유 없이 계약 체결 통보일로부터 10일 이내에 계약을 체결하지 아니할 때는 입찰보증금은 산학협력단에 귀속됨\n   타. 산학협력단은 성공적인 사업을 완수하기 위해 협상 시 제안사에게 제안요청서의 내용 중 일부에 대해 변경을 요구할 수 있으며, 제안사는 산학협력단이 제시하는 의견을 특별한 사유가 없는 한 반영하여야 함\n   파. 본 제안요청서에 명시되지 않은 사항은 제안서, 과업지시서의 내용을 따르며, 본 사업의 목적상 필요한 사항은 상호 협의하여 추진하되 산학협력단의 견해를 우선으로 하고, 본 제안요청서에 명시되지 않더라도 산학협력단의 계약 및 회계 관련 규정 중 에서 본 사업과 관련이 있는 사항은 제안요청서와 동등한 효력을 가짐\n   하. 최종 계약 체결이나 공식적인 착수 통보 이전에 수행된 제안요청과 관련된 자료 공개 상 오류나 누락에 대하여는 산학협력단이 책임지지 아니하며 본 사업 수행 과정에서 법·제도의 변경, 산학협력단의 정책변경 등 현저한 사업 환경변화가 있을 경우 사업이 변경될 수 있음""]",,
B_rule_single_route,1,경희대학교_[입찰공고] 산학협력단 정보시스템 운영 용역업체 선정.hwp,central,이 제안요청서의 사업명은 무엇인가?,경희대학교 산학협력단 정보시스템(인포21 등) 운영 용역사업,1) 제안요청서의 내용 및 붙임자료를 기준으로 하여 그 사항을 최대한 충족하도록 작성함,"[""1. 제안서 작성요령\n    가. 제안서의 효력\n       1) 제안서에 게시된 내용 및 의뢰기관의 요구에 의하여 수정·보완 및 변경된 제안 내용은 제안사가 사업자로 선정된 후 계약서에 명시되지 않더라도 계약서와 동일한 효력을 가짐. 단, 계약서에 명시한 경우는 계약서 사항이 우선함\n       2) 제출서류 및 제안서의 내용이 부정,허위로 작성된 사실이 발견될 시에는 심사대상에서 제외됨. 계약체결 이후 제안내용이 충족되지 못할 경우에는 손해배상 책임을 져야 하며, 계약체결 후 부정,허위 적성으로 판결 시 계약을 해제 또는 해지하며 의뢰기관은 계약상대자를 부정당업체로 제재할 수 있음\n       3) 필요시 제안사에 대하여 추가제안 또는 자료를 요청할 수 있으며, 이에 따라 제출된 자료는 제안서와 동일한 효력을 가짐\n       4) 제안서 및 계약서에 대하여 이견이 발생할 경우 또는 계약상에 정하지 아니한 사항에 대하여는 쌍방의 협의에 의하여 결정하되, 해석상 문제가 발생 시 의뢰기관의 지시에 따름\n       5) 제안서의 내용에 기술되지 않은 사항일지라도 향후 사업 추진 시 필요하다고 인정될 경우에는 발주자의 요청에 의해 수정될 수 있음\n       6) 제출된 제안서의 내용은 의뢰기관이 요청하지 않는 한 변경할 수 없음\n       7) 본 제안요청서와 공고에 명시하지 아니한 사항은 ｢국가를 당사자로 하는 계약에 관한 법률｣ 등 국가 계약 관련 법률과 의뢰기관의 관련 규정에 따름\n    나. 제안서 작성지침 및 유의사항\n       1) 제안요청서의 내용 및 붙임자료를 기준으로 하여 그 사항을 최대한 충족하도록 작성함\n       2) 작성 목차와 서식에 맞추어 작성하고, 본 제안요청서에 명시되지 않은 사항이라도 본 사업 수행에 필요하다고 인정되는 항목 및 내용 등을 별도의 항목으로 추가하여 제안 가능함 \n       3) 내용은 객관적으로 입증할 수 있어야 하며, 그 내용이 허위로 확인될 경우 평가대상에서 제외됨\n       4) 작성 내용에 대한 "", ""시까지 제안사는 본 사업에 관하여 어떠한 권리도 행사할 수 없고 본 사업과 관련하여 나온 모든 산출물은 산학협력단의 허가 없이 제3자에게 공개, 양도, 활용, 기타 영리 목적으로 이용할 수 없음. 또한, 제안내용의 전부 또는 일부에 대하여 담합한 사실이 발견되거나 담합하였다고 판단될 때에는 제안을 무효로 함\n   차.  본 사업의 수행에 필요한 모든 비용은 가격입찰금액에 포함시켜야 함\n   카. 낙찰자가 정당한 사유 없이 계약 체결 통보일로부터 10일 이내에 계약을 체결하지 아니할 때는 입찰보증금은 산학협력단에 귀속됨\n   타. 산학협력단은 성공적인 사업을 완수하기 위해 협상 시 제안사에게 제안요청서의 내용 중 일부에 대해 변경을 요구할 수 있으며, 제안사는 산학협력단이 제시하는 의견을 특별한 사유가 없는 한 반영하여야 함\n   파. 본 제안요청서에 명시되지 않은 사항은 제안서, 과업지시서의 내용을 따르며, 본 사업의 목적상 필요한 사항은 상호 협의하여 추진하되 산학협력단의 견해를 우선으로 하고, 본 제안요청서에 명시되지 않더라도 산학협력단의 계약 및 회계 관련 규정 중 에서 본 사업과 관련이 있는 사항은 제안요청서와 동등한 효력을 가짐\n   하. 최종 계약 체결이나 공식적인 착수 통보 이전에 수행된 제안요청과 관련된 자료 공개 상 오류나 누락에 대하여는 산학협력단이 책임지지 아니하며 본 사업 수행 과정에서 법·제도의 변경, 산학협력단의 정책변경 등 현저한 사업 환경변화가 있을 경우 사업이 변경될 수 있음""]",,
C_rule_multi_route,1,경희대학교_[입찰공고] 산학협력단 정보시스템 운영 용역업체 선정.hwp,central,이 제안요청서의 사업명은 무엇인가?,경희대학교 산학협력단 정보시스템(인포21 등) 운영 용역사업,1) 제안요청서의 내용 및 붙임자료를 기준으로 하여 그 사항을 최대한 충족하도록 작성함,"[""1. 제안서 작성요령\n    가. 제안서의 효력\n       1) 제안서에 게시된 내용 및 의뢰기관의 요구에 의하여 수정·보완 및 변경된 제안 내용은 제안사가 사업자로 선정된 후 계약서에 명시되지 않더라도 계약서와 동일한 효력을 가짐. 단, 계약서에 명시한 경우는 계약서 사항이 우선함\n       2) 제출서류 및 제안서의 내용이 부정,허위로 작성된 사실이 발견될 시에는 심사대상에서 제외됨. 계약체결 이후 제안내용이 충족되지 못할 경우에는 손해배상 책임을 져야 하며, 계약체결 후 부정,허위 적성으로 판결 시 계약을 해제 또는 해지하며 의뢰기관은 계약상대자를 부정당업체로 제재할 수 있음\n       3) 필요시 제안사에 대하여 추가제안 또는 자료를 요청할 수 있으며, 이에 따라 제출된 자료는 제안서와 동일한 효력을 가짐\n       4) 제안서 및 계약서에 대하여 이견이 발생할 경우 또는 계약상에 정하지 아니한 사항에 대하여는 쌍방의 협의에 의하여 결정하되, 해석상 문제가 발생 시 의뢰기관의 지시에 따름\n       5) 제안서의 내용에 기술되지 않은 사항일지라도 향후 사업 추진 시 필요하다고 인정될 경우에는 발주자의 요청에 의해 수정될 수 있음\n       6) 제출된 제안서의 내용은 의뢰기관이 요청하지 않는 한 변경할 수 없음\n       7) 본 제안요청서와 공고에 명시하지 아니한 사항은 ｢국가를 당사자로 하는 계약에 관한 법률｣ 등 국가 계약 관련 법률과 의뢰기관의 관련 규정에 따름\n    나. 제안서 작성지침 및 유의사항\n       1) 제안요청서의 내용 및 붙임자료를 기준으로 하여 그 사항을 최대한 충족하도록 작성함\n       2) 작성 목차와 서식에 맞추어 작성하고, 본 제안요청서에 명시되지 않은 사항이라도 본 사업 수행에 필요하다고 인정되는 항목 및 내용 등을 별도의 항목으로 추가하여 제안 가능함 \n       3) 내용은 객관적으로 입증할 수 있어야 하며, 그 내용이 허위로 확인될 경우 평가대상에서 제외됨\n       4) 작성 내용에 대한 "", ""시까지 제안사는 본 사업에 관하여 어떠한 권리도 행사할 수 없고 본 사업과 관련하여 나온 모든 산출물은 산학협력단의 허가 없이 제3자에게 공개, 양도, 활용, 기타 영리 목적으로 이용할 수 없음. 또한, 제안내용의 전부 또는 일부에 대하여 담합한 사실이 발견되거나 담합하였다고 판단될 때에는 제안을 무효로 함\n   차.  본 사업의 수행에 필요한 모든 비용은 가격입찰금액에 포함시켜야 함\n   카. 낙찰자가 정당한 사유 없이 계약 체결 통보일로부터 10일 이내에 계약을 체결하지 아니할 때는 입찰보증금은 산학협력단에 귀속됨\n   타. 산학협력단은 성공적인 사업을 완수하기 위해 협상 시 제안사에게 제안요청서의 내용 중 일부에 대해 변경을 요구할 수 있으며, 제안사는 산학협력단이 제시하는 의견을 특별한 사유가 없는 한 반영하여야 함\n   파. 본 제안요청서에 명시되지 않은 사항은 제안서, 과업지시서의 내용을 따르며, 본 사업의 목적상 필요한 사항은 상호 협의하여 추진하되 산학협력단의 견해를 우선으로 하고, 본 제안요청서에 명시되지 않더라도 산학협력단의 계약 및 회계 관련 규정 중 에서 본 사업과 관련이 있는 사항은 제안요청서와 동등한 효력을 가짐\n   하. 최종 계약 체결이나 공식적인 착수 통보 이전에 수행된 제안요청과 관련된 자료 공개 상 오류나 누락에 대하여는 산학협력단이 책임지지 아니하며 본 사업 수행 과정에서 법·제도의 변경, 산학협력단의 정책변경 등 현저한 사업 환경변화가 있을 경우 사업이 변경될 수 있음""]",,
A_single_pipeline,1,고양도시관리공사_관산근린공원 다목적구장 홈페이지 및 회원 통합운영.hwp,central,이 사업의 과업기간과 무상하자보증기간은 어떻게 되나요?,과업기간: 착수일로부터 90일 이내; 무상하자보증기간: 준공일로부터 1년,4) 제안사는 공급하는 제품의 품질에 대하여 최종적인 책임을 져야 하며 기술 환경 및 기타사정 등으로 인하여 일부 사업의 내용 및 범위 등의 변경이 필요한 경우에는 발주기관과 협의에 의해 조정할 수 있습니다,"["" 있으며, 입증 자료를 제출하지 못할 경우 불가능한 것으로 판단합니다.\n      4) 제안사는 공급하는 제품의 품질에 대하여 최종적인 책임을 져야 하며 기술 환경 및 기타사정 등으로 인하여 일부 사업의 내용 및 범위 등의 변경이 필요한 경우에는 발주기관과 협의에 의해 조정할 수 있습니다.\n      5) 본 제안요청서 및 제안서, 계약사항 등에 관하여 이견이 발생하였을 경우 또는 계약상에 정하지 아니한 사항에 대하여는 발주기관과 제안사의 협의에 의해 결정합니다.\n      6) 입찰에 참가하고자 하는 자는 본 입찰 유의서 및 지방자치단체를 당사자로 하는 계약에 관한 법률 등을 입찰 전에 완전히 숙지하였다고 간주하며 이를 숙지하지 못함으로 발생되는 책임은 입찰 참가자에게 있습니다.\n      7) 입찰 공고문, 제안요청서 및 이에 근거한 별첨(붙임 등) 등에 명시되지 않은 사항은 지방자치단체를 당사자로 하는 계약에 관한 법률, 소프트웨어 진흥법, 국제표준규격 등 관련 규정 및 발주기관의 계약 요령에 따른다."", ""정성적 지표의 평가기준\n󰏚 평가항목 및 배점\n  정성적 평가의 평가항목 및 기준은 과학기술정보통신부 장관이 고시한 소프트웨어 기술성 평가기준 중 기술제안서 평가항목별 배점한도를 준용하되, 본 사업의 내용을 고려하여 아래와 같이 정함""]",,
B_rule_single_route,1,고양도시관리공사_관산근린공원 다목적구장 홈페이지 및 회원 통합운영.hwp,central,이 사업의 과업기간과 무상하자보증기간은 어떻게 되나요?,과업기간: 착수일로부터 90일 이내; 무상하자보증기간: 준공일로부터 1년,"정성적 평가의 평가항목 및 기준은 과학기술정보통신부 장관이 고시한 소프트웨어 기술성 평가기준 중 기술제안서 평가항목별 배점한도를 준용하되, 본 사업의 내용을 고려하여 아래와 같이 정함","[""3. 제안서 설명회(제안업체 참석) 및 평가\n가. 제안서 발표\n  1) 일    시 : 2024. 9. 26.(목) 14:00 ~ 16:00(예정)\n  2) 장    소 : 경기 고양시 일산서구 중앙로 1601 고양종합운동장 중회의실\n      ※ 추진 일정은 사업추진 여건 등에 따라 변동 가능, 변경 시 별도안내\n  3) 평가시간 : 업체당 40분(제안설명 20분, 질의응답 10분, 평가 10분)\n  4) 발표순서 : 발표순서는 당일 추첨에 의하여 결정\n  5) 발표자료 : PPT 자료\n      ※ 발표자료는 제안서 제출시 함께 제출할 것\n      ※ 제안회사를 인식할 수 있는 일체의 표기 사용금지      \n나. 평가방법 및 항목별 배점 (※붙임3 참고)\n      1) 평가 주체 : 고양도시관리공사\n      2) 기술평가와 가격평가를 실시하여 종합평가점수로 산출\n        ­평가비율 : 기술능력평가(90%), 가격평가(10%)\n        ※ 「행정기관 및 공공기관 정보시스템 구축·운영 지침」 제18조(평가배점)의 규정에 따라 기술능력평가 배점한도를 90점으로 함\n        ­종합 평가점수 = 기술평가점수 + 입찰가격 평가점수 \n        ­평가점수에서 소수점 이하가 있는 경우 소수점 셋째자리에서 반올림\n      3) 기술평가 \n        ­기술평가 : 정량적평가 20점 + 정성적평가 70점\n        ※ 「지방자치단체 입찰시 낙찰자 결정기준(행정안전부 예규 제283호」 제7장 협상에 의한 계약체결기준의 <별표1>에 따라 정량적 평가 배점한도를 20점으로 함\n        ­정성적 평가는 고양도시관리공사에서 내·외부 전문가를 평가위원으로 위촉하여 평가기준에 따라 평가하며, 제안서평가위원회 구성과 관련하여서는 [참고] 고양도시관리공사 제안서평가위원회설치 및 운영에 관한 시행내규에 의함\n        ※ 정성적평가는 제안서 평가위원별 평가분야 합계점수 중에서 최고점수와 최저점수를 부여한 위원을 제외하고 나머지 위원의 평가점수를 합산"", ""4. 협상대상자 선정 및 협상 진행\n가. 협상적격자 선정\n      1) 제안서 평가결과 기술능력 평가 점수가 기술능력 평가분야 배점한도의 85%이상인 자를 협상적격자로 선정합니다. \n      2) 협상순서는 합산점수의 고득점순에 따라 결정하되 합산점수가 동일한 제안자가 2인 이상일 경우에는 기술능력 평가점수가 높은 제안자를 선순위자로 하고, 기술능력 평가점수도 동일한 경우에는 추첨으로 정합니다.\n      3) 본 입찰은 SW 관련 사업으로 입찰가격 평가시 해당 입찰가격이 예정가격의 100분의 80미만일 경우에는 배점한도의 30%에 해당하는 평점을 부여합니다.\n      4) 가격제안서(입찰서)의 입찰가격이 사업금액(추정가격에 부가가치세를 더한 금액)을 초과하는 자는 협상적격자에서 제외합니다.\n      5) 협상 순위에 따라 결정된 협상대상자와 협상을 하며, 협상이 성립된 때에는 다른 협상적격자와 협상을 실시하지 아니하고, 협상대상자와 협상이 성립되지 않으면 동일한 기준과 절차에 따라 순차적으로 차 순위 협상적격자와 협상을 실시합니다.\n      6) 협상적격자에 한하여 협상일시·장소를 개별통지하며, 협상대상에서 제외된 업체는 별도의 통지를 하지 않습니다.\n      7) 기타 평가 관련 사항은 「지방자치단체 입찰시 낙찰자 결정기준」 제7장 협상에 의한 계약체결 기준에 의합니다.\n나. 협상진행\n  1) 제안서 협상\n    ­ 협상대상자가 제안한 사업내용, 이행방법, 이행일정 등 제안서 내용을 대상으로 협상을 실시합니다.\n    ­ 협상대상자와 협상을 통해 제안서 내용 일부를 조정할 수 있습니다.\n  2) 가격협상\n    ­ 협상대상자와 가격협상 시 기준가격은 해당사업 추정가격에 부가가치세를 더한 금액(예정가격을 작성한 경우에는 예정가격) 이하로서 협상대상자가 제안한 가격으로 합니다. \n     ­ 협상대상자가 제안한 내용을 가감조정하는 경우에는 그 가감되는 내용에 상당하는 금액을 해당사업 추정가격에 부가가치세를 더한 금액(예정가격을 작성한 경우에는 예정가"", ""정성적 지표의 평가기준\n󰏚 평가항목 및 배점\n  정성적 평가의 평가항목 및 기준은 과학기술정보통신부 장관이 고시한 소프트웨어 기술성 평가기준 중 기술제안서 평가항목별 배점한도를 준용하되, 본 사업의 내용을 고려하여 아래와 같이 정함""]",,
C_rule_multi_route,1,고양도시관리공사_관산근린공원 다목적구장 홈페이지 및 회원 통합운영.hwp,central,이 사업의 과업기간과 무상하자보증기간은 어떻게 되나요?,과업기간: 착수일로부터 90일 이내; 무상하자보증기간: 준공일로부터 1년,"정성적 평가의 평가항목 및 기준은 과학기술정보통신부 장관이 고시한 소프트웨어 기술성 평가기준 중 기술제안서 평가항목별 배점한도를 준용하되, 본 사업의 내용을 고려하여 아래와 같이 정함","[""3. 제안서 설명회(제안업체 참석) 및 평가\n가. 제안서 발표\n  1) 일    시 : 2024. 9. 26.(목) 14:00 ~ 16:00(예정)\n  2) 장    소 : 경기 고양시 일산서구 중앙로 1601 고양종합운동장 중회의실\n      ※ 추진 일정은 사업추진 여건 등에 따라 변동 가능, 변경 시 별도안내\n  3) 평가시간 : 업체당 40분(제안설명 20분, 질의응답 10분, 평가 10분)\n  4) 발표순서 : 발표순서는 당일 추첨에 의하여 결정\n  5) 발표자료 : PPT 자료\n      ※ 발표자료는 제안서 제출시 함께 제출할 것\n      ※ 제안회사를 인식할 수 있는 일체의 표기 사용금지      \n나. 평가방법 및 항목별 배점 (※붙임3 참고)\n      1) 평가 주체 : 고양도시관리공사\n      2) 기술평가와 가격평가를 실시하여 종합평가점수로 산출\n        ­평가비율 : 기술능력평가(90%), 가격평가(10%)\n        ※ 「행정기관 및 공공기관 정보시스템 구축·운영 지침」 제18조(평가배점)의 규정에 따라 기술능력평가 배점한도를 90점으로 함\n        ­종합 평가점수 = 기술평가점수 + 입찰가격 평가점수 \n        ­평가점수에서 소수점 이하가 있는 경우 소수점 셋째자리에서 반올림\n      3) 기술평가 \n        ­기술평가 : 정량적평가 20점 + 정성적평가 70점\n        ※ 「지방자치단체 입찰시 낙찰자 결정기준(행정안전부 예규 제283호」 제7장 협상에 의한 계약체결기준의 <별표1>에 따라 정량적 평가 배점한도를 20점으로 함\n        ­정성적 평가는 고양도시관리공사에서 내·외부 전문가를 평가위원으로 위촉하여 평가기준에 따라 평가하며, 제안서평가위원회 구성과 관련하여서는 [참고] 고양도시관리공사 제안서평가위원회설치 및 운영에 관한 시행내규에 의함\n        ※ 정성적평가는 제안서 평가위원별 평가분야 합계점수 중에서 최고점수와 최저점수를 부여한 위원을 제외하고 나머지 위원의 평가점수를 합산"", ""4. 협상대상자 선정 및 협상 진행\n가. 협상적격자 선정\n      1) 제안서 평가결과 기술능력 평가 점수가 기술능력 평가분야 배점한도의 85%이상인 자를 협상적격자로 선정합니다. \n      2) 협상순서는 합산점수의 고득점순에 따라 결정하되 합산점수가 동일한 제안자가 2인 이상일 경우에는 기술능력 평가점수가 높은 제안자를 선순위자로 하고, 기술능력 평가점수도 동일한 경우에는 추첨으로 정합니다.\n      3) 본 입찰은 SW 관련 사업으로 입찰가격 평가시 해당 입찰가격이 예정가격의 100분의 80미만일 경우에는 배점한도의 30%에 해당하는 평점을 부여합니다.\n      4) 가격제안서(입찰서)의 입찰가격이 사업금액(추정가격에 부가가치세를 더한 금액)을 초과하는 자는 협상적격자에서 제외합니다.\n      5) 협상 순위에 따라 결정된 협상대상자와 협상을 하며, 협상이 성립된 때에는 다른 협상적격자와 협상을 실시하지 아니하고, 협상대상자와 협상이 성립되지 않으면 동일한 기준과 절차에 따라 순차적으로 차 순위 협상적격자와 협상을 실시합니다.\n      6) 협상적격자에 한하여 협상일시·장소를 개별통지하며, 협상대상에서 제외된 업체는 별도의 통지를 하지 않습니다.\n      7) 기타 평가 관련 사항은 「지방자치단체 입찰시 낙찰자 결정기준」 제7장 협상에 의한 계약체결 기준에 의합니다.\n나. 협상진행\n  1) 제안서 협상\n    ­ 협상대상자가 제안한 사업내용, 이행방법, 이행일정 등 제안서 내용을 대상으로 협상을 실시합니다.\n    ­ 협상대상자와 협상을 통해 제안서 내용 일부를 조정할 수 있습니다.\n  2) 가격협상\n    ­ 협상대상자와 가격협상 시 기준가격은 해당사업 추정가격에 부가가치세를 더한 금액(예정가격을 작성한 경우에는 예정가격) 이하로서 협상대상자가 제안한 가격으로 합니다. \n     ­ 협상대상자가 제안한 내용을 가감조정하는 경우에는 그 가감되는 내용에 상당하는 금액을 해당사업 추정가격에 부가가치세를 더한 금액(예정가격을 작성한 경우에는 예정가"", ""정성적 지표의 평가기준\n󰏚 평가항목 및 배점\n  정성적 평가의 평가항목 및 기준은 과학기술정보통신부 장관이 고시한 소프트웨어 기술성 평가기준 중 기술제안서 평가항목별 배점한도를 준용하되, 본 사업의 내용을 고려하여 아래와 같이 정함"", ""하여 산술평균한다. (최고 또는 최저 점수가 2개 이상인 경우 하나만 제외) \n        ※ 산술평균시 소수점 처리 방법 (소수점 셋째자리에서 반올림)\n다. 유의사항\n      1) 제출서류가 미비하거나, 심사에 필요한 내용 항목의 누락 등 구비서류가 불충분한 경우 심사 대상에서 제외될 수 있습니다.\n      2) 제안설명 불참 업체는 입찰참가등록을 취소합니다.\n      3) 공정한 심사를 위하여 제안평가위원회의 평가위원 명단은 사전에 공개하지 않으며, 제안서 발주사 기준에 의하여 평가합니다. 제안사는 이에 대해 일체의 이의를 제기할 수 없습니다.\n      4) 제안사는 제안서 제출 시 소속 직원 중 해당 사업을 수행할 사업책임자를 명시하여야 하며, 사업책임자가 설명 및 질의응답을 하여야 한다. 다만, 제안서 제출 이후 사업책임자의 퇴사, 질병 등 불가피한 사유가 있는 경우에는 설명 및 질의응답할 자를 발주기관의 승인을 받아 변경할 수 있습니다.\n      5) 제안서 설명 및 질의 답변시 ‘4’에 따른 대상자가 아닌 경우에는 제안사가 제출한 제안서만으로 평가한다.\n      6) 제안설명은 과업의 추진방안에 대한 제안서 내용을 설명하며, 제안서에 기재된 내용 이외의 의사표시는 인정하지 않습니다.\n      7) 제안서 발표 시 다른 제출자의 발표를 들을 수 없습니다.\n      8) 다음의 세부평가 방법에서 정하지 않은 사항은「지방자치단체 입찰 시 낙찰자 결정기준」(시행 행정안전부 예규 제283호, 2024.3.28. 일부개정)을 준용합니다.""]",,
A_single_pipeline,1,광주과학기술원_실시간통합연구비관리시스템(RCMS)  연계 모듈 변경 사업.hwp,central,이 사업의 계약방법(입찰방식)은 무엇인가?,제한경쟁 입찰(협상에 의한 계약 체결),계약방법 : 제한경쟁 입찰(협상에 의한 계약 체결),"[""1. 사업개요\n  가. 사 업 명 : 실시간통합연구비관리시스템(RCMS) 연계모듈 변경 사업\n  나. 사업기간 : 계약체결일로부터 3개월 이내\n      ※ 제안요청서 내 추진일정표 참조 \n  다. 사업비  :  54,450,000원(VAT 포함) \n  라. 계약방법 : 제한경쟁 입찰(협상에 의한 계약 체결)\n  마. 대금지급방법 \n     1) 선금 : 100분의50 (광주과학기술원 계약업무요령 제 47조 선급금지급)\n     2) 잔금 : 최종검수 완료시 지급\n   \n2. 사업배경\n가. 국가연구개발혁신법 시행(2021.1.1.)에 따라 연구 비목 및 세목이 변경됨으로써 연계 전송의 오류 발생\n나. ZEUS-RCMS간 연계 타입 구모듈에 대한 최신 모듈 적용으로 행정절차 간소화 필요\n다. 부가세 연구과제 관리를 위한 연계 전송 기능 개선 필요\n라. 연구비 집행(출장비, 회의비, 외부 전문기술 활용비) 건에 대한 세부사항 연계전송 개선사항 반영 필요"", ""4. 추진방안\n가. 대기업 참여 여부 : 대기업 참여제한 사업\n  ❍ 소프트웨어 진흥법 제48조 (중소 소프트웨어사업자의 사업참여 지원)에 따른 “대기업인 소프트웨어 사업자가 참여 할 수 있는 사업금액의 하한”고시(과학기술정보통신부고시 제2024-9호, 2024.2.28.) 준수\n나. 기술 대 가격 비율의 조정\n ❍ 기술평가와 가격평가를 실시하여 종합평가점수로 평가\n    - 평가비율 : 기술평가(90%), 가격평가(10%)\n    - 종합평가점수  = 기술평가점수 + 입찰가격 평가점수\n    - 협상에 의한 계약 체결시 기술 대 가격 배점기준 9:1로 적용\n다. 하도급 여부 : 하도급 사전 승인제\n  ❍ 하도급 사전승인\n     본 사업의 하도급의 경우 「소프트웨어 진흥법」 제51조제5항 및 「소프트웨어사업 계약 및 관리감독에 관한 지침」의 규정에 의하여 반드시 하도급계약 전에 발주기관으로부터 사전승인을 받아야 함\n  ❍ 하도급 비율제한\n     본 사업의 과업의 일부를 하도급하려는 경우 「소프트웨어 진흥법」 제51조제1항에 따라 물품(상용소프트웨어 포함) 구매금액을 제외한 소프트웨어사업금액의 100분의 50을 초과할 수 없으며, 같은 법 제3항에 따라 다시 하도급은 원칙적으로 불허함. 다만, 같은 법 제51조제2항 각 호 및 제3항 각 호에 해당하는 경우 그러하지 아니함\n  ❍ 하도급 계획서 제출 요청\n     본 사업 과업의 일부를 하도급하려는 경우 계약체결 시 「소프트웨어사업 계약 및 관리감독에 관한 지침」의 별지 제7호서식 소프트웨어사업 하도급 계획서(계약체결 시)를 제출하여야 함\n  ❍ 하도급 계약의 적정성 판단 세부기준 명시\n     하도급계약의 승인을 신청하는 경우, 「소프트웨어사업 계약 및 관리감독에 관한 지침」의 별표 3 [하도급계약의 적정성 판단 세부기준]에 따라 적정성여부를 판단하며, 평가점수가 85점 이상인 경우에 한하여 하도급계약을 승인함. 다만, 85점 이상인 경우라 하더라도 하도급 계약의 세부 조건 등으로 인하여 사업의 원활한 수행""]",,
B_rule_single_route,1,광주과학기술원_실시간통합연구비관리시스템(RCMS)  연계 모듈 변경 사업.hwp,central,이 사업의 계약방법(입찰방식)은 무엇인가?,제한경쟁 입찰(협상에 의한 계약 체결),※ SW 사업의 경우에는 해당 입찰가격이 추정가격의 100분의 80미만일 경우에는 배점한도의 30%에 해당하는 평점을 부여,"[""2. 제안서 평가방법\n  가. 평가방식\n   ❍ 제안서 평가는 제안 내용에 대하여 평가위원회를 구성하여 평가하고, 제안서에 기재되지 않은 사항은 평가하지 않는다. \n   ❍ 협상대상 업체를 선정하기 위한 평가는 총점을 100점으로 하고 기술능력평가의 비중을 100분의 90으로, 가격평가의 비중을 100분의 10으로 한다.\n      ※ 기술능력평가 점수는 계산 결과 소수점 셋째자리에서 반올림\n   ❍ 기술능력평가는 평가위원별로 제출된 제안서를 평가하여 “평가항목 및 배점”에 의거하여 실시한다.\n   ❍ 기술평가 기준 및 배점은 소프트웨어 기술성 평가 기준을 참고하되, 본 사업에 맞게 재구성한 기술평가표에 따른다.\n   ❍ 기술능력평가 중 기술제안서 평가항목 및 배점은 평가항목별로 최고점수와 최저점수를 준 위원의 점수를 제외하고, 나머지 위원의 평가점수 평균을 평가 점수로 한다.\n   ❍ 가격평가는 ｢협상에 의한 계약체결기준｣ (기획재정부 계약예규)을 기준으로 함\n       - 입찰가격 평점산식\n         ⚬ 입찰가격을 추정가격의 100분의 80 이상으로 입찰한 자\n                    \n       ※ SW 사업의 경우에는 해당 입찰가격이 추정가격의 100분의 80미만일 경우에는 배점한도의 30%에 해당하는 평점을 부여.\n      ※ 입찰가격 평가시 사업예산으로 하는 경우에는 추정가격에 부가가치세를 포함하여 적용하고, 예정가격을 작성한 경우에는 추정가격을 예정가격으로 적용\n   ❍ 제안 가격부분은 각 항목별 세부비용을 구분하여 제안토록 하고 금액에 대한 산출근거 및 기준을 부가가치세를 포함하여 구체적으로 제시하여야 한다.\n   ❍ 제안사는 제안서, 평가방법 또는 선정 결과에 대해 이의를 제기할 수 없으며, 제안서 평가결과의 세부내용 및 협상결과는 공개하지 않는다.\n  나. 협상기준\n   ❍ 제안서 평가결과 기술능력평가 점수가 기술능력평가 분야 배점한도의 85%이상인 제안사를 협상적격으로 선정한다.\n   ❍ 종합평가점수(기술능력평가+가격평"", ""4. 추진방안\n가. 대기업 참여 여부 : 대기업 참여제한 사업\n  ❍ 소프트웨어 진흥법 제48조 (중소 소프트웨어사업자의 사업참여 지원)에 따른 “대기업인 소프트웨어 사업자가 참여 할 수 있는 사업금액의 하한”고시(과학기술정보통신부고시 제2024-9호, 2024.2.28.) 준수\n나. 기술 대 가격 비율의 조정\n ❍ 기술평가와 가격평가를 실시하여 종합평가점수로 평가\n    - 평가비율 : 기술평가(90%), 가격평가(10%)\n    - 종합평가점수  = 기술평가점수 + 입찰가격 평가점수\n    - 협상에 의한 계약 체결시 기술 대 가격 배점기준 9:1로 적용\n다. 하도급 여부 : 하도급 사전 승인제\n  ❍ 하도급 사전승인\n     본 사업의 하도급의 경우 「소프트웨어 진흥법」 제51조제5항 및 「소프트웨어사업 계약 및 관리감독에 관한 지침」의 규정에 의하여 반드시 하도급계약 전에 발주기관으로부터 사전승인을 받아야 함\n  ❍ 하도급 비율제한\n     본 사업의 과업의 일부를 하도급하려는 경우 「소프트웨어 진흥법」 제51조제1항에 따라 물품(상용소프트웨어 포함) 구매금액을 제외한 소프트웨어사업금액의 100분의 50을 초과할 수 없으며, 같은 법 제3항에 따라 다시 하도급은 원칙적으로 불허함. 다만, 같은 법 제51조제2항 각 호 및 제3항 각 호에 해당하는 경우 그러하지 아니함\n  ❍ 하도급 계획서 제출 요청\n     본 사업 과업의 일부를 하도급하려는 경우 계약체결 시 「소프트웨어사업 계약 및 관리감독에 관한 지침」의 별지 제7호서식 소프트웨어사업 하도급 계획서(계약체결 시)를 제출하여야 함\n  ❍ 하도급 계약의 적정성 판단 세부기준 명시\n     하도급계약의 승인을 신청하는 경우, 「소프트웨어사업 계약 및 관리감독에 관한 지침」의 별표 3 [하도급계약의 적정성 판단 세부기준]에 따라 적정성여부를 판단하며, 평가점수가 85점 이상인 경우에 한하여 하도급계약을 승인함. 다만, 85점 이상인 경우라 하더라도 하도급 계약의 세부 조건 등으로 인하여 사업의 원활한 수행"", ""가) 고득점 순으로 협상대상자 후보를 선정하며, 후보 중 가장 점수가 높은 업체를 우선 협상대상자로 선정한다.\n   ❍ 종합평가 점수가 동일한 경우에는 기술능력 평가점수가 높은 제안사를 선순위자로 하고, 기술능력 평가점수도 동일한 경우에는 기술능력의 세부평가항목 중 배점이 큰 항목에서 높은 점수를 얻은 제안사를 선순위로 한다.\n   ❍ 상위 순위업체와 협상결과 협의가 이루어지면 하위 순위업체와의 협상은 생략한다.\n   ❍ 협상대상 업체 선정결과는 서면으로 통보하며, 미선정업체에 대한 통보는 생략한다.\n   ❍ 협상이 결렬되면 동일한 기준과 절차에 의해 차 순위 협상대상 업체와 협상을 실시한다.\n   ❍ 협상적격자가 없거나 모든 협상대상자와 협상 결렬시 재공고 입찰에 부칠 수 있다.\n   ❍ 협상대상자가 제안한 사업내용 중 수정, 보완, 변경이 필요한 경우 협상을 통해 그 내용의 일부를 조정할 수 있다.""]",,
C_rule_multi_route,1,광주과학기술원_실시간통합연구비관리시스템(RCMS)  연계 모듈 변경 사업.hwp,central,이 사업의 계약방법(입찰방식)은 무엇인가?,제한경쟁 입찰(협상에 의한 계약 체결),※ SW 사업의 경우에는 해당 입찰가격이 추정가격의 100분의 80미만일 경우에는 배점한도의 30%에 해당하는 평점을 부여,"[""2. 제안서 평가방법\n  가. 평가방식\n   ❍ 제안서 평가는 제안 내용에 대하여 평가위원회를 구성하여 평가하고, 제안서에 기재되지 않은 사항은 평가하지 않는다. \n   ❍ 협상대상 업체를 선정하기 위한 평가는 총점을 100점으로 하고 기술능력평가의 비중을 100분의 90으로, 가격평가의 비중을 100분의 10으로 한다.\n      ※ 기술능력평가 점수는 계산 결과 소수점 셋째자리에서 반올림\n   ❍ 기술능력평가는 평가위원별로 제출된 제안서를 평가하여 “평가항목 및 배점”에 의거하여 실시한다.\n   ❍ 기술평가 기준 및 배점은 소프트웨어 기술성 평가 기준을 참고하되, 본 사업에 맞게 재구성한 기술평가표에 따른다.\n   ❍ 기술능력평가 중 기술제안서 평가항목 및 배점은 평가항목별로 최고점수와 최저점수를 준 위원의 점수를 제외하고, 나머지 위원의 평가점수 평균을 평가 점수로 한다.\n   ❍ 가격평가는 ｢협상에 의한 계약체결기준｣ (기획재정부 계약예규)을 기준으로 함\n       - 입찰가격 평점산식\n         ⚬ 입찰가격을 추정가격의 100분의 80 이상으로 입찰한 자\n                    \n       ※ SW 사업의 경우에는 해당 입찰가격이 추정가격의 100분의 80미만일 경우에는 배점한도의 30%에 해당하는 평점을 부여.\n      ※ 입찰가격 평가시 사업예산으로 하는 경우에는 추정가격에 부가가치세를 포함하여 적용하고, 예정가격을 작성한 경우에는 추정가격을 예정가격으로 적용\n   ❍ 제안 가격부분은 각 항목별 세부비용을 구분하여 제안토록 하고 금액에 대한 산출근거 및 기준을 부가가치세를 포함하여 구체적으로 제시하여야 한다.\n   ❍ 제안사는 제안서, 평가방법 또는 선정 결과에 대해 이의를 제기할 수 없으며, 제안서 평가결과의 세부내용 및 협상결과는 공개하지 않는다.\n  나. 협상기준\n   ❍ 제안서 평가결과 기술능력평가 점수가 기술능력평가 분야 배점한도의 85%이상인 제안사를 협상적격으로 선정한다.\n   ❍ 종합평가점수(기술능력평가+가격평"", ""4. 추진방안\n가. 대기업 참여 여부 : 대기업 참여제한 사업\n  ❍ 소프트웨어 진흥법 제48조 (중소 소프트웨어사업자의 사업참여 지원)에 따른 “대기업인 소프트웨어 사업자가 참여 할 수 있는 사업금액의 하한”고시(과학기술정보통신부고시 제2024-9호, 2024.2.28.) 준수\n나. 기술 대 가격 비율의 조정\n ❍ 기술평가와 가격평가를 실시하여 종합평가점수로 평가\n    - 평가비율 : 기술평가(90%), 가격평가(10%)\n    - 종합평가점수  = 기술평가점수 + 입찰가격 평가점수\n    - 협상에 의한 계약 체결시 기술 대 가격 배점기준 9:1로 적용\n다. 하도급 여부 : 하도급 사전 승인제\n  ❍ 하도급 사전승인\n     본 사업의 하도급의 경우 「소프트웨어 진흥법」 제51조제5항 및 「소프트웨어사업 계약 및 관리감독에 관한 지침」의 규정에 의하여 반드시 하도급계약 전에 발주기관으로부터 사전승인을 받아야 함\n  ❍ 하도급 비율제한\n     본 사업의 과업의 일부를 하도급하려는 경우 「소프트웨어 진흥법」 제51조제1항에 따라 물품(상용소프트웨어 포함) 구매금액을 제외한 소프트웨어사업금액의 100분의 50을 초과할 수 없으며, 같은 법 제3항에 따라 다시 하도급은 원칙적으로 불허함. 다만, 같은 법 제51조제2항 각 호 및 제3항 각 호에 해당하는 경우 그러하지 아니함\n  ❍ 하도급 계획서 제출 요청\n     본 사업 과업의 일부를 하도급하려는 경우 계약체결 시 「소프트웨어사업 계약 및 관리감독에 관한 지침」의 별지 제7호서식 소프트웨어사업 하도급 계획서(계약체결 시)를 제출하여야 함\n  ❍ 하도급 계약의 적정성 판단 세부기준 명시\n     하도급계약의 승인을 신청하는 경우, 「소프트웨어사업 계약 및 관리감독에 관한 지침」의 별표 3 [하도급계약의 적정성 판단 세부기준]에 따라 적정성여부를 판단하며, 평가점수가 85점 이상인 경우에 한하여 하도급계약을 승인함. 다만, 85점 이상인 경우라 하더라도 하도급 계약의 세부 조건 등으로 인하여 사업의 원활한 수행"", ""가) 고득점 순으로 협상대상자 후보를 선정하며, 후보 중 가장 점수가 높은 업체를 우선 협상대상자로 선정한다.\n   ❍ 종합평가 점수가 동일한 경우에는 기술능력 평가점수가 높은 제안사를 선순위자로 하고, 기술능력 평가점수도 동일한 경우에는 기술능력의 세부평가항목 중 배점이 큰 항목에서 높은 점수를 얻은 제안사를 선순위로 한다.\n   ❍ 상위 순위업체와 협상결과 협의가 이루어지면 하위 순위업체와의 협상은 생략한다.\n   ❍ 협상대상 업체 선정결과는 서면으로 통보하며, 미선정업체에 대한 통보는 생략한다.\n   ❍ 협상이 결렬되면 동일한 기준과 절차에 의해 차 순위 협상대상 업체와 협상을 실시한다.\n   ❍ 협상적격자가 없거나 모든 협상대상자와 협상 결렬시 재공고 입찰에 부칠 수 있다.\n   ❍ 협상대상자가 제안한 사업내용 중 수정, 보완, 변경이 필요한 경우 협상을 통해 그 내용의 일부를 조정할 수 있다."", ""나. 정량적(계량)평가 세부기준(10점)\n ※ [별표1] 참고\n4. 입찰서류 및 제안서 제출\n  가. 제출서류 \n 1) 제안서 제출공문서 및 하기서류 각 1부. \n ※ 제출자가 대표가 아닌 경우, 위임장 및 재직증명서 각 1 부 포함\n    - 입찰참가신청서(소정양식) 1부.\n    - 법인등기부 등본(개인인 경우 주민등록등본) 1부\n    - 사업자등록증 사본(원본 대조필) \n 2) 입찰보증서류(입찰이행보증보험증권 등) 1부\n ※ 금액은 입찰금액의 2.5/100이상으로 하며, 보증기간은 입찰서 제출마감일 이전부터 입찰서 제출마감일 다음날부터 30일 이후로 할 것 \n 3) 소프트웨어 사업자 신고서(원본 대조필) 사본 1부 및 직접생산확인증명서 각 1부\n 4) 중소기업확인서 1부\n 5) 인감증명서 및 사용인감계 1부\n 6) 국세 및 지방세 완납증명서 1부\n 7) 행정처분내용 1부 \n 8) 청렴계약 이행각서 1부\n 9) 가격제안서(본원 양식) 1부 (밀봉 날인하여 제출)\n 10) 제안서 USB 1개(관리용 파일 1부, 평가용 파일 1부) \n    * 관리용 파일은 제안사 구분 가능토록 표지에 표기 제출, \n    * 평가용 파일은 제안사를 알 수 있는 모든 기록과 제안사 표기를 삭제하여 제출,     이를 따르지 않을시 1건당 1점씩 감점처리 함\n 11) 기타 제안 관련 서식에 근거한 관련서류 일체\n         *  하도급 계약승인 신청서(해당시) 1부 \n         *  공동수급협정서 관련 양식 일체(공동수급의 경우에 한함) \n   나. 제안서 포함사항\n     1) 제안업체의 일반현황 및 연혁\n        * 참여인력의 개인정보 수집･이용･제공 동의서 포함 <서식 제13호>\n     2) 주요사업실적 (참고용)\n     3) 최근 3개년도의 자본금 및 매출액 현황(재무제표 증명원 등)\n        ※ 입찰참가신청 서류와 평가서류는 구분하여 제출\n        ※ 별도의 첨부 양식이 없는 사항에 대해서는 제안사의 자율 형식에 의함\n        ※ 제""]",,
A_single_pipeline,1,광주과학기술원_학사시스템 기능개선 사업.hwp,central,이 사업의 입찰방식(계약방법)은 무엇인가요?,공개경쟁입찰(협상에 의한 계약체결),계약방법 : 공개경쟁입찰(협상에 의한 계약체결),"[""라. 계약방법 : 공개경쟁입찰(협상에 의한 계약체결)\n  마. 대금지급방법 \n     1) 선금 : 100분의50 (광주과학기술원 계약업무요령 제 47조 선급금지급)\n     2) 잔금 : 최종검수 완료시 지급\n  바. 기타 : 공동수급불가\n   \n2. 사업배경\n가. GIST 학사조직 개편에 따른 후속 조치 필요\n나. 학위 연계 과정 신설 및 대학원 과정 구분 변경에 따른 시스템 개선 필요"", ""4. 추진방안\n가. 대기업 참여 여부 : 대기업 참여제한 사업\n  ❍ 소프트웨어진흥법 제48조(중소 소프트웨어사업자의 사업참여 지원)에 따른 “중소 소프트웨어사업자의 사업 참여 지원에 관한 지침”(과학기술정보통신부고시 제2024-36호, 2024.09.05.) 준수\n나. 기술 대 가격 비율의 조정\n ❍ 기술평가와 가격평가를 실시하여 종합평가점수로 평가\n    - 평가비율 : 기술평가(90%), 가격평가(10%)\n    - 종합평가점수  = 기술평가점수 + 입찰가격 평가점수\n    - 협상에 의한 계약 체결시 기술 대 가격 배점기준 9:1로 적용\n다. 하도급 여부 : 하도급 사전 승인제\n  ❍ 하도급 사전승인\n     본 사업의 하도급의 경우「소프트웨어진흥법」제51조 및「소프트웨어사업의 계약 및 관리감독에 관한 지침」(과학기술정보통신부 고시 제2023-15호)의 규정에 의하여 반드시 하도급계약 전에 발주기관으로부터 사전승인을 받아야 함\n  ❍ 하도급 비율제한\n     본 사업의 과업의 일부를 하도급하려는 경우 「소프트웨어진흥법」 제51조의제1항에 따라 사업금액의 100분의 50을 초과할 수 없으며, 제3항에 따라 재하도급은 원칙적으로 불허함. 다만, 같은 법 제51조의제2항제1호 및 제2호 각 호에 해당하는 경우 그러하지 아니함\n  ❍ 하도급 계획서 제출 요청\n     본 사업 과업의 일부를 하도급하려는 경우 입찰 시 및 계약체결 시 「소프트웨어사업 계약 및 관리 감독에 관한 지침」(과학기술정보통신부 고시 제2023-15호, 2023. 5. 15.)의 별지 서식 제7호 서식의 소프트웨어사업 하도급계획서를 제출하여야 함\n  ❍ 하도급 계약의 적정성 판단 세부기준 명시\n     하도급계약의 승인을 신청하는 경우,「소프트웨어사업 계약 및 관리 감독에 관한 지침」에 따른 [하도급계약의 적정성 판단 세부기준]에 따라 적정성여부를 판단하며, 평가점수가 85점 이상인 경우에 한하여 하도급계약을 승인함. 다만, 85점 이상인 경우라 하더라도 하도급 계약의 세부 조건 등으로 인""]",,
B_rule_single_route,1,광주과학기술원_학사시스템 기능개선 사업.hwp,central,이 사업의 입찰방식(계약방법)은 무엇인가요?,공개경쟁입찰(협상에 의한 계약체결),※ SW 사업의 경우에는 해당 입찰가격이 추정가격의 100분의 80미만일 경우에는 배점한도의 30%에 해당하는 평점을 부여,"[""2. 제안서 평가방법\n  가. 평가방식\n   ❍ 제안서 평가는 제안 내용에 대하여 평가위원회를 구성하여 평가하고, 제안서에 기재되지 않은 사항은 평가하지 않는다. \n   ❍ 협상대상 업체를 선정하기 위한 평가는 총점을 100점으로 하고 기술능력평가의 비중을 100분의 90으로, 가격평가의 비중을 100분의 10으로 한다.\n      ※ 기술능력평가 점수는 계산 결과 소수점 셋째자리에서 반올림\n   ❍ 기술능력평가는 평가위원별로 제출된 제안서를 평가하여 “평가항목 및 배점”에 의거하여 실시한다.\n   ❍ 기술평가 기준 및 배점은 소프트웨어 기술성 평가 기준을 참고하되, 본 사업에 맞게 재구성한 기술평가표에 따른다.\n   ❍ 기술능력평가 중 기술제안서 평가항목 및 배점은 평가항목별로 최고점수와 최저점수를 준 위원의 점수를 제외하고, 나머지 위원의 평가점수 평균을 평가 점수로 한다.\n   ❍ 가격평가는 ｢협상에 의한 계약체결기준｣ (기획재정부 계약예규)을 기준으로 함\n       - 입찰가격 평점산식\n         ⚬ 입찰가격을 추정가격의 100분의 80 이상으로 입찰한 자\n                    \n       ※ SW 사업의 경우에는 해당 입찰가격이 추정가격의 100분의 80미만일 경우에는 배점한도의 30%에 해당하는 평점을 부여.\n      ※ 입찰가격 평가시 사업예산으로 하는 경우에는 추정가격에 부가가치세를 포함하여 적용하고, 예정가격을 작성한 경우에는 추정가격을 예정가격으로 적용\n   ❍ 제안 가격부분은 각 항목별 세부비용을 구분하여 제안토록 하고 금액에 대한 산출근거 및 기준을 부가가치세를 포함하여 구체적으로 제시하여야 한다.\n   ❍ 제안사는 제안서, 평가방법 또는 선정 결과에 대해 이의를 제기할 수 없으며, 제안서 평가결과의 세부내용 및 협상결과는 공개하지 않는다.\n  나. 협상기준\n   ❍ 제안서 평가결과 기술능력평가 점수가 기술능력평가 분야 배점한도의 85%이상인 제안사를 협상적격으로 선정한다.\n   ❍ 종합평가점수(기술능력평가+가격평"", ""4. 추진방안\n가. 대기업 참여 여부 : 대기업 참여제한 사업\n  ❍ 소프트웨어진흥법 제48조(중소 소프트웨어사업자의 사업참여 지원)에 따른 “중소 소프트웨어사업자의 사업 참여 지원에 관한 지침”(과학기술정보통신부고시 제2024-36호, 2024.09.05.) 준수\n나. 기술 대 가격 비율의 조정\n ❍ 기술평가와 가격평가를 실시하여 종합평가점수로 평가\n    - 평가비율 : 기술평가(90%), 가격평가(10%)\n    - 종합평가점수  = 기술평가점수 + 입찰가격 평가점수\n    - 협상에 의한 계약 체결시 기술 대 가격 배점기준 9:1로 적용\n다. 하도급 여부 : 하도급 사전 승인제\n  ❍ 하도급 사전승인\n     본 사업의 하도급의 경우「소프트웨어진흥법」제51조 및「소프트웨어사업의 계약 및 관리감독에 관한 지침」(과학기술정보통신부 고시 제2023-15호)의 규정에 의하여 반드시 하도급계약 전에 발주기관으로부터 사전승인을 받아야 함\n  ❍ 하도급 비율제한\n     본 사업의 과업의 일부를 하도급하려는 경우 「소프트웨어진흥법」 제51조의제1항에 따라 사업금액의 100분의 50을 초과할 수 없으며, 제3항에 따라 재하도급은 원칙적으로 불허함. 다만, 같은 법 제51조의제2항제1호 및 제2호 각 호에 해당하는 경우 그러하지 아니함\n  ❍ 하도급 계획서 제출 요청\n     본 사업 과업의 일부를 하도급하려는 경우 입찰 시 및 계약체결 시 「소프트웨어사업 계약 및 관리 감독에 관한 지침」(과학기술정보통신부 고시 제2023-15호, 2023. 5. 15.)의 별지 서식 제7호 서식의 소프트웨어사업 하도급계획서를 제출하여야 함\n  ❍ 하도급 계약의 적정성 판단 세부기준 명시\n     하도급계약의 승인을 신청하는 경우,「소프트웨어사업 계약 및 관리 감독에 관한 지침」에 따른 [하도급계약의 적정성 판단 세부기준]에 따라 적정성여부를 판단하며, 평가점수가 85점 이상인 경우에 한하여 하도급계약을 승인함. 다만, 85점 이상인 경우라 하더라도 하도급 계약의 세부 조건 등으로 인"", ""가) 고득점 순으로 협상대상자 후보를 선정하며, 후보 중 가장 점수가 높은 업체를 우선 협상대상자로 선정한다.\n   ❍ 종합평가 점수가 동일한 경우에는 기술능력 평가점수가 높은 제안사를 선순위자로 하고, 기술능력 평가점수도 동일한 경우에는 기술능력의 세부평가항목 중 배점이 큰 항목에서 높은 점수를 얻은 제안사를 선순위로 한다.\n   ❍ 상위 순위업체와 협상결과 협의가 이루어지면 하위 순위업체와의 협상은 생략한다.\n   ❍ 협상대상 업체 선정결과는 서면으로 통보하며, 미선정업체에 대한 통보는 생략한다.\n   ❍ 협상이 결렬되면 동일한 기준과 절차에 의해 차 순위 협상대상 업체와 협상을 실시한다.\n   ❍ 협상적격자가 없거나 모든 협상대상자와 협상 결렬시 재공고 입찰에 부칠 수 있다.\n   ❍ 협상대상자가 제안한 사업내용 중 수정, 보완, 변경이 필요한 경우 협상을 통해 그 내용의 일부를 조정할 수 있다.""]",,
C_rule_multi_route,1,광주과학기술원_학사시스템 기능개선 사업.hwp,central,이 사업의 입찰방식(계약방법)은 무엇인가요?,공개경쟁입찰(협상에 의한 계약체결),※ SW 사업의 경우에는 해당 입찰가격이 추정가격의 100분의 80미만일 경우에는 배점한도의 30%에 해당하는 평점을 부여,"[""2. 제안서 평가방법\n  가. 평가방식\n   ❍ 제안서 평가는 제안 내용에 대하여 평가위원회를 구성하여 평가하고, 제안서에 기재되지 않은 사항은 평가하지 않는다. \n   ❍ 협상대상 업체를 선정하기 위한 평가는 총점을 100점으로 하고 기술능력평가의 비중을 100분의 90으로, 가격평가의 비중을 100분의 10으로 한다.\n      ※ 기술능력평가 점수는 계산 결과 소수점 셋째자리에서 반올림\n   ❍ 기술능력평가는 평가위원별로 제출된 제안서를 평가하여 “평가항목 및 배점”에 의거하여 실시한다.\n   ❍ 기술평가 기준 및 배점은 소프트웨어 기술성 평가 기준을 참고하되, 본 사업에 맞게 재구성한 기술평가표에 따른다.\n   ❍ 기술능력평가 중 기술제안서 평가항목 및 배점은 평가항목별로 최고점수와 최저점수를 준 위원의 점수를 제외하고, 나머지 위원의 평가점수 평균을 평가 점수로 한다.\n   ❍ 가격평가는 ｢협상에 의한 계약체결기준｣ (기획재정부 계약예규)을 기준으로 함\n       - 입찰가격 평점산식\n         ⚬ 입찰가격을 추정가격의 100분의 80 이상으로 입찰한 자\n                    \n       ※ SW 사업의 경우에는 해당 입찰가격이 추정가격의 100분의 80미만일 경우에는 배점한도의 30%에 해당하는 평점을 부여.\n      ※ 입찰가격 평가시 사업예산으로 하는 경우에는 추정가격에 부가가치세를 포함하여 적용하고, 예정가격을 작성한 경우에는 추정가격을 예정가격으로 적용\n   ❍ 제안 가격부분은 각 항목별 세부비용을 구분하여 제안토록 하고 금액에 대한 산출근거 및 기준을 부가가치세를 포함하여 구체적으로 제시하여야 한다.\n   ❍ 제안사는 제안서, 평가방법 또는 선정 결과에 대해 이의를 제기할 수 없으며, 제안서 평가결과의 세부내용 및 협상결과는 공개하지 않는다.\n  나. 협상기준\n   ❍ 제안서 평가결과 기술능력평가 점수가 기술능력평가 분야 배점한도의 85%이상인 제안사를 협상적격으로 선정한다.\n   ❍ 종합평가점수(기술능력평가+가격평"", ""4. 추진방안\n가. 대기업 참여 여부 : 대기업 참여제한 사업\n  ❍ 소프트웨어진흥법 제48조(중소 소프트웨어사업자의 사업참여 지원)에 따른 “중소 소프트웨어사업자의 사업 참여 지원에 관한 지침”(과학기술정보통신부고시 제2024-36호, 2024.09.05.) 준수\n나. 기술 대 가격 비율의 조정\n ❍ 기술평가와 가격평가를 실시하여 종합평가점수로 평가\n    - 평가비율 : 기술평가(90%), 가격평가(10%)\n    - 종합평가점수  = 기술평가점수 + 입찰가격 평가점수\n    - 협상에 의한 계약 체결시 기술 대 가격 배점기준 9:1로 적용\n다. 하도급 여부 : 하도급 사전 승인제\n  ❍ 하도급 사전승인\n     본 사업의 하도급의 경우「소프트웨어진흥법」제51조 및「소프트웨어사업의 계약 및 관리감독에 관한 지침」(과학기술정보통신부 고시 제2023-15호)의 규정에 의하여 반드시 하도급계약 전에 발주기관으로부터 사전승인을 받아야 함\n  ❍ 하도급 비율제한\n     본 사업의 과업의 일부를 하도급하려는 경우 「소프트웨어진흥법」 제51조의제1항에 따라 사업금액의 100분의 50을 초과할 수 없으며, 제3항에 따라 재하도급은 원칙적으로 불허함. 다만, 같은 법 제51조의제2항제1호 및 제2호 각 호에 해당하는 경우 그러하지 아니함\n  ❍ 하도급 계획서 제출 요청\n     본 사업 과업의 일부를 하도급하려는 경우 입찰 시 및 계약체결 시 「소프트웨어사업 계약 및 관리 감독에 관한 지침」(과학기술정보통신부 고시 제2023-15호, 2023. 5. 15.)의 별지 서식 제7호 서식의 소프트웨어사업 하도급계획서를 제출하여야 함\n  ❍ 하도급 계약의 적정성 판단 세부기준 명시\n     하도급계약의 승인을 신청하는 경우,「소프트웨어사업 계약 및 관리 감독에 관한 지침」에 따른 [하도급계약의 적정성 판단 세부기준]에 따라 적정성여부를 판단하며, 평가점수가 85점 이상인 경우에 한하여 하도급계약을 승인함. 다만, 85점 이상인 경우라 하더라도 하도급 계약의 세부 조건 등으로 인"", ""가) 고득점 순으로 협상대상자 후보를 선정하며, 후보 중 가장 점수가 높은 업체를 우선 협상대상자로 선정한다.\n   ❍ 종합평가 점수가 동일한 경우에는 기술능력 평가점수가 높은 제안사를 선순위자로 하고, 기술능력 평가점수도 동일한 경우에는 기술능력의 세부평가항목 중 배점이 큰 항목에서 높은 점수를 얻은 제안사를 선순위로 한다.\n   ❍ 상위 순위업체와 협상결과 협의가 이루어지면 하위 순위업체와의 협상은 생략한다.\n   ❍ 협상대상 업체 선정결과는 서면으로 통보하며, 미선정업체에 대한 통보는 생략한다.\n   ❍ 협상이 결렬되면 동일한 기준과 절차에 의해 차 순위 협상대상 업체와 협상을 실시한다.\n   ❍ 협상적격자가 없거나 모든 협상대상자와 협상 결렬시 재공고 입찰에 부칠 수 있다.\n   ❍ 협상대상자가 제안한 사업내용 중 수정, 보완, 변경이 필요한 경우 협상을 통해 그 내용의 일부를 조정할 수 있다."", ""4. 입찰서류 및 제안서 제출\n  가. 제출서류 \n 1) 제안서 제출공문서 및 하기서류 각 1부. \n ※ 제출자가 대표가 아닌 경우, 위임장 및 재직증명서 각 1 부 포함\n    - 입찰참가신청서(소정양식, 입찰참가신청서의 입찰보증금란에 해당금액을 꼭 기록) 1부.\n    - 법인등기부 등본(개인인 경우 주민등록등본) 1부\n    - 사업자등록증 사본(원본 대조필) \n 2) 입찰보증서류(입찰이행보증보험증권 등) 1부\n ※ 금액은 입찰금액의 2.5/100이상으로 하며, 보증기간은 입찰서 제출마감일 이전부터 입찰서 제출마감일 다음날부터 30일 이후로 할 것 \n 3) 소프트웨어 사업자 신고서(원본 대조필) 사본 1부 및 직접생산확인증명서 각 1부\n 4) 중소기업확인서 1부\n 5) 인감증명서 및 사용인감계 1부\n 6) 국세 및 지방세 완납증명서 1부\n 7) 행정처분내용 1부 \n 8) 청렴계약 이행각서 1부\n 9) 가격제안서(본원 양식) 1부 (밀봉 날인하여 제출)\n 10) 제안서 USB 1개(관리용 파일 1부, 평가용 파일 1부) \n    * 관리용 파일은 제안사 구분 가능토록 표지에 표기 제출, \n    * 평가용 파일은 제안사를 알 수 있는 모든 기록과 제안사 표기를 삭제하여 제출,     이를 따르지 않을시 1건당 1점씩 감점처리 함\n 11) 기타 제안 관련 서식에 근거한 관련서류 일체\n   나. 제안서 포함사항\n     1) 제안업체의 일반현황 및 연혁\n     2) 주요사업실적 \n     3) 최근 3개년도의 자본금 및 매출액 현황(재무제표 증명원 등)\n        ※ 입찰참가신청 서류와 평가서류는 구분하여 제출\n        ※ 별도의 첨부 양식이 없는 사항에 대해서는 제안사의 자율 형식에 의함\n        ※ 제출 시 인감 또는 사용 인감 지참\n        ※ 제안서 제출 시 “별표3-제안서 계량평가 요약서” 첨부\n5. 제안서 평가\n   가. 제안서 평가 방식 : 서면평가 진행\n   나. 유의사항\n     1) 발표자료가 제안서와 상이한 사항이 있는""]",,
A_single_pipeline,1,국가과학기술지식정보서비스_통합정보시스템 고도화 용역.hwp,central,공동수급체(공동이행방식) 형태의 참가가 허용되나요?,공동수급체(공동이행방식)형태의 참가를 불허함,□ 공동수급체(공동이행방식)형태의 참가를 불허함,"[""□ 공동수급체(공동이행방식)형태의 참가를 불허함\n □ 본 사업은 하도급을 불허함""]",,
B_rule_single_route,1,국가과학기술지식정보서비스_통합정보시스템 고도화 용역.hwp,central,공동수급체(공동이행방식) 형태의 참가가 허용되나요?,공동수급체(공동이행방식)형태의 참가를 불허함,□ 공동수급체(공동이행방식)형태의 참가를 불허함,"[""ㅇ 제안서 발표는 제안서 제출 순서로 진행하며 제안서 발표는 발표(20분) 질문(10분)으로 제한함\n  ㅇ 본 용역사업에 대한 평가는 기술점수(90점)를 기준으로 동 점수의 일정한 비율(85%) 이상인 업체를 협상대상 후보자로 선정하고 선정된 협상대상 후보자에 대하여 가격평가를 실시하여 기술평가점수와 가격평가점수를 합한 점수의 고득점 순으로 협상대상자를 선정하며, 협상대상자 중 가장 점수가 높은 자를 우선협상대상자로 선정함\n  ㅇ 평가결과는 공개하지 않는 것을 원칙으로 하며, 제안사는 기술평가 결과에 대해 일체의 이의를 제기 할 수 없음"", ""ㅇ 제안서 평가결과 기술능력 평가점수가 기술능력 평가분야 배점한도의 85% 이상인 제안사를 협상적격자로 선정하며,"", ""□ 공동수급체(공동이행방식)형태의 참가를 불허함\n □ 본 사업은 하도급을 불허함""]",,
C_rule_multi_route,1,국가과학기술지식정보서비스_통합정보시스템 고도화 용역.hwp,central,공동수급체(공동이행방식) 형태의 참가가 허용되나요?,공동수급체(공동이행방식)형태의 참가를 불허함,□ 공동수급체(공동이행방식)형태의 참가를 불허함,"[""ㅇ 제안서 발표는 제안서 제출 순서로 진행하며 제안서 발표는 발표(20분) 질문(10분)으로 제한함\n  ㅇ 본 용역사업에 대한 평가는 기술점수(90점)를 기준으로 동 점수의 일정한 비율(85%) 이상인 업체를 협상대상 후보자로 선정하고 선정된 협상대상 후보자에 대하여 가격평가를 실시하여 기술평가점수와 가격평가점수를 합한 점수의 고득점 순으로 협상대상자를 선정하며, 협상대상자 중 가장 점수가 높은 자를 우선협상대상자로 선정함\n  ㅇ 평가결과는 공개하지 않는 것을 원칙으로 하며, 제안사는 기술평가 결과에 대해 일체의 이의를 제기 할 수 없음"", ""ㅇ 제안서 평가결과 기술능력 평가점수가 기술능력 평가분야 배점한도의 85% 이상인 제안사를 협상적격자로 선정하며,"", ""□ 공동수급체(공동이행방식)형태의 참가를 불허함\n □ 본 사업은 하도급을 불허함"", ""ㅇ 본 사업은 소프트웨어 진흥법 제50조, 같은 법 시행령 제47조 제1항 제2호, 제3호에 따른 과업내용 변경 및 그에 따른 계약금액ㆍ계약기간 조정이 필요한 경우, 계약상대자는 소프트웨어사업 과업변경요청서를 제출하여야 함\n □ 소프트웨어사업 영향평가 제외대상 사업""]",,
A_single_pipeline,1,국가철도공단_철도인프라 디지털트윈 정보화전략계획(ISP) 수립 용역(변.hwp,central,입찰방법은 무엇인가?,"제한경쟁입찰(협상에 의한 계약, 기술90%, 가격 10%)",해당 정보를 찾을 수 없습니다.,[],,
B_rule_single_route,1,국가철도공단_철도인프라 디지털트윈 정보화전략계획(ISP) 수립 용역(변.hwp,central,입찰방법은 무엇인가?,"제한경쟁입찰(협상에 의한 계약, 기술90%, 가격 10%)",우선 협상대상자 선정,"[""3. 우선 협상대상자 선정\n  가. 제안서에 대한 평가결과 기술능력평가 점수가 기술능력평가분야 배점한도의 85%이상인 자를 협상적격자로 선정하고, 협상적격자의 기술능력평가 점수와 입찰가격평가 점수를 합산하여 합산점수의 고득점순에 따라 협상순서를 결정하나, 기술능력평가 배점한도의 85% 미만인 업체는 우선협상대상자에서 제외한다.\n  나. 기술제안서 평가의 비중은 90%, 가격제안서 평가의 비중은 10%를 적용하고, 위의 모든 절차는 기술제안서 평가를 제외하고는 공단 KR전자조달시스템을 이용하여 시행한다.\n     - 협상대상자가 제안한 사업내용, 이행일정, 제안가격, 계약조건 등에 대해 협상대상자와 협상을 통해 그 내용의 일부를 조정할 수 있으며, 제안사의 기술제안서와 가격제안서의 내용이 크게 불일치하여 협상이 어렵다고 판단될 경우, 평가결과에 관계없이 낙찰자선정을 위한 협상에서 제외할 수 있다.\n     - 종합평가결과 최고점수를 얻은 자가 복수일 경우에는 기술제안서 평가점수를 우선으로 하고, 기술제안서 평가점수도 동일한 경우에는 기술제안서 평가항목 중 배점이 높은 항목에서 높은 점수를 얻은 자를 우선협상대상자로 선정한다.\n4. 제안서 보상\n  가. 본 사업은 ｢소프트웨어사업 계약 및 관리감독에 관한 지침｣ 제16조에 따라, 제안서 보상대상사업에 해당하지 않으므로 제안서 보상을 실시하지 않음"", ""[주]\n 1.「신용정보의 이용 및 보호에 관한 법률」제4조제1항제1호 또는「자본시장과 금융투자업에 관한 법률」제335조의3에 따라 업무를 영위하는 신용조회사 또는 신용평가사가 입찰공고일 이전에 평가하고 유효기간 내에 있는 회사채, 기업어음 및 기업신용평가등급을 국가종합전자조달시스템에 조회된 신용평가등급으로 평가하되, 가장 최근의 신용평가등급으로 평가한다. 다만, 가장 최근의 신용평가등급이 다수가 있으며 그 결과가 서로 다른 경우에는 가장 낮은 등급으로 평가한다.\n 2. KR전자조달시스템에서 신용평가등급 확인서가 확인되지 않은 경우에는 최저등급으로 평가하며, 유효기간 만료일이 입찰공고일인 경우에도 유효한 것으로 평가한다.\n 3. 합병한 자에 대하여는 합병 후 새로운 신용평가등급으로 심사하여야 하며 합병 후 새로운 신용평가등급이 없는 경우에는 합병대상자 중 가장 낮은 신용평가등급을 받은 자의 신용평가등급으로 심사한다.\n 4. 추정가격이 고시금액 미만인 입찰에서 입찰공고일을 기준으로 최근 7년 이내에 사업을 개시한 창업기업에 대해서는 신용평가등급 점수상의 배점 한도를 부여한다. 이 경우 창업기업에 대한 기간계산은 법인인 경우에는 법인등기부상 법인설립등기일을, 개인사업자인 경우에는 사업자등록증명서상 사업자등록일을 기준으로 한다.(이하 창업기업에 대한 기간계산은 같다)\n 5. 공동수급체의 경우 구성원별 해당 점수에 지분율을 곱한 후 그 점수들을 합산하여 최종 평가하고, 평가 결과 소수점 이하의 숫자가 있는 경우 소수점 다섯째자리에서 반올림 한다.\n  예)"", ""2. 입찰 참가 자격 조건 \n  가.「국가를 당사자로 하는 계약에 관한 법률 시행령」 제12조 및 동법 시행규칙 제14조｣ 규정에 의한 경쟁 입찰 참가 자격을 갖춘 업체로 입찰등록 마감일 현재 부정당업체로 등록되어 있지 않은 업체이며, 아래 1) 또는 2) 조건을 만족하는 업체\n    1) 입찰공고일 기준 최근 3년 이내 디지털트윈(DT) 관련 사업(ISP, ISMP, 설계, 구축) 또는 연구용역 실적이 있는 업체\n    2) 입찰공고일 기준 최근 3년 이내 BIM 관련 사업(ISP, ISMP, 설계, 구축) 실적이 있는 업체\n  나. 본 사업은 20억원 미만 사업으로 ｢소프트웨어 진흥법｣ 제48조 및 ｢중소 소프트웨어사업자의 사업 참여 지원에 관한 지침(과학기술정보통신부 고시 제2023-25, `23.08.14.)｣ 제2조, 제3조에 따라 대기업 및 중견기업(상호출자제한기업집단 소속회사 포함) 사업자는 참여할 수 없음\n  다. 단독 또는 공동수급체(공동이행방식)를 구성하여 입찰에 참가할 수 있으며, 단독 또는 공동수급체는 가항 1), 2)를 만족하여야 함\n    1) 공동수급대표자는 반드시 가항 1)을 만족하여야 하며 수급비율이 가장 높아야 함\n    2) 공동수급체는 5개 이하로 구성하여야 하며, 구성원별 계약참여 최소지분율은 10% 이상으로 하여야 함\n      ※ [공동계약운용요령 (기획재정부계약예규) 제9조 참조]""]",,
C_rule_multi_route,1,국가철도공단_철도인프라 디지털트윈 정보화전략계획(ISP) 수립 용역(변.hwp,central,입찰방법은 무엇인가?,"제한경쟁입찰(협상에 의한 계약, 기술90%, 가격 10%)",우선 협상대상자 선정,"[""3. 우선 협상대상자 선정\n  가. 제안서에 대한 평가결과 기술능력평가 점수가 기술능력평가분야 배점한도의 85%이상인 자를 협상적격자로 선정하고, 협상적격자의 기술능력평가 점수와 입찰가격평가 점수를 합산하여 합산점수의 고득점순에 따라 협상순서를 결정하나, 기술능력평가 배점한도의 85% 미만인 업체는 우선협상대상자에서 제외한다.\n  나. 기술제안서 평가의 비중은 90%, 가격제안서 평가의 비중은 10%를 적용하고, 위의 모든 절차는 기술제안서 평가를 제외하고는 공단 KR전자조달시스템을 이용하여 시행한다.\n     - 협상대상자가 제안한 사업내용, 이행일정, 제안가격, 계약조건 등에 대해 협상대상자와 협상을 통해 그 내용의 일부를 조정할 수 있으며, 제안사의 기술제안서와 가격제안서의 내용이 크게 불일치하여 협상이 어렵다고 판단될 경우, 평가결과에 관계없이 낙찰자선정을 위한 협상에서 제외할 수 있다.\n     - 종합평가결과 최고점수를 얻은 자가 복수일 경우에는 기술제안서 평가점수를 우선으로 하고, 기술제안서 평가점수도 동일한 경우에는 기술제안서 평가항목 중 배점이 높은 항목에서 높은 점수를 얻은 자를 우선협상대상자로 선정한다.\n4. 제안서 보상\n  가. 본 사업은 ｢소프트웨어사업 계약 및 관리감독에 관한 지침｣ 제16조에 따라, 제안서 보상대상사업에 해당하지 않으므로 제안서 보상을 실시하지 않음"", ""[주]\n 1.「신용정보의 이용 및 보호에 관한 법률」제4조제1항제1호 또는「자본시장과 금융투자업에 관한 법률」제335조의3에 따라 업무를 영위하는 신용조회사 또는 신용평가사가 입찰공고일 이전에 평가하고 유효기간 내에 있는 회사채, 기업어음 및 기업신용평가등급을 국가종합전자조달시스템에 조회된 신용평가등급으로 평가하되, 가장 최근의 신용평가등급으로 평가한다. 다만, 가장 최근의 신용평가등급이 다수가 있으며 그 결과가 서로 다른 경우에는 가장 낮은 등급으로 평가한다.\n 2. KR전자조달시스템에서 신용평가등급 확인서가 확인되지 않은 경우에는 최저등급으로 평가하며, 유효기간 만료일이 입찰공고일인 경우에도 유효한 것으로 평가한다.\n 3. 합병한 자에 대하여는 합병 후 새로운 신용평가등급으로 심사하여야 하며 합병 후 새로운 신용평가등급이 없는 경우에는 합병대상자 중 가장 낮은 신용평가등급을 받은 자의 신용평가등급으로 심사한다.\n 4. 추정가격이 고시금액 미만인 입찰에서 입찰공고일을 기준으로 최근 7년 이내에 사업을 개시한 창업기업에 대해서는 신용평가등급 점수상의 배점 한도를 부여한다. 이 경우 창업기업에 대한 기간계산은 법인인 경우에는 법인등기부상 법인설립등기일을, 개인사업자인 경우에는 사업자등록증명서상 사업자등록일을 기준으로 한다.(이하 창업기업에 대한 기간계산은 같다)\n 5. 공동수급체의 경우 구성원별 해당 점수에 지분율을 곱한 후 그 점수들을 합산하여 최종 평가하고, 평가 결과 소수점 이하의 숫자가 있는 경우 소수점 다섯째자리에서 반올림 한다.\n  예)"", ""2. 입찰 참가 자격 조건 \n  가.「국가를 당사자로 하는 계약에 관한 법률 시행령」 제12조 및 동법 시행규칙 제14조｣ 규정에 의한 경쟁 입찰 참가 자격을 갖춘 업체로 입찰등록 마감일 현재 부정당업체로 등록되어 있지 않은 업체이며, 아래 1) 또는 2) 조건을 만족하는 업체\n    1) 입찰공고일 기준 최근 3년 이내 디지털트윈(DT) 관련 사업(ISP, ISMP, 설계, 구축) 또는 연구용역 실적이 있는 업체\n    2) 입찰공고일 기준 최근 3년 이내 BIM 관련 사업(ISP, ISMP, 설계, 구축) 실적이 있는 업체\n  나. 본 사업은 20억원 미만 사업으로 ｢소프트웨어 진흥법｣ 제48조 및 ｢중소 소프트웨어사업자의 사업 참여 지원에 관한 지침(과학기술정보통신부 고시 제2023-25, `23.08.14.)｣ 제2조, 제3조에 따라 대기업 및 중견기업(상호출자제한기업집단 소속회사 포함) 사업자는 참여할 수 없음\n  다. 단독 또는 공동수급체(공동이행방식)를 구성하여 입찰에 참가할 수 있으며, 단독 또는 공동수급체는 가항 1), 2)를 만족하여야 함\n    1) 공동수급대표자는 반드시 가항 1)을 만족하여야 하며 수급비율이 가장 높아야 함\n    2) 공동수급체는 5개 이하로 구성하여야 하며, 구성원별 계약참여 최소지분율은 10% 이상으로 하여야 함\n      ※ [공동계약운용요령 (기획재정부계약예규) 제9조 참조]"", ""* 평가 이후 점수를 90%로 환산하여 기술성 평가 점수 산정\n   * 제안사 회사명칭(로고 포함)을 표시한 경우 획득 총점에서 최대 2점 감점\n    - 제안서(0.5점), 제안 요약서(0.5점), 제안발표자료(0.5점), 발표 중 소속 표현(0.5점)\n  나. 계량 평가 기준(15점)\n   1) 신용평가 등급에 따른 경영상태 (5점)\n \n<표>""]",,
A_single_pipeline,1,국립인천해양박물관_국립인천해양박물관 해양자료관리시스템 구축 용.hwp,central,이 사업의 계약방법(입찰방식)은 무엇인가?,제한경쟁입찰(협상에 의한 계약),계약방법 : 제한경쟁입찰(협상에 의한 계약),"[""라. 계약방법 : 제한경쟁입찰(협상에 의한 계약)"", ""가. 본 사업의 수행 결과물(계약목적물)에 대한 지식재산권은 발주기관과 계약상대자가 공동으로 소유하며, 별도의 정함이 없는 한 지분은 균등한 것으로 함. 다만, 개발의 기여도 및 계약목적물의 특수성(보안, 영업비밀 등)을 고려하여 계약당사자 간의 협의를 통해 지식재산권 귀속 주체 등에 대해 공동소유와 달리 정할 수 있음. 또한, 지식재산권의 타 용도 및 상업적 활용 시 반드시 발주기관과 협의하여야 함""]",,
B_rule_single_route,1,국립인천해양박물관_국립인천해양박물관 해양자료관리시스템 구축 용.hwp,central,이 사업의 계약방법(입찰방식)은 무엇인가?,제한경쟁입찰(협상에 의한 계약),계약방법 : 제한경쟁입찰(협상에 의한 계약),"[""라. 계약방법 : 제한경쟁입찰(협상에 의한 계약)"", ""가. 본 사업의 수행 결과물(계약목적물)에 대한 지식재산권은 발주기관과 계약상대자가 공동으로 소유하며, 별도의 정함이 없는 한 지분은 균등한 것으로 함. 다만, 개발의 기여도 및 계약목적물의 특수성(보안, 영업비밀 등)을 고려하여 계약당사자 간의 협의를 통해 지식재산권 귀속 주체 등에 대해 공동소유와 달리 정할 수 있음. 또한, 지식재산권의 타 용도 및 상업적 활용 시 반드시 발주기관과 협의하여야 함""]",,
C_rule_multi_route,1,국립인천해양박물관_국립인천해양박물관 해양자료관리시스템 구축 용.hwp,central,이 사업의 계약방법(입찰방식)은 무엇인가?,제한경쟁입찰(협상에 의한 계약),계약방법 : 제한경쟁입찰(협상에 의한 계약),"[""라. 계약방법 : 제한경쟁입찰(협상에 의한 계약)"", ""가. 본 사업의 수행 결과물(계약목적물)에 대한 지식재산권은 발주기관과 계약상대자가 공동으로 소유하며, 별도의 정함이 없는 한 지분은 균등한 것으로 함. 다만, 개발의 기여도 및 계약목적물의 특수성(보안, 영업비밀 등)을 고려하여 계약당사자 간의 협의를 통해 지식재산권 귀속 주체 등에 대해 공동소유와 달리 정할 수 있음. 또한, 지식재산권의 타 용도 및 상업적 활용 시 반드시 발주기관과 협의하여야 함""]",,
A_single_pipeline,1,국립중앙의료원_(긴급)「2024년도 차세대 응급의료 상황관리시스템 구축.hwp,extreme,이 사업의 입찰방식은 무엇인가요?,제한경쟁입찰 / 협상에 의한 계약,※ 소프트웨어사업 계약 및 관리감독에 관한 지침 제7조(총 사업규모가 3억원 이상)에 따라 사업범위 내에 직접구매 대상 상용SW제품이 1개라도 존재하는 사업의 경우 「소프트웨어사업 계약 및 관리감독에 관한 지침」 별지 2호서식 <직접구매 대상 상용소프트웨어 구매계획>을 첨부,"[""2) 상용SW 직접구매 및 SW품질성능 평가시험(BMT)\n   가. 본 사업은 ‘직접구매 대상 상용SW 구매계획’을 첨부해야하는 사업에 해당( ) 또는 미해당(✔) 되는 사업임\n     ※ 소프트웨어사업 계약 및 관리감독에 관한 지침 제7조(총 사업규모가 3억원 이상)에 따라 사업범위 내에 직접구매 대상 상용SW제품이 1개라도 존재하는 사업의 경우 「소프트웨어사업 계약 및 관리감독에 관한 지침」 별지 2호서식 <직접구매 대상 상용소프트웨어 구매계획>을 첨부"", ""2. 위 사업의 계약 체결과 이행 그리고 공사 시행과 준공(납품) 등의 전 과정을 통하여 어떠한 경우에도 뇌물공여나 청탁으로 관계 국립중앙의료원임직원을 회유하여 편의를 제공받는 등 불법을 묵인하도록 요청하지 않겠으며, 관계 국립중앙의료원임직원의 어떠한 불법ㆍ부당 요구에도 단호히 이를 거부하겠습니다.""]",,
B_rule_single_route,1,국립중앙의료원_(긴급)「2024년도 차세대 응급의료 상황관리시스템 구축.hwp,extreme,이 사업의 입찰방식은 무엇인가요?,제한경쟁입찰 / 협상에 의한 계약,용역 제안서에 의한 기술능력평가와 입찰가격평가를 분리하여 실시함,"[""가. 용역 제안서에 의한 기술능력평가와 입찰가격평가를 분리하여 실시함.\n      - 기술능력평가 90점, 입찰가격평가 10점으로 평가\n 나. 제안서 평가 결과 기술능력평가 점수가 76.5점 이상(총 90점 기준 85% 이상 득점)인 업체를 협상적격자로 선정하며, 기술능력점수*와 입찰가격점수의 합산점수가 높은 순으로 협상을 실시함.\n      * 기술능력점수: 평가위원이 평가한 점수 중 최저 및 최고점수를 제외한 후 산술평균하여 산출(평가점수 계산은 소수점 이하가 있는 경우 소수점 3자리에서 반올림). 다만, 최저 또는 최고점수가 2개 이상일 때에는 이중 하나만 제외\n      ※ 합산 점수가 동일한 경우 기술능력평가 점수가 높은 업체를 우선협상대상으로 선정함.\n 다. 우선순위 1순위 업체부터 가격 및 기타사항에 대한 협상을 통해 사업자 선정, 협상 결렬 시 차 순위 업체에 협상권 부여\n 라. 협상절차 및 그 결과의 조치, 가격협상에 대한 기준은 국가계약법 시행령 제43조(협상에 의한 계약체결) 및 협상에 의한 계약체결 기준(기획재정부 계약예규 제656호)에 따르며 해당 절차를 거쳐 낙찰자를 결정함.\n 마. 사업예산을 초과하는 가격을 제안하는 업체는 우선협상 대상자에서 제외함."", ""※ 상기의 세부 판단 항목 및 배점은 SW사업의 특성을 고려하여 가감 조정되었음\n - 관련근거: 소프트웨어사업 계약 및 관리감독에 관한 지침 제21조(하도급계약의 승인 등) ② 국가기관등의 장은 제1항에도 불구하고 소프트웨어사업의 특성을 고려하여 별표 3의 세부 판단항목을 추가하거나 제외할 수 있고 배점한도를 가감조정할 수 있다."", ""제9조(구성원의 출자비율) ①당 공동수급체의 출자비율은 다음과 같이 정한다.\n  1. ㅇㅇㅇ :    %\n  2. ㅇㅇㅇ :    %\n  ②제1항의 비율은 다음 각 호의 어느 하나에 해당하는 경우에 변경할 수 있다. 다만, 출자비율을 변경하는 경우에는 공동수급체 일부구성원의 출자비율 전부를 다른 구성원에게 이전할 수 없다.\n  1. 발주기관과의 계약내용 변경에 따라 계약금액이 증감되었을 경우\n  2. 공동수급체 구성원 중 파산, 해산, 부도, 법정관리, 워크아웃(기업구조조정촉진법에 따라 채권단이 구조조정 대상으로 결정하여 구조조정중인 업체), 중도탈퇴의 사유로 인하여 당초 협정서의 내용대로 계약이행이 곤란한 구성원이 발생하여 공동수급체구성원 연명으로 출자비율의 변경을 요청한 경우\n  ③현금이외의 출자는 시가를 고려, 구성원이 협의 평가하는 것으로 한다.""]",,
C_rule_multi_route,1,국립중앙의료원_(긴급)「2024년도 차세대 응급의료 상황관리시스템 구축.hwp,extreme,이 사업의 입찰방식은 무엇인가요?,제한경쟁입찰 / 협상에 의한 계약,용역 제안서에 의한 기술능력평가와 입찰가격평가를 분리하여 실시함,"[""가. 용역 제안서에 의한 기술능력평가와 입찰가격평가를 분리하여 실시함.\n      - 기술능력평가 90점, 입찰가격평가 10점으로 평가\n 나. 제안서 평가 결과 기술능력평가 점수가 76.5점 이상(총 90점 기준 85% 이상 득점)인 업체를 협상적격자로 선정하며, 기술능력점수*와 입찰가격점수의 합산점수가 높은 순으로 협상을 실시함.\n      * 기술능력점수: 평가위원이 평가한 점수 중 최저 및 최고점수를 제외한 후 산술평균하여 산출(평가점수 계산은 소수점 이하가 있는 경우 소수점 3자리에서 반올림). 다만, 최저 또는 최고점수가 2개 이상일 때에는 이중 하나만 제외\n      ※ 합산 점수가 동일한 경우 기술능력평가 점수가 높은 업체를 우선협상대상으로 선정함.\n 다. 우선순위 1순위 업체부터 가격 및 기타사항에 대한 협상을 통해 사업자 선정, 협상 결렬 시 차 순위 업체에 협상권 부여\n 라. 협상절차 및 그 결과의 조치, 가격협상에 대한 기준은 국가계약법 시행령 제43조(협상에 의한 계약체결) 및 협상에 의한 계약체결 기준(기획재정부 계약예규 제656호)에 따르며 해당 절차를 거쳐 낙찰자를 결정함.\n 마. 사업예산을 초과하는 가격을 제안하는 업체는 우선협상 대상자에서 제외함."", ""※ 상기의 세부 판단 항목 및 배점은 SW사업의 특성을 고려하여 가감 조정되었음\n - 관련근거: 소프트웨어사업 계약 및 관리감독에 관한 지침 제21조(하도급계약의 승인 등) ② 국가기관등의 장은 제1항에도 불구하고 소프트웨어사업의 특성을 고려하여 별표 3의 세부 판단항목을 추가하거나 제외할 수 있고 배점한도를 가감조정할 수 있다."", ""제9조(구성원의 출자비율) ①당 공동수급체의 출자비율은 다음과 같이 정한다.\n  1. ㅇㅇㅇ :    %\n  2. ㅇㅇㅇ :    %\n  ②제1항의 비율은 다음 각 호의 어느 하나에 해당하는 경우에 변경할 수 있다. 다만, 출자비율을 변경하는 경우에는 공동수급체 일부구성원의 출자비율 전부를 다른 구성원에게 이전할 수 없다.\n  1. 발주기관과의 계약내용 변경에 따라 계약금액이 증감되었을 경우\n  2. 공동수급체 구성원 중 파산, 해산, 부도, 법정관리, 워크아웃(기업구조조정촉진법에 따라 채권단이 구조조정 대상으로 결정하여 구조조정중인 업체), 중도탈퇴의 사유로 인하여 당초 협정서의 내용대로 계약이행이 곤란한 구성원이 발생하여 공동수급체구성원 연명으로 출자비율의 변경을 요청한 경우\n  ③현금이외의 출자는 시가를 고려, 구성원이 협의 평가하는 것으로 한다.""]",,
A_single_pipeline,1,국민연금공단_2024년 이러닝시스템 운영 용역.hwp,central,사업기간은 계약체결일로부터 언제까지인가?,계약체결일로부터 2025년 2월까지,□ 사업기간: 계약체결일로부터 2025,"[""□ 사업기간: 계약체결일로부터 2025. 2월까지""]",,
B_rule_single_route,1,국민연금공단_2024년 이러닝시스템 운영 용역.hwp,central,사업기간은 계약체결일로부터 언제까지인가?,계약체결일로부터 2025년 2월까지,□ 사업기간: 계약체결일로부터 2025,"[""□ 사업기간: 계약체결일로부터 2025. 2월까지""]",,
C_rule_multi_route,1,국민연금공단_2024년 이러닝시스템 운영 용역.hwp,central,사업기간은 계약체결일로부터 언제까지인가?,계약체결일로부터 2025년 2월까지,□ 사업기간: 계약체결일로부터 2025,"[""□ 사업기간: 계약체결일로부터 2025. 2월까지""]",,
A_single_pipeline,1,국민연금공단_사업장 사회보험료 지원 고시 개정에 따른 정보시스템 보.hwp,central,이 사업의 사업예산(사업 금액)은 얼마로 되어 있는가?,"415,977,877원(부가가치세 포함)","사업 금액: 415,977,877원(부가가치세 포함)","[""2. 사업 기간: 계약체결일로부터 180일 이내\n   ※ 소프트웨어 개발사업 적정사업 기간 선정 기준【붙임7】에 따른 사업임   \n 3. 사업 금액: 415,977,877원(부가가치세 포함)\n   ※ 한국소프트웨어산업협회- SW사업 대가산정 가이드(기능점수방식)\n   ※ 사업 금액은 업무 여건에 따라 변동될 수 있음"", ""* 해당 사업 규모 대비 입찰공고일 기준 최근 3년간 사업수행실적(금액 기준)을 합산 적용. 단, 입찰공고일을 기준으로 최근 7년 이내에 사업을 개시한 창업기업에 대해서는 최근 7년간 사업수행실적을 합산 적용\n[주]\n 1. 수행실적은 입찰공고 또는 제안요청서 등 입찰 관계 서류에 별도로 정한 경우를 제외하고는 계약 일자 및 납품기한과 관계없이 이행이 완료된 시점을 기준으로 평가한다. 이 경우 입찰공고일에 이행 완료된 실적도 평가에 포함하나, 입찰공고일 다음날부터 이행 완료된 자료는 평가에서 제외한다. \n 2. 등급 구간별 평점은 제9 조 제8항 제1호에 따라 부여한다.\n 3. 등급 구간 및 구간별 평점은 위 표에 의하며, 필요하다고 인정되는 경우 입찰공고에 달리 정할 수 있다.\n 4. 실적 인정 범위는 제안요청서에 정하되, 수행실적은 제5호에 따라 제출된 실적을 기준으로 평가한다.\n 5. 입찰자는 수행실적 평가를 위하여 별지 제2호서식의 수행실적 총괄표와 다음 각 목에 따른 별지 제3호서식 또는 그에 따른 수행실적증명서 등을 제출하여야 한다.\n  가. 국가기관, 지방자치단체, 기획재정부장관이 지정한 공공기관 또는 지방공기업 법령 적용 기관이 발급한 수행실적증명서\n  나. 위 가목에서 정한 이외의 기관 또는 민간이 발주하였으면 발주자가 발급한 수행실적증명서, 발주자의 인감증명서(필요시 사용인감계 포함), 계약서, 세금계산서(필요시 거래명세표 포함)를 첨부하여야 하며, 수행실적증명서는 해당 인감(필요시 사용인감)으로 날인하여야 함\n  다. 위 가목과 나목에도 불구하고 한국소프트웨어산업협회장이 발급하는 소프트웨어사업 수행실적 확인서\n  라. 국외의 공공기관, 민간기업 등이 발주한 경우 가목 및 나목을 준용하되, 공공기관 이외의 납품실적은 이를 공증하거나 해당국가의 상공회의소 또는 해당국가에 주재하는 대한민국 공관의 확인을 받은 경우에는 세금계산서 등 증빙자료 첨부를 생략할 수 있음\n  마. 이행실적에 대한 입증책임은 입찰자가 부담하며 의무를 다하지 아니하여 실적 확""]",,
B_rule_single_route,1,국민연금공단_사업장 사회보험료 지원 고시 개정에 따른 정보시스템 보.hwp,central,이 사업의 사업예산(사업 금액)은 얼마로 되어 있는가?,"415,977,877원(부가가치세 포함)","사업 금액: 415,977,877원(부가가치세 포함)","[""2. 사업 기간: 계약체결일로부터 180일 이내\n   ※ 소프트웨어 개발사업 적정사업 기간 선정 기준【붙임7】에 따른 사업임   \n 3. 사업 금액: 415,977,877원(부가가치세 포함)\n   ※ 한국소프트웨어산업협회- SW사업 대가산정 가이드(기능점수방식)\n   ※ 사업 금액은 업무 여건에 따라 변동될 수 있음"", ""* 해당 사업 규모 대비 입찰공고일 기준 최근 3년간 사업수행실적(금액 기준)을 합산 적용. 단, 입찰공고일을 기준으로 최근 7년 이내에 사업을 개시한 창업기업에 대해서는 최근 7년간 사업수행실적을 합산 적용\n[주]\n 1. 수행실적은 입찰공고 또는 제안요청서 등 입찰 관계 서류에 별도로 정한 경우를 제외하고는 계약 일자 및 납품기한과 관계없이 이행이 완료된 시점을 기준으로 평가한다. 이 경우 입찰공고일에 이행 완료된 실적도 평가에 포함하나, 입찰공고일 다음날부터 이행 완료된 자료는 평가에서 제외한다. \n 2. 등급 구간별 평점은 제9 조 제8항 제1호에 따라 부여한다.\n 3. 등급 구간 및 구간별 평점은 위 표에 의하며, 필요하다고 인정되는 경우 입찰공고에 달리 정할 수 있다.\n 4. 실적 인정 범위는 제안요청서에 정하되, 수행실적은 제5호에 따라 제출된 실적을 기준으로 평가한다.\n 5. 입찰자는 수행실적 평가를 위하여 별지 제2호서식의 수행실적 총괄표와 다음 각 목에 따른 별지 제3호서식 또는 그에 따른 수행실적증명서 등을 제출하여야 한다.\n  가. 국가기관, 지방자치단체, 기획재정부장관이 지정한 공공기관 또는 지방공기업 법령 적용 기관이 발급한 수행실적증명서\n  나. 위 가목에서 정한 이외의 기관 또는 민간이 발주하였으면 발주자가 발급한 수행실적증명서, 발주자의 인감증명서(필요시 사용인감계 포함), 계약서, 세금계산서(필요시 거래명세표 포함)를 첨부하여야 하며, 수행실적증명서는 해당 인감(필요시 사용인감)으로 날인하여야 함\n  다. 위 가목과 나목에도 불구하고 한국소프트웨어산업협회장이 발급하는 소프트웨어사업 수행실적 확인서\n  라. 국외의 공공기관, 민간기업 등이 발주한 경우 가목 및 나목을 준용하되, 공공기관 이외의 납품실적은 이를 공증하거나 해당국가의 상공회의소 또는 해당국가에 주재하는 대한민국 공관의 확인을 받은 경우에는 세금계산서 등 증빙자료 첨부를 생략할 수 있음\n  마. 이행실적에 대한 입증책임은 입찰자가 부담하며 의무를 다하지 아니하여 실적 확""]",,
C_rule_multi_route,1,국민연금공단_사업장 사회보험료 지원 고시 개정에 따른 정보시스템 보.hwp,central,이 사업의 사업예산(사업 금액)은 얼마로 되어 있는가?,"415,977,877원(부가가치세 포함)","사업 금액: 415,977,877원(부가가치세 포함)","[""2. 사업 기간: 계약체결일로부터 180일 이내\n   ※ 소프트웨어 개발사업 적정사업 기간 선정 기준【붙임7】에 따른 사업임   \n 3. 사업 금액: 415,977,877원(부가가치세 포함)\n   ※ 한국소프트웨어산업협회- SW사업 대가산정 가이드(기능점수방식)\n   ※ 사업 금액은 업무 여건에 따라 변동될 수 있음"", ""* 해당 사업 규모 대비 입찰공고일 기준 최근 3년간 사업수행실적(금액 기준)을 합산 적용. 단, 입찰공고일을 기준으로 최근 7년 이내에 사업을 개시한 창업기업에 대해서는 최근 7년간 사업수행실적을 합산 적용\n[주]\n 1. 수행실적은 입찰공고 또는 제안요청서 등 입찰 관계 서류에 별도로 정한 경우를 제외하고는 계약 일자 및 납품기한과 관계없이 이행이 완료된 시점을 기준으로 평가한다. 이 경우 입찰공고일에 이행 완료된 실적도 평가에 포함하나, 입찰공고일 다음날부터 이행 완료된 자료는 평가에서 제외한다. \n 2. 등급 구간별 평점은 제9 조 제8항 제1호에 따라 부여한다.\n 3. 등급 구간 및 구간별 평점은 위 표에 의하며, 필요하다고 인정되는 경우 입찰공고에 달리 정할 수 있다.\n 4. 실적 인정 범위는 제안요청서에 정하되, 수행실적은 제5호에 따라 제출된 실적을 기준으로 평가한다.\n 5. 입찰자는 수행실적 평가를 위하여 별지 제2호서식의 수행실적 총괄표와 다음 각 목에 따른 별지 제3호서식 또는 그에 따른 수행실적증명서 등을 제출하여야 한다.\n  가. 국가기관, 지방자치단체, 기획재정부장관이 지정한 공공기관 또는 지방공기업 법령 적용 기관이 발급한 수행실적증명서\n  나. 위 가목에서 정한 이외의 기관 또는 민간이 발주하였으면 발주자가 발급한 수행실적증명서, 발주자의 인감증명서(필요시 사용인감계 포함), 계약서, 세금계산서(필요시 거래명세표 포함)를 첨부하여야 하며, 수행실적증명서는 해당 인감(필요시 사용인감)으로 날인하여야 함\n  다. 위 가목과 나목에도 불구하고 한국소프트웨어산업협회장이 발급하는 소프트웨어사업 수행실적 확인서\n  라. 국외의 공공기관, 민간기업 등이 발주한 경우 가목 및 나목을 준용하되, 공공기관 이외의 납품실적은 이를 공증하거나 해당국가의 상공회의소 또는 해당국가에 주재하는 대한민국 공관의 확인을 받은 경우에는 세금계산서 등 증빙자료 첨부를 생략할 수 있음\n  마. 이행실적에 대한 입증책임은 입찰자가 부담하며 의무를 다하지 아니하여 실적 확""]",,
A_single_pipeline,1,국방과학연구소_기록관리시스템 통합 활용 및 보안 환경 구축.hwp,central,기록관리시스템 이용자 페이지 전면 개편에 포함된 주요 기능은 무엇인가?,"메인/서브 페이지 구축, 메인/서브 페이지 컨텐츠 개편, 기록물 이관 기능 구현, 기록물 평가 기능 구현, 부가 기능 구현",기록관리시스템 이용자 페이지 전면 개편,"[""가. 기록관리시스템 이용자 페이지 전면 개편\n ❍ 이용자 페이지 전면 개편 : 메인/서브 페이지 구축\n ❍ 이용자 페이지 전면 개편 : 메인/서브 페이지 컨텐츠 개편\n ❍ 이용자 페이지 전면 개편 : 기록물 이관 기능 구현\n ❍ 이용자 페이지 전면 개편 : 기록물 평가 기능 구현\n ❍ 이용자 페이지 전면 개편 : 부가 기능 구현"", ""❍ 추진배경\n   - 「공공기록물 관리에 관한 법률」(법률 제18740호, 2022.7.12.시행)\n   - 「공공데이터 제공 및 이용 활성화에 관한 법률」(법률 제17344호, 2020.12.10.시행)\n   - 「데이터기반행정 활성화에 관한 법률」(법률 제17370호, 2020.12.10.시행)\n   - 「공공기관의 데이터베이스 표준화 지침」(행안부고시 제2023-18호, 2023.4.3.시행)\n   - 분산 구축된 연구소 기록관리시스템(3개*) 운영(~2023) 및 통합(2024~)\n     * 기록관리시스템 : 전자기록관(main), 종결사업기록관리시스템(sub), 영상기록관리시스템(sub)\n    · 각 시스템별 관리자 페이지 통합 완료(2024)\n    · 각 시스템별 이용자 페이지 이전/취합 완료(2024)\n    · 각 시스템별 이용자 페이지 관련 DB 별도 운영 중(現)""]",,
B_rule_single_route,1,국방과학연구소_기록관리시스템 통합 활용 및 보안 환경 구축.hwp,central,기록관리시스템 이용자 페이지 전면 개편에 포함된 주요 기능은 무엇인가?,"메인/서브 페이지 구축, 메인/서브 페이지 컨텐츠 개편, 기록물 이관 기능 구현, 기록물 평가 기능 구현, 부가 기능 구현",기록관리시스템 이용자 페이지 전면 개편,"[""가. 기록관리시스템 이용자 페이지 전면 개편\n ❍ 이용자 페이지 전면 개편 : 메인/서브 페이지 구축\n ❍ 이용자 페이지 전면 개편 : 메인/서브 페이지 컨텐츠 개편\n ❍ 이용자 페이지 전면 개편 : 기록물 이관 기능 구현\n ❍ 이용자 페이지 전면 개편 : 기록물 평가 기능 구현\n ❍ 이용자 페이지 전면 개편 : 부가 기능 구현"", ""❍ 추진배경\n   - 「공공기록물 관리에 관한 법률」(법률 제18740호, 2022.7.12.시행)\n   - 「공공데이터 제공 및 이용 활성화에 관한 법률」(법률 제17344호, 2020.12.10.시행)\n   - 「데이터기반행정 활성화에 관한 법률」(법률 제17370호, 2020.12.10.시행)\n   - 「공공기관의 데이터베이스 표준화 지침」(행안부고시 제2023-18호, 2023.4.3.시행)\n   - 분산 구축된 연구소 기록관리시스템(3개*) 운영(~2023) 및 통합(2024~)\n     * 기록관리시스템 : 전자기록관(main), 종결사업기록관리시스템(sub), 영상기록관리시스템(sub)\n    · 각 시스템별 관리자 페이지 통합 완료(2024)\n    · 각 시스템별 이용자 페이지 이전/취합 완료(2024)\n    · 각 시스템별 이용자 페이지 관련 DB 별도 운영 중(現)""]",,
C_rule_multi_route,1,국방과학연구소_기록관리시스템 통합 활용 및 보안 환경 구축.hwp,central,기록관리시스템 이용자 페이지 전면 개편에 포함된 주요 기능은 무엇인가?,"메인/서브 페이지 구축, 메인/서브 페이지 컨텐츠 개편, 기록물 이관 기능 구현, 기록물 평가 기능 구현, 부가 기능 구현",기록관리시스템 이용자 페이지 전면 개편,"[""가. 기록관리시스템 이용자 페이지 전면 개편\n ❍ 이용자 페이지 전면 개편 : 메인/서브 페이지 구축\n ❍ 이용자 페이지 전면 개편 : 메인/서브 페이지 컨텐츠 개편\n ❍ 이용자 페이지 전면 개편 : 기록물 이관 기능 구현\n ❍ 이용자 페이지 전면 개편 : 기록물 평가 기능 구현\n ❍ 이용자 페이지 전면 개편 : 부가 기능 구현"", ""❍ 추진배경\n   - 「공공기록물 관리에 관한 법률」(법률 제18740호, 2022.7.12.시행)\n   - 「공공데이터 제공 및 이용 활성화에 관한 법률」(법률 제17344호, 2020.12.10.시행)\n   - 「데이터기반행정 활성화에 관한 법률」(법률 제17370호, 2020.12.10.시행)\n   - 「공공기관의 데이터베이스 표준화 지침」(행안부고시 제2023-18호, 2023.4.3.시행)\n   - 분산 구축된 연구소 기록관리시스템(3개*) 운영(~2023) 및 통합(2024~)\n     * 기록관리시스템 : 전자기록관(main), 종결사업기록관리시스템(sub), 영상기록관리시스템(sub)\n    · 각 시스템별 관리자 페이지 통합 완료(2024)\n    · 각 시스템별 이용자 페이지 이전/취합 완료(2024)\n    · 각 시스템별 이용자 페이지 관련 DB 별도 운영 중(現)""]",,
A_single_pipeline,1,국방과학연구소_대용량 자료전송시스템 고도화.hwp,central,이 사업의 입찰방식은 무엇인가요?,공개경쟁입찰 방식,▢ 본 사업의 수행에 필요한 모든 비용은 가격입찰금액에 포함해야 함,"[""9. 입찰 유의사항 \n ▢ 제안서 인력은 자사인력으로 구성하여야 함\n ▢ 제안서의 내용을 대상으로 협상하며 그 내용의 일부를 조정 가능\n ▢ 제출된 제안서는 일체 반환하지 않으며, 본 제안과 관련된 일체의 소요비용(제안서 작성 비용 포함)은 입찰참가자의 부담으로 함\n ▢ 본 사업의 수행에 필요한 모든 비용은 가격입찰금액에 포함해야 함\n ▢ 입찰의 무효\n   - 국가를 당사자로 하는 계약에 관한 법률 시행령 제39조 제4항, 시행규칙 제44조, 용역입찰유의서 제12조에 저촉될 경우 입찰은 무효로 함\n   - 낙찰자 결정 전 낙찰예정자의 입찰이 용역입찰유의서 제12조의 무효입찰에 해당되는 경우 무효입찰로 처리\n ▢ 제안내용에 대한 확인을 위하여 추가 자료 요청 및 현지실사를 할 수 있으며 입찰참가자는 이에 응하여야 함\n ▢ 계약상의 사업을 수행함에 있어 부실, 조잡 또는 부당하게 하거나, 부정한 행위를 한 사업자는 향후 신규사업의 참여에 제한을 받을 수 있음\n ▢ 계약 해제‧해지 사항\n   - 사업수행자가 정당한 사유 없이 약정한 착수기일을 경과하고도  사업에 착수하지 아니할 경우\n   - 계약서상의 사업을 기한 내에 수행사의 사유로 완료할 가능성 없음이 명백히 인정될 경우\n   - 과업을 정당한 사유 없이 이행하지 않은 경우 \n   - 제안 내용의 전부 또는 일부에 대하여 담합한 사실이 발견되는 경우에는 제안을 무효로 함\n ▢ 관계 법령 등의 숙지\n   - 입찰에 참가하고자 하는 자는 시행령 등의 입찰 관련 법령 및 용역입찰유의서 제4조 제1항의 규정에 의한 입찰에 관한 서류를 입찰 전에 완전히 숙지하여야 하며 이를 숙지하지 못한 책임은 입찰 참가자에게 있음\n   - 입찰에 참가하고자 하는 자는 용역입찰유의서 제5조 제1항의 규정에 의해 입찰에 관한 서류의 검토과정에서 발견한 입찰에 관한 서류상의 착오 또는 기타 설명이 요구되는 사항에 대하여는 입철서 제출마감일 전일까지 주관기관에 그 설명을 요구할 수 있음\n ▢ 제안요청서 및 제안서의 내용에 대한 해석상의 문제"", ""11. 기타 안내사항 \n▢ (과업심의위원회 개최)본 사업은 「소프트웨어 진흥법」 제50조에 따른 과업내용 확정을 위하여 과업심의위원회를 개최한 사업임\n   - (과업내용 변경) 본 사업은 「소프트웨어 진흥법」제50조, 같은 법 시행령 제47조 제1항 제2호, 제3호에 따라 과업내용 변경 및 그에 따른 계약금액·계약기간 조정이 필요한 경우, 계약상대자는 국가기관등의 장에게 소프트웨어사업 과업변경요청서*를 제출하여야 하며, 국가기관등의 장은 과업심의위원회 개최 요청에 대해서 특별한 사정이 없으면 수용해야 함\n  　  * 「소프트웨어사업 계약 및 관리감독에 관한 지침」별지 제13호서식  　　소프트웨어 과업변경요청서를 작성하여 제출\n ▢ (적정사업기간 산정)  ｢소프트웨어사업 계약 및 관리감독에 관한 지침｣ 제10조에 따라 소프트웨어 개발사업 적정 사업기간 산정 기준에 따른 사업임\n ▢ (SW사업 영향평가) 「소프트웨어 진흥법」제43조, 같은 법 시행령 제35조 내지 제37조, 「소프트웨어사업 계약 및 관리감독에 관한 지침」제5조, 제6조에 따라 소프트웨어사업 영향평가를 미리 실시한 사업임\n ▢ (감리 非대상) 사업비 5억 원 미만의 정보시스템 구축사업으로서 「전자정부법 시행령 제71조」에 따라 정보시스템 감리 대상이 아님.\n ▢ (하도급 준수사항) 5개월 이내의 짧은 사업 기간으로 신속하고 정확한 사업 설계와 구축이 필요함. 이에 따라 사업의 수주자가 직접 수행함을 원칙으로 하며, 하도급계약은 승인하지 않음""]",,
B_rule_single_route,1,국방과학연구소_대용량 자료전송시스템 고도화.hwp,central,이 사업의 입찰방식은 무엇인가요?,공개경쟁입찰 방식,▢ 본 사업의 수행에 필요한 모든 비용은 가격입찰금액에 포함해야 함,"[""9. 입찰 유의사항 \n ▢ 제안서 인력은 자사인력으로 구성하여야 함\n ▢ 제안서의 내용을 대상으로 협상하며 그 내용의 일부를 조정 가능\n ▢ 제출된 제안서는 일체 반환하지 않으며, 본 제안과 관련된 일체의 소요비용(제안서 작성 비용 포함)은 입찰참가자의 부담으로 함\n ▢ 본 사업의 수행에 필요한 모든 비용은 가격입찰금액에 포함해야 함\n ▢ 입찰의 무효\n   - 국가를 당사자로 하는 계약에 관한 법률 시행령 제39조 제4항, 시행규칙 제44조, 용역입찰유의서 제12조에 저촉될 경우 입찰은 무효로 함\n   - 낙찰자 결정 전 낙찰예정자의 입찰이 용역입찰유의서 제12조의 무효입찰에 해당되는 경우 무효입찰로 처리\n ▢ 제안내용에 대한 확인을 위하여 추가 자료 요청 및 현지실사를 할 수 있으며 입찰참가자는 이에 응하여야 함\n ▢ 계약상의 사업을 수행함에 있어 부실, 조잡 또는 부당하게 하거나, 부정한 행위를 한 사업자는 향후 신규사업의 참여에 제한을 받을 수 있음\n ▢ 계약 해제‧해지 사항\n   - 사업수행자가 정당한 사유 없이 약정한 착수기일을 경과하고도  사업에 착수하지 아니할 경우\n   - 계약서상의 사업을 기한 내에 수행사의 사유로 완료할 가능성 없음이 명백히 인정될 경우\n   - 과업을 정당한 사유 없이 이행하지 않은 경우 \n   - 제안 내용의 전부 또는 일부에 대하여 담합한 사실이 발견되는 경우에는 제안을 무효로 함\n ▢ 관계 법령 등의 숙지\n   - 입찰에 참가하고자 하는 자는 시행령 등의 입찰 관련 법령 및 용역입찰유의서 제4조 제1항의 규정에 의한 입찰에 관한 서류를 입찰 전에 완전히 숙지하여야 하며 이를 숙지하지 못한 책임은 입찰 참가자에게 있음\n   - 입찰에 참가하고자 하는 자는 용역입찰유의서 제5조 제1항의 규정에 의해 입찰에 관한 서류의 검토과정에서 발견한 입찰에 관한 서류상의 착오 또는 기타 설명이 요구되는 사항에 대하여는 입철서 제출마감일 전일까지 주관기관에 그 설명을 요구할 수 있음\n ▢ 제안요청서 및 제안서의 내용에 대한 해석상의 문제"", ""11. 기타 안내사항 \n▢ (과업심의위원회 개최)본 사업은 「소프트웨어 진흥법」 제50조에 따른 과업내용 확정을 위하여 과업심의위원회를 개최한 사업임\n   - (과업내용 변경) 본 사업은 「소프트웨어 진흥법」제50조, 같은 법 시행령 제47조 제1항 제2호, 제3호에 따라 과업내용 변경 및 그에 따른 계약금액·계약기간 조정이 필요한 경우, 계약상대자는 국가기관등의 장에게 소프트웨어사업 과업변경요청서*를 제출하여야 하며, 국가기관등의 장은 과업심의위원회 개최 요청에 대해서 특별한 사정이 없으면 수용해야 함\n  　  * 「소프트웨어사업 계약 및 관리감독에 관한 지침」별지 제13호서식  　　소프트웨어 과업변경요청서를 작성하여 제출\n ▢ (적정사업기간 산정)  ｢소프트웨어사업 계약 및 관리감독에 관한 지침｣ 제10조에 따라 소프트웨어 개발사업 적정 사업기간 산정 기준에 따른 사업임\n ▢ (SW사업 영향평가) 「소프트웨어 진흥법」제43조, 같은 법 시행령 제35조 내지 제37조, 「소프트웨어사업 계약 및 관리감독에 관한 지침」제5조, 제6조에 따라 소프트웨어사업 영향평가를 미리 실시한 사업임\n ▢ (감리 非대상) 사업비 5억 원 미만의 정보시스템 구축사업으로서 「전자정부법 시행령 제71조」에 따라 정보시스템 감리 대상이 아님.\n ▢ (하도급 준수사항) 5개월 이내의 짧은 사업 기간으로 신속하고 정확한 사업 설계와 구축이 필요함. 이에 따라 사업의 수주자가 직접 수행함을 원칙으로 하며, 하도급계약은 승인하지 않음""]",,
C_rule_multi_route,1,국방과학연구소_대용량 자료전송시스템 고도화.hwp,central,이 사업의 입찰방식은 무엇인가요?,공개경쟁입찰 방식,▢ 본 사업의 수행에 필요한 모든 비용은 가격입찰금액에 포함해야 함,"[""9. 입찰 유의사항 \n ▢ 제안서 인력은 자사인력으로 구성하여야 함\n ▢ 제안서의 내용을 대상으로 협상하며 그 내용의 일부를 조정 가능\n ▢ 제출된 제안서는 일체 반환하지 않으며, 본 제안과 관련된 일체의 소요비용(제안서 작성 비용 포함)은 입찰참가자의 부담으로 함\n ▢ 본 사업의 수행에 필요한 모든 비용은 가격입찰금액에 포함해야 함\n ▢ 입찰의 무효\n   - 국가를 당사자로 하는 계약에 관한 법률 시행령 제39조 제4항, 시행규칙 제44조, 용역입찰유의서 제12조에 저촉될 경우 입찰은 무효로 함\n   - 낙찰자 결정 전 낙찰예정자의 입찰이 용역입찰유의서 제12조의 무효입찰에 해당되는 경우 무효입찰로 처리\n ▢ 제안내용에 대한 확인을 위하여 추가 자료 요청 및 현지실사를 할 수 있으며 입찰참가자는 이에 응하여야 함\n ▢ 계약상의 사업을 수행함에 있어 부실, 조잡 또는 부당하게 하거나, 부정한 행위를 한 사업자는 향후 신규사업의 참여에 제한을 받을 수 있음\n ▢ 계약 해제‧해지 사항\n   - 사업수행자가 정당한 사유 없이 약정한 착수기일을 경과하고도  사업에 착수하지 아니할 경우\n   - 계약서상의 사업을 기한 내에 수행사의 사유로 완료할 가능성 없음이 명백히 인정될 경우\n   - 과업을 정당한 사유 없이 이행하지 않은 경우 \n   - 제안 내용의 전부 또는 일부에 대하여 담합한 사실이 발견되는 경우에는 제안을 무효로 함\n ▢ 관계 법령 등의 숙지\n   - 입찰에 참가하고자 하는 자는 시행령 등의 입찰 관련 법령 및 용역입찰유의서 제4조 제1항의 규정에 의한 입찰에 관한 서류를 입찰 전에 완전히 숙지하여야 하며 이를 숙지하지 못한 책임은 입찰 참가자에게 있음\n   - 입찰에 참가하고자 하는 자는 용역입찰유의서 제5조 제1항의 규정에 의해 입찰에 관한 서류의 검토과정에서 발견한 입찰에 관한 서류상의 착오 또는 기타 설명이 요구되는 사항에 대하여는 입철서 제출마감일 전일까지 주관기관에 그 설명을 요구할 수 있음\n ▢ 제안요청서 및 제안서의 내용에 대한 해석상의 문제"", ""11. 기타 안내사항 \n▢ (과업심의위원회 개최)본 사업은 「소프트웨어 진흥법」 제50조에 따른 과업내용 확정을 위하여 과업심의위원회를 개최한 사업임\n   - (과업내용 변경) 본 사업은 「소프트웨어 진흥법」제50조, 같은 법 시행령 제47조 제1항 제2호, 제3호에 따라 과업내용 변경 및 그에 따른 계약금액·계약기간 조정이 필요한 경우, 계약상대자는 국가기관등의 장에게 소프트웨어사업 과업변경요청서*를 제출하여야 하며, 국가기관등의 장은 과업심의위원회 개최 요청에 대해서 특별한 사정이 없으면 수용해야 함\n  　  * 「소프트웨어사업 계약 및 관리감독에 관한 지침」별지 제13호서식  　　소프트웨어 과업변경요청서를 작성하여 제출\n ▢ (적정사업기간 산정)  ｢소프트웨어사업 계약 및 관리감독에 관한 지침｣ 제10조에 따라 소프트웨어 개발사업 적정 사업기간 산정 기준에 따른 사업임\n ▢ (SW사업 영향평가) 「소프트웨어 진흥법」제43조, 같은 법 시행령 제35조 내지 제37조, 「소프트웨어사업 계약 및 관리감독에 관한 지침」제5조, 제6조에 따라 소프트웨어사업 영향평가를 미리 실시한 사업임\n ▢ (감리 非대상) 사업비 5억 원 미만의 정보시스템 구축사업으로서 「전자정부법 시행령 제71조」에 따라 정보시스템 감리 대상이 아님.\n ▢ (하도급 준수사항) 5개월 이내의 짧은 사업 기간으로 신속하고 정확한 사업 설계와 구축이 필요함. 이에 따라 사업의 수주자가 직접 수행함을 원칙으로 하며, 하도급계약은 승인하지 않음""]",,
A_single_pipeline,1,그랜드코리아레저(주)_2024년도 GKL  그룹웨어 시스템 구축 용역.hwp,central,사업예산은 얼마인가?,"1,515,000천원 (부가세 포함)",해당 정보를 찾을 수 없습니다.,[],,
B_rule_single_route,1,그랜드코리아레저(주)_2024년도 GKL  그룹웨어 시스템 구축 용역.hwp,central,사업예산은 얼마인가?,"1,515,000천원 (부가세 포함)",해당 정보를 찾을 수 없습니다.,[],,
C_rule_multi_route,1,그랜드코리아레저(주)_2024년도 GKL  그룹웨어 시스템 구축 용역.hwp,central,사업예산은 얼마인가?,"1,515,000천원 (부가세 포함)",해당 정보를 찾을 수 없습니다.,[],,
A_single_pipeline,1,나노종합기술원_스마트 팹 서비스 활용체계 구축관련 설비온라인 시스.hwp,central,이 사업의 용역예산은 얼마인가요?,"2,349,130,320 원 (VAT포함)", 본 사업의 하도급의 경우 「소프트웨어진흥법」 제51조제5항 및 「소프트웨어사업 계약 및 관리감독에 관한 지침」의 규정에 의하여 반드시 하도급계약 전에 발주기관으로부터 사전승인을 받아야 함,"[""3.1. 일반사항\n  □ 과업심의위원회\n     본 사업은 「소프트웨어진흥법」 제50조에 따른 과업내용 확정을 위하여 과업심의위원회를 개최한 사업임5\n     본 사업은 「소프트웨어진흥법」에 따라 계약당사자가 과업변경심의위원회 개최를 요청할 수 있음\n  □ 상용SW 직접구매 및 SW품질성능평가시험(BMT)\n     SW도입 대상 내역 : 해당없음\n     분리발주 제외 사유 : 해당없음\n □ 하도급 관리감독 및 시정요구\n     본 사업 관련해서 기술원은 「소프트웨어진흥법」 제51조제7항에 따라 하도급 제한규정 준수여부를 지속적으로 관리‧감독하여야 하고, 제1항부터 제5항까지의 규정을 위한한 계약상대자에게 시정을 요구하여야 함\n  □ 하도급 사전승인\n     본 사업의 하도급의 경우 「소프트웨어진흥법」 제51조제5항 및 「소프트웨어사업 계약 및 관리감독에 관한 지침」의 규정에 의하여 반드시 하도급계약 전에 발주기관으로부터 사전승인을 받아야 함\n  □ 하도급 비율제한\n     본 사업 과업의 일부를 하도급하려는 경우 「소프트웨어진흥법」 제51조제1항에 따라 물품(상용소프트웨어 포함) 구매금액을 제외한 소프트웨어사업금액의 100분의 50을 초과할 수 없으며, 같은법 제3항에 따라 다시 하도급은 원칙적으로 불험함. 다만, 같은 법 제51조제2항 각 호 및 제3항 각 호에 해당하는 경우 그러하지 아니함"", ""□ 하도급 계획서 제출 요청\n     본 사업 과업의 일부를 하도급하려는 경우 계약체결 시 「소프트웨어사업 계약 및 관리감독에 관한 지침」의 별지 제7호서식 ‘소프트웨어사업 하도급 계획서’를 제출하여야 함\n  □ 소프트웨어 기술성 평가시 ‘하도급계획적정성’ 평가 실시\n     본 사업은 기술성 평가 시 ‘하도급계획적정성’을 평가항목에 포함하는 사업으로 「소프트웨어 기술성 평가기준 지침｣ 별지 제4호서식 소프트웨어사업 하도급 계획 적정성 확인서‘를 제출해야 함\n  □ 하도급 계약의 적정성 판단 세부기준 명시\n     하도급계약의 승인을 신청하는 경우, 「소프트웨어사업 계약 및 관리감독에 관한 지침」의 별표 3 [하도급계약의 적정성 판단 세부기준]에 따라 적정성여부를 판단하며, 평가점수가 85점 이상인 경우에 한하여 하도급계약을 승인함. 다만, 85점 이상인 경우라 하더라도 하도급 계약의 세부 조건 등으로 인하여 사업의 원활한 수행이 불가능하다고 인정되는 경우 그 사유를 기재하여 하도급 승인 거절을 통보할 수 있음\n  □ 공동수급체 구성\n     본 사업에서 전체 사업금액 대비 10%를 초과하여 하도급하려는 경우, 「소프트웨어 진흥법」 제51조제6항 및 동 법 시행령 제48조제5항에 따라 하수급인과 공동수급체를 구성하여 참여해야 하며, 공동수급체를 구성하지 못하는 불가피한 사정이 있는 경우 그 사유를 제시하여야 함\n  □ 작업장소 상호협의\n     계약당사자는 SW사업 수행을 위해 필요한 작업장소 등(장소, 설비, 기타 작업환경)을 상호협의하여 결정하며, 핵심 개발인력이 아닌 지원인력의 근무장소는 보안 등 특별한 사유가 있는 경우를 제외하고는 계약상대자가 달리 정할 수 있음\n     SW사업 수행을 위해 필요한 작업장소 등은 사업예산 내 계상되어 있으므로 관련 비용을 포함하여 제안가격을 산출하되, 작업장소 등은 상호협의하여 결정함\n     SW사업 수행을 위하여 필요한 작업장소는 기술원에서 제공하며, 설비 및 기타 작업환경은 계약상대자가 구비하여야 함""]",,
B_rule_single_route,1,나노종합기술원_스마트 팹 서비스 활용체계 구축관련 설비온라인 시스.hwp,central,이 사업의 용역예산은 얼마인가요?,"2,349,130,320 원 (VAT포함)","다만, 85점 이상인 경우라 하더라도 하도급 계약의 세부 조건 등으로 인하여 사업의 원활한 수행이 불가능하다고 인정되는 경우 그 사유를 기재하여 하도급 승인 거절을 통보할 수 있음","[""□ 하도급 계획서 제출 요청\n     본 사업 과업의 일부를 하도급하려는 경우 계약체결 시 「소프트웨어사업 계약 및 관리감독에 관한 지침」의 별지 제7호서식 ‘소프트웨어사업 하도급 계획서’를 제출하여야 함\n  □ 소프트웨어 기술성 평가시 ‘하도급계획적정성’ 평가 실시\n     본 사업은 기술성 평가 시 ‘하도급계획적정성’을 평가항목에 포함하는 사업으로 「소프트웨어 기술성 평가기준 지침｣ 별지 제4호서식 소프트웨어사업 하도급 계획 적정성 확인서‘를 제출해야 함\n  □ 하도급 계약의 적정성 판단 세부기준 명시\n     하도급계약의 승인을 신청하는 경우, 「소프트웨어사업 계약 및 관리감독에 관한 지침」의 별표 3 [하도급계약의 적정성 판단 세부기준]에 따라 적정성여부를 판단하며, 평가점수가 85점 이상인 경우에 한하여 하도급계약을 승인함. 다만, 85점 이상인 경우라 하더라도 하도급 계약의 세부 조건 등으로 인하여 사업의 원활한 수행이 불가능하다고 인정되는 경우 그 사유를 기재하여 하도급 승인 거절을 통보할 수 있음\n  □ 공동수급체 구성\n     본 사업에서 전체 사업금액 대비 10%를 초과하여 하도급하려는 경우, 「소프트웨어 진흥법」 제51조제6항 및 동 법 시행령 제48조제5항에 따라 하수급인과 공동수급체를 구성하여 참여해야 하며, 공동수급체를 구성하지 못하는 불가피한 사정이 있는 경우 그 사유를 제시하여야 함\n  □ 작업장소 상호협의\n     계약당사자는 SW사업 수행을 위해 필요한 작업장소 등(장소, 설비, 기타 작업환경)을 상호협의하여 결정하며, 핵심 개발인력이 아닌 지원인력의 근무장소는 보안 등 특별한 사유가 있는 경우를 제외하고는 계약상대자가 달리 정할 수 있음\n     SW사업 수행을 위해 필요한 작업장소 등은 사업예산 내 계상되어 있으므로 관련 비용을 포함하여 제안가격을 산출하되, 작업장소 등은 상호협의하여 결정함\n     SW사업 수행을 위하여 필요한 작업장소는 기술원에서 제공하며, 설비 및 기타 작업환경은 계약상대자가 구비하여야 함"", ""3.1. 일반사항\n  □ 과업심의위원회\n     본 사업은 「소프트웨어진흥법」 제50조에 따른 과업내용 확정을 위하여 과업심의위원회를 개최한 사업임5\n     본 사업은 「소프트웨어진흥법」에 따라 계약당사자가 과업변경심의위원회 개최를 요청할 수 있음\n  □ 상용SW 직접구매 및 SW품질성능평가시험(BMT)\n     SW도입 대상 내역 : 해당없음\n     분리발주 제외 사유 : 해당없음\n □ 하도급 관리감독 및 시정요구\n     본 사업 관련해서 기술원은 「소프트웨어진흥법」 제51조제7항에 따라 하도급 제한규정 준수여부를 지속적으로 관리‧감독하여야 하고, 제1항부터 제5항까지의 규정을 위한한 계약상대자에게 시정을 요구하여야 함\n  □ 하도급 사전승인\n     본 사업의 하도급의 경우 「소프트웨어진흥법」 제51조제5항 및 「소프트웨어사업 계약 및 관리감독에 관한 지침」의 규정에 의하여 반드시 하도급계약 전에 발주기관으로부터 사전승인을 받아야 함\n  □ 하도급 비율제한\n     본 사업 과업의 일부를 하도급하려는 경우 「소프트웨어진흥법」 제51조제1항에 따라 물품(상용소프트웨어 포함) 구매금액을 제외한 소프트웨어사업금액의 100분의 50을 초과할 수 없으며, 같은법 제3항에 따라 다시 하도급은 원칙적으로 불험함. 다만, 같은 법 제51조제2항 각 호 및 제3항 각 호에 해당하는 경우 그러하지 아니함"", ""3.2. 기타사항\n  □ 기타 제안관련 정보\n     제안서에 기재된 핵심인력의 기술 및 경력사항 등 중요한 내용이 허위로 밝혀지는 경우 기술원은 계약파기, 손해배상청구 등 필요한 조치를 할 수 있음\n     일정지연, 품질저하에 따르는 예산초과 등 리스크 발생을 사전에 예방하고 발생 시 사후 대처 방안을 제시하여야 함\n     제안서에는 본 사업에 대한 이해 하에 전체적인 사업추진 방안이 구체적으로 제시되어야 하며, 사업추진 목표 달성을 위해 추가해야할 사항이 있을 경우, 추진방안과 제안업체의 역할을 명확히 제시해야 함\n     제안사는 본 사업의 성공을 위한 신기술 적용방안을 제안 할 수 있음""]",,
C_rule_multi_route,1,나노종합기술원_스마트 팹 서비스 활용체계 구축관련 설비온라인 시스.hwp,central,이 사업의 용역예산은 얼마인가요?,"2,349,130,320 원 (VAT포함)","다만, 85점 이상인 경우라 하더라도 하도급 계약의 세부 조건 등으로 인하여 사업의 원활한 수행이 불가능하다고 인정되는 경우 그 사유를 기재하여 하도급 승인 거절을 통보할 수 있음","[""□ 하도급 계획서 제출 요청\n     본 사업 과업의 일부를 하도급하려는 경우 계약체결 시 「소프트웨어사업 계약 및 관리감독에 관한 지침」의 별지 제7호서식 ‘소프트웨어사업 하도급 계획서’를 제출하여야 함\n  □ 소프트웨어 기술성 평가시 ‘하도급계획적정성’ 평가 실시\n     본 사업은 기술성 평가 시 ‘하도급계획적정성’을 평가항목에 포함하는 사업으로 「소프트웨어 기술성 평가기준 지침｣ 별지 제4호서식 소프트웨어사업 하도급 계획 적정성 확인서‘를 제출해야 함\n  □ 하도급 계약의 적정성 판단 세부기준 명시\n     하도급계약의 승인을 신청하는 경우, 「소프트웨어사업 계약 및 관리감독에 관한 지침」의 별표 3 [하도급계약의 적정성 판단 세부기준]에 따라 적정성여부를 판단하며, 평가점수가 85점 이상인 경우에 한하여 하도급계약을 승인함. 다만, 85점 이상인 경우라 하더라도 하도급 계약의 세부 조건 등으로 인하여 사업의 원활한 수행이 불가능하다고 인정되는 경우 그 사유를 기재하여 하도급 승인 거절을 통보할 수 있음\n  □ 공동수급체 구성\n     본 사업에서 전체 사업금액 대비 10%를 초과하여 하도급하려는 경우, 「소프트웨어 진흥법」 제51조제6항 및 동 법 시행령 제48조제5항에 따라 하수급인과 공동수급체를 구성하여 참여해야 하며, 공동수급체를 구성하지 못하는 불가피한 사정이 있는 경우 그 사유를 제시하여야 함\n  □ 작업장소 상호협의\n     계약당사자는 SW사업 수행을 위해 필요한 작업장소 등(장소, 설비, 기타 작업환경)을 상호협의하여 결정하며, 핵심 개발인력이 아닌 지원인력의 근무장소는 보안 등 특별한 사유가 있는 경우를 제외하고는 계약상대자가 달리 정할 수 있음\n     SW사업 수행을 위해 필요한 작업장소 등은 사업예산 내 계상되어 있으므로 관련 비용을 포함하여 제안가격을 산출하되, 작업장소 등은 상호협의하여 결정함\n     SW사업 수행을 위하여 필요한 작업장소는 기술원에서 제공하며, 설비 및 기타 작업환경은 계약상대자가 구비하여야 함"", ""3.1. 일반사항\n  □ 과업심의위원회\n     본 사업은 「소프트웨어진흥법」 제50조에 따른 과업내용 확정을 위하여 과업심의위원회를 개최한 사업임5\n     본 사업은 「소프트웨어진흥법」에 따라 계약당사자가 과업변경심의위원회 개최를 요청할 수 있음\n  □ 상용SW 직접구매 및 SW품질성능평가시험(BMT)\n     SW도입 대상 내역 : 해당없음\n     분리발주 제외 사유 : 해당없음\n □ 하도급 관리감독 및 시정요구\n     본 사업 관련해서 기술원은 「소프트웨어진흥법」 제51조제7항에 따라 하도급 제한규정 준수여부를 지속적으로 관리‧감독하여야 하고, 제1항부터 제5항까지의 규정을 위한한 계약상대자에게 시정을 요구하여야 함\n  □ 하도급 사전승인\n     본 사업의 하도급의 경우 「소프트웨어진흥법」 제51조제5항 및 「소프트웨어사업 계약 및 관리감독에 관한 지침」의 규정에 의하여 반드시 하도급계약 전에 발주기관으로부터 사전승인을 받아야 함\n  □ 하도급 비율제한\n     본 사업 과업의 일부를 하도급하려는 경우 「소프트웨어진흥법」 제51조제1항에 따라 물품(상용소프트웨어 포함) 구매금액을 제외한 소프트웨어사업금액의 100분의 50을 초과할 수 없으며, 같은법 제3항에 따라 다시 하도급은 원칙적으로 불험함. 다만, 같은 법 제51조제2항 각 호 및 제3항 각 호에 해당하는 경우 그러하지 아니함"", ""3.2. 기타사항\n  □ 기타 제안관련 정보\n     제안서에 기재된 핵심인력의 기술 및 경력사항 등 중요한 내용이 허위로 밝혀지는 경우 기술원은 계약파기, 손해배상청구 등 필요한 조치를 할 수 있음\n     일정지연, 품질저하에 따르는 예산초과 등 리스크 발생을 사전에 예방하고 발생 시 사후 대처 방안을 제시하여야 함\n     제안서에는 본 사업에 대한 이해 하에 전체적인 사업추진 방안이 구체적으로 제시되어야 하며, 사업추진 목표 달성을 위해 추가해야할 사항이 있을 경우, 추진방안과 제안업체의 역할을 명확히 제시해야 함\n     제안사는 본 사업의 성공을 위한 신기술 적용방안을 제안 할 수 있음"", ""1.1. 개 요\n  □ 용 역 명 : 스마트 팹 서비스 활용체계 구축관련 설비 온라인 시스템 구축 용역\n  □ 용역기간 : 계약체결일로부터 18개월\n    ○ 추진일정은 사업기간 내에 과업별 특성에 따라 제안하고 추후 협의할 수 있음\n    ○ 본 사업은 소프트웨어 개발사업 적정 사업기간 산정 기준에 따른 사업임\n       ※ 산정내용 별도 첨부자료(사업기간 산정서) 참조\n  □ 용역예산 : 2,349,130,320 원 (VAT포함)\n  □ 입찰방법 : 제한경쟁입찰 / 협상에 의한 계약""]",,
A_single_pipeline,1,남서울대학교_[혁신-국고] 남서울대학교 스마트 정보시스템 활성화(학사.hwp,central,사업 범위에 포함된 파일 암호화 적용 및 암/복호화 모듈 적용 대상 시스템은 무엇인가?,기존 파일에 대한 암호화 적용; 학부 학사포털 서비스에 파일 암/복호화 모듈 적용; 대학원 학사포털 서비스에 파일 암/복호화 모듈 적용; 평생교육원(학점은행) 학사포털 서비스에 파일 암/복호화 모듈 적용; 연구행정 및 업적관리 시스템에 대한 파일 암/복호화 모듈 적용; 학생경력관리 플랫폼에 대한 파일 암/복호화 모듈 적용,"- 우리 대학이 보유하고 있는 서비스에 암/복호화 모듈 적용하고, 향후 신규 시스템 도입시에 대한 적용 가이드 마련하여 지속적인 파일 보안 유지","[""□ 관리적 전략\n  - 정보화시스템 구축 관련 법령, 지침 및 가이드를 준수한 표준관리체계를 수립하여, 본 사업 수행 전반에 적용\n  - 적용 대상 시스템 분석·설계 단계에서 의사소통 및 협업체계 조직의 의견을 수렴하고, 구현·검사 단계에서 보고회와 시연을 실시\n □ 기술적 전략\n  - 기존에 암호화 되어있지 않은 모든 파일에 대한 암호화 진행하여 보안 강화\n  - 우리 대학이 보유하고 있는 서비스에 암/복호화 모듈 적용하고, 향후 신규 시스템 도입시에 대한 적용 가이드 마련하여 지속적인 파일 보안 유지"", ""가. 사업 범위\n □ 기존 파일에 대한 암호화 적용 \n □ 학부 학사포털 서비스에 파일 암/복호화 모듈 적용\n □ 대학원 학사포털 서비스에 파일 암/복호화 모듈 적용\n □ 평생교육원(학점은행) 학사포털 서비스에 파일 암/복호화 모듈 적용\n □ 연구행정 및 업적관리 시스템에 대한 파일 암/복호화 모듈 적용\n □ 학생경력관리 플랫폼에 대한 파일 암/복호화 모듈 적용""]",,
B_rule_single_route,1,남서울대학교_[혁신-국고] 남서울대학교 스마트 정보시스템 활성화(학사.hwp,central,사업 범위에 포함된 파일 암호화 적용 및 암/복호화 모듈 적용 대상 시스템은 무엇인가?,기존 파일에 대한 암호화 적용; 학부 학사포털 서비스에 파일 암/복호화 모듈 적용; 대학원 학사포털 서비스에 파일 암/복호화 모듈 적용; 평생교육원(학점은행) 학사포털 서비스에 파일 암/복호화 모듈 적용; 연구행정 및 업적관리 시스템에 대한 파일 암/복호화 모듈 적용; 학생경력관리 플랫폼에 대한 파일 암/복호화 모듈 적용,기술평가와 가격평가를 실시하여 종합평가점수 산출,"[""가. 기술평가와 가격평가를 실시하여 종합평가점수 산출\n □ 평가비율: 기술평가(90%), 가격평가(10%)\n   - 기술평가는 100점 기준으로 평가 후 평가점수의 90% 환산반영\n □ 종합평가점수: 기술평가 점수 + 가격평가 점수 \n □ 종합평가점수가 높은 업체를 우선협상대상자로 선정\n □ 종합평가점수 동점 시 처리방침\n   - 종합평가점수가 동점인 경우 기술평가 점수가 높은 업체를 선정\n   - 기술평가점수도 동일한 경우 배점이 높은 평가항목에서 점수가 높은 업체 선정\n □ 평가점수는 소수점 다섯째 자리에서 반올림하여 소수점 이하 넷째자리까지 산출\n 나. 기술평가 방법 \n □ 제안서의 공정한 기술평가를 위해 전문가로 구성된 기술평가위원회를 구성‧운영\n □ 기술평가는「소프트웨어 기술성 평가기준 지침(과학기술정보통신부고시 제2020-100호)」의 ‘기술제안서 평가항목 및 배점한도’를 준용\n □ 각 평가위원의 평가점수 중 최고점수와 최저점수를 제외한 나머지 점수를 산술평균하여 90점 만점으로 환산하며, 기술능력평가 분야 배점한도의 85%이상인 사업자를 협상적격업체로 선정\n □ 제안사는「소프트웨어 기술성 평가기준 지침」제5조제6항에 따라 기술성 평가항목별 자가점검표를 작성하여 제안서에 포함하여야 함\n 다. 가격평가 방법 \n □ 예정가격은 사업의 예산규모 내에서 관련 법령 및 관계규정에 따라 계약부서에서 결정 \n □「협상에 의한 계약체결 기준」에 따라 평가점수 산출\n 라. 협상 적격자 선정 및 협상 \n □ 협상 적격자 중 종합평가점수가 1위인 제안사를 우선협상대상자로 선정하여 기타 지원조건 등을 협상 \n □ 우선협상대상자와 협상 결렬 시 동일한 기준‧절차에 따라 순차적으로 차(次) 순위자와 협상을 실시\n   - 협상대상자가 제안한 내용을 가감하는 경우에는 그 가감되는 내용에 상당하는 금액을 당해 사업예산(또는 예정가격) 범위 내에서 조정 가능\n □ 협상대상자와 협상이 모두 결렬되면 재공고하여 재입찰을 추진\n □ 기타 규정되지 않은 사항은 조달청 규정에 의함"", ""주4) ① 세부평가항목 A~C는 중복하여 평가한다.\n        ② 모든 세부평가항목에 해당하지 않는 경우, 해당 평가항목의 배점한도를 부여한다.\n        ③ 공동수급체를 평가하는 경우 해당 사유가 있는 구성원의 출자비율 또는 분담비율에 해당하는 점수(소수점 다섯째 자리에서 반올림하여 산출)만큼 감점한다. \n        ④ A.최저임금 위반 평가는 입찰공고일을 기준으로 최근 3년 이내에 최저임금법 위반으로 유죄판결이 확정되어 고용노동부 장관으로부터 통보된 사업장을 기준으로 적용한다.\n        ⑤ B.임금체불 평가는 입찰공고일을 기준으로 고용노동부장관이 공개중인 체불사업주 명단의 사업장에 대하여 적용한다.\n        ⑥ C.고용개선조치 미이행 평가는 입찰공고일을 기준으로 최근 2년 이내에 고용노동부장관이 공표한 적극적 고용개선조치 미이행 사업주 명단의 자료에 표시된 사업장을 기준으로 적용한다. 다만, 2017년 5월 1일 이후 공표된 자부터 적용한다."", ""□ 추정가격 20억원 미만 사업으로 중소기업자만 입찰참가 가능\n   -「국가를 당사자로 하는 계약에 관한 법률」시행령 제21조(제한경쟁입찰에 의할 계약과 제한사항 등) 제1항 참조 \n   -「중소기업제품 구매촉진 및 판로지원에 관한 법률」제9조(직접생산의 확인 등)에 의한 개찰일 전일까지 발급받은 유효기간 내 ‘직접생산확인증명서(정보시스템개발서비스)’ 제출 필요\n □ 공동수급(컨소시엄) 및 하도급 : 허용\n본 사업은 공동이행방식 형태의 공동수급을 허용하며, 공동수급업체 구성원은「국가를 당사자로 하는 계약에 관한 법률 시행령」제12조(경쟁입찰의 참가자격) 동법 시행규칙 제14조(입찰참가자격요건의 증명) 규정에 저촉되지 않아야 함\n  ❍ 공동수급업체는 5개 이하로 구성하되, 구성원별 계약참여 최소지분율은 10%이상(공동계약운용요령 제9조 제5항 참조)이어야 함\n □ 본 제안에 하도급을 포함한 경우 다음 사항을 준수하여야 함\n  ❍ 본 사업의 과업의 일부를 하도급하려는 경우「소프트웨어 진흥법」제20조의3 제1항에 따라 사업금액의 100분의 50을 초과할 수 없으며, 제2항에 따라 재하도급은 원칙적으로 불허함. 다만, 같은 법 제20조의3 제1항 및 제2항 각 호에 해당하는 경우 그러하지 아니함\n  ❍ 원도급자가 지급하는 하도급 대금을 별지 제 5호 서식으로 제안서에 포함하여 제출하여야 함\n  ❍ 하도급금액이 전체 사업금액의 10% 이상인 경우에는 공동수급체를 구성하여 본 사업에 참여하고, 공동수급체를 구성하지 못하는 불가피한 사정이 있는 경우 이를 발주기관에 제시(소프트웨어 진흥법 제20조의3제4항)\n  ❍ 하도급의 계약부터 대금지급 및 실적관리를 조달청 ‘정부계약하도급관리시스템(하도급지킴이)’을 이용하여 실행하여야 함\n  ❍ 하도급 대금에 대한 기준은 직접인건비의 경우 한국소프트웨어협회장이 공표한 노임단가의 100%, 제경비와 기술료의 합은 직접인건비의 20% 이상으로 적용하여야 함\n  ❍「소프트웨어 진흥법」제20조의3 및「소프트웨어사업의 하도급 승인 및 관리 지""]",,
C_rule_multi_route,1,남서울대학교_[혁신-국고] 남서울대학교 스마트 정보시스템 활성화(학사.hwp,central,사업 범위에 포함된 파일 암호화 적용 및 암/복호화 모듈 적용 대상 시스템은 무엇인가?,기존 파일에 대한 암호화 적용; 학부 학사포털 서비스에 파일 암/복호화 모듈 적용; 대학원 학사포털 서비스에 파일 암/복호화 모듈 적용; 평생교육원(학점은행) 학사포털 서비스에 파일 암/복호화 모듈 적용; 연구행정 및 업적관리 시스템에 대한 파일 암/복호화 모듈 적용; 학생경력관리 플랫폼에 대한 파일 암/복호화 모듈 적용,기술평가와 가격평가를 실시하여 종합평가점수 산출,"[""가. 기술평가와 가격평가를 실시하여 종합평가점수 산출\n □ 평가비율: 기술평가(90%), 가격평가(10%)\n   - 기술평가는 100점 기준으로 평가 후 평가점수의 90% 환산반영\n □ 종합평가점수: 기술평가 점수 + 가격평가 점수 \n □ 종합평가점수가 높은 업체를 우선협상대상자로 선정\n □ 종합평가점수 동점 시 처리방침\n   - 종합평가점수가 동점인 경우 기술평가 점수가 높은 업체를 선정\n   - 기술평가점수도 동일한 경우 배점이 높은 평가항목에서 점수가 높은 업체 선정\n □ 평가점수는 소수점 다섯째 자리에서 반올림하여 소수점 이하 넷째자리까지 산출\n 나. 기술평가 방법 \n □ 제안서의 공정한 기술평가를 위해 전문가로 구성된 기술평가위원회를 구성‧운영\n □ 기술평가는「소프트웨어 기술성 평가기준 지침(과학기술정보통신부고시 제2020-100호)」의 ‘기술제안서 평가항목 및 배점한도’를 준용\n □ 각 평가위원의 평가점수 중 최고점수와 최저점수를 제외한 나머지 점수를 산술평균하여 90점 만점으로 환산하며, 기술능력평가 분야 배점한도의 85%이상인 사업자를 협상적격업체로 선정\n □ 제안사는「소프트웨어 기술성 평가기준 지침」제5조제6항에 따라 기술성 평가항목별 자가점검표를 작성하여 제안서에 포함하여야 함\n 다. 가격평가 방법 \n □ 예정가격은 사업의 예산규모 내에서 관련 법령 및 관계규정에 따라 계약부서에서 결정 \n □「협상에 의한 계약체결 기준」에 따라 평가점수 산출\n 라. 협상 적격자 선정 및 협상 \n □ 협상 적격자 중 종합평가점수가 1위인 제안사를 우선협상대상자로 선정하여 기타 지원조건 등을 협상 \n □ 우선협상대상자와 협상 결렬 시 동일한 기준‧절차에 따라 순차적으로 차(次) 순위자와 협상을 실시\n   - 협상대상자가 제안한 내용을 가감하는 경우에는 그 가감되는 내용에 상당하는 금액을 당해 사업예산(또는 예정가격) 범위 내에서 조정 가능\n □ 협상대상자와 협상이 모두 결렬되면 재공고하여 재입찰을 추진\n □ 기타 규정되지 않은 사항은 조달청 규정에 의함"", ""주4) ① 세부평가항목 A~C는 중복하여 평가한다.\n        ② 모든 세부평가항목에 해당하지 않는 경우, 해당 평가항목의 배점한도를 부여한다.\n        ③ 공동수급체를 평가하는 경우 해당 사유가 있는 구성원의 출자비율 또는 분담비율에 해당하는 점수(소수점 다섯째 자리에서 반올림하여 산출)만큼 감점한다. \n        ④ A.최저임금 위반 평가는 입찰공고일을 기준으로 최근 3년 이내에 최저임금법 위반으로 유죄판결이 확정되어 고용노동부 장관으로부터 통보된 사업장을 기준으로 적용한다.\n        ⑤ B.임금체불 평가는 입찰공고일을 기준으로 고용노동부장관이 공개중인 체불사업주 명단의 사업장에 대하여 적용한다.\n        ⑥ C.고용개선조치 미이행 평가는 입찰공고일을 기준으로 최근 2년 이내에 고용노동부장관이 공표한 적극적 고용개선조치 미이행 사업주 명단의 자료에 표시된 사업장을 기준으로 적용한다. 다만, 2017년 5월 1일 이후 공표된 자부터 적용한다."", ""□ 추정가격 20억원 미만 사업으로 중소기업자만 입찰참가 가능\n   -「국가를 당사자로 하는 계약에 관한 법률」시행령 제21조(제한경쟁입찰에 의할 계약과 제한사항 등) 제1항 참조 \n   -「중소기업제품 구매촉진 및 판로지원에 관한 법률」제9조(직접생산의 확인 등)에 의한 개찰일 전일까지 발급받은 유효기간 내 ‘직접생산확인증명서(정보시스템개발서비스)’ 제출 필요\n □ 공동수급(컨소시엄) 및 하도급 : 허용\n본 사업은 공동이행방식 형태의 공동수급을 허용하며, 공동수급업체 구성원은「국가를 당사자로 하는 계약에 관한 법률 시행령」제12조(경쟁입찰의 참가자격) 동법 시행규칙 제14조(입찰참가자격요건의 증명) 규정에 저촉되지 않아야 함\n  ❍ 공동수급업체는 5개 이하로 구성하되, 구성원별 계약참여 최소지분율은 10%이상(공동계약운용요령 제9조 제5항 참조)이어야 함\n □ 본 제안에 하도급을 포함한 경우 다음 사항을 준수하여야 함\n  ❍ 본 사업의 과업의 일부를 하도급하려는 경우「소프트웨어 진흥법」제20조의3 제1항에 따라 사업금액의 100분의 50을 초과할 수 없으며, 제2항에 따라 재하도급은 원칙적으로 불허함. 다만, 같은 법 제20조의3 제1항 및 제2항 각 호에 해당하는 경우 그러하지 아니함\n  ❍ 원도급자가 지급하는 하도급 대금을 별지 제 5호 서식으로 제안서에 포함하여 제출하여야 함\n  ❍ 하도급금액이 전체 사업금액의 10% 이상인 경우에는 공동수급체를 구성하여 본 사업에 참여하고, 공동수급체를 구성하지 못하는 불가피한 사정이 있는 경우 이를 발주기관에 제시(소프트웨어 진흥법 제20조의3제4항)\n  ❍ 하도급의 계약부터 대금지급 및 실적관리를 조달청 ‘정부계약하도급관리시스템(하도급지킴이)’을 이용하여 실행하여야 함\n  ❍ 하도급 대금에 대한 기준은 직접인건비의 경우 한국소프트웨어협회장이 공표한 노임단가의 100%, 제경비와 기술료의 합은 직접인건비의 20% 이상으로 적용하여야 함\n  ❍「소프트웨어 진흥법」제20조의3 및「소프트웨어사업의 하도급 승인 및 관리 지"", ""주2) \n 1.「신용정보의 이용 및 보호에 관한 법률」제2조 제8의3에 해당하는 신용조회사 또는「자본시장과 금융투자업에 관한 법률」제335조의3에 따라 업무를 영위하는 신용평가사가 입찰공고일 이전에 평가하고 유효기간 내에 있는 회사채, 기업어음 및 기업신용평가등급을 국가종합전자조달시스템에 조회된 신용평가등급으로 평가하되, 가장 최근의 신용평가등급으로 평가한다. 다만, 가장 최근의 신용평가등급이 다수가 있으며 그 결과가 서로 다른 경우에는 가장 낮은 등급으로 평가한다.\n 2. 국가종합전자조달시스템에서 신용평가등급 확인서가 확인되지 않은 경우에는 최저등급으로 평가하며, 유효기간 시작일 또는 만료일이 입찰공고일인 경우에도 유효한 것으로 평가한다. 다만, 입찰공고일 다음날 이후에 발생 또는 수정된 자료는 평가에서 제외한다.\n 3. 주 1에도 불구하고, 합병 또는 분할한 자가 입찰공고일 이전에 평가한 신용평가등급이 없는 경우에는 입찰서 제출 마감일 전일까지 발급된 유효기간 내에 있는 가장 최근의 신용평가등급으로 평가한다. 다만, 합병 후 새로운 신용평가등급이 없는 경우에는 입찰공고일 이전에 평가하고 유효기간 내에 있는 신용평가등급으로서 합병 대상자 중 가장 낮은 신용평가등급을 받은 자의 신용평가등급으로 평가한다.\n 4. 추정가격이 고시금액 미만인 입찰에서 입찰공고일을 기준으로 최근 7년 이내에 사업을 개시한 창업기업에 대해서는 신용평가등급 점수상의 배점 한도를 부여한다. 이 경우 창업기업에 대한 확인은 「중소기업제품공공구매 종합정보망」에 등재된 자료로 확인하며, 창업기업확인서의 유효기간 내에 있어야 한다. 다만, 제안서 평가일 전일까지 발급된 자료도 심사에 포함하며, 이 경우 입찰공고일 이전 창업을 확인 할 수 있는 자료(법인인 경우 법인등기부상 법인설립등기일, 개인사업자인 경우에는 사업자등록증명서 상 사업자등록일)를 제출하여야 한다.(이하 창업기업에 대한 확인방법은 같다)""]",,
A_single_pipeline,1,대검찰청_아태 사이버범죄 역량강화 허브(APC-HUB) 홈페이지 및 온라인 교.hwp,central,이 사업의 계약방법(입찰방식)은 무엇인가?,"제한경쟁입찰, 협상에 의한 계약",- 본 사업의 계약방식은 「국가를 당사자로 하는 계약에 관한 법률 시행령」 제43조 규정에 의한 협상에 의한 계약 체결방식을 적용한다,"[""2. 입찰방식\n◦ 입찰 및 사업자 선정방법\n - 입찰방법 : 제한경쟁입찰, 협상에 의한 계약\n - 본 사업의 계약방식은 「국가를 당사자로 하는 계약에 관한 법률 시행령」 제43조 규정에 의한 협상에 의한 계약 체결방식을 적용한다.\n - 협상은 제안서 기술평가(90%)와 가격평가(10%)를 종합평가한 결과 고득점자순으로 한다. 다만, 제안서 평가결과 기술능력 평가점수가 배점한도의 85% 미만은 협상대상에서 제외한다.\n  ※ 기타사항은 계약예규 ‘협상에 의한 계약체결기준’에 의한다.\n◦ 입찰 참가 자격\n - 입찰 공고일 현재 「국가를 당사자로 하는 계약에 관한 법률 시행령」제12조 및 동법 시행령 제14조에 의거 입찰참가 자격요건을 갖춘 업체\n - 입찰 공고일 현재 「국가를 당사자로 하는 계약에 관한 법률 시행령」 제76조(부정당업자의 입찰참가자격 제한)에 의거 부정당업자에 해당하지 않은 자\n - 공고일 현재 ｢소프트웨어진흥법｣ 제24조의 규정에 의한 소프트웨어 사업자(컴퓨터관련서비스사업, 업종코드: 1468)로 등록된 사업자\n - 본 사업은 사업금액이 20억원 미만인 사업으로서, 대기업인 소프트웨어사업자 참여할 수 있는 사업금액의 하한에 대한 관련 규정 : 「중소 소프트웨어사업자의 사업 참여 지원에 관한 지침」(과학기술정보통신부고시 제2024-9호)에 의거 대기업 소프트웨어 사업자는 본 입찰에 참여할 수 없으며,「소프트웨어진흥법」제48조 제4항에 따라「독점규제 및 공정거래에 관한 법률」제14조에 따라 지정된 상호출자제한기업집단에 속하는 기업도 입찰에 참여할 수 없음\n - 「중소기업제품구매촉진 및 판로지원에 관한 법률」제9조 및 동법 시행규칙 제5조에 따라 발급된 직접생산확인증명서 [전산업무(소프트웨어개발)-정보시스템개발서비스, 분류번호: 8111159901](전자입찰서 제출 마감일 전일까지 발급된 것으로 유효기간 내에 있어야 함)를 소지한 업체\n - 「중소기업기본법」제2조에 따른 소기업자 또는 「소상공인 보호 및 지원에 관한 법률」 제2조에 따른 소상공인으로서 "", ""4. 사업 계획 \n   가. 용역기간 : 계약일로부터 5개월(2024년 11월 30일 이내)\n    ※ 국가정보자원관리원과의 최종 운영 테스트 완료 시 까지임\n   나. 사 업 비 : 35,750천 원(부가가치세 포함)\n   다. 계약방법 : 제한경쟁입찰, 협상에 의한 계약\n     ※『국가를 당사자로 하는 계약에 관한 법률』시행령 제43조에 따른 협상에 의한 계약\n   라. 참가자격 등 기타 사항은 입찰 공고서 참고""]",,
B_rule_single_route,1,대검찰청_아태 사이버범죄 역량강화 허브(APC-HUB) 홈페이지 및 온라인 교.hwp,central,이 사업의 계약방법(입찰방식)은 무엇인가?,"제한경쟁입찰, 협상에 의한 계약",- 본 사업의 계약방식은 「국가를 당사자로 하는 계약에 관한 법률 시행령」 제43조 규정에 의한 협상에 의한 계약 체결방식을 적용한다,"[""2. 입찰방식\n◦ 입찰 및 사업자 선정방법\n - 입찰방법 : 제한경쟁입찰, 협상에 의한 계약\n - 본 사업의 계약방식은 「국가를 당사자로 하는 계약에 관한 법률 시행령」 제43조 규정에 의한 협상에 의한 계약 체결방식을 적용한다.\n - 협상은 제안서 기술평가(90%)와 가격평가(10%)를 종합평가한 결과 고득점자순으로 한다. 다만, 제안서 평가결과 기술능력 평가점수가 배점한도의 85% 미만은 협상대상에서 제외한다.\n  ※ 기타사항은 계약예규 ‘협상에 의한 계약체결기준’에 의한다.\n◦ 입찰 참가 자격\n - 입찰 공고일 현재 「국가를 당사자로 하는 계약에 관한 법률 시행령」제12조 및 동법 시행령 제14조에 의거 입찰참가 자격요건을 갖춘 업체\n - 입찰 공고일 현재 「국가를 당사자로 하는 계약에 관한 법률 시행령」 제76조(부정당업자의 입찰참가자격 제한)에 의거 부정당업자에 해당하지 않은 자\n - 공고일 현재 ｢소프트웨어진흥법｣ 제24조의 규정에 의한 소프트웨어 사업자(컴퓨터관련서비스사업, 업종코드: 1468)로 등록된 사업자\n - 본 사업은 사업금액이 20억원 미만인 사업으로서, 대기업인 소프트웨어사업자 참여할 수 있는 사업금액의 하한에 대한 관련 규정 : 「중소 소프트웨어사업자의 사업 참여 지원에 관한 지침」(과학기술정보통신부고시 제2024-9호)에 의거 대기업 소프트웨어 사업자는 본 입찰에 참여할 수 없으며,「소프트웨어진흥법」제48조 제4항에 따라「독점규제 및 공정거래에 관한 법률」제14조에 따라 지정된 상호출자제한기업집단에 속하는 기업도 입찰에 참여할 수 없음\n - 「중소기업제품구매촉진 및 판로지원에 관한 법률」제9조 및 동법 시행규칙 제5조에 따라 발급된 직접생산확인증명서 [전산업무(소프트웨어개발)-정보시스템개발서비스, 분류번호: 8111159901](전자입찰서 제출 마감일 전일까지 발급된 것으로 유효기간 내에 있어야 함)를 소지한 업체\n - 「중소기업기본법」제2조에 따른 소기업자 또는 「소상공인 보호 및 지원에 관한 법률」 제2조에 따른 소상공인으로서 "", ""3. 제안서 평가방법\n◦ 평가기준 및 평가방법\n - 기술평가와 가격평가를 실시하여 종합평가점수로 산출 \n - ‘제안서 평가항목 및 배점’은 「협상에 의한 계약 제안서평가 세부기준」(조달청 지침)을 준용하되 본 사업의 특성에 맞게 조정함\n  ※ 아래 ‘제안서 기술평가 항목 및 배점한도’ 참조\n - 종합평가점수 산출\n  · 종합평가점수 = 기술 평가 + 입찰가격 평가\n - 제안서의 평가항목 및 배점 : 총 100점\n  · 기술능력평가 : 90점   \n   ※ 대검찰청은 외부전문가를 포함한 기술평가 심의위원회를 구성하여 아래 ‘제안서 평가항목 및 배점한도’의 기준에 따라 자체 기술 평가 실시\n  · 가격평가(입찰가격평가) : 10점   ※「협상에 의한 계약체결기준」(기획재정부계약예규)에 의해 평가점수 산출\n - 평가점수에서 소수점 이하가 있는 경우 소수점 5자리에서 반올림\n◦ 협상적격자 및 협상순위의 선정\n - 제안서 평가결과 기술능력평가 점수가 기술능력평가분야 배점한도의 85% 이상인 자를 협상적격자로 선정한다.\n - 협상순서는 협상적격자의 기술능력평가 점수와 입찰가격평가 점수를 합산하여 합산점수의 고득점 순에 따라 결정하며, 평가 결과 협상적격자가 없는 경우에는 재공고 입찰에 부칠 수 있다.\n - 합산점수가 동일한 제안자가 2인 이상일 경우에는 기술능력 평가점수가 높은 제안자를 선순위자로 하고, 기술능력 평가점수도 동일한 경우에는 기술능력의 세부평가항목 중 배점이 큰 항목에서 높은 점수를 얻은 자를 선순위자로 하고, 기술능력 세부평가점수도 동일한 경우에는 추첨으로 정한다.\n - 협상이 성립된 때에는 다른 협상적격자와의 협상은 실시하지 않는다.\n - 선순위 협상대상자와의 협상이 성립되지 않으면 동일한 기준과 절차에 따라 순차적으로 차순위 협상적격자와 협상을 실시한다.\n - 모든 협상적격자와 협상 결렬 시 재공고입찰에 부칠 수 있다.\n◦ 기술성 평가 기준\n - 기술평가 항목 및 배점한도"", ""◦ SW산출물 반출 절차\n - 공급자는 지식재산권의 활용을 위하여 SW산출물의 반출을 요청할 수 있으며, 발주기관에서는 ｢보안업무규정｣ 제4조 및 제안요청서에 명시된 누출금지정보에 해당하지 않을 경우 SW산출물을 제공함. 다만 SW산출물의 활용 절차와 공급자가 SW산출물 활용 절차를 지키지 않는 경우 입찰참가자격 제한 등에 관하여는 ｢소프트웨어사업 계약 및 관리감독에 관한 지침｣(과학기술정보정통부 고시 제2023-15호) 제32조(산출물의 활용)에 따른다.\n◦ 개발 SW의 공동활용\n - 본 사업을 통해 개발되는 소프트웨어는 용역계약일반조건 제56조(계약목적물의 지식재산권 귀속)에 따라 타 기관과 공동 활용할 계획이 없음\n◦ 계약당사자는 SW사업 수행을 위해 필요한 작업장소 등(장소, 설비, 기타 작업환경)을 상호협의하여 결정하며, 핵심 개발인력이 아닌 지원인력의 근무장소는 보안 등 특별한 사유가 있는 경우를 제외하고는 계약상대자가 달리 정할 수 있음\n◦ 과업변경심의위원회 개최\n - 본 사업은 「소프트웨어 진흥법 제50조, 같은 법 시행령 제47조 제1항 제1호, 제3호에 따른 과업내용 변경 및 그에 따른 계약금액·계약기간 조정이 필요한 경우, 계약상대자는 국가기관 등의 장에게 소프트웨어사업 과업변경요청서를 제출하여야 함\n   ※「소프트웨어사업 계약 및 관리감독에 관한 지침」 별지 13호 서식 참조\n - 본 사업은「소프트웨어 진흥법」제50조에 따른 과업내용 확정을 위하여 과업심의워원회를 (✔)개최 또는 ( )미개최 한 사업임 (※ 미개최시 계약 전까지 개최 예정)    ※ 위 괄호 내 해당사항에 체크‘(✔)’ 표시""]",,
C_rule_multi_route,1,대검찰청_아태 사이버범죄 역량강화 허브(APC-HUB) 홈페이지 및 온라인 교.hwp,central,이 사업의 계약방법(입찰방식)은 무엇인가?,"제한경쟁입찰, 협상에 의한 계약",- 본 사업의 계약방식은 「국가를 당사자로 하는 계약에 관한 법률 시행령」 제43조 규정에 의한 협상에 의한 계약 체결방식을 적용한다,"[""2. 입찰방식\n◦ 입찰 및 사업자 선정방법\n - 입찰방법 : 제한경쟁입찰, 협상에 의한 계약\n - 본 사업의 계약방식은 「국가를 당사자로 하는 계약에 관한 법률 시행령」 제43조 규정에 의한 협상에 의한 계약 체결방식을 적용한다.\n - 협상은 제안서 기술평가(90%)와 가격평가(10%)를 종합평가한 결과 고득점자순으로 한다. 다만, 제안서 평가결과 기술능력 평가점수가 배점한도의 85% 미만은 협상대상에서 제외한다.\n  ※ 기타사항은 계약예규 ‘협상에 의한 계약체결기준’에 의한다.\n◦ 입찰 참가 자격\n - 입찰 공고일 현재 「국가를 당사자로 하는 계약에 관한 법률 시행령」제12조 및 동법 시행령 제14조에 의거 입찰참가 자격요건을 갖춘 업체\n - 입찰 공고일 현재 「국가를 당사자로 하는 계약에 관한 법률 시행령」 제76조(부정당업자의 입찰참가자격 제한)에 의거 부정당업자에 해당하지 않은 자\n - 공고일 현재 ｢소프트웨어진흥법｣ 제24조의 규정에 의한 소프트웨어 사업자(컴퓨터관련서비스사업, 업종코드: 1468)로 등록된 사업자\n - 본 사업은 사업금액이 20억원 미만인 사업으로서, 대기업인 소프트웨어사업자 참여할 수 있는 사업금액의 하한에 대한 관련 규정 : 「중소 소프트웨어사업자의 사업 참여 지원에 관한 지침」(과학기술정보통신부고시 제2024-9호)에 의거 대기업 소프트웨어 사업자는 본 입찰에 참여할 수 없으며,「소프트웨어진흥법」제48조 제4항에 따라「독점규제 및 공정거래에 관한 법률」제14조에 따라 지정된 상호출자제한기업집단에 속하는 기업도 입찰에 참여할 수 없음\n - 「중소기업제품구매촉진 및 판로지원에 관한 법률」제9조 및 동법 시행규칙 제5조에 따라 발급된 직접생산확인증명서 [전산업무(소프트웨어개발)-정보시스템개발서비스, 분류번호: 8111159901](전자입찰서 제출 마감일 전일까지 발급된 것으로 유효기간 내에 있어야 함)를 소지한 업체\n - 「중소기업기본법」제2조에 따른 소기업자 또는 「소상공인 보호 및 지원에 관한 법률」 제2조에 따른 소상공인으로서 "", ""3. 제안서 평가방법\n◦ 평가기준 및 평가방법\n - 기술평가와 가격평가를 실시하여 종합평가점수로 산출 \n - ‘제안서 평가항목 및 배점’은 「협상에 의한 계약 제안서평가 세부기준」(조달청 지침)을 준용하되 본 사업의 특성에 맞게 조정함\n  ※ 아래 ‘제안서 기술평가 항목 및 배점한도’ 참조\n - 종합평가점수 산출\n  · 종합평가점수 = 기술 평가 + 입찰가격 평가\n - 제안서의 평가항목 및 배점 : 총 100점\n  · 기술능력평가 : 90점   \n   ※ 대검찰청은 외부전문가를 포함한 기술평가 심의위원회를 구성하여 아래 ‘제안서 평가항목 및 배점한도’의 기준에 따라 자체 기술 평가 실시\n  · 가격평가(입찰가격평가) : 10점   ※「협상에 의한 계약체결기준」(기획재정부계약예규)에 의해 평가점수 산출\n - 평가점수에서 소수점 이하가 있는 경우 소수점 5자리에서 반올림\n◦ 협상적격자 및 협상순위의 선정\n - 제안서 평가결과 기술능력평가 점수가 기술능력평가분야 배점한도의 85% 이상인 자를 협상적격자로 선정한다.\n - 협상순서는 협상적격자의 기술능력평가 점수와 입찰가격평가 점수를 합산하여 합산점수의 고득점 순에 따라 결정하며, 평가 결과 협상적격자가 없는 경우에는 재공고 입찰에 부칠 수 있다.\n - 합산점수가 동일한 제안자가 2인 이상일 경우에는 기술능력 평가점수가 높은 제안자를 선순위자로 하고, 기술능력 평가점수도 동일한 경우에는 기술능력의 세부평가항목 중 배점이 큰 항목에서 높은 점수를 얻은 자를 선순위자로 하고, 기술능력 세부평가점수도 동일한 경우에는 추첨으로 정한다.\n - 협상이 성립된 때에는 다른 협상적격자와의 협상은 실시하지 않는다.\n - 선순위 협상대상자와의 협상이 성립되지 않으면 동일한 기준과 절차에 따라 순차적으로 차순위 협상적격자와 협상을 실시한다.\n - 모든 협상적격자와 협상 결렬 시 재공고입찰에 부칠 수 있다.\n◦ 기술성 평가 기준\n - 기술평가 항목 및 배점한도"", ""◦ SW산출물 반출 절차\n - 공급자는 지식재산권의 활용을 위하여 SW산출물의 반출을 요청할 수 있으며, 발주기관에서는 ｢보안업무규정｣ 제4조 및 제안요청서에 명시된 누출금지정보에 해당하지 않을 경우 SW산출물을 제공함. 다만 SW산출물의 활용 절차와 공급자가 SW산출물 활용 절차를 지키지 않는 경우 입찰참가자격 제한 등에 관하여는 ｢소프트웨어사업 계약 및 관리감독에 관한 지침｣(과학기술정보정통부 고시 제2023-15호) 제32조(산출물의 활용)에 따른다.\n◦ 개발 SW의 공동활용\n - 본 사업을 통해 개발되는 소프트웨어는 용역계약일반조건 제56조(계약목적물의 지식재산권 귀속)에 따라 타 기관과 공동 활용할 계획이 없음\n◦ 계약당사자는 SW사업 수행을 위해 필요한 작업장소 등(장소, 설비, 기타 작업환경)을 상호협의하여 결정하며, 핵심 개발인력이 아닌 지원인력의 근무장소는 보안 등 특별한 사유가 있는 경우를 제외하고는 계약상대자가 달리 정할 수 있음\n◦ 과업변경심의위원회 개최\n - 본 사업은 「소프트웨어 진흥법 제50조, 같은 법 시행령 제47조 제1항 제1호, 제3호에 따른 과업내용 변경 및 그에 따른 계약금액·계약기간 조정이 필요한 경우, 계약상대자는 국가기관 등의 장에게 소프트웨어사업 과업변경요청서를 제출하여야 함\n   ※「소프트웨어사업 계약 및 관리감독에 관한 지침」 별지 13호 서식 참조\n - 본 사업은「소프트웨어 진흥법」제50조에 따른 과업내용 확정을 위하여 과업심의워원회를 (✔)개최 또는 ( )미개최 한 사업임 (※ 미개최시 계약 전까지 개최 예정)    ※ 위 괄호 내 해당사항에 체크‘(✔)’ 표시"", ""<표>\n \n   ※ 허브 홈페이지의 컨텐츠가 저장된 서버를 관리하는 국가정보자원관리원(광주센터)과 사전 협의 필요\n   ※「소프트웨어사업 및 관리감독에 관한 지침」에 의한 소프트웨어 개발사업 적정 사업기간 산정기준에 따른 사업임. 별지 제4호 서식에 따른 “소프트웨어 개발사업의 적정 사업기간 종합산정서”를 별첨함""]",,
A_single_pipeline,1,대전대학교_대전대학교 2024학년도 다층적 융합 학습경험 플랫폼(MILE) 전.hwp,central,이 입찰 문서의 사업명은 무엇인가요?,다층적 융합 학습경험 플랫폼(MILE) 구축,이 입찰 문서의 사업명은 '다층적 융합 학습경험 플랫폼(MILE) 구축'입니다.,,,
B_rule_single_route,1,대전대학교_대전대학교 2024학년도 다층적 융합 학습경험 플랫폼(MILE) 전.hwp,central,이 입찰 문서의 사업명은 무엇인가요?,다층적 융합 학습경험 플랫폼(MILE) 구축,이 입찰 문서의 사업명은 '다층적 융합 학습경험 플랫폼(MILE) 구축'입니다.,,,
C_rule_multi_route,1,대전대학교_대전대학교 2024학년도 다층적 융합 학습경험 플랫폼(MILE) 전.hwp,central,이 입찰 문서의 사업명은 무엇인가요?,다층적 융합 학습경험 플랫폼(MILE) 구축,이 입찰 문서의 사업명은 '다층적 융합 학습경험 플랫폼(MILE) 구축'입니다.,,,
A_single_pipeline,1,대한상공회의소_기업 재생에너지 지원센터 홈페이지 개편 및 시스템 고.hwp,central,사업의 계약기간은 어떻게 명시되어 있나요?,계약체결일로부터 6개월 이내,"ㅇ 계약 당사자는 투입인력을 자유롭게 구성 및 운영하되, 사업의 품질, 보안, 일정 등에 위험이 발생하지 않도록 해야 함","[""ㅇ 계약 당사자는 투입인력을 자유롭게 구성 및 운영하되, 사업의 품질, 보안, 일정 등에 위험이 발생하지 않도록 해야 함"", ""ㅇ 제안서 기술능력평가 기준은「소프트웨어 기술성 평가기준 지침」 \n    (과학기술정보통신부 고시)을 준용\n* 평가항목의 합인 각 평가부문별 배점한도는 30점을 초과하지 못하며, 사업의 특성 및 내용 등을 고려하여 평가 항목, 항목별 배점 한도를 조정""]",,
B_rule_single_route,1,대한상공회의소_기업 재생에너지 지원센터 홈페이지 개편 및 시스템 고.hwp,central,사업의 계약기간은 어떻게 명시되어 있나요?,계약체결일로부터 6개월 이내,"ㅇ 계약 당사자는 투입인력을 자유롭게 구성 및 운영하되, 사업의 품질, 보안, 일정 등에 위험이 발생하지 않도록 해야 함","[""ㅇ 계약 당사자는 투입인력을 자유롭게 구성 및 운영하되, 사업의 품질, 보안, 일정 등에 위험이 발생하지 않도록 해야 함"", ""ㅇ 제안서 기술능력평가 기준은「소프트웨어 기술성 평가기준 지침」 \n    (과학기술정보통신부 고시)을 준용\n* 평가항목의 합인 각 평가부문별 배점한도는 30점을 초과하지 못하며, 사업의 특성 및 내용 등을 고려하여 평가 항목, 항목별 배점 한도를 조정""]",,
C_rule_multi_route,1,대한상공회의소_기업 재생에너지 지원센터 홈페이지 개편 및 시스템 고.hwp,central,사업의 계약기간은 어떻게 명시되어 있나요?,계약체결일로부터 6개월 이내,"ㅇ 계약 당사자는 투입인력을 자유롭게 구성 및 운영하되, 사업의 품질, 보안, 일정 등에 위험이 발생하지 않도록 해야 함","[""ㅇ 계약 당사자는 투입인력을 자유롭게 구성 및 운영하되, 사업의 품질, 보안, 일정 등에 위험이 발생하지 않도록 해야 함"", ""ㅇ 제안서 기술능력평가 기준은「소프트웨어 기술성 평가기준 지침」 \n    (과학기술정보통신부 고시)을 준용\n* 평가항목의 합인 각 평가부문별 배점한도는 30점을 초과하지 못하며, 사업의 특성 및 내용 등을 고려하여 평가 항목, 항목별 배점 한도를 조정""]",,
A_single_pipeline,1,"대한장애인체육회_2025년 전국장애인체육대회 전산 및 시스템, 홈페이지 .hwp",central,이 문서의 사업명은 무엇입니까?,"2025년 전국장애인체육대회 전산 및 시스템, 홈페이지 유지·보수 용역",해당 정보를 찾을 수 없습니다.,[],,
B_rule_single_route,1,"대한장애인체육회_2025년 전국장애인체육대회 전산 및 시스템, 홈페이지 .hwp",central,이 문서의 사업명은 무엇입니까?,"2025년 전국장애인체육대회 전산 및 시스템, 홈페이지 유지·보수 용역",해당 정보를 찾을 수 없습니다.,[],,
C_rule_multi_route,1,"대한장애인체육회_2025년 전국장애인체육대회 전산 및 시스템, 홈페이지 .hwp",central,이 문서의 사업명은 무엇입니까?,"2025년 전국장애인체육대회 전산 및 시스템, 홈페이지 유지·보수 용역",해당 정보를 찾을 수 없습니다.,[],,
A_single_pipeline,1,대한적십자사 의료원_적십자병원 병원정보 재해복구시스템 구축 용역 .hwp,central,이 사업의 입찰·계약방법과 평가 비중은 무엇인가?,"제한경쟁, 협상에 의한 계약; 평가기준은 기술 90%, 가격 10%",수행실적은 입찰공고 또는 제안요청서 등 입찰 관계서류에 따로 정한 경우를 제외하고는 계약일자 및 납품기한에 관계없이 이행이 완료된 시점을 기준으로 평가한다,"[""[주]\n       1. 수행실적은 입찰공고 또는 제안요청서 등 입찰 관계서류에 따로 정한 경우를 제외하고는 계약일자 및 납품기한에 관계없이 이행이 완료된 시점을 기준으로 평가한다.\n       2. 등급구간별 평점은 제9조제8항제1호에 따라 부여한다.\n       3. 등급구간 및 구간별 평점은 위 표에 의하며, 필요하다고 인정되는 경우 입찰공고에 달리 정할 수 있다.\n       4. 실적 인정 범위는 제안요청서에 정하되, 수행실적은 제5호에 따라 제출된 실적을 기준으로 평가한다.\n       5. 입찰자는 수행실적 평가를 위하여 별지 제15호서식의 수행실적 총괄표와 다음 각 목에 따른 별지 제16호서식 또는 그에 준한 수행실적증명서 등을 제출하여야 한다.\n        가. 국가기관, 지방자치단체, 기획재정부장관이 지정한 공공기관 또는 지방공기업법령 적용 기관이 발급한 수행실적증명서\n        나. 위 가목에서 정한 이외의 기관 또는 민간이 발주한 경우 발주기관이 발급한 수행실적증명서, 계약서, 세금계산서(필요시 거래명세표 포함) 등을 첨부하여야 함\n        다. 위 가목과 나목에도 불구하고 한국소프트웨어산업협회장이 발급하는 소프트웨어사업 수행실적 확인서\n        라. 국외의 공공기관, 민간기업 등이 발주한 경우 가목 및 나목을 준용하되, 공공기관 이외의 납품실적은 이를 공증하거나 해당국가의 상공회의소 또는 해당국가에 주재하는 대한민국 공관의 확인을 받은 경우에는 세금계산서 등 증명자료 첨부를 생략할 수 있음\n        마. 이행실적에 대한 입증책임은 입찰자가 부담하며 의무를 다하지 아니하여 실적확인이 어려운 경우에는 실적으로 인정하지 않는다.\n       6. 공동수급체의 경우 구성원별 실적에 지분율을 곱한 후 그 실적들을 합산한 실적으로 최종 평가하고, 평가 결과 소수점 이하의 숫자가 있는 경우 소수점 다섯째자리에서 반올림 한다.\n          (예) {(A사 실적×A사 지분율)+(B사 실적×B사 지분율)…}에 대한 점수 \n □ "", ""7. 기타사항\n □ 입찰 시 유의사항\n  ○ 제출된 제안서는 일체 반환하지 않으며, 본 제안과 관련된 일체의 소요비용은 입찰참가자의 부담으로 함\n  ○ 제안내용에 대한 확인을 위하여 추가자료 요청 또는 현지실사를 할 수 있으며, 입찰참가자는 이에 응하여야 함\n  ○ 낙찰자로 결정된 이후에 구성원을 변경할 수 없음\n  ○ 계약상의 사업을 수행함에 있어 부실, 조잡 또는 부당하게 하거나, 부정행위를 한 사업자는 향후 신규 사업 참가에 제한을 받을 수 있음\n  ○ 본 사업의 수행에 필요한 모든 비용은 가격입찰금액에 포함시켜야 함\n  ○ 사업추진 결과 발생한 지식재산권은 주관기관과 공동소유로 함\n  ○ 입찰공고문, 제안안내서, 제안요청서 및 이에 근거한 별첨 등에 명시되지 않은 사항은 국가를 당사자로 하는 계약에 관한 법률, 소프트웨어 진흥법, 기획재정부 계약예규, 국제표준규격 등 관련 규정 및 발주사의 계약 요령에 따름\n  ○ 입찰에 참가하고자 하는 자는 본 입찰유의서 및 국가를 당사자로 하는 계약에 관한 법률 등을 입찰 전에 완전히 숙지하여야 하며, 이를 숙지하지 못함으로 발생되는 책임은 입찰참가자에게 있음""]",,
B_rule_single_route,1,대한적십자사 의료원_적십자병원 병원정보 재해복구시스템 구축 용역 .hwp,central,이 사업의 입찰·계약방법과 평가 비중은 무엇인가?,"제한경쟁, 협상에 의한 계약; 평가기준은 기술 90%, 가격 10%",수행실적은 입찰공고 또는 제안요청서 등 입찰 관계서류에 따로 정한 경우를 제외하고는 계약일자 및 납품기한에 관계없이 이행이 완료된 시점을 기준으로 평가한다,"[""[주]\n       1. 수행실적은 입찰공고 또는 제안요청서 등 입찰 관계서류에 따로 정한 경우를 제외하고는 계약일자 및 납품기한에 관계없이 이행이 완료된 시점을 기준으로 평가한다.\n       2. 등급구간별 평점은 제9조제8항제1호에 따라 부여한다.\n       3. 등급구간 및 구간별 평점은 위 표에 의하며, 필요하다고 인정되는 경우 입찰공고에 달리 정할 수 있다.\n       4. 실적 인정 범위는 제안요청서에 정하되, 수행실적은 제5호에 따라 제출된 실적을 기준으로 평가한다.\n       5. 입찰자는 수행실적 평가를 위하여 별지 제15호서식의 수행실적 총괄표와 다음 각 목에 따른 별지 제16호서식 또는 그에 준한 수행실적증명서 등을 제출하여야 한다.\n        가. 국가기관, 지방자치단체, 기획재정부장관이 지정한 공공기관 또는 지방공기업법령 적용 기관이 발급한 수행실적증명서\n        나. 위 가목에서 정한 이외의 기관 또는 민간이 발주한 경우 발주기관이 발급한 수행실적증명서, 계약서, 세금계산서(필요시 거래명세표 포함) 등을 첨부하여야 함\n        다. 위 가목과 나목에도 불구하고 한국소프트웨어산업협회장이 발급하는 소프트웨어사업 수행실적 확인서\n        라. 국외의 공공기관, 민간기업 등이 발주한 경우 가목 및 나목을 준용하되, 공공기관 이외의 납품실적은 이를 공증하거나 해당국가의 상공회의소 또는 해당국가에 주재하는 대한민국 공관의 확인을 받은 경우에는 세금계산서 등 증명자료 첨부를 생략할 수 있음\n        마. 이행실적에 대한 입증책임은 입찰자가 부담하며 의무를 다하지 아니하여 실적확인이 어려운 경우에는 실적으로 인정하지 않는다.\n       6. 공동수급체의 경우 구성원별 실적에 지분율을 곱한 후 그 실적들을 합산한 실적으로 최종 평가하고, 평가 결과 소수점 이하의 숫자가 있는 경우 소수점 다섯째자리에서 반올림 한다.\n          (예) {(A사 실적×A사 지분율)+(B사 실적×B사 지분율)…}에 대한 점수 \n □ "", ""7. 기타사항\n □ 입찰 시 유의사항\n  ○ 제출된 제안서는 일체 반환하지 않으며, 본 제안과 관련된 일체의 소요비용은 입찰참가자의 부담으로 함\n  ○ 제안내용에 대한 확인을 위하여 추가자료 요청 또는 현지실사를 할 수 있으며, 입찰참가자는 이에 응하여야 함\n  ○ 낙찰자로 결정된 이후에 구성원을 변경할 수 없음\n  ○ 계약상의 사업을 수행함에 있어 부실, 조잡 또는 부당하게 하거나, 부정행위를 한 사업자는 향후 신규 사업 참가에 제한을 받을 수 있음\n  ○ 본 사업의 수행에 필요한 모든 비용은 가격입찰금액에 포함시켜야 함\n  ○ 사업추진 결과 발생한 지식재산권은 주관기관과 공동소유로 함\n  ○ 입찰공고문, 제안안내서, 제안요청서 및 이에 근거한 별첨 등에 명시되지 않은 사항은 국가를 당사자로 하는 계약에 관한 법률, 소프트웨어 진흥법, 기획재정부 계약예규, 국제표준규격 등 관련 규정 및 발주사의 계약 요령에 따름\n  ○ 입찰에 참가하고자 하는 자는 본 입찰유의서 및 국가를 당사자로 하는 계약에 관한 법률 등을 입찰 전에 완전히 숙지하여야 하며, 이를 숙지하지 못함으로 발생되는 책임은 입찰참가자에게 있음""]",,
C_rule_multi_route,1,대한적십자사 의료원_적십자병원 병원정보 재해복구시스템 구축 용역 .hwp,central,이 사업의 입찰·계약방법과 평가 비중은 무엇인가?,"제한경쟁, 협상에 의한 계약; 평가기준은 기술 90%, 가격 10%",수행실적은 입찰공고 또는 제안요청서 등 입찰 관계서류에 따로 정한 경우를 제외하고는 계약일자 및 납품기한에 관계없이 이행이 완료된 시점을 기준으로 평가한다,"[""[주]\n       1. 수행실적은 입찰공고 또는 제안요청서 등 입찰 관계서류에 따로 정한 경우를 제외하고는 계약일자 및 납품기한에 관계없이 이행이 완료된 시점을 기준으로 평가한다.\n       2. 등급구간별 평점은 제9조제8항제1호에 따라 부여한다.\n       3. 등급구간 및 구간별 평점은 위 표에 의하며, 필요하다고 인정되는 경우 입찰공고에 달리 정할 수 있다.\n       4. 실적 인정 범위는 제안요청서에 정하되, 수행실적은 제5호에 따라 제출된 실적을 기준으로 평가한다.\n       5. 입찰자는 수행실적 평가를 위하여 별지 제15호서식의 수행실적 총괄표와 다음 각 목에 따른 별지 제16호서식 또는 그에 준한 수행실적증명서 등을 제출하여야 한다.\n        가. 국가기관, 지방자치단체, 기획재정부장관이 지정한 공공기관 또는 지방공기업법령 적용 기관이 발급한 수행실적증명서\n        나. 위 가목에서 정한 이외의 기관 또는 민간이 발주한 경우 발주기관이 발급한 수행실적증명서, 계약서, 세금계산서(필요시 거래명세표 포함) 등을 첨부하여야 함\n        다. 위 가목과 나목에도 불구하고 한국소프트웨어산업협회장이 발급하는 소프트웨어사업 수행실적 확인서\n        라. 국외의 공공기관, 민간기업 등이 발주한 경우 가목 및 나목을 준용하되, 공공기관 이외의 납품실적은 이를 공증하거나 해당국가의 상공회의소 또는 해당국가에 주재하는 대한민국 공관의 확인을 받은 경우에는 세금계산서 등 증명자료 첨부를 생략할 수 있음\n        마. 이행실적에 대한 입증책임은 입찰자가 부담하며 의무를 다하지 아니하여 실적확인이 어려운 경우에는 실적으로 인정하지 않는다.\n       6. 공동수급체의 경우 구성원별 실적에 지분율을 곱한 후 그 실적들을 합산한 실적으로 최종 평가하고, 평가 결과 소수점 이하의 숫자가 있는 경우 소수점 다섯째자리에서 반올림 한다.\n          (예) {(A사 실적×A사 지분율)+(B사 실적×B사 지분율)…}에 대한 점수 \n □ "", ""7. 기타사항\n □ 입찰 시 유의사항\n  ○ 제출된 제안서는 일체 반환하지 않으며, 본 제안과 관련된 일체의 소요비용은 입찰참가자의 부담으로 함\n  ○ 제안내용에 대한 확인을 위하여 추가자료 요청 또는 현지실사를 할 수 있으며, 입찰참가자는 이에 응하여야 함\n  ○ 낙찰자로 결정된 이후에 구성원을 변경할 수 없음\n  ○ 계약상의 사업을 수행함에 있어 부실, 조잡 또는 부당하게 하거나, 부정행위를 한 사업자는 향후 신규 사업 참가에 제한을 받을 수 있음\n  ○ 본 사업의 수행에 필요한 모든 비용은 가격입찰금액에 포함시켜야 함\n  ○ 사업추진 결과 발생한 지식재산권은 주관기관과 공동소유로 함\n  ○ 입찰공고문, 제안안내서, 제안요청서 및 이에 근거한 별첨 등에 명시되지 않은 사항은 국가를 당사자로 하는 계약에 관한 법률, 소프트웨어 진흥법, 기획재정부 계약예규, 국제표준규격 등 관련 규정 및 발주사의 계약 요령에 따름\n  ○ 입찰에 참가하고자 하는 자는 본 입찰유의서 및 국가를 당사자로 하는 계약에 관한 법률 등을 입찰 전에 완전히 숙지하여야 하며, 이를 숙지하지 못함으로 발생되는 책임은 입찰참가자에게 있음""]",,
A_single_pipeline,1,문화체육관광부 국립민속박물관_2024년 국립민속박물관 민속아카이브 자.hwp,central,사업기간은 언제까지인가?,계약 후 2024.12.20.(금)까지,해당 정보를 찾을 수 없습니다.,[],,
B_rule_single_route,1,문화체육관광부 국립민속박물관_2024년 국립민속박물관 민속아카이브 자.hwp,central,사업기간은 언제까지인가?,계약 후 2024.12.20.(금)까지,해당 정보를 찾을 수 없습니다.,[],,
C_rule_multi_route,1,문화체육관광부 국립민속박물관_2024년 국립민속박물관 민속아카이브 자.hwp,central,사업기간은 언제까지인가?,계약 후 2024.12.20.(금)까지,해당 정보를 찾을 수 없습니다.,[],,
A_single_pipeline,1,부산관광공사_경영정보시스템 기능개선.hwp,central,입찰방식(계약방식)은 어떻게 명시되어 있습니까?,"전자입찰(나라장터), 제한경쟁(총액), 협상에 의한 계약","계약방식: 전자입찰(나라장터), 제한경쟁(총액), 협상에 의한 계약","[""1. 개    요\n   가. 사 업 명: 부산관광공사 경영정보시스템 기능 개선 용역\n   나. 사업기간: 계약일로부터 90일\n   다. 사업금액: 금109,000,000원(금일억구백만원), 부가가치세 포함\n   라. 계약방식: 전자입찰(나라장터), 제한경쟁(총액), 협상에 의한 계약"", ""선정 방법\n  ❍ 입찰방식: 제한경쟁입찰(총액), 협상에 의한 계약, 전자입찰(나라장터)\n  ❍ 낙찰자 결정방식: 「지방자치단체를 당사자로 하는 계약에 관한 법률」 시행령 제43조에 따른 “협상에 의한 계약체결”적용, 계약체결에 필요한 세부적인 사항은 행정안전부 예규 “지방자치단체 입찰시 낙찰자 결정기준”의 제7장“협상에 의한 계약체결기준”을 적용함\n  ❍ 본 사업은 「소프트웨어진흥법」제50조 제3항에 의거 계약상대자가 ‘과업심의위원회’개최를 요청할 수 있음.""]",,
B_rule_single_route,1,부산관광공사_경영정보시스템 기능개선.hwp,central,입찰방식(계약방식)은 어떻게 명시되어 있습니까?,"전자입찰(나라장터), 제한경쟁(총액), 협상에 의한 계약",제안서 평가,"[""제안서 평가\n 가. 제안서 평가방법\n   - 기술평가와 가격평가를 실시하여 종합평가점수로 평가\n① 평가비율: 기술능력평가(90%), 가격평가(10%)\n     ※ 기술능력평가: 정량적 평가 20점, 정성적 평가 70점\n② 종합평가점수 = 기술평가점수 + 입찰가격 평가점수\n 나. 기술평가 방법\n  ❍ 제안평가 및 사업자 선정에 관한 사항은 『지방자치단체 입찰시 낙찰자 결정기준- 제5장 협상에 의한 계약체결기준』에 따름\n  ❍ 평가위원회는 발주기관이 선임하는 평가위원들로 구성하고 명단은 비공개로 함\n  ❍ 정성적 평가는 제출한 서류(제안서)로 평가위원회에서 발표를 통해 심사함\n  ❍ 정성적 평가는 최고점수와 최저점수를 준 위원을 제외하고 나머지 위원의 평가점수를 합산하여 산술평균한 점수로 하며, 이 경우 최고점수·최저점수가 2개 이상인 경우 하나의 점수만 제외 함\n  ❍ 제안자가 제출한 제안서에 대한 평가는 기술능력평가와 입찰가격평가로 구분하여 합산함\n    ※ 정성적 평가 세부기준(평가배점 포함) 및 결과는 비공개로 하며, 제안서에 \n       기재된 내용 이외의 자료는 평가대상에서 제외 함  \n    ※ 공동수급의 경우, 정량적 지표의 평가(사업수행 실적, 경영상태, 신인도)는 구성원별 참여 비율을 곱한 후 합산하여 평가함\n 다. 평가위원회 구성·운영\n  ❍ 『부산광역시 협상에 의한 계약 제안서평가위원회 규칙』에 따라 평가위원회를 운영 함\n  ❍ 평가위원은 전문성이 있는 국가 및 다른 자치단체 공무원, 해당분야 전문기관․단체 임직원 및 전문가‧대학교수 등으로 구성\n  ❍ 평가위원은 7인 ~ 10인으로 한다.\n    - 평가위원 선정은 사전에 평가위원 예비명부(3배수이상)를 작성하고 고유번호 부여 후 밀봉 보관\n    - 입찰참가자가 제안서 접수 시 고유번호 중 선호번호를 추첨한 결과에 따라 다빈도 순으로 평가위원을 선정\n    ※ 추첨결과 다빈도 수가 동일한 경우 고령자 순으로 선정\n 라. 제안서 평가\n   제안서평가위원회: 공고문에 따름\n    - 장  "", ""입찰참가자격\n   「지방계약법」시행령 제13조 및 같은 법 시행규칙 제14조 규정에 의해 당해 사업의 자격요건을 갖춘 사업자로서 부산광역시에 주된 영업소재지를 둔 자\n   「소프트웨어진흥법」제58조에 의해 “소프트웨어사업자(컴퓨터관련서비스사업)[업종코드 1468]의 신고를 필하고 「중소기업제품구매촉진 및 판로지원에 관한 법률」에 의한 직접생산증명서(소프트웨어유지및지원서비스[8111229901])를 소지한 자로 입찰 마감일 전일 이전에 발급된 것으로 유효기간내에 있어야 함\n   중소기업 범위 및 확인에 관한 규정에 따라 중소기업·소상공인확인서를 소지한 업체\n   본 사업은 20억원 미만 사업으로 「소프트웨어진흥법」제48조(중소 소프트웨어사업자의 사업참여 지원) 및 중소 소프트웨어사업자의 사업 참여 지원에 관한 지침 제2조, 제3조에 따라, 대기업 및 중견기업인 소프트웨어 사업자의 입찰 참여를 제한하며, 중소 소프트웨어사업자만 입찰참가 가능\n   단독 또는 공동수급체(공동이행방식)를 구성하여 입찰 참가할 수 있으며, 공동수급의 경우, 구성원은 3개 사 이하로 제한되고, 각 수급체는 최소지분율 30% 이상을 소유하여야 함. (이때, 공동수급체 참여자 모두는 입찰참가자격을 갖추어야 함)\n   공동수급체 구성 시 출자비율이 가장 높은 1개 업체를 공동수급체의 대표자(주사업자)로 지정하여야 하며, 공동수급체 참여자는 다른 공동수급체의 구성원으로 중복하여 입찰 참가할 수 없음.\n   제안서상 ”컨소시엄“ 또는 ”공동수급“이란 용어는 ”공동수급체(공동이행방식)“을 구성한 경우에만 사용하여야 함\n   공동수급 입찰자는 공동수급체 구성의 책임 범위 및 권리, 의무관계, 역할을 명확히 규정하여 제안서 상에 기재하여야 함.\n   공동계약 체결 이후 구성원의 지분율 변경 사유는 행정안전부 계약예규 ”제5장공동계약 운영요령“에서 정한 바와 같음.\n     ※ 단순 경영상태 악화 등 명확하지 않은 경우에는 지분율 변경 불가\n   공동수급체 구성원 간의 부적절한 이면합의"", ""<표>\n  \n  ❍ 평가항목에 해당하는 사항이 없거나 증빙서류 미제출시 0점 처리 \n  ❍ 국내 소재업체의 수행실적 중 공공기관 이외의 수행 실적은 원본이 확인된 해당 용역의 계약서, 세금계산서, 거래명세표 등을 첨부한 경우에 평가하고, 공급받는 자의 인감증명 법인 또는 개인)을 첨부한 거래사실 확인서를 함께 제출해야 함\n  ❍ 국가기관, 지방자치단체, 기획재정부장관이 지정한 공공기관 또는 지방공기업법령 적용 기관이 발급한 수행실적증명서\n  ❍ 위에서 정한 이외의 기관 또는 민간이 발주한 경우 발주자가 발급한 수행실적증명서, 발주자의 인감증명서(필요시 사용인감계 포함), 계약서, 세금계산서(필요시 거래명세표 포함)를 첨부하여야 하며, 수행실적증명서는 해당 인감(필요시 사용 인감)으로 날인하여야 함\n  ❍ 위 나목과 다목에도 불구하고 한국소프트웨어산업협회장이 발급하는 소프트웨어 사업수행실적 확인서\n  ❍ 이행실적에 대한 입증책임은 입찰자가 부담하며 의무를 다하지 아니하여 실적 확인이 어려운 경우에는 실적으로 인정하지 아니함\n  ❍ 공동수급체의 경우 구성원별 해당 점수에 지분율을 곱한 후 그 점수들을 합산하여 최종 평가하고, 평가 결과 소수점 이하의 숫자가 있는 경우 소수점 다섯째자리에서 반올림 함 다만, 합산한 점수는 총 배점 한도를 초과할 수 없음 (예) (A사 점수×A사 지분율)+(B사 점수×B사 지분율)""]",,
C_rule_multi_route,1,부산관광공사_경영정보시스템 기능개선.hwp,central,입찰방식(계약방식)은 어떻게 명시되어 있습니까?,"전자입찰(나라장터), 제한경쟁(총액), 협상에 의한 계약",제안서 평가,"[""제안서 평가\n 가. 제안서 평가방법\n   - 기술평가와 가격평가를 실시하여 종합평가점수로 평가\n① 평가비율: 기술능력평가(90%), 가격평가(10%)\n     ※ 기술능력평가: 정량적 평가 20점, 정성적 평가 70점\n② 종합평가점수 = 기술평가점수 + 입찰가격 평가점수\n 나. 기술평가 방법\n  ❍ 제안평가 및 사업자 선정에 관한 사항은 『지방자치단체 입찰시 낙찰자 결정기준- 제5장 협상에 의한 계약체결기준』에 따름\n  ❍ 평가위원회는 발주기관이 선임하는 평가위원들로 구성하고 명단은 비공개로 함\n  ❍ 정성적 평가는 제출한 서류(제안서)로 평가위원회에서 발표를 통해 심사함\n  ❍ 정성적 평가는 최고점수와 최저점수를 준 위원을 제외하고 나머지 위원의 평가점수를 합산하여 산술평균한 점수로 하며, 이 경우 최고점수·최저점수가 2개 이상인 경우 하나의 점수만 제외 함\n  ❍ 제안자가 제출한 제안서에 대한 평가는 기술능력평가와 입찰가격평가로 구분하여 합산함\n    ※ 정성적 평가 세부기준(평가배점 포함) 및 결과는 비공개로 하며, 제안서에 \n       기재된 내용 이외의 자료는 평가대상에서 제외 함  \n    ※ 공동수급의 경우, 정량적 지표의 평가(사업수행 실적, 경영상태, 신인도)는 구성원별 참여 비율을 곱한 후 합산하여 평가함\n 다. 평가위원회 구성·운영\n  ❍ 『부산광역시 협상에 의한 계약 제안서평가위원회 규칙』에 따라 평가위원회를 운영 함\n  ❍ 평가위원은 전문성이 있는 국가 및 다른 자치단체 공무원, 해당분야 전문기관․단체 임직원 및 전문가‧대학교수 등으로 구성\n  ❍ 평가위원은 7인 ~ 10인으로 한다.\n    - 평가위원 선정은 사전에 평가위원 예비명부(3배수이상)를 작성하고 고유번호 부여 후 밀봉 보관\n    - 입찰참가자가 제안서 접수 시 고유번호 중 선호번호를 추첨한 결과에 따라 다빈도 순으로 평가위원을 선정\n    ※ 추첨결과 다빈도 수가 동일한 경우 고령자 순으로 선정\n 라. 제안서 평가\n   제안서평가위원회: 공고문에 따름\n    - 장  "", ""입찰참가자격\n   「지방계약법」시행령 제13조 및 같은 법 시행규칙 제14조 규정에 의해 당해 사업의 자격요건을 갖춘 사업자로서 부산광역시에 주된 영업소재지를 둔 자\n   「소프트웨어진흥법」제58조에 의해 “소프트웨어사업자(컴퓨터관련서비스사업)[업종코드 1468]의 신고를 필하고 「중소기업제품구매촉진 및 판로지원에 관한 법률」에 의한 직접생산증명서(소프트웨어유지및지원서비스[8111229901])를 소지한 자로 입찰 마감일 전일 이전에 발급된 것으로 유효기간내에 있어야 함\n   중소기업 범위 및 확인에 관한 규정에 따라 중소기업·소상공인확인서를 소지한 업체\n   본 사업은 20억원 미만 사업으로 「소프트웨어진흥법」제48조(중소 소프트웨어사업자의 사업참여 지원) 및 중소 소프트웨어사업자의 사업 참여 지원에 관한 지침 제2조, 제3조에 따라, 대기업 및 중견기업인 소프트웨어 사업자의 입찰 참여를 제한하며, 중소 소프트웨어사업자만 입찰참가 가능\n   단독 또는 공동수급체(공동이행방식)를 구성하여 입찰 참가할 수 있으며, 공동수급의 경우, 구성원은 3개 사 이하로 제한되고, 각 수급체는 최소지분율 30% 이상을 소유하여야 함. (이때, 공동수급체 참여자 모두는 입찰참가자격을 갖추어야 함)\n   공동수급체 구성 시 출자비율이 가장 높은 1개 업체를 공동수급체의 대표자(주사업자)로 지정하여야 하며, 공동수급체 참여자는 다른 공동수급체의 구성원으로 중복하여 입찰 참가할 수 없음.\n   제안서상 ”컨소시엄“ 또는 ”공동수급“이란 용어는 ”공동수급체(공동이행방식)“을 구성한 경우에만 사용하여야 함\n   공동수급 입찰자는 공동수급체 구성의 책임 범위 및 권리, 의무관계, 역할을 명확히 규정하여 제안서 상에 기재하여야 함.\n   공동계약 체결 이후 구성원의 지분율 변경 사유는 행정안전부 계약예규 ”제5장공동계약 운영요령“에서 정한 바와 같음.\n     ※ 단순 경영상태 악화 등 명확하지 않은 경우에는 지분율 변경 불가\n   공동수급체 구성원 간의 부적절한 이면합의"", ""<표>\n  \n  ❍ 평가항목에 해당하는 사항이 없거나 증빙서류 미제출시 0점 처리 \n  ❍ 국내 소재업체의 수행실적 중 공공기관 이외의 수행 실적은 원본이 확인된 해당 용역의 계약서, 세금계산서, 거래명세표 등을 첨부한 경우에 평가하고, 공급받는 자의 인감증명 법인 또는 개인)을 첨부한 거래사실 확인서를 함께 제출해야 함\n  ❍ 국가기관, 지방자치단체, 기획재정부장관이 지정한 공공기관 또는 지방공기업법령 적용 기관이 발급한 수행실적증명서\n  ❍ 위에서 정한 이외의 기관 또는 민간이 발주한 경우 발주자가 발급한 수행실적증명서, 발주자의 인감증명서(필요시 사용인감계 포함), 계약서, 세금계산서(필요시 거래명세표 포함)를 첨부하여야 하며, 수행실적증명서는 해당 인감(필요시 사용 인감)으로 날인하여야 함\n  ❍ 위 나목과 다목에도 불구하고 한국소프트웨어산업협회장이 발급하는 소프트웨어 사업수행실적 확인서\n  ❍ 이행실적에 대한 입증책임은 입찰자가 부담하며 의무를 다하지 아니하여 실적 확인이 어려운 경우에는 실적으로 인정하지 아니함\n  ❍ 공동수급체의 경우 구성원별 해당 점수에 지분율을 곱한 후 그 점수들을 합산하여 최종 평가하고, 평가 결과 소수점 이하의 숫자가 있는 경우 소수점 다섯째자리에서 반올림 함 다만, 합산한 점수는 총 배점 한도를 초과할 수 없음 (예) (A사 점수×A사 지분율)+(B사 점수×B사 지분율)"", ""❍ 신용평가등급은 신용정보의 이용 및 보호에 관한 법률 제4조제4항제1호 또는 제4호의 업무를 영위하는 신용정보업자가 동 적격심사세부기준 제6조의 적용기준일 전 가장 최근에 평가한 유효기간 내 회사채(또는 기업어음)에 대한 신용평가등급 또는 기업신용평가등급(위의 신용정보업자가 신용평가등급, 등급평가일 및 등급유효기간 등을 명시하여 작성한 ‘신용평가등급확인서’)을 기준으로 평가함\n  ❍ 평가대상자의 회사채(또는 기업어음) 및 기업신용평가에 따른 평점이 다른 경우에는 높은 평점으로 평가하며, ‘신용평가등급확인서’를 제출하지 않은 경우에는 최저등급으로 평가함\n  ❍ 합병한 업체에 대하여는 합병 후 새로운 신용평가등급으로 심사하여야 하며 합병 후의 새로운 신용평가등급이 없는 경우에는 합병 대상업체 중 가장 낮은 신용평가 등급을 받은 업체의 신용평가등급으로 심사함\n  ❍ 조달청 신용평가등급 조회시스템에 의하여 신용평가등급 조회가 가능한 경우에는 동 시스템 조회결과에 의해 평가할 수 있음\n  ❍ 공동수급체의 경우 구성원별 해당 점수에 지분율을 곱한 후 그 점수들을 합산하여 최종 평가하고, 평가 결과 소수점 이하의 숫자가 있는 경우 소수점 다섯째자리에서 반올림 함 다만, 합산한 점수는 총 배점 한도를 초과할 수 없음 (예) (A사 점수×A사 지분율)+(B사 점수×B사 지분율)""]",,
A_single_pipeline,1,사단법인 보험개발원_실손보험 청구 전산화 시스템 구축 사업.hwp,central,입찰방식은 무엇인가요?,"일반경쟁입찰, 협상에 의한 계약",해당 정보를 찾을 수 없습니다.,[],,
B_rule_single_route,1,사단법인 보험개발원_실손보험 청구 전산화 시스템 구축 사업.hwp,central,입찰방식은 무엇인가요?,"일반경쟁입찰, 협상에 의한 계약",해당 정보를 찾을 수 없습니다.,[],,
C_rule_multi_route,1,사단법인 보험개발원_실손보험 청구 전산화 시스템 구축 사업.hwp,central,입찰방식은 무엇인가요?,"일반경쟁입찰, 협상에 의한 계약",해당 정보를 찾을 수 없습니다.,[],,
A_single_pipeline,1,사단법인아시아물위원회사무국_우즈벡-키르기즈스탄 기후변화대응 스.hwp,central,이 용역의 사업기간은 언제까지인가?,계약체결일로부터 2027년 12월 31일 까지,- 실적증명원 및 해당 용역의 계약서 사본 등 이행실적 및 유사사업임을 증명하는 서류를 첨부하여 제안서와 함께 제출,"[""2) 회사 유사사업 수행실적 (6점)\n   ❍ 실적인정범위 : 공고일 기준 최근 15년 이내 완료한 실적\n   ❍ 공동으로 수행한 실적의 경우, 제안 업체의 참여지분율을 곱하여 산정한 금액(또는 분담부분에 해당되는 금액)을 기준으로 하여야 함\n   ❍ 공동수급체 구성 시 구성원별 수행실적 건수에 제안 업체의 사업 참여 지분율을 곱하여 산정한 후, 이를 합산하여 평가\n    ※ 유사사업 : 수행기간 1년 이상이고 참여지분 실적 5억 이상의 프로젝트성 해외사업으로서 수자원개발, 농업토목(관개 또는 양수장 필수 포함) 관련 PMC용역, 기본설계, 실시설계, 감리, 시공, 수행실적 \n    ※ 연수사업, 평가용역, 연구용역, 입찰지원, 사전조사(예비타당성조사, 타당성조사, 기본조사, 사업형성 등) 참여실적 불인정\n   ❍ 제출서류\n      - 유사분야 사업 수행실적 총괄표\n      - 유사분야 사업 수행실적 증명원\n      - 실적증명원 및 해당 용역의 계약서 사본 등 이행실적 및 유사사업임을 증명하는 서류를 첨부하여 제안서와 함께 제출\n   ❍ 유사사업 수행건수 (3점)""]",,
B_rule_single_route,1,사단법인아시아물위원회사무국_우즈벡-키르기즈스탄 기후변화대응 스.hwp,central,이 용역의 사업기간은 언제까지인가?,계약체결일로부터 2027년 12월 31일 까지,- 실적증명원 및 해당 용역의 계약서 사본 등 이행실적 및 유사사업임을 증명하는 서류를 첨부하여 제안서와 함께 제출,"[""2) 회사 유사사업 수행실적 (6점)\n   ❍ 실적인정범위 : 공고일 기준 최근 15년 이내 완료한 실적\n   ❍ 공동으로 수행한 실적의 경우, 제안 업체의 참여지분율을 곱하여 산정한 금액(또는 분담부분에 해당되는 금액)을 기준으로 하여야 함\n   ❍ 공동수급체 구성 시 구성원별 수행실적 건수에 제안 업체의 사업 참여 지분율을 곱하여 산정한 후, 이를 합산하여 평가\n    ※ 유사사업 : 수행기간 1년 이상이고 참여지분 실적 5억 이상의 프로젝트성 해외사업으로서 수자원개발, 농업토목(관개 또는 양수장 필수 포함) 관련 PMC용역, 기본설계, 실시설계, 감리, 시공, 수행실적 \n    ※ 연수사업, 평가용역, 연구용역, 입찰지원, 사전조사(예비타당성조사, 타당성조사, 기본조사, 사업형성 등) 참여실적 불인정\n   ❍ 제출서류\n      - 유사분야 사업 수행실적 총괄표\n      - 유사분야 사업 수행실적 증명원\n      - 실적증명원 및 해당 용역의 계약서 사본 등 이행실적 및 유사사업임을 증명하는 서류를 첨부하여 제안서와 함께 제출\n   ❍ 유사사업 수행건수 (3점)""]",,
C_rule_multi_route,1,사단법인아시아물위원회사무국_우즈벡-키르기즈스탄 기후변화대응 스.hwp,central,이 용역의 사업기간은 언제까지인가?,계약체결일로부터 2027년 12월 31일 까지,- 실적증명원 및 해당 용역의 계약서 사본 등 이행실적 및 유사사업임을 증명하는 서류를 첨부하여 제안서와 함께 제출,"[""2) 회사 유사사업 수행실적 (6점)\n   ❍ 실적인정범위 : 공고일 기준 최근 15년 이내 완료한 실적\n   ❍ 공동으로 수행한 실적의 경우, 제안 업체의 참여지분율을 곱하여 산정한 금액(또는 분담부분에 해당되는 금액)을 기준으로 하여야 함\n   ❍ 공동수급체 구성 시 구성원별 수행실적 건수에 제안 업체의 사업 참여 지분율을 곱하여 산정한 후, 이를 합산하여 평가\n    ※ 유사사업 : 수행기간 1년 이상이고 참여지분 실적 5억 이상의 프로젝트성 해외사업으로서 수자원개발, 농업토목(관개 또는 양수장 필수 포함) 관련 PMC용역, 기본설계, 실시설계, 감리, 시공, 수행실적 \n    ※ 연수사업, 평가용역, 연구용역, 입찰지원, 사전조사(예비타당성조사, 타당성조사, 기본조사, 사업형성 등) 참여실적 불인정\n   ❍ 제출서류\n      - 유사분야 사업 수행실적 총괄표\n      - 유사분야 사업 수행실적 증명원\n      - 실적증명원 및 해당 용역의 계약서 사본 등 이행실적 및 유사사업임을 증명하는 서류를 첨부하여 제안서와 함께 제출\n   ❍ 유사사업 수행건수 (3점)""]",,
A_single_pipeline,1,서민금융진흥원_서민금융진흥원 서민금융 채팅 상담시스템 구축.hwp,central,이 입찰의 입찰방식(입찰방법)은 무엇인가요?,제한공개경쟁입찰(제한경쟁)이며 낙찰자 결정은 협상에 의한 계약체결(긴급공고 포함),□ 입찰방법: 제한공개경쟁입찰,"[""□ 입찰방법: 제한공개경쟁입찰"", ""□ 입찰의 성립 \n  ㅇ 2인 이상의 유효한 입찰이 있어야 성립\n □ 입찰의 무효\n  ㅇ 「국가를 당사자로 하는 계약에 관한 법률 시행령」제39조, 동 시행규칙 제44조 및 계약예규를 위반한 업체\n  ㅇ 제출서류 및 제안서 내용이 부정․허위로 작성된 것으로 판명되는 경우 계약체결 이전에는 무효, 계약체결 이후에는 계약을 해제 또는 해지함\n □ 기타\n  ㅇ 계약과정의 투명성 확보 및 부패 관행의 척결을 위하여 입찰참가신청서를 제출하고자 하는 업체는 청렴계약·인권경영 이행각서(서금원소정 양식)를 작성하여 제출하여야 함\n  ㅇ 본 제안요청서에 명시하지 아니한 사항은 서금원「계약세칙」및 관계법령에 따름""]",,
B_rule_single_route,1,서민금융진흥원_서민금융진흥원 서민금융 채팅 상담시스템 구축.hwp,central,이 입찰의 입찰방식(입찰방법)은 무엇인가요?,제한공개경쟁입찰(제한경쟁)이며 낙찰자 결정은 협상에 의한 계약체결(긴급공고 포함),□ 입찰방법: 제한공개경쟁입찰,"[""□ 입찰방법: 제한공개경쟁입찰"", ""□ 입찰의 성립 \n  ㅇ 2인 이상의 유효한 입찰이 있어야 성립\n □ 입찰의 무효\n  ㅇ 「국가를 당사자로 하는 계약에 관한 법률 시행령」제39조, 동 시행규칙 제44조 및 계약예규를 위반한 업체\n  ㅇ 제출서류 및 제안서 내용이 부정․허위로 작성된 것으로 판명되는 경우 계약체결 이전에는 무효, 계약체결 이후에는 계약을 해제 또는 해지함\n □ 기타\n  ㅇ 계약과정의 투명성 확보 및 부패 관행의 척결을 위하여 입찰참가신청서를 제출하고자 하는 업체는 청렴계약·인권경영 이행각서(서금원소정 양식)를 작성하여 제출하여야 함\n  ㅇ 본 제안요청서에 명시하지 아니한 사항은 서금원「계약세칙」및 관계법령에 따름""]",,
C_rule_multi_route,1,서민금융진흥원_서민금융진흥원 서민금융 채팅 상담시스템 구축.hwp,central,이 입찰의 입찰방식(입찰방법)은 무엇인가요?,제한공개경쟁입찰(제한경쟁)이며 낙찰자 결정은 협상에 의한 계약체결(긴급공고 포함),□ 입찰방법: 제한공개경쟁입찰,"[""□ 입찰방법: 제한공개경쟁입찰"", ""□ 입찰의 성립 \n  ㅇ 2인 이상의 유효한 입찰이 있어야 성립\n □ 입찰의 무효\n  ㅇ 「국가를 당사자로 하는 계약에 관한 법률 시행령」제39조, 동 시행규칙 제44조 및 계약예규를 위반한 업체\n  ㅇ 제출서류 및 제안서 내용이 부정․허위로 작성된 것으로 판명되는 경우 계약체결 이전에는 무효, 계약체결 이후에는 계약을 해제 또는 해지함\n □ 기타\n  ㅇ 계약과정의 투명성 확보 및 부패 관행의 척결을 위하여 입찰참가신청서를 제출하고자 하는 업체는 청렴계약·인권경영 이행각서(서금원소정 양식)를 작성하여 제출하여야 함\n  ㅇ 본 제안요청서에 명시하지 아니한 사항은 서금원「계약세칙」및 관계법령에 따름""]",,
A_single_pipeline,1,서영대학교 산학협력단_전문대학 혁신지원사업 서영대학교 차세대 교육.hwp,central,이 사업의 입찰방식은 무엇인가?,제한경쟁입찰(협상에 의한 계약)," 제안사는 현 시스템의 운영현황, 본 사업의 추진목표 등을 파악하여 개발방법론, 프로세스 등 최적의 개발 방안을 제시하여야 하며, 사업기간 내 개발을 완료하고 현업의 업무 적응력을 높이며 안정적으로 기술 지원을 할 수 있는 구체적 방안 및 절차를 제시하여야 한다","[""나. 공통사항\n     본 내용은 본 사업과 관련된 모든 세부사업에 대하여 공통으로 적용한다.\n     본 사업에 필요한 모든 내용은 대학이 제시한 조건에 충족하여야 하며, 주사업자가 일괄 제안하여야 한다.\n     제안사는 현 시스템의 운영현황, 본 사업의 추진목표 등을 파악하여 개발방법론, 프로세스 등 최적의 개발 방안을 제시하여야 하며, 사업기간 내 개발을 완료하고 현업의 업무 적응력을 높이며 안정적으로 기술 지원을 할 수 있는 구체적 방안 및 절차를 제시하여야 한다.\n     현재 운용되고 있는 학사정보시스템(TIS), 행정관리시스템(YES), 학생통합 및 학생종합정보시스템, 역량기반 교육과정 및 성과기반, 현장실습운영시스템, 학생통합시스템, M-CT인증 관리시스템의 업무 기능을 기본적으로 반영하여야 하며, 그것이 어려운 경우 그와 유사한 기능이 구현되어야 한다.\n     제안사는 보유하고 있는 자사의 기술력을 통해 분석, 개발, 적용, 교육, 안정화 등의 시스템 구축과 관련된 모든 과정을 최적화된 방법으로 수행하여 대학의 차세대교육혁신지원시스템 구축 목표를 효과적이고 현실적으로 달성할 수 있는 방안을 적극적으로 제시하여야 한다.\n     본 사업 진행 시 제안사는 관련 모든 법률, 규정 및 지침 등을 반드시 준수하여야 하며, 사용자 인터페이스 및 각종 코드를 표준화하여 생산성을 향상시키고 운영·유지보수의 편리성을 충족시켜야 한다.\n      - 웹 접근성 가이드 및 웹 표준 준수\n      - 행정기관 및 공공기관 정보시스템 구축·운영 지침 【행정자치부고시(제2015-45호)】\n      - OWASP Top 10 및 OWSAP Guide (국제 웹 보안표준기구)\n      - W3C(World Wide Web Consortium) 국제표준 적용하여 각종 웹브라우저 및 OS와의 호환성 보장\n      - 정보시스템 구축 단계별 정보보호 가이드라인(한국정보보호진흥원)\n      - 저작권법에 관한 법률, 동법 시행령 및 시행규칙\n      -"", "" 웹 응용프로그램 개발보안 가이드(행정안전부)\n      - 모바일 전자정부서비스 앱 소스코드 보안성 검증 운영 안내(행정안전부)\n      - 정보시스템 소프트웨어 개발보안 가이드(행정안전부) 등\n     현재 대학에서 사용하는 시스템(솔루션 포함)이 본 사업을 진행하는데 있어 직접적 영향을 미치는 부분에 대해서는 미리 문제(연동, 적용, 운영 등)를 파악하고 관련 제반 문제에 대해서는 주사업자가 모든 책임을 진다.\n     제안사는 프로젝트 관리 도구를 선정하여 프로젝트 관리를 수행하고, 모든 보고 및 검토회의 등은 프로젝트 관리도구의 데이터를 근거로 한 보고를 수행하여야 한다.\n     프로젝트 수행 기간 중 사업관리 조직을 구성하고, 개발자, 운영자, 사용자, 관리자 등 모든 이해당사자를 의사소통관리, 품질관리, 형상관리 등이 가능하도록 하고 결함 등을 사전 발굴하여 조치하여야 한다.\n     본 제안요청서에서 제시한 제품별 제안규격에도 불구하고 대학 정보화 환경에 적합한 최신기술 및 솔루션이 있는 경우 제시할 수 있으며 채택 여부는 대학이 결정한다.\n     본 제안요청서에 명시된 모든 조항은 대학이 요구하는 최소한의 사항만 규정하므로, 상세하게 기술되지 않았거나 누락된 사항에 대해서 본 사업의 목적과 내용에 명시된 목표시스템 구현에 전혀 문제가 발생하지 않도록 제안업체는 철저히 검토하여 반드시 사전조치를 취하고 대학과 협의하여 실제 구현 및 설치 등에 명확히 반영하여야 한다.\n     개발에 사용된 모든 인프라(H/W, S/W, 콘텐츠에 사용한 이미지 및 글꼴 등)는 저작권에 문제가 없어야 하며, 비용이 발생하는 경우 주사업자가 부담하여야 한다.\n     기 구축 솔루션에 대한 연동비용이 발생하는 경우 제안사가 부담하여야 한다.\n     무상유지보수 기간은 최종 검수 후 12개월로 한다.\n     무상유지보수 기간 중 솔루션 제품의 새로운 버전이 출시될 경우 무상으로 업그레이드 제공해야 한다.""]",,
B_rule_single_route,1,서영대학교 산학협력단_전문대학 혁신지원사업 서영대학교 차세대 교육.hwp,central,이 사업의 입찰방식은 무엇인가?,제한경쟁입찰(협상에 의한 계약)," 제안사는 현 시스템의 운영현황, 본 사업의 추진목표 등을 파악하여 개발방법론, 프로세스 등 최적의 개발 방안을 제시하여야 하며, 사업기간 내 개발을 완료하고 현업의 업무 적응력을 높이며 안정적으로 기술 지원을 할 수 있는 구체적 방안 및 절차를 제시하여야 한다","[""나. 공통사항\n     본 내용은 본 사업과 관련된 모든 세부사업에 대하여 공통으로 적용한다.\n     본 사업에 필요한 모든 내용은 대학이 제시한 조건에 충족하여야 하며, 주사업자가 일괄 제안하여야 한다.\n     제안사는 현 시스템의 운영현황, 본 사업의 추진목표 등을 파악하여 개발방법론, 프로세스 등 최적의 개발 방안을 제시하여야 하며, 사업기간 내 개발을 완료하고 현업의 업무 적응력을 높이며 안정적으로 기술 지원을 할 수 있는 구체적 방안 및 절차를 제시하여야 한다.\n     현재 운용되고 있는 학사정보시스템(TIS), 행정관리시스템(YES), 학생통합 및 학생종합정보시스템, 역량기반 교육과정 및 성과기반, 현장실습운영시스템, 학생통합시스템, M-CT인증 관리시스템의 업무 기능을 기본적으로 반영하여야 하며, 그것이 어려운 경우 그와 유사한 기능이 구현되어야 한다.\n     제안사는 보유하고 있는 자사의 기술력을 통해 분석, 개발, 적용, 교육, 안정화 등의 시스템 구축과 관련된 모든 과정을 최적화된 방법으로 수행하여 대학의 차세대교육혁신지원시스템 구축 목표를 효과적이고 현실적으로 달성할 수 있는 방안을 적극적으로 제시하여야 한다.\n     본 사업 진행 시 제안사는 관련 모든 법률, 규정 및 지침 등을 반드시 준수하여야 하며, 사용자 인터페이스 및 각종 코드를 표준화하여 생산성을 향상시키고 운영·유지보수의 편리성을 충족시켜야 한다.\n      - 웹 접근성 가이드 및 웹 표준 준수\n      - 행정기관 및 공공기관 정보시스템 구축·운영 지침 【행정자치부고시(제2015-45호)】\n      - OWASP Top 10 및 OWSAP Guide (국제 웹 보안표준기구)\n      - W3C(World Wide Web Consortium) 국제표준 적용하여 각종 웹브라우저 및 OS와의 호환성 보장\n      - 정보시스템 구축 단계별 정보보호 가이드라인(한국정보보호진흥원)\n      - 저작권법에 관한 법률, 동법 시행령 및 시행규칙\n      -"", "" 웹 응용프로그램 개발보안 가이드(행정안전부)\n      - 모바일 전자정부서비스 앱 소스코드 보안성 검증 운영 안내(행정안전부)\n      - 정보시스템 소프트웨어 개발보안 가이드(행정안전부) 등\n     현재 대학에서 사용하는 시스템(솔루션 포함)이 본 사업을 진행하는데 있어 직접적 영향을 미치는 부분에 대해서는 미리 문제(연동, 적용, 운영 등)를 파악하고 관련 제반 문제에 대해서는 주사업자가 모든 책임을 진다.\n     제안사는 프로젝트 관리 도구를 선정하여 프로젝트 관리를 수행하고, 모든 보고 및 검토회의 등은 프로젝트 관리도구의 데이터를 근거로 한 보고를 수행하여야 한다.\n     프로젝트 수행 기간 중 사업관리 조직을 구성하고, 개발자, 운영자, 사용자, 관리자 등 모든 이해당사자를 의사소통관리, 품질관리, 형상관리 등이 가능하도록 하고 결함 등을 사전 발굴하여 조치하여야 한다.\n     본 제안요청서에서 제시한 제품별 제안규격에도 불구하고 대학 정보화 환경에 적합한 최신기술 및 솔루션이 있는 경우 제시할 수 있으며 채택 여부는 대학이 결정한다.\n     본 제안요청서에 명시된 모든 조항은 대학이 요구하는 최소한의 사항만 규정하므로, 상세하게 기술되지 않았거나 누락된 사항에 대해서 본 사업의 목적과 내용에 명시된 목표시스템 구현에 전혀 문제가 발생하지 않도록 제안업체는 철저히 검토하여 반드시 사전조치를 취하고 대학과 협의하여 실제 구현 및 설치 등에 명확히 반영하여야 한다.\n     개발에 사용된 모든 인프라(H/W, S/W, 콘텐츠에 사용한 이미지 및 글꼴 등)는 저작권에 문제가 없어야 하며, 비용이 발생하는 경우 주사업자가 부담하여야 한다.\n     기 구축 솔루션에 대한 연동비용이 발생하는 경우 제안사가 부담하여야 한다.\n     무상유지보수 기간은 최종 검수 후 12개월로 한다.\n     무상유지보수 기간 중 솔루션 제품의 새로운 버전이 출시될 경우 무상으로 업그레이드 제공해야 한다.""]",,
C_rule_multi_route,1,서영대학교 산학협력단_전문대학 혁신지원사업 서영대학교 차세대 교육.hwp,central,이 사업의 입찰방식은 무엇인가?,제한경쟁입찰(협상에 의한 계약)," 제안사는 현 시스템의 운영현황, 본 사업의 추진목표 등을 파악하여 개발방법론, 프로세스 등 최적의 개발 방안을 제시하여야 하며, 사업기간 내 개발을 완료하고 현업의 업무 적응력을 높이며 안정적으로 기술 지원을 할 수 있는 구체적 방안 및 절차를 제시하여야 한다","[""나. 공통사항\n     본 내용은 본 사업과 관련된 모든 세부사업에 대하여 공통으로 적용한다.\n     본 사업에 필요한 모든 내용은 대학이 제시한 조건에 충족하여야 하며, 주사업자가 일괄 제안하여야 한다.\n     제안사는 현 시스템의 운영현황, 본 사업의 추진목표 등을 파악하여 개발방법론, 프로세스 등 최적의 개발 방안을 제시하여야 하며, 사업기간 내 개발을 완료하고 현업의 업무 적응력을 높이며 안정적으로 기술 지원을 할 수 있는 구체적 방안 및 절차를 제시하여야 한다.\n     현재 운용되고 있는 학사정보시스템(TIS), 행정관리시스템(YES), 학생통합 및 학생종합정보시스템, 역량기반 교육과정 및 성과기반, 현장실습운영시스템, 학생통합시스템, M-CT인증 관리시스템의 업무 기능을 기본적으로 반영하여야 하며, 그것이 어려운 경우 그와 유사한 기능이 구현되어야 한다.\n     제안사는 보유하고 있는 자사의 기술력을 통해 분석, 개발, 적용, 교육, 안정화 등의 시스템 구축과 관련된 모든 과정을 최적화된 방법으로 수행하여 대학의 차세대교육혁신지원시스템 구축 목표를 효과적이고 현실적으로 달성할 수 있는 방안을 적극적으로 제시하여야 한다.\n     본 사업 진행 시 제안사는 관련 모든 법률, 규정 및 지침 등을 반드시 준수하여야 하며, 사용자 인터페이스 및 각종 코드를 표준화하여 생산성을 향상시키고 운영·유지보수의 편리성을 충족시켜야 한다.\n      - 웹 접근성 가이드 및 웹 표준 준수\n      - 행정기관 및 공공기관 정보시스템 구축·운영 지침 【행정자치부고시(제2015-45호)】\n      - OWASP Top 10 및 OWSAP Guide (국제 웹 보안표준기구)\n      - W3C(World Wide Web Consortium) 국제표준 적용하여 각종 웹브라우저 및 OS와의 호환성 보장\n      - 정보시스템 구축 단계별 정보보호 가이드라인(한국정보보호진흥원)\n      - 저작권법에 관한 법률, 동법 시행령 및 시행규칙\n      -"", "" 웹 응용프로그램 개발보안 가이드(행정안전부)\n      - 모바일 전자정부서비스 앱 소스코드 보안성 검증 운영 안내(행정안전부)\n      - 정보시스템 소프트웨어 개발보안 가이드(행정안전부) 등\n     현재 대학에서 사용하는 시스템(솔루션 포함)이 본 사업을 진행하는데 있어 직접적 영향을 미치는 부분에 대해서는 미리 문제(연동, 적용, 운영 등)를 파악하고 관련 제반 문제에 대해서는 주사업자가 모든 책임을 진다.\n     제안사는 프로젝트 관리 도구를 선정하여 프로젝트 관리를 수행하고, 모든 보고 및 검토회의 등은 프로젝트 관리도구의 데이터를 근거로 한 보고를 수행하여야 한다.\n     프로젝트 수행 기간 중 사업관리 조직을 구성하고, 개발자, 운영자, 사용자, 관리자 등 모든 이해당사자를 의사소통관리, 품질관리, 형상관리 등이 가능하도록 하고 결함 등을 사전 발굴하여 조치하여야 한다.\n     본 제안요청서에서 제시한 제품별 제안규격에도 불구하고 대학 정보화 환경에 적합한 최신기술 및 솔루션이 있는 경우 제시할 수 있으며 채택 여부는 대학이 결정한다.\n     본 제안요청서에 명시된 모든 조항은 대학이 요구하는 최소한의 사항만 규정하므로, 상세하게 기술되지 않았거나 누락된 사항에 대해서 본 사업의 목적과 내용에 명시된 목표시스템 구현에 전혀 문제가 발생하지 않도록 제안업체는 철저히 검토하여 반드시 사전조치를 취하고 대학과 협의하여 실제 구현 및 설치 등에 명확히 반영하여야 한다.\n     개발에 사용된 모든 인프라(H/W, S/W, 콘텐츠에 사용한 이미지 및 글꼴 등)는 저작권에 문제가 없어야 하며, 비용이 발생하는 경우 주사업자가 부담하여야 한다.\n     기 구축 솔루션에 대한 연동비용이 발생하는 경우 제안사가 부담하여야 한다.\n     무상유지보수 기간은 최종 검수 후 12개월로 한다.\n     무상유지보수 기간 중 솔루션 제품의 새로운 버전이 출시될 경우 무상으로 업그레이드 제공해야 한다.""]",,
A_single_pipeline,1,"서울특별시 여성가족재단_(재공고, 협상) 서울 디지털성범죄 안심지원센.hwp",extreme,사업기간은 어떻게 되는가?,계약체결일로부터 2024년 12월 20일,해당 정보를 찾을 수 없습니다.,[],,
B_rule_single_route,1,"서울특별시 여성가족재단_(재공고, 협상) 서울 디지털성범죄 안심지원센.hwp",extreme,사업기간은 어떻게 되는가?,계약체결일로부터 2024년 12월 20일,④ 기술능력 평가 중 정성적 평가점수는 위원별 정성적 평가분야 합계점수 중에서 최고점수와 최저점수를 준 위원을 제외하고 나머지 위원의 평가점수를 합산하여 산술평균한 점수로 함,"[""④ 기술능력 평가 중 정성적 평가점수는 위원별 정성적 평가분야 합계점수 중에서 최고점수와 최저점수를 준 위원을 제외하고 나머지 위원의 평가점수를 합산하여 산술평균한 점수로 함. 이 경우 최고점수․최저점수가 2개 이상인 경우 하나의 점수만 제외함. 세부 평가방법  평가항목 및 기준은 [붙임 6]와 같다.\n  ⑤ 입찰가격 평가(10점)는 제안서 평가위원회에서 기술능력 평가(정성적 평가) 완료 후 지체 없이 입찰참가자가 참석한 자리에서 밀봉한 가격입찰서를 개봉하고 입찰가격에 대한 평가를 실시하며, 입찰가격 평가산식은 「지방자치단체 입찰시 낙찰자 결정기준」제7장 [별표1] 규정에 의거 [붙임 7]과 같다.\n  ⑥ 제안서 평가 시 각 평가분야(항목)에서 따로 정하지 않는 한 점수산정결과 소수점 이하의 숫자가 있는 경우에는 소수점 다섯째자리에서 반올림함. 다만, 비교․대비 등의 계산값을 평가등급 등의 구간(이상․미만 등)에 적용할 때에는 반올림하지 아니하고 그대로 그 구간에 해당하는 등급의 점수로 산정함.\n제5조 (협상적격자 및 협상순위의 선정) ① 제안서 평가결과 기술능력 평가점수가 기술능력 평가분야 배점한도의 85% 이상인자를 협상적격자로 선정함.\n  ② 협상순서는 기술능력 평가점수와 입찰가격 평가점수의 합산 점수의 고득점 순에 의하여 결정하되 합산 점수가 동일한 제안자가 2인 이상일 경우에는 기술능력 평가점수가 높은 제안자를 선순위자로 하고, 기술능력 평가점수도 동일한 경우에는 추첨에 의함.\n  ③ 가격제안서(입찰서)의 입찰가격이 추정가격에 부가가치세를 더한 금액(예정가격을 작성한 경우에는 예정가격)을 초과하는 자는 협상적격자에서 제외함.\n제6조 (협상적격자에 대한 통지) 제5조에 의하여 협상적격자와 협상순위가 결정된 경우에는 협상적격자에게 협상순위와 협상일정을 통보함.\n제7조 (협상절차) ① 제5조에 의하여 결정된 협상순위에 따라 결정된 협상대상자와 협상을 하며, 협상이 성립된 때에는 다른 협상적격자와 협상을 실시하지 아니함.\n  ② 협상대상자와의 협상이 성립되지"", ""제1조 (목적) 이 기준은 아래 규정에 의해 「서울 디지털성범죄 안심지원센터 업무시스템 및 AI기반 삭제지원 시스템 통합」 사업 사업의 협상에 의한 계약체결기준에 필요한 세부기준 및 절차를 정함을 목적으로 함.\n  1.「지방자치단체를 당사자로 하는 계약에 관한 법률 시행령」제43조(협상에 의한 계약체결) 및 제44조(지식기반사업 등의 계약방법)\n  2.「지방자치단체 입찰시 낙찰자 결정 기준」(행정안전부예규)\n  3.「행정기관 및 공공기관 정보시스템 구축운영 지침」(행정안전부고시)\n  4.「소프트웨어 기술성 평가기준 지침」(과학기술정보통신부고시)\n  5.「서울특별시 정보화사업 제안서 세부평가기준」\n제2조 (정의) 이 기준에서 사용하는 용어의 정의는 다음과 같다.\n  1. ‘협상적격자’라 함은 제안서의 평가결과 협상에 의한 계약의 협상대상자가 될 수 있는 자격을 갖춘 자를 말함.\n  2. ‘협상대상자’라 함은 협상적격자로서 협상순위에 따라 발주기관 계약담당자와 제안서 내용을 대상으로 협상하는 자를 말함.\n제3조 (적용범위) 이 기준은「서울 디지털성범죄 안심지원센터 업무시스템 및 AI기반 삭제지원 시스템 통합」 사업에 적용하되, 동 기준에서 규정하지 않은 사항에 대해서는 관련법령 따른다.\n제4조 (제안서 평가) ① 제안서는 기술능력과 입찰가격을 종합하여 평가하며, 평가점수 비율은 기술능력 평가 90/100과 입찰가격 평가 10/100으로 함. 평가항목 및 배점은 [붙임 4]와 같다.\n  ② 기술능력 평가는 정량적 평가와 정성적 평가로 구분되며, 정량적 지표에 의한 평가는 계약담당자가 심사기준에 따라 평가하고, 정성적 평가는 심사위원들이 함.\n  ③ 기술능력 평가 중 정량적 지표(20점)는 「지방자치단체 입찰시 낙찰자 결정기준」제7장 협상에 의한 계약 [별표]의 기술인력 보유상태, 수행경험(실적), 경영상태, 등을 준용하여 평가하며, 정량적 지표의 세부 평가방법은 [붙임 5]와 같다."", ""주) 1. 평가대상 업체의 회사채(또는 기업어음) 및 기업신용평가에 따른 평점이 다른 경우에는 높은 평점으로 평가하며, ‘신용평가등급확인서’를 제출하지 않은 경우에는 최저 등급으로 평가\n         2. 합병 또는 분할한 자가 입찰공고일 이전에 평가한 신용평가등급이 없는 경우에는 입찰서 제출 마감일 전일까지 발급된 유효기간 내에 있는 가장 최근의 신용평가등급으로 평가함. 다만, 합병 후 새로운 신용평가등급이 없는 경우에는 입찰공고일 이전에 평가하고 유효기간 내에 있는 신용평가등급으로서 합병 대상자 중 가장 낮은 신용평가등급을 받은 자의 신용평가등급으로 평가함.\n         3. 추정가격이 고시금액 미만인 입찰에서 입찰공고일을 기준으로 최근 7년 이내에 사업을 개시한 창업기업에 대해서는 신용평가등급 점수상의 배점 한도를 부여함. 이 경우 창업기업에 대한 기간계산은 법인인 경우에는 법인등기부상 법인설립등기일을, 개인사업자인 경우에는 사업자 등록증명서상 사업자등록일을 기준으로 함.(이하 창업기업에 대한 기간계산은 같다)\n         4. 공동수급으로 참여한 경우 공동수급체 구성원별로 각각 산출한 경영상태 평가점수에 각각의 출자비율 또는 분담 비율을 곱하여 이를 합산하여 평가 \n         5. 중소기업협동조합이 입찰에 참여하는 경우 중소기업협동조합의 신용평가등급으로 평가한다.""]",,
C_rule_multi_route,1,"서울특별시 여성가족재단_(재공고, 협상) 서울 디지털성범죄 안심지원센.hwp",extreme,사업기간은 어떻게 되는가?,계약체결일로부터 2024년 12월 20일,④ 기술능력 평가 중 정성적 평가점수는 위원별 정성적 평가분야 합계점수 중에서 최고점수와 최저점수를 준 위원을 제외하고 나머지 위원의 평가점수를 합산하여 산술평균한 점수로 함,"[""④ 기술능력 평가 중 정성적 평가점수는 위원별 정성적 평가분야 합계점수 중에서 최고점수와 최저점수를 준 위원을 제외하고 나머지 위원의 평가점수를 합산하여 산술평균한 점수로 함. 이 경우 최고점수․최저점수가 2개 이상인 경우 하나의 점수만 제외함. 세부 평가방법  평가항목 및 기준은 [붙임 6]와 같다.\n  ⑤ 입찰가격 평가(10점)는 제안서 평가위원회에서 기술능력 평가(정성적 평가) 완료 후 지체 없이 입찰참가자가 참석한 자리에서 밀봉한 가격입찰서를 개봉하고 입찰가격에 대한 평가를 실시하며, 입찰가격 평가산식은 「지방자치단체 입찰시 낙찰자 결정기준」제7장 [별표1] 규정에 의거 [붙임 7]과 같다.\n  ⑥ 제안서 평가 시 각 평가분야(항목)에서 따로 정하지 않는 한 점수산정결과 소수점 이하의 숫자가 있는 경우에는 소수점 다섯째자리에서 반올림함. 다만, 비교․대비 등의 계산값을 평가등급 등의 구간(이상․미만 등)에 적용할 때에는 반올림하지 아니하고 그대로 그 구간에 해당하는 등급의 점수로 산정함.\n제5조 (협상적격자 및 협상순위의 선정) ① 제안서 평가결과 기술능력 평가점수가 기술능력 평가분야 배점한도의 85% 이상인자를 협상적격자로 선정함.\n  ② 협상순서는 기술능력 평가점수와 입찰가격 평가점수의 합산 점수의 고득점 순에 의하여 결정하되 합산 점수가 동일한 제안자가 2인 이상일 경우에는 기술능력 평가점수가 높은 제안자를 선순위자로 하고, 기술능력 평가점수도 동일한 경우에는 추첨에 의함.\n  ③ 가격제안서(입찰서)의 입찰가격이 추정가격에 부가가치세를 더한 금액(예정가격을 작성한 경우에는 예정가격)을 초과하는 자는 협상적격자에서 제외함.\n제6조 (협상적격자에 대한 통지) 제5조에 의하여 협상적격자와 협상순위가 결정된 경우에는 협상적격자에게 협상순위와 협상일정을 통보함.\n제7조 (협상절차) ① 제5조에 의하여 결정된 협상순위에 따라 결정된 협상대상자와 협상을 하며, 협상이 성립된 때에는 다른 협상적격자와 협상을 실시하지 아니함.\n  ② 협상대상자와의 협상이 성립되지"", ""제1조 (목적) 이 기준은 아래 규정에 의해 「서울 디지털성범죄 안심지원센터 업무시스템 및 AI기반 삭제지원 시스템 통합」 사업 사업의 협상에 의한 계약체결기준에 필요한 세부기준 및 절차를 정함을 목적으로 함.\n  1.「지방자치단체를 당사자로 하는 계약에 관한 법률 시행령」제43조(협상에 의한 계약체결) 및 제44조(지식기반사업 등의 계약방법)\n  2.「지방자치단체 입찰시 낙찰자 결정 기준」(행정안전부예규)\n  3.「행정기관 및 공공기관 정보시스템 구축운영 지침」(행정안전부고시)\n  4.「소프트웨어 기술성 평가기준 지침」(과학기술정보통신부고시)\n  5.「서울특별시 정보화사업 제안서 세부평가기준」\n제2조 (정의) 이 기준에서 사용하는 용어의 정의는 다음과 같다.\n  1. ‘협상적격자’라 함은 제안서의 평가결과 협상에 의한 계약의 협상대상자가 될 수 있는 자격을 갖춘 자를 말함.\n  2. ‘협상대상자’라 함은 협상적격자로서 협상순위에 따라 발주기관 계약담당자와 제안서 내용을 대상으로 협상하는 자를 말함.\n제3조 (적용범위) 이 기준은「서울 디지털성범죄 안심지원센터 업무시스템 및 AI기반 삭제지원 시스템 통합」 사업에 적용하되, 동 기준에서 규정하지 않은 사항에 대해서는 관련법령 따른다.\n제4조 (제안서 평가) ① 제안서는 기술능력과 입찰가격을 종합하여 평가하며, 평가점수 비율은 기술능력 평가 90/100과 입찰가격 평가 10/100으로 함. 평가항목 및 배점은 [붙임 4]와 같다.\n  ② 기술능력 평가는 정량적 평가와 정성적 평가로 구분되며, 정량적 지표에 의한 평가는 계약담당자가 심사기준에 따라 평가하고, 정성적 평가는 심사위원들이 함.\n  ③ 기술능력 평가 중 정량적 지표(20점)는 「지방자치단체 입찰시 낙찰자 결정기준」제7장 협상에 의한 계약 [별표]의 기술인력 보유상태, 수행경험(실적), 경영상태, 등을 준용하여 평가하며, 정량적 지표의 세부 평가방법은 [붙임 5]와 같다."", ""주) 1. 평가대상 업체의 회사채(또는 기업어음) 및 기업신용평가에 따른 평점이 다른 경우에는 높은 평점으로 평가하며, ‘신용평가등급확인서’를 제출하지 않은 경우에는 최저 등급으로 평가\n         2. 합병 또는 분할한 자가 입찰공고일 이전에 평가한 신용평가등급이 없는 경우에는 입찰서 제출 마감일 전일까지 발급된 유효기간 내에 있는 가장 최근의 신용평가등급으로 평가함. 다만, 합병 후 새로운 신용평가등급이 없는 경우에는 입찰공고일 이전에 평가하고 유효기간 내에 있는 신용평가등급으로서 합병 대상자 중 가장 낮은 신용평가등급을 받은 자의 신용평가등급으로 평가함.\n         3. 추정가격이 고시금액 미만인 입찰에서 입찰공고일을 기준으로 최근 7년 이내에 사업을 개시한 창업기업에 대해서는 신용평가등급 점수상의 배점 한도를 부여함. 이 경우 창업기업에 대한 기간계산은 법인인 경우에는 법인등기부상 법인설립등기일을, 개인사업자인 경우에는 사업자 등록증명서상 사업자등록일을 기준으로 함.(이하 창업기업에 대한 기간계산은 같다)\n         4. 공동수급으로 참여한 경우 공동수급체 구성원별로 각각 산출한 경영상태 평가점수에 각각의 출자비율 또는 분담 비율을 곱하여 이를 합산하여 평가 \n         5. 중소기업협동조합이 입찰에 참여하는 경우 중소기업협동조합의 신용평가등급으로 평가한다.""]",,
A_single_pipeline,1,서울특별시교육청_서울특별시교육청 지능정보화전략계획(ISP) 수립(2차) .hwp,central,사업기간: 이 사업의 중장기 계획 수립 기간은 몇 년인가?,3개년(3년),❍ 서울 미래교육 실현과 교육정책 변화에 대응하는 지능정보화 중장기(3년) 계획 수립,"[""1. 사업 개요 \n 가. 추진배경 및 필요성\n  ❍ 서울 미래교육 지능정보화정책의 효율적·체계적 추진을 위해 2021년 제1차 지능정보화전략계획(ISP) ※ ISP(Information Strategy Plan) 조직 및 정보화 업무를 분석, 현재의 업무 체계를 변화시키고 효율성을 증대하기 위한 목표 모델과 이행계획 마련의 운영 전략 계획 수립\n을 수립, 세부 실행과제*를 이행하고 있으며,\n    ‑ 1차 ISP 이후, 지능정보사회 환경 변화 대응 및 정보화정책의 지속적·체계적 추진을 위해 외부 전문기관 컨설팅으로 3개년 종합계획 수립\n    * (1차 ISP 도출과제 중 이행내용) 정보화조직 개편(2023. 7월), 학교정보화지원체계(테크센터) 구축·운영(2023년), 센클라우드 구축·운영(2023년), RPA 추진(2023년), 전문인력 양성(2023년)\n  ❍ 디지털 대전환 시대, 교육과 기술의 결합을 위한 새로운 패러다임의 ISP 수립\n    ‑ 서울교육 정책방향과 연계 및 디지털 전환 환경변화에 대응하기 위한 지능정보화 총괄 종합계획(3개년) 수립 필요\n    ※ 서울 미래교육 지능정보화정책 기본 방향과 비전 및 중장기 발전 방안 제시\n  ❍ 최신 지능정보기술(에듀테크)을 적용한 미래교육 디지털 서비스로의 전환\n    ‑ 빅데이터, 인공지능(생성형AI), 클라우드, RPA 등의 최신기술 적용과 다양한 정보자원 및 교육데이터의 통합·활용을 위한 혁신적인 정보화 환경 마련 요구 증대 \n    ‑ 디지털교과서 도입 및 가속화된 학교 에듀테크 환경에 맞는 교실의 디지털화를 담아내기 위한 미래형 교육 플랫폼 구축 방안 마련 필요\n  ❍ 새로운 변화에 효율적으로 대응하기 위한 정보화지원체계 개편\n    ‑ 학교 업무경감 및 교육인프라 지원 강화 등 효율적인 지능정보화정책 추진을 위한 조직ㆍ인력 체계 재구성 필요\n    ※ 정보화조직(본청-직속기관-지원청 업무 역할) 재정립 및 전문인력 양성\n 나. 주요 사업내용\n  ❍ 서울시교육청 중장기(3개년) 지능정보화 마스"", ""나. 정보화 현황\n  ❍ 제안서 작성 시 서울특별시교육청에서 운영하는 각종 정보시스템의 현황 및 세부내용이 필요할 경우 발주기관 지정 장소에서 열람 가능\n    ※ 근거: 「행정기관 및 공공기관 정보시스템 구축・운영 지침」제17조(제안요청서 보안사항 등)에 따라 공개하지 않음\n3. 사업 추진방안\n 가. 추진목표\n  ❍ 서울 미래교육 실현과 교육정책 변화에 대응하는 지능정보화 중장기(3년) 계획 수립\n  ❍ 디지털 대전환 시대, 에듀테크 활용 지능정보화 방향 제시\n  ❍ 지능정보사회 디지털 서비스 전환 및 학교 공감 교육·행정 서비스 제공 기반 마련\n  ❍ 새로운 변화 대응의 효율적인 정보화정책 추진 조직 재구조화 및 업무 지원체계 마련\n 나. 추진전략\n  ❍ 관리적 측면\n    ‑ 원활한 사업수행을 위한 전담 TF를 구성·운영하여 분야별로 정책과제를 발굴하고 이행방안을 마련\n    ※ (TF 구성) 정보화 주요업무 부서 실무자와 학교정보담당 교직원 등 참여\n    ‑ 업무 추진부서와 유관기관에 대한 현장 요구사항 분석 및 개선과제 도출로 사업 완성도 제고\n  ❍ 기술적 측면\n    ‑ 선진기술 추이와 혁신적인 정보화 환경변화 동향 조사·분석을 통한 개선 방안 마련\n    ‑ 최신 지능정보기술 활용 미래교육 수행 방안 및 교육환경 발전을 위한 현실성 있는 실행 과제 마련\n    ‑ 클라우드, 빅데이터, 인공지능(생성형AI), 메타버스 등 최신기술 발전을 고려한 국제표준 적용\n  ❍ 표준화 측면\n    ‑ 내부 및 외부 데이터 연계 확대에 따른 관리 용이성‧지속성을 위한 연계 기술 표준화 적용\n    ‑ 업무의 개선과 고도화 및 신규업무 추가를 고려한 확장성 있는 미래 모델 설계\n    ‑ 공통 프레임워크 적용을 통한 서비스 간 유기적인 구성 및 중복개발 최소화 방안 마련\n  ❍ 법‧제도적 측면\n    ‑ 환경변화에 따른 내부 가이드라인을 마련하고 기반·정보화 등 관련 법령·지침 준수에 대한 방향성 제시\n    ‑ 보안 관련 법령을 준용한 시스템 관리ㆍ운영 방안 ""]",,
B_rule_single_route,1,서울특별시교육청_서울특별시교육청 지능정보화전략계획(ISP) 수립(2차) .hwp,central,사업기간: 이 사업의 중장기 계획 수립 기간은 몇 년인가?,3개년(3년),2) 상용 소프트웨어 직접구매 : 정보화전략계획 수립 사업으로 해당 없음,"[""※ 상기의 정량적 평가표에 의거하여 자체평가서 및 증빙을 정량적 제안서에 제출\n  ※ [붙임 1] 기술평가 정량점수 계산 기준 참조\n 다. 기타 유의 사항\n 1) 과업심의위원회\n  ❍ (과업내용 확정 심의 여부) 본 사업은 「소프트웨어 진흥법」 제50조에 따른 과업내용 확정을 위하여 과업심의위원회를 계약 전까지 개최할 예정 사업임\n    ‑ (과업내용 변경) 본 사업은 「소프트웨어 진흥법」 제50조, 같은 법 시행령 제47조 제1항 제2호, 제3호에 따른 과업내용 변경 및 그에 따른 계약금액·계약기간 조정이 필요한 경우, 계약상대자는 국가기관등의 장에게 소프트웨어사업 과업변경요청서*를 제출하여 과업심의위원회 개최를 요청할 수 있다\n      * 「소프트웨어사업 계약 및 관리감독에 관한 지침」 별지 9호 서식 참조\n 2) 상용 소프트웨어 직접구매 : 정보화전략계획 수립 사업으로 해당 없음\n 3) 하도급 제한\n  ❍ 본 사업은 수주자(공동계약의 경우 공동수급체 구성원 포함)가 직접 수행함을 원칙으로 하되, 하도급 계약이 필요한 경우 다음 사항 준수\n    ‑ 하도급 사전승인\n     · 본 사업의 하도급의 경우 「소프트웨어 진흥법」 제51조제5항, 같은 법 시행규칙 제14조제1항 및 「소프트웨어사업 계약 및 관리감독에 관한 지침」의 규정에 의하여 반드시 발주기관으로부터 사전승인을 받고 하도급 계약을 하여야 함\n    ‑ 하도급 비율제한\n     · 본 사업의 과업의 일부를 하도급하려는 경우 「소프트웨어 진흥법」 제51조제1항에 따라 물품(상용소프트웨어 포함) 구매금액을 제외한 소프트웨어사업금액의 100분의 50을 초과할 수 없으며, 같은 법 제3항에 따라 다시 하도급은 원칙적으로 불허함. 다만, 같은 법 제51조제2항 각 호 및 제3항 각 호에 해당하는 경우 그러하지 아니함\n    ‑ 하도급 계획서 제출 요청\n     · 본 사업 과업의 일부를 하도급하려는 경우 계약체결 시 「소프트웨어사업 계약 및 관리감독에 관한 지침」의 별지 제7호서식 소프트웨어사업 하도급 계"", ""획서를 제출하여야 함 (서식 18호 참조)\n    ‑ 하도급 계약의 적정성 판단 세부기준 명시\n     · 발주사는 하도급계약의 승인을 신청하는 경우, 「소프트웨어사업 계약 및 관리감독에 관한 지침」의 별표 3 [하도급계약의 적정성 판단 세부기준]에 따라 적정성여부를 판단하며, 평가점수가 85점 이상인 경우에 한하여 하도급계약을 승인함. 다만, 85점 이상인 경우라 하더라도 하도급 계약의 세부 조건 등으로 인하여 사업의 원활한 수행이 불가능하다고 인정되는 경우 그 사유를 기재하여 하도급 승인 거절을 통보할 수 있음\n    ‑ 공동수급체 구성 \n     · 본 사업에서 전체 사업금액 대비 10%를 초과하여 하도급하려는 경우, 「소프트웨어 진흥법」 제51조제6항 및 동 법 시행령 제48조제5항에 따라 하도급이 아닌 공동수급체를 구성하여 참여해야하며, 공동수급체를 구성하지 못하는 불가피한 사정이 있는 경우 그 사유를 제시하여야 함\n    ‑ 정부기관 등에서 부정당제재 중인 업체와 공동수급 및 하도급 구성을 금함\n 4) 작업 장소\n  ❍ 작업 장소 상호 협의\n    ‑ 계약당사자는 사업 수행을 위해 필요한 작업장소 등(장소, 설비, 기타 작업환경)을 상호협의하여 결정하며, 핵심 개발인력이 아닌 지원인력의 근무장소는 보안 등 특별한 사유가 있는 경우를 제외하고는 계약상대자가 달리 정할 수 있음\n    ‑ 사업 수행을 위해 필요한 작업장소 등은 사업예산 내 계상되어 있으므로 관련 비용을 포함하여 제안가격을 산출하되, 작업장소 등은 상호협의하여 결정함\n 5) SW사업 산출물 활용 보장\n  ❍ 당해 계약에 따른 계약목적물에 대한 지식재산권 활용\n    ‑ (지식재산권) 발주기관과 계약상대자가 공동으로 소유하며 별도의 정함이 없는 한 지분은 균등한 것으로 함. 다만 개발의 기여도 및 계약목적물의 특수성(국가안전보장, 국방, 외교관계 등)을 고려하여 계약당사자간의 협의를 통해 지식재산권 귀속주체 등에 대해 공동소유와 달리 정할 수 있음\n    ‑ (산출물 반출 요청) 계약상대자"", ""참가자에게 있음\n  ❍ 입찰자는 발주기관으로부터 배부받은 입찰에 관한 서류 또는 각종 자료 및 입찰 과정에서 얻은 정보를 당해 입찰 외의 목적으로 사용해서 안 됨 \n  ❍ 제안서에 사업, 경쟁업체 등 입찰관련 사항에 대한 허위정보를 기재한 경우 관련 규정에 따라 협상적격자에서 제외, 계약해지 또는 부정당업자 입찰참가자격제한 등의 불이익을 받을 수 있으며, 기재한 내용에 대한 사실 확인에 대한 의무 및 입증 책임은 입찰자 본인에게 있음\n 나. 제안 평가 관련 사항\n 1) 기술능력 평가 및 입찰가격 평가\n  ❍ 종합평가점수(100%) = 기술능력평가(90%) + 입찰가격평가(10%)\n   - 제안서 평가는 기술능력(90%)과 입찰가격(10%)을 종합적으로 평가\n   - 기술능력평가(90점)와 가격평가(10점) 결과를 합산하여 고득점 순으로 선정\n     ※ (기술능력 평가 배점) 정성적 평가(70점), 정량적 평가(20)\n 2) 기술능력 평가 방법\n  ❍ 발주기관에서 구성한 관련 전문가로 구성된 평가위원회에서 제안서 평가\n  ❍ 각 항목별 평가배점과 방법은 『4). 기술성 평가기준』에 의함\n  ❍ 기술능력평가 점수가 기술능력 평가분야 배점한도의 85% 이상인 자를 협상대상자(협상적격자)로 선정함. 단, 평가 결과 협상적격자가 없는 경우에는 재공고 입찰에 부칠 수 있음\n  ❍ 평가점수 결과는 소수점 다섯째자리에서 반올림함\n 3) 우선협상대상자 선정 및 계약체결""]",,
C_rule_multi_route,1,서울특별시교육청_서울특별시교육청 지능정보화전략계획(ISP) 수립(2차) .hwp,central,사업기간: 이 사업의 중장기 계획 수립 기간은 몇 년인가?,3개년(3년),1) 서울 미래교육 실현을 위한 지능정보화(3개년) 중장기 종합계획 수립,"[""※ 상기의 정량적 평가표에 의거하여 자체평가서 및 증빙을 정량적 제안서에 제출\n  ※ [붙임 1] 기술평가 정량점수 계산 기준 참조\n 다. 기타 유의 사항\n 1) 과업심의위원회\n  ❍ (과업내용 확정 심의 여부) 본 사업은 「소프트웨어 진흥법」 제50조에 따른 과업내용 확정을 위하여 과업심의위원회를 계약 전까지 개최할 예정 사업임\n    ‑ (과업내용 변경) 본 사업은 「소프트웨어 진흥법」 제50조, 같은 법 시행령 제47조 제1항 제2호, 제3호에 따른 과업내용 변경 및 그에 따른 계약금액·계약기간 조정이 필요한 경우, 계약상대자는 국가기관등의 장에게 소프트웨어사업 과업변경요청서*를 제출하여 과업심의위원회 개최를 요청할 수 있다\n      * 「소프트웨어사업 계약 및 관리감독에 관한 지침」 별지 9호 서식 참조\n 2) 상용 소프트웨어 직접구매 : 정보화전략계획 수립 사업으로 해당 없음\n 3) 하도급 제한\n  ❍ 본 사업은 수주자(공동계약의 경우 공동수급체 구성원 포함)가 직접 수행함을 원칙으로 하되, 하도급 계약이 필요한 경우 다음 사항 준수\n    ‑ 하도급 사전승인\n     · 본 사업의 하도급의 경우 「소프트웨어 진흥법」 제51조제5항, 같은 법 시행규칙 제14조제1항 및 「소프트웨어사업 계약 및 관리감독에 관한 지침」의 규정에 의하여 반드시 발주기관으로부터 사전승인을 받고 하도급 계약을 하여야 함\n    ‑ 하도급 비율제한\n     · 본 사업의 과업의 일부를 하도급하려는 경우 「소프트웨어 진흥법」 제51조제1항에 따라 물품(상용소프트웨어 포함) 구매금액을 제외한 소프트웨어사업금액의 100분의 50을 초과할 수 없으며, 같은 법 제3항에 따라 다시 하도급은 원칙적으로 불허함. 다만, 같은 법 제51조제2항 각 호 및 제3항 각 호에 해당하는 경우 그러하지 아니함\n    ‑ 하도급 계획서 제출 요청\n     · 본 사업 과업의 일부를 하도급하려는 경우 계약체결 시 「소프트웨어사업 계약 및 관리감독에 관한 지침」의 별지 제7호서식 소프트웨어사업 하도급 계"", ""획서를 제출하여야 함 (서식 18호 참조)\n    ‑ 하도급 계약의 적정성 판단 세부기준 명시\n     · 발주사는 하도급계약의 승인을 신청하는 경우, 「소프트웨어사업 계약 및 관리감독에 관한 지침」의 별표 3 [하도급계약의 적정성 판단 세부기준]에 따라 적정성여부를 판단하며, 평가점수가 85점 이상인 경우에 한하여 하도급계약을 승인함. 다만, 85점 이상인 경우라 하더라도 하도급 계약의 세부 조건 등으로 인하여 사업의 원활한 수행이 불가능하다고 인정되는 경우 그 사유를 기재하여 하도급 승인 거절을 통보할 수 있음\n    ‑ 공동수급체 구성 \n     · 본 사업에서 전체 사업금액 대비 10%를 초과하여 하도급하려는 경우, 「소프트웨어 진흥법」 제51조제6항 및 동 법 시행령 제48조제5항에 따라 하도급이 아닌 공동수급체를 구성하여 참여해야하며, 공동수급체를 구성하지 못하는 불가피한 사정이 있는 경우 그 사유를 제시하여야 함\n    ‑ 정부기관 등에서 부정당제재 중인 업체와 공동수급 및 하도급 구성을 금함\n 4) 작업 장소\n  ❍ 작업 장소 상호 협의\n    ‑ 계약당사자는 사업 수행을 위해 필요한 작업장소 등(장소, 설비, 기타 작업환경)을 상호협의하여 결정하며, 핵심 개발인력이 아닌 지원인력의 근무장소는 보안 등 특별한 사유가 있는 경우를 제외하고는 계약상대자가 달리 정할 수 있음\n    ‑ 사업 수행을 위해 필요한 작업장소 등은 사업예산 내 계상되어 있으므로 관련 비용을 포함하여 제안가격을 산출하되, 작업장소 등은 상호협의하여 결정함\n 5) SW사업 산출물 활용 보장\n  ❍ 당해 계약에 따른 계약목적물에 대한 지식재산권 활용\n    ‑ (지식재산권) 발주기관과 계약상대자가 공동으로 소유하며 별도의 정함이 없는 한 지분은 균등한 것으로 함. 다만 개발의 기여도 및 계약목적물의 특수성(국가안전보장, 국방, 외교관계 등)을 고려하여 계약당사자간의 협의를 통해 지식재산권 귀속주체 등에 대해 공동소유와 달리 정할 수 있음\n    ‑ (산출물 반출 요청) 계약상대자"", ""참가자에게 있음\n  ❍ 입찰자는 발주기관으로부터 배부받은 입찰에 관한 서류 또는 각종 자료 및 입찰 과정에서 얻은 정보를 당해 입찰 외의 목적으로 사용해서 안 됨 \n  ❍ 제안서에 사업, 경쟁업체 등 입찰관련 사항에 대한 허위정보를 기재한 경우 관련 규정에 따라 협상적격자에서 제외, 계약해지 또는 부정당업자 입찰참가자격제한 등의 불이익을 받을 수 있으며, 기재한 내용에 대한 사실 확인에 대한 의무 및 입증 책임은 입찰자 본인에게 있음\n 나. 제안 평가 관련 사항\n 1) 기술능력 평가 및 입찰가격 평가\n  ❍ 종합평가점수(100%) = 기술능력평가(90%) + 입찰가격평가(10%)\n   - 제안서 평가는 기술능력(90%)과 입찰가격(10%)을 종합적으로 평가\n   - 기술능력평가(90점)와 가격평가(10점) 결과를 합산하여 고득점 순으로 선정\n     ※ (기술능력 평가 배점) 정성적 평가(70점), 정량적 평가(20)\n 2) 기술능력 평가 방법\n  ❍ 발주기관에서 구성한 관련 전문가로 구성된 평가위원회에서 제안서 평가\n  ❍ 각 항목별 평가배점과 방법은 『4). 기술성 평가기준』에 의함\n  ❍ 기술능력평가 점수가 기술능력 평가분야 배점한도의 85% 이상인 자를 협상대상자(협상적격자)로 선정함. 단, 평가 결과 협상적격자가 없는 경우에는 재공고 입찰에 부칠 수 있음\n  ❍ 평가점수 결과는 소수점 다섯째자리에서 반올림함\n 3) 우선협상대상자 선정 및 계약체결"", ""4. 제안 요청내용\n 가. 사업명 : 서울특별시교육청 지능정보화전략계획(ISP) 수립(2차)\n 나. 사업 기간 : 계약일로부터 5개월\n 다. 예산소요액 : 금 248,796천원(부가세 포함)\n 라. 사업 내용\n  1) 서울 미래교육 실현을 위한 지능정보화(3개년) 중장기 종합계획 수립\n   ❍ 서울 미래교육 지능정보화 비전, 전략, 정책방향 및 목표 설정\n   ❍ 지능정보화 추진 기반 역량과 성과 분석·평가, 문제점과 개선방향 도출\n    ‑ 지능정보기술, 인프라, 제도, 인적 부분 SWOT 분석\n    ‑ 현장 인터뷰 등을 통하여 지능정보화 요구가 높은 신규 업무 도출\n   ❍ 지능정보화 관련 상위 법령 제·개정에 따른 자치법규 정비 방안 마련(신규 제정 및 현행 보완)\n   ❍ 지능정보화 추진 전략과 과제별 투입인력 및 소요 예산 산정\n   ❍ 타 기관 정보화 환경(관리·운영) 분석과 사례조사 및 시사점 도출\n  2) 학교 현장 교육활동 보호 및 민원처리 개선을 위한 스마트 플랫폼 구축 방안 마련\n   ❍ 교육활동 보호 종합대책 연계, 스마트 공지 통합플랫폼 구축 방안 마련\n   ❍ 현 학교 공지시스템 현황 및 문제점 분석 후 개선 방안 도출\n   ❍ 학교 및 학생·학부모 의견 수렴을 통한 소통ㆍ커뮤니티 중심의 참여 플랫폼(민원처리시스템) 구축 방안 마련\n  3) 학교 업무경감 및 디지털 기반의 교육·행정환경 구축 방안 마련\n   ❍ 학교 네트워크(학내망, 유·무선) 중장기 개선 방안\n    ‑ 디지털 대전환에 따른 학교 교수·학습 환경 변화 분석 및 방향 제시\n    ‑ 각급 학교 유ㆍ무선 네트워크 현황 및 문제점 분석\n    ‑ 학교 네트워크 환경 개선(최적화) 방안 및 운영·관리, 지속적·체계적·전문적ㆍ종합적 지원 방안 \n   ❍ 학교정보화지원체계(테크센터) 효율적 운영 방안\n    ‑ 테크센터 운영 현황(조직·인력 체계, 수행업무, 운영 및 사업 추진 방식 등) 분석 및 문제점 도출\n    ‑ 미래 교육 체제 전환을 위한 테크센터 운영·관리 최적화(""]",,
A_single_pipeline,1,세종테크노파크_세종테크노파크 인사정보 전산시스템 구축 용역 입찰공.hwp,central,이 사업의 계약방법(입찰방식)은 무엇인가?,제한경쟁입찰(협상에 의한 계약),계약방법 : 제한경쟁입찰(협상에 의한 계약),"[""1. 일반사항\n  가. 용 역 명 : 세종테크노파크 인사정보 전산시스템 구축\n  나. 용역기간 : 계약 체결일로부터 약 60일 이내\n  다. 사 업 비 : 금90,000,000원(부가가치세 포함)\n  라. 계약방법 : 제한경쟁입찰(협상에 의한 계약)"", ""2. 추진전략\n  가. 사업수행 전략\n    ❍ ｢행정기관 및 공공기관 정보시스템 구축･운영 지침｣ 제7조에 따라 주관 사업자로부터 품질관리, 위험관리, 변경관리 등의 사업수행 계획서 및 기술적용계획표를 제출 받아 사업의 정상추진 이행여부에 대한 관리･감독\n    ❍ 세종테크노파크 현업 담당자 인터뷰를 통한 요구사항 의견 수렴 및 요구사항 분석을 통해 사업의 범위, 방향 등 사업 단계별 표준 산출물 종류, 수량, 제출시기 등은 제안내용을 검토 후, 사업수행 계획서에 반영하여 향후 원활한 시스템 운영 및 유지보수 업무 수행이 가능하도록 관리･감독\n  나. 사업관리 전략\n    ❍ [사업관리] 투입인력, 일정, 통제, 비용 등 관리\n    ❍ [품질관리] 상용/응용시스템, 아키텍쳐, S/W, 초기데이터, 산출물 등 사업전반에 걸쳐 품질관리 이행 및 준수여부 점검\n    ❍ [변경관리] 업무, 기술 등 환경변화에 따른 요구사항, 투입인력, 일정 등 관리\n    ❍ [위험관리] 내·외부 위험요소 관리\n    ❍ [보안관리] 사업수행 중 중요 정보가 유출되지 않도록 사전·사후 보안대책 강구\n  다. 표준화 전략\n    ❍ 시스템의 확장성·호환성·안전성이 확보될 수 있도록 정보 시스템 구축·운영기술 지침 준수\n    ❍ 국제·국가표준 등을 준수하고 최신 기술과 정보 기술들을 면밀히 분석하여 향후 확장성·안전성이 확보될 수 있도록 추진\n    ❍ 보안관련 법령, 규정, 지침 및 국가정보보안 기본지침, 개인정보보호 관련 법령, 규정, 지침 및 국무조정실 개인정보 보호지침 준수\n    ❍ 공공기관 데이터베이스 표준화 지침을 준수하여 세종테크노파크 환경에 적합한 DataBase 표준화\n  라. 시스템 구축 전략\n    ❍ 업무분석 및 시스템 표준화 분석\n      - 인사정보 프로그램 프로세스 및 데이터를 기반으로 하는 인사정보시스템 구축 표준화\n      - 현행(AS-IS) 분석과 부서별 현행 업무 프로세스 및 업무특성 분석을 통해 인사정보시스템 구축 방안 도출\n      ""]",,
B_rule_single_route,1,세종테크노파크_세종테크노파크 인사정보 전산시스템 구축 용역 입찰공.hwp,central,이 사업의 계약방법(입찰방식)은 무엇인가?,제한경쟁입찰(협상에 의한 계약),계약방법 : 제한경쟁입찰(협상에 의한 계약),"[""1. 일반사항\n  가. 용 역 명 : 세종테크노파크 인사정보 전산시스템 구축\n  나. 용역기간 : 계약 체결일로부터 약 60일 이내\n  다. 사 업 비 : 금90,000,000원(부가가치세 포함)\n  라. 계약방법 : 제한경쟁입찰(협상에 의한 계약)"", ""2. 추진전략\n  가. 사업수행 전략\n    ❍ ｢행정기관 및 공공기관 정보시스템 구축･운영 지침｣ 제7조에 따라 주관 사업자로부터 품질관리, 위험관리, 변경관리 등의 사업수행 계획서 및 기술적용계획표를 제출 받아 사업의 정상추진 이행여부에 대한 관리･감독\n    ❍ 세종테크노파크 현업 담당자 인터뷰를 통한 요구사항 의견 수렴 및 요구사항 분석을 통해 사업의 범위, 방향 등 사업 단계별 표준 산출물 종류, 수량, 제출시기 등은 제안내용을 검토 후, 사업수행 계획서에 반영하여 향후 원활한 시스템 운영 및 유지보수 업무 수행이 가능하도록 관리･감독\n  나. 사업관리 전략\n    ❍ [사업관리] 투입인력, 일정, 통제, 비용 등 관리\n    ❍ [품질관리] 상용/응용시스템, 아키텍쳐, S/W, 초기데이터, 산출물 등 사업전반에 걸쳐 품질관리 이행 및 준수여부 점검\n    ❍ [변경관리] 업무, 기술 등 환경변화에 따른 요구사항, 투입인력, 일정 등 관리\n    ❍ [위험관리] 내·외부 위험요소 관리\n    ❍ [보안관리] 사업수행 중 중요 정보가 유출되지 않도록 사전·사후 보안대책 강구\n  다. 표준화 전략\n    ❍ 시스템의 확장성·호환성·안전성이 확보될 수 있도록 정보 시스템 구축·운영기술 지침 준수\n    ❍ 국제·국가표준 등을 준수하고 최신 기술과 정보 기술들을 면밀히 분석하여 향후 확장성·안전성이 확보될 수 있도록 추진\n    ❍ 보안관련 법령, 규정, 지침 및 국가정보보안 기본지침, 개인정보보호 관련 법령, 규정, 지침 및 국무조정실 개인정보 보호지침 준수\n    ❍ 공공기관 데이터베이스 표준화 지침을 준수하여 세종테크노파크 환경에 적합한 DataBase 표준화\n  라. 시스템 구축 전략\n    ❍ 업무분석 및 시스템 표준화 분석\n      - 인사정보 프로그램 프로세스 및 데이터를 기반으로 하는 인사정보시스템 구축 표준화\n      - 현행(AS-IS) 분석과 부서별 현행 업무 프로세스 및 업무특성 분석을 통해 인사정보시스템 구축 방안 도출\n      ""]",,
C_rule_multi_route,1,세종테크노파크_세종테크노파크 인사정보 전산시스템 구축 용역 입찰공.hwp,central,이 사업의 계약방법(입찰방식)은 무엇인가?,제한경쟁입찰(협상에 의한 계약),계약방법 : 제한경쟁입찰(협상에 의한 계약),"[""1. 일반사항\n  가. 용 역 명 : 세종테크노파크 인사정보 전산시스템 구축\n  나. 용역기간 : 계약 체결일로부터 약 60일 이내\n  다. 사 업 비 : 금90,000,000원(부가가치세 포함)\n  라. 계약방법 : 제한경쟁입찰(협상에 의한 계약)"", ""2. 추진전략\n  가. 사업수행 전략\n    ❍ ｢행정기관 및 공공기관 정보시스템 구축･운영 지침｣ 제7조에 따라 주관 사업자로부터 품질관리, 위험관리, 변경관리 등의 사업수행 계획서 및 기술적용계획표를 제출 받아 사업의 정상추진 이행여부에 대한 관리･감독\n    ❍ 세종테크노파크 현업 담당자 인터뷰를 통한 요구사항 의견 수렴 및 요구사항 분석을 통해 사업의 범위, 방향 등 사업 단계별 표준 산출물 종류, 수량, 제출시기 등은 제안내용을 검토 후, 사업수행 계획서에 반영하여 향후 원활한 시스템 운영 및 유지보수 업무 수행이 가능하도록 관리･감독\n  나. 사업관리 전략\n    ❍ [사업관리] 투입인력, 일정, 통제, 비용 등 관리\n    ❍ [품질관리] 상용/응용시스템, 아키텍쳐, S/W, 초기데이터, 산출물 등 사업전반에 걸쳐 품질관리 이행 및 준수여부 점검\n    ❍ [변경관리] 업무, 기술 등 환경변화에 따른 요구사항, 투입인력, 일정 등 관리\n    ❍ [위험관리] 내·외부 위험요소 관리\n    ❍ [보안관리] 사업수행 중 중요 정보가 유출되지 않도록 사전·사후 보안대책 강구\n  다. 표준화 전략\n    ❍ 시스템의 확장성·호환성·안전성이 확보될 수 있도록 정보 시스템 구축·운영기술 지침 준수\n    ❍ 국제·국가표준 등을 준수하고 최신 기술과 정보 기술들을 면밀히 분석하여 향후 확장성·안전성이 확보될 수 있도록 추진\n    ❍ 보안관련 법령, 규정, 지침 및 국가정보보안 기본지침, 개인정보보호 관련 법령, 규정, 지침 및 국무조정실 개인정보 보호지침 준수\n    ❍ 공공기관 데이터베이스 표준화 지침을 준수하여 세종테크노파크 환경에 적합한 DataBase 표준화\n  라. 시스템 구축 전략\n    ❍ 업무분석 및 시스템 표준화 분석\n      - 인사정보 프로그램 프로세스 및 데이터를 기반으로 하는 인사정보시스템 구축 표준화\n      - 현행(AS-IS) 분석과 부서별 현행 업무 프로세스 및 업무특성 분석을 통해 인사정보시스템 구축 방안 도출\n      ""]",,
A_single_pipeline,1,수협중앙회_강릉어선안전조업국 상황관제시스템 구축.hwp,central,이 사업의 입찰방식은 무엇인가?,제한경쟁입찰,사업의 안내,"[""Ⅰ. 사업의 안내\n  1. 사업설명 1\n  2. 사업개요 1\n  3. 사업범위2\n  4. 추진일정2\n  5. 기대효과2"", ""* 사업목표 달성을 위해 필요한 컨버터, 분배기, 케이블 등 부수자재 및 부대설비 모두 포함\n□ 사업수행사는 착수 후 동 사업의 설계서의 작성 및 본회의 승인을 득한 후 사업을 추진하여야 한다.""]",,
B_rule_single_route,1,수협중앙회_강릉어선안전조업국 상황관제시스템 구축.hwp,central,이 사업의 입찰방식은 무엇인가?,제한경쟁입찰,□ 사업수행사는 착수 후 동 사업의 설계서의 작성 및 본회의 승인을 득한 후 사업을 추진하여야 한다.,"[""□ 선정절차\n  ○ 본 용역에 응찰하고자 하는 자는 제안요청서에 따라 제안서를 작성 제출\n  ○ 제안서의 평가는 기술평가와 가격평가로 나누어 종합적으로 평가하되, 기술평가 80%와 가격평가 20%의 비중으로 실시\n  ○ 제안서 평가 결과 기술평가 점수와 가격평가 점수를 합산하여 70점 이상인 자를 협상적격자로 선정\n    - 협상 순서는 합산점수의 고득점순에 따라서 결정\n    - 합산점수가 동일한 제안자가 2인 이상일 경우 기술평가 점수가 높은 제안자를 선순위자로 하고, 기술평가 점수도 동일한 경우에는 기술평가 세부평가항목 중 배점이 큰 항목에서 높은 점수를 얻은 자를 선순위자로 함\n    - 합산점수가 70점 이상인 자가 없는 경우에는 재공고 입찰\n  ○ 결정된 협상순서에 따라 협상대상자와 협상을 하며, 협상이 성립된 때에는 다른 협상적격자와 협상을 실시하지 않음\n  ○ 협상이 성립되지 아니하면 동일한 기준과 절차에 따라 차순위 협상\n  ○ 협상금액은 협상적격자의 제안서 평균금액을 기준으로 하며 제안서 평균금액이 해당 협상대상자의 제안서 금액보다 높을 경우에는 해당 협상대상자의 제안서 금액을 협상금액으로 함\n  ○ 본 제안요청서에 규정하지 아니한 사항과 입찰에 필요한 세부사항에 대하여는 본회 「협상에 의한 계약요령」에 따르거나 별도로 정하여 시행할 수 있음"", ""제9조(구성원의 출자비율) ① 당 공동수급체의 출자비율은 다음과 같이 정한다.\n    1. ㅇㅇㅇ :      %\n    2. ㅇㅇㅇ :      %\n  ② 제1항의 비율은 다음 각호의 1에 해당하는 경우 변경할 수 있다. 다만, 출자비율을 변경하는 경우 공동수급체 일부구성원의 출자비율 전부를 다른 구성원에게 이전할 수 없다.\n    1. 발주기관과의 계약내용 변경에 따라 계약금액이 증감되었을 경우\n    2. 공동수급체 구성원중 파산, 해산, 부도 등의 사유로 인하여 당초 협정서의    내용대로 계약이행이 곤란한 구성원이 발생하여 공동수급체구성원 연명으로    출자비율의 변경을 요청한 경우\n  ③ 현금이외의 출자는 시가를 참작, 구성원이 협의 평가하는 것으로 한다."", ""* 사업목표 달성을 위해 필요한 컨버터, 분배기, 케이블 등 부수자재 및 부대설비 모두 포함\n□ 사업수행사는 착수 후 동 사업의 설계서의 작성 및 본회의 승인을 득한 후 사업을 추진하여야 한다.""]",,
C_rule_multi_route,1,수협중앙회_강릉어선안전조업국 상황관제시스템 구축.hwp,central,이 사업의 입찰방식은 무엇인가?,제한경쟁입찰,□ 사업수행사는 착수 후 동 사업의 설계서의 작성 및 본회의 승인을 득한 후 사업을 추진하여야 한다.,"[""□ 선정절차\n  ○ 본 용역에 응찰하고자 하는 자는 제안요청서에 따라 제안서를 작성 제출\n  ○ 제안서의 평가는 기술평가와 가격평가로 나누어 종합적으로 평가하되, 기술평가 80%와 가격평가 20%의 비중으로 실시\n  ○ 제안서 평가 결과 기술평가 점수와 가격평가 점수를 합산하여 70점 이상인 자를 협상적격자로 선정\n    - 협상 순서는 합산점수의 고득점순에 따라서 결정\n    - 합산점수가 동일한 제안자가 2인 이상일 경우 기술평가 점수가 높은 제안자를 선순위자로 하고, 기술평가 점수도 동일한 경우에는 기술평가 세부평가항목 중 배점이 큰 항목에서 높은 점수를 얻은 자를 선순위자로 함\n    - 합산점수가 70점 이상인 자가 없는 경우에는 재공고 입찰\n  ○ 결정된 협상순서에 따라 협상대상자와 협상을 하며, 협상이 성립된 때에는 다른 협상적격자와 협상을 실시하지 않음\n  ○ 협상이 성립되지 아니하면 동일한 기준과 절차에 따라 차순위 협상\n  ○ 협상금액은 협상적격자의 제안서 평균금액을 기준으로 하며 제안서 평균금액이 해당 협상대상자의 제안서 금액보다 높을 경우에는 해당 협상대상자의 제안서 금액을 협상금액으로 함\n  ○ 본 제안요청서에 규정하지 아니한 사항과 입찰에 필요한 세부사항에 대하여는 본회 「협상에 의한 계약요령」에 따르거나 별도로 정하여 시행할 수 있음"", ""제9조(구성원의 출자비율) ① 당 공동수급체의 출자비율은 다음과 같이 정한다.\n    1. ㅇㅇㅇ :      %\n    2. ㅇㅇㅇ :      %\n  ② 제1항의 비율은 다음 각호의 1에 해당하는 경우 변경할 수 있다. 다만, 출자비율을 변경하는 경우 공동수급체 일부구성원의 출자비율 전부를 다른 구성원에게 이전할 수 없다.\n    1. 발주기관과의 계약내용 변경에 따라 계약금액이 증감되었을 경우\n    2. 공동수급체 구성원중 파산, 해산, 부도 등의 사유로 인하여 당초 협정서의    내용대로 계약이행이 곤란한 구성원이 발생하여 공동수급체구성원 연명으로    출자비율의 변경을 요청한 경우\n  ③ 현금이외의 출자는 시가를 참작, 구성원이 협의 평가하는 것으로 한다."", ""* 사업목표 달성을 위해 필요한 컨버터, 분배기, 케이블 등 부수자재 및 부대설비 모두 포함\n□ 사업수행사는 착수 후 동 사업의 설계서의 작성 및 본회의 승인을 득한 후 사업을 추진하여야 한다."", ""Ⅱ. 제안요청 내용\n  1. 목표시스템 구성도3\n  2. 주요사업내용3\n  3. 요구사항목록5\n  4. 요구사항상세6""]",,
A_single_pipeline,1,수협중앙회_수협중앙회 수산물사이버직매장 시스템 재구축 ISMP 수립 입.hwp,central,이 사업의 입찰방식(계약방법)은 무엇인가요?,제한경쟁입찰(협상에 의한 계약),입찰방식 및 방법29,"[""Ⅴ. 입찰안내 29\n  1. 입찰방식 및 방법29\n  2. 적용기준29\n  3. 참가자격29\n  4. 제안설명회 및 평가30\n  5. 협상적격자 선정 및 협상방법31\n  6. 입찰시 유의사항32\n  7. 제안서 제출 유의사항32\n  8. 제안서 보상32\n  9. 기타 사항33"", ""1. 사업개요\n  □ 사 업 명 : 수협중앙회 수산물 사이버직매장 재구축 ISMP수립 용역\n  □ 사업기간 : 계약일로부터 4월(120일)  * 사업기간은 협의에 의해 조정할 수 있음\n  □ 계약방법 : 제한경쟁입찰(협상에 의한 계약)\n  □ 사업예산 : 300백만원(V.A.T. 포함)""]",,
B_rule_single_route,1,수협중앙회_수협중앙회 수산물사이버직매장 시스템 재구축 ISMP 수립 입.hwp,central,이 사업의 입찰방식(계약방법)은 무엇인가요?,제한경쟁입찰(협상에 의한 계약),입찰방식 및 방법29,"[""Ⅴ. 입찰안내 29\n  1. 입찰방식 및 방법29\n  2. 적용기준29\n  3. 참가자격29\n  4. 제안설명회 및 평가30\n  5. 협상적격자 선정 및 협상방법31\n  6. 입찰시 유의사항32\n  7. 제안서 제출 유의사항32\n  8. 제안서 보상32\n  9. 기타 사항33"", ""1. 사업개요\n  □ 사 업 명 : 수협중앙회 수산물 사이버직매장 재구축 ISMP수립 용역\n  □ 사업기간 : 계약일로부터 4월(120일)  * 사업기간은 협의에 의해 조정할 수 있음\n  □ 계약방법 : 제한경쟁입찰(협상에 의한 계약)\n  □ 사업예산 : 300백만원(V.A.T. 포함)""]",,
C_rule_multi_route,1,수협중앙회_수협중앙회 수산물사이버직매장 시스템 재구축 ISMP 수립 입.hwp,central,이 사업의 입찰방식(계약방법)은 무엇인가요?,제한경쟁입찰(협상에 의한 계약),입찰방식 및 방법29,"[""Ⅴ. 입찰안내 29\n  1. 입찰방식 및 방법29\n  2. 적용기준29\n  3. 참가자격29\n  4. 제안설명회 및 평가30\n  5. 협상적격자 선정 및 협상방법31\n  6. 입찰시 유의사항32\n  7. 제안서 제출 유의사항32\n  8. 제안서 보상32\n  9. 기타 사항33"", ""1. 사업개요\n  □ 사 업 명 : 수협중앙회 수산물 사이버직매장 재구축 ISMP수립 용역\n  □ 사업기간 : 계약일로부터 4월(120일)  * 사업기간은 협의에 의해 조정할 수 있음\n  □ 계약방법 : 제한경쟁입찰(협상에 의한 계약)\n  □ 사업예산 : 300백만원(V.A.T. 포함)""]",,
A_single_pipeline,1,울산광역시_2024년 버스정보시스템 확대 구축 및 기능개선 용역.hwp,extreme,사업범위에 명시된 버스정보안내단말기 제작 및 설치 수량(신설·교체 구분 포함)은 얼마인가?,"버스정보안내단말기 130대 제작 및 설치(신설 60, 교체 70)","❍ 버스정보안내단말기 130대 제작 및 설치(신설 60, 교체 70)","[""3. 사업범위\n 가. 공간적 범위\n  ❍ 울산광역시 관내 버스정류소 및 교통관리센터\n 나. 내용적 범위\n  ❍ 버스정보안내단말기 130대 제작 및 설치(신설 60, 교체 70)\n  ❍ 프로그램 기능개선(문자 혼용 노선번호 및 회차지 대기 서비스 표출) 및 적용\n \n<표>"", ""2. 사업내용\n 가. 버스정보안내단말기(BIT) 확대 구축 \n  ❍ 버스정보안내단말기(BIT) 제작 및 설치 : 130대\n    - BIT 신규 설치 : 60개소\n    - BIT 교체 설치 : 70개소\n 나. 버스정보시스템(BIS) 소프트웨어 기능개선\n  ❍ BIS 소프트웨어 프로그램 기능 개선 및 적용 \n    - 문자혼용 노선번호 표출\n    - 회차지 대기 서비스 표출""]",,
B_rule_single_route,1,울산광역시_2024년 버스정보시스템 확대 구축 및 기능개선 용역.hwp,extreme,사업범위에 명시된 버스정보안내단말기 제작 및 설치 수량(신설·교체 구분 포함)은 얼마인가?,"버스정보안내단말기 130대 제작 및 설치(신설 60, 교체 70)",제안서 평가 방법,"[""3. 제안서 평가 방법\n 가. 제안서 평가 방법\n  ❍ 지방자치단체 입찰시 낙찰자 결정기준(행정안전부 예규)의 제7장 협상에 의한 계약체결 기준에 의함\n  ❍ 행정기관 및 공공기관 정보시스템 구축·운영 지침(행정안전부 고시)\n  ❍ 제안서 평가 방법 : 기술능력평가 점수 90%(정량적평가 20점, 정성적평가 70점), 입찰가격평가 점수 10%\n  ❍ 기술능력평가 배점은 사업의 성격을 고려하여 항목별로 적정 가중치를 설정하여 배점함\n  ❍ 기술제안서 평가결과에 대하여 제안업체는 어떠한 이의도 제기할 수 없음\n  ❍ 기술능력평가 중 정성적평가는 “기술제안서 평가위원회”를 구성하여 평가하며 평가결과 공개는 협상계약 제안서평가 세부기준에 따름"", ""제8조 (거래계좌) 행정안전부 예규「지방자치단체 입찰 및 계약 집행기준」제7장 공동계약 운영요령 제3절 7. 대가의 지급에 정한 바에 따라 선금, 기성대가 등은 다음 계좌로 지급받는다.\n  1. ○○○회사(공동수급체대표자) : ○○은행, 계좌번호○○○, 예금주○○○\n  2. ○○○회사 : ○○은행, 계좌번호○○○, 예금주○○○\n제9조 (구성원의 출자비율) ① 각 구성원의 출자비율은 다음과 같이 정한다.\n  1. ○○○:     %\n  2. ○○○:     %\n  ② 제1항의 출자비율은 다음 각 호의 어느 하나에 해당하는 경우에 변경할 수 있다. 다만, 출자비율을 변경함에 있어 일부 구성원의 출자지분 전부를 다른 구성원에게 이전할 수 없다.\n  1. 발주기관과의 계약내용 변경에 따라 계약금액이 증감되었을 경우\n  2. 공동수급체의 구성원 중 파산, 해산, 부도 등의 사유로 인하여 당초 협정서의 내용대로 계약이행이 곤란한 구성원이 발생하여 공동수급체의 구성원 연명으로 출자비율의 변경을 요청한 경우\n  ③ 현금 이외의 출자는 시가를 참작, 구성원이 협의 평가하는 것으로 한다."", ""<표>\n \n1. 사업일반\n 가. 사 업 명 : 2024년 버스정보시스템 확대 구축 및 기능개선\n 나. 사업기간 : 착수일로부터 5개월\n    ※ 본 사업은 「소프트웨어 진흥법」제45조(적정 사업기간 산정 등) 및 「소프트웨어사업 계약 및 관리감독에 관한 지침」제10조(적정 사업기간의 산정)에 따라 ‘소프트웨어 개발사업 적정 사업기간 산정기준’에 따른 사업임\n 다. 사업예산 : 금986,945,000원(금구억팔천육백구십사만오천원)\n 라. 계약방법 : 제한경쟁입찰(협상에 의한 계약)""]",,
C_rule_multi_route,1,울산광역시_2024년 버스정보시스템 확대 구축 및 기능개선 용역.hwp,extreme,사업범위에 명시된 버스정보안내단말기 제작 및 설치 수량(신설·교체 구분 포함)은 얼마인가?,"버스정보안내단말기 130대 제작 및 설치(신설 60, 교체 70)",제안서 평가 방법,"[""3. 제안서 평가 방법\n 가. 제안서 평가 방법\n  ❍ 지방자치단체 입찰시 낙찰자 결정기준(행정안전부 예규)의 제7장 협상에 의한 계약체결 기준에 의함\n  ❍ 행정기관 및 공공기관 정보시스템 구축·운영 지침(행정안전부 고시)\n  ❍ 제안서 평가 방법 : 기술능력평가 점수 90%(정량적평가 20점, 정성적평가 70점), 입찰가격평가 점수 10%\n  ❍ 기술능력평가 배점은 사업의 성격을 고려하여 항목별로 적정 가중치를 설정하여 배점함\n  ❍ 기술제안서 평가결과에 대하여 제안업체는 어떠한 이의도 제기할 수 없음\n  ❍ 기술능력평가 중 정성적평가는 “기술제안서 평가위원회”를 구성하여 평가하며 평가결과 공개는 협상계약 제안서평가 세부기준에 따름"", ""제8조 (거래계좌) 행정안전부 예규「지방자치단체 입찰 및 계약 집행기준」제7장 공동계약 운영요령 제3절 7. 대가의 지급에 정한 바에 따라 선금, 기성대가 등은 다음 계좌로 지급받는다.\n  1. ○○○회사(공동수급체대표자) : ○○은행, 계좌번호○○○, 예금주○○○\n  2. ○○○회사 : ○○은행, 계좌번호○○○, 예금주○○○\n제9조 (구성원의 출자비율) ① 각 구성원의 출자비율은 다음과 같이 정한다.\n  1. ○○○:     %\n  2. ○○○:     %\n  ② 제1항의 출자비율은 다음 각 호의 어느 하나에 해당하는 경우에 변경할 수 있다. 다만, 출자비율을 변경함에 있어 일부 구성원의 출자지분 전부를 다른 구성원에게 이전할 수 없다.\n  1. 발주기관과의 계약내용 변경에 따라 계약금액이 증감되었을 경우\n  2. 공동수급체의 구성원 중 파산, 해산, 부도 등의 사유로 인하여 당초 협정서의 내용대로 계약이행이 곤란한 구성원이 발생하여 공동수급체의 구성원 연명으로 출자비율의 변경을 요청한 경우\n  ③ 현금 이외의 출자는 시가를 참작, 구성원이 협의 평가하는 것으로 한다."", ""<표>\n \n1. 사업일반\n 가. 사 업 명 : 2024년 버스정보시스템 확대 구축 및 기능개선\n 나. 사업기간 : 착수일로부터 5개월\n    ※ 본 사업은 「소프트웨어 진흥법」제45조(적정 사업기간 산정 등) 및 「소프트웨어사업 계약 및 관리감독에 관한 지침」제10조(적정 사업기간의 산정)에 따라 ‘소프트웨어 개발사업 적정 사업기간 산정기준’에 따른 사업임\n 다. 사업예산 : 금986,945,000원(금구억팔천육백구십사만오천원)\n 라. 계약방법 : 제한경쟁입찰(협상에 의한 계약)""]",,
A_single_pipeline,1,을지대학교_을지대학교 비교과시스템 개발.hwp,central,입찰방식은 무엇인가?,제한경쟁입찰 (협상에 의한 계약체결 방식),해당 정보를 찾을 수 없습니다.,[],,
B_rule_single_route,1,을지대학교_을지대학교 비교과시스템 개발.hwp,central,입찰방식은 무엇인가?,제한경쟁입찰 (협상에 의한 계약체결 방식),1) 기술평가와 가격평가를 실시하여 종합평가점수로 평가,"[""1) 기술평가와 가격평가를 실시하여 종합평가점수로 평가\n     평가비율 : 기술평가(70%), 가격평가(30%)\n     종합평가점수 = 기술평가점수 + 입찰가격 평가점수\n2) 기술평가 방법\n     제안서의 공정한 평가를 위해 평가위원회를 구성하여 평가하고, 제안서에 기재되지 않은 사항은 평가하지 않는다.\n     협상대상 업체를 선정하기 위한 평가는 총점을 100점으로 하고 기술능력평가의 비중을 100분의 70으로, 가격평가의 비중을 100분의 30으로 한다.\n     기술능력평가는 평가위원별로 제출된 제안서를 평가하여 “평가항목 및 배점”에 의거하여 실시한다.\n     기술평가 기준 및 배점은 소프트웨어 기술성 평가 기준을 참고하되, 본사업에 맞게 재구성한 기술평가표(『다. 기술성평가기준』)에 따른다\n     기술능력평가 중 기술제안서 각 평가위원의 평가점수 중 최고점수와 최저점수를 제외한 나머지 위원의 평가점수를 평균한 점수(70점 만점)를 평가 점수로 한다\n     가격평가는 ｢협상에 의한 계약체결기준｣ (기획재정부 계약예규 제114호, 2012.9.22.)을 기준으로 함\n         - 입찰가격 평점산식\n           ⚬ 입찰가격을 추정가격의 100분의 80 이상으로 입찰한 자\n                      \n         ※ 최저입찰가격 : 유효한 입찰자중 최저입찰가격\n         ※ 당해입찰가격 : 당해 평가대상자의 입찰가격\n         ※ 입찰가격 평가시 사업예산으로 하는 경우에는 추정가격에 부가가치세를 포함하여 적용하고, 예정가격을 작성한 경우에는 추정가격을 예정가격으로 적용\n           ⚬ 입찰가격을 추정가격의 100분의 80 미만인 입찰한 자 \n                 \n                           \n         ※ 최저입찰가격 : 유효한 입찰자중 최저입찰가격\n         ※ 당해입찰가격 : 당해 평가대상자의 입찰가격으로 하되, 입찰가격이 추정가격의 100분"", ""4. 추진방안\n   가. 사업예산 : 비공개 입찰\n     ❍ 사업예산은 공개하지 않으며, 수행업체에서 소요되는 비용을 산출하여 제안서 제출 시 함께 제출\n   나. 기술 대 가격 비율의 조정\n        ❍ 기술평가와 가격평가를 실시하여 종합평가점수로 평가\n          - 평가비율 : 기술평가(70%), 가격평가(30%)\n          - 종합평가점수  = 기술평가점수 + 입찰가격 평가점수\n          - 협상에 의한 계약 체결시 기술 대 가격 배점기준 7:3으로 적용\nⅣ. 제안요청 내용 \n 1. 제안요청 개요\n   가. 사 업 명 : 을지대학교 비교과시스템 개발 사업\n   나. 사업기간 : 계약체결일로부터 2025년 4월 30일 까지"", ""의 60 미만일 경우에는 100분의 60으로 계산\n         ※ 입찰가격 평가시 사업예산으로 하는 경우에는 추정가격에 부가가치세를 포함하여 적용하고, 예정가격을 작성한 경우에는 추정가격을 예정가격으로 적용\n     제안 가격부분은 각 항목별 세부비용을 구분하여 제안토록 하고 금액에 대한 산출근거 및 기준을 부가가치세를 포함하여 구체적으로 제시하여야 한다\n     제안사는 제안서, 평가방법 또는 선정 결과에 대해 이의를 제기할 수 없으며, 제안서 평가결과의 세부내용 및 협상결과는 공개하지 않는다\n     평가점수 결과는 소수점 셋째자리에서 반올림\n3) 우선협상대상자 선정 및 계약체결\n     협상대상자 중 기술평가점수와 가격평가점수를 합한 점수가 1위인 제안사를 우선협상대상자로 선정하여 기타 지원조건 등을 협상한다\n     종합평가점수(기술능력평가+가격평가) 고득점 순으로 협상대상자 후보를 선정하며, 후보 중 가장 점수가 높은 1순위 업체부터 단계별 순차적으로 협상한다\n     종합평가점수가 동일한 경우에는 기술평가 점수가 높은 제안사를 선순위자로 하고, 기술능력 평가점수도 동일한 경우에는 기술능력의 세부평가항목 중 배점이 큰 항목에서 높은 점수를 얻은 제안사를 선순위로 한다\n     상위 순위업체와 협상결과 협의가 이루어지면 하위 순위 업체와의 협상은 진행하지 않는다\n     협상대상 업체 선정결과는 서면으로 통보하며, 미선정업체에 대한 통보는 생략\n     협상대상자와 협상이 결렬되면 동일한 기준과 절차에 의해 차 순위 협상대상 업체와 협상을 실시한다\n     협상적격자가 없거나 모든 협상대상자와 협상 결렬시 재공고 입찰에 부칠 수 있다\n     협상대상자가 제안한 사업내용 중 수정, 보완, 변경이 필요한 경우 협상을 통해 그 내용의 일부를 조정할 수 있다\n     선정된 계약상대자는 사업의 성공적 수행, 사업 진행 및 기술지원, 품질보증 등 사업 전반에 책임을 진다\n     상기에 표시되지 않은 절차는 국가를 당사자로 하는 계약""]",,
C_rule_multi_route,1,을지대학교_을지대학교 비교과시스템 개발.hwp,central,입찰방식은 무엇인가?,제한경쟁입찰 (협상에 의한 계약체결 방식),1) 기술평가와 가격평가를 실시하여 종합평가점수로 평가,"[""1) 기술평가와 가격평가를 실시하여 종합평가점수로 평가\n     평가비율 : 기술평가(70%), 가격평가(30%)\n     종합평가점수 = 기술평가점수 + 입찰가격 평가점수\n2) 기술평가 방법\n     제안서의 공정한 평가를 위해 평가위원회를 구성하여 평가하고, 제안서에 기재되지 않은 사항은 평가하지 않는다.\n     협상대상 업체를 선정하기 위한 평가는 총점을 100점으로 하고 기술능력평가의 비중을 100분의 70으로, 가격평가의 비중을 100분의 30으로 한다.\n     기술능력평가는 평가위원별로 제출된 제안서를 평가하여 “평가항목 및 배점”에 의거하여 실시한다.\n     기술평가 기준 및 배점은 소프트웨어 기술성 평가 기준을 참고하되, 본사업에 맞게 재구성한 기술평가표(『다. 기술성평가기준』)에 따른다\n     기술능력평가 중 기술제안서 각 평가위원의 평가점수 중 최고점수와 최저점수를 제외한 나머지 위원의 평가점수를 평균한 점수(70점 만점)를 평가 점수로 한다\n     가격평가는 ｢협상에 의한 계약체결기준｣ (기획재정부 계약예규 제114호, 2012.9.22.)을 기준으로 함\n         - 입찰가격 평점산식\n           ⚬ 입찰가격을 추정가격의 100분의 80 이상으로 입찰한 자\n                      \n         ※ 최저입찰가격 : 유효한 입찰자중 최저입찰가격\n         ※ 당해입찰가격 : 당해 평가대상자의 입찰가격\n         ※ 입찰가격 평가시 사업예산으로 하는 경우에는 추정가격에 부가가치세를 포함하여 적용하고, 예정가격을 작성한 경우에는 추정가격을 예정가격으로 적용\n           ⚬ 입찰가격을 추정가격의 100분의 80 미만인 입찰한 자 \n                 \n                           \n         ※ 최저입찰가격 : 유효한 입찰자중 최저입찰가격\n         ※ 당해입찰가격 : 당해 평가대상자의 입찰가격으로 하되, 입찰가격이 추정가격의 100분"", ""4. 추진방안\n   가. 사업예산 : 비공개 입찰\n     ❍ 사업예산은 공개하지 않으며, 수행업체에서 소요되는 비용을 산출하여 제안서 제출 시 함께 제출\n   나. 기술 대 가격 비율의 조정\n        ❍ 기술평가와 가격평가를 실시하여 종합평가점수로 평가\n          - 평가비율 : 기술평가(70%), 가격평가(30%)\n          - 종합평가점수  = 기술평가점수 + 입찰가격 평가점수\n          - 협상에 의한 계약 체결시 기술 대 가격 배점기준 7:3으로 적용\nⅣ. 제안요청 내용 \n 1. 제안요청 개요\n   가. 사 업 명 : 을지대학교 비교과시스템 개발 사업\n   나. 사업기간 : 계약체결일로부터 2025년 4월 30일 까지"", ""의 60 미만일 경우에는 100분의 60으로 계산\n         ※ 입찰가격 평가시 사업예산으로 하는 경우에는 추정가격에 부가가치세를 포함하여 적용하고, 예정가격을 작성한 경우에는 추정가격을 예정가격으로 적용\n     제안 가격부분은 각 항목별 세부비용을 구분하여 제안토록 하고 금액에 대한 산출근거 및 기준을 부가가치세를 포함하여 구체적으로 제시하여야 한다\n     제안사는 제안서, 평가방법 또는 선정 결과에 대해 이의를 제기할 수 없으며, 제안서 평가결과의 세부내용 및 협상결과는 공개하지 않는다\n     평가점수 결과는 소수점 셋째자리에서 반올림\n3) 우선협상대상자 선정 및 계약체결\n     협상대상자 중 기술평가점수와 가격평가점수를 합한 점수가 1위인 제안사를 우선협상대상자로 선정하여 기타 지원조건 등을 협상한다\n     종합평가점수(기술능력평가+가격평가) 고득점 순으로 협상대상자 후보를 선정하며, 후보 중 가장 점수가 높은 1순위 업체부터 단계별 순차적으로 협상한다\n     종합평가점수가 동일한 경우에는 기술평가 점수가 높은 제안사를 선순위자로 하고, 기술능력 평가점수도 동일한 경우에는 기술능력의 세부평가항목 중 배점이 큰 항목에서 높은 점수를 얻은 제안사를 선순위로 한다\n     상위 순위업체와 협상결과 협의가 이루어지면 하위 순위 업체와의 협상은 진행하지 않는다\n     협상대상 업체 선정결과는 서면으로 통보하며, 미선정업체에 대한 통보는 생략\n     협상대상자와 협상이 결렬되면 동일한 기준과 절차에 의해 차 순위 협상대상 업체와 협상을 실시한다\n     협상적격자가 없거나 모든 협상대상자와 협상 결렬시 재공고 입찰에 부칠 수 있다\n     협상대상자가 제안한 사업내용 중 수정, 보완, 변경이 필요한 경우 협상을 통해 그 내용의 일부를 조정할 수 있다\n     선정된 계약상대자는 사업의 성공적 수행, 사업 진행 및 기술지원, 품질보증 등 사업 전반에 책임을 진다\n     상기에 표시되지 않은 절차는 국가를 당사자로 하는 계약"", ""1. 입찰방식\n  1) 사업자 선정 방식\n『국가를 당사자로 하는 계약에 관한 법률시행령 제43조 및 제43조의2』에 의한 계약체결 기준을 적용\n 제한경쟁입찰(총액/협상에 의한 계약체결)\n 계약체결에 필요한 세부적인 사항은 기획재정부 계약예규 제247호(2015.9.21.) “협상에 의한 계약체결기준”을 적용.\n2) 입찰 참가자격\n 본 제안 사업의 수행이 가능한 업체로서 다음 요건을 모두 갖춘 사업자\n① 경쟁입찰 참가자격을 갖춘 사업자\n② SW산업진흥법 제24조에 의한 소프트웨어사업자(컴퓨터관련서비스업)\n③ 국가를 당사자로하는 계약에 관한 법률」제27조 및 동법 시행령 제 76조(부정당업자의 입찰참가자격 제한)에 해당되지 않은 업체\n 공동수급(공동이행방식)의 형태로 참가할 경우, 아래 사항을 준수하여야 함\n① 공동수급 구성 시에는 반드시 역할분담에 따른 업무비율을 기재하여야 함\n② 공동수급체는 5개 이하로 구성하여야 하며, 구성원별 계약참여 최소지분율은 10% 이상([공동계약운용요령 (기획재정부계약예규) 제4조 및 제9조] 참조)이어야 함\n③ 공동수급의 형태로 입찰에 참여하는 경우 협정서에 주 사업자를 반드시 명기하여야 하며, 주 사업자는 사업추진, 품질보증 등의 전체적인 사업수행에 대한 권한을 갖고 모든 책임을 짐\n 하도급은 소프트웨어산업 진흥법 제20조의 3 및 동법 시행규칙 제8조, 소프트웨어사업 하도급계약의 적정성 판단기준을 준용함(단, 재하도급 및 중복 하도급 불가)\n 계약기간 중 하도급 계약 체결 시 사전에 주관기관에 서면으로 승인을 득한 후 하도급 계약 체결 가능""]",,
A_single_pipeline,1,인천공항운영서비스(주)_인천공항운영서비스㈜ 차세대 ERP시스템 구축 .hwp,central,사업예산은 얼마입니까?,"996,356,000원(부가세 별도)",해당 정보를 찾을 수 없습니다.,[],,
B_rule_single_route,1,인천공항운영서비스(주)_인천공항운영서비스㈜ 차세대 ERP시스템 구축 .hwp,central,사업예산은 얼마입니까?,"996,356,000원(부가세 별도)","- 대금 지급 : 계약금 30%, 1차 중도금 30%, 2차 중도금 30%, 잔금 10%이며,                   세금계산서 발행 후 현금 지급 조건","[""- 대금 지급 : 계약금 30%, 1차 중도금 30%, 2차 중도금 30%, 잔금 10%이며,                   세금계산서 발행 후 현금 지급 조건\n 3. 제안서 평가 방법\n  ❍ 기술평가와 가격평가를 실시하여 종합평가 점수로 평가\n    - 평가비율 : 기술평가(80%), 가격평가(20%)\n    - 종합평가 점수 = 기술평가 점수 + 입찰가격 평가 점수\n  ❍ 기술평가\n    - 평가위원회는 참여 업체별 제안서 발표(PT) 심사로 진행하고, 제안사의        사업관리자(PM)가 직접 발표하며 참석자 수는 PM 포함 3명으로 한정\n      ※ 기술평가 위원회 미 참석 시 사업수행 의사가 없는 것으로 간주\n    - 평가위원은 평가의 공정성 및 전문성을 기하기 위하여 각계 관련          전문가들로 구성하며 제안서 발표일은 입찰 마감일 기준 7일 이내 통보\n    - 발표 시간은 제안사별 30분(제안설명 20분, 질의응답 10분)내외로 하며        발표순서는 제안서 제출 순 진행\n    - 평가점수 산정 : 각 제안업체가 받은 점수 중에서 최저 및 최고점수를        제외한 후 산술평균(소수점 다섯째자리에서 반올림)하여 산출하나, 최저 또는        최고 점수가 2개 이상일 때에는 이중 하나만 제외함\n    - 심사·선정 결과는 나라장터 공개 예정\n  ❍ 평가 항목 및 배점"", ""Ⅰ. 사업 개요 \n    1. 사업명1\n    2. 사업기간1\n    3. 사업예산1\n    4. 계약방법1\n Ⅱ. 주요 시스템 구축·운영 현황\n    1. ERP 시스템1\n    2. 그룹웨어 시스템 1\n Ⅲ. 사업 추진방안\n    1. 차세대 시스템 추진 배경 및 필요성2\n    2. 사업 추진 방향 및 규모 3\n    3. 사업 추진 체계4\n    4. 사업 추진 일정4\n Ⅳ. 제안서 안내 \n    1. 사업 추진 일반5\n    2. 요구사항 총괄표 5\n    3. 상세 요구사항 7\n Ⅴ. 제안서 작성요령\n    1. 제안서의 효력 …52\n    2. 제안서 안내 사항 52\n    3. 제안서 목차 및 작성 방법54\n Ⅵ. 입찰 안내 사항\n    1. 입찰참가자격56\n    2. 입찰 및 계약 방식57\n    3. 제안서 평가 방법 57\n    4. 우선협상자 선정 및 협상순서61\n    5. 유의사항61"", ""4. 우선협상대상자 선정 및 협상 순서\n  ❍ 제안서 평가결과 기술능력평가(80점) 점수가 85%(68점) 이상인 자를        대상으로 입찰가격평가(20점) 점수와 합산하여 고득점 순으로 선정\n  ❍ 동점자 발생 시 평가지표는 ①기술 및 기능 → ②성능 및 품질 →        ③프로젝트 지원 → ④전략 및 방법론 → ⑤프로젝트 관리 순으로        우선 순위를 두고 평가하여 순위 산출\n  ❍ 협상이 성립된 때는 다른 협상적격자와의 협상을 실시하지 않음\n  ❍ 모든 협상적격자와 협상 결렬 시 재공고 입찰에 부칠 수 있음\n 5. 유의사항\n  ❍ 제안된 제안서는 일체 반환되지 않으며, 본 제안과 관련된 일체의 소요       비용은 입찰참가자의 부담으로 함\n  ❍ 제출된 제안서는 계약 내용에 포함되므로 유의하여 작성하여야 함\n  ❍ 본 제안을 수행함에 있어 자의적으로 발생하는 저작권, 사용료 및        특허권 등에 관한 문제에 대해 일체의 책임은 제안사에 있음\n  ❍ 본 용역은 제 3자에게 재용역이 불가함\n  ❍ 계약서에 명시되지 않은 사항이더라도 과업 수행상 불가피하거나,        당연히 시행하여야 할 사항에 대해서는 계약서에 포함된 것으로 간주함\n  ❍ 제안서 평가 시 평가위원이 요구한 추가 과업 내용이나, 추가 제안사항에       대해 동의한 경우 과업계획에 반영하여야 함\n  ❍ 제안사가 제출한 제안서의 내용은 발주기관이 별도로 요청하지 않는 한       변경할 수 없으며, 제안서/계약서 등의 내용이 상이할 경우 발주기관의       해석에 따름\n  ❍ 용역 수행 중 획득한 정보는 발주기관의 허락 없이 타사에 누설하지 못함\n  ❍ 입찰공고서, 제안요청서 및 이에 근거한 별첨 등에 명시되지 않은 사항은       국가를 당사자로 하는 계약에 관한 법률, 기획재정부 계약예규 등        관련 규정 및 발주사의 계약 요령에 따름\n  ❍ 입찰에 참가하고자 하는 자는 본 입찰 유의서 및 국가를 당사자로 하는       계약에 관한 법률 등을 ""]",,
C_rule_multi_route,1,인천공항운영서비스(주)_인천공항운영서비스㈜ 차세대 ERP시스템 구축 .hwp,central,사업예산은 얼마입니까?,"996,356,000원(부가세 별도)","- 대금 지급 : 계약금 30%, 1차 중도금 30%, 2차 중도금 30%, 잔금 10%이며,                   세금계산서 발행 후 현금 지급 조건","[""- 대금 지급 : 계약금 30%, 1차 중도금 30%, 2차 중도금 30%, 잔금 10%이며,                   세금계산서 발행 후 현금 지급 조건\n 3. 제안서 평가 방법\n  ❍ 기술평가와 가격평가를 실시하여 종합평가 점수로 평가\n    - 평가비율 : 기술평가(80%), 가격평가(20%)\n    - 종합평가 점수 = 기술평가 점수 + 입찰가격 평가 점수\n  ❍ 기술평가\n    - 평가위원회는 참여 업체별 제안서 발표(PT) 심사로 진행하고, 제안사의        사업관리자(PM)가 직접 발표하며 참석자 수는 PM 포함 3명으로 한정\n      ※ 기술평가 위원회 미 참석 시 사업수행 의사가 없는 것으로 간주\n    - 평가위원은 평가의 공정성 및 전문성을 기하기 위하여 각계 관련          전문가들로 구성하며 제안서 발표일은 입찰 마감일 기준 7일 이내 통보\n    - 발표 시간은 제안사별 30분(제안설명 20분, 질의응답 10분)내외로 하며        발표순서는 제안서 제출 순 진행\n    - 평가점수 산정 : 각 제안업체가 받은 점수 중에서 최저 및 최고점수를        제외한 후 산술평균(소수점 다섯째자리에서 반올림)하여 산출하나, 최저 또는        최고 점수가 2개 이상일 때에는 이중 하나만 제외함\n    - 심사·선정 결과는 나라장터 공개 예정\n  ❍ 평가 항목 및 배점"", ""Ⅰ. 사업 개요 \n    1. 사업명1\n    2. 사업기간1\n    3. 사업예산1\n    4. 계약방법1\n Ⅱ. 주요 시스템 구축·운영 현황\n    1. ERP 시스템1\n    2. 그룹웨어 시스템 1\n Ⅲ. 사업 추진방안\n    1. 차세대 시스템 추진 배경 및 필요성2\n    2. 사업 추진 방향 및 규모 3\n    3. 사업 추진 체계4\n    4. 사업 추진 일정4\n Ⅳ. 제안서 안내 \n    1. 사업 추진 일반5\n    2. 요구사항 총괄표 5\n    3. 상세 요구사항 7\n Ⅴ. 제안서 작성요령\n    1. 제안서의 효력 …52\n    2. 제안서 안내 사항 52\n    3. 제안서 목차 및 작성 방법54\n Ⅵ. 입찰 안내 사항\n    1. 입찰참가자격56\n    2. 입찰 및 계약 방식57\n    3. 제안서 평가 방법 57\n    4. 우선협상자 선정 및 협상순서61\n    5. 유의사항61"", ""4. 우선협상대상자 선정 및 협상 순서\n  ❍ 제안서 평가결과 기술능력평가(80점) 점수가 85%(68점) 이상인 자를        대상으로 입찰가격평가(20점) 점수와 합산하여 고득점 순으로 선정\n  ❍ 동점자 발생 시 평가지표는 ①기술 및 기능 → ②성능 및 품질 →        ③프로젝트 지원 → ④전략 및 방법론 → ⑤프로젝트 관리 순으로        우선 순위를 두고 평가하여 순위 산출\n  ❍ 협상이 성립된 때는 다른 협상적격자와의 협상을 실시하지 않음\n  ❍ 모든 협상적격자와 협상 결렬 시 재공고 입찰에 부칠 수 있음\n 5. 유의사항\n  ❍ 제안된 제안서는 일체 반환되지 않으며, 본 제안과 관련된 일체의 소요       비용은 입찰참가자의 부담으로 함\n  ❍ 제출된 제안서는 계약 내용에 포함되므로 유의하여 작성하여야 함\n  ❍ 본 제안을 수행함에 있어 자의적으로 발생하는 저작권, 사용료 및        특허권 등에 관한 문제에 대해 일체의 책임은 제안사에 있음\n  ❍ 본 용역은 제 3자에게 재용역이 불가함\n  ❍ 계약서에 명시되지 않은 사항이더라도 과업 수행상 불가피하거나,        당연히 시행하여야 할 사항에 대해서는 계약서에 포함된 것으로 간주함\n  ❍ 제안서 평가 시 평가위원이 요구한 추가 과업 내용이나, 추가 제안사항에       대해 동의한 경우 과업계획에 반영하여야 함\n  ❍ 제안사가 제출한 제안서의 내용은 발주기관이 별도로 요청하지 않는 한       변경할 수 없으며, 제안서/계약서 등의 내용이 상이할 경우 발주기관의       해석에 따름\n  ❍ 용역 수행 중 획득한 정보는 발주기관의 허락 없이 타사에 누설하지 못함\n  ❍ 입찰공고서, 제안요청서 및 이에 근거한 별첨 등에 명시되지 않은 사항은       국가를 당사자로 하는 계약에 관한 법률, 기획재정부 계약예규 등        관련 규정 및 발주사의 계약 요령에 따름\n  ❍ 입찰에 참가하고자 하는 자는 본 입찰 유의서 및 국가를 당사자로 하는       계약에 관한 법률 등을 "", ""주1) 민간실적은 계약서, 세금계산서, 거래명세표 등 증빙자료를 첨부하여야 하며, 특히 필요한 경우 공급받는 자의 인감증명(법인 또는 개인)을 첨부한 거래사실 확인서를 제출하게 할 수 있음\n  2) 이행실적은 입찰공고에 명시한 용역범위 및 기준(물량, 금액 등) 등의 조건에 부합된 경우에 한하며, 공동계약으로 이행하였을 경우 비율과 이행실적을 기재해야 함""]",,
A_single_pipeline,1,인천광역시 동구_수도국산달동네박물관 전시해설 시스템 구축(협상에 .hwp,central,입찰방식(추진방식)은 무엇인가요?,제한경쟁입찰(협상에 의한 계약),추진방식 : 제한경쟁입찰(협상에 의한 계약),"[""5. 추진방식 : 제한경쟁입찰(협상에 의한 계약)\n6. 사업범위\n ▢ 안드로이드 운영체제 기반의 전시해설 시스템 개발\n ▢ 외국인을 위한 다국어 전시해설 콘텐츠 제작 반영\n ▢ 관람객 대상 대여서비스 운영을 위한 전시해설 기기 납품"", ""2. 추진방식\n ▢ 입찰 및 낙찰방식""]",,
B_rule_single_route,1,인천광역시 동구_수도국산달동네박물관 전시해설 시스템 구축(협상에 .hwp,central,입찰방식(추진방식)은 무엇인가요?,제한경쟁입찰(협상에 의한 계약),제안서 평가 방법,"[""1. 제안서 평가 방법 \n□ 제안서 평가 원칙\n  ◦ 행정기관 및 공공기관 정보시스템 구축․운영 지침(행정안전부고시 제2024-66호) 제18조에 의거, 평가비율은 기술평가 90%와 가격평가 10%로 하며, 기술평가점수와 가격평가점수를 합산하여 종합평가점수를 산출함\n  ◦ 기술평가항목 및 배점기준은 “2. 제안서 평가기준”에 의함\n  ◦ 기술평가 시 각 평가위원의 평가점수 중 최고점수와 최저점수를 제외한 나머지 점수를 산술평균한 점수를 90점 만점으로 환산하며, 기술능력평가 분야 배점한도의 85% 이상인 자를 협상적격자로 선정\n  ◦ 평가점수 결과는 소수점 셋째자리에서 반올림\n  ◦ 기타 평가의 방법과 결과공개 등 제반 사항은 조달청 규정에 따름"", ""[주]\n 1. 「신용정보의 이용 및 보호에 관한 법률」제2조 제8의3에 해당하는 신용조회사 또는「자본시장과 금융투자업에 관한 법률」제335조의3에 따라 업무를 영위하는 신용평가사가 입찰공고일 이전에 평가하고 유효기간 내에 있는 회사채, 기업어음 및 기업신용평가등급을 국가종합전자조달시스템에 조회된 신용평가등급으로 평가하되, 가장 최근의 신용평가등급으로 평가한다. 다만, 가장 최근의 신용평가등급이 다수가 있으며 그 결과가 서로 다른 경우에는 가장 낮은 등급으로 평가한다.\n 2. 국가종합전자조달시스템에서 신용평가등급 확인서가 확인되지 않은 경우에는 최저등급으로 평가하며, 유효기간 시작일 또는 만료일이 입찰공고일인 경우에도 유효한 것으로 평가한다. 다만, 입찰공고일 다음날 이후에 발생 또는 수정된 자료는 평가에서 제외한다.\n 3. 주1에도 불구하고, 합병 또는 분할한 자가 입찰공고일 이전에 평가한 신용평가등급이 없는 경우에는 입찰서 제출 마감일 전일까지 발급된 유효기간 내에 있는 가장 최근의 신용평가등급으로 평가한다. 다만, 합병 후 새로운 신용평가등급이 없는 경우에는 입찰공고일 이전에 평가하고 유효기간 내에 있는 신용평가등급으로서 합병 대상자 중 가장 낮은 신용평가등급을 받은 자의 신용평가등급으로 평가한다.\n 4. 추정가격이 고시금액 미만인 입찰에서 입찰공고일을 기준으로 최근 7년 이내에 사업을 개시한 창업기업에 대해서는 신용평가등급 점수상의 배점 한도를 부여한다. 이 경우 창업기업에 대한 확인은 「중소기업제품공공구매 종합정보망」에 등재된 자료로 확인하며, 창업기업확인서의 유효기간 내에 있어야 한다. 다만, 제안서 평가일 전일까지 발급된 자료도 심사에 포함하며, 이 경우 입찰공고일 이전 창업을 확인 할 수 있는 자료(법인인 경우 법인등기부상 법인설립등기일, 개인사업자인 경우에는 사업자등록증명서 상 사업자등록일)를 제출하여야 한다.(이하 창업기업에 대한 확인방법은 같다)\n 5. 공동수급체의 경우 구성원별 해당 점수에 지분율을 곱한 후 그 점수들을 합산하여 최종 평가하"", ""<표>\n  \n1. 사 업 명 : 수도국산달동네박물관 전시해설 시스템 구축  \n2. 사업위치 : 인천광역시 동구 솔빛로 51 수도국산달동네박물관\n3. 사업기간 : 착수일로부터 6개월 이내\n4. 소요예산 : 금200,000천원(금이억원) ※ 부가가치세 포함\n  \n<표>""]",,
C_rule_multi_route,1,인천광역시 동구_수도국산달동네박물관 전시해설 시스템 구축(협상에 .hwp,central,입찰방식(추진방식)은 무엇인가요?,제한경쟁입찰(협상에 의한 계약),제안서 평가 방법,"[""1. 제안서 평가 방법 \n□ 제안서 평가 원칙\n  ◦ 행정기관 및 공공기관 정보시스템 구축․운영 지침(행정안전부고시 제2024-66호) 제18조에 의거, 평가비율은 기술평가 90%와 가격평가 10%로 하며, 기술평가점수와 가격평가점수를 합산하여 종합평가점수를 산출함\n  ◦ 기술평가항목 및 배점기준은 “2. 제안서 평가기준”에 의함\n  ◦ 기술평가 시 각 평가위원의 평가점수 중 최고점수와 최저점수를 제외한 나머지 점수를 산술평균한 점수를 90점 만점으로 환산하며, 기술능력평가 분야 배점한도의 85% 이상인 자를 협상적격자로 선정\n  ◦ 평가점수 결과는 소수점 셋째자리에서 반올림\n  ◦ 기타 평가의 방법과 결과공개 등 제반 사항은 조달청 규정에 따름"", ""[주]\n 1. 「신용정보의 이용 및 보호에 관한 법률」제2조 제8의3에 해당하는 신용조회사 또는「자본시장과 금융투자업에 관한 법률」제335조의3에 따라 업무를 영위하는 신용평가사가 입찰공고일 이전에 평가하고 유효기간 내에 있는 회사채, 기업어음 및 기업신용평가등급을 국가종합전자조달시스템에 조회된 신용평가등급으로 평가하되, 가장 최근의 신용평가등급으로 평가한다. 다만, 가장 최근의 신용평가등급이 다수가 있으며 그 결과가 서로 다른 경우에는 가장 낮은 등급으로 평가한다.\n 2. 국가종합전자조달시스템에서 신용평가등급 확인서가 확인되지 않은 경우에는 최저등급으로 평가하며, 유효기간 시작일 또는 만료일이 입찰공고일인 경우에도 유효한 것으로 평가한다. 다만, 입찰공고일 다음날 이후에 발생 또는 수정된 자료는 평가에서 제외한다.\n 3. 주1에도 불구하고, 합병 또는 분할한 자가 입찰공고일 이전에 평가한 신용평가등급이 없는 경우에는 입찰서 제출 마감일 전일까지 발급된 유효기간 내에 있는 가장 최근의 신용평가등급으로 평가한다. 다만, 합병 후 새로운 신용평가등급이 없는 경우에는 입찰공고일 이전에 평가하고 유효기간 내에 있는 신용평가등급으로서 합병 대상자 중 가장 낮은 신용평가등급을 받은 자의 신용평가등급으로 평가한다.\n 4. 추정가격이 고시금액 미만인 입찰에서 입찰공고일을 기준으로 최근 7년 이내에 사업을 개시한 창업기업에 대해서는 신용평가등급 점수상의 배점 한도를 부여한다. 이 경우 창업기업에 대한 확인은 「중소기업제품공공구매 종합정보망」에 등재된 자료로 확인하며, 창업기업확인서의 유효기간 내에 있어야 한다. 다만, 제안서 평가일 전일까지 발급된 자료도 심사에 포함하며, 이 경우 입찰공고일 이전 창업을 확인 할 수 있는 자료(법인인 경우 법인등기부상 법인설립등기일, 개인사업자인 경우에는 사업자등록증명서 상 사업자등록일)를 제출하여야 한다.(이하 창업기업에 대한 확인방법은 같다)\n 5. 공동수급체의 경우 구성원별 해당 점수에 지분율을 곱한 후 그 점수들을 합산하여 최종 평가하"", ""<표>\n  \n1. 사 업 명 : 수도국산달동네박물관 전시해설 시스템 구축  \n2. 사업위치 : 인천광역시 동구 솔빛로 51 수도국산달동네박물관\n3. 사업기간 : 착수일로부터 6개월 이내\n4. 소요예산 : 금200,000천원(금이억원) ※ 부가가치세 포함\n  \n<표>"", ""4. 기타사항\n ▢ 개발SW의 공동활용 사전명시\n  ◦ 본 사업을 통해 개발되는 소프트웨어는 용역계약일반조건 제56조(계약목적물의 지식재산권 귀속 등)에 따라 타 기관과 공동활용할 계획이 없음\n ▢ 적정 사업기간 산정\n  ◦ 본 사업은 「소프트웨어사업 관리감독에 관한 일반기준」제10조에 의거 적정 사업기간 산정 기준을 준수함\n     ※ 소프트웨어 개발사업의 적정 사업기간 종합 산정서 별표5. 첨부\n ▢ 소프트웨어사업 과업심의위원회\n  ◦ 본 사업은 「소프트웨어 진흥법」제50조에 따른 과업내용 확정 및 적정 사업기간 산정을 위하여 과업심의위원회를 개최한 사업임\n  ◦ 「소프트웨어 진흥법」제50조, 동법 시행령 제47조 제1항 제2호, 제3호에 따른 과업내용 변경 및 그에 따른 계약금액·계약기간 조정이 필요한 경우 계약상대자는 발주청에게 소프트웨어사업 과업변경요청서를 제출하여야 하며, 발주청은 과업심의위원회 개최 요청에 대해서 특별한 사정이 없으면 수용해야 함\n     ※ 「소프트웨어사업 계약 및 관리감독에 관한 지침」 별지 13호서식 참조\n ▢ 사업 담당자 연락처\n  ◦ 인천동구청 문화관광과 박이넷 주무관 (24park@korea.kr, 032-770-6135)""]",,
A_single_pipeline,1,인천광역시_도시계획위원회 통합관리시스템 구축용역.hwp,central,입찰방식은 무엇인가요?,제한경쟁입찰(협상에 의한 계약),해당 정보를 찾을 수 없습니다.,[],,
B_rule_single_route,1,인천광역시_도시계획위원회 통합관리시스템 구축용역.hwp,central,입찰방식은 무엇인가요?,제한경쟁입찰(협상에 의한 계약),"③ 입찰등록 이후에는 공동수급 참여 업체를 변경할 수 없고, 업체 간 권리의 전부 또는 일부를 양도할 수 없으며, 공동수급 참여 업체는 중복하여 공동수급체를 구성할 수 없음","[""따름\n③ 입찰등록 이후에는 공동수급 참여 업체를 변경할 수 없고, 업체 간 권리의 전부 또는 일부를 양도할 수 없으며, 공동수급 참여 업체는 중복하여 공동수급체를 구성할 수 없음\n④ 입찰등록 마감일 기준 「지방자치단체를 당사자로 하는 계약에 관한 법률」시행령 제92조에 의한 부정당업자(공동수급인 경우 구성원 포함)로 지정된 업체이거나, 휴·폐업 및 영업 정지 등의 처분기간 중인 업체와 부도, 파산, 해산, 영업정지 등의 상태에 있는 업체는 입찰참가 자격을 제한함\n ○ 하도급에 관한 사항\n① 하도급 사전승인\n   - 본 사업의 하도급의 경우 「소프트웨어 진흥법」 제51조제5항 및 「소프트웨어사업 계약 및 관리감독에 관한 지침」의 규정에 의하여 반드시 하도급계약 전에 발주기관으로부터 사전승인을 받아야 함.\n② 하도급 비율제한\n   - 본 사업의 과업의 일부를 하도급하려는 경우 「소프트웨어 진흥법」 제51조제1항에 따라 물품(상용소프트웨어 포함) 구매금액을 제외한 소프트웨어사업금액의 100분의 50을 초과할 수 없으며, 같은 법 제3항에 따라 다시 하도급은 원칙적으로 불허함. 다만, 같은 법 제51조제2항 각 호 및 제3항 각 호에 해당하는 경우 그러하지 아니함\n③ 하도급 계획서 제출 요청\n   - 본 사업 과업의 일부를 하도급하려는 경우 계약체결 시 「소프트웨어사업 계약 및 관리감독에 관한 지침」의 별지 제7호서식 소프트웨어사업 하도급 계획서(계약체결 시)를 제출하여야 함\n④ 하도급 계약의 적정성 판단 세부기준 명시\n   - 하도급계약의 승인을 신청하는 경우, 「소프트웨어사업 계약 및 관리감독에 관한 지침」의 별표 3 [하도급계약의 적정성 판단 세부기준]에 따라 적정성여부를 판단하며, 평가점수가 85점 이상인 경우에 한하여 하도급계약을 승인함. 다만, 85점 이상인 경우라 하더라도 하도급 계약의 세부 조건 등으로 인하여 사업의 원활한 수행이 불가능하다고 인정되는 경우 그 사유를 기재하여 하도급 승인 거절을 통보할 수 있음\n⑤ 공동수급체 구성\n   - 본 사업에서 "", ""가. 「신용정보의 이용 및 보호에 관한 법률」제4조 또는 「자본시장과 금융투자업에 관한 법률」제335조의3에 따라 업무를 영위하는 신용조회사 또는 신용평가사가 입찰공고일 이전에 평가하고 유효기간 내에 있는 회사채, 기업어음, 기업신용평가등급을 기준으로 평가하되 가장 최근의 신용평가등급으로 평가한다. 다만, 가장최근의 신용평가등급이 다수가 있으나, 그 결과가 서로 다른 경우에는 가장 낮은 등급으로 평가한다.\n나. 국가종합전자조달시스템에서 ‘신용평가등급 확인서’가 확인되지 않은 경우에는 최저 등급으로 평가하며, 유효기간 만료일이 입찰공고일인 경우에도 유효한 것으로 평가한다. 다만, 입찰공고일 다음날 이후에 발생 또는 수정된 자료는 평가에서 제외한다.\n다. 주 1에도 불구하고, 합병 또는 분할한 자가 입찰공고일 이전에 평가한 신용평가등급이 없는 경우에는 입찰서 제출 마감일 전일까지 발급된 유효기간 내에 있는 가장 최근의 신용평가등급으로 평가한다. 다만, 합병 후 새로운 신용평가등급이 없는 경우에는 입찰공고일 이전에 평가하고 유효기간 내에 있는 신용평가등급으로서 합병 대상자 중 가장 낮은 신용평가등급을 받은 자의 신용평가등급으로 평가한다.\n라. 추정가격이 고시금액 미만인 입찰에서 입찰공고일을 기준으로 최근 7년 이내에 사업을 개시한 창업기업에 대해서는 신용평가등급 점수상의 배점 한도를 부여한다. 이 경우 창업기업에 대한 확인은 「중소기업제품공공구매 종합정보망」에 등재된 자료로 확인하며, 창업기업확인서의 유효기간 내에 있어야 한다. 다만, 제안서 평가일 전일까지 발급된 자료도 심사에 포함하며, 이 경우 입찰공고일 이전 창업을 확인 할 수 있는 자료(법인인 경우 법인등기부상 법인설립등기일, 개인사업자인 경우에는 사업자등록증명서 상 사업자등록일)를 제출하여야 한다.(이하 창업기업에 대한 확인방법은 같다)\n마. 공동수급체의 경우 구성원별 해당 점수에 지분율을 곱한 후 그 점수들을 합산하여 최종 평가하고, 평가 결과 소수점 이하의 숫자가 있는 경우 소수점 다섯째자리에서 반올림"", ""전체 사업금액 대비 10%를 초과하여 하도급하려는 경우, 「소프트웨어 진흥법」 제51조제6항 및 동 법 시행령 제48조제5항에 따라 하수급인과 공동수급체를 구성하여 참여해야하며, 공동수급체를 구성하지 못하는 불가피한 사정이 있는 경우 그 사유를 제시하여야 함\n ○ 하자담보 책임기간 : 1년\n① 하자담보 책임기간은 계약사업자는 본 사업이 종료한 날(사업에 대한 시험 및 검사를 수행하여 최종산출물을 인도한 날을 말함)로부터 1년으로 함\n ○ 기타 유의 사항\n① 용역계약 일반조건 제56조(계약목적물의 지식재산권 귀속 등)에 의거 계약목적물의 지식재산권은 발주기관과 계약상대자가 공동으로 소유하며, 타 기관과 공동활용 할 계획이 없음\n② 다만 개발의 기여도 및 계약목적물의 특수성(국가안전보장, 외교관계, 보안 및 정보보호 등)을  고려하여 발주기관, 계약상대자자간의 협의를 통해 귀속주체 등에 대해 공동소유와 달리 정할 수 있음\n③ 본 사업의 수행 결과물(계약목적물)에 대한 지식재산권은 발주기관과 계약상대자가 공동으로 소유하며, 별도의 정함이 없는 한 지분은 균등한 것으로 함. 다만, 개발의 기여도 및 계약목적물의 특수성(보안, 영업비밀 등)을 고려하여 계약 당사자간 협의를 통해 지식재산권 귀속주체 등에 대해 공동소유와 달리 정할 수 있음. 또한, 지식재산권의 타 용도 및 상업적 활용 시 반드시 발주기관과 협의하여야 함""]",,
C_rule_multi_route,1,인천광역시_도시계획위원회 통합관리시스템 구축용역.hwp,central,입찰방식은 무엇인가요?,제한경쟁입찰(협상에 의한 계약),"③ 입찰등록 이후에는 공동수급 참여 업체를 변경할 수 없고, 업체 간 권리의 전부 또는 일부를 양도할 수 없으며, 공동수급 참여 업체는 중복하여 공동수급체를 구성할 수 없음","[""따름\n③ 입찰등록 이후에는 공동수급 참여 업체를 변경할 수 없고, 업체 간 권리의 전부 또는 일부를 양도할 수 없으며, 공동수급 참여 업체는 중복하여 공동수급체를 구성할 수 없음\n④ 입찰등록 마감일 기준 「지방자치단체를 당사자로 하는 계약에 관한 법률」시행령 제92조에 의한 부정당업자(공동수급인 경우 구성원 포함)로 지정된 업체이거나, 휴·폐업 및 영업 정지 등의 처분기간 중인 업체와 부도, 파산, 해산, 영업정지 등의 상태에 있는 업체는 입찰참가 자격을 제한함\n ○ 하도급에 관한 사항\n① 하도급 사전승인\n   - 본 사업의 하도급의 경우 「소프트웨어 진흥법」 제51조제5항 및 「소프트웨어사업 계약 및 관리감독에 관한 지침」의 규정에 의하여 반드시 하도급계약 전에 발주기관으로부터 사전승인을 받아야 함.\n② 하도급 비율제한\n   - 본 사업의 과업의 일부를 하도급하려는 경우 「소프트웨어 진흥법」 제51조제1항에 따라 물품(상용소프트웨어 포함) 구매금액을 제외한 소프트웨어사업금액의 100분의 50을 초과할 수 없으며, 같은 법 제3항에 따라 다시 하도급은 원칙적으로 불허함. 다만, 같은 법 제51조제2항 각 호 및 제3항 각 호에 해당하는 경우 그러하지 아니함\n③ 하도급 계획서 제출 요청\n   - 본 사업 과업의 일부를 하도급하려는 경우 계약체결 시 「소프트웨어사업 계약 및 관리감독에 관한 지침」의 별지 제7호서식 소프트웨어사업 하도급 계획서(계약체결 시)를 제출하여야 함\n④ 하도급 계약의 적정성 판단 세부기준 명시\n   - 하도급계약의 승인을 신청하는 경우, 「소프트웨어사업 계약 및 관리감독에 관한 지침」의 별표 3 [하도급계약의 적정성 판단 세부기준]에 따라 적정성여부를 판단하며, 평가점수가 85점 이상인 경우에 한하여 하도급계약을 승인함. 다만, 85점 이상인 경우라 하더라도 하도급 계약의 세부 조건 등으로 인하여 사업의 원활한 수행이 불가능하다고 인정되는 경우 그 사유를 기재하여 하도급 승인 거절을 통보할 수 있음\n⑤ 공동수급체 구성\n   - 본 사업에서 "", ""가. 「신용정보의 이용 및 보호에 관한 법률」제4조 또는 「자본시장과 금융투자업에 관한 법률」제335조의3에 따라 업무를 영위하는 신용조회사 또는 신용평가사가 입찰공고일 이전에 평가하고 유효기간 내에 있는 회사채, 기업어음, 기업신용평가등급을 기준으로 평가하되 가장 최근의 신용평가등급으로 평가한다. 다만, 가장최근의 신용평가등급이 다수가 있으나, 그 결과가 서로 다른 경우에는 가장 낮은 등급으로 평가한다.\n나. 국가종합전자조달시스템에서 ‘신용평가등급 확인서’가 확인되지 않은 경우에는 최저 등급으로 평가하며, 유효기간 만료일이 입찰공고일인 경우에도 유효한 것으로 평가한다. 다만, 입찰공고일 다음날 이후에 발생 또는 수정된 자료는 평가에서 제외한다.\n다. 주 1에도 불구하고, 합병 또는 분할한 자가 입찰공고일 이전에 평가한 신용평가등급이 없는 경우에는 입찰서 제출 마감일 전일까지 발급된 유효기간 내에 있는 가장 최근의 신용평가등급으로 평가한다. 다만, 합병 후 새로운 신용평가등급이 없는 경우에는 입찰공고일 이전에 평가하고 유효기간 내에 있는 신용평가등급으로서 합병 대상자 중 가장 낮은 신용평가등급을 받은 자의 신용평가등급으로 평가한다.\n라. 추정가격이 고시금액 미만인 입찰에서 입찰공고일을 기준으로 최근 7년 이내에 사업을 개시한 창업기업에 대해서는 신용평가등급 점수상의 배점 한도를 부여한다. 이 경우 창업기업에 대한 확인은 「중소기업제품공공구매 종합정보망」에 등재된 자료로 확인하며, 창업기업확인서의 유효기간 내에 있어야 한다. 다만, 제안서 평가일 전일까지 발급된 자료도 심사에 포함하며, 이 경우 입찰공고일 이전 창업을 확인 할 수 있는 자료(법인인 경우 법인등기부상 법인설립등기일, 개인사업자인 경우에는 사업자등록증명서 상 사업자등록일)를 제출하여야 한다.(이하 창업기업에 대한 확인방법은 같다)\n마. 공동수급체의 경우 구성원별 해당 점수에 지분율을 곱한 후 그 점수들을 합산하여 최종 평가하고, 평가 결과 소수점 이하의 숫자가 있는 경우 소수점 다섯째자리에서 반올림"", ""전체 사업금액 대비 10%를 초과하여 하도급하려는 경우, 「소프트웨어 진흥법」 제51조제6항 및 동 법 시행령 제48조제5항에 따라 하수급인과 공동수급체를 구성하여 참여해야하며, 공동수급체를 구성하지 못하는 불가피한 사정이 있는 경우 그 사유를 제시하여야 함\n ○ 하자담보 책임기간 : 1년\n① 하자담보 책임기간은 계약사업자는 본 사업이 종료한 날(사업에 대한 시험 및 검사를 수행하여 최종산출물을 인도한 날을 말함)로부터 1년으로 함\n ○ 기타 유의 사항\n① 용역계약 일반조건 제56조(계약목적물의 지식재산권 귀속 등)에 의거 계약목적물의 지식재산권은 발주기관과 계약상대자가 공동으로 소유하며, 타 기관과 공동활용 할 계획이 없음\n② 다만 개발의 기여도 및 계약목적물의 특수성(국가안전보장, 외교관계, 보안 및 정보보호 등)을  고려하여 발주기관, 계약상대자자간의 협의를 통해 귀속주체 등에 대해 공동소유와 달리 정할 수 있음\n③ 본 사업의 수행 결과물(계약목적물)에 대한 지식재산권은 발주기관과 계약상대자가 공동으로 소유하며, 별도의 정함이 없는 한 지분은 균등한 것으로 함. 다만, 개발의 기여도 및 계약목적물의 특수성(보안, 영업비밀 등)을 고려하여 계약 당사자간 협의를 통해 지식재산권 귀속주체 등에 대해 공동소유와 달리 정할 수 있음. 또한, 지식재산권의 타 용도 및 상업적 활용 시 반드시 발주기관과 협의하여야 함"", ""1. 제안서 평가방법\n  ○ 제안 평가 및 사업자 선정에 관한 사항은 「지방자치단체 협상에 의한 계약 체결기준」에 따름\n  ○ 제안서 평가위원회 개최\n① 일시 및 장소: 입찰공고문에 따름\n② 발표순서: 입찰서류 접수 순\n③ 발표시간: 업체별 20분(발표 15분, 질의응답 5분) 내외\n④ 발표방법: 프레젠테이션   ※발표자: 사업관리자(PM)※배석인원은 발표자 포함 3인 이내로 함\n  ○ 종합평가점수 산출 : 기술능력평가(90%) + 입찰가격평가(10%)""]",,
A_single_pipeline,1,인천광역시_인천일자리플랫폼 정보시스템 구축 ISP 수립용역.hwp,central,이 입찰의 계약방법(입찰방식)은 무엇인가?,협상에 의한 계약(제한경쟁입찰),계약방법 : 협상에 의한 계약(제한경쟁입찰),"[""󰊱 사업일반\n  가. 사 업 명 : 인천일자리플랫폼 정보시스템 구축 ISP 수립\n  나. 사업기간 : 계약일로부터 3개월\n  다. 사업예산 : 금100,000천원(금일억원) 범위내\n  라. 계약방법 : 협상에 의한 계약(제한경쟁입찰)\n    ※「지방자치단체를 당사자로 하는 계약에 관한 법률 시행령」제20조, 43조, 44조 및 동법 시행규칙 제25조, 지방자치단체 입찰시 낙찰자 결정기준\n󰊲 추진배경 및 필요성\n  가. 구인기업‧구직자 일자리 생애주기 맞춤형 정보시스템 필요\n    - 인천일자리센터는 구인‧구직 위주의 단순 취업알선 역할만 수행(워크넷 플랫폼 활용)\n    - 일자리 수요자의 현 위치 탐색 후 정책단계별* 일자리지원 필요\n      * 경력준비, 직업탐색, 구인‧구직활동, 취업, 근속유지, 경력관리, 퇴직준비 등\n  나. 계층별‧기관별 일자리정책 창구의 일원화 필요"", ""󰊲 입찰방식\n  가. 입찰방식 : 제한경쟁입찰\n  나. 사업자 선정방식 : 협상에 의한 계약""]",,
B_rule_single_route,1,인천광역시_인천일자리플랫폼 정보시스템 구축 ISP 수립용역.hwp,central,이 입찰의 계약방법(입찰방식)은 무엇인가?,협상에 의한 계약(제한경쟁입찰),"본 사업은 공동수급(공동이행방식)을 허용하며, 공동수급업체 구성원은「지방자치단체를 당사자로 하는 계약에 관한 법률 시행령」 제13조(입찰의 참가자격) 및 동법 시행규칙 제14조 규정에 저촉되지 않아야 함","[""󰊶 제안서 평가 방법\n  가. 평가일반\n    o 평가는 기술능력평가와 가격평가를 구분하여 종합평가하며, 평가 비중은 기술능력평가 90%(정량적 평가 20%, 정성적 평가 70%), 가격평가 10%로 평가함\n      - ｢행정기관 및 공공기관 정보시스템 구축ㆍ운영 지침, 행정안전부고시｣제18조(평가배점)에 의함\n    o 평가점수에서 소수점 이하가 있을 경우 소수점 다섯째자리에서 반올림함\n    o 협상순서는 합산점수의 고득점순에 따라 결정하되 합산점수가 동일한 제안자가 2인 이상일 경우에는 기술능력 평가점수가 높은 제안자를 선순위자로 하고, 기술능력 평가점수도 동일한 경우에는 추첨으로 정함\n    o 기술능력평가는 정략적 평가와 정성적 평가로 나누어 평가하고 정량적 평가는 사업담당자가 심사기준에 따라 평가하고, 정성적 평가는 제안서 평가위원회를 구성하여 평가하되, 제안사의 제안설명(PT)도 병행함\n    o 제안 설명 시 사업관리자(PM)가 직접 발표하여야 함\n      - (PM 필수조건) 주관 사업자 소속인력, 사업기간 중 교체불가, 반드시 제안서 제출 시 건강보험 납부확인서 제출\n          ※ 단, 인천광역시 요구 또는 퇴사 등 사유 인정 시 교체가능\n    o 정성적 평가는 위원별 정성적 평가분야 합계점수 중에서 최고점수와 최저점수를 준 위원을 제외하고 나머지 위원의 평가점수를 합산하여 산술평균한 점수로 한다.\n    o 본 사업은 SW사업으로, 제안서 평가 결과 기술능력 평가 점수가 기술능력 평가분야 배점 한도의 85%이상인 자를 협상 적격자로 선정함\n    o 협상대상자 중 기술평가점수와 가격평가점수를 합한 점수가 1위인 제안사를 우선협상대상자로 선정하여 기타 지원조건 등을 협상함\n  나. 평가기준"", ""󰊳 입찰참가자격(입찰공고문에 의함)\n  가. 지방자치단체를 당사자로 하는 계약에 관한 법률시행령 제13조(입찰 참가자격) 및 동법 시행규칙 제14조(입찰 참가자격 요건의 증명)에 의한 경쟁 입찰 참가자격이 있는 자로서 아래 조건을 갖추어야 함\n  나. 입찰참가신청 서류 마감일 현재「소프트웨어 진흥법 시행령」제53조 및 동 시행규칙 제17조에 의한 소프트웨어사업자(컴퓨터관련서비스업[업종코드 1468]) 신고를 필한 업체\n  다.「중소기업제품 구매촉진 및 판로지원에 관한 법률」제9조에 따라 직접 생산증명서 정보시스템개발서비스(8111159901)를 소지한 업체\n  라.「중소기업기본법」 제2조에 따른 중소기업자 또는 「소상공인 보호 및 지원에 관한 법률」 제2조에 따른 소상공인으로서 중기업확인서, 소기업확인서, 소상공인확인서 중 하나를 소지한 업체\n      ※ 단, <중‧소기업‧소상공인확인서>는 전자입찰서 제출 마감일 전일까지 신청한 것으로 유효기간 내에 있어야 함.\n  마.「지방자치단체를 당사자로 하는 계약에 관한 법률」제31조 및 동법 시행령제92조(부정당업자의 입찰참가자격의 제함)에 해당되지 아니한 업체\n  바. 본 사업은 사업금액이 20억원 미만인 사업으로서, 중소 소프트웨어사업자의 사업 참여 지원에 관한 지침(과학기술정보통신부 고시)에 의거 대기업 및 중견기업 소프트웨어 사업자는 본 입찰에 참여할 수 없으며,「소프트웨어진흥법」제48조 제4항의「독점규제 및 공정거래에 관한 법률」제14조에 따라 지정된 상호출자제한기업집단에 속하는 기업도 입찰에 참여할 수 없음\n  사. 본 사업은 공동수급(공동이행방식)을 허용하며, 공동수급업체 구성원은「지방자치단체를 당사자로 하는 계약에 관한 법률 시행령」 제13조(입찰의 참가자격) 및 동법 시행규칙 제14조 규정에 저촉되지 않아야 함\n  아. 공동수급체는 5개 이하로 구성하여야 하며 구성원별 계약참여 최소 지분율은 5% 이상이어야 함\n  자. 공동수급은 공동이행방식을 원칙으로 하며, 공동계약운용요령 상의 공동수급 표준협정서"", ""라.  정성적 지표 평가방법 \n      - 정성적 평가는 평가항목별 등급을 5등급(매우우수, 우수, 보통, 미흡, 매우미흡)으로 구분하여 평가하며, 항목별 배점에 따라 등급점수를 부여하고, 항목평가를 위한 자료 미제출시는 ‘미제시’ 등급으로 처리 한다""]",,
C_rule_multi_route,1,인천광역시_인천일자리플랫폼 정보시스템 구축 ISP 수립용역.hwp,central,이 입찰의 계약방법(입찰방식)은 무엇인가?,협상에 의한 계약(제한경쟁입찰),"본 사업은 공동수급(공동이행방식)을 허용하며, 공동수급업체 구성원은「지방자치단체를 당사자로 하는 계약에 관한 법률 시행령」 제13조(입찰의 참가자격) 및 동법 시행규칙 제14조 규정에 저촉되지 않아야 함","[""󰊶 제안서 평가 방법\n  가. 평가일반\n    o 평가는 기술능력평가와 가격평가를 구분하여 종합평가하며, 평가 비중은 기술능력평가 90%(정량적 평가 20%, 정성적 평가 70%), 가격평가 10%로 평가함\n      - ｢행정기관 및 공공기관 정보시스템 구축ㆍ운영 지침, 행정안전부고시｣제18조(평가배점)에 의함\n    o 평가점수에서 소수점 이하가 있을 경우 소수점 다섯째자리에서 반올림함\n    o 협상순서는 합산점수의 고득점순에 따라 결정하되 합산점수가 동일한 제안자가 2인 이상일 경우에는 기술능력 평가점수가 높은 제안자를 선순위자로 하고, 기술능력 평가점수도 동일한 경우에는 추첨으로 정함\n    o 기술능력평가는 정략적 평가와 정성적 평가로 나누어 평가하고 정량적 평가는 사업담당자가 심사기준에 따라 평가하고, 정성적 평가는 제안서 평가위원회를 구성하여 평가하되, 제안사의 제안설명(PT)도 병행함\n    o 제안 설명 시 사업관리자(PM)가 직접 발표하여야 함\n      - (PM 필수조건) 주관 사업자 소속인력, 사업기간 중 교체불가, 반드시 제안서 제출 시 건강보험 납부확인서 제출\n          ※ 단, 인천광역시 요구 또는 퇴사 등 사유 인정 시 교체가능\n    o 정성적 평가는 위원별 정성적 평가분야 합계점수 중에서 최고점수와 최저점수를 준 위원을 제외하고 나머지 위원의 평가점수를 합산하여 산술평균한 점수로 한다.\n    o 본 사업은 SW사업으로, 제안서 평가 결과 기술능력 평가 점수가 기술능력 평가분야 배점 한도의 85%이상인 자를 협상 적격자로 선정함\n    o 협상대상자 중 기술평가점수와 가격평가점수를 합한 점수가 1위인 제안사를 우선협상대상자로 선정하여 기타 지원조건 등을 협상함\n  나. 평가기준"", ""󰊳 입찰참가자격(입찰공고문에 의함)\n  가. 지방자치단체를 당사자로 하는 계약에 관한 법률시행령 제13조(입찰 참가자격) 및 동법 시행규칙 제14조(입찰 참가자격 요건의 증명)에 의한 경쟁 입찰 참가자격이 있는 자로서 아래 조건을 갖추어야 함\n  나. 입찰참가신청 서류 마감일 현재「소프트웨어 진흥법 시행령」제53조 및 동 시행규칙 제17조에 의한 소프트웨어사업자(컴퓨터관련서비스업[업종코드 1468]) 신고를 필한 업체\n  다.「중소기업제품 구매촉진 및 판로지원에 관한 법률」제9조에 따라 직접 생산증명서 정보시스템개발서비스(8111159901)를 소지한 업체\n  라.「중소기업기본법」 제2조에 따른 중소기업자 또는 「소상공인 보호 및 지원에 관한 법률」 제2조에 따른 소상공인으로서 중기업확인서, 소기업확인서, 소상공인확인서 중 하나를 소지한 업체\n      ※ 단, <중‧소기업‧소상공인확인서>는 전자입찰서 제출 마감일 전일까지 신청한 것으로 유효기간 내에 있어야 함.\n  마.「지방자치단체를 당사자로 하는 계약에 관한 법률」제31조 및 동법 시행령제92조(부정당업자의 입찰참가자격의 제함)에 해당되지 아니한 업체\n  바. 본 사업은 사업금액이 20억원 미만인 사업으로서, 중소 소프트웨어사업자의 사업 참여 지원에 관한 지침(과학기술정보통신부 고시)에 의거 대기업 및 중견기업 소프트웨어 사업자는 본 입찰에 참여할 수 없으며,「소프트웨어진흥법」제48조 제4항의「독점규제 및 공정거래에 관한 법률」제14조에 따라 지정된 상호출자제한기업집단에 속하는 기업도 입찰에 참여할 수 없음\n  사. 본 사업은 공동수급(공동이행방식)을 허용하며, 공동수급업체 구성원은「지방자치단체를 당사자로 하는 계약에 관한 법률 시행령」 제13조(입찰의 참가자격) 및 동법 시행규칙 제14조 규정에 저촉되지 않아야 함\n  아. 공동수급체는 5개 이하로 구성하여야 하며 구성원별 계약참여 최소 지분율은 5% 이상이어야 함\n  자. 공동수급은 공동이행방식을 원칙으로 하며, 공동계약운용요령 상의 공동수급 표준협정서"", ""라.  정성적 지표 평가방법 \n      - 정성적 평가는 평가항목별 등급을 5등급(매우우수, 우수, 보통, 미흡, 매우미흡)으로 구분하여 평가하며, 항목별 배점에 따라 등급점수를 부여하고, 항목평가를 위한 자료 미제출시는 ‘미제시’ 등급으로 처리 한다"", ""제1조 (목적) 이 협정서는 공동수급체의 구성원이 재정, 경영, 기술능력, 인원 및 기자재를 동원하여 아래의 공사, 물품 또는 용역에 대한 계획, 입찰, 시공 등을 위하여 출자비율에 따라 공동 연대하여 계약을 이행할 것을 약속하는 협약을 정함에 있다.\n  1. 계약건명 :\n  2. 계약금액 :\n  3. 발주기관명 :\n제2조 (공동수급체) 공동수급체의 명칭, 사업소의 소재지, 대표자는 다음과 같다.\n  1. 명          칭 : ○○○\n  2. 주사무소소재지 :\n  3. 대 표 자 성 명 :\n제3조 (공동수급체의 구성원) ① 공동수급체의 구성원은 다음과 같다.\n  1. ○○○회사(대표자 :         소재지 :                )\n  2. ○○○회사(대표자 :         소재지 :                )\n  ② 공동수급체 대표자는 ○○○로 한다.\n  ③ 공동수급체 대표자는 발주기관과 제3자에 대하여 공동수급체를 대표하며, 공동수급체의 재산관리와 대금청구 등의 권한을 가진다.\n제4조 (효력기간) 이 협정서는 당사자간의 기명(서명)․날인과 동시에 발효하며, 해당 계약의 이행으로 종결된다. 다만, 발주기관이나 제3자에 대하여 해당 계약과 관련한 권리․의무 관계가 남아있는 한 이 협정서의 효력은 존속된다.\n제5조 (의무) 공동수급체의 구성원은 제1조에서 정한 목적을 수행하기 위하여 성실, 근면 및 신의를 바탕으로 하여 필요한 모든 지식과 기술을 활용할 것을 약속한다.\n제6조 (책임) 공동수급체의 구성원은 발주기관에 대한 계약의 의무이행에 대하여 연대하여 책임을 진다.\n제7조 (하도급) 공동수급체 구성원 중 일부 구성원이 하도급계약을 체결하려는 경우에는 다른 구성원의 동의를 받아야 한다.\n제8조 (거래계좌) 행정안전부 예규「지방자치단체 입찰 및 계약 집행기준」제7장 공동계약 운영요령 제3절 7. 대가의 지급에 정한 바에 따라 선금, 기성대가 등은 다음 계좌로 지급받는다.\n  1. ○○○회사(공동수급체대표자) : ○○은행, 계좌번호○○○, 예""]",,
A_single_pipeline,1,재단법인 광주광역시 광주문화재단_2024년 광주문화예술통합플랫폼 시스.hwp,central,사업기간은 언제까지인가요?,계약일로부터 2024. 12. 31.까지,해당 정보를 찾을 수 없습니다.,[],,
B_rule_single_route,1,재단법인 광주광역시 광주문화재단_2024년 광주문화예술통합플랫폼 시스.hwp,central,사업기간은 언제까지인가요?,계약일로부터 2024. 12. 31.까지,❍ 사업기간 : 계약일로부터 2024,"[""❍ 사업기간 : 계약일로부터 2024. 12. 31.까지 \n ❍ 기초금액 : 금61,890,000원(부가가치세 포함) \n ❍ 입찰방법 : 경쟁입찰\n ❍ 계약방법 : 협상에 의한 계약\n   - 지방자치단체를 당사자로 하는 계약에 관한 법률 시행령 제43조\n ❍ 제안서 평가비율 : 기술평가(90%), 가격평가(10%)"", ""마. 기타사항\n    ­ 제안서 보상\n     · 사업예산 20억 미만의 소프트웨어 사업으로, 「소프트웨어사업의 제안서 보상기준 등에 관한 운영규정」(과학기술정보통신부고시 제2016-108호) 제2조에 의거 제안서 보상은 실시하지 않음\n    ­ 하자담보 책임기간\n     · 본사업의 하자담보 책임기간은 발주기관의 검사에 의하여 사업 검수완료일로부터 1년간으로 함\n    ­ 작업장소\n     · 본 사업의 작업장소는 원활한 사업수행을 위해 발주기관과 협의하여 결정\n     · 작업 장소 관련 비용은 전체 사업 예산에 계상되어 있으므로 제안사가 부담하여야 합니다.(사용료, 기타 발생하는 부대비용 등)\n    ­ 적정 사업기간 산정\n     · 본 사업은 ｢소프트웨어사업 관리감독에 관한 일반기준｣에 따라 소프트웨어 개발사업 적정 사업기간 산정 기준에 따른 사업임\n    ­ SW사업정보 데이터 작성\n     · 본 사업은 『소프트웨어산업진흥법 제22조』에 따라 SW사업정보(SW사업수행 및 실적정보)데이터를 작성 제출하여야 함.\n     · SW사업정보 데이터 작성 및 제출에 관한 사항은 www.spir.kr 자료실의 ‘SW사업정보 저장소 데이터 제출 안내’문서를 참조토록 함\n     · SW사업정보 데이터는 사업수행계획서 작성 시 단계별 산출물 리스트에 명시하도록 함\n     · SW사업정보 중 기능점수 데이터의 작성을 위해 사업수행 인원 중 기능점수 산정 가능 전문가를 포함토록 함\n    ­ 계약목적물의 지식재산권 공동귀속\n     · 본 사업의 수행 결과물(계약목적물)에 대한 지식재산권은 발주기관과 계약상대자가 공동으로 소유하며, 별도의 정함이 없는 한 지분은 균등한 것으로 함\n    ­ 계약목적물의 지식재산권 공동활용 범위\n     · 본 사업을 통해 개발되는 소프트웨어는 용역계약일반조건 제56조(계약목적물의 지식재산권 귀속 등)에 따라 타 기관과 공동활용 할 계획이 없음을 사전에 안내함\n    ­ 원격지 개발 장소 제시・검토 절차\n     · 공급자는 작업장"", ""소 상호협의 시 제안요청서 내 명시된 보안요구사항을 준수한 작업 장소를 제시할 수 있으며, 발주기관에서는 제시된 작업 장소에 관하여 우선 검토\n     · 다만, 발주기관에서는 공급자가 제시한 작업장소가 보안요구사항을 준수하지 못한 경우 거부할 수 있음\n     · 공급자는 원격지 개발에 따른 보안사고 등 위험요인을 식별하여 이에 대한 대응 방안을 제안해야하며, 제안요청서에 명시한 원격지 보안요구사항을 준수하여 원격지 개발에 따른 구체적인 원격지 보안 관리대책을 제시하여야 함\n    ­ 정보누출금지 대상 정보\n     · 우리 기관에서는 (별표 3)와 같이 누출금지정보로 지정하며, 입찰 및 사업 수행과정에서 무단으로 누출할 경우 관련 법령에 따라 부정당업자로 입찰참가자격을 제한할 수 있음\n    ­ SW산출물 반출 절차\n     · 계약상대자는 공급받은 SW산출물에 대하여 제안요청서, 계약서 등에 누출금지정보로 명시한 정보를 삭제하고 활용하여야 하며, 이를 확인하는 계약상대자 대표명의의 확약서를 발주기관에 제출하여야 함\n     · 계약상대자가 반출된 SW산출물을 제3자에게 제공하려는 경우 반드시 발주기관으로부터 사전승인을 받아야 함\n    ­ 과업내용 확정 심의 여부\n     · 본 사업은 「소프트웨어 진흥법」 제50조에 따른 과업내용 확정을 위하여 과업심의위원회를 (  )개최 또는 ( ✔ )미개최 한 사업임\n    ­ 과업내용의 변경\n     · 본 사업은 ｢소프트웨어 진흥법｣ 제50조, 같은 법 시행령 제47조 제1항 제2호, 제3호에 따른 과업내용 변경 및 그에 따른 계약금액·계약기간 조정이 필요한 경우, 계약상대자는 국가기관등의 장에게 소프트웨어사업 과업변경요청서*를 제출하여 과업심의위원회 개최를 요청할 수 있으며, 국가기관 등의 장은 과업심의위원회 개최요청에 대해서 특별한 사정이 없으면 수용해야 함\n    * 「소프트웨어사업 계약 및 관리감독에 관한 지침」 별지 13호 서식 참조""]",,
C_rule_multi_route,1,재단법인 광주광역시 광주문화재단_2024년 광주문화예술통합플랫폼 시스.hwp,central,사업기간은 언제까지인가요?,계약일로부터 2024. 12. 31.까지,❍ 사업기간 : 계약일로부터 2024,"[""❍ 사업기간 : 계약일로부터 2024. 12. 31.까지 \n ❍ 기초금액 : 금61,890,000원(부가가치세 포함) \n ❍ 입찰방법 : 경쟁입찰\n ❍ 계약방법 : 협상에 의한 계약\n   - 지방자치단체를 당사자로 하는 계약에 관한 법률 시행령 제43조\n ❍ 제안서 평가비율 : 기술평가(90%), 가격평가(10%)"", ""마. 기타사항\n    ­ 제안서 보상\n     · 사업예산 20억 미만의 소프트웨어 사업으로, 「소프트웨어사업의 제안서 보상기준 등에 관한 운영규정」(과학기술정보통신부고시 제2016-108호) 제2조에 의거 제안서 보상은 실시하지 않음\n    ­ 하자담보 책임기간\n     · 본사업의 하자담보 책임기간은 발주기관의 검사에 의하여 사업 검수완료일로부터 1년간으로 함\n    ­ 작업장소\n     · 본 사업의 작업장소는 원활한 사업수행을 위해 발주기관과 협의하여 결정\n     · 작업 장소 관련 비용은 전체 사업 예산에 계상되어 있으므로 제안사가 부담하여야 합니다.(사용료, 기타 발생하는 부대비용 등)\n    ­ 적정 사업기간 산정\n     · 본 사업은 ｢소프트웨어사업 관리감독에 관한 일반기준｣에 따라 소프트웨어 개발사업 적정 사업기간 산정 기준에 따른 사업임\n    ­ SW사업정보 데이터 작성\n     · 본 사업은 『소프트웨어산업진흥법 제22조』에 따라 SW사업정보(SW사업수행 및 실적정보)데이터를 작성 제출하여야 함.\n     · SW사업정보 데이터 작성 및 제출에 관한 사항은 www.spir.kr 자료실의 ‘SW사업정보 저장소 데이터 제출 안내’문서를 참조토록 함\n     · SW사업정보 데이터는 사업수행계획서 작성 시 단계별 산출물 리스트에 명시하도록 함\n     · SW사업정보 중 기능점수 데이터의 작성을 위해 사업수행 인원 중 기능점수 산정 가능 전문가를 포함토록 함\n    ­ 계약목적물의 지식재산권 공동귀속\n     · 본 사업의 수행 결과물(계약목적물)에 대한 지식재산권은 발주기관과 계약상대자가 공동으로 소유하며, 별도의 정함이 없는 한 지분은 균등한 것으로 함\n    ­ 계약목적물의 지식재산권 공동활용 범위\n     · 본 사업을 통해 개발되는 소프트웨어는 용역계약일반조건 제56조(계약목적물의 지식재산권 귀속 등)에 따라 타 기관과 공동활용 할 계획이 없음을 사전에 안내함\n    ­ 원격지 개발 장소 제시・검토 절차\n     · 공급자는 작업장"", ""소 상호협의 시 제안요청서 내 명시된 보안요구사항을 준수한 작업 장소를 제시할 수 있으며, 발주기관에서는 제시된 작업 장소에 관하여 우선 검토\n     · 다만, 발주기관에서는 공급자가 제시한 작업장소가 보안요구사항을 준수하지 못한 경우 거부할 수 있음\n     · 공급자는 원격지 개발에 따른 보안사고 등 위험요인을 식별하여 이에 대한 대응 방안을 제안해야하며, 제안요청서에 명시한 원격지 보안요구사항을 준수하여 원격지 개발에 따른 구체적인 원격지 보안 관리대책을 제시하여야 함\n    ­ 정보누출금지 대상 정보\n     · 우리 기관에서는 (별표 3)와 같이 누출금지정보로 지정하며, 입찰 및 사업 수행과정에서 무단으로 누출할 경우 관련 법령에 따라 부정당업자로 입찰참가자격을 제한할 수 있음\n    ­ SW산출물 반출 절차\n     · 계약상대자는 공급받은 SW산출물에 대하여 제안요청서, 계약서 등에 누출금지정보로 명시한 정보를 삭제하고 활용하여야 하며, 이를 확인하는 계약상대자 대표명의의 확약서를 발주기관에 제출하여야 함\n     · 계약상대자가 반출된 SW산출물을 제3자에게 제공하려는 경우 반드시 발주기관으로부터 사전승인을 받아야 함\n    ­ 과업내용 확정 심의 여부\n     · 본 사업은 「소프트웨어 진흥법」 제50조에 따른 과업내용 확정을 위하여 과업심의위원회를 (  )개최 또는 ( ✔ )미개최 한 사업임\n    ­ 과업내용의 변경\n     · 본 사업은 ｢소프트웨어 진흥법｣ 제50조, 같은 법 시행령 제47조 제1항 제2호, 제3호에 따른 과업내용 변경 및 그에 따른 계약금액·계약기간 조정이 필요한 경우, 계약상대자는 국가기관등의 장에게 소프트웨어사업 과업변경요청서*를 제출하여 과업심의위원회 개최를 요청할 수 있으며, 국가기관 등의 장은 과업심의위원회 개최요청에 대해서 특별한 사정이 없으면 수용해야 함\n    * 「소프트웨어사업 계약 및 관리감독에 관한 지침」 별지 13호 서식 참조"", ""3. 제안서 평가안내\n  가. 제안서 평가 실시\n    ­ 평가일시 및 장소 : 추후 별도 지정, 개별 통보\n    ­ 제안서 설명시간 : 업체당 30분 내외(제안 설명 20분, 질의응답 10분)\n                      ※ 제한시간 초과 시 1분당 0.1점 감점 처리\n    ­ 제안서 설명순서 : 제안서 접수 순서\n    ­ 유의사항\n     · 발표자 및 참석자 : 발표자(대표자 또는 대표자가 위임한 자) 외 1명 이내 \n      ※ 대리인의 경우 위임장과 신분증 지참 \n    · 평가위원회에서 사용하는 장비는 직접 설치하여 사용하여야 함\n     ※ 빔 프로젝터와 스크린은 발주기관에서 제공\n    · 제안 설명 시 천재지변(정전 포함)을 제외한 발표장비 오작동, 발표자 발표지연 등 기타사유에 의해 중단된 경우 제안 설명시간에 포함\n    · 발표내용이 제안서와 상이한 사항이 있는 경우 이를 별도로 명기하고 그 사유를 명확하게 설명하여야 함\n    · 제안설명회 불참업체는 사업제안서 제출 여부 및 가격입찰 여부와 무관하게 기술능력 평가점수의 정성적 평가항목을 0점 처리함\n    · 제안서평가위원회 개최 후 평가결과는 재단 홈페이지에 공개함\n  \n<표>""]",,
A_single_pipeline,1,재단법인 광주연구원_광주정책연구아카이브(GPA) 시스템 개발.hwp,central,사업기간은 어떻게 명시되어 있습니까?,착수일로부터 5개월,해당 정보를 찾을 수 없습니다.,[],,
B_rule_single_route,1,재단법인 광주연구원_광주정책연구아카이브(GPA) 시스템 개발.hwp,central,사업기간은 어떻게 명시되어 있습니까?,착수일로부터 5개월,협상대상 업체선정,"[""5. 협상대상 업체선정\n ❍ 협상적격자 선정을 위한 평가는 기술평가 점수 90점(정량적평가 20점, 정성적 평가 70점) 가격평가 점수 10점으로 이루어지며 평가위원회는 정성적 평가만을 실시한다.\n    ▸ 평가위원회는 위원장을 포함 7인 이상 10인 이내의 내·외부전문가로 구성, 평가항목 배점표에 의거 평가위원회가 주관적으로 평가\n    ▸ 평가위원이 평가한 점수를 평균하여 획득점수를 산출함\n  ❍ 제안서 평가결과 기술능력평가 점수가 기술능력평가분야 배점한도의 \n     85%(90점 만점에 76.5점 이상) 이상인 자를 협상적격자로 선정한다.\n  ❍ 평균점수 산정결과 소수점 이하의 숫자가 있는 경우에는 소수점 셋째자리에서 반올림 한다.\n  ❍ 협상순서는 협상적격자의 기술능력평가 점수와 입찰가격평가 점수를 합산하여 고득점 순으로 하고 우선협상대상 업체와 협상이 타결되면 차순위 업체와는 협상을 생략한다.\n      ※ 종합평점 = 기술평가점수(90점) + 가격평가점수(10점)\n  ❍ 다만, 합산점수가 동일한 제안자가 2인 이상인 경우에는 기술능력 평가점수가 높은 제안자를 선순위자로 하고, 기술능력평가 점수도 동일한 경우에는 기술능력의 세부평가항목 중 배점이 큰 항목에서 높은 점수를 얻은 자를 선순위자로 선정한다.\n  ❍ 제안서 평가결과의 세부내용 및 협상결과를 공개하지 않으며, 제안사는 이에 대하여 이의를 제기할 수 없다.\n  ❍ 기타 세부적인 사항은 「지방자치단체 입찰시 낙찰자 결정기준」 제7장 협상에 의한 계약 낙찰자 결정기준에 따른다.\n  ❍ 우선 협상대상 업체와 협상 결렬시 차 순위 대상 업체와 협상 진행한다.\n      ※ 다만, 차 순위 협상 대상 업체가 부적합하다고 판단 될 경우 재공고 추진"", ""가. 평가방법\n   1) 제안서 평가는 기술능력평가와 가격평가로 구분하며, 기술능력평가는 정량적 지표에 의한 평가와 정성적 지표에 의한 평가로 구분하여 실시한다.\n   2) 제안서의 평가는 100점 만점을 기준으로 하되, 기술능력평가 90점(정성적 평가 70점, 정량적 평가 20점), 입찰가격평가 10점으로 배점하여 평가한다.\n   3) 가격평가와 기술능력평가 중 정량적 지표(사업수행능력)에 의한 평가는 계약담당자가 연구원에서 정한 심사기준에 따라 평가한다. \n   4) 평가위원회는 소정의 세부평가기준에 의하여 정성적 평가(기술제안서)를 실시한다. \n   5) 정성적 평가는 제안사별 최고점수와 최저점수를 준 위원을 각각 제외하고 나머지 위원의 평가점수를 합산하여 산술평균한 점수로 한다. 동일한 최고점수 혹은 최저점수를 준 위원이 2명 이상인 경우 한 명만 제외한다. 평균점수 산정결과 소수점 이하의 숫자가 있는 경우에는 소수점 다섯째 자리에서 반올림한다.\n   6) 협상적격자는 기술능력 평가점수가 기술능력 평가분야 배점한도의 85% 이상인 업체로 선정하며, 협상순서는 협상 적격자 중 기술능력 평가점수와 입찰가격 평가점수를 합산한 결과 최고점수를 얻은 업체를 우선 협상적격자로 지정하고 다른 협상적격자에 우선하여 협상을 실시한다. 기술능력 평가점수가 기술능력 평가분야 배점한도의 85% 이상인 업체가 없을 경우 재공고 입찰에 부친다.\n   7) 합산점수가 동일한 경우에는 기술능력평가 점수가 높은 제안사를 우선으로 하며, 기술능력평가 점수도 동일한 경우에는 추첨에 의해 협상대상자를 선정한다.\n   8) 협상대상자와 협상순위가 결정되면, 협상대상자에게 협상순위와 협상일정을 개별 통보한다."", ""❍ 제안서 및 입찰서제출 구비서류\n        ① 제안서 11부 및 제안서 수록 USB 1개\n       ② 가격제안서 1부.\n         - 반드시 봉인하고 사용인감 날인 후 봉투에 “입찰서” 표기하여 제출\n       ③ 입찰보증금 보증보험증권 1부.\n          - 입찰보증금 : 입찰금액의 100분의 5이상의 입찰이행보증보험증권을 \n                         제안서 접수(입찰등록)시 제출하여야 함.\n          - 입찰보증기간 : 입찰 참가 제출마감일 이전 ~ 입찰서 제출마감일 다음날       부터 30일 이후\n          - 입찰보증금을 면제받고자 하는 경우 관련 증빙서류를 별도 제출하여야      함. 단, 입찰보증금 미납사실 및 부정당업자 제재 이력이 있는 경우 입      찰보증서(이행증권)를 제출해야 함. (미제출시 입찰무효처리)\n       ④ 국세 및 지방세 완납증명서 1부.\n       ⑤ 실적증명서(최근 3년간 유사사업 실적) 1부.\n       ⑥ (유효기간 내) 입찰용 신용평가등급 확인서(경영상태를 확인할 수 있는 신     용평가등급 서류) 1부.\n       ⑦ 정량적 지표 평가 관련 신인도 증명서류 (기술(품질) 인증 보유 또는 혁신     형 중소기업) 각 1부\n       ⑧ 보안서약서 1부.\n       ⑨ 기타 제안요청서에 명시한 서류 및 관련 증빙자료 각 1부""]",,
C_rule_multi_route,1,재단법인 광주연구원_광주정책연구아카이브(GPA) 시스템 개발.hwp,central,사업기간은 어떻게 명시되어 있습니까?,착수일로부터 5개월,협상대상 업체선정,"[""5. 협상대상 업체선정\n ❍ 협상적격자 선정을 위한 평가는 기술평가 점수 90점(정량적평가 20점, 정성적 평가 70점) 가격평가 점수 10점으로 이루어지며 평가위원회는 정성적 평가만을 실시한다.\n    ▸ 평가위원회는 위원장을 포함 7인 이상 10인 이내의 내·외부전문가로 구성, 평가항목 배점표에 의거 평가위원회가 주관적으로 평가\n    ▸ 평가위원이 평가한 점수를 평균하여 획득점수를 산출함\n  ❍ 제안서 평가결과 기술능력평가 점수가 기술능력평가분야 배점한도의 \n     85%(90점 만점에 76.5점 이상) 이상인 자를 협상적격자로 선정한다.\n  ❍ 평균점수 산정결과 소수점 이하의 숫자가 있는 경우에는 소수점 셋째자리에서 반올림 한다.\n  ❍ 협상순서는 협상적격자의 기술능력평가 점수와 입찰가격평가 점수를 합산하여 고득점 순으로 하고 우선협상대상 업체와 협상이 타결되면 차순위 업체와는 협상을 생략한다.\n      ※ 종합평점 = 기술평가점수(90점) + 가격평가점수(10점)\n  ❍ 다만, 합산점수가 동일한 제안자가 2인 이상인 경우에는 기술능력 평가점수가 높은 제안자를 선순위자로 하고, 기술능력평가 점수도 동일한 경우에는 기술능력의 세부평가항목 중 배점이 큰 항목에서 높은 점수를 얻은 자를 선순위자로 선정한다.\n  ❍ 제안서 평가결과의 세부내용 및 협상결과를 공개하지 않으며, 제안사는 이에 대하여 이의를 제기할 수 없다.\n  ❍ 기타 세부적인 사항은 「지방자치단체 입찰시 낙찰자 결정기준」 제7장 협상에 의한 계약 낙찰자 결정기준에 따른다.\n  ❍ 우선 협상대상 업체와 협상 결렬시 차 순위 대상 업체와 협상 진행한다.\n      ※ 다만, 차 순위 협상 대상 업체가 부적합하다고 판단 될 경우 재공고 추진"", ""가. 평가방법\n   1) 제안서 평가는 기술능력평가와 가격평가로 구분하며, 기술능력평가는 정량적 지표에 의한 평가와 정성적 지표에 의한 평가로 구분하여 실시한다.\n   2) 제안서의 평가는 100점 만점을 기준으로 하되, 기술능력평가 90점(정성적 평가 70점, 정량적 평가 20점), 입찰가격평가 10점으로 배점하여 평가한다.\n   3) 가격평가와 기술능력평가 중 정량적 지표(사업수행능력)에 의한 평가는 계약담당자가 연구원에서 정한 심사기준에 따라 평가한다. \n   4) 평가위원회는 소정의 세부평가기준에 의하여 정성적 평가(기술제안서)를 실시한다. \n   5) 정성적 평가는 제안사별 최고점수와 최저점수를 준 위원을 각각 제외하고 나머지 위원의 평가점수를 합산하여 산술평균한 점수로 한다. 동일한 최고점수 혹은 최저점수를 준 위원이 2명 이상인 경우 한 명만 제외한다. 평균점수 산정결과 소수점 이하의 숫자가 있는 경우에는 소수점 다섯째 자리에서 반올림한다.\n   6) 협상적격자는 기술능력 평가점수가 기술능력 평가분야 배점한도의 85% 이상인 업체로 선정하며, 협상순서는 협상 적격자 중 기술능력 평가점수와 입찰가격 평가점수를 합산한 결과 최고점수를 얻은 업체를 우선 협상적격자로 지정하고 다른 협상적격자에 우선하여 협상을 실시한다. 기술능력 평가점수가 기술능력 평가분야 배점한도의 85% 이상인 업체가 없을 경우 재공고 입찰에 부친다.\n   7) 합산점수가 동일한 경우에는 기술능력평가 점수가 높은 제안사를 우선으로 하며, 기술능력평가 점수도 동일한 경우에는 추첨에 의해 협상대상자를 선정한다.\n   8) 협상대상자와 협상순위가 결정되면, 협상대상자에게 협상순위와 협상일정을 개별 통보한다."", ""❍ 제안서 및 입찰서제출 구비서류\n        ① 제안서 11부 및 제안서 수록 USB 1개\n       ② 가격제안서 1부.\n         - 반드시 봉인하고 사용인감 날인 후 봉투에 “입찰서” 표기하여 제출\n       ③ 입찰보증금 보증보험증권 1부.\n          - 입찰보증금 : 입찰금액의 100분의 5이상의 입찰이행보증보험증권을 \n                         제안서 접수(입찰등록)시 제출하여야 함.\n          - 입찰보증기간 : 입찰 참가 제출마감일 이전 ~ 입찰서 제출마감일 다음날       부터 30일 이후\n          - 입찰보증금을 면제받고자 하는 경우 관련 증빙서류를 별도 제출하여야      함. 단, 입찰보증금 미납사실 및 부정당업자 제재 이력이 있는 경우 입      찰보증서(이행증권)를 제출해야 함. (미제출시 입찰무효처리)\n       ④ 국세 및 지방세 완납증명서 1부.\n       ⑤ 실적증명서(최근 3년간 유사사업 실적) 1부.\n       ⑥ (유효기간 내) 입찰용 신용평가등급 확인서(경영상태를 확인할 수 있는 신     용평가등급 서류) 1부.\n       ⑦ 정량적 지표 평가 관련 신인도 증명서류 (기술(품질) 인증 보유 또는 혁신     형 중소기업) 각 1부\n       ⑧ 보안서약서 1부.\n       ⑨ 기타 제안요청서에 명시한 서류 및 관련 증빙자료 각 1부"", ""8. 평가항목\n□ 평가항목 및 배점표""]",,
A_single_pipeline,1,재단법인 한국장애인문화예술원_2024년 장애인문화예술정보시스템 이음.hwp,central,사업예산은 얼마로 책정되어 있나요?,총액 380백만원 (부가세 포함),해당 정보를 찾을 수 없습니다.,[],,
B_rule_single_route,1,재단법인 한국장애인문화예술원_2024년 장애인문화예술정보시스템 이음.hwp,central,사업예산은 얼마로 책정되어 있나요?,총액 380백만원 (부가세 포함),ㅇ 사 업 명 : 2024년 장애인문화예술정보시스템 이음온라인 운영,"[""1. 용역개요 \n ㅇ 사 업 명 : 2024년 장애인문화예술정보시스템 이음온라인 운영\n ㅇ 사업기간 : 계약체결일 ~ 2024. 12. 31. \n ㅇ 입찰방법 : 제한경쟁입찰\n ㅇ 낙찰자 결정방법 : 협상에 의한 계약\n ㅇ 소요예산 : 총액 380백만원 (부가세 포함)"", ""3. 기타사항\n 1) 일반지침\n ㅇ 과업수행자는 본 과업을 수행하는 데 있어 장문원의 특별한 요구가 없는 한 제안요청서에 따라 과업을 진행해야 함\n ㅇ 본 사업은 「소프트웨어 진흥법」 제50조에 따른 과업내용 확정을 위하여 과업심의위원회를 미개최한 사업임\n ㅇ 과업의 최종 결정은 협상을 통해 결정하며, 과업의 큰 틀을 벗어나지 않는 범위에서 양자간 협의를 통한 과업 내용 조정 가능함\n ㅇ 과업수행자는 과업수행 시 장문원의 의견을 충분히 수렴하여 반영하여야 하며, 세부 추진 일정 및 성과물 도출 등에 대하여 실무담당자와 사전에 긴밀히 협의한 후 수행해야 함\n ㅇ 본 사업은 하도급 및 그와 유사한 형태의 외주 개발을 금지함\n 2) 결과물 및 저작권의 귀속 \n ㅇ 과업의 수행결과로 얻어지는 결과물 및 관련 자료 및 저작권, 저작 인접권은 기획재정부 계약예규 용역계약 일반조건 제56조 1항에 따라 공동소유 혹은 계약당사자 간의 협의를 통해 정함\n ㅇ 동 과업의 수행결과로 얻어지는 결과물 및 관련 자료에 대한 권리문제 발생 시 계약상대자가 책임을 지고 해결하여야 함 \n 3) 과업내용 및 과업기간 변경\n ㅇ 본 사업은 「소프트웨어 진흥법」제50조, 같은 법 시행령 제47조 제1항 제2호, 제3호에 따라 과업내용 변경 및 그에 따른 계약금액·계약기간 조정이 필요한 경우 계약상대자는 장문원에 소프트웨어사업 과업변경요청서를 제출하여 과업심의위원회의 개최를 요청할 수 있으며, 장문원은 과업심의위원회 개최요청에 대해서 특별한 사정이 없으면 수용해야 함  *「소프트웨어사업 계약 및 관리감독에 관한 지침」 별지 13호서식 참조\n ㅇ 장문원은 용역 수행 중 특별한 사유 없이 다음사항이 발생할 경우 계약위반 행위로 간주, 계약 해지 등 법적 조치를 할 수 있음\n  - 계약상 합의된 사항을 기한 내에 이행하지 아니한 때\n  - 계약기간 내 과업을 완료할 능력이 없거나 현저하게 계획공정이 미달될 때\n 4) 보안\n ㅇ 과업수행자는 본 과업과 관련하여 습득한 사항을 제3자에게 누설해서는 안되며"", ""나. 문의처\n ㅇ 용역과업 관련 \n  - 공연장추진단TF 이채현 주임 (T.02-760-9708, chaihyun@kdac.or.kr)\n ㅇ 입찰 및 계약 관련\n  - 경영관리부 이창희 대리 (T.02-760-9712, ddanddara@kdac.or.kr)\n2. 제안서 평가 및 사업자 선정\n가. 기본방침 및 적용규정 등\n ㅇ 기술평가와 가격평가를 실시하여 종합평가 점수로 산출\n  - 배점기준 : 기술평가 90점 + 가격평가 10점\n ㅇ 기본방침 : 객관적이고 공정한 기준과 절차를 적용하여 경쟁에 의한 우수사업자 선정""]",,
C_rule_multi_route,1,재단법인 한국장애인문화예술원_2024년 장애인문화예술정보시스템 이음.hwp,central,사업예산은 얼마로 책정되어 있나요?,총액 380백만원 (부가세 포함),ㅇ 사 업 명 : 2024년 장애인문화예술정보시스템 이음온라인 운영,"[""1. 용역개요 \n ㅇ 사 업 명 : 2024년 장애인문화예술정보시스템 이음온라인 운영\n ㅇ 사업기간 : 계약체결일 ~ 2024. 12. 31. \n ㅇ 입찰방법 : 제한경쟁입찰\n ㅇ 낙찰자 결정방법 : 협상에 의한 계약\n ㅇ 소요예산 : 총액 380백만원 (부가세 포함)"", ""3. 기타사항\n 1) 일반지침\n ㅇ 과업수행자는 본 과업을 수행하는 데 있어 장문원의 특별한 요구가 없는 한 제안요청서에 따라 과업을 진행해야 함\n ㅇ 본 사업은 「소프트웨어 진흥법」 제50조에 따른 과업내용 확정을 위하여 과업심의위원회를 미개최한 사업임\n ㅇ 과업의 최종 결정은 협상을 통해 결정하며, 과업의 큰 틀을 벗어나지 않는 범위에서 양자간 협의를 통한 과업 내용 조정 가능함\n ㅇ 과업수행자는 과업수행 시 장문원의 의견을 충분히 수렴하여 반영하여야 하며, 세부 추진 일정 및 성과물 도출 등에 대하여 실무담당자와 사전에 긴밀히 협의한 후 수행해야 함\n ㅇ 본 사업은 하도급 및 그와 유사한 형태의 외주 개발을 금지함\n 2) 결과물 및 저작권의 귀속 \n ㅇ 과업의 수행결과로 얻어지는 결과물 및 관련 자료 및 저작권, 저작 인접권은 기획재정부 계약예규 용역계약 일반조건 제56조 1항에 따라 공동소유 혹은 계약당사자 간의 협의를 통해 정함\n ㅇ 동 과업의 수행결과로 얻어지는 결과물 및 관련 자료에 대한 권리문제 발생 시 계약상대자가 책임을 지고 해결하여야 함 \n 3) 과업내용 및 과업기간 변경\n ㅇ 본 사업은 「소프트웨어 진흥법」제50조, 같은 법 시행령 제47조 제1항 제2호, 제3호에 따라 과업내용 변경 및 그에 따른 계약금액·계약기간 조정이 필요한 경우 계약상대자는 장문원에 소프트웨어사업 과업변경요청서를 제출하여 과업심의위원회의 개최를 요청할 수 있으며, 장문원은 과업심의위원회 개최요청에 대해서 특별한 사정이 없으면 수용해야 함  *「소프트웨어사업 계약 및 관리감독에 관한 지침」 별지 13호서식 참조\n ㅇ 장문원은 용역 수행 중 특별한 사유 없이 다음사항이 발생할 경우 계약위반 행위로 간주, 계약 해지 등 법적 조치를 할 수 있음\n  - 계약상 합의된 사항을 기한 내에 이행하지 아니한 때\n  - 계약기간 내 과업을 완료할 능력이 없거나 현저하게 계획공정이 미달될 때\n 4) 보안\n ㅇ 과업수행자는 본 과업과 관련하여 습득한 사항을 제3자에게 누설해서는 안되며"", ""나. 문의처\n ㅇ 용역과업 관련 \n  - 공연장추진단TF 이채현 주임 (T.02-760-9708, chaihyun@kdac.or.kr)\n ㅇ 입찰 및 계약 관련\n  - 경영관리부 이창희 대리 (T.02-760-9712, ddanddara@kdac.or.kr)\n2. 제안서 평가 및 사업자 선정\n가. 기본방침 및 적용규정 등\n ㅇ 기술평가와 가격평가를 실시하여 종합평가 점수로 산출\n  - 배점기준 : 기술평가 90점 + 가격평가 10점\n ㅇ 기본방침 : 객관적이고 공정한 기준과 절차를 적용하여 경쟁에 의한 우수사업자 선정"", ""나. 제안서 평가\n ㅇ 기술평가(90점) \n  - 5~7인 이상으로 구성된 평가위원회를 구성하며, 본 사업의 특성을 고려한 평가기준에 의거하여 평가 실시\n  - 평가점수 결과는 소수점 다섯째 자리에서 반올림\n  - 필요한 서류가 누락되었거나 제출된 서류가 불확실하여 인지할 수 없는 경우에는 제안서 내용의 변경이 없는 경미한 사항에 한하여 기한을 정하여 보완을 요구할 수 있음. 이때 요청한 보완서류가 기한 내 도착하지 않으면 당초 제출된 서류만으로 평가하고, 당초 제출된 서류가 불명확하여 심사가 불가능한 경우에는 평가에서 제외함\n ㅇ 가격평가(10점) \n  - 가격입찰서는 기술평가 완료 후 나라장터를 통해 개찰함\n  - 가격평가에 대한 세부 기준 등은 기획재정부 계약예규 협상에 의한 계약체결기준을 준용함\n 다. 평가기준 \n  ㅇ 평가표""]",,
A_single_pipeline,1,재단법인경기도일자리재단_2025년 통합접수시스템 운영.hwp,extreme,이 사업의 입찰방식(계약방법)은 무엇인가?,"제한경쟁입찰, 협상에 의한 계약","□ 계약방법: 제한경쟁입찰, 협상에 의한 계약","[""□ 계약방법: 제한경쟁입찰, 협상에 의한 계약"", ""□ 기타 요청사항\n  ❍ 본 제안요청서는「2025년 통합접수시스템 운영」에 대한 제안을 받기 위한 것으로, 재단법인 경기도일자리재단의 요구사항을 충분히 검토 후 제안서를 작성해야 함.\n  ❍ 제안업체에서 제안요청서보다 개선된 사항이나 향상된 기능을 제공하고자 할 경우, 해당사항을 제안서에 “개선부분”으로 명시하고 구체적이고 충분한 설명이 이루어져야 함.\n  ❍ 본 제안요청서는 사업의 성격과 업무범위를 이해하는데 필요한 안내 자료이며, 계약서의 일부가 됨.\n  ❍ 제안서에는 일자리플랫폼 시스템의 특성을 충분히 이해하고, 제안요청서를 기반으로 추진전략, 추진계획, 문서화 정보 등이 구체적으로 명시되어야 하며, 본 사업을 추진하는 데 요구되는 조직과 역할분담 등을 구체적으로 제시하여야 함.\n  ❍ 사업 전반에 관한 위험요소, 위험관리지표 등에 대한 대응전략 등이 포함된 위험관리 계획을 제시하여야 함.\n  ❍ 본 제안요청서에는 명기되지 아니한 사항은 상호 조정하에 추진하도록 함.\n  ❍ 계약자는 계약일로부터 사업완료일까지 일자리플랫폼 시스템을 원활하게 운영할 수 있도록 지원하여야 함.\n  ❍ 본 사업은「소프트웨어 진흥법」제43조(소프트웨어사업 영향평가)의 1항,「소프트웨어사업 계약 및 관리감독에 관한 지침」(과기정통부 고시) 제5조(소프트웨어사업 영향평가)의 1항에 따라 SW사업 영향평가를 미리 실시한 사업임.\n    -「소프트웨어사업 계약 및 관리감독에 관한 지침」별지 제1호 서식에 따라 “소프트웨어사업 영향평가 검토 결과서” 첨부.(붙임 2 참조)""]",,
B_rule_single_route,1,재단법인경기도일자리재단_2025년 통합접수시스템 운영.hwp,extreme,이 사업의 입찰방식(계약방법)은 무엇인가?,"제한경쟁입찰, 협상에 의한 계약","❍ 평가기준 및 배점은「지방자치단체 입찰시 낙찰자 결정기준」과「소프트웨어 기술성 평가기준」을 참고하여 본 사업의 특성 및 내용 등을 고려하여 정하되, 제안서 평가위원회에서 검토 및 결정한 후 평가위원별로 실시함","[""※ 평가비중의 조정은 기술력이 우수한 사업자를 선정하여 정보화사업의 품질을 확보하기 위함.(근거: 행정기관 및 공공기관 정보시스템 구축·운영 지침)\n  ❍ 기술평가(90%)와 가격평가(10%)를 종합평가한 결과 고득점자 순으로 협상 적격자를 정함.\n      ※ 본 사업은 SW사업으로 제안서평가 결과, 기술부문 평가점수가 배점한도의 85% 이상인 자가 협상적격자로 선정됨.\n  ❍ 기술평가는 정량적 평가와 정성적 평가로 나누어 평가하고 정량적 평가는 사업담당자가 심사기준에 따라 평가하고, 정성적 평가는 제안서 평가위원회를 구성하여 제안서의 기술 평가를 수행하며, 제안 내용의 이해를 돕기 위해 제안서 평가 시 제안사별 제안서 발표(제안설명 PT)도 병행함.\n  ❍ 평가기준 및 배점은「지방자치단체 입찰시 낙찰자 결정기준」과「소프트웨어 기술성 평가기준」을 참고하여 본 사업의 특성 및 내용 등을 고려하여 정하되, 제안서 평가위원회에서 검토 및 결정한 후 평가위원별로 실시함.\n  ❍ 정성적 평가는 평가위원이 평가한 점수 중 최고점수와 최저점수를 제외하고, 나머지 점수를 산술평균하여 획득점수를 산출하고, 평균점수 산정결과 소수점 이하의 숫자가 있는 경우에는 소수점 다섯째 자리에서 반올림함.\n  ❍ 가격평가 점수는「지방자치단체 입찰시 낙찰자 결정기준」에 의거 산정함.\n  ❍ 동점 시 처리방침\n    - 합산점수(기술평가+가격평가)가 동일한 제안자가 2인 이상일 경우에는 기술평가 점수가 높은 제안자를 협상 선 순위자로 함.\n    - 기술평가 점수도 동일한 경우에는 추첨으로 정함."", ""사업은 20억원 미만 사업으로「소프트웨어 진흥법」제48조(중소 소프트웨어 사업자의 사업참여 지원) 및 중소 소프트웨어 사업자의 사업 참여 지원에 관한 지침 제2조, 제3조에 따라 대기업 및 중견기업인 소프트웨어 사업자의 입찰참여 제한(소프트웨어 사업자 일반 현황 관리확인서 상의 ‘공공 소프트웨어사업 입찰참여 제한금액 : 없음’으로 확인)\n    ※ 총 사업금액 20억원 미만인 사업으로 중소 소프트웨어 사업자(소프트웨어 사업자 일반 현황 관리 확인서 상의‘공공 소프트웨어사업 입찰참여 제한금액: 없음’으로 확인)만 입찰참가 가능.\n  ❍「중소기업기본법」제2조에 따른 중소기업자 또는「소상공인 보호 및 지원에 관한 법률」제2조에 따른 소상공인으로서「중소기업 범위 및 확인에 관한 규정」에 따라 발급된 ‘중·소기업·소상공인확인서’(전자입찰서 제출 마감일 전일까지 발급된 것으로 유효기간 내에 있어야함)를 소지한 자\n     ※ <중소기업 확인서〉는 중소기업공공구매종합정보망(www.smpp.go.kr)에서 확인하며, 확인이 되지 않을 경우 입찰참가 자격이 없으며, 중소기업확인서를 전자입찰서 제출 마감일 이후 신청한 업체는 낙찰자 선정방법이 협상에 의한 계약 적용에도 불구하고 참가자격이 없음.\n  ❍ 공동수급(공동이행방식)의 형태로 제안에 참여할 수 있으며, 이 경우 공동수급체 구성원은 위의 입찰 참가자격 요건을 갖추어야 함.\n  ❍ 공동수급(공동이행방식)의 경우 주관사업자는 참여 업체 간 공동책임, 권리, 의무관계, 책임소재, 상호협력방안을 명백히 규정한 「공동수급표준협정서」를 제출하여야 함.\n     ※ 공동수급(공동이행방식)의 형태로 제안에 참여할 수 있으나 지분이 가장 많은 자가 대표자가 되고(지분이 동일한 경우에는 업체간의 협의에 의함), 구성원의 최소지분은 10% 이상 이어야 함 .\n     ※ 공동수급체 구성원은 2개 업체 이내로 제한함.\n     ※ 공동수급체 구성원이 동일 입찰건에 대해 공동수급체를 중복으로 결성하여 참여한 입찰은 무효 처리됨.\n  ❍ 낙찰자로"", ""□ 협상적격자 선정\n  ❍ 지방자치단체를 당사자로 하는 계약에 관한 법률 시행령 제43조 및 제44조 제2항의 협상에 의한 계약체결기준에 의하여, 제안서를 평가한 후 협상절차를 통하여 사업자를 선정함.\n  ❍ 기술평가와 가격평가를 실시하여 종합평가점수로 평가함.\n    - 평가비율: 기술평가(90%), 가격평가(10%)\n    - 종합평가점수 산출: 평가점수 = 기술평가점수 + 가격평가접수\n  ❍ 종합평가 결과 고득점자 순으로 협상적격자를 정함.\n      ※ 본 사업은 SW사업으로 제안서평가 결과, 기술부문 평가점수가 배점한도의 85% 이상인자가 협상 적격자로 선정됨.""]",,
C_rule_multi_route,1,재단법인경기도일자리재단_2025년 통합접수시스템 운영.hwp,extreme,이 사업의 입찰방식(계약방법)은 무엇인가?,"제한경쟁입찰, 협상에 의한 계약","❍ 평가기준 및 배점은「지방자치단체 입찰시 낙찰자 결정기준」과「소프트웨어 기술성 평가기준」을 참고하여 본 사업의 특성 및 내용 등을 고려하여 정하되, 제안서 평가위원회에서 검토 및 결정한 후 평가위원별로 실시함","[""※ 평가비중의 조정은 기술력이 우수한 사업자를 선정하여 정보화사업의 품질을 확보하기 위함.(근거: 행정기관 및 공공기관 정보시스템 구축·운영 지침)\n  ❍ 기술평가(90%)와 가격평가(10%)를 종합평가한 결과 고득점자 순으로 협상 적격자를 정함.\n      ※ 본 사업은 SW사업으로 제안서평가 결과, 기술부문 평가점수가 배점한도의 85% 이상인 자가 협상적격자로 선정됨.\n  ❍ 기술평가는 정량적 평가와 정성적 평가로 나누어 평가하고 정량적 평가는 사업담당자가 심사기준에 따라 평가하고, 정성적 평가는 제안서 평가위원회를 구성하여 제안서의 기술 평가를 수행하며, 제안 내용의 이해를 돕기 위해 제안서 평가 시 제안사별 제안서 발표(제안설명 PT)도 병행함.\n  ❍ 평가기준 및 배점은「지방자치단체 입찰시 낙찰자 결정기준」과「소프트웨어 기술성 평가기준」을 참고하여 본 사업의 특성 및 내용 등을 고려하여 정하되, 제안서 평가위원회에서 검토 및 결정한 후 평가위원별로 실시함.\n  ❍ 정성적 평가는 평가위원이 평가한 점수 중 최고점수와 최저점수를 제외하고, 나머지 점수를 산술평균하여 획득점수를 산출하고, 평균점수 산정결과 소수점 이하의 숫자가 있는 경우에는 소수점 다섯째 자리에서 반올림함.\n  ❍ 가격평가 점수는「지방자치단체 입찰시 낙찰자 결정기준」에 의거 산정함.\n  ❍ 동점 시 처리방침\n    - 합산점수(기술평가+가격평가)가 동일한 제안자가 2인 이상일 경우에는 기술평가 점수가 높은 제안자를 협상 선 순위자로 함.\n    - 기술평가 점수도 동일한 경우에는 추첨으로 정함."", ""사업은 20억원 미만 사업으로「소프트웨어 진흥법」제48조(중소 소프트웨어 사업자의 사업참여 지원) 및 중소 소프트웨어 사업자의 사업 참여 지원에 관한 지침 제2조, 제3조에 따라 대기업 및 중견기업인 소프트웨어 사업자의 입찰참여 제한(소프트웨어 사업자 일반 현황 관리확인서 상의 ‘공공 소프트웨어사업 입찰참여 제한금액 : 없음’으로 확인)\n    ※ 총 사업금액 20억원 미만인 사업으로 중소 소프트웨어 사업자(소프트웨어 사업자 일반 현황 관리 확인서 상의‘공공 소프트웨어사업 입찰참여 제한금액: 없음’으로 확인)만 입찰참가 가능.\n  ❍「중소기업기본법」제2조에 따른 중소기업자 또는「소상공인 보호 및 지원에 관한 법률」제2조에 따른 소상공인으로서「중소기업 범위 및 확인에 관한 규정」에 따라 발급된 ‘중·소기업·소상공인확인서’(전자입찰서 제출 마감일 전일까지 발급된 것으로 유효기간 내에 있어야함)를 소지한 자\n     ※ <중소기업 확인서〉는 중소기업공공구매종합정보망(www.smpp.go.kr)에서 확인하며, 확인이 되지 않을 경우 입찰참가 자격이 없으며, 중소기업확인서를 전자입찰서 제출 마감일 이후 신청한 업체는 낙찰자 선정방법이 협상에 의한 계약 적용에도 불구하고 참가자격이 없음.\n  ❍ 공동수급(공동이행방식)의 형태로 제안에 참여할 수 있으며, 이 경우 공동수급체 구성원은 위의 입찰 참가자격 요건을 갖추어야 함.\n  ❍ 공동수급(공동이행방식)의 경우 주관사업자는 참여 업체 간 공동책임, 권리, 의무관계, 책임소재, 상호협력방안을 명백히 규정한 「공동수급표준협정서」를 제출하여야 함.\n     ※ 공동수급(공동이행방식)의 형태로 제안에 참여할 수 있으나 지분이 가장 많은 자가 대표자가 되고(지분이 동일한 경우에는 업체간의 협의에 의함), 구성원의 최소지분은 10% 이상 이어야 함 .\n     ※ 공동수급체 구성원은 2개 업체 이내로 제한함.\n     ※ 공동수급체 구성원이 동일 입찰건에 대해 공동수급체를 중복으로 결성하여 참여한 입찰은 무효 처리됨.\n  ❍ 낙찰자로"", ""□ 협상적격자 선정\n  ❍ 지방자치단체를 당사자로 하는 계약에 관한 법률 시행령 제43조 및 제44조 제2항의 협상에 의한 계약체결기준에 의하여, 제안서를 평가한 후 협상절차를 통하여 사업자를 선정함.\n  ❍ 기술평가와 가격평가를 실시하여 종합평가점수로 평가함.\n    - 평가비율: 기술평가(90%), 가격평가(10%)\n    - 종합평가점수 산출: 평가점수 = 기술평가점수 + 가격평가접수\n  ❍ 종합평가 결과 고득점자 순으로 협상적격자를 정함.\n      ※ 본 사업은 SW사업으로 제안서평가 결과, 기술부문 평가점수가 배점한도의 85% 이상인자가 협상 적격자로 선정됨.""]",,
A_single_pipeline,1,재단법인스포츠윤리센터_스포츠윤리센터 LMS(학습지원시스템) 기능개선.hwp,central,이 사업의 입찰방식은 무엇인가?,제한경쟁입찰,"- 신규 교육콘텐츠 개발 사업의 산출물 연계, LMS에서 구현 가능하도록 개선","[""□ 스포츠윤리센터 LMS(학습지원시스템) 기능개선\n  ㅇ 교육 미디어 플레이어 개선\n    - HTML 게임, 클릭 반응 등 상호작용 가능한 플레이어 구현\n    - 신규 교육콘텐츠 개발 사업의 산출물 연계, LMS에서 구현 가능하도록 개선\n    - 플레이어 내 자막 출력 기능 개발\n  ㅇ 강사파견 시스템 개선\n    - 현장교육 강사매칭 프로세스 자동화 구현\n  ㅇ 학습자 및 관리자 페이지 고도화\n    - 교육등록 체계, 통계 기능, 이수여부 연계 가이드 고도화 진행\n  \n<표>"", ""ㅇ 「소프트웨어 진흥법 제48조(중소 소프트웨어사업자의 사업참여 지원)」 및 「중소 소프트웨어사업자의 사업참여 지원에 관한 지침(과학기술정보통신부고시 제2023-25호)」에 의거, 참여 제한에 해당하지 않는 자\n ㅇ 「중·소기업·소상공인 및 장애인 기업 확인요령」에 따라 발급된 중·소기업·소상공인확인서(전자입찰서 제출 마감일 전날까지 발급된 것으로 유효기간 내 서류)를 소지한 자\n ㅇ 「국가를 당사자로 하는 계약에 관한 법률」 제27조의5 및 동법 시행령 제12조제③항에 따라 ‘조세포탈 등을 한 자’로서 유죄판결이 확정된 날부터 2년이 지나지 아니한 자\n ㅇ 국가 정보보안 기본지침 제26조(용역업체 보안)에 따라 본 사업의 참여 인원이 아래에 해당하는 회사는 입찰에 참여할 수 없음\n    - 「국가공무원법」제33조제3호부터 제6의3호까지에 해당하는 자\n    - 「국가를 당사자로 하는 계약에 관한 법률」제27조제1항 각호의 행위를 한 자\n ㅇ 「중소기업제품 구매촉진 및 판로지원에 관한 법률 제9조」 및 동법「시행령 제10조」에 의거 직접생산증명서(정보시스템개발서비스) 소지 업체\n  ※ ‘직접생산확인증명서’는 입찰마감일 전일까지 발급된 것으로서 중소기업제품 공공구매 종합정보망(http://www.smpp.go.kr)에서 확인 가능해야 함\n3. 입찰 시 유의사항""]",,
B_rule_single_route,1,재단법인스포츠윤리센터_스포츠윤리센터 LMS(학습지원시스템) 기능개선.hwp,central,이 사업의 입찰방식은 무엇인가?,제한경쟁입찰,ㅇ 사업을 수행하면서 부실·조잡 또는 부당하게 하거나 부정한 행위를 한 입찰자는 향후 신규 사업의 참여에 제한을 받을 수 있음,"[""ㅇ 제출한 제안서에 대한 평가는 기술평가와 가격평가로 구분하여 종합평가를 실시하되 종합평가는 기술능력평가(제안서 평가, 90%), 가격평가(10%) 비중 적용을 적용하여 실시\n  ※ 가격평가는 협상에 의한 계약체결 기준(기획재정부 계약예규)에 준함\n ㅇ 입찰 종료 후 사업 관련 분야 전문가로 구성된 평가위원회에서 제안서 평가\n ㅇ 제안서 평가는 제안요청사항에 따른 분야별 제안내용을 정형화된 평가항목 및 배점에 따라 평가\n ㅇ 기술평가 항목 및 배점 기준은 아래 “기술성 평가기준”에 의함\n ㅇ 기술평가 점수(90점 만점 기준)가 85% 이상인 제안업체에 한해 협상적격자로 선정\n2. 제안서 기술평가 기준\n ㅇ 제안서 기술평가는 기획재정부 계약예규 또는 소프트웨어 기술성 평가 기준 지침(과학기술정보통신부고시 [별표 1])을 준용함"", ""ㅇ 입찰공고문, 제안안내서, 제안요청서 및 이에 근거한 별첨 등에 명시되지 않은 사항은「국가를 당사자로 하는 계약에 관한 법률」,「소프트웨어 진흥법」,「기획재정부 계약예규」,「국제표준규격」등 관련 규정 및 수요기관의 계약 요령에 따름\n ㅇ 입찰자는 본 제안요청서 및 「국가를 당사자로 하는 계약에 관한 법률」 등을 입찰 전에 완전히 숙지하였다고 간주하며 이를 숙지하지 못해 발생하는 책임은 입찰 업체에 있음\n ㅇ 「국가를 당사자로 하는 계약에 관한 법률」 시행령 제12조 및 시행규칙 제14조, 용역입찰유의서 제12조에 저촉될 경우 입찰은 무효로 함\n ㅇ 입찰에 관한 서류 또는 각종 자료 및 입찰 과정에서 얻은 정보 당해 입찰 외의 목적으로 사용 불가\n ㅇ 사업을 수행하면서 부실·조잡 또는 부당하게 하거나 부정한 행위를 한 입찰자는 향후 신규 사업의 참여에 제한을 받을 수 있음\n ㅇ 본 사업의 수행에 필요한 모든 비용은 가격입찰금액에 포함해야 함\n ㅇ 입찰자가 퇴직자가 포함된 영입 현황확인서 등의 허위서류를 제출하는 경우 관련 법규에 따라 계약해지, 부정당업자제재 등의 처분을 받을 수 있음\n ㅇ 입찰자가 제출한 제안서의 저작권은 수요기관과 제안사가 공동 소유하며, 관련 법령 및 국가기관(국회, 감사원, 법원 등)의 자료 제출 요구 시 입찰자 동의 없이 제출할 수 있음\n ㅇ 본 사업은 「소프트웨어 진흥법 제58조」에 따라 SW사업정보 데이터를 작성 및 제출(세부사항 관련문서 참조)하여야 하고, SW사업정보 데이터는 사업수행계획서 작성 시 단계별 산출물 목록에 명시하며, 기능점수 산정을 위해 사업수행 인원 중 기능점수 산정 가능 전문가를 포함해야 함\n4. 입찰(제안) 서류의 제출 및 반환"", ""ㅇ「국가를 당사자로 하는 계약에 관한 법률」준용을 원칙으로, 협상에 의한 계약체결기준(기획재정부 계약예규)에 따르며, 기타 규정되지 않은 사항은 수요기관 또는 조달청 규정에 따름\n ㅇ 제안서 평가결과 기술평가 점수가 기술평가 분야 배점 한도의 85% 이상인 자를 협상 적격자로 선정하고, 가격평가점수를 합한 종합점수가 높은 자 순으로 우선협상대상자 선정\n ㅇ 최고점수를 얻은 자가 복수일 경우 제안서 기술평가 점수가 높은 업체를 우선협상대상자로 선정하되, 기술평가 점수가 동일한 경우 기술평가 배점이 큰 평가부문에서 높은 점수를 얻은 자를 우선협상대상자로 선정함""]",,
C_rule_multi_route,1,재단법인스포츠윤리센터_스포츠윤리센터 LMS(학습지원시스템) 기능개선.hwp,central,이 사업의 입찰방식은 무엇인가?,제한경쟁입찰,ㅇ 사업을 수행하면서 부실·조잡 또는 부당하게 하거나 부정한 행위를 한 입찰자는 향후 신규 사업의 참여에 제한을 받을 수 있음,"[""ㅇ 제출한 제안서에 대한 평가는 기술평가와 가격평가로 구분하여 종합평가를 실시하되 종합평가는 기술능력평가(제안서 평가, 90%), 가격평가(10%) 비중 적용을 적용하여 실시\n  ※ 가격평가는 협상에 의한 계약체결 기준(기획재정부 계약예규)에 준함\n ㅇ 입찰 종료 후 사업 관련 분야 전문가로 구성된 평가위원회에서 제안서 평가\n ㅇ 제안서 평가는 제안요청사항에 따른 분야별 제안내용을 정형화된 평가항목 및 배점에 따라 평가\n ㅇ 기술평가 항목 및 배점 기준은 아래 “기술성 평가기준”에 의함\n ㅇ 기술평가 점수(90점 만점 기준)가 85% 이상인 제안업체에 한해 협상적격자로 선정\n2. 제안서 기술평가 기준\n ㅇ 제안서 기술평가는 기획재정부 계약예규 또는 소프트웨어 기술성 평가 기준 지침(과학기술정보통신부고시 [별표 1])을 준용함"", ""ㅇ 입찰공고문, 제안안내서, 제안요청서 및 이에 근거한 별첨 등에 명시되지 않은 사항은「국가를 당사자로 하는 계약에 관한 법률」,「소프트웨어 진흥법」,「기획재정부 계약예규」,「국제표준규격」등 관련 규정 및 수요기관의 계약 요령에 따름\n ㅇ 입찰자는 본 제안요청서 및 「국가를 당사자로 하는 계약에 관한 법률」 등을 입찰 전에 완전히 숙지하였다고 간주하며 이를 숙지하지 못해 발생하는 책임은 입찰 업체에 있음\n ㅇ 「국가를 당사자로 하는 계약에 관한 법률」 시행령 제12조 및 시행규칙 제14조, 용역입찰유의서 제12조에 저촉될 경우 입찰은 무효로 함\n ㅇ 입찰에 관한 서류 또는 각종 자료 및 입찰 과정에서 얻은 정보 당해 입찰 외의 목적으로 사용 불가\n ㅇ 사업을 수행하면서 부실·조잡 또는 부당하게 하거나 부정한 행위를 한 입찰자는 향후 신규 사업의 참여에 제한을 받을 수 있음\n ㅇ 본 사업의 수행에 필요한 모든 비용은 가격입찰금액에 포함해야 함\n ㅇ 입찰자가 퇴직자가 포함된 영입 현황확인서 등의 허위서류를 제출하는 경우 관련 법규에 따라 계약해지, 부정당업자제재 등의 처분을 받을 수 있음\n ㅇ 입찰자가 제출한 제안서의 저작권은 수요기관과 제안사가 공동 소유하며, 관련 법령 및 국가기관(국회, 감사원, 법원 등)의 자료 제출 요구 시 입찰자 동의 없이 제출할 수 있음\n ㅇ 본 사업은 「소프트웨어 진흥법 제58조」에 따라 SW사업정보 데이터를 작성 및 제출(세부사항 관련문서 참조)하여야 하고, SW사업정보 데이터는 사업수행계획서 작성 시 단계별 산출물 목록에 명시하며, 기능점수 산정을 위해 사업수행 인원 중 기능점수 산정 가능 전문가를 포함해야 함\n4. 입찰(제안) 서류의 제출 및 반환"", ""ㅇ「국가를 당사자로 하는 계약에 관한 법률」준용을 원칙으로, 협상에 의한 계약체결기준(기획재정부 계약예규)에 따르며, 기타 규정되지 않은 사항은 수요기관 또는 조달청 규정에 따름\n ㅇ 제안서 평가결과 기술평가 점수가 기술평가 분야 배점 한도의 85% 이상인 자를 협상 적격자로 선정하고, 가격평가점수를 합한 종합점수가 높은 자 순으로 우선협상대상자 선정\n ㅇ 최고점수를 얻은 자가 복수일 경우 제안서 기술평가 점수가 높은 업체를 우선협상대상자로 선정하되, 기술평가 점수가 동일한 경우 기술평가 배점이 큰 평가부문에서 높은 점수를 얻은 자를 우선협상대상자로 선정함"", ""□ 스포츠윤리센터 LMS(학습지원시스템) 기능개선\n  ㅇ 교육 미디어 플레이어 개선\n    - HTML 게임, 클릭 반응 등 상호작용 가능한 플레이어 구현\n    - 신규 교육콘텐츠 개발 사업의 산출물 연계, LMS에서 구현 가능하도록 개선\n    - 플레이어 내 자막 출력 기능 개발\n  ㅇ 강사파견 시스템 개선\n    - 현장교육 강사매칭 프로세스 자동화 구현\n  ㅇ 학습자 및 관리자 페이지 고도화\n    - 교육등록 체계, 통계 기능, 이수여부 연계 가이드 고도화 진행\n  \n<표>""]",,
A_single_pipeline,1,재단법인충북연구원_GIS통계 기반 재난안전데이터 분석ㆍ관리 시스템 구.hwp,central,사업기간은 언제까지인가요?,착수일로부터 2025년 11월 14일까지,해당 정보를 찾을 수 없습니다.,[],,
B_rule_single_route,1,재단법인충북연구원_GIS통계 기반 재난안전데이터 분석ㆍ관리 시스템 구.hwp,central,사업기간은 언제까지인가요?,착수일로부터 2025년 11월 14일까지,제안서 설명,"[""가. 제안서 설명\n ○ 평가위원회 개최 시 「업체별 제안서 내용 설명(프레젠테이션)」\n    ① 평가위원회 개최 시 제안서를 제출한 업체로부터 제안서 내용에 대한 설명을 청취하고, 질의 및 답변 실시\n    ② 업체별 제안서 설명은 사업 책임연구원이 하여야 함.\n    ③ 업체별 설명시간은 발표20분 이내, 질의/응답 10분 이내로 진행\n       * 추후 업체의 수 등 상황에 따라 조정 가능\n    ④ 제안 설명 자료는 파워포인트 이용\n    ⑤ 제출한 제안서와 동일한 내용으로 작성\n    ⑥ 제안 설명에 참여하지 않은 업체는 평가대상에서 제외함\n나. 제안서 평가\n□ 평가기준\n ○ 기술능력평가와 입찰가격평가를 실시하여 종합평가점수로 평가\n- 평가비율 : 기술능력평가(90%), 입찰가격평가(10%)\n- 기술능력평가 = 정량적 평가(20점) + 정성적 평가(70점)\n- 종합평가점수 = 기술능력평가점수 + 입찰가격평가점수\n□ 평가방법\n ○ 제출한 제안서는 발주기관에서 제안서 평가위원회를 구성하여 평가 진행\n ○ 제안서 평가위원회 구성은 다음과 같음\n- 위원장은 해당 위원회 위원 중 호선으로 진행하며, 평가위원은 위원장을 포함하여 7명을 선정함\n- 평가위원은 제안서의 공정한 평가를 위하여 3배수 이상의 예비명부 작성 → 고유번호 부여 → 입찰참가자 제안서 제출 시 위원수 만큼 번호 추첨 → 多 빈도 순으로 선정함\n* 불참자를 예상하여 예비평가위원 2명 추가지정(추가 지정 위원은 평가위원 불참 시 참석)\n ○ 평가기준 및 배점은 제안서 평가위원회의 검토 및 의결에 의하여 조정‧변경 시행 가능\n ○ 본 평가 및 제안요청서와 관련하여 해석상의 차이가 있을 경우 발주처의 해석에 따름\n ○ 기술능력평가와 입찰가격평가 중 정량적 지표에 의한 평가는 계약(사업) 담당자가 심사기준에 따라 평가하며, 기술능력평가 중 정성적 평가는 평가위원들이 ’제안서 평가기준‘ 배점에 의해 평가를 진행함\n ○ 점수는 각 평가위원이 작성한 평가표를 집계하여 산출하며, 산출결과 최종평균 점수가 소수"", ""1) 세부평가항목 1~3은 중복하여 평가하며, 배점한도를 초과하여 감점하지 않음\n2) 모든 세부평가항목에 해당하지 않는 경우, 해당 평가항목의 배점한도를 부여함\n3) (1. 최저임금 위반 평가) 평가는 입찰공고일 기준으로 최근 3년 이내에 최저임금법 위반으로 유죄판결이 확정되어 고용노동부 장관으로부터 통보된 사업장을 기준으로 적용함\n4) (2. 임금체불 평가) 평가는 입찰공고일을 기준으로 고용노동부장관이 공개중인 체불 사업주 명단의 사업장에 대하여 적용함\n5) (3. 고용개선조치 미이행) 평가는 입찰공고일을 기준으로 최근 2년 이내에 고용노동부장관이 공표한 적극적 고용개선조치 미이행 사업주 명단의 자료에 표시된 사업장을 기준으로 적용함. 다만, 2017년 5월 1일 이후 공표된 자부터 적용함\n ○ 신인도(2점)\n- 제출마감일 기준 최근 1년간 관계법령에 따라 입찰참가 제한 또는 영업정지를 받은 기간을 합산하여 정지기간 1개월마다 배점의 10%씩 감점(1월 미만인 경우 1월로 계산)"", ""점 이하의 숫자가 나올 시 소수점 셋째 자리에서 반올림함\n다. 평가항목 및 배점\n ○ 평가점수 : 100점\n ○ 배점기준""]",,
C_rule_multi_route,1,재단법인충북연구원_GIS통계 기반 재난안전데이터 분석ㆍ관리 시스템 구.hwp,central,사업기간은 언제까지인가요?,착수일로부터 2025년 11월 14일까지,제안서 설명,"[""가. 제안서 설명\n ○ 평가위원회 개최 시 「업체별 제안서 내용 설명(프레젠테이션)」\n    ① 평가위원회 개최 시 제안서를 제출한 업체로부터 제안서 내용에 대한 설명을 청취하고, 질의 및 답변 실시\n    ② 업체별 제안서 설명은 사업 책임연구원이 하여야 함.\n    ③ 업체별 설명시간은 발표20분 이내, 질의/응답 10분 이내로 진행\n       * 추후 업체의 수 등 상황에 따라 조정 가능\n    ④ 제안 설명 자료는 파워포인트 이용\n    ⑤ 제출한 제안서와 동일한 내용으로 작성\n    ⑥ 제안 설명에 참여하지 않은 업체는 평가대상에서 제외함\n나. 제안서 평가\n□ 평가기준\n ○ 기술능력평가와 입찰가격평가를 실시하여 종합평가점수로 평가\n- 평가비율 : 기술능력평가(90%), 입찰가격평가(10%)\n- 기술능력평가 = 정량적 평가(20점) + 정성적 평가(70점)\n- 종합평가점수 = 기술능력평가점수 + 입찰가격평가점수\n□ 평가방법\n ○ 제출한 제안서는 발주기관에서 제안서 평가위원회를 구성하여 평가 진행\n ○ 제안서 평가위원회 구성은 다음과 같음\n- 위원장은 해당 위원회 위원 중 호선으로 진행하며, 평가위원은 위원장을 포함하여 7명을 선정함\n- 평가위원은 제안서의 공정한 평가를 위하여 3배수 이상의 예비명부 작성 → 고유번호 부여 → 입찰참가자 제안서 제출 시 위원수 만큼 번호 추첨 → 多 빈도 순으로 선정함\n* 불참자를 예상하여 예비평가위원 2명 추가지정(추가 지정 위원은 평가위원 불참 시 참석)\n ○ 평가기준 및 배점은 제안서 평가위원회의 검토 및 의결에 의하여 조정‧변경 시행 가능\n ○ 본 평가 및 제안요청서와 관련하여 해석상의 차이가 있을 경우 발주처의 해석에 따름\n ○ 기술능력평가와 입찰가격평가 중 정량적 지표에 의한 평가는 계약(사업) 담당자가 심사기준에 따라 평가하며, 기술능력평가 중 정성적 평가는 평가위원들이 ’제안서 평가기준‘ 배점에 의해 평가를 진행함\n ○ 점수는 각 평가위원이 작성한 평가표를 집계하여 산출하며, 산출결과 최종평균 점수가 소수"", ""1) 세부평가항목 1~3은 중복하여 평가하며, 배점한도를 초과하여 감점하지 않음\n2) 모든 세부평가항목에 해당하지 않는 경우, 해당 평가항목의 배점한도를 부여함\n3) (1. 최저임금 위반 평가) 평가는 입찰공고일 기준으로 최근 3년 이내에 최저임금법 위반으로 유죄판결이 확정되어 고용노동부 장관으로부터 통보된 사업장을 기준으로 적용함\n4) (2. 임금체불 평가) 평가는 입찰공고일을 기준으로 고용노동부장관이 공개중인 체불 사업주 명단의 사업장에 대하여 적용함\n5) (3. 고용개선조치 미이행) 평가는 입찰공고일을 기준으로 최근 2년 이내에 고용노동부장관이 공표한 적극적 고용개선조치 미이행 사업주 명단의 자료에 표시된 사업장을 기준으로 적용함. 다만, 2017년 5월 1일 이후 공표된 자부터 적용함\n ○ 신인도(2점)\n- 제출마감일 기준 최근 1년간 관계법령에 따라 입찰참가 제한 또는 영업정지를 받은 기간을 합산하여 정지기간 1개월마다 배점의 10%씩 감점(1월 미만인 경우 1월로 계산)"", ""점 이하의 숫자가 나올 시 소수점 셋째 자리에서 반올림함\n다. 평가항목 및 배점\n ○ 평가점수 : 100점\n ○ 배점기준"", ""가. 협상적격자 및 협상순위 선정\n ○ 협상순서는 합산점수의 고득점 순에 따라 결정하되, 합산점수가 동일한 제안자가 2인 이상일 경우에는 기술능력 평가 점수가 높은 제안자를 선 순위자로 하고, 기술능력 평가점수도 동일한 경우에는 추첨으로 정함\n나. 선정결과 통보\n ○ 제안서 평가결과 및 협상대상은 선정된 업체에만 유선 통보\n다. 협상진행 및 절차\n ○ 협상대상자가 제안한 사업내용, 이행방법, 이행일정 등 제안서 내용을 대상으로 협상을 실시함\n ○ 협상대상자와 협상을 통해 제안서 내용 일부를 조정할 수 있음\n ○ 협상대상자와의 가격협상 시 기준가격은 해당사업 추정가격에 부가가치세를 더한 금액 이하로서 협상대상자가 제안한 가격으로 함\n ○ 협상대상자가 제안한 내용을 가감 조정하는 경우에는 그 가감되는 내용에 상당하는 금액을 해당사업 추정가격에 부가가치세를 더한 금액 안의 범위에서 조정하여 계약금액을 결정함\n ○ 결정된 협상순위에 따라 협상대상자와 협상을 하며, 협상이 성립된 때에는 다른 협상적격자와 협상을 실시하지 않음\n ○ 협상대상자와의 협상이 성립되지 않으면, 동일한 기준과 절차에 따라 순차적으로 차순위 협상적격자와 협상을 실시함\n ○ 모든 협상적격자와의 협상이 결렬될 경우에는 재공고 입찰이나 새로운 입찰을 진행함\n ○ 협상절차 및 그 결과의 조치는 「지방자치단체 입찰 시 낙찰자 결정기준」에 의하며, 미 선정된 제안사에 대한 통보는 생략함\n ○ 협상기간은 협상개시를 통보한 날로부터 15일 이내로 함\n ○ 해당사업의 규모, 특수성, 난이도 등에 따라 협상 대상자와의 협의에 따라 10일 안의 범위에서 협상기간을 조정할 수 있음\n라. 협상결과 통보\n ○ 협상이 성립되면 그 결과를 해당 협상대상자에게 서면 통보\n마. 계약체결과 이행\n ○ 협상이 성립된 후 특별한 사유가 없는 한 10일 이내에 계약체결을 진행함\n ○ 계약의 체결과 이행에 관하여는 서면 통보한 협상결과와 지방자치단체를 당사자로 하는 계약에 관한 법률‧시행령‧시행규칙과 이에 근거한 계약의 일반조건, 특수조""]",,
A_single_pipeline,1,전북대학교_JST 공유대학(원) xAPI기반 LRS시스템 구축.hwp,central,사업예산은 얼마인가요?,"금116,000,000원(금일억일천육백만원, 부가세 포함)",해당 정보를 찾을 수 없습니다.,[],,
B_rule_single_route,1,전북대학교_JST 공유대학(원) xAPI기반 LRS시스템 구축.hwp,central,사업예산은 얼마인가요?,"금116,000,000원(금일억일천육백만원, 부가세 포함)",협상대상자 선정방식,"[""3. 협상대상자 선정방식\n□ 제안서 평가기준 근거 법규\n  ❍「국가를 당사자로 하는 계약에 관한 법률 시행령」 제43조(협상에 의한 계약체결)\n  ❍「협상에 의한 계약체결기준」(기획재정부 계약예규) \n  ❍「교육부 기술(제안서) 평가업무 처리규정」(교육부훈령 제111호)\n□ 제안서 기술평가위원회\n  ❍ 평가위원은 전북지역혁신플랫폼 대학교육혁신본부에서 임명(위촉)한 위원에 의하여 제안서를 토대로 기술평가를 수행\n  ❍ 기술평가 점수는 각 평가위원의 기술평가점수 중에서 최저 및 최고 점수를 제외한 후 평균하여 산출. 다만, 최저 또는 최고 점수가 2개 이상일 때에는 하나만 제외\n  ❍ 평가위원 명단, 평가결과 및 세부내용 등은 공개하지 않으며 평가결과에 이의를 제기할 수 없음\n□ 제안서 평가방식\n  ❍ 기술평가와 가격평가를 실시하여 종합평가점수로 평가\n   - 평가비율 : 기술평가(90%), 가격평가(10%)\n   - 종합평가점수 = 기술평가점수 + 입찰가격 평가점수\n  ❍ 제안서 평가결과 기술능력평가 점수가 배점한도(90점)의 85%(76.5점)이 상인 자를 협상적격자로 선정하고, 협상적격자의 기술능력평가 점수와 입찰가격평가 점수를 합산하여 합산점수의 고득점 순에 따라 협상을 실시\n  ❍ 기술능력평가 최종 점수는 평가위원별 기술평가점수 중에서 최저 및 최고 점수를 제외한 점수를 산술 평균하여 소수점 둘째자리까지 산출\n   ※최저 또는 최고 점수가 2개 이상일 때에 그 중 하나만 제외\n  ❍「소프트웨어 기술성 평가기준 지침」 제4조제5항에 따라 본사업은 기술능력평가의 변별력을 확보하기 위하여 기술능력평가점수 총배점한도를 기준으로 순위간 점수차(2점)를 지정하여차등점수제를 부여함\n  ❍ 합산점수가 동일한 제안자가 2인 이상일 경우, 기술능력평가 점수가 높은 자를 우선협상대상자로 선정\n  ❍ 기술능력평가 점수도 동일한 경우, 제안서 부문별 평가 항목 중 배점이 큰 항목을 우선하여 높은 점수를 얻은 자를 우선협상대상자로 선정\n  ❍ 입찰자가 제안서 평가에 참석하지 않은"", ""<표>\n* 등급별 평점이 소수점 이하의 숫자가 있는 경우 소수점 다섯째자리에서 반올림 함\n[주]\n 1.「신용정보의 이용 및 보호에 관한 법률」제4조제1항제1호 또는「자본시장과 금융투자업에 관한 법률」제335조의3에 따라 업무를 영위하는 신용조회사 또는 신용평가사가 입찰공고일 이전에 평가하고 유효기간 내에 있는 회사채, 기업어음 및 기업신용평가등급을 국가종합전자조달시스템에 조회된 신용평가등급으로 평가하되, 가장 최근의 신용평가등급으로 평가한다. 다만, 가장 최근의 신용평가등급이 다수가 있으며 그 결과가 서로 다른 경우에는 가장 낮은 등급으로 평가함\n 2. 국가종합전자조달시스템에서 신용평가등급 확인서가 확인되지 않은 경우에는 최저등급으로 평가하며, 유효기간 만료일이 입찰공고일인 경우에도 유효한 것으로 평가함\n 3. 주 1에도 불구하고, 합병 또는 분할한 자가 입찰공고일 이전에 평가한 신용평가등급이 없는 경우에는 입찰서 제출 마감일 전일까지 발급된 유효기간 내에 있는 가장 최근의 신용평가등급으로 평가한다. 다만, 합병 후 새로운 신용평가등급이 없는 경우에는 입찰공고일 이전에 평가하고 유효기간 내에 있는 신용평가등급으로서 합병 대상자 중 가장 낮은 신용평가등급을 받은 자의 신용평가등급으로 평가함\n 4. 추정가격이 고시금액 미만인 입찰에서 입찰공고일을 기준으로 최근 7년 이내에 사업을 개시한 창업기업에 대해서는 신용평가등급 점수상의 배점 한도를 부여한다. 이 경우 창업기업에 대한 기간계산은 법인인 경우에는 법인등기부상 법인설립등기일을, 개인사업자인 경우에는 사업자등록증명서상 사업자등록일을 기준으로 함(이하 창업기업에 대한 기간계산은 같다)"", "" 경우, 제출된 서면 제안서에 의해서만 평가함\n□ 제안서 발표\n  ❍ 일시 및 장소: 입찰공고문 참고\n  ❍ 제안 설명 기회는 공평하게 부여하며, 발표순서는 추첨으로 정함\n  ❍ 제안서 검토시간은 30분 이내로 하되, 참여업체 수에 따라 시간 조정\n   ※업체 발표시간 : 업체별 30분이내(제안서설명 : 20분, 질의응답: 10분)\n  ❍ 제안서 발표는 업체의 사업관리자(PM)가 직접 하여야 하며, 본 사업과 관련성이 없는 자는 발표할 수 없음\n  ❍ 표자료는 제안요약서를 이용하되 동 내용과 제안서의 내용이 상이할 경우에는 제안서를 우선하며, 평가위원회에서 감점처리 될 수 있음\n  ❍ 참여업체의 발표자료는 PPT로 제작, 설명회에 필요한 각종 프로그램 및 노트북, 마우스포인터 등은 해당 업체에서 준비\n   ※음향장비 이용의 경우, 환경에 따라 이용 불가능할 수 있음을 참고\n   ※입찰참가 시, 발표자료는 PDF파일로 제출하나, 제안서 평가 설명회 참가 시에는 PPT 자료 제작 필요\n  ❍ 제안사의 제안서 내용을 기준으로 하되, 필요시 보충 설명자료를 요구할 수 있으며, 제안자는 이에 응해야 함\n  ❍ 공정성과 신뢰성을 기하기 위해 기술성 평가위원회를 구성하여 평가하며, 평가위원의 명단은 공개하지 않음\n□ 평가기준\n  ❍ 기술평가항목 및 배점한도""]",,
C_rule_multi_route,1,전북대학교_JST 공유대학(원) xAPI기반 LRS시스템 구축.hwp,central,사업예산은 얼마인가요?,"금116,000,000원(금일억일천육백만원, 부가세 포함)",협상대상자 선정방식,"[""3. 협상대상자 선정방식\n□ 제안서 평가기준 근거 법규\n  ❍「국가를 당사자로 하는 계약에 관한 법률 시행령」 제43조(협상에 의한 계약체결)\n  ❍「협상에 의한 계약체결기준」(기획재정부 계약예규) \n  ❍「교육부 기술(제안서) 평가업무 처리규정」(교육부훈령 제111호)\n□ 제안서 기술평가위원회\n  ❍ 평가위원은 전북지역혁신플랫폼 대학교육혁신본부에서 임명(위촉)한 위원에 의하여 제안서를 토대로 기술평가를 수행\n  ❍ 기술평가 점수는 각 평가위원의 기술평가점수 중에서 최저 및 최고 점수를 제외한 후 평균하여 산출. 다만, 최저 또는 최고 점수가 2개 이상일 때에는 하나만 제외\n  ❍ 평가위원 명단, 평가결과 및 세부내용 등은 공개하지 않으며 평가결과에 이의를 제기할 수 없음\n□ 제안서 평가방식\n  ❍ 기술평가와 가격평가를 실시하여 종합평가점수로 평가\n   - 평가비율 : 기술평가(90%), 가격평가(10%)\n   - 종합평가점수 = 기술평가점수 + 입찰가격 평가점수\n  ❍ 제안서 평가결과 기술능력평가 점수가 배점한도(90점)의 85%(76.5점)이 상인 자를 협상적격자로 선정하고, 협상적격자의 기술능력평가 점수와 입찰가격평가 점수를 합산하여 합산점수의 고득점 순에 따라 협상을 실시\n  ❍ 기술능력평가 최종 점수는 평가위원별 기술평가점수 중에서 최저 및 최고 점수를 제외한 점수를 산술 평균하여 소수점 둘째자리까지 산출\n   ※최저 또는 최고 점수가 2개 이상일 때에 그 중 하나만 제외\n  ❍「소프트웨어 기술성 평가기준 지침」 제4조제5항에 따라 본사업은 기술능력평가의 변별력을 확보하기 위하여 기술능력평가점수 총배점한도를 기준으로 순위간 점수차(2점)를 지정하여차등점수제를 부여함\n  ❍ 합산점수가 동일한 제안자가 2인 이상일 경우, 기술능력평가 점수가 높은 자를 우선협상대상자로 선정\n  ❍ 기술능력평가 점수도 동일한 경우, 제안서 부문별 평가 항목 중 배점이 큰 항목을 우선하여 높은 점수를 얻은 자를 우선협상대상자로 선정\n  ❍ 입찰자가 제안서 평가에 참석하지 않은"", ""<표>\n* 등급별 평점이 소수점 이하의 숫자가 있는 경우 소수점 다섯째자리에서 반올림 함\n[주]\n 1.「신용정보의 이용 및 보호에 관한 법률」제4조제1항제1호 또는「자본시장과 금융투자업에 관한 법률」제335조의3에 따라 업무를 영위하는 신용조회사 또는 신용평가사가 입찰공고일 이전에 평가하고 유효기간 내에 있는 회사채, 기업어음 및 기업신용평가등급을 국가종합전자조달시스템에 조회된 신용평가등급으로 평가하되, 가장 최근의 신용평가등급으로 평가한다. 다만, 가장 최근의 신용평가등급이 다수가 있으며 그 결과가 서로 다른 경우에는 가장 낮은 등급으로 평가함\n 2. 국가종합전자조달시스템에서 신용평가등급 확인서가 확인되지 않은 경우에는 최저등급으로 평가하며, 유효기간 만료일이 입찰공고일인 경우에도 유효한 것으로 평가함\n 3. 주 1에도 불구하고, 합병 또는 분할한 자가 입찰공고일 이전에 평가한 신용평가등급이 없는 경우에는 입찰서 제출 마감일 전일까지 발급된 유효기간 내에 있는 가장 최근의 신용평가등급으로 평가한다. 다만, 합병 후 새로운 신용평가등급이 없는 경우에는 입찰공고일 이전에 평가하고 유효기간 내에 있는 신용평가등급으로서 합병 대상자 중 가장 낮은 신용평가등급을 받은 자의 신용평가등급으로 평가함\n 4. 추정가격이 고시금액 미만인 입찰에서 입찰공고일을 기준으로 최근 7년 이내에 사업을 개시한 창업기업에 대해서는 신용평가등급 점수상의 배점 한도를 부여한다. 이 경우 창업기업에 대한 기간계산은 법인인 경우에는 법인등기부상 법인설립등기일을, 개인사업자인 경우에는 사업자등록증명서상 사업자등록일을 기준으로 함(이하 창업기업에 대한 기간계산은 같다)"", "" 경우, 제출된 서면 제안서에 의해서만 평가함\n□ 제안서 발표\n  ❍ 일시 및 장소: 입찰공고문 참고\n  ❍ 제안 설명 기회는 공평하게 부여하며, 발표순서는 추첨으로 정함\n  ❍ 제안서 검토시간은 30분 이내로 하되, 참여업체 수에 따라 시간 조정\n   ※업체 발표시간 : 업체별 30분이내(제안서설명 : 20분, 질의응답: 10분)\n  ❍ 제안서 발표는 업체의 사업관리자(PM)가 직접 하여야 하며, 본 사업과 관련성이 없는 자는 발표할 수 없음\n  ❍ 표자료는 제안요약서를 이용하되 동 내용과 제안서의 내용이 상이할 경우에는 제안서를 우선하며, 평가위원회에서 감점처리 될 수 있음\n  ❍ 참여업체의 발표자료는 PPT로 제작, 설명회에 필요한 각종 프로그램 및 노트북, 마우스포인터 등은 해당 업체에서 준비\n   ※음향장비 이용의 경우, 환경에 따라 이용 불가능할 수 있음을 참고\n   ※입찰참가 시, 발표자료는 PDF파일로 제출하나, 제안서 평가 설명회 참가 시에는 PPT 자료 제작 필요\n  ❍ 제안사의 제안서 내용을 기준으로 하되, 필요시 보충 설명자료를 요구할 수 있으며, 제안자는 이에 응해야 함\n  ❍ 공정성과 신뢰성을 기하기 위해 기술성 평가위원회를 구성하여 평가하며, 평가위원의 명단은 공개하지 않음\n□ 평가기준\n  ❍ 기술평가항목 및 배점한도"", ""1. 사업개요\n□ 사 업 명: JST 공유대학(원) xAPI기반 LRS시스템 구축\n□ 주관기관: 전북지역혁신플랫폼 대학교육혁신본부\n□ 사업기간: 계약체결일로부터 75일까지\n□ 사업예산: 금116,000,000원(금일억일천육백만원, 부가세 포함)\n□ 계약방법: 제한(총액)경쟁입찰(협상에 의한 계약)\n \n2. 추진배경 및 사업목적\n□ 추진배경\n  ❍ (학습 데이터의 통합 관리) 기존의 LMS나 다양한 학습 플랫폼에서 발생하는 데이터를 통합적으로 관리하고 분석할 필요성 증가\n  ❍ (개인 맞춤형 학습 환경 구축) 학습자의 다양한 학습 데이터를 수집 및 분석하여 학습자의 패턴을 파악하여 학습자에게 맞춤형 학습 경로 제공\n  ❍ (데이터 기반의 의사결정) JST 공유대학(원) 학습 데이터를 분석하여 교육 정책 수립에 필요한 정보를 제공하고, 교육 효과를 객관적으로 평가 할 수 있는 교육 데이터 기반의 정책 의사결정 지원 체계 요구\n  ❍ 초개인화 LRS(Learning Record Store)구축: 빅데이터에 기반한 학습자의 학습분석을 바탕으로, 개인 맞춤별 학습경로를 제공하여 학습 효과 극대화 필요\n□ 사업목적\n  ❍ xAPI 기반으로 학습자의 다양한 학습활동 데이터 수집 체계 구축\n  ❍ 분석된 학습 활동 데이터를 바탕으로 학습자 맞춤형 학습 경로 제공 \n  ❍ 학습자의 학습효과 향상 및 교수 방법 개선 인사이트 도출\n 3. 사업내용 및 기대효과\n□ 사업내용\n  JST 공유대학(원) LRS 시스템 구축안 구성도""]",,
A_single_pipeline,1,전북특별자치도 정읍시_정읍체육트레이닝센터 통합운영관리시스템 구.hwp,extreme,사업기간은 어떻게 명시되어 있나요?,착수일로부터 80일 이내,해당 정보를 찾을 수 없습니다.,[],,
B_rule_single_route,1,전북특별자치도 정읍시_정읍체육트레이닝센터 통합운영관리시스템 구.hwp,extreme,사업기간은 어떻게 명시되어 있나요?,착수일로부터 80일 이내,제안서 평가 및 협상,"[""3. 제안서 평가 및 협상\n  가. 평가방법\n     제안서 평가는 본 사업의 4. 제안서 세부평가 기준의 평가항목의 배점기준에 따라 평가하며, 본 제안요청서에서 정하지 않은 사항은 정부입찰계약집행기준, 협상에 의한 계약체결 기준(기획재정부 예규)을 준용함\n  나. 평가항목 및 배점\n   1) 종합 평가점수(100) = 기술능력 평가점수(90) + 입찰가격 평가점수(10)\n   2) 기술능력 평가 : 90점(정량적 평가 20점, 정성적 평가 70점) \n    - 정량적 지표의 평가는 담당부서(자)가 평가하며, 제안사는 [별지 서식10] 정량적 평가지표 자가진단표를 작성·제출하고, 정량적 지표 증빙자료를 USB에 저장된 전자파일 형태로 제출해야 함\n    - 정성적 지표의 평가는 '제안 설명회'를 개최하고, 정읍시청 에서 구성한 '제안서 평가위원회'에서 평가([붙임 11] 평가위원별 평가점수표)함 \n   3) 입찰가격 평가 : 10점 \n    - 입찰가격 평가는 '제안서 평가위원회'의 정성적 지표의 평가 후, 입찰가격 평가 산식에 따라 평가함\n    - 가격제안입찰서는 부가가치세가 포함된 가격으로 제출하여야 하며 제안서 등의 방문 제출 시 반드시 함께 제출해야 함\n   ※ 첨부된 제안요청서 내 “가격입찰서”([별지 15] 입찰가격제안서), “가격입찰서 산출내역”는 반드시 밀봉 후 인감 날인하여 제출해야 하며, 국가종합전자조달시스템에 가격입찰서를 제출하지 아니하거나 제출하는 가격입찰서의 금액과 상이한 경우 그 입찰을 무효로 함"", ""다. 협상적격자 선정 및 협상순서\n  1) 제안서 평가결과 기술능력 평가점수가 기술능력 평가분야 배점한도의 85% 이상인 제안사를 협상적격자로 선정하며, 평가결과 협상적격자가 없는 경우에는 재공고 입찰에 부칠 수 있음\n  2) 협상순서는 협상적격자중 종합 평가점수의 고득점 순서에 따라 결정하며 종합 평가점수가 동일한 제안자가 2인 이상일 경우에는 기술능력평가 점수가 높은 제안자를 선 순위자로 하고, 기술능력평가 점수도 동일한 경우에는 추첨으로 정함\n  3) 선순위 협상대상자와 협상이 성립(낙찰자 결정)된 때에는 다른 하순위 협상 적격자와 협상을 실시하지 아니함\n  4) 협상대상자와의 협상이 성립되지 않으면 동일한 기준과 절차에 따라 순차적으로 차순위 협상적격자와 협상을 실시함\n  5) 모든 협상적격자와 협상이 결렬될 시에는 재공고 입찰에 부칠 수 있음\n  6) 협상범위는 협상대상자가 제안한 사업내용, 이행방법, 이행일정 및 기술평가 위원회에서 권유한 사항 등을 협상대상으로 하며 협상을 통해 그 내용의 일부를 조정할 수 있음\n  7) 가격제안서(입찰서)의 입찰가격이 추정가격(예정가격을 작성할 경우에는 예정가격)을 초과하는 자는 협상적격자에서 제외\n  8) 협상이 성립된 후 사업 추진에 지장이 없도록 조속한 시일 내에 계약 \n     체결\n  9) 그 외 기술하지 아니한 사항은 지방자치단체 입찰시 낙찰자 결정 기준 협상에 의한 계약 제안서 평가 세부기준을 따름"", ""4. 제안서 세부평가 기준\n  가. 평가항목 및 배점 총괄표\n \n<표>""]",,
C_rule_multi_route,1,전북특별자치도 정읍시_정읍체육트레이닝센터 통합운영관리시스템 구.hwp,extreme,사업기간은 어떻게 명시되어 있나요?,착수일로부터 80일 이내,제안서 평가 및 협상,"[""3. 제안서 평가 및 협상\n  가. 평가방법\n     제안서 평가는 본 사업의 4. 제안서 세부평가 기준의 평가항목의 배점기준에 따라 평가하며, 본 제안요청서에서 정하지 않은 사항은 정부입찰계약집행기준, 협상에 의한 계약체결 기준(기획재정부 예규)을 준용함\n  나. 평가항목 및 배점\n   1) 종합 평가점수(100) = 기술능력 평가점수(90) + 입찰가격 평가점수(10)\n   2) 기술능력 평가 : 90점(정량적 평가 20점, 정성적 평가 70점) \n    - 정량적 지표의 평가는 담당부서(자)가 평가하며, 제안사는 [별지 서식10] 정량적 평가지표 자가진단표를 작성·제출하고, 정량적 지표 증빙자료를 USB에 저장된 전자파일 형태로 제출해야 함\n    - 정성적 지표의 평가는 '제안 설명회'를 개최하고, 정읍시청 에서 구성한 '제안서 평가위원회'에서 평가([붙임 11] 평가위원별 평가점수표)함 \n   3) 입찰가격 평가 : 10점 \n    - 입찰가격 평가는 '제안서 평가위원회'의 정성적 지표의 평가 후, 입찰가격 평가 산식에 따라 평가함\n    - 가격제안입찰서는 부가가치세가 포함된 가격으로 제출하여야 하며 제안서 등의 방문 제출 시 반드시 함께 제출해야 함\n   ※ 첨부된 제안요청서 내 “가격입찰서”([별지 15] 입찰가격제안서), “가격입찰서 산출내역”는 반드시 밀봉 후 인감 날인하여 제출해야 하며, 국가종합전자조달시스템에 가격입찰서를 제출하지 아니하거나 제출하는 가격입찰서의 금액과 상이한 경우 그 입찰을 무효로 함"", ""다. 협상적격자 선정 및 협상순서\n  1) 제안서 평가결과 기술능력 평가점수가 기술능력 평가분야 배점한도의 85% 이상인 제안사를 협상적격자로 선정하며, 평가결과 협상적격자가 없는 경우에는 재공고 입찰에 부칠 수 있음\n  2) 협상순서는 협상적격자중 종합 평가점수의 고득점 순서에 따라 결정하며 종합 평가점수가 동일한 제안자가 2인 이상일 경우에는 기술능력평가 점수가 높은 제안자를 선 순위자로 하고, 기술능력평가 점수도 동일한 경우에는 추첨으로 정함\n  3) 선순위 협상대상자와 협상이 성립(낙찰자 결정)된 때에는 다른 하순위 협상 적격자와 협상을 실시하지 아니함\n  4) 협상대상자와의 협상이 성립되지 않으면 동일한 기준과 절차에 따라 순차적으로 차순위 협상적격자와 협상을 실시함\n  5) 모든 협상적격자와 협상이 결렬될 시에는 재공고 입찰에 부칠 수 있음\n  6) 협상범위는 협상대상자가 제안한 사업내용, 이행방법, 이행일정 및 기술평가 위원회에서 권유한 사항 등을 협상대상으로 하며 협상을 통해 그 내용의 일부를 조정할 수 있음\n  7) 가격제안서(입찰서)의 입찰가격이 추정가격(예정가격을 작성할 경우에는 예정가격)을 초과하는 자는 협상적격자에서 제외\n  8) 협상이 성립된 후 사업 추진에 지장이 없도록 조속한 시일 내에 계약 \n     체결\n  9) 그 외 기술하지 아니한 사항은 지방자치단체 입찰시 낙찰자 결정 기준 협상에 의한 계약 제안서 평가 세부기준을 따름"", ""4. 제안서 세부평가 기준\n  가. 평가항목 및 배점 총괄표\n \n<표>""]",,
A_single_pipeline,1,조선대학교_(재공고)2024 조선대학교 SW중심대학 사업관리시스템(WeHub) 구.hwp,central,이 입찰의 입찰방법은 무엇인가?,제한경쟁입찰,해당 정보를 찾을 수 없습니다.,[],,
B_rule_single_route,1,조선대학교_(재공고)2024 조선대학교 SW중심대학 사업관리시스템(WeHub) 구.hwp,central,이 입찰의 입찰방법은 무엇인가?,제한경쟁입찰,기술평가 세부 평가방식,"[""5. 기술평가 세부 평가방식\n  가. 제안서의 평가는 “평가항목별 세부 기준”의 평가항목 및 배점표에 따라 학교에서 구성한 “평가위원”이 평가를 실시한다.\n  나. 제안서 평가는 조선대학교의 평가 기준에 의하여 평가하며 제안사는 기술평가 결과에 \n      대해 일체의 이의를 제기할 수 없으며 세부적인 평가항목 및 결과는 공개하지 않음\n  다. 기술평가 시 각 업체별 평가위원의 점수 중 최고점수 1개와 최저점수 1개를 제외하고, 나머지 평가위원들의 점수를 평균화(평가위원이 5명 이내인 경우 평가위원 전체의 점수를 평균화)한다. 단, 최고 또는 최저 점수가 복수 일 경우에는 그 중 1개 점수만 제외한다.\n  라. 평가를 위한 증빙서류 미제출 시 “0”점 처리함\n  마. 제안서의 평균 점수가 80점 만점의 85% 이상 업체(68점 이상)를 대상으로 가격 평가 \n     진행"", ""2) 입찰가격을 추정가격의 100분의 80 미만인 입찰한 자에 대한 평가      \n    \n             \n    * 최저입찰가격 : 유효한 입찰자중 최저입찰가격으로 하되, 입찰가격이 추\n      정가격의 100분의 70미만일 경우에는 100분의 70으로 계산 \n    * 해당입찰가격 : 해당평가대상자의 입찰가격으로 하되, 입찰가격이 추정가\n      격의 100분의 70미만일 경우에는 배점한도의 30%에 해당하는 평점을 부\n      여\n    * SW 사업 및 「소방장비관리법」에 따른 소방장비, 「경찰관 직무집행\n      법」에 따른 경찰장구, 「해양경찰장비 도입 및 관리에 관한 법률」에 따\n      른 해양경찰장비, 「군수품관리법」에 따른 군수품으로서 소방ㆍ경찰ㆍ해\n      양경찰ㆍ군의 안전 관련 물품 구매ㆍ제조의 경우에는 해당 입찰가격이 추\n      정가격의 100분의 80미만일 경우에는 배점한도의 30%에 해당하는 평점\n      을 부여\n    * 입찰가격 평가시 사업예산으로 하는 경우에는 추정가격에 부가가치세를 \n      포함하여 적용하고, 예정가격을 작성 한 경우에는 추정가격을 예정가격으\n      로 적용\n    3) 입찰가격 평점 계산식에 의한 계산결과 소수점이하의 숫자가 있는 경우\n       에는 소수점 다섯째자리에서 반올림함\n    4) 각 중앙관서의 장은 계약수행 과정에서 계약상대자가 계약금액 이외에 \n       제3자로부터 경제적 이익을 얻을 수 있는 경우 등 위 기준을 적용하기 \n       곤란하다고 판단되는 경우에는 기획재정부 장관과 협의하여 위 기준과 \n       다른 평점 계산식을 운영할 수 있다."", ""1. 사업 개요\n사업명 : 2024 조선대학교 SW중심대학 사업관리시스템(WeHub) 구축\n사업기간 : 계약체결일로부터 90일(약 3개월)\n하자유지보수기간: 사업을 종료한 날부터 1년\n설계금액 : 금 100,000,000원(부가세 포함)\n입찰방법 :　제한경쟁입찰\n계약방법 : 협상에 의한 계약(기술점수 80점, 가격점수 20점)""]",,
C_rule_multi_route,1,조선대학교_(재공고)2024 조선대학교 SW중심대학 사업관리시스템(WeHub) 구.hwp,central,이 입찰의 입찰방법은 무엇인가?,제한경쟁입찰,기술평가 세부 평가방식,"[""5. 기술평가 세부 평가방식\n  가. 제안서의 평가는 “평가항목별 세부 기준”의 평가항목 및 배점표에 따라 학교에서 구성한 “평가위원”이 평가를 실시한다.\n  나. 제안서 평가는 조선대학교의 평가 기준에 의하여 평가하며 제안사는 기술평가 결과에 \n      대해 일체의 이의를 제기할 수 없으며 세부적인 평가항목 및 결과는 공개하지 않음\n  다. 기술평가 시 각 업체별 평가위원의 점수 중 최고점수 1개와 최저점수 1개를 제외하고, 나머지 평가위원들의 점수를 평균화(평가위원이 5명 이내인 경우 평가위원 전체의 점수를 평균화)한다. 단, 최고 또는 최저 점수가 복수 일 경우에는 그 중 1개 점수만 제외한다.\n  라. 평가를 위한 증빙서류 미제출 시 “0”점 처리함\n  마. 제안서의 평균 점수가 80점 만점의 85% 이상 업체(68점 이상)를 대상으로 가격 평가 \n     진행"", ""2) 입찰가격을 추정가격의 100분의 80 미만인 입찰한 자에 대한 평가      \n    \n             \n    * 최저입찰가격 : 유효한 입찰자중 최저입찰가격으로 하되, 입찰가격이 추\n      정가격의 100분의 70미만일 경우에는 100분의 70으로 계산 \n    * 해당입찰가격 : 해당평가대상자의 입찰가격으로 하되, 입찰가격이 추정가\n      격의 100분의 70미만일 경우에는 배점한도의 30%에 해당하는 평점을 부\n      여\n    * SW 사업 및 「소방장비관리법」에 따른 소방장비, 「경찰관 직무집행\n      법」에 따른 경찰장구, 「해양경찰장비 도입 및 관리에 관한 법률」에 따\n      른 해양경찰장비, 「군수품관리법」에 따른 군수품으로서 소방ㆍ경찰ㆍ해\n      양경찰ㆍ군의 안전 관련 물품 구매ㆍ제조의 경우에는 해당 입찰가격이 추\n      정가격의 100분의 80미만일 경우에는 배점한도의 30%에 해당하는 평점\n      을 부여\n    * 입찰가격 평가시 사업예산으로 하는 경우에는 추정가격에 부가가치세를 \n      포함하여 적용하고, 예정가격을 작성 한 경우에는 추정가격을 예정가격으\n      로 적용\n    3) 입찰가격 평점 계산식에 의한 계산결과 소수점이하의 숫자가 있는 경우\n       에는 소수점 다섯째자리에서 반올림함\n    4) 각 중앙관서의 장은 계약수행 과정에서 계약상대자가 계약금액 이외에 \n       제3자로부터 경제적 이익을 얻을 수 있는 경우 등 위 기준을 적용하기 \n       곤란하다고 판단되는 경우에는 기획재정부 장관과 협의하여 위 기준과 \n       다른 평점 계산식을 운영할 수 있다."", ""1. 사업 개요\n사업명 : 2024 조선대학교 SW중심대학 사업관리시스템(WeHub) 구축\n사업기간 : 계약체결일로부터 90일(약 3개월)\n하자유지보수기간: 사업을 종료한 날부터 1년\n설계금액 : 금 100,000,000원(부가세 포함)\n입찰방법 :　제한경쟁입찰\n계약방법 : 협상에 의한 계약(기술점수 80점, 가격점수 20점)"", ""3. 기타사항\n제안요청서에 명시하지 않았더라도 사업 진행에 꼭 필요한 기본 항목은 모두 포함하는 것을 원칙으로 하며, 협의를 통해 최종 결정함.\n사업내용이 변경될 경우에는 과업 변경절차에 따라 상호 협의하여 결정하며, 제안사 판단으로 추가되어야 할 요구사항에 대해서는 별도 표시하여 추가 작성 가능함.\n제안사는 제안요청서에 기술된 요구사항을 기반으로 제안하되, 업무분석 단계에서 보다 창의적인 방법으로 요구사항을 해석·정제하여 사업에 반영해야 함.\n제안요청서 상의 용어는 일반적인 통념에 따라 해석하되, 해석상의 차이가 있거나 별도의 언급이 없을 경우에는 발주기관의 의견에 따름.\n4. 결과물 제출\n사업 완료에 따른 완료보고서 제출\n완료계\n디자인 원본 소스 일체\n시스템 관리자(운영자) 매뉴얼\n하자유지보수보증보험증권 1부\n※ 사업의 하자담보책임기간은 사업을 종료한 날(사업에 대한 시험 및 검사를 수행하여    최종출물을 인도한 날을 말함)부터 1년으로 함""]",,
A_single_pipeline,1,중앙선거관리위원회_2025년도 행정정보시스템 위탁운영사업.hwp,extreme,이 입찰의 입찰방법은 무엇인가?,제한경쟁입찰,해당 정보를 찾을 수 없습니다.,[],,
B_rule_single_route,1,중앙선거관리위원회_2025년도 행정정보시스템 위탁운영사업.hwp,extreme,이 입찰의 입찰방법은 무엇인가?,제한경쟁입찰,󰂛 종합평가점수 산출,"[""󰂛 종합평가점수 산출\n   ❍ 평가비율 : 제안서평가(90%), 입찰가격평가(10%)\n   ❍ 종합평가점수 산출 : 제안서평가 점수 + 입찰가격평가 점수\n       ※ 점수계산은 소수점 이하 5자리까지 산정 후 반올림하여 소수점 이하 4자리까지 산출\n       ※ 입찰가격평가 : 기획재정부 계약예규 제538호 \""협상에 의한 계약체결기준\"" 적용\n   ❍ 동점 시 처리방법\n      - 종합평가점수가 동점인 경우 제안서평가점수가 높은 제안사를 선정\n      - 제안서평가점수도 동일한 경우 배점이 높은 평가항목에서 점수가 높은 제안사를 선정(시스템 운영 요구사항-사업수행 투입인력-이해도 및 준비성 순)\n  󰂜 제안서평가 방법\n   ❍ 제안서 평가는 발주기관 주관으로 실시하며, 공정한 평가를 위하여 전문가로 구성된 평가위원회를 구성하여 제안서의 제안서평가 수행\n   ❍ 제안서평가는「소프트웨어 기술성 평가기준(과학기술정보통신부 고시)」을 기준으로 하되, 사업의 특성 및 내용 등을 고려하여 평가항목 및 항목별 배점한도를 조정\n  󰂝 제안서평가 관련 유의사항\n   ❍ 평가결과 공개에 관한 사항은 관련 규정 준수\n   ❍ 제안사는 제안서 제안서평가 결과에 대해 일체의 이의제기 불가\n   ❍ 제안내용이 허위로 판명되는 경우 심사결과에 관계없이 협상대상에서 제외\n  󰂞 협상적격자 선정 및 협상순서\n   ❍ 제안서평가점수가 제안서평가배점한도의 85%이상인 제안사를 협상적격자로 선정\n      - 협상적격자가 없는 경우 재공고 입찰에 부칠 수 있음\n   ❍ 협상순서는 종합평가점수(제안서평가+가격평가)의 고득점순서에 의하여 결정\n      - 협상이 성립된 때에는 다른 협상적격자와의 협상은 미실시\n      - 모든 협상적격자와 협상 결렬시 재공고 입찰\n  󰂟 협상방법 및 기준\n   ❍ 협상대상자가 제안한 사업내용, 이행방법, 이행일정, 제안가격 등 제안서의 내용을 대상으로 협상 실시\n   ❍ 가격협상의 기준가격은 협상대상자가 제안한 가격으로 결정\n      ※ 다만, 협상대상"", ""자가 제안한 가격이 예정가격(또는 사업예산) 이상인 경우에는 예정가격(또는 사업예산) 이하로 가격 조정 협의\n   ❍ 협상대상자가 제안한 내용을 가감하는 경우에는 가감내용에 상당하는 금액을 예정가격 범위 내에서 조정 가능\n  󰂠 제안서 기술평가 기준(제안서 평가항목 및 배점한도)\n   ❍ 정량적 평가항목 (5점)\n  \n<표>"", ""󰂛 계약대가의 지급\n   ❍ 용역수행 대가의 지급은 각종 산출물 및 업무별 이행결과를 검사한 후 이상이 없을 경우에 계약금액을 균분하여 매월 지급하는 것을 원칙으로 하되, 주관사업자는 사업의 원활한 수행을 위해 필요한 경우 선금을 지급 요청\n   ❍ 주관사업자가 선금 지급을 요청하는 때에는 관련법규 및 규정에 따라야 하며, 원활한 예산집행을 위해 선금의 지급시기 및 지급비율에 대하여 계약 이후 발주기관과 사전 협의 필요\n 󰂜 참여인력관리\n   ❍ 본 사업에 참여하는 핵심인력은 전원 지정된 장소에 상주하여 근무하는 것을 원칙으로 하되, 지원인력이나 단순 참여인력 등은 보안 등 특별한 사유가 있는 경우를 제외하고는 주관사업자가 근무장소를 지정하여 근무\n   ❍ 상주인력(정기, 비정기)의 근무시간 및 방법은 공무원 복무규정을 준수하며, 특별한 관리와 주의가 필요하여 발주기관이 요청하는 경우 정규 근무시간 이외에도 시스템 운영 지원\n   ❍ 본 사업과 관련한 참여인력은 사업착수 시점 또는 개인별 투입시점에 개인별 보안서약서를 작성하여 제출\n   ❍ 발주기관은 청사 출입 근무자를 대상으로 『선거관리위원회 정보통신보안업무규정』 제9조 등에 따라 상주인력에 대해 신원조사를 실시할 수 있으며, 다음 각 호에 해당하여 형의 실효기간이 경과하지 않은 자는 상주근무 불가\n       - 우리위원회 또는 계약상대자가 참여인원이 다음 각 호에 해당되는 사실을 알게 된 경우\n          1.「국가공무원법」제33조제3호부터 제6의4호까지에 해당하는 사람\n          2.「국가를 당사자로 하는 계약에 관한 법률」제27조제1항 각 호의 행위를 한 사람\n        - 상주인력이 근무 시간 중 영리를 목적으로 본 사업과 무관한 업무를 수행한 경우 \n       - 사업수행 중 보안사항 유출 등 의도적인 보안 침해행위를 한 경우\n   ❍ 상주 인력이 1일 이상 부재 시 주관사업자는 부재기간 동안 대체인력을 투입하거나 대행업무자를 지정\n   ❍ 발주기관이 자질부족·근무태도 불량 등의""]",,
C_rule_multi_route,1,중앙선거관리위원회_2025년도 행정정보시스템 위탁운영사업.hwp,extreme,이 입찰의 입찰방법은 무엇인가?,제한경쟁입찰,󰂛 종합평가점수 산출,"[""󰂛 종합평가점수 산출\n   ❍ 평가비율 : 제안서평가(90%), 입찰가격평가(10%)\n   ❍ 종합평가점수 산출 : 제안서평가 점수 + 입찰가격평가 점수\n       ※ 점수계산은 소수점 이하 5자리까지 산정 후 반올림하여 소수점 이하 4자리까지 산출\n       ※ 입찰가격평가 : 기획재정부 계약예규 제538호 \""협상에 의한 계약체결기준\"" 적용\n   ❍ 동점 시 처리방법\n      - 종합평가점수가 동점인 경우 제안서평가점수가 높은 제안사를 선정\n      - 제안서평가점수도 동일한 경우 배점이 높은 평가항목에서 점수가 높은 제안사를 선정(시스템 운영 요구사항-사업수행 투입인력-이해도 및 준비성 순)\n  󰂜 제안서평가 방법\n   ❍ 제안서 평가는 발주기관 주관으로 실시하며, 공정한 평가를 위하여 전문가로 구성된 평가위원회를 구성하여 제안서의 제안서평가 수행\n   ❍ 제안서평가는「소프트웨어 기술성 평가기준(과학기술정보통신부 고시)」을 기준으로 하되, 사업의 특성 및 내용 등을 고려하여 평가항목 및 항목별 배점한도를 조정\n  󰂝 제안서평가 관련 유의사항\n   ❍ 평가결과 공개에 관한 사항은 관련 규정 준수\n   ❍ 제안사는 제안서 제안서평가 결과에 대해 일체의 이의제기 불가\n   ❍ 제안내용이 허위로 판명되는 경우 심사결과에 관계없이 협상대상에서 제외\n  󰂞 협상적격자 선정 및 협상순서\n   ❍ 제안서평가점수가 제안서평가배점한도의 85%이상인 제안사를 협상적격자로 선정\n      - 협상적격자가 없는 경우 재공고 입찰에 부칠 수 있음\n   ❍ 협상순서는 종합평가점수(제안서평가+가격평가)의 고득점순서에 의하여 결정\n      - 협상이 성립된 때에는 다른 협상적격자와의 협상은 미실시\n      - 모든 협상적격자와 협상 결렬시 재공고 입찰\n  󰂟 협상방법 및 기준\n   ❍ 협상대상자가 제안한 사업내용, 이행방법, 이행일정, 제안가격 등 제안서의 내용을 대상으로 협상 실시\n   ❍ 가격협상의 기준가격은 협상대상자가 제안한 가격으로 결정\n      ※ 다만, 협상대상"", ""자가 제안한 가격이 예정가격(또는 사업예산) 이상인 경우에는 예정가격(또는 사업예산) 이하로 가격 조정 협의\n   ❍ 협상대상자가 제안한 내용을 가감하는 경우에는 가감내용에 상당하는 금액을 예정가격 범위 내에서 조정 가능\n  󰂠 제안서 기술평가 기준(제안서 평가항목 및 배점한도)\n   ❍ 정량적 평가항목 (5점)\n  \n<표>"", ""󰂛 계약대가의 지급\n   ❍ 용역수행 대가의 지급은 각종 산출물 및 업무별 이행결과를 검사한 후 이상이 없을 경우에 계약금액을 균분하여 매월 지급하는 것을 원칙으로 하되, 주관사업자는 사업의 원활한 수행을 위해 필요한 경우 선금을 지급 요청\n   ❍ 주관사업자가 선금 지급을 요청하는 때에는 관련법규 및 규정에 따라야 하며, 원활한 예산집행을 위해 선금의 지급시기 및 지급비율에 대하여 계약 이후 발주기관과 사전 협의 필요\n 󰂜 참여인력관리\n   ❍ 본 사업에 참여하는 핵심인력은 전원 지정된 장소에 상주하여 근무하는 것을 원칙으로 하되, 지원인력이나 단순 참여인력 등은 보안 등 특별한 사유가 있는 경우를 제외하고는 주관사업자가 근무장소를 지정하여 근무\n   ❍ 상주인력(정기, 비정기)의 근무시간 및 방법은 공무원 복무규정을 준수하며, 특별한 관리와 주의가 필요하여 발주기관이 요청하는 경우 정규 근무시간 이외에도 시스템 운영 지원\n   ❍ 본 사업과 관련한 참여인력은 사업착수 시점 또는 개인별 투입시점에 개인별 보안서약서를 작성하여 제출\n   ❍ 발주기관은 청사 출입 근무자를 대상으로 『선거관리위원회 정보통신보안업무규정』 제9조 등에 따라 상주인력에 대해 신원조사를 실시할 수 있으며, 다음 각 호에 해당하여 형의 실효기간이 경과하지 않은 자는 상주근무 불가\n       - 우리위원회 또는 계약상대자가 참여인원이 다음 각 호에 해당되는 사실을 알게 된 경우\n          1.「국가공무원법」제33조제3호부터 제6의4호까지에 해당하는 사람\n          2.「국가를 당사자로 하는 계약에 관한 법률」제27조제1항 각 호의 행위를 한 사람\n        - 상주인력이 근무 시간 중 영리를 목적으로 본 사업과 무관한 업무를 수행한 경우 \n       - 사업수행 중 보안사항 유출 등 의도적인 보안 침해행위를 한 경우\n   ❍ 상주 인력이 1일 이상 부재 시 주관사업자는 부재기간 동안 대체인력을 투입하거나 대행업무자를 지정\n   ❍ 발주기관이 자질부족·근무태도 불량 등의""]",,
A_single_pipeline,1,축산물품질평가원_꿀 품질평가 전산시스템 기능개선 사업.hwp,extreme,이 사업의 입찰방법은 무엇인가?,일반경쟁입찰(협상에 의한 계약),"- 본 사업의 과업의 일부를 하도급하려는 경우 ｢소프트웨어 진흥법｣ 제51조제1항에 따라 사업금액의 100분의 50을 초과할 수 없으며, 제3항에 따라 재하도급은 원칙적으로 불허함","[""4) 하도급계약 사전 승인 및 관리\n  ◦ 하도급 사전승인\n   - ｢소프트웨어 진흥법｣ 제51조 및 ｢소프트웨어사업 계약 및 관리감독에 관한 지침｣ (과학기술정보통신부고시 제2021-100호)의 규정에 의하여 반드시 하도급계약 전에 발주기관으로부터 사전승인을 받아야 함\n  ◦ 하도급 비율제한 및 재하도급 금지\n   - 본 사업의 과업의 일부를 하도급하려는 경우 ｢소프트웨어 진흥법｣ 제51조제1항에 따라 사업금액의 100분의 50을 초과할 수 없으며, 제3항에 따라 재하도급은 원칙적으로 불허함. 다만 같은 법 제51조제2항 및 제3항 각 호에 해당하는 경우 그러하지 아니함\n   - 본 사업에서 전체 사업금액 대비 10%를 초과하여 하도급이 불가하며, 이를 초과할 경우「소프트웨어 진흥법」제51조제6항 및 동법 시행령 제48조제5항에 따라 불가피한 사정이 있는 경우 그사유를 제시하여야 함.\n  ◦ 하도급 계획서 제출 요청\n   - 본 사업 과업의 일부를 하도급하려는 경우 입찰 시 및 계약체결 시 ｢소프트웨어사업 계약 및 관리감독에 관한 지침｣(과학기술정보통신부고시 제2021-100호)의 별지 제7호서식 소프트웨어사업 하도급 계획서를 제출하여야 함\n  ◦ 하도급 계약의 적정성 판단 세부기준 명시\n   - 하도급 계약의 승인을 신청하는 경우 ｢소프트웨어사업 계약 및 관리감독에 관한 지침｣(과학기술정보통신부고시 제2021-100호)에 따른 [하도급 계약의 적정성 판단 세부기준]에 따라 적정성 여부를 판단하며, 평가점수가 85점 이상인 경우에 한하여 하도급 계약을 승인함. 다만 85점 이상인 경우라 하더라도 하도급계약의 세부조건 등으로 인하여 사업의 원활한 수행이 불가능하다고 인정되는 경우 그 사유를 기재하여 하도급 승인 거절을 통보할 수 있음\n  ◦ 하도급 대금에 대한 기준은 직접인건비의 경우 한국소프트웨어산업협회장이 공표한 노임단가의 100%, 제경비와 기술료의 합은 직접인건비의 20% 이상으로 적용하여야 함\n  ◦ 원도급자가 지급하는 하도급 대금을 제안서에 포함하여"", ""출물의 반출을 요청할 수 있으며, 발주기관에서는 「보안업무규정」 제4조 및 제안요청서에 명시된 누출금지정보에 해당하지 않을 경우 SW산출물을 제공함(단 공급자는 아래 내용을 준수하여야 함)\n      - 공급자는 공급받은 SW산출물에 대하여 제안요청서, 계약서 등에 누출금지정보로 명시한 정보를 삭제하고 활용하여야 하며, 이를 확인하는 공급자 대표명의의 확약서를 발주기관에 제출하여야 함\n      - 공급자가 반출된 SW산출물을 제3자에게 제공하려는 경우 반드시 발주기관으로부터 사전승인을 받아야 함\n      - 발주기관은 공급자가 제공받은 SW산출물을 무단으로 유출하거나 누출되는 경우 및 누출금지정보를 삭제하지 않고 활용하는 경우에는 「국가계약법」제76조제1항제3호에 따라 입찰참가자격을 제한함\n   ❍ 제안요청서 및 제안서의 내용에 대한 해석상의 문제가 있거나, 기타 규정되지 않은 사항은 축산물품질평가원과 상호협의 후 결정 함\n   ❍ 본 사업의 수행에 필요한 모든 비용은 가격입찰금액에 포함시켜야 함""]",,
B_rule_single_route,1,축산물품질평가원_꿀 품질평가 전산시스템 기능개선 사업.hwp,extreme,이 사업의 입찰방법은 무엇인가?,일반경쟁입찰(협상에 의한 계약),"- 본 사업의 과업의 일부를 하도급하려는 경우 ｢소프트웨어 진흥법｣ 제51조제1항에 따라 사업금액의 100분의 50을 초과할 수 없으며, 제3항에 따라 재하도급은 원칙적으로 불허함","["" 제출하여야 함\n  ◦ 하도급은 단순물품 구매 및 설치용역 등을 포함한 원도급 금액의 50%를 초과할 수 없으며, 재하도급은 허용하지 않음\n  ◦ 하도급의 계약부터 대금지급 및 실적관리를 조달청 ‘정부계약하도급관리시스템(하도급지킴이)’을 이용하여 실행하여야 함\n 5) 공동수급(공동이행방식) 허용 여부\n  ◦ 본 사업은 공동수급(공동이행방식)을 허용하지 않음\n    ※ 용역 기간 중 이행 업체별 과업수행 능력이 상이하여 양질의 과업을 진행하기 어려울 수 있으며, 향후 발생할지 모를 하자에 대한 책임소재가 불분명해질 수 있음. \n 나. 제안서 평가방법\n  1) 기술평가와 가격평가를 실시하여 종합평가점수로 산출\n   ❍ 평가비율 : 기술평가(90%), 가격평가(10%)\n   ❍ 종합평가점수 = 기술평가점수 + 입찰가격 평가점수\n  2) 기술평가 방법 : 조달청 기술평가\n   ❍ 본 사업은 차등점수제를 적용함(세부사항은 기술성평가기준 참조)\n   ❍ 기타 평가의 방법과 결과공개 등 제반 사항은 조달청 규정에 따름\n  3) 평가일시 : \""입찰공고문\"" 참조\n  4) 우선협상대상자 선정 및 계약체결\n   ❍ 기술성 평가가 100점 만점기준으로 85점 이상인 자를 협상적격자로 선정하며, 가격평가점수와 합산하여 고득점순으로 협상순서를 결정함\n   ❍ 협상대상자 중 기술평가점수와 가격평가점수를 합한 점수가 1위인 제안사를 우선협상대상자로 선정하여 기타 지원조건 등을 협상\n   ❍ 협상대상자와 협상이 모두 결렬되면 재공고 입찰 추진\n   ❍ 기타 규정되지 않은 사항은 조달청 규정에 의함\n   ❍ 기술평가 항목 및 배점표는 <다. 기술성 평가기준> 참조\n 다. 기술성 평가기준\n  1) 정성평가(90점)"", ""4) 하도급계약 사전 승인 및 관리\n  ◦ 하도급 사전승인\n   - ｢소프트웨어 진흥법｣ 제51조 및 ｢소프트웨어사업 계약 및 관리감독에 관한 지침｣ (과학기술정보통신부고시 제2021-100호)의 규정에 의하여 반드시 하도급계약 전에 발주기관으로부터 사전승인을 받아야 함\n  ◦ 하도급 비율제한 및 재하도급 금지\n   - 본 사업의 과업의 일부를 하도급하려는 경우 ｢소프트웨어 진흥법｣ 제51조제1항에 따라 사업금액의 100분의 50을 초과할 수 없으며, 제3항에 따라 재하도급은 원칙적으로 불허함. 다만 같은 법 제51조제2항 및 제3항 각 호에 해당하는 경우 그러하지 아니함\n   - 본 사업에서 전체 사업금액 대비 10%를 초과하여 하도급이 불가하며, 이를 초과할 경우「소프트웨어 진흥법」제51조제6항 및 동법 시행령 제48조제5항에 따라 불가피한 사정이 있는 경우 그사유를 제시하여야 함.\n  ◦ 하도급 계획서 제출 요청\n   - 본 사업 과업의 일부를 하도급하려는 경우 입찰 시 및 계약체결 시 ｢소프트웨어사업 계약 및 관리감독에 관한 지침｣(과학기술정보통신부고시 제2021-100호)의 별지 제7호서식 소프트웨어사업 하도급 계획서를 제출하여야 함\n  ◦ 하도급 계약의 적정성 판단 세부기준 명시\n   - 하도급 계약의 승인을 신청하는 경우 ｢소프트웨어사업 계약 및 관리감독에 관한 지침｣(과학기술정보통신부고시 제2021-100호)에 따른 [하도급 계약의 적정성 판단 세부기준]에 따라 적정성 여부를 판단하며, 평가점수가 85점 이상인 경우에 한하여 하도급 계약을 승인함. 다만 85점 이상인 경우라 하더라도 하도급계약의 세부조건 등으로 인하여 사업의 원활한 수행이 불가능하다고 인정되는 경우 그 사유를 기재하여 하도급 승인 거절을 통보할 수 있음\n  ◦ 하도급 대금에 대한 기준은 직접인건비의 경우 한국소프트웨어산업협회장이 공표한 노임단가의 100%, 제경비와 기술료의 합은 직접인건비의 20% 이상으로 적용하여야 함\n  ◦ 원도급자가 지급하는 하도급 대금을 제안서에 포함하여"", ""[주]\n 1. 차등점수제 적용(2점)\n   - 기술력이 우수한 업체가 낙찰자로 선정이 될 수 있도록 기술평가 점수에 따라 입찰자의 순위를 정하고, 입찰자의 순위에 따른 고정점수를 부여하는 차등점수제를 적용한다.\n   - 「조달청 협상에 의한 계약 제안서평가 세부기준(조달청지침 제44호, 2022.2.11.)」제9조제10항에 따른 차등점수제를 적용하는 경우에는 [별표19]에 따라 평가점수를 산출한다. 단, 협상적격(배점한도 85%이상) 여부 판단은 차등점수가 아닌 원 기술능력평가점수를 기준으로 한다.""]",,
C_rule_multi_route,1,축산물품질평가원_꿀 품질평가 전산시스템 기능개선 사업.hwp,extreme,이 사업의 입찰방법은 무엇인가?,일반경쟁입찰(협상에 의한 계약),"- 본 사업의 과업의 일부를 하도급하려는 경우 ｢소프트웨어 진흥법｣ 제51조제1항에 따라 사업금액의 100분의 50을 초과할 수 없으며, 제3항에 따라 재하도급은 원칙적으로 불허함","["" 제출하여야 함\n  ◦ 하도급은 단순물품 구매 및 설치용역 등을 포함한 원도급 금액의 50%를 초과할 수 없으며, 재하도급은 허용하지 않음\n  ◦ 하도급의 계약부터 대금지급 및 실적관리를 조달청 ‘정부계약하도급관리시스템(하도급지킴이)’을 이용하여 실행하여야 함\n 5) 공동수급(공동이행방식) 허용 여부\n  ◦ 본 사업은 공동수급(공동이행방식)을 허용하지 않음\n    ※ 용역 기간 중 이행 업체별 과업수행 능력이 상이하여 양질의 과업을 진행하기 어려울 수 있으며, 향후 발생할지 모를 하자에 대한 책임소재가 불분명해질 수 있음. \n 나. 제안서 평가방법\n  1) 기술평가와 가격평가를 실시하여 종합평가점수로 산출\n   ❍ 평가비율 : 기술평가(90%), 가격평가(10%)\n   ❍ 종합평가점수 = 기술평가점수 + 입찰가격 평가점수\n  2) 기술평가 방법 : 조달청 기술평가\n   ❍ 본 사업은 차등점수제를 적용함(세부사항은 기술성평가기준 참조)\n   ❍ 기타 평가의 방법과 결과공개 등 제반 사항은 조달청 규정에 따름\n  3) 평가일시 : \""입찰공고문\"" 참조\n  4) 우선협상대상자 선정 및 계약체결\n   ❍ 기술성 평가가 100점 만점기준으로 85점 이상인 자를 협상적격자로 선정하며, 가격평가점수와 합산하여 고득점순으로 협상순서를 결정함\n   ❍ 협상대상자 중 기술평가점수와 가격평가점수를 합한 점수가 1위인 제안사를 우선협상대상자로 선정하여 기타 지원조건 등을 협상\n   ❍ 협상대상자와 협상이 모두 결렬되면 재공고 입찰 추진\n   ❍ 기타 규정되지 않은 사항은 조달청 규정에 의함\n   ❍ 기술평가 항목 및 배점표는 <다. 기술성 평가기준> 참조\n 다. 기술성 평가기준\n  1) 정성평가(90점)"", ""4) 하도급계약 사전 승인 및 관리\n  ◦ 하도급 사전승인\n   - ｢소프트웨어 진흥법｣ 제51조 및 ｢소프트웨어사업 계약 및 관리감독에 관한 지침｣ (과학기술정보통신부고시 제2021-100호)의 규정에 의하여 반드시 하도급계약 전에 발주기관으로부터 사전승인을 받아야 함\n  ◦ 하도급 비율제한 및 재하도급 금지\n   - 본 사업의 과업의 일부를 하도급하려는 경우 ｢소프트웨어 진흥법｣ 제51조제1항에 따라 사업금액의 100분의 50을 초과할 수 없으며, 제3항에 따라 재하도급은 원칙적으로 불허함. 다만 같은 법 제51조제2항 및 제3항 각 호에 해당하는 경우 그러하지 아니함\n   - 본 사업에서 전체 사업금액 대비 10%를 초과하여 하도급이 불가하며, 이를 초과할 경우「소프트웨어 진흥법」제51조제6항 및 동법 시행령 제48조제5항에 따라 불가피한 사정이 있는 경우 그사유를 제시하여야 함.\n  ◦ 하도급 계획서 제출 요청\n   - 본 사업 과업의 일부를 하도급하려는 경우 입찰 시 및 계약체결 시 ｢소프트웨어사업 계약 및 관리감독에 관한 지침｣(과학기술정보통신부고시 제2021-100호)의 별지 제7호서식 소프트웨어사업 하도급 계획서를 제출하여야 함\n  ◦ 하도급 계약의 적정성 판단 세부기준 명시\n   - 하도급 계약의 승인을 신청하는 경우 ｢소프트웨어사업 계약 및 관리감독에 관한 지침｣(과학기술정보통신부고시 제2021-100호)에 따른 [하도급 계약의 적정성 판단 세부기준]에 따라 적정성 여부를 판단하며, 평가점수가 85점 이상인 경우에 한하여 하도급 계약을 승인함. 다만 85점 이상인 경우라 하더라도 하도급계약의 세부조건 등으로 인하여 사업의 원활한 수행이 불가능하다고 인정되는 경우 그 사유를 기재하여 하도급 승인 거절을 통보할 수 있음\n  ◦ 하도급 대금에 대한 기준은 직접인건비의 경우 한국소프트웨어산업협회장이 공표한 노임단가의 100%, 제경비와 기술료의 합은 직접인건비의 20% 이상으로 적용하여야 함\n  ◦ 원도급자가 지급하는 하도급 대금을 제안서에 포함하여"", ""[주]\n 1. 차등점수제 적용(2점)\n   - 기술력이 우수한 업체가 낙찰자로 선정이 될 수 있도록 기술평가 점수에 따라 입찰자의 순위를 정하고, 입찰자의 순위에 따른 고정점수를 부여하는 차등점수제를 적용한다.\n   - 「조달청 협상에 의한 계약 제안서평가 세부기준(조달청지침 제44호, 2022.2.11.)」제9조제10항에 따른 차등점수제를 적용하는 경우에는 [별표19]에 따라 평가점수를 산출한다. 단, 협상적격(배점한도 85%이상) 여부 판단은 차등점수가 아닌 원 기술능력평가점수를 기준으로 한다.""]",,
A_single_pipeline,1,축산물품질평가원_축산물이력관리시스템 개선(정보화 사업).hwp,central,사업기간은 어떻게 되나요?,계약일로부터 6개월,❍ 사업자는 제안요청 내용이 제안서에 어떻게 제안되었는지 목차 및 해당 페이지를 표시하는 등 조견표(3단 비교)를 작성하여 제출하여야 한다,"[""󰊱 소프트웨어 개발보안(시큐어 코딩)관련 가이드 준수\n ❍ 기능개발 시 소프트웨어 개발보안 가이드 및 점검 시 소프트웨어 보안약점 진단가이드, ‘소프트웨어 개발보안 가이드’에 따른 소스코드 보안성 확보를 위해 착수단계에서 표준 코딩스타일 정의 및 적절한 개발절차·개발방법론, 교육계획 등의 가이드 준수방안*을 제시하여야 한다.\n    * 소스코드 보안취약성을 자체 진단하고 제거하기 위한 방안 제시 요구(진단도구, 진단 전문인력 활용, 진단환경, 진단회수, 진단·조치방안 등) \n    * ｢행정기관 및 공공기관 정보시스템 구축․운영 지침｣(행정자치부 고시) 제50조(소프트웨어 개발보안 원칙)과 제53조(보안약점 진단절차)에 따라 소프트웨어 개발보안 적용하고 소프트웨어 보안약점 기준을 사업자 준수  \n ❍ 기능개발 시 ‘모바일 대민서비스 구축 가이드’, ‘모바일 대민서비스 보안취약점 점검 가이드’, ‘모바일 전자정부서비스 앱 소스코드 가이드’준수\n    * 소스코드 보안취약성을 자체 진단하고 제거하기 위한 방안 제시 요구(진단도구, 진단 전문인력 활용, 진단환경, 진단회수, 진단·조치방안 등) \n    * ｢모바일 행정기관 및 공공기관 정보시스템 구축․운영 지침｣(행정자치부 고시) 제50조(소프트웨어 개발보안 원칙)과 제53조(보안약점 진단절차)에 따라 소프트웨어 개발보안 적용하고 소프트웨어 보안약점 기준을 사업자 준수  \n󰊲 구축시스템의 모의시험\n ❍ 구축시스템의 테스트 유형(단위 테스트, 통합 테스트, 시스템 테스트, 성능, 테스트 등)에 따른 테스트 환경, 방법, 절차 등 요구사항을 제시하여야 한다.\n ❍ 개발서버에 테스트 할 때는 테스트 샘플정보(모의 테스트 등)를 만들어서 테스트 할 수 있는 방안 제시\n󰊳 기타 조건\n ❍ 사업자는 제안요청 내용이 제안서에 어떻게 제안되었는지 목차 및 해당 페이지를 표시하는 등 조견표(3단 비교)를 작성하여 제출하여야 한다. \n ❍ 본 사업의 추진과 관련하여 제안요청서에 명시되지 않은 사항에 대해서는 최근 고지된 관련 규정 ""]",,
B_rule_single_route,1,축산물품질평가원_축산물이력관리시스템 개선(정보화 사업).hwp,central,사업기간은 어떻게 되나요?,계약일로부터 6개월,"각 세부평가항목은 최고 5등급을 기준으로 제안서별로 절대 또는 상대평가하며, 상대평가 시 우열을 가리기 어려운 경우에는 동일한 점수를 부여할 수 있다","[""[주]\n 1. 각 세부평가항목은 최고 5등급을 기준으로 제안서별로 절대 또는 상대평가하며, 상대평가 시 우열을 가리기 어려운 경우에는 동일한 점수를 부여할 수 있다.\n 2. 위 표에서 “하도급 금액 비율”이란 원도급의 총 입찰금액 대비 하도급 총금액의 비율을 말한다.\n 3. 위 표에서 “하도급 계약금액 비율”이란 하도급 할 총금액 대비 하도급 예정자와 계약할 총금액의 비율을 말한다.\n󰊲 정량평가(10점)"", ""[주]\n 1. 세부평가항목 ①~③는 중복하여 평가하며, 배점한도를 초과하여 감점하지 않는다.\n 2. 모든 세부평가항목에 해당하지 않는 경우, 해당 평가항목의 배점한도를 부여한다.\n 3. 공동수급체를 평가하는 경우 해당 사유가 있는 구성원의 출자비율 또는 분담비율에 해당하는 점수(소수점 다섯째 자리에서 반올림하여 산출)만큼 감점한다.\n 4. ①최저임금 위반 평가는 입찰공고일을 기준으로 최근 3년 이내에 최저임금법 위반으로 유죄판결이 확정되어 고용노동부 장관으로부터 통보된 사업장을 기준으로 적용한다.\n 5. ②임금체불 평가는 입찰공고일을 기준으로 고용노동부장관이 공개중인 체불사업주 명단의 사업장에 대하여 적용한다.\n 6. ③고용개선조치 미이행 평가는 입찰공고일을 기준으로 최근 2년 이내에 고용노동부장관이 공표한 적극적 고용개선조치 미이행 사업주 명단의 자료에 표시된 사업장을 기준으로 적용한다. 다만, 2017년 5월 1일 이후 공표된 자부터 적용한다."", ""󰊱 기술평가와 가격평가를 실시하여 종합평가점수로 산출\n ❍ 평가비율(100%) : 기술평가(정성80%+정량10%), 가격평가(10%)\n ❍ 종합평가점수(100점) = 기술평가 점수(90점) + 입찰가격 평가점수(10점)\n   * 기술능력 대 가격능력의 평가 배점에 관한 사항은 ｢행정기관 및 공공기관 정보시스템 구축·운영 지침｣ 제18조에 따름\n ❍ 동점 시 처리방침""]",,
C_rule_multi_route,1,축산물품질평가원_축산물이력관리시스템 개선(정보화 사업).hwp,central,사업기간은 어떻게 되나요?,계약일로부터 6개월,"각 세부평가항목은 최고 5등급을 기준으로 제안서별로 절대 또는 상대평가하며, 상대평가 시 우열을 가리기 어려운 경우에는 동일한 점수를 부여할 수 있다","[""[주]\n 1. 각 세부평가항목은 최고 5등급을 기준으로 제안서별로 절대 또는 상대평가하며, 상대평가 시 우열을 가리기 어려운 경우에는 동일한 점수를 부여할 수 있다.\n 2. 위 표에서 “하도급 금액 비율”이란 원도급의 총 입찰금액 대비 하도급 총금액의 비율을 말한다.\n 3. 위 표에서 “하도급 계약금액 비율”이란 하도급 할 총금액 대비 하도급 예정자와 계약할 총금액의 비율을 말한다.\n󰊲 정량평가(10점)"", ""[주]\n 1. 세부평가항목 ①~③는 중복하여 평가하며, 배점한도를 초과하여 감점하지 않는다.\n 2. 모든 세부평가항목에 해당하지 않는 경우, 해당 평가항목의 배점한도를 부여한다.\n 3. 공동수급체를 평가하는 경우 해당 사유가 있는 구성원의 출자비율 또는 분담비율에 해당하는 점수(소수점 다섯째 자리에서 반올림하여 산출)만큼 감점한다.\n 4. ①최저임금 위반 평가는 입찰공고일을 기준으로 최근 3년 이내에 최저임금법 위반으로 유죄판결이 확정되어 고용노동부 장관으로부터 통보된 사업장을 기준으로 적용한다.\n 5. ②임금체불 평가는 입찰공고일을 기준으로 고용노동부장관이 공개중인 체불사업주 명단의 사업장에 대하여 적용한다.\n 6. ③고용개선조치 미이행 평가는 입찰공고일을 기준으로 최근 2년 이내에 고용노동부장관이 공표한 적극적 고용개선조치 미이행 사업주 명단의 자료에 표시된 사업장을 기준으로 적용한다. 다만, 2017년 5월 1일 이후 공표된 자부터 적용한다."", ""󰊱 기술평가와 가격평가를 실시하여 종합평가점수로 산출\n ❍ 평가비율(100%) : 기술평가(정성80%+정량10%), 가격평가(10%)\n ❍ 종합평가점수(100점) = 기술평가 점수(90점) + 입찰가격 평가점수(10점)\n   * 기술능력 대 가격능력의 평가 배점에 관한 사항은 ｢행정기관 및 공공기관 정보시스템 구축·운영 지침｣ 제18조에 따름\n ❍ 동점 시 처리방침"", ""󰊲 기술평가 (축산물품질평가원 기술평가위원회 개최)\n󰊳 가격평가 방법\n ❍ 기획재정부 계약예규(협상에 의한 계약체결기준의 별표)의 평점산식에 따라 SW 사업으로 평가함\n ❍ 본 사업은 「소프트웨어 기술성 평가기준 지침」 제4조제5항에 따른 차등점수제를 미적용한 사업임\n󰊴 우선협상대상자 선정 및 계약체결\n ❍ 기술성 평가가 100점 만점기준으로 85점 이상인 자를 협상적격자로 선정하며, 가격평가점수와 합산하여 고득점순으로 협상순서를 결정함\n ❍ 협상대상자 중 기술평가점수와 가격평가점수를 합한 점수가 1위인 제안사를 우선협상대상자로 선정하여 기타 지원조건 등을 협상\n ❍ 협상대상자와 협상이 모두 결렬되면 재공고 입찰 추진\n ❍ 기타 규정되지 않은 사항은 조달청 규정에 의함\n ❍ 기술평가 항목 및 배점표는 <다. 기술평가 기준> 참조""]",,
A_single_pipeline,1,케빈랩 주식회사_평택시 강소형 스마트시티 AI 기반의 영상감시 시스템 .hwp,central,입찰방식은 무엇인가?,제한경쟁입찰,해당 정보를 찾을 수 없습니다.,[],,
B_rule_single_route,1,케빈랩 주식회사_평택시 강소형 스마트시티 AI 기반의 영상감시 시스템 .hwp,central,입찰방식은 무엇인가?,제한경쟁입찰,해당 정보를 찾을 수 없습니다.,[],,
C_rule_multi_route,1,케빈랩 주식회사_평택시 강소형 스마트시티 AI 기반의 영상감시 시스템 .hwp,central,입찰방식은 무엇인가?,제한경쟁입찰,해당 정보를 찾을 수 없습니다.,[],,
A_single_pipeline,1,파주도시관광공사_종량제봉투 판매관리 전산시스템 개선사업.hwp,extreme,이 사업의 입찰방식은 무엇인가요?,제한경쟁입찰(협상에 의한 계약),본 사업의 효율적인 추진을 위하여 제안사는 파주도시관광공사의 계약수행,"[""라. 본 사업의 효율적인 추진을 위하여 제안사는 파주도시관광공사의 계약수행 \n        과정에 계약이행 상황 등의 지도, 감독에 대해 성실히 응하여야 하며, 지적된\n        사항은 최단 시일 내에 성실히 보완하여야 함\n    마. 본 사업의 효율적인 수행을 위하여 사업수행의 전반에 대한 위험요소, 위험관리지표\n        발견 및 대응 전략 등이 포함된 위험관리 계획을 제시하여야 함\n    바. 시스템 구축 완료 이후 각 업무담당자들이 시스템을 원활히 운영할 수 있게\n        지원하여야 하며, 제안사는 업무담당자들이 시스템 오류 해결 또는 수정 요구할\n        경우 이에 응해야 하며, 시스템 개선을 요구할 경우 개선해야 함\n 3. 목표 시스템 개념도"", ""원에서 과업내용 확정 간소화 심의를 받은 사항임\n  2. 입찰참가자격\n    가. 기본요건\n      1) 본 제안 사업의 수행이 가능한 업체로서 입찰참가자격 요건을 모두 갖춘 사업자이여야 함\n      2)「지방자치단체를 당사자로 하는 계약에 관한 법률 시행령」 제13조(입찰의 참가자격) 및\n         동법 시행규칙 제14조(입찰참가가격 사전심사)에 의한 요건을 갖추고, 동법 시행령 제92조\n         (부정당업자의 입찰 참가자격 제한)규정에 따라 입찰 공고일 전일부터 개찰일까지(낙찰자는\n         계약 체결일까지) 입찰 참가자격을 제한받지 아니한 업체\n      3) 「소프트웨어 진흥법」 제58조에 의한 소프트웨어사업자(분야: 컴퓨터관련 서비스사업[업종코드: 1468])\n           으로 등록된 업체\n      4) 「중소기업제품구매촉진 및 판로지원에 관한 법률」 제9조 및 같은 법 시행령 제10조에 따른 직접생산확인증명서(세부품명: 정보시스템개발서비스, 세부품명번호: 8111159901)를 소지한 업체\n      5) 경쟁입찰 참가자격을 갖추고, 조달청 입찰참가자격 등록증을 소지한 사업자\n      6) 지방자치단체를 당사자로 하는 계약에 관한 법률」제31조 및 동법 시행령 제92조(부정당업자의 입찰참가자격\n           제한)에 해당 하지 않은 업체\n      7) 상호 출자제한기업 집단에 속하는 회사인 경우에는 입찰에 참여할 수 없으며, 계약체결일 기준으로 입찰자가 상호출자제한 집단에 속하는 회사일 경우에도 계약체결 불가(차순위자와 협상)\n      8) 중소기업 기본법 제2조에 따른 소기업 또는 소상공인 보호 및 지원에 관한 법률 제2조에\n         따른 소상공인으로서 「중소기업 범위 및 확인에 관한 규정」에 따라 발급된 중소기업\n           확인서를 소지한 업체\n    나. 대기업 참여여부 : 대기업 참여제한 사업\n      7) 본 사업은 20억미만 사업으로 「소프트웨어 진흥법」 에 의한 「중소 소프트웨어""]",,
B_rule_single_route,1,파주도시관광공사_종량제봉투 판매관리 전산시스템 개선사업.hwp,extreme,이 사업의 입찰방식은 무엇인가요?,제한경쟁입찰(협상에 의한 계약),기준 가격은 당해 사업 추정금액(예정가격을 작성한 경우에는 예정가격) 이하로서 협상대상자가,"["" 기준 가격은 당해 사업 추정금액(예정가격을 작성한 경우에는 예정가격) 이하로서 협상대상자가\n           제안한 가격으로 함\n      8) 우선 협상 선정결과는 서면으로 통보하며, 미 선정업체에 대한 통보는 생략함\n    바. 협상기간\n      ❍ 협상기간은 협상개시를 통보한 날로부터 10일 이내로 한다.\n  4. 제안서 평가항목 및 배점\n    가. 기술능력평가와 가격평가를 실시하여 종합평가점수로 평가\n      1) 평가비율 : 기술능력평가(90%), 가격평가(10%)\n      2) 종합평가점수 = 기술능력평가점수 + 입찰가격 평가점수\n      3) 기술능력평가 : 정성적 평가(70점) + 정량적 평가(20점)\n      4) 제안서 평가항목 및 배점"", ""3. 추진방안\n    가. 중소 소프트웨어사업자의 사업 참여 지원 사업\n      - 「소프트웨어 진흥법」 제48조(중소 소프트웨어사업자의 사업 참여 지원)에 따른 중소 소프트웨어사업자의 사업참여지원에 관한 지침(과학기술 정보통신부 고시 제 제2023-14호, 2023.4.24.) 준수\n    나. 기술 대 가격 비율의 조정\n      - 기술평가와 가격평가를 실시하여 종합평가점수로 평가\n        · 평가비율 : 기술평가(90%), 가격평가(10%)\n        · 종합평가점수 산출 : 평가점수 = 기술평가점수 + 입찰가격 평가점수\n           ※ 관련 지침 : 행정기관 및 공공기관 정보시스템 구축·운영 지침 제18조(평가배점)에 의해 협상에\n                          의한 계약 체결 기준 적용 [행정안전부고시 제2023-27호, 2023. 4. 13]"", ""나. 적용규정\n      1) ｢지방자치단체를 당사자로 하는 계약에 관한 법률 시행령｣ 제43조(협상에 의한 계약체결)\n      2) ｢소프트웨어 진흥법 시행령｣ 제44조(국가기관등의 소프트웨어사업 계약체결 방식)\n      3) ｢행정기관 및 공공기관 정보시스템 구축·운영 지침｣(행정안전부 고시 제2023-27호, 2023.4.13.)\n      4) ˹지방자치단체 입찰 및 계약집행기준˼(행정안전부예규 제252호, 2023. 7. 1.)\n      5) ˹지방자치단체 입찰시 낙찰자 결정기준˼(행정안전부예규 제253호, 2023. 7. 1.)\n     다. 입찰방식 : 제한경쟁입찰 \n    라. 낙찰자 결정방식 : 협상에 의한 계약 체결\n    마. 협상적격자 및 협상순위의 선정\n      1) 제안서 평가결과 기술능력 평가 점수가 기술능력 평가분야 배점한도의 85% 이상인 자를 협상적격자로\n           선정하며, 종합평가결과 협상 적격자가 없을 경우에는 재공고입찰에 부칠 수 있음\n      2) 가격제안서(입찰서)의 입찰가격이 추정가격에 부가가치세를 더한 금액(예정가격을 작성한 경우에는 예정가격)을 초과하는 자는 협상적격자에서 제외함\n      3) 종합평가 결과 점수가 동일한 제안자가 2인 이상일 경우에는 기술능력 평가점수가 높은 제안자를 선순위자로\n           하고, 기술능력 평가점수도 동일한 경우에는 추첨으로 정함\n      4) 협상내용은 협상대상자가 제안한 사업내용, 이행방법, 이행일정 등 제안서 내용을 대상으로 협상을 실시한다\n      5) 협상순서는 종합평가 점수의 고득점 순에 의하여 결정하며, 1순위 협상적격자와의 협상이 성립된 때에는 다른\n           협상 적격자와의 협상은 실시하지 않음\n      6) 우선 협상 대상자와의 협상이 성립되지 않으면 동일한 조건으로 다음 순위 협상적격자와 협상을 실시함\n           또한 모든 협상 적격자와 협상 결렬 시에는 재공고/입찰에 부칠 수 있음\n      7) 가격협상 시""]",,
C_rule_multi_route,1,파주도시관광공사_종량제봉투 판매관리 전산시스템 개선사업.hwp,extreme,이 사업의 입찰방식은 무엇인가요?,제한경쟁입찰(협상에 의한 계약),기준 가격은 당해 사업 추정금액(예정가격을 작성한 경우에는 예정가격) 이하로서 협상대상자가,"["" 기준 가격은 당해 사업 추정금액(예정가격을 작성한 경우에는 예정가격) 이하로서 협상대상자가\n           제안한 가격으로 함\n      8) 우선 협상 선정결과는 서면으로 통보하며, 미 선정업체에 대한 통보는 생략함\n    바. 협상기간\n      ❍ 협상기간은 협상개시를 통보한 날로부터 10일 이내로 한다.\n  4. 제안서 평가항목 및 배점\n    가. 기술능력평가와 가격평가를 실시하여 종합평가점수로 평가\n      1) 평가비율 : 기술능력평가(90%), 가격평가(10%)\n      2) 종합평가점수 = 기술능력평가점수 + 입찰가격 평가점수\n      3) 기술능력평가 : 정성적 평가(70점) + 정량적 평가(20점)\n      4) 제안서 평가항목 및 배점"", ""3. 추진방안\n    가. 중소 소프트웨어사업자의 사업 참여 지원 사업\n      - 「소프트웨어 진흥법」 제48조(중소 소프트웨어사업자의 사업 참여 지원)에 따른 중소 소프트웨어사업자의 사업참여지원에 관한 지침(과학기술 정보통신부 고시 제 제2023-14호, 2023.4.24.) 준수\n    나. 기술 대 가격 비율의 조정\n      - 기술평가와 가격평가를 실시하여 종합평가점수로 평가\n        · 평가비율 : 기술평가(90%), 가격평가(10%)\n        · 종합평가점수 산출 : 평가점수 = 기술평가점수 + 입찰가격 평가점수\n           ※ 관련 지침 : 행정기관 및 공공기관 정보시스템 구축·운영 지침 제18조(평가배점)에 의해 협상에\n                          의한 계약 체결 기준 적용 [행정안전부고시 제2023-27호, 2023. 4. 13]"", ""나. 적용규정\n      1) ｢지방자치단체를 당사자로 하는 계약에 관한 법률 시행령｣ 제43조(협상에 의한 계약체결)\n      2) ｢소프트웨어 진흥법 시행령｣ 제44조(국가기관등의 소프트웨어사업 계약체결 방식)\n      3) ｢행정기관 및 공공기관 정보시스템 구축·운영 지침｣(행정안전부 고시 제2023-27호, 2023.4.13.)\n      4) ˹지방자치단체 입찰 및 계약집행기준˼(행정안전부예규 제252호, 2023. 7. 1.)\n      5) ˹지방자치단체 입찰시 낙찰자 결정기준˼(행정안전부예규 제253호, 2023. 7. 1.)\n     다. 입찰방식 : 제한경쟁입찰 \n    라. 낙찰자 결정방식 : 협상에 의한 계약 체결\n    마. 협상적격자 및 협상순위의 선정\n      1) 제안서 평가결과 기술능력 평가 점수가 기술능력 평가분야 배점한도의 85% 이상인 자를 협상적격자로\n           선정하며, 종합평가결과 협상 적격자가 없을 경우에는 재공고입찰에 부칠 수 있음\n      2) 가격제안서(입찰서)의 입찰가격이 추정가격에 부가가치세를 더한 금액(예정가격을 작성한 경우에는 예정가격)을 초과하는 자는 협상적격자에서 제외함\n      3) 종합평가 결과 점수가 동일한 제안자가 2인 이상일 경우에는 기술능력 평가점수가 높은 제안자를 선순위자로\n           하고, 기술능력 평가점수도 동일한 경우에는 추첨으로 정함\n      4) 협상내용은 협상대상자가 제안한 사업내용, 이행방법, 이행일정 등 제안서 내용을 대상으로 협상을 실시한다\n      5) 협상순서는 종합평가 점수의 고득점 순에 의하여 결정하며, 1순위 협상적격자와의 협상이 성립된 때에는 다른\n           협상 적격자와의 협상은 실시하지 않음\n      6) 우선 협상 대상자와의 협상이 성립되지 않으면 동일한 조건으로 다음 순위 협상적격자와 협상을 실시함\n           또한 모든 협상 적격자와 협상 결렬 시에는 재공고/입찰에 부칠 수 있음\n      7) 가격협상 시""]",,
A_single_pipeline,1,한국가스공사_[재공고]차세대 통합정보시스템(ERP) 구축.hwp,extreme,"이 사업의 계약상 사업기간은 어떻게 되며, 사업기간 종료 후 무상하자보수 기간은 얼마인가?","사업기간은 계약일로부터 28개월이며, 사업기간 종료 후 1년간 무상하자보수를 실시한다.",○  사업기간 종료 후 1년간 무상하자보수 실시 (시스템 안정화 지원계획 제출),"[""3. 사업기간 : 계약일로부터 28개월\n ○  소프트웨어 사업수행 적정 사업기간 산정기준에 따른 사업\n ○  사업기간 종료 후 1년간 무상하자보수 실시 (시스템 안정화 지원계획 제출)"", ""2. 사업목적\n ○ 기술지원 종료(‘27년)에 대비한 ERP 업그레이드\n   - 제조사(SAP社)의 기술지원 종료 이후 세법 개정, 보안취약점 발생시 원활한 대응이 불가 등 기술지원 종료 대비한 선제적 대응으로 안정적 서비스 제공""]",,
B_rule_single_route,1,한국가스공사_[재공고]차세대 통합정보시스템(ERP) 구축.hwp,extreme,"이 사업의 계약상 사업기간은 어떻게 되며, 사업기간 종료 후 무상하자보수 기간은 얼마인가?","사업기간은 계약일로부터 28개월이며, 사업기간 종료 후 1년간 무상하자보수를 실시한다.",○  사업기간 종료 후 1년간 무상하자보수 실시 (시스템 안정화 지원계획 제출),"[""나. 하도급 비율제한\n  ○ 본 사업의 과업의 일부를 하도급하려는 경우 「소프트웨어 진흥법」제51조제1항에 따라 물품(상용소프트웨어 포함) 구매금액을 제외한 소프트웨어 사업금액의 100분의 50을 초과할 수 없으며, 같은 법 제3항에 따라 재하도급은 원칙적으로 불허한다. 다만, 같은 법 제51조 제2항 각 호 및 제3항 각 호에 해당하는 경우 그러하지 아니한다."", ""3. 사업기간 : 계약일로부터 28개월\n ○  소프트웨어 사업수행 적정 사업기간 산정기준에 따른 사업\n ○  사업기간 종료 후 1년간 무상하자보수 실시 (시스템 안정화 지원계획 제출)"", ""󰊲 업무 프로세스 개선(PI) 및 고도화 개발\n   - KOGAS 전사 업무 프로세스 표준화\n   - 표준 업무 프로세스 기반 업무 지원 시스템 기능 개선 요구사항 도출\n     * 과업지시서 기능요구사항(SFR-012∼045) 34개 과제 참조\n     * 전사 업무 프로세스 표준화 과업 수행을 통하여 최종 과제 확정\n     * SAP ERP 기능 고도화 과업은 34개 과제를 기준으로 추정가격을 산출하였음(기능점수 기준 920FP 상당). 단, 사업 진행中 최종 확정된 과제를 기준으로 개발규모(최종 기능점수)를 재산정하여 과업 변경이 필요한 경우 과업 및 그에 따른 계약 변경 예정\n   - SAP 컨버전 후 최종 확정된 업무별 시스템 기능 개선 요구사항 반영\n 󰊳 생산공급 시스템 재구축\n   - KOGAS 핵심 업무인 천연가스 생산/공급 업무 시스템 재구축\n   - 표준 업무 프로세스 기반 기능 고도화, 데이터 분석 및 활용 서비스 개발\n   - 생산/공급 현장의 실시간 운전정보에 대한 트렌드, 통계치 등 시각화 구현""]",,
C_rule_multi_route,1,한국가스공사_[재공고]차세대 통합정보시스템(ERP) 구축.hwp,extreme,"이 사업의 계약상 사업기간은 어떻게 되며, 사업기간 종료 후 무상하자보수 기간은 얼마인가?","사업기간은 계약일로부터 28개월이며, 사업기간 종료 후 1년간 무상하자보수를 실시한다.",○  사업기간 종료 후 1년간 무상하자보수 실시 (시스템 안정화 지원계획 제출),"[""나. 하도급 비율제한\n  ○ 본 사업의 과업의 일부를 하도급하려는 경우 「소프트웨어 진흥법」제51조제1항에 따라 물품(상용소프트웨어 포함) 구매금액을 제외한 소프트웨어 사업금액의 100분의 50을 초과할 수 없으며, 같은 법 제3항에 따라 재하도급은 원칙적으로 불허한다. 다만, 같은 법 제51조 제2항 각 호 및 제3항 각 호에 해당하는 경우 그러하지 아니한다."", ""3. 사업기간 : 계약일로부터 28개월\n ○  소프트웨어 사업수행 적정 사업기간 산정기준에 따른 사업\n ○  사업기간 종료 후 1년간 무상하자보수 실시 (시스템 안정화 지원계획 제출)"", ""󰊲 업무 프로세스 개선(PI) 및 고도화 개발\n   - KOGAS 전사 업무 프로세스 표준화\n   - 표준 업무 프로세스 기반 업무 지원 시스템 기능 개선 요구사항 도출\n     * 과업지시서 기능요구사항(SFR-012∼045) 34개 과제 참조\n     * 전사 업무 프로세스 표준화 과업 수행을 통하여 최종 과제 확정\n     * SAP ERP 기능 고도화 과업은 34개 과제를 기준으로 추정가격을 산출하였음(기능점수 기준 920FP 상당). 단, 사업 진행中 최종 확정된 과제를 기준으로 개발규모(최종 기능점수)를 재산정하여 과업 변경이 필요한 경우 과업 및 그에 따른 계약 변경 예정\n   - SAP 컨버전 후 최종 확정된 업무별 시스템 기능 개선 요구사항 반영\n 󰊳 생산공급 시스템 재구축\n   - KOGAS 핵심 업무인 천연가스 생산/공급 업무 시스템 재구축\n   - 표준 업무 프로세스 기반 기능 고도화, 데이터 분석 및 활용 서비스 개발\n   - 생산/공급 현장의 실시간 운전정보에 대한 트렌드, 통계치 등 시각화 구현""]",,
A_single_pipeline,1,한국건강가정진흥원_2025년 아이돌봄인력 인적성 검사 정보시스템 운영.hwp,central,이 사업의 입찰방식은 무엇인가?,제한경쟁입찰(협상에 의한 계약),"ㅇ 계약상의 사업을 수행함에 있어 부실, 조잡 또는 부당하게 하거나, 부정한 행위를 한 사업자는 향후 신규 사업의 참여에 제한을 받을 수 있음","[""ㅇ 제출된 제안서는 일체 반환하지 않으며, 본 제안과 관련된 일체의 소요비용은 입찰참가자의 부담으로 함\n ㅇ 제안내용에 대한 확인을 위하여 추가자료 요청 또는 현지실사를 할 수 있으며, 입찰참가자는 이에 응하여야 함\n ㅇ 계약상의 사업을 수행함에 있어 부실, 조잡 또는 부당하게 하거나, 부정한 행위를 한 사업자는 향후 신규 사업의 참여에 제한을 받을 수 있음\n ㅇ 본 사업의 수행에 필요한 모든 비용은 가격입찰금액에 포함시켜야 함\n ㅇ 사업추진 결과 발생한 지식재산권은 주관기관과 공동소유\n ㅇ 다만, 기여도 및 계약목적물의 특수성(보안, 영업비밀 등)을 고려하여 계약당사자간의 협의를 통해 지식재산권 귀속주체 등에 대해 공동소유와 달리 정할 수 있음. 단, 지식재산권의 타 용도 및 상업적 활용 시 반드시 주관기관과 협의하여야 함""]",,
B_rule_single_route,1,한국건강가정진흥원_2025년 아이돌봄인력 인적성 검사 정보시스템 운영.hwp,central,이 사업의 입찰방식은 무엇인가?,제한경쟁입찰(협상에 의한 계약),"ㅇ 계약상의 사업을 수행함에 있어 부실, 조잡 또는 부당하게 하거나, 부정한 행위를 한 사업자는 향후 신규 사업의 참여에 제한을 받을 수 있음","[""ㅇ 제출된 제안서는 일체 반환하지 않으며, 본 제안과 관련된 일체의 소요비용은 입찰참가자의 부담으로 함\n ㅇ 제안내용에 대한 확인을 위하여 추가자료 요청 또는 현지실사를 할 수 있으며, 입찰참가자는 이에 응하여야 함\n ㅇ 계약상의 사업을 수행함에 있어 부실, 조잡 또는 부당하게 하거나, 부정한 행위를 한 사업자는 향후 신규 사업의 참여에 제한을 받을 수 있음\n ㅇ 본 사업의 수행에 필요한 모든 비용은 가격입찰금액에 포함시켜야 함\n ㅇ 사업추진 결과 발생한 지식재산권은 주관기관과 공동소유\n ㅇ 다만, 기여도 및 계약목적물의 특수성(보안, 영업비밀 등)을 고려하여 계약당사자간의 협의를 통해 지식재산권 귀속주체 등에 대해 공동소유와 달리 정할 수 있음. 단, 지식재산권의 타 용도 및 상업적 활용 시 반드시 주관기관과 협의하여야 함""]",,
C_rule_multi_route,1,한국건강가정진흥원_2025년 아이돌봄인력 인적성 검사 정보시스템 운영.hwp,central,이 사업의 입찰방식은 무엇인가?,제한경쟁입찰(협상에 의한 계약),"ㅇ 계약상의 사업을 수행함에 있어 부실, 조잡 또는 부당하게 하거나, 부정한 행위를 한 사업자는 향후 신규 사업의 참여에 제한을 받을 수 있음","[""ㅇ 제출된 제안서는 일체 반환하지 않으며, 본 제안과 관련된 일체의 소요비용은 입찰참가자의 부담으로 함\n ㅇ 제안내용에 대한 확인을 위하여 추가자료 요청 또는 현지실사를 할 수 있으며, 입찰참가자는 이에 응하여야 함\n ㅇ 계약상의 사업을 수행함에 있어 부실, 조잡 또는 부당하게 하거나, 부정한 행위를 한 사업자는 향후 신규 사업의 참여에 제한을 받을 수 있음\n ㅇ 본 사업의 수행에 필요한 모든 비용은 가격입찰금액에 포함시켜야 함\n ㅇ 사업추진 결과 발생한 지식재산권은 주관기관과 공동소유\n ㅇ 다만, 기여도 및 계약목적물의 특수성(보안, 영업비밀 등)을 고려하여 계약당사자간의 협의를 통해 지식재산권 귀속주체 등에 대해 공동소유와 달리 정할 수 있음. 단, 지식재산권의 타 용도 및 상업적 활용 시 반드시 주관기관과 협의하여야 함""]",,
A_single_pipeline,1,한국교육과정평가원_국가교육과정정보센터(NCIC) 시스템 운영 및 개선.hwp,central,이 사업의 선정 및 계약 방식(입찰방식)은 무엇인가?,"제한경쟁 입찰, 협상에 의한 계약","❍ 선정 및 계약 방식 : 제한경쟁 입찰, 협상에 의한 계약","[""4. 사업자 선정 방안\n  ❍ 선정 및 계약 방식 : 제한경쟁 입찰, 협상에 의한 계약 \n  ❍ 평가 방법\n   ㆍ 평가 비율 : 기술평가(90%), 가격평가(10%)\n   ㆍ 우리원 관련 규정에 따라 기술평가 위원회를 구성하여 평가 실시\n   ㆍ 제안서 평가 결과 입찰가격이 해당 사업예산(예정가격을 작성한 경우에는 예정가격) 이하인 자로서 기술 능력 평가점수가 기술 능력 평가 분야 배점 한도의 85% 이상인 자를 협상적격자로 선정\n   ㆍ 우선협상대상자 선정 및 협상은 종합평가 결과의 득점자순으로 실시\n      ※ 다만, 제안서 기술 평가점수가 배점 한도의 85%미만은 협상 대상에서 제외"", ""5. 기  타\n  ❍ 제안안내서, 제안요청서, 입찰공고 및 이에 근거한 별첨 등에 명시되지 않은 사항은 국가를 당사자로 하는 계약에 관한 법률, 협상에 의한 계약체결기준 등 국가계약관련 법령을 따름\n  ❍ 본 사업의 계약목적물에 대한 지식재산권 귀속은 계약당사자간 공동으로 소유함\n  ❍ 본 사업은 소프트웨어 개발사업 적정 사업기간 산정 기준에 따른 사업임\n  ❍ 본 사업은 「소프트웨어 진흥법」 제43조, 같은 법 시행령 제35조 내지 제37조, \n    「소프트웨어사업 계약 및 관리감독에 관한 지침」 제5조, 제6조에 따라 소프트웨어사업 영향평가를 미리 실시한 사업임\n  ❍ 제안 관련 문의처\n    - 한국교육과정평가원 미래학교교육연구본부 043-931-0195\n  ❍ 입찰 관련 문의처\n    - 한국교육과정평가원 구매계약부 043-931-0685""]",,
B_rule_single_route,1,한국교육과정평가원_국가교육과정정보센터(NCIC) 시스템 운영 및 개선.hwp,central,이 사업의 선정 및 계약 방식(입찰방식)은 무엇인가?,"제한경쟁 입찰, 협상에 의한 계약","❍ 선정 및 계약 방식 : 제한경쟁 입찰, 협상에 의한 계약","[""4. 사업자 선정 방안\n  ❍ 선정 및 계약 방식 : 제한경쟁 입찰, 협상에 의한 계약 \n  ❍ 평가 방법\n   ㆍ 평가 비율 : 기술평가(90%), 가격평가(10%)\n   ㆍ 우리원 관련 규정에 따라 기술평가 위원회를 구성하여 평가 실시\n   ㆍ 제안서 평가 결과 입찰가격이 해당 사업예산(예정가격을 작성한 경우에는 예정가격) 이하인 자로서 기술 능력 평가점수가 기술 능력 평가 분야 배점 한도의 85% 이상인 자를 협상적격자로 선정\n   ㆍ 우선협상대상자 선정 및 협상은 종합평가 결과의 득점자순으로 실시\n      ※ 다만, 제안서 기술 평가점수가 배점 한도의 85%미만은 협상 대상에서 제외"", ""5. 기  타\n  ❍ 제안안내서, 제안요청서, 입찰공고 및 이에 근거한 별첨 등에 명시되지 않은 사항은 국가를 당사자로 하는 계약에 관한 법률, 협상에 의한 계약체결기준 등 국가계약관련 법령을 따름\n  ❍ 본 사업의 계약목적물에 대한 지식재산권 귀속은 계약당사자간 공동으로 소유함\n  ❍ 본 사업은 소프트웨어 개발사업 적정 사업기간 산정 기준에 따른 사업임\n  ❍ 본 사업은 「소프트웨어 진흥법」 제43조, 같은 법 시행령 제35조 내지 제37조, \n    「소프트웨어사업 계약 및 관리감독에 관한 지침」 제5조, 제6조에 따라 소프트웨어사업 영향평가를 미리 실시한 사업임\n  ❍ 제안 관련 문의처\n    - 한국교육과정평가원 미래학교교육연구본부 043-931-0195\n  ❍ 입찰 관련 문의처\n    - 한국교육과정평가원 구매계약부 043-931-0685""]",,
C_rule_multi_route,1,한국교육과정평가원_국가교육과정정보센터(NCIC) 시스템 운영 및 개선.hwp,central,이 사업의 선정 및 계약 방식(입찰방식)은 무엇인가?,"제한경쟁 입찰, 협상에 의한 계약","❍ 선정 및 계약 방식 : 제한경쟁 입찰, 협상에 의한 계약","[""4. 사업자 선정 방안\n  ❍ 선정 및 계약 방식 : 제한경쟁 입찰, 협상에 의한 계약 \n  ❍ 평가 방법\n   ㆍ 평가 비율 : 기술평가(90%), 가격평가(10%)\n   ㆍ 우리원 관련 규정에 따라 기술평가 위원회를 구성하여 평가 실시\n   ㆍ 제안서 평가 결과 입찰가격이 해당 사업예산(예정가격을 작성한 경우에는 예정가격) 이하인 자로서 기술 능력 평가점수가 기술 능력 평가 분야 배점 한도의 85% 이상인 자를 협상적격자로 선정\n   ㆍ 우선협상대상자 선정 및 협상은 종합평가 결과의 득점자순으로 실시\n      ※ 다만, 제안서 기술 평가점수가 배점 한도의 85%미만은 협상 대상에서 제외"", ""5. 기  타\n  ❍ 제안안내서, 제안요청서, 입찰공고 및 이에 근거한 별첨 등에 명시되지 않은 사항은 국가를 당사자로 하는 계약에 관한 법률, 협상에 의한 계약체결기준 등 국가계약관련 법령을 따름\n  ❍ 본 사업의 계약목적물에 대한 지식재산권 귀속은 계약당사자간 공동으로 소유함\n  ❍ 본 사업은 소프트웨어 개발사업 적정 사업기간 산정 기준에 따른 사업임\n  ❍ 본 사업은 「소프트웨어 진흥법」 제43조, 같은 법 시행령 제35조 내지 제37조, \n    「소프트웨어사업 계약 및 관리감독에 관한 지침」 제5조, 제6조에 따라 소프트웨어사업 영향평가를 미리 실시한 사업임\n  ❍ 제안 관련 문의처\n    - 한국교육과정평가원 미래학교교육연구본부 043-931-0195\n  ❍ 입찰 관련 문의처\n    - 한국교육과정평가원 구매계약부 043-931-0685""]",,
A_single_pipeline,1,한국농수산식품유통공사_농산물가격안정기금 정부예산회계연계시스템 .hwp,central,사업기간은 어떻게 명시되어 있나요?,계약일로부터 7개월,□ 제안서 작성 시에는 본 사업을 위하여 각 단위업무별로「무엇을 할 것인가」와 「이것을 하기 위해서 어떻게 할 것인가」에 대하여 상세히 설명,"[""④ 기타서류\n     - 입찰공고문에서 정하는 입찰참가자격 확인서류 등 일체의 서류\n □ 제안서의 각 페이지는 쉽게 참조할 수 있도록 페이지 하단 중앙에 일련번호를 붙이며, 각 장별로 번호를 부여하고 제안서와 제안요청서의 요구 항목 비교를 위해 조견표를 제시해야 함\n □ 제안서는 한글 또는 파워포인트 포맷 형태로의 작성이 원칙이며, 사용된 영문약어에 대해서는 약어표를 제공하여야 함\n □ 기술적인 설명자료, 제안서의 내용을 객관적으로 입증할 수 있는 관련 자료는 제안서의 `별첨'으로 제출하여야 함\n □ 소프트웨어사업 이행실적 확인서는 한국소프트웨어산업협회에서 발급한 확인서를 기본으로 하되, 부득이한 경우에는 발주자가 확인한 것으로 함\n □ 제안서 작성 시에는 본 사업을 위하여 각 단위업무별로「무엇을 할 것인가」와 「이것을 하기 위해서 어떻게 할 것인가」에 대하여 상세히 설명\n □ 제안은 반드시 제안요청서의 요구사항을 모두 충족하여야 하며, 제안내용이 이를 충족하지 못하다고 판단될 경우 평가대상에서 제외함\n □ 제안서는 제안서 작성요령에 따라 작성하고 필요시 추가할 수 있으며, 우리 공사가 요청하지 않는 한 수정, 추가, 대체할 수 없음\n □ 제안내용은 꼭 필요한 사항 위주로 명료하게 작성하여야 하며,  「가능하다」,「동의한다」,「가능하다고 본다」,「할 수도 있다」, 「고려하고 있다」등의 표현은 평가에서 불가능한 것으로 간주함\n □ 제안서의 모든 내용은 객관적으로 입증할 수 있어야 하고, 제안내용의 근거자료 및 참고자료 등을 첨부하여야 하며 그 내용이 허위로 확인될 경우 평가대상에서 제외함\n □ 본 용역과 관련하여 제출된 제안서 및 관련자료는 일체 반환하지 않으며, 제안요청서, 입찰유의서, 계약조건 등을 숙지한 후 입찰에 참여 필요\n □ 제안내용의 전부 또는 일부에 대하여 담합한 사실이 발견되거나  담합하였다고 판단되는 경우 제안을 무효로 함 \n □ 계약 후에도 제안서의 내용이 허위로 작성한 사실이 발견되거나 제안된 내용을 충족시키지 못할 경우 계약은 해지되며, ""]",,
B_rule_single_route,1,한국농수산식품유통공사_농산물가격안정기금 정부예산회계연계시스템 .hwp,central,사업기간은 어떻게 명시되어 있나요?,계약일로부터 7개월,□ 제안서 평가(기술평가),"[""□ 제안서 평가(기술평가)\n  ◦ 평가위원 구성 : 관련분야 내‧외부 전문가 8명(내부 50% 이하)\n   - 사업분야 전문가 평가가 필요하여 자체 기술평가 추진\n  ◦ 평가점수 산정 : 평가위원별 합산점수 중 최고‧최저점을 제외한 평균점수 적용\n   - 단, 최저 또는 최고 점수가 2개 이상일 때에는 이 중 하나만 제외\n   - 평가점수 평균점수 산출 시 소수점 다섯째 자리에서 반올림\n  ◦ 평가방법 : 업체별 제안서 PT 발표 및 평가\n  ◦ 제안서 평가항목 및 배점"", ""* 등급별 평점이 소수점 이하의 숫자가 있는 경우 소수점 다섯째자리에서 반올림 함\n[주]\n 1.「신용정보의 이용 및 보호에 관한 법률」 제4조제1항제1호 또는「자본시장과 금융투자업에 관한 법률」 제335조의3에 따라 업무를 영위하는 신용조회사 또는 신용평가사가 입찰공고일 이전에 평가하고 유효기간 내에 있는 회사채, 기업어음 및 기업신용평가등급으로 평가하되, 가장 최근의 신용평가등급으로 평가한다. 다만, 가장 최근의 신용평가등급이 다수가 있으며 그 결과가 서로 다른 경우에는 가장 낮은 등급으로 평가\n 2. 국가종합전자조달시스템에서 신용평가등급 확인서가 확인되지 않은 경우, 정량 제안서에 포함하여 제출하여야 하고, 미 제출시에는 최저등급으로 평가. 단, 유효기간 만료일이 입찰공고일인 경우에도 유효한 것으로 평가\n 3. 합병한 자에 대하여는 합병 후 새로운 신용평가등급으로 심사하여야 하며 합병 후 새로운 신용평가등급이 없는 경우에는 합병대상자 중 가장 낮은 신용평가등급을 받은 자의 신용평가등급으로 심사\n 4. 추정가격이 고시금액 미만인 입찰에서 입찰공고일을 기준으로 최근 7년 이내에 사업을 개시한 창업기업에 대해서는 신용평가등급 점수상의 배점 한도를 부여한다. 이 경우 창업기업에 대한 기간계산은 법인인 경우 법인등기부상 법인설립등기일, 개인사업자인 경우 사업자 등록증명서상 사업자등록일 기준(이하 창업기업에 대한 기간계산 같음)\n 5. 공동수급의 경우 업체신용평가등급 평가점수에 출자(구성)비율(금액기준) 곱한 후 합산한다\n    (예) (A사 점수×A사 출자(구성)비율) + (B사 점수×B사 출자(구성)비율)··· \n \n   - 상생협력 : 5점[가점] ※정량평가 배점(5점) 한도내에서 최대 5점 반영"", ""3. 협상적격자 선정 및 협상순서\n □ 제안서 평가결과 기술능력평가(90%) 점수가 85% 이상인 자를 대상으로 입찰가격평가(10%)점수를 합산하여 고득점 순으로 협상순위 결정\n  ◦ 합산점수가 동일한 경우 : 기술능력 평가점수가 높은 자에 우선순위 부여\n  ◦ 기술능력 평가점수도 동일한 경우 : 세부평가항목 중 배점이 큰 항목에서 높은 점수를 얻은 자에게 우선순위 부여\n  ◦ 협상이 성립된 때에는 다른 협상적격자와의 협상은 실시하지 않음\n □ 모든 협상적격자와 협상 결렬 시 재공고 입찰에 부칠 수 있음\n □ 협상대상자가 제안한 사업내용, 이행방법, 이행일정, 제안가격 등 제안서의 내용을 대상으로 협상 실시\n □ 협상대상자와 협상을 통해 그 내용의 일부를 조정 가능""]",,
C_rule_multi_route,1,한국농수산식품유통공사_농산물가격안정기금 정부예산회계연계시스템 .hwp,central,사업기간은 어떻게 명시되어 있나요?,계약일로부터 7개월,□ 제안서 평가(기술평가),"[""□ 제안서 평가(기술평가)\n  ◦ 평가위원 구성 : 관련분야 내‧외부 전문가 8명(내부 50% 이하)\n   - 사업분야 전문가 평가가 필요하여 자체 기술평가 추진\n  ◦ 평가점수 산정 : 평가위원별 합산점수 중 최고‧최저점을 제외한 평균점수 적용\n   - 단, 최저 또는 최고 점수가 2개 이상일 때에는 이 중 하나만 제외\n   - 평가점수 평균점수 산출 시 소수점 다섯째 자리에서 반올림\n  ◦ 평가방법 : 업체별 제안서 PT 발표 및 평가\n  ◦ 제안서 평가항목 및 배점"", ""* 등급별 평점이 소수점 이하의 숫자가 있는 경우 소수점 다섯째자리에서 반올림 함\n[주]\n 1.「신용정보의 이용 및 보호에 관한 법률」 제4조제1항제1호 또는「자본시장과 금융투자업에 관한 법률」 제335조의3에 따라 업무를 영위하는 신용조회사 또는 신용평가사가 입찰공고일 이전에 평가하고 유효기간 내에 있는 회사채, 기업어음 및 기업신용평가등급으로 평가하되, 가장 최근의 신용평가등급으로 평가한다. 다만, 가장 최근의 신용평가등급이 다수가 있으며 그 결과가 서로 다른 경우에는 가장 낮은 등급으로 평가\n 2. 국가종합전자조달시스템에서 신용평가등급 확인서가 확인되지 않은 경우, 정량 제안서에 포함하여 제출하여야 하고, 미 제출시에는 최저등급으로 평가. 단, 유효기간 만료일이 입찰공고일인 경우에도 유효한 것으로 평가\n 3. 합병한 자에 대하여는 합병 후 새로운 신용평가등급으로 심사하여야 하며 합병 후 새로운 신용평가등급이 없는 경우에는 합병대상자 중 가장 낮은 신용평가등급을 받은 자의 신용평가등급으로 심사\n 4. 추정가격이 고시금액 미만인 입찰에서 입찰공고일을 기준으로 최근 7년 이내에 사업을 개시한 창업기업에 대해서는 신용평가등급 점수상의 배점 한도를 부여한다. 이 경우 창업기업에 대한 기간계산은 법인인 경우 법인등기부상 법인설립등기일, 개인사업자인 경우 사업자 등록증명서상 사업자등록일 기준(이하 창업기업에 대한 기간계산 같음)\n 5. 공동수급의 경우 업체신용평가등급 평가점수에 출자(구성)비율(금액기준) 곱한 후 합산한다\n    (예) (A사 점수×A사 출자(구성)비율) + (B사 점수×B사 출자(구성)비율)··· \n \n   - 상생협력 : 5점[가점] ※정량평가 배점(5점) 한도내에서 최대 5점 반영"", ""3. 협상적격자 선정 및 협상순서\n □ 제안서 평가결과 기술능력평가(90%) 점수가 85% 이상인 자를 대상으로 입찰가격평가(10%)점수를 합산하여 고득점 순으로 협상순위 결정\n  ◦ 합산점수가 동일한 경우 : 기술능력 평가점수가 높은 자에 우선순위 부여\n  ◦ 기술능력 평가점수도 동일한 경우 : 세부평가항목 중 배점이 큰 항목에서 높은 점수를 얻은 자에게 우선순위 부여\n  ◦ 협상이 성립된 때에는 다른 협상적격자와의 협상은 실시하지 않음\n □ 모든 협상적격자와 협상 결렬 시 재공고 입찰에 부칠 수 있음\n □ 협상대상자가 제안한 사업내용, 이행방법, 이행일정, 제안가격 등 제안서의 내용을 대상으로 협상 실시\n □ 협상대상자와 협상을 통해 그 내용의 일부를 조정 가능"", ""◦ 본 사업은 20억원 미만 사업으로 「소프트웨어 진흥법」 제48조(중소 소프트웨어사업자의 사업참여 지원) 및 중소 소프트웨어사업자의 사업 참여 지원에 관한 지침 제2조, 제3조에 따라 대기업 및 중견기업인 소프트웨어 사업자의 입찰 참여 제한(소프트웨어사업자 일반 현황 관리확인서 상의 ‘공공 소프트웨어사업 입찰참여 제한금액: 없음’으로 확인)\n    - 총사업금액 20억원 미만인 사업으로 중소 소프트웨어사업자(소프트웨어사업자 일반 현황 관리확인서 상의 ‘공공 소프트웨어사업 입찰참여 제한금액: 없음’으로 확인)만 입찰참가 가능\n  ◦「중소기업기본법」제2조에 따른 중‧소기업자 및「소상공인 보호 및 지원에 관한 법률」제2조에 따른 소상공인으로서 `중소기업범위 및 확인에 관한 규정'에 따라 발급된 <중‧소기업‧소상공인 확인서>를 소지한 자\n  ◦「중소기업자 간 경쟁제품에 대한 직접생산 확인 기준」에 의거 직접생산확인증명서(입찰마감일 전일까지 전산업무(소프트웨어개발) 분야의 `정보시스템개발서비스(8111159901)'에 대해 발행된 것으로 유효기간 내에 있어야 함)를 소지한 업체\n □ 「국가를 당사자로 하는 계약에 관한 법률」제27조 1항 및 「동법 시행령」제76조에 의한 부정당업체로 지정되지 않은 업체\n □ 단독 또는 공동수급이 가능하고, 공동 수급 시에는 공동수급협정서를 작성하여 제안서 제출 시 첨부해야 하고, 당사자 간의 책임, 권리, 의무관계를 명백히 규정하여야 함\n  ◦ 공동수급업체 구성원은「국가를 당사자로 하는 계약에 관한 법률 시행령」제12조 및 「동법 시행규칙」 제14조 규정에 저촉되지 않아야 함, 공동이행 방식 또는 분담이행 방식을 고려하여 제안\n  ◦ 공동수급업체는 5개 이하로 구성하며, 구성원별 계약참여 최소지분율은 10% 이상이어야 함""]",,
A_single_pipeline,1,한국농어촌공사_네팔 수자원관리 정보화사업-Pilot 시스템 구축용역.hwp,central,사업예산,"금181,913,000원(VAT 포함)","사업예산 : 금181,913,000원(VAT 포함)","[""1. 과업개요\n  \n<그림>\n 용 역 명 : 네팔 수자원관리 정보화사업 Pilot 시스템 구축\n  \n<그림>\n 용역기간 : 용역착수일로부터 6개월\n  \n<그림>\n 사업예산 : 금181,913,000원(VAT 포함)\n2. 추진배경 및 필요성\n  \n<그림>\n (자동계측체계) 이기종 자료 수집·관리를 위한 자동계측체계 시연\n  \n<그림>\n (사업확장) 통합물관리기술의 확대 적용 기회 마련\n  \n<그림>\n (기술역량강화) 네팔 정부의 물관리 및 ICT 기술역량강화\n3. 사업 내용\n   GIS 기반 Pilot 시스템 구축\n   계측장비의 데이터 수집 및 기간데이터 표출 구현\n   모바일 기반 자료입력 모듈 구현\n   Pilot 시스템 구축을 위한 현장 계측기기(HW) 설치\n4. 사업의 목적\n  \n<그림>\n 다양한 자동계측기기와 ICT 기술도입으로 실시간 물관리 현황 및 분석 체계 시연 및 데이터 기반의 과학적 물관리 기술전수를 통한 네팔 정부의 통합물관리기술 본격 도입을 위한 현실성 구현\n5. 사업의 범위\n  \n<그림>\n GIS 시스템 구축 및 자동계측기기를 이용하여 수집된 자료 표출\n  \n<그림>\n 시스템 구축 범위는 ①자동계측기기 설치, ②GIS 기반 Pilot 시스템 구축, ③수집자료 표출 및 관리로 구성됨 \n6. 기대효과\n  \n<그림>\n 한국의 물관리 기술전수를 통한 국가 위상 상승 및 국가 간 협력관계 도모\n  \n<그림>\n 네팔 수자원관개청(Department of Water Resources and Irrigation, DWRI)에서 운영 중인 관개관리정보시스템(Nepal Irrigation Management Information System, NIMIS) 기능 및 자료제공 확대\n  \n<그림>\n GIS 기반 농업용수 공급 자료 수집 및 분석을 통한 효과적으로 기후변화 여건에 대응 \n  \n<그림>\n 다양한 ICT 기술을 접목한 계측장비 및 모바일 자료입력 시스템 시연을 통하여 네팔 정부 기술역량 강화"", ""3. 협상 적격자 선정 및 협상방법\n  \n<그림>\n 협상 적격자 선정 및 협상순위 결정\n     기술평가 점수가 기술평가분야 배점한도의 85% 이상인 자를 대상으로 함\n     협상순서는 협상적격자의 기술능력평가 점수와 입찰가격평가 점수를 합산하여 합산점수의 고득점 순에 따라 결정함\n     합산점수가 동일한 제안자 2인 이상일 경우에는 기술능력 평가 점수가 높은 제안자를 선순위자로 하고, 기술평가 점수도 동일한 경우에는 기술능력의 세부평가항목 중 배점이 큰 항목에서 높은 점수를 얻은 자를 선순위자로 함\n  \n<그림>\n 협상 절차 및 방법\n     협상순위에 따라 결정된 우선협상대상자와 협상하며, 협상이 성립된 때에는 다른 협상대상자와 협상을 하지 않음. 우선협상대상자와 협상 결렬 시, 동일한 기준·절차에 따라 순차적으로 차(次) 순위자와 협상을 시행함. 모든 협상대상자와 협상이 결렬된 경우에는 재공고 입찰이 가능함\n     협상대상자가 제안한 사업내용, 이행방법, 이행일정 등 제안서의 내용을 대상으로 협상을 실시함. 협상대상자가 제안한 이행과업내용, 이행일정 등의 내용을 대상으로 일부수정‧보완‧변경‧추가‧삭제하여 그 내용의 일부를 협상 조정 가능함\n     협상대상자가 제안한 내용을 가감하는 경우에는 그 가감되는 내용에 상당하는 금액을 당해 사업예산(또는 예정가격) 범위 내에서 조정 가능함\n     제안요청 시 포함되지 않았으나 발주기관의 협상요구에 의하여 증가되는 사업범위에 대해서는 해당 원가 추가 반영 가능함\n4. 제안서 등의 제출\n  \n<그림>\n 제안서 제출 및 등록서류 : “입찰공고문”에 의함\n  \n<그림>\n 제안요청 설명회\n     본 사업은 제안요청 설명회를 실시하지 않으며 입찰 참가 자격과 관련이 없음\n  \n<그림>\n 제안설명회 개최\n     제안설명회는 코로나19로 인한 사회적 거리두기 등 외부요인으로 인해 대면평가를 비대면평가로 대체할 수 있으며, 제안설명회 세부 일시 및 장소 등은 추후 수요기관에서 별도 통보\n     제안""]",,
B_rule_single_route,1,한국농어촌공사_네팔 수자원관리 정보화사업-Pilot 시스템 구축용역.hwp,central,사업예산,"금181,913,000원(VAT 포함)", 협상대상자가 제안한 내용을 가감하는 경우에는 그 가감되는 내용에 상당하는 금액을 당해 사업예산(또는 예정가격) 범위 내에서 조정 가능함,"[""3. 협상 적격자 선정 및 협상방법\n  \n<그림>\n 협상 적격자 선정 및 협상순위 결정\n     기술평가 점수가 기술평가분야 배점한도의 85% 이상인 자를 대상으로 함\n     협상순서는 협상적격자의 기술능력평가 점수와 입찰가격평가 점수를 합산하여 합산점수의 고득점 순에 따라 결정함\n     합산점수가 동일한 제안자 2인 이상일 경우에는 기술능력 평가 점수가 높은 제안자를 선순위자로 하고, 기술평가 점수도 동일한 경우에는 기술능력의 세부평가항목 중 배점이 큰 항목에서 높은 점수를 얻은 자를 선순위자로 함\n  \n<그림>\n 협상 절차 및 방법\n     협상순위에 따라 결정된 우선협상대상자와 협상하며, 협상이 성립된 때에는 다른 협상대상자와 협상을 하지 않음. 우선협상대상자와 협상 결렬 시, 동일한 기준·절차에 따라 순차적으로 차(次) 순위자와 협상을 시행함. 모든 협상대상자와 협상이 결렬된 경우에는 재공고 입찰이 가능함\n     협상대상자가 제안한 사업내용, 이행방법, 이행일정 등 제안서의 내용을 대상으로 협상을 실시함. 협상대상자가 제안한 이행과업내용, 이행일정 등의 내용을 대상으로 일부수정‧보완‧변경‧추가‧삭제하여 그 내용의 일부를 협상 조정 가능함\n     협상대상자가 제안한 내용을 가감하는 경우에는 그 가감되는 내용에 상당하는 금액을 당해 사업예산(또는 예정가격) 범위 내에서 조정 가능함\n     제안요청 시 포함되지 않았으나 발주기관의 협상요구에 의하여 증가되는 사업범위에 대해서는 해당 원가 추가 반영 가능함\n4. 제안서 등의 제출\n  \n<그림>\n 제안서 제출 및 등록서류 : “입찰공고문”에 의함\n  \n<그림>\n 제안요청 설명회\n     본 사업은 제안요청 설명회를 실시하지 않으며 입찰 참가 자격과 관련이 없음\n  \n<그림>\n 제안설명회 개최\n     제안설명회는 코로나19로 인한 사회적 거리두기 등 외부요인으로 인해 대면평가를 비대면평가로 대체할 수 있으며, 제안설명회 세부 일시 및 장소 등은 추후 수요기관에서 별도 통보\n     제안"", ""진계획을 수립하여 용역수행계획서를 발주사에 제출하여야 함\n     과제 수행 완료 후 사업 용역대행사의 사업수행 평가 결과가 불량일 경우 향후 본 사업 참여에 제한을 받을 수 있음\n     낙찰자로 결정된 이후 본 사업의 전부를 하청 또는 재하청을 할 수 없음\n  \n<그림>\n 입찰의 무효\n     국가를 당사자로 하는 계약에 관한 법률 시행령 제12조(경쟁입찰의 참가자격) 및 시행규칙 제14조(입찰참가자격요건의 증명) 규정, 용역입찰유의서 제12조에 저촉될 경우 입찰은 무효로 함\n  \n<그림>\n 하자담보\n     본 사업의 하자담보책임기간 및 하자보수보증금률은 「국가계약법」 제18조(하자보수보증금), 「정보통신공사법」 제37조(공사의 하자담보책임」, 「소프트웨어 진흥법」 제60조(소프트웨어사업의 하자담보책임)에 의거 1년에 2%를 적용한다.\n     그 외의 사항은 「(계약예규) 용역계약일반조건」 제58조(하자보수 등)를 따른다.\n  \n<그림>\n 기 타\n     본 입찰에 참가하는 자는 발주사 청렴계약 입찰특별유의서 제2조(입찰참가업체의 청렴계약 이행각서 제출) 제1항에 의거 청렴계약이행각서를 제출한 것으로 간주하며, 최종 낙찰자로 선정된 기업은 대표자가 날인하여 계약 체결 시 제출하여야 함\n     본 사업의 작업 장소는 원활한 사업수행을 위해 발주기관과 협의하여 결정함\n     본 사업은 20억원 미만의 SW사업으로 제안서 보상 대상사업에서 제외\n     향후 정보화사업 보안성 검토 내용을 준수하여야 함\n  \n<그림>\n 작업장소 상호 협의 등\n     작업장소 상호 협의\n      - SW사업 수행을 위해 필요한 작업장소 등은 사업예산 내 계상되어 있으므로 관련 비용을 포함하여 제안가격을 산출하되, 작업장소 등(장소, 설비, 기타 작업환경)은 한국농어촌공사(이하 “공사”)와 상호 협의하여 결정함 \n     원격지 개발 장소 제시 검토 절차\n      - 공급자는 작업장소 상호협의 시 제안요청서 내 명시된 보안요구사항을 준수한 작업장소를 "", ""1. 과업개요\n  \n<그림>\n 용 역 명 : 네팔 수자원관리 정보화사업 Pilot 시스템 구축\n  \n<그림>\n 용역기간 : 용역착수일로부터 6개월\n  \n<그림>\n 사업예산 : 금181,913,000원(VAT 포함)\n2. 추진배경 및 필요성\n  \n<그림>\n (자동계측체계) 이기종 자료 수집·관리를 위한 자동계측체계 시연\n  \n<그림>\n (사업확장) 통합물관리기술의 확대 적용 기회 마련\n  \n<그림>\n (기술역량강화) 네팔 정부의 물관리 및 ICT 기술역량강화\n3. 사업 내용\n   GIS 기반 Pilot 시스템 구축\n   계측장비의 데이터 수집 및 기간데이터 표출 구현\n   모바일 기반 자료입력 모듈 구현\n   Pilot 시스템 구축을 위한 현장 계측기기(HW) 설치\n4. 사업의 목적\n  \n<그림>\n 다양한 자동계측기기와 ICT 기술도입으로 실시간 물관리 현황 및 분석 체계 시연 및 데이터 기반의 과학적 물관리 기술전수를 통한 네팔 정부의 통합물관리기술 본격 도입을 위한 현실성 구현\n5. 사업의 범위\n  \n<그림>\n GIS 시스템 구축 및 자동계측기기를 이용하여 수집된 자료 표출\n  \n<그림>\n 시스템 구축 범위는 ①자동계측기기 설치, ②GIS 기반 Pilot 시스템 구축, ③수집자료 표출 및 관리로 구성됨 \n6. 기대효과\n  \n<그림>\n 한국의 물관리 기술전수를 통한 국가 위상 상승 및 국가 간 협력관계 도모\n  \n<그림>\n 네팔 수자원관개청(Department of Water Resources and Irrigation, DWRI)에서 운영 중인 관개관리정보시스템(Nepal Irrigation Management Information System, NIMIS) 기능 및 자료제공 확대\n  \n<그림>\n GIS 기반 농업용수 공급 자료 수집 및 분석을 통한 효과적으로 기후변화 여건에 대응 \n  \n<그림>\n 다양한 ICT 기술을 접목한 계측장비 및 모바일 자료입력 시스템 시연을 통하여 네팔 정부 기술역량 강화""]",,
C_rule_multi_route,1,한국농어촌공사_네팔 수자원관리 정보화사업-Pilot 시스템 구축용역.hwp,central,사업예산,"금181,913,000원(VAT 포함)", 협상대상자가 제안한 내용을 가감하는 경우에는 그 가감되는 내용에 상당하는 금액을 당해 사업예산(또는 예정가격) 범위 내에서 조정 가능함,"[""3. 협상 적격자 선정 및 협상방법\n  \n<그림>\n 협상 적격자 선정 및 협상순위 결정\n     기술평가 점수가 기술평가분야 배점한도의 85% 이상인 자를 대상으로 함\n     협상순서는 협상적격자의 기술능력평가 점수와 입찰가격평가 점수를 합산하여 합산점수의 고득점 순에 따라 결정함\n     합산점수가 동일한 제안자 2인 이상일 경우에는 기술능력 평가 점수가 높은 제안자를 선순위자로 하고, 기술평가 점수도 동일한 경우에는 기술능력의 세부평가항목 중 배점이 큰 항목에서 높은 점수를 얻은 자를 선순위자로 함\n  \n<그림>\n 협상 절차 및 방법\n     협상순위에 따라 결정된 우선협상대상자와 협상하며, 협상이 성립된 때에는 다른 협상대상자와 협상을 하지 않음. 우선협상대상자와 협상 결렬 시, 동일한 기준·절차에 따라 순차적으로 차(次) 순위자와 협상을 시행함. 모든 협상대상자와 협상이 결렬된 경우에는 재공고 입찰이 가능함\n     협상대상자가 제안한 사업내용, 이행방법, 이행일정 등 제안서의 내용을 대상으로 협상을 실시함. 협상대상자가 제안한 이행과업내용, 이행일정 등의 내용을 대상으로 일부수정‧보완‧변경‧추가‧삭제하여 그 내용의 일부를 협상 조정 가능함\n     협상대상자가 제안한 내용을 가감하는 경우에는 그 가감되는 내용에 상당하는 금액을 당해 사업예산(또는 예정가격) 범위 내에서 조정 가능함\n     제안요청 시 포함되지 않았으나 발주기관의 협상요구에 의하여 증가되는 사업범위에 대해서는 해당 원가 추가 반영 가능함\n4. 제안서 등의 제출\n  \n<그림>\n 제안서 제출 및 등록서류 : “입찰공고문”에 의함\n  \n<그림>\n 제안요청 설명회\n     본 사업은 제안요청 설명회를 실시하지 않으며 입찰 참가 자격과 관련이 없음\n  \n<그림>\n 제안설명회 개최\n     제안설명회는 코로나19로 인한 사회적 거리두기 등 외부요인으로 인해 대면평가를 비대면평가로 대체할 수 있으며, 제안설명회 세부 일시 및 장소 등은 추후 수요기관에서 별도 통보\n     제안"", ""진계획을 수립하여 용역수행계획서를 발주사에 제출하여야 함\n     과제 수행 완료 후 사업 용역대행사의 사업수행 평가 결과가 불량일 경우 향후 본 사업 참여에 제한을 받을 수 있음\n     낙찰자로 결정된 이후 본 사업의 전부를 하청 또는 재하청을 할 수 없음\n  \n<그림>\n 입찰의 무효\n     국가를 당사자로 하는 계약에 관한 법률 시행령 제12조(경쟁입찰의 참가자격) 및 시행규칙 제14조(입찰참가자격요건의 증명) 규정, 용역입찰유의서 제12조에 저촉될 경우 입찰은 무효로 함\n  \n<그림>\n 하자담보\n     본 사업의 하자담보책임기간 및 하자보수보증금률은 「국가계약법」 제18조(하자보수보증금), 「정보통신공사법」 제37조(공사의 하자담보책임」, 「소프트웨어 진흥법」 제60조(소프트웨어사업의 하자담보책임)에 의거 1년에 2%를 적용한다.\n     그 외의 사항은 「(계약예규) 용역계약일반조건」 제58조(하자보수 등)를 따른다.\n  \n<그림>\n 기 타\n     본 입찰에 참가하는 자는 발주사 청렴계약 입찰특별유의서 제2조(입찰참가업체의 청렴계약 이행각서 제출) 제1항에 의거 청렴계약이행각서를 제출한 것으로 간주하며, 최종 낙찰자로 선정된 기업은 대표자가 날인하여 계약 체결 시 제출하여야 함\n     본 사업의 작업 장소는 원활한 사업수행을 위해 발주기관과 협의하여 결정함\n     본 사업은 20억원 미만의 SW사업으로 제안서 보상 대상사업에서 제외\n     향후 정보화사업 보안성 검토 내용을 준수하여야 함\n  \n<그림>\n 작업장소 상호 협의 등\n     작업장소 상호 협의\n      - SW사업 수행을 위해 필요한 작업장소 등은 사업예산 내 계상되어 있으므로 관련 비용을 포함하여 제안가격을 산출하되, 작업장소 등(장소, 설비, 기타 작업환경)은 한국농어촌공사(이하 “공사”)와 상호 협의하여 결정함 \n     원격지 개발 장소 제시 검토 절차\n      - 공급자는 작업장소 상호협의 시 제안요청서 내 명시된 보안요구사항을 준수한 작업장소를 "", ""1. 과업개요\n  \n<그림>\n 용 역 명 : 네팔 수자원관리 정보화사업 Pilot 시스템 구축\n  \n<그림>\n 용역기간 : 용역착수일로부터 6개월\n  \n<그림>\n 사업예산 : 금181,913,000원(VAT 포함)\n2. 추진배경 및 필요성\n  \n<그림>\n (자동계측체계) 이기종 자료 수집·관리를 위한 자동계측체계 시연\n  \n<그림>\n (사업확장) 통합물관리기술의 확대 적용 기회 마련\n  \n<그림>\n (기술역량강화) 네팔 정부의 물관리 및 ICT 기술역량강화\n3. 사업 내용\n   GIS 기반 Pilot 시스템 구축\n   계측장비의 데이터 수집 및 기간데이터 표출 구현\n   모바일 기반 자료입력 모듈 구현\n   Pilot 시스템 구축을 위한 현장 계측기기(HW) 설치\n4. 사업의 목적\n  \n<그림>\n 다양한 자동계측기기와 ICT 기술도입으로 실시간 물관리 현황 및 분석 체계 시연 및 데이터 기반의 과학적 물관리 기술전수를 통한 네팔 정부의 통합물관리기술 본격 도입을 위한 현실성 구현\n5. 사업의 범위\n  \n<그림>\n GIS 시스템 구축 및 자동계측기기를 이용하여 수집된 자료 표출\n  \n<그림>\n 시스템 구축 범위는 ①자동계측기기 설치, ②GIS 기반 Pilot 시스템 구축, ③수집자료 표출 및 관리로 구성됨 \n6. 기대효과\n  \n<그림>\n 한국의 물관리 기술전수를 통한 국가 위상 상승 및 국가 간 협력관계 도모\n  \n<그림>\n 네팔 수자원관개청(Department of Water Resources and Irrigation, DWRI)에서 운영 중인 관개관리정보시스템(Nepal Irrigation Management Information System, NIMIS) 기능 및 자료제공 확대\n  \n<그림>\n GIS 기반 농업용수 공급 자료 수집 및 분석을 통한 효과적으로 기후변화 여건에 대응 \n  \n<그림>\n 다양한 ICT 기술을 접목한 계측장비 및 모바일 자료입력 시스템 시연을 통하여 네팔 정부 기술역량 강화"", ""※ 등급별 평점이 소수점 이하의 숫자가 있는 경우 소수점 다섯째자리에서 반올림 함\n    ※ 신용평가등급은 「신용정보의 이용 및 보호에 관한 법률」제4조제4항 제1호 또는 제4호의 업무를 영위하는 신용정보업자가 심사기준일 이전에 평가한 유효기간 내에 있는 회사채, 기업어음, 기업신용평가등급을 기준으로『조달청신용평가등급조회시스템』또는『중소기업제품 공공구매정보망』에 따라 조회된 신용평가등급으로 평가하되 가장 최근의 신용평가등급으로 평가한다.\n    ※ 국가종합전자조달시스템에서 신용평가등급 확인서가 확인되지 않은 경우 에는 최저등급으로 평가하며, 유효기간 만료일이 입찰공고일인 경우에도 유효한 것으로 평가한다.\n    ※ 합병한 자에 대하여는 합병 후 새로운 신용평가등급으로 심사하여야 하며, 합병 후의 새로운 신용평가등급이 없는 경우에는 합병대상자 중 가장 낮은 신용평가등급을 받은 자의 신용평가등급으로 심사한다.\n    ※ 공동수급체의 경우 구성원별 해당 점수에 지분율을 곱한 후 그 점수들을 합산하여 최종 평가하고, 평가결과 소수점 이하의 숫자가 있는 경우 소수점 다섯째짜리에서 반올림 한다.\n       [예] (A사 점수×A사 지분율)+(B사 점수×B사 지분율)…\n  \n<그림>\n 정성 평가기준\n     각 평가항목은 기술제안서별로 평가하며, 상대평가 시 우열을 가리기 어려운 경우에는 동일한 점수를 부여할 수 있다\n     평가 항목별 최고점과 최저점의 차이가 해당항목 배점한도의 15%를 초과하지 않는 범위 내에서 차등 평가한다. 다만, 기술능력의 차이 등 사유가 있는 경우에는 20%를 초과하지 않는 범위 내에서 평가할 수 있으며, 기술능력의 현격한 차이 등 특별한 사유가 있는 경우에는 20%를 초과하여 평가할 수 있다. 20%를 초과 평가하는 경우에는 평가사유서에 그 사유를 구체적으로 명시하여야 한다.\n     평가기준\n      - 비계량 평가항목별로 6등급으로 평가, 평가위원의 항목별 채점 점수를 산술평균한 점수로 산정한다.\n \n<표>""]",,
A_single_pipeline,1,한국농어촌공사_아세안+3 식량안보정보시스템(AFSIS) 3단계 협력(캄보디아.hwp,central,사업명은 무엇입니까?,아세안+3 식량안보정보시스템 3단계 협력사업(캄보디아),사업명은 '아세안+3 식량안보정보시스템 3단계 협력사업(캄보디아)'입니다.,,,
B_rule_single_route,1,한국농어촌공사_아세안+3 식량안보정보시스템(AFSIS) 3단계 협력(캄보디아.hwp,central,사업명은 무엇입니까?,아세안+3 식량안보정보시스템 3단계 협력사업(캄보디아),사업명은 '아세안+3 식량안보정보시스템 3단계 협력사업(캄보디아)'입니다.,,,
C_rule_multi_route,1,한국농어촌공사_아세안+3 식량안보정보시스템(AFSIS) 3단계 협력(캄보디아.hwp,central,사업명은 무엇입니까?,아세안+3 식량안보정보시스템 3단계 협력사업(캄보디아),사업명은 '아세안+3 식량안보정보시스템 3단계 협력사업(캄보디아)'입니다.,,,
A_single_pipeline,1,한국로봇산업진흥원_한국로봇산업진흥원 사업관리시스템 온라인평가 .hwp,central,사업기간은 어떻게 명시되어 있나요?,계약체결일로부터 165일이내(5.5개월),해당 정보를 찾을 수 없습니다.,[],,
B_rule_single_route,1,한국로봇산업진흥원_한국로봇산업진흥원 사업관리시스템 온라인평가 .hwp,central,사업기간은 어떻게 명시되어 있나요?,계약체결일로부터 165일이내(5.5개월),해당 정보를 찾을 수 없습니다.,[],,
C_rule_multi_route,1,한국로봇산업진흥원_한국로봇산업진흥원 사업관리시스템 온라인평가 .hwp,central,사업기간은 어떻게 명시되어 있나요?,계약체결일로부터 165일이내(5.5개월),해당 정보를 찾을 수 없습니다.,[],,
A_single_pipeline,1,한국발명진흥회 입찰공고_2024년 건설기술에 관한 특허·실용신안 활용실.hwp,central,이 사업의 과업기간은 얼마입니까?,계약체결일로부터 120일,(1) 제안대상 사업의 수행이 가능한 업체로서 아래의 요건을 갖춘 업체,"[""(1) 제안대상 사업의 수행이 가능한 업체로서 아래의 요건을 갖춘 업체\n  -｢국가를 당사자로 하는 계약에 관한 법률 시행령｣ 제12조 및 동법 시행규칙 제14조의 규정에 의한 입찰참가 자격을 갖춘 자\n  - 「국가를 당사자로 하는 계약에 관한 법률 시행령」 제43조 규정에 의한 협상절차를 거쳐 계약함이 타당하다고 인정되는 업체\n  - 국가종합전자조달시스템 입찰참가자격등록규정에 의하여 반드시 나라장터(G2B)에 입찰마감일 전일까지 입찰참가자격을 등록한 자\n  -｢소프트웨어 진흥법｣ 제2조제4호에 의한 소프트웨어사업자 [나라장터 업종코드 1468(컴퓨터관련 서비스사업)]\n  -「중소기업제품 구매촉진 및 판로지원에 관한 법률」 제9조 및 같은 법 시행령 제10조에 의한 직접생산 확인증명서 [세부품명 : 정보시스템개발서비스, 세부품명번호 : 8111159901]를 소지한 자"", ""o 기술평가는 소프트웨어기술성평가기준을 기준으로, 본 사업의 특성 및 내용 등을 고려하여 평가항목, 항목별 배점한도를 조정""]",,
B_rule_single_route,1,한국발명진흥회 입찰공고_2024년 건설기술에 관한 특허·실용신안 활용실.hwp,central,이 사업의 과업기간은 얼마입니까?,계약체결일로부터 120일,"o 기술평가는 소프트웨어기술성평가기준을 기준으로, 본 사업의 특성 및 내용 등을 고려하여 평가항목, 항목별 배점한도를 조정","[""o 기술평가는 소프트웨어기술성평가기준을 기준으로, 본 사업의 특성 및 내용 등을 고려하여 평가항목, 항목별 배점한도를 조정"", ""o 동점시 처리방안\n     - 종합평가점수가 동점인 경우 기술평가 점수가 높은 업체를 선정\n     - 기술평가점수도 동일한 경우 배점이 높은 평가항목에서 점수가 높은 업체 선정"", ""o 효율적인 업무처리 지원을 위한 기능 구축\n   - 신청/심사 프로세스 간소화 및 자료 업/다운로드 편의성 제공\n   - 심사 진행 단계 및 처리(수수료 납부, 의견제출통지서 통보, 심사결과 등)에 대한 고객 자동알림 기능(e-mail, 알림톡 등)\n   - 시스템에서 각 심사 건별 의견제출통지서 작성 및 확인 기능 제공\n   - 최종 승인에 대한 내부결재자 결재 기능 제공\n   - 시스템 상에서 ‘최종승인문서’ 작성 및 e-mail 발송 기능 제공\n   - 심사위원별 심사의뢰건 배분 및 심사진행 관리 기능 제공\n   - 관리자 추가 및 권한 부여 기능 제공\n   - 고객 만족도 향상을 위해 사용자용 시스템에 FAQ 기능 제공\n  o DB 개선 및 검색창 추가를 통한 실적 조회 및 통계 추출 기능 구축\n   - 관리자 시스템의 필요한 데이터 추출을 위한 검색창 기능\n   - 기간별 수수료의 구분(심사수수료, 등록수수료, 증명서 발급수수료)에 따른 데이터(기업명, 금액, 건수 등) 검색 및 통계 추출 기능""]",,
C_rule_multi_route,1,한국발명진흥회 입찰공고_2024년 건설기술에 관한 특허·실용신안 활용실.hwp,central,이 사업의 과업기간은 얼마입니까?,계약체결일로부터 120일,"o 기술평가는 소프트웨어기술성평가기준을 기준으로, 본 사업의 특성 및 내용 등을 고려하여 평가항목, 항목별 배점한도를 조정","[""o 기술평가는 소프트웨어기술성평가기준을 기준으로, 본 사업의 특성 및 내용 등을 고려하여 평가항목, 항목별 배점한도를 조정"", ""o 동점시 처리방안\n     - 종합평가점수가 동점인 경우 기술평가 점수가 높은 업체를 선정\n     - 기술평가점수도 동일한 경우 배점이 높은 평가항목에서 점수가 높은 업체 선정"", ""o 효율적인 업무처리 지원을 위한 기능 구축\n   - 신청/심사 프로세스 간소화 및 자료 업/다운로드 편의성 제공\n   - 심사 진행 단계 및 처리(수수료 납부, 의견제출통지서 통보, 심사결과 등)에 대한 고객 자동알림 기능(e-mail, 알림톡 등)\n   - 시스템에서 각 심사 건별 의견제출통지서 작성 및 확인 기능 제공\n   - 최종 승인에 대한 내부결재자 결재 기능 제공\n   - 시스템 상에서 ‘최종승인문서’ 작성 및 e-mail 발송 기능 제공\n   - 심사위원별 심사의뢰건 배분 및 심사진행 관리 기능 제공\n   - 관리자 추가 및 권한 부여 기능 제공\n   - 고객 만족도 향상을 위해 사용자용 시스템에 FAQ 기능 제공\n  o DB 개선 및 검색창 추가를 통한 실적 조회 및 통계 추출 기능 구축\n   - 관리자 시스템의 필요한 데이터 추출을 위한 검색창 기능\n   - 기간별 수수료의 구분(심사수수료, 등록수수료, 증명서 발급수수료)에 따른 데이터(기업명, 금액, 건수 등) 검색 및 통계 추출 기능"", ""o DB 개선 및 검색창 추가를 통한 실적 조회 및 통계 추출 기능 구축\n   - 시스템 상에서 관리자의 필요한 데이터 추출을 위한 검색창 기능\n     ※ 건설기술에 관한 특허·실용신안 활용실적 승인건 DB의 분류(기술분야, 등록번호, 기간(연/월), 기업, 실적구분, 유효상태(유효/만료), 특허명, 심사단계, 발주처, 활용현장(지역), 수수료 납부(심사수수료, 등록수수료, 증명서 발급수수료), 심사장기불응건의 심사단계)별 데이터 검색 및 결과(Excel) 다운로드 기능\n   - 기간별 수수료의 구분(심사수수료, 등록수수료, 증명서 발급수수료)에 따른 데이터(기업명, 금액, 건수 등) 검색 및 통계 추출 기능""]",,
A_single_pipeline,1,한국보건산업진흥원_의료기기산업 종합정보시스템(정보관리기관) 기능.hwp,central,입찰방식은 무엇인가?,제한경쟁(긴급입찰),해당 정보를 찾을 수 없습니다.,[],,
B_rule_single_route,1,한국보건산업진흥원_의료기기산업 종합정보시스템(정보관리기관) 기능.hwp,central,입찰방식은 무엇인가?,제한경쟁(긴급입찰),"* 세부평가항목 ①~②는 중복하여 평가하며, 배점한도를 초과하여 감점하지 않는다","[""* 세부평가항목 ①~②는 중복하여 평가하며, 배점한도를 초과하여 감점하지 않는다.\n  * 모든 세부평가항목에 해당하지 않는 경우, 해당 평가항목의 배점한도를 부여한다.\n  * 공동수급체를 평가하는 경우 해당 사유가 있는 구성원의 출자비율 또는 분담비율에 해당하는 점수(소수점 다섯째 자리에서 반올림하여 산출)만큼 감점한다.\n  * 중소기업협동조합이 입찰에 참여하는 경우 해당 사유가 있는 조합원의 출자비율 또는 분담비율에 해당하는 점수(소수점 다섯째 자리에서 반올림하여 산출)만큼 감점한다.\n  * ① 임금체불 평가는 입찰공고일을 기준으로 고용노동부장관이 공개중인 체불사업주 명단의 사업장에 대하여 적용한다.\n  * ② 고용개선조치 미이행 평가는 입찰공고일을 기준으로 최근 2년 이내에 고용노동부장관이 공표한 적극적 고용개선조치 미이행 사업주 명단의 자료에 표시된 사업장을 기준으로 적용한다. 다만, 2017년 5월 1일 이후 공표된 자부터 적용한다.\n<별첨 1>"", ""* 「신용정보의 이용 및 보호에 관한 법률」제2조 제8의3에 해당하는 신용조회사  또는「자본시장과 금융투자업에 관한 법률」제335조의3에 따라 업무를 영위하는 신용평가사가 입찰공고일 이전에 평가하고 유효기간 내에 있는 회사채, 기업어음 및 기업신용평가등급을 국가종합전자조달시스템에 조회된 신용평가등급으로 평가하되, 가장 최근의 신용평가등급으로 평가한다. 다만, 가장 최근의 신용평가등급이 다수가 있으며 그 결과가 서로 다른 경우에는 가장 낮은 등급으로 평가한다.\n  * 국가종합전자조달시스템에서 신용평가등급 확인서가 확인되지 않은 경우에는 최저등급으로 평가하며, 유효기간 시작일 또는 만료일이 입찰공고일인 경우에도 유효한 것으로 평가한다. 다만, 입찰공고일 다음날 이후에 발생 또는 수정된 자료는 평가에서 제외한다.\n  * 주 1에도 불구하고, 합병 또는 분할한 자가 입찰공고일 이전에 평가한 신용평가등급이 없는 경우에는 입찰서 제출 마감일 전일까지 발급된 유효기간 내에 있는 가장 최근의 신용평가등급으로 평가한다. 다만, 합병 후 새로운 신용평가등급이 없는 경우에는 입찰공고일 이전에 평가하고 유효기간 내에 있는 신용평가등급으로서 합병 대상자 중 가장 낮은 신용평가등급을 받은 자의 신용평가등급으로 평가한다.\n  * 추정가격이 고시금액 미만인 입찰에서 입찰공고일을 기준으로 최근 7년 이내에 사업을 개시한 창업기업에 대해서는 신용평가등급 점수상의 배점 한도를 부여한다. 이 경우 창업기업에 대한 확인은 「중소기업제품공공구매 종합정보망」에 등재된 자료로 확인하며, 창업기업확인서의 유효기간 내에 있어야 한다. 다만, 제안서 평가일 전일까지 발급된 자료도 심사에 포함하며, 이 경우 입찰공고일 이전 창업을 확인 할 수 있는 자료(법인인 경우 법인등기부상 법인설립등기일, 개인사업자인 경우에는 사업자등록증명서 상 사업자등록일)를 제출하여야 한다.(이하 창업기업에 대한 확인방법은 같다)\n  * 공동수급체의 경우 구성원별 해당 점수에 지분율을 곱한 후 그 점수들을 합산하여 최종 평가하고, 평"", ""○ 평가방식 : 각 평가위원의 평가점수 중 최고점수 1개, 최저점수 1개를 제외한 나머지 점수를 합산 후 평균을(소수점 다섯째 자리 반올림) 내어 획득점수를 산출하며, 배점 한도의 85% 미만은 협상대상에서 제외""]",,
C_rule_multi_route,1,한국보건산업진흥원_의료기기산업 종합정보시스템(정보관리기관) 기능.hwp,central,입찰방식은 무엇인가?,제한경쟁(긴급입찰),"* 세부평가항목 ①~②는 중복하여 평가하며, 배점한도를 초과하여 감점하지 않는다","[""* 세부평가항목 ①~②는 중복하여 평가하며, 배점한도를 초과하여 감점하지 않는다.\n  * 모든 세부평가항목에 해당하지 않는 경우, 해당 평가항목의 배점한도를 부여한다.\n  * 공동수급체를 평가하는 경우 해당 사유가 있는 구성원의 출자비율 또는 분담비율에 해당하는 점수(소수점 다섯째 자리에서 반올림하여 산출)만큼 감점한다.\n  * 중소기업협동조합이 입찰에 참여하는 경우 해당 사유가 있는 조합원의 출자비율 또는 분담비율에 해당하는 점수(소수점 다섯째 자리에서 반올림하여 산출)만큼 감점한다.\n  * ① 임금체불 평가는 입찰공고일을 기준으로 고용노동부장관이 공개중인 체불사업주 명단의 사업장에 대하여 적용한다.\n  * ② 고용개선조치 미이행 평가는 입찰공고일을 기준으로 최근 2년 이내에 고용노동부장관이 공표한 적극적 고용개선조치 미이행 사업주 명단의 자료에 표시된 사업장을 기준으로 적용한다. 다만, 2017년 5월 1일 이후 공표된 자부터 적용한다.\n<별첨 1>"", ""* 「신용정보의 이용 및 보호에 관한 법률」제2조 제8의3에 해당하는 신용조회사  또는「자본시장과 금융투자업에 관한 법률」제335조의3에 따라 업무를 영위하는 신용평가사가 입찰공고일 이전에 평가하고 유효기간 내에 있는 회사채, 기업어음 및 기업신용평가등급을 국가종합전자조달시스템에 조회된 신용평가등급으로 평가하되, 가장 최근의 신용평가등급으로 평가한다. 다만, 가장 최근의 신용평가등급이 다수가 있으며 그 결과가 서로 다른 경우에는 가장 낮은 등급으로 평가한다.\n  * 국가종합전자조달시스템에서 신용평가등급 확인서가 확인되지 않은 경우에는 최저등급으로 평가하며, 유효기간 시작일 또는 만료일이 입찰공고일인 경우에도 유효한 것으로 평가한다. 다만, 입찰공고일 다음날 이후에 발생 또는 수정된 자료는 평가에서 제외한다.\n  * 주 1에도 불구하고, 합병 또는 분할한 자가 입찰공고일 이전에 평가한 신용평가등급이 없는 경우에는 입찰서 제출 마감일 전일까지 발급된 유효기간 내에 있는 가장 최근의 신용평가등급으로 평가한다. 다만, 합병 후 새로운 신용평가등급이 없는 경우에는 입찰공고일 이전에 평가하고 유효기간 내에 있는 신용평가등급으로서 합병 대상자 중 가장 낮은 신용평가등급을 받은 자의 신용평가등급으로 평가한다.\n  * 추정가격이 고시금액 미만인 입찰에서 입찰공고일을 기준으로 최근 7년 이내에 사업을 개시한 창업기업에 대해서는 신용평가등급 점수상의 배점 한도를 부여한다. 이 경우 창업기업에 대한 확인은 「중소기업제품공공구매 종합정보망」에 등재된 자료로 확인하며, 창업기업확인서의 유효기간 내에 있어야 한다. 다만, 제안서 평가일 전일까지 발급된 자료도 심사에 포함하며, 이 경우 입찰공고일 이전 창업을 확인 할 수 있는 자료(법인인 경우 법인등기부상 법인설립등기일, 개인사업자인 경우에는 사업자등록증명서 상 사업자등록일)를 제출하여야 한다.(이하 창업기업에 대한 확인방법은 같다)\n  * 공동수급체의 경우 구성원별 해당 점수에 지분율을 곱한 후 그 점수들을 합산하여 최종 평가하고, 평"", ""○ 평가방식 : 각 평가위원의 평가점수 중 최고점수 1개, 최저점수 1개를 제외한 나머지 점수를 합산 후 평균을(소수점 다섯째 자리 반올림) 내어 획득점수를 산출하며, 배점 한도의 85% 미만은 협상대상에서 제외"", ""- 합산점수가 동일한 제안사가 2인 이상인 경우에는 기술능력 평가점수가 높은 제안자 우선순위자, 기술능력 평가점수도 동일한 경우에는 기술능력의 세부평가항목 중 배점이 큰 항목에서 높은 점수를 얻은 자를 우선 순위자로 함\n \n  ○ 위원구성 :「행정기관 및 공공기관 정보시스템 구축운영지침 제30조 2항」(행정안전부고시)를 준수하여 위원장을 포함한 7인 이상 및 외부전문가 2/3 이상 구성""]",,
A_single_pipeline,1,한국보육진흥원_연차별 자율 품질관리 시스템 기능개선.hwp,central,사업기간은 어떻게 명시되어 있습니까?,계약체결일로부터 4개월(120일),해당 정보를 찾을 수 없습니다.,[],,
B_rule_single_route,1,한국보육진흥원_연차별 자율 품질관리 시스템 기능개선.hwp,central,사업기간은 어떻게 명시되어 있습니까?,계약체결일로부터 4개월(120일),사업자 선정방법 : 종합평가점수,"[""다. 사업자 선정방법 : 종합평가점수\n ❍ (평가비율) 기술평가 90%, 가격평가 10%\n ❍ (종합평가점수 산출) 기술 평가점수 + 입찰가격 평가점수\n   - 동점 시 처리방법\n    ㆍ 종합평가점수가 동점인 경우 기술평가 점수가 높은 업체를 선정\n    ㆍ 기술평가점수도 동일한 경우 ‘기술 및 기능’항목 점수가 높은 업체 선정\n   - 평가점수에서 소수점 이하가 있는 경우 소수점 5자리에서 반올림\n     ※ 협상에 의한 계약 제안서평가 세부기준 제12조(평가점수 산출)의 소수점 처리 기준 동일 적용 \n ❍ 기술평가\n   - 기술평가는 수요기관에서 오프라인 심사로 진행\n   - 관련분야 내‧외부 전문가 5인 이상으로 평가위원회를 구성하여 평가 실시\n   - 각 항목별 평가배점과 방법은「기술제안서 평가항목 및 배점한도」에 의함\n   - 각 평가위원이 평가한 점수 중 최고점수와 최저점수를 제외한 나머지 점수를 산술평균한 점수를 90점 만점으로 하며, 기술능력평가 분야 배점한도의 85% 이상인 자를 협상적격자로 선정\n    ㆍ 최고 또는 최저점수가 2개 이상 동점일 경우 하나만 제외\n    ㆍ 평점산식에 의한 계산결과 소수점 이하의 숫자가 있는 경우에는 소수점 셋째자리에서 반올림함 \n ❍ (가격평가) 「협상에 의한 계약 체결기준」에 따름\n ❍ 기술능력 및 입찰가격 평가점수에 대한 종합평가(기술능력 90%, 가격평가 10%)를 거쳐 고득점 순위로 우선협상 대상자 선정\n     ※ 「국가를 당사자로 하는 계약에 관한 법률 시행령」제43조(협상에 의한 계약체결), 「협상에 의한 계약체결기준」제7조(제안서의 평가)\n ❍ 평가결과 공개 등은 기획재정부 계약예규 「협상에 의한 계약체결기준」제7조에 따름"", ""[주]\n 1.「신용정보의 이용 및 보호에 관한 법률」제2조 제8의3에 해당하는 신용조회사 또는「자본시장과 금융투자업에 관한 법률」제335조의3에 따라 업무를 영위하는 신용평가사가 입찰공고일 이전에 평가하고 유효기간 내에 있는 회사채, 기업어음 및 기업신용평가등급을 국가종합전자조달시스템에 조회된 신용평가등급으로 평가하되, 가장 최근의 신용평가등급으로 평가한다. 다만, 가장 최근의 신용평가등급이 다수가 있으며 그 결과가 서로 다른 경우에는 가장 낮은 등급으로 평가한다.\n 2. 국가종합전자조달시스템에서 신용평가등급 확인서가 확인되지 않은 경우에는 최저등급으로 평가하며, 유효기간 시작일 또는 만료일이 입찰공고일인 경우에도 유효한 것으로 평가한다. 다만, 입찰공고일 다음날 이후에 발생 또는 수정된 자료는 평가에서 제외한다.\n 3. 주 1에도 불구하고, 합병 또는 분할한 자가 입찰공고일 이전에 평가한 신용평가등급이 없는 경우에는 입찰서 제출 마감일 전일까지 발급된 유효기간 내에 있는 가장 최근의 신용평가등급으로 평가한다. 다만, 합병 후 새로운 신용평가등급이 없는 경우에는 입찰공고일 이전에 평가하고 유효기간 내에 있는 신용평가등급으로서 합병 대상자 중 가장 낮은 신용평가등급을 받은 자의 신용평가등급으로 평가한다.\n 4. 추정가격이 고시금액 미만인 입찰에서 입찰공고일을 기준으로 최근 7년 이내에 사업을 개시한 창업기업에 대해서는 신용평가등급 점수상의 배점 한도를 부여한다. 이 경우 창업기업에 대한 확인은 「중소기업제품공공구매 종합정보망」에 등재된 자료로 확인하며, 창업기업확인서의 유효기간 내에 있어야 한다. 다만, 제안서 평가일 전일까지 발급된 자료도 심사에 포함하며, 이 경우 입찰공고일 이전 창업을 확인 할 수 있는 자료(법인인 경우 법인등기부상 법인설립등기일, 개인사업자인 경우에는 사업자등록증명서 상 사업자등록일)를 제출하여야 한다.(이하 창업기업에 대한 확인방법은 같다)\n 5. 공동수급체의 경우 구성원별 해당 점수에 지분율을 곱한 후 그 점수들을 합산하여 최종 평가하"", ""□ 사 업 명 : 연차별 자율 품질관리 시스템 기능개선\n □ 사업기간 : 계약체결일로부터 ~ 4개월(120일)\n □ 사업예산 : 금75,000,000원(금칠천오백만원정, VAT포함)\n □ 입찰방법 : 제한경쟁, 협상에 의한 계약""]",,
C_rule_multi_route,1,한국보육진흥원_연차별 자율 품질관리 시스템 기능개선.hwp,central,사업기간은 어떻게 명시되어 있습니까?,계약체결일로부터 4개월(120일),사업자 선정방법 : 종합평가점수,"[""다. 사업자 선정방법 : 종합평가점수\n ❍ (평가비율) 기술평가 90%, 가격평가 10%\n ❍ (종합평가점수 산출) 기술 평가점수 + 입찰가격 평가점수\n   - 동점 시 처리방법\n    ㆍ 종합평가점수가 동점인 경우 기술평가 점수가 높은 업체를 선정\n    ㆍ 기술평가점수도 동일한 경우 ‘기술 및 기능’항목 점수가 높은 업체 선정\n   - 평가점수에서 소수점 이하가 있는 경우 소수점 5자리에서 반올림\n     ※ 협상에 의한 계약 제안서평가 세부기준 제12조(평가점수 산출)의 소수점 처리 기준 동일 적용 \n ❍ 기술평가\n   - 기술평가는 수요기관에서 오프라인 심사로 진행\n   - 관련분야 내‧외부 전문가 5인 이상으로 평가위원회를 구성하여 평가 실시\n   - 각 항목별 평가배점과 방법은「기술제안서 평가항목 및 배점한도」에 의함\n   - 각 평가위원이 평가한 점수 중 최고점수와 최저점수를 제외한 나머지 점수를 산술평균한 점수를 90점 만점으로 하며, 기술능력평가 분야 배점한도의 85% 이상인 자를 협상적격자로 선정\n    ㆍ 최고 또는 최저점수가 2개 이상 동점일 경우 하나만 제외\n    ㆍ 평점산식에 의한 계산결과 소수점 이하의 숫자가 있는 경우에는 소수점 셋째자리에서 반올림함 \n ❍ (가격평가) 「협상에 의한 계약 체결기준」에 따름\n ❍ 기술능력 및 입찰가격 평가점수에 대한 종합평가(기술능력 90%, 가격평가 10%)를 거쳐 고득점 순위로 우선협상 대상자 선정\n     ※ 「국가를 당사자로 하는 계약에 관한 법률 시행령」제43조(협상에 의한 계약체결), 「협상에 의한 계약체결기준」제7조(제안서의 평가)\n ❍ 평가결과 공개 등은 기획재정부 계약예규 「협상에 의한 계약체결기준」제7조에 따름"", ""[주]\n 1.「신용정보의 이용 및 보호에 관한 법률」제2조 제8의3에 해당하는 신용조회사 또는「자본시장과 금융투자업에 관한 법률」제335조의3에 따라 업무를 영위하는 신용평가사가 입찰공고일 이전에 평가하고 유효기간 내에 있는 회사채, 기업어음 및 기업신용평가등급을 국가종합전자조달시스템에 조회된 신용평가등급으로 평가하되, 가장 최근의 신용평가등급으로 평가한다. 다만, 가장 최근의 신용평가등급이 다수가 있으며 그 결과가 서로 다른 경우에는 가장 낮은 등급으로 평가한다.\n 2. 국가종합전자조달시스템에서 신용평가등급 확인서가 확인되지 않은 경우에는 최저등급으로 평가하며, 유효기간 시작일 또는 만료일이 입찰공고일인 경우에도 유효한 것으로 평가한다. 다만, 입찰공고일 다음날 이후에 발생 또는 수정된 자료는 평가에서 제외한다.\n 3. 주 1에도 불구하고, 합병 또는 분할한 자가 입찰공고일 이전에 평가한 신용평가등급이 없는 경우에는 입찰서 제출 마감일 전일까지 발급된 유효기간 내에 있는 가장 최근의 신용평가등급으로 평가한다. 다만, 합병 후 새로운 신용평가등급이 없는 경우에는 입찰공고일 이전에 평가하고 유효기간 내에 있는 신용평가등급으로서 합병 대상자 중 가장 낮은 신용평가등급을 받은 자의 신용평가등급으로 평가한다.\n 4. 추정가격이 고시금액 미만인 입찰에서 입찰공고일을 기준으로 최근 7년 이내에 사업을 개시한 창업기업에 대해서는 신용평가등급 점수상의 배점 한도를 부여한다. 이 경우 창업기업에 대한 확인은 「중소기업제품공공구매 종합정보망」에 등재된 자료로 확인하며, 창업기업확인서의 유효기간 내에 있어야 한다. 다만, 제안서 평가일 전일까지 발급된 자료도 심사에 포함하며, 이 경우 입찰공고일 이전 창업을 확인 할 수 있는 자료(법인인 경우 법인등기부상 법인설립등기일, 개인사업자인 경우에는 사업자등록증명서 상 사업자등록일)를 제출하여야 한다.(이하 창업기업에 대한 확인방법은 같다)\n 5. 공동수급체의 경우 구성원별 해당 점수에 지분율을 곱한 후 그 점수들을 합산하여 최종 평가하"", ""□ 사 업 명 : 연차별 자율 품질관리 시스템 기능개선\n □ 사업기간 : 계약체결일로부터 ~ 4개월(120일)\n □ 사업예산 : 금75,000,000원(금칠천오백만원정, VAT포함)\n □ 입찰방법 : 제한경쟁, 협상에 의한 계약"", ""나. 입찰참가자격 : 입찰공고문에 따름\n ❍ 「국가를 당사자로 하는 계약에 관한 법률 시행령」 제12조 및 동법 시행규칙 제14조 규정에 의한 경쟁입찰 참가자격을 갖추어야 하며, 조달청 입찰참가자격등록증 소지업체이여야 함\n ❍ 소프트웨어 진흥법 제58조의 규정에 의한 소프트웨어사업자[컴퓨터관련서비스사업(업종코드:1468)]면허를 보유한 업체\n ❍ 「중소기업제품 구매촉진 및 판로지원에 관한 법률」제9조 및 같은 법 시행령 제10조에 의한 직접생산확인증명서(세부품명: “정보시스템개발서비스”, 세부품명번호 : 8111159901)를 소지한 자\n ❍ 본 사업은 소프트웨어 진흥법 제48조에 따른 대기업 참여제한 대상 사업임\n   - 본 사업은 20억원 미만 사업으로 「소프트웨어 진흥법」제48조 및 「중소 소프트웨어사업자의 사업 참여 지원에 관한 지침」(과학기술정보통신부)에 의거 대기업 및 중견기업인 소프트웨어 사업자의 입찰 참여 제한(SW 사업자신고 확인서 상의 ‘공공입찰참여 제한금액: 없음’으로 확인)\n   - 총예산 20억원 미만인 사업으로 중소소프트웨어사업자(SW 사업자신고 확인서 상의 ‘공공입찰참여 제한금액: 없음’으로 확인)만 입찰참가 가능""]",,
A_single_pipeline,1,한국사학진흥재단_대학재정정보시스템(기본재산 및 기채 사후관리) 고.hwp,extreme,입찰방식은 무엇인가요?,제한경쟁입찰 및 협상에 의한 계약체결,해당 정보를 찾을 수 없습니다.,[],,
B_rule_single_route,1,한국사학진흥재단_대학재정정보시스템(기본재산 및 기채 사후관리) 고.hwp,extreme,입찰방식은 무엇인가요?,제한경쟁입찰 및 협상에 의한 계약체결,❍ ｢소프트웨어 진흥법｣ 제48조 제4항에 의거 상호출자제한기업집단에 속하는 회사는 사업금액에 관계없이 입찰 참여를 제한함,"[""❍ ｢소프트웨어 진흥법｣ 제48조 제4항에 의거 상호출자제한기업집단에 속하는 회사는 사업금액에 관계없이 입찰 참여를 제한함\n    ❍ ｢국가를 당사자로 하는 계약에 관한 법률｣ 제27조의5 및 같은 법 시행령 제12조 제3항에 따라 “조세포탈 등을 한 자”로서 유죄판결이 확정된 날부터 2년이 지나지 아니한 자에 대하여 입찰 참여를 제한함\n    ❍ 공동수급(공동이행방식)의 형태로 입찰에 참가할 경우, 아래 사항을 준수하여야 함\n      - 본 사업은 공동수급을 허용하며, 공동수급업체 구성원은 ｢국가를 당사자로 하는 계약에 관한 법률 시행령｣ 제12조(경쟁입찰의 참가자격) 및 같은 법 시행규칙 제14조 규정에 저촉되지 않아야 함\n      - 공동수급체는 5개 이하로 구성하여야 하며, 구성원별 계약참여 최소지분율은 10% 이상으로 하여야 함(기획재정부 계약예규「공동계약운용요령」 제9조 참조)\n      - 공동수급은 공동이행방식을 원칙으로 하며, 공동계약운용요령 상의 공동수급표준협정서(공동이행방식)는 G2B를 통해 등록하여야 함\n  3. 제안서 평가 방법\n    ❍ 기술평가와 가격평가를 실시하여 종합평가점수로 평가\n      - 평가비율 : 기술 능력평가(90%), 입찰 가격평가(10%)\n      - 종합평가점수 = 기술 능력평가 점수 + 입찰 가격평가 점수\n        ※ 종합평가점수가 동점일 경우 다음의 순으로 협상대상자를 선정함\n          1. 기술평가 점수가 높은 입찰자\n          2. 기술평가 점수도 동일한 경우 배점이 높은 항목에서 점수가 높은 입찰자\n    ❍ 기술평가 방법\n      - 제안서의 공정한 평가를 위해 전문가로 구성된 평가위원회를 구성하여 평가기준 및 항목별 배점에 따라 실시\n      - 각 항목별 평가배점과 방법은 아래 “제안서 평가배점 및 기준”에 의함\n      - 각 평가위원의 평가점수 중 최고점수와 최저점수를 제외(최저 또는 최고점수가 2개 이상일 경우 하나만 제외)한 나머지 점수를 산술평균하여 산출하며,"", "" 기술평가 분야 배점한도(90점)의 85% 이상인 자를 협상대상자로 선정하여 종합점수의 고득점 순에 따라 협상을 진행함\n        ※ 모든 협상대상자와 협상 결렬 시 재공고입찰에 부칠 수 있음\n      - 평가점수 결과는 소수점 다섯째자리에서 반올림\n    ❍ 가격평가 방법 : 조달청 국가종합전자조달시스템에서 실시\n  4. 제안서 평가배점 및 기준\n \n<표>\n ※ 대기업 참여제한, 중소기업 참여로 상생협력 부문 평가 미실시\n  ※ 위 표에서 \""하도급 금액 비율\""이란 원도급의 총 입찰금액 대비 하수급 총금액의 비율을 말한다.\n  ※ 위 표에서 \""하도급 계약금액 비율\""이란 하도급 할 총금액 대비 하수급 예정자와 계약할 총금액의 비율을 말한다.\n    ❍ 정량평가 기준\n      - 경영상태(2점)"", ""수 없으며, 같은 법 제3항에 따라 재하도급은 원칙적으로 불허함. 다만, 같은 법 제51조제2항 각 호 및 제3항 각 호에 해당하는 경우 그러하지 아니함\n    ❍ 하도급 계획서 제출 요청\n      - 본 사업 과업의 일부를 하도급하려는 경우 계약체결 시 ‘소프트웨어사업 하도급 계획서’를 제출하여야 함(별지 6호 서식 참고)\n    ❍ 하도급 계약의 적정성 판단 세부기준\n      - 하도급계약의 승인을 신청하는 경우, 「소프트웨어사업 계약 및 관리감독에 관한 지침」의 별표 3 ‘하도급계약의 적정성 판단 세부기준’에 따라 적정성여부를 판단하며, 평가점수가 85점 이상인 경우에 한하여 하도급계약을 승인함. 다만, 85점 이상인 경우라 하더라도 하도급 계약의 세부 조건 등으로 인하여 사업의 원활한 수행이 불가능하다고 인정되는 경우 그 사유를 기재하여 하도급 승인 거절을 통보할 수 있음\n    ❍ 공동수급체 구성\n      - 본 사업에서 전체 사업금액 대비 10%를 초과하여 하도급하려는 경우, 「소프트웨어 진흥법」 제51조제6항 및 같은 법 시행령 제48조제5항에 따라 하도급이 아닌 공동수급체를 구성하여 참여해야하며, 공동수급체를 구성하지 못하는 불가피한 사정이 있는 경우 그 사유를 제시하여야 함\n    ❍ 하도급대금 지급 확인\n      - 본 사업은 하도급 가능 사업으로 제안사는 대가를 지급받은 경우 15일 이내에 하도급대금을 하수급인에게 현금으로 지급하여야 하며, 하도급대금의 지급 내역(수령자, 지급액, 지급일 등)을 5일(공휴일 및 토요일 제외) 이내에 재단 계약담당자에게 통보하여야 함\n  5. SW사업 작업장소(원격지 개발)\n    ❍ 작업장소 상호 협의\n      - 사업 수행을 위해 필요한 작업장소 등(장소, 설비, 기타 작업환경)은 상호협의하여 결정하며, 핵심 개발인력이 아닌 지원인력의 근무장소는 보안 등 특별한 사유가 있는 경우를 제외하고는 제안사가 달리 정할 수 있음\n      - 사업 수행을 위해 필요한 작업장소 등은 사업예산 내 계상되어 있""]",,
C_rule_multi_route,1,한국사학진흥재단_대학재정정보시스템(기본재산 및 기채 사후관리) 고.hwp,extreme,입찰방식은 무엇인가요?,제한경쟁입찰 및 협상에 의한 계약체결,❍ ｢소프트웨어 진흥법｣ 제48조 제4항에 의거 상호출자제한기업집단에 속하는 회사는 사업금액에 관계없이 입찰 참여를 제한함,"[""❍ ｢소프트웨어 진흥법｣ 제48조 제4항에 의거 상호출자제한기업집단에 속하는 회사는 사업금액에 관계없이 입찰 참여를 제한함\n    ❍ ｢국가를 당사자로 하는 계약에 관한 법률｣ 제27조의5 및 같은 법 시행령 제12조 제3항에 따라 “조세포탈 등을 한 자”로서 유죄판결이 확정된 날부터 2년이 지나지 아니한 자에 대하여 입찰 참여를 제한함\n    ❍ 공동수급(공동이행방식)의 형태로 입찰에 참가할 경우, 아래 사항을 준수하여야 함\n      - 본 사업은 공동수급을 허용하며, 공동수급업체 구성원은 ｢국가를 당사자로 하는 계약에 관한 법률 시행령｣ 제12조(경쟁입찰의 참가자격) 및 같은 법 시행규칙 제14조 규정에 저촉되지 않아야 함\n      - 공동수급체는 5개 이하로 구성하여야 하며, 구성원별 계약참여 최소지분율은 10% 이상으로 하여야 함(기획재정부 계약예규「공동계약운용요령」 제9조 참조)\n      - 공동수급은 공동이행방식을 원칙으로 하며, 공동계약운용요령 상의 공동수급표준협정서(공동이행방식)는 G2B를 통해 등록하여야 함\n  3. 제안서 평가 방법\n    ❍ 기술평가와 가격평가를 실시하여 종합평가점수로 평가\n      - 평가비율 : 기술 능력평가(90%), 입찰 가격평가(10%)\n      - 종합평가점수 = 기술 능력평가 점수 + 입찰 가격평가 점수\n        ※ 종합평가점수가 동점일 경우 다음의 순으로 협상대상자를 선정함\n          1. 기술평가 점수가 높은 입찰자\n          2. 기술평가 점수도 동일한 경우 배점이 높은 항목에서 점수가 높은 입찰자\n    ❍ 기술평가 방법\n      - 제안서의 공정한 평가를 위해 전문가로 구성된 평가위원회를 구성하여 평가기준 및 항목별 배점에 따라 실시\n      - 각 항목별 평가배점과 방법은 아래 “제안서 평가배점 및 기준”에 의함\n      - 각 평가위원의 평가점수 중 최고점수와 최저점수를 제외(최저 또는 최고점수가 2개 이상일 경우 하나만 제외)한 나머지 점수를 산술평균하여 산출하며,"", "" 기술평가 분야 배점한도(90점)의 85% 이상인 자를 협상대상자로 선정하여 종합점수의 고득점 순에 따라 협상을 진행함\n        ※ 모든 협상대상자와 협상 결렬 시 재공고입찰에 부칠 수 있음\n      - 평가점수 결과는 소수점 다섯째자리에서 반올림\n    ❍ 가격평가 방법 : 조달청 국가종합전자조달시스템에서 실시\n  4. 제안서 평가배점 및 기준\n \n<표>\n ※ 대기업 참여제한, 중소기업 참여로 상생협력 부문 평가 미실시\n  ※ 위 표에서 \""하도급 금액 비율\""이란 원도급의 총 입찰금액 대비 하수급 총금액의 비율을 말한다.\n  ※ 위 표에서 \""하도급 계약금액 비율\""이란 하도급 할 총금액 대비 하수급 예정자와 계약할 총금액의 비율을 말한다.\n    ❍ 정량평가 기준\n      - 경영상태(2점)"", ""수 없으며, 같은 법 제3항에 따라 재하도급은 원칙적으로 불허함. 다만, 같은 법 제51조제2항 각 호 및 제3항 각 호에 해당하는 경우 그러하지 아니함\n    ❍ 하도급 계획서 제출 요청\n      - 본 사업 과업의 일부를 하도급하려는 경우 계약체결 시 ‘소프트웨어사업 하도급 계획서’를 제출하여야 함(별지 6호 서식 참고)\n    ❍ 하도급 계약의 적정성 판단 세부기준\n      - 하도급계약의 승인을 신청하는 경우, 「소프트웨어사업 계약 및 관리감독에 관한 지침」의 별표 3 ‘하도급계약의 적정성 판단 세부기준’에 따라 적정성여부를 판단하며, 평가점수가 85점 이상인 경우에 한하여 하도급계약을 승인함. 다만, 85점 이상인 경우라 하더라도 하도급 계약의 세부 조건 등으로 인하여 사업의 원활한 수행이 불가능하다고 인정되는 경우 그 사유를 기재하여 하도급 승인 거절을 통보할 수 있음\n    ❍ 공동수급체 구성\n      - 본 사업에서 전체 사업금액 대비 10%를 초과하여 하도급하려는 경우, 「소프트웨어 진흥법」 제51조제6항 및 같은 법 시행령 제48조제5항에 따라 하도급이 아닌 공동수급체를 구성하여 참여해야하며, 공동수급체를 구성하지 못하는 불가피한 사정이 있는 경우 그 사유를 제시하여야 함\n    ❍ 하도급대금 지급 확인\n      - 본 사업은 하도급 가능 사업으로 제안사는 대가를 지급받은 경우 15일 이내에 하도급대금을 하수급인에게 현금으로 지급하여야 하며, 하도급대금의 지급 내역(수령자, 지급액, 지급일 등)을 5일(공휴일 및 토요일 제외) 이내에 재단 계약담당자에게 통보하여야 함\n  5. SW사업 작업장소(원격지 개발)\n    ❍ 작업장소 상호 협의\n      - 사업 수행을 위해 필요한 작업장소 등(장소, 설비, 기타 작업환경)은 상호협의하여 결정하며, 핵심 개발인력이 아닌 지원인력의 근무장소는 보안 등 특별한 사유가 있는 경우를 제외하고는 제안사가 달리 정할 수 있음\n      - 사업 수행을 위해 필요한 작업장소 등은 사업예산 내 계상되어 있""]",,
A_single_pipeline,1,한국사회보장정보원_라오스 보건의료정보화 협력을 위한 사전타당성 조.hwp,central,이 사업의 입찰방식(계약방법)은 무엇입니까?,"제한경쟁, 협상에 의한 계약체결","❍ 계약방법 : 제한경쟁, 협상에 의한 계약체결","[""❍ 사 업 명 : 라오스 보건의료정보화 협력을 위한 사전타당성 조사\n ❍ 사업기간 : 계약일로부터 90일(3개월)\n ❍ 사업예산 : 금 40,000,000원(금사천만원, VAT 포함)\n ❍ 계약방법 : 제한경쟁, 협상에 의한 계약체결"", ""<그림>\n 작성 유의사항\n ❍ 국문 보고서 전자파일은 .hwp, 영문 전자파일은 .docx, 발표자료는 ppt 형태로 제출해야 함\n ❍ 보고회 등의 장소 및 일정은 반드시 발주기관과 사전 조율 필요\n ❍ 사업추진 일정 계획, 품질보증계획과 연계하여 산출물의 종류, 주요내용, 작성 및 제출시기, 제출 부수 등을 제시하고 체계적으로 관리\n ❍ 최종결과보고서는 감수 및 디자인된 인쇄 출판물 형태로 제작하여 제출\n ❍ 산출물 중 중요·필수 자료의 경우 발주기관과 상의 후 영문 번역 및 감수 진행 필요\n ❍ 사업 진행 간 발생한 모든 자료 일체를 폴더별 정리하여 제출\n ❍ 업무 추진 회의 등에 대한 회의록 작성\n ❍ 본 사업의 수행결과물(계약목적물)에 대한 지식재산권은 발주기관과 계약상대자가 공동으로 소유\n   - 별도의 정함이 없는 한 지분은 균등한 것으로 정함\n   - 지식재산권의 타 용도 및 상업적 활용 시 반드시 발주기관과 협의\n<사업결과보고서 목차(예시)>\n<표>""]",,
B_rule_single_route,1,한국사회보장정보원_라오스 보건의료정보화 협력을 위한 사전타당성 조.hwp,central,이 사업의 입찰방식(계약방법)은 무엇입니까?,"제한경쟁, 협상에 의한 계약체결","❍ 계약방법 : 제한경쟁, 협상에 의한 계약체결","[""❍ 사 업 명 : 라오스 보건의료정보화 협력을 위한 사전타당성 조사\n ❍ 사업기간 : 계약일로부터 90일(3개월)\n ❍ 사업예산 : 금 40,000,000원(금사천만원, VAT 포함)\n ❍ 계약방법 : 제한경쟁, 협상에 의한 계약체결"", ""<그림>\n 작성 유의사항\n ❍ 국문 보고서 전자파일은 .hwp, 영문 전자파일은 .docx, 발표자료는 ppt 형태로 제출해야 함\n ❍ 보고회 등의 장소 및 일정은 반드시 발주기관과 사전 조율 필요\n ❍ 사업추진 일정 계획, 품질보증계획과 연계하여 산출물의 종류, 주요내용, 작성 및 제출시기, 제출 부수 등을 제시하고 체계적으로 관리\n ❍ 최종결과보고서는 감수 및 디자인된 인쇄 출판물 형태로 제작하여 제출\n ❍ 산출물 중 중요·필수 자료의 경우 발주기관과 상의 후 영문 번역 및 감수 진행 필요\n ❍ 사업 진행 간 발생한 모든 자료 일체를 폴더별 정리하여 제출\n ❍ 업무 추진 회의 등에 대한 회의록 작성\n ❍ 본 사업의 수행결과물(계약목적물)에 대한 지식재산권은 발주기관과 계약상대자가 공동으로 소유\n   - 별도의 정함이 없는 한 지분은 균등한 것으로 정함\n   - 지식재산권의 타 용도 및 상업적 활용 시 반드시 발주기관과 협의\n<사업결과보고서 목차(예시)>\n<표>""]",,
C_rule_multi_route,1,한국사회보장정보원_라오스 보건의료정보화 협력을 위한 사전타당성 조.hwp,central,이 사업의 입찰방식(계약방법)은 무엇입니까?,"제한경쟁, 협상에 의한 계약체결","❍ 계약방법 : 제한경쟁, 협상에 의한 계약체결","[""❍ 사 업 명 : 라오스 보건의료정보화 협력을 위한 사전타당성 조사\n ❍ 사업기간 : 계약일로부터 90일(3개월)\n ❍ 사업예산 : 금 40,000,000원(금사천만원, VAT 포함)\n ❍ 계약방법 : 제한경쟁, 협상에 의한 계약체결"", ""<그림>\n 작성 유의사항\n ❍ 국문 보고서 전자파일은 .hwp, 영문 전자파일은 .docx, 발표자료는 ppt 형태로 제출해야 함\n ❍ 보고회 등의 장소 및 일정은 반드시 발주기관과 사전 조율 필요\n ❍ 사업추진 일정 계획, 품질보증계획과 연계하여 산출물의 종류, 주요내용, 작성 및 제출시기, 제출 부수 등을 제시하고 체계적으로 관리\n ❍ 최종결과보고서는 감수 및 디자인된 인쇄 출판물 형태로 제작하여 제출\n ❍ 산출물 중 중요·필수 자료의 경우 발주기관과 상의 후 영문 번역 및 감수 진행 필요\n ❍ 사업 진행 간 발생한 모든 자료 일체를 폴더별 정리하여 제출\n ❍ 업무 추진 회의 등에 대한 회의록 작성\n ❍ 본 사업의 수행결과물(계약목적물)에 대한 지식재산권은 발주기관과 계약상대자가 공동으로 소유\n   - 별도의 정함이 없는 한 지분은 균등한 것으로 정함\n   - 지식재산권의 타 용도 및 상업적 활용 시 반드시 발주기관과 협의\n<사업결과보고서 목차(예시)>\n<표>""]",,
A_single_pipeline,1,한국산업단지공단_산단 안전정보시스템 1차 구축 용역.hwp,extreme,납품한 모든 장비의 하자담보책임기간은 얼마인가?,발주기관이 검사에 의하여 사업의 완성을 확인한 후 1년간,❍ 본 사업을 통하여 납품한 모든 장비의 하자담보책임기간은 발주기관이 검사에 의하여 사업의 완성을 확인한 후 1년간으로 함,"[""❍ 본 사업을 통하여 납품한 모든 장비의 하자담보책임기간은 발주기관이 검사에 의하여 사업의 완성을 확인한 후 1년간으로 함"", ""출하여야 한다.\n  ③ (제품변경 시 재 인증) 제안사는 취약점 또는 기능적 결함 등이 발견되어 정보보호제품의 SW패치 또는 HW 사양을 변경하는 경우, 납품한 동 제품의 취약점 및 결함을 즉시 보완하고, 변경 후 수일 이내에 변경된 사양으로 재 인증 추진 등 관련사항을 조치하여야 한다.\n  ④ (보안적합성 사후검증) 제안사는 발주기관에서 국가 전문기관의 보안적합성 사후검증을 받을 경우, 필요한 모든 기술적·절차적 지원을 수행하여야하며, 구성사양 및 보안모듈 변경 등에 따른 재인증 및 대체장비 변경납품 요청 시 이에 응하여야 한다.\n   ※ 기존 보안적합성 검증필 제품도 국가·공공기관 구축 후 국가 전문기관의 현장실사 위주의 사후검증 필요\n  ⑤ 정보보호 제품 관련 처리기준은 국가정보원 기준 및 발주기관 관련지침에 의거 준용한다.""]",,
B_rule_single_route,1,한국산업단지공단_산단 안전정보시스템 1차 구축 용역.hwp,extreme,납품한 모든 장비의 하자담보책임기간은 얼마인가?,발주기관이 검사에 의하여 사업의 완성을 확인한 후 1년간,❍ 본 사업을 통하여 납품한 모든 장비의 하자담보책임기간은 발주기관이 검사에 의하여 사업의 완성을 확인한 후 1년간으로 함,"[""※ 소프트웨어사업 특성을 고려하여 검토항목을 수정할 수 있음\n[ 참고1 ] 기능점수(FP)기반 소프트웨어 적정 개발기간 산정표"", ""❍ 본 사업을 통하여 납품한 모든 장비의 하자담보책임기간은 발주기관이 검사에 의하여 사업의 완성을 확인한 후 1년간으로 함"", ""- 평가비율은 기술평가점수 90%와 가격평가점수 10%로 하며, 기술평가점수와 가격평가점수를 합산하여 종합 평가점수를 산출""]",,
C_rule_multi_route,1,한국산업단지공단_산단 안전정보시스템 1차 구축 용역.hwp,extreme,납품한 모든 장비의 하자담보책임기간은 얼마인가?,발주기관이 검사에 의하여 사업의 완성을 확인한 후 1년간,❍ 본 사업을 통하여 납품한 모든 장비의 하자담보책임기간은 발주기관이 검사에 의하여 사업의 완성을 확인한 후 1년간으로 함,"[""※ 소프트웨어사업 특성을 고려하여 검토항목을 수정할 수 있음\n[ 참고1 ] 기능점수(FP)기반 소프트웨어 적정 개발기간 산정표"", ""❍ 본 사업을 통하여 납품한 모든 장비의 하자담보책임기간은 발주기관이 검사에 의하여 사업의 완성을 확인한 후 1년간으로 함"", ""- 평가비율은 기술평가점수 90%와 가격평가점수 10%로 하며, 기술평가점수와 가격평가점수를 합산하여 종합 평가점수를 산출""]",,
A_single_pipeline,1,한국산업인력공단_RFID기반 국가자격 시험 결과물 스마트 관리시스템 도.hwp,central,"하자보증기간은 몇 개월이며, 하자보증과 관련하여 제출해야 할 서류는 무엇인가?","하자보증기간은 12개월이며, 관련 하자 이행보험 증권을 제출해야 함","본 계약체결물의 하자보증기간은 12개월로 하며, 관련하자 이행보험 증권을 제출하여야 함","[""다. IoT(RFID) 기술 지원, 사후 관리, 운영자 교육 및 시험 결과물 관리지침 마련\n   1) 환경 분석, 시스템 구성, 표준화, 시험 절차 등 RFID 적용방안 지침\n   2) 시스템 분석·설계, 구축, 설치 경과 등 구축 방법 관련 지침\n   3) 사용 매뉴얼, 운영 절차·전략 등 운영 관련 지침 마련 및 교육 실시  \n4. 납품 조건 및 유지보수 관련 사항\n  가. 납품완료일 : 계약 협의 시 별도로 정함\n   1) 납품 완료는 계약체결물의 설치 및 성능시험, 검수를 완료하여야 함\n   2) 계약체결물 중 개발 소프트웨어의 소스 코드를 포함한 운영소프트웨어가 탑재된 하드웨어 결과물 등을 제출하여야 함\n  나. 납품 장소: 공단 지정장소(서울지역본부, 울산지사, 국가자격채점센터)\n  다. 설치 및 검수에 관한 기준\n   ○ 검수는 발주자가 시행하고 장비의 시범운영, 정상 동작 등을 확인하고, 감독관이 적합하다고 최종 승인한 시점을 검수 완료 시점으로 함\n   ○ RFID 태그 부착 및 시험 결과물 실사에 대해서는 공단에서 샘플링으로 확인을 할 수 있으며, 보완을 요구할 수 있음\n  라. 본 계약체결물의 하자보증기간은 12개월로 하며, 관련하자 이행보험 증권을 제출하여야 함\n  마. 하자보증기간 중 발주자의 고의나 중대한 과실이 아닌 사유로 발생한 계약체결물의 고장 또는 파손은 계약상대자의 부담으로 수리하거나 교환하여야 함\n  바. 제반 비용\n   ○ 사업 추진을 위한 네트워크, 전기·전원 또는 바닥 시설공사 등 시스템의 설치, 구축 등에 소요되는 일체의 경비는 본 사업에 포함함\n   ○ 본 사업에서 생산된 사용자 지침서, 운영자 가이드 등 각종 용역산출물을 디지털 형태로 제작 관리하는 방안을 제시하고, 관련된 비용은 본 사업에 포함함\n   ○ 납품하는 장비에 대해 검사 완료까지 소요되는 제반 경비는 본 사업에 포함함\n     ※ RFID 국가자격 시험 결과물 스마트 관리시스템 운영 관련 하드웨어 및 솔루션\n      \n<표>"", ""나. 제안서에는 제안요청서에서 요구하는 사항에 대해 자세하게 기술\n  다. 제안서는 제안서 작성순서 및 작성지침을 참조하여 순서대로 각 요구조건에 대해 간단·명료하게 작성하고, 추가적인 설명자료 및 증빙자료는 별첨으로 작성·첨부하여야 함\n  라. 제안서의 내용은 명확한 용어를 사용하여 표현하여야 하며, “～할 수도 있다”, “～이 가능하다”, “～을 고려하고 있다”, “～에 동의한다” 등과 같은 모호한 표현은 제안서 평가 시 불가능한 것으로 간주함\n  마. 제안내용에 대한 확인을 위하여 추가자료 요청을 할 수 있음\n  바. 제안에 관한 증명 내용은 반드시 “사실과 상위 없음” 증빙자료를 첨부해야 함\n  사. 제안과 관련되어 제출된 자료일체는 반환하지 않으며 본 제안과 관련된 일체의 소요비용은 제안업체가 부담함\n  아. 제안사는 본 사업에 적용할 기술적용계획표를 검토하여 그 적용결과표를 제안서에 첨부하여 제출하여야 함\n  자. 제안서의 모든 기재사항은 객관적으로 입증할 수 있는 관계서류를 첨부해야 하며, 평가 시 영향을 미칠 중대한 내용에 대해 허위 작성한 사실이 판명될 시 평가대상에서 제외됨은 물론 계약 후에도 계약파기와 함께 인적, 물적, 기간적 손실에 따른 손해배상을 청구할 수 있음\n  차. 선정된 사업자는 사업추진, 품질보증, 모든 협력사업자 관리 등의 전체적 사업관리에 대한 권한 및 책임을 가짐\n3. 제안서 제출 서류\n  가. 제출 장소 및 기한은 입찰공고문에서 정한 바에 따름\n  나. 입찰에 제출되는 서류는 원본 제출을 원칙으로 하며, 제출서류가 사본일 경우에는 “사실과 상위 없음”을 확인·날인하여 제출\n4. 보안 준수사항\n  가. 제안요청일 이후 제안서 제출 시까지 발생하는 모든 사안에 대해제안 참여기관의 제안관계자 이외의 인원에 대해서는 대외비로 취급되어야 하며, 본 제안요청서의 전체 또는 일부가 제안서 제출 이외의 다른 목적으로 사용될 수 없음  \n  나. 본 사업의 입찰에 참여하여 기관이 획득한 발주기관에 대한 정보는 공단의 서면에 의한 승인 ""]",,
B_rule_single_route,1,한국산업인력공단_RFID기반 국가자격 시험 결과물 스마트 관리시스템 도.hwp,central,"하자보증기간은 몇 개월이며, 하자보증과 관련하여 제출해야 할 서류는 무엇인가?","하자보증기간은 12개월이며, 관련 하자 이행보험 증권을 제출해야 함","본 계약체결물의 하자보증기간은 12개월로 하며, 관련하자 이행보험 증권을 제출하여야 함","[""2. 입찰 방법\n 가. 기술평가는 ｢소프트웨어 진흥법｣ 제49조제2항에 따른 ｢소프트웨어 기술성 평가기준 지침｣을 적용하고, 제안서 평가항목 및 배점은 본 사업에 적합한 내용으로 재구성하며, ｢행정기관 및 공공기관 정보시스템 구축·운영 지침｣ 제18조에 따라 기술평가 90%, 가격평가 10%의 비중을 적용하여 실시\n 나. 각 평가위원의 평가점수 중 최고점수와 최저점수를 제외한 나머지 점수를 산술평균한 점수를 90점 만점으로 환산하며, 입찰가격이 해당 사업예산(예정가격을 작성한 경우에는 예정가격) 이하이면서 기술평가분야 배점한도의 85%이상인 제안사를 협상적격자로 정하고, 협상순서는 협상적격자 중 종합평가점수의 고득점 순에 의하여 결정\n      ※ 최고점수와 최저점수에 동일한 점수가 있는 경우 1개의 평가 점수만 제외\n 다. 평가점수 결과는 소수점 셋째자리에서 반올림 처리\n 라. 동점 시 처리방침\n   \n<표>"", ""* 등급별 평점이 소수점 이하의 숫자가 있는 경우 소수점 다섯째자리에서 반올림 함\n주)\n 1. 「신용정보의 이용 및 보호에 관한 법률」제2조 제8의3에 해당하는 신용조회사  또는「자본시장과 금융투자업에 관한 법률」제335조의3에 따라 업무를 영위하는신용평가사가 입찰공고일 이전에 평가하고 유효기간 내에 있는 회사채, 기업어음 및 기업신용평가등급을 국가종합전자조달시스템에 조회된 신용평가등급으로 평가하되, 가장 최근의 신용평가등급으로 평가한다. 다만, 가장 최근의 신용평가등급이 다수가 있으며 그 결과가 서로 다른 경우에는 가장 낮은 등급으로 평가한다.\n 2. 국가종합전자조달시스템에서 신용평가등급 확인서가 확인되지 않은 경우에는 최저등급으로 평가하며, 유효기간 시작일 또는 만료일이 입찰공고일인 경우에도 유효한 것으로 평가한다. 다만, 입찰공고일 다음날 이후에 발생 또는 수정된 자료는 평가에서 제외한다.\n 3. 주 1에도 불구하고, 합병 또는 분할한 자가 입찰공고일 이전에 평가한 신용평가등급이 없는 경우에는 입찰서 제출 마감일 전일까지 발급된 유효기간 내에 있는 가장 최근의 신용평가등급으로 평가한다. 다만, 합병 후 새로운 신용평가등급이 없는 경우에는 입찰공고일 이전에 평가하고 유효기간 내에 있는 신용평가등급으로서 합병 대상자 중 가장 낮은 신용평가등급을 받은 자의 신용평가등급으로 평가한다.\n 4. 추정가격이 고시금액 미만인 입찰에서 입찰공고일을 기준으로 최근 7년 이내에 사업을 개시한 창업기업에 대해서는 신용평가등급 점수상의 배점 한도를 부여한다. 이 경우 창업기업에 대한 확인은 「중소기업제품공공구매 종합정보망」에 등재된 자료로 확인하며, 창업기업확인서의 유효기간 내에 있어야 한다. 다만, 제안서 평가일 전일까지 발급된 자료도 심사에 포함하며, 이 경우 입찰공고일 이전 창업을 확인 할 수 있는 자료(법인인 경우 법인등기부상 법인설립등기일, 개인사업자인 경우에는 사업자등록증명서 상 사업자등록일)를 제출하여야 한다.(이하 창업기업에 대한 확인방법은 같다)\n 5. 공동수급"", ""다. IoT(RFID) 기술 지원, 사후 관리, 운영자 교육 및 시험 결과물 관리지침 마련\n   1) 환경 분석, 시스템 구성, 표준화, 시험 절차 등 RFID 적용방안 지침\n   2) 시스템 분석·설계, 구축, 설치 경과 등 구축 방법 관련 지침\n   3) 사용 매뉴얼, 운영 절차·전략 등 운영 관련 지침 마련 및 교육 실시  \n4. 납품 조건 및 유지보수 관련 사항\n  가. 납품완료일 : 계약 협의 시 별도로 정함\n   1) 납품 완료는 계약체결물의 설치 및 성능시험, 검수를 완료하여야 함\n   2) 계약체결물 중 개발 소프트웨어의 소스 코드를 포함한 운영소프트웨어가 탑재된 하드웨어 결과물 등을 제출하여야 함\n  나. 납품 장소: 공단 지정장소(서울지역본부, 울산지사, 국가자격채점센터)\n  다. 설치 및 검수에 관한 기준\n   ○ 검수는 발주자가 시행하고 장비의 시범운영, 정상 동작 등을 확인하고, 감독관이 적합하다고 최종 승인한 시점을 검수 완료 시점으로 함\n   ○ RFID 태그 부착 및 시험 결과물 실사에 대해서는 공단에서 샘플링으로 확인을 할 수 있으며, 보완을 요구할 수 있음\n  라. 본 계약체결물의 하자보증기간은 12개월로 하며, 관련하자 이행보험 증권을 제출하여야 함\n  마. 하자보증기간 중 발주자의 고의나 중대한 과실이 아닌 사유로 발생한 계약체결물의 고장 또는 파손은 계약상대자의 부담으로 수리하거나 교환하여야 함\n  바. 제반 비용\n   ○ 사업 추진을 위한 네트워크, 전기·전원 또는 바닥 시설공사 등 시스템의 설치, 구축 등에 소요되는 일체의 경비는 본 사업에 포함함\n   ○ 본 사업에서 생산된 사용자 지침서, 운영자 가이드 등 각종 용역산출물을 디지털 형태로 제작 관리하는 방안을 제시하고, 관련된 비용은 본 사업에 포함함\n   ○ 납품하는 장비에 대해 검사 완료까지 소요되는 제반 경비는 본 사업에 포함함\n     ※ RFID 국가자격 시험 결과물 스마트 관리시스템 운영 관련 하드웨어 및 솔루션\n      \n<표>""]",,
C_rule_multi_route,1,한국산업인력공단_RFID기반 국가자격 시험 결과물 스마트 관리시스템 도.hwp,central,"하자보증기간은 몇 개월이며, 하자보증과 관련하여 제출해야 할 서류는 무엇인가?","하자보증기간은 12개월이며, 관련 하자 이행보험 증권을 제출해야 함","본 계약체결물의 하자보증기간은 12개월로 하며, 관련하자 이행보험 증권을 제출하여야 함","[""2. 입찰 방법\n 가. 기술평가는 ｢소프트웨어 진흥법｣ 제49조제2항에 따른 ｢소프트웨어 기술성 평가기준 지침｣을 적용하고, 제안서 평가항목 및 배점은 본 사업에 적합한 내용으로 재구성하며, ｢행정기관 및 공공기관 정보시스템 구축·운영 지침｣ 제18조에 따라 기술평가 90%, 가격평가 10%의 비중을 적용하여 실시\n 나. 각 평가위원의 평가점수 중 최고점수와 최저점수를 제외한 나머지 점수를 산술평균한 점수를 90점 만점으로 환산하며, 입찰가격이 해당 사업예산(예정가격을 작성한 경우에는 예정가격) 이하이면서 기술평가분야 배점한도의 85%이상인 제안사를 협상적격자로 정하고, 협상순서는 협상적격자 중 종합평가점수의 고득점 순에 의하여 결정\n      ※ 최고점수와 최저점수에 동일한 점수가 있는 경우 1개의 평가 점수만 제외\n 다. 평가점수 결과는 소수점 셋째자리에서 반올림 처리\n 라. 동점 시 처리방침\n   \n<표>"", ""* 등급별 평점이 소수점 이하의 숫자가 있는 경우 소수점 다섯째자리에서 반올림 함\n주)\n 1. 「신용정보의 이용 및 보호에 관한 법률」제2조 제8의3에 해당하는 신용조회사  또는「자본시장과 금융투자업에 관한 법률」제335조의3에 따라 업무를 영위하는신용평가사가 입찰공고일 이전에 평가하고 유효기간 내에 있는 회사채, 기업어음 및 기업신용평가등급을 국가종합전자조달시스템에 조회된 신용평가등급으로 평가하되, 가장 최근의 신용평가등급으로 평가한다. 다만, 가장 최근의 신용평가등급이 다수가 있으며 그 결과가 서로 다른 경우에는 가장 낮은 등급으로 평가한다.\n 2. 국가종합전자조달시스템에서 신용평가등급 확인서가 확인되지 않은 경우에는 최저등급으로 평가하며, 유효기간 시작일 또는 만료일이 입찰공고일인 경우에도 유효한 것으로 평가한다. 다만, 입찰공고일 다음날 이후에 발생 또는 수정된 자료는 평가에서 제외한다.\n 3. 주 1에도 불구하고, 합병 또는 분할한 자가 입찰공고일 이전에 평가한 신용평가등급이 없는 경우에는 입찰서 제출 마감일 전일까지 발급된 유효기간 내에 있는 가장 최근의 신용평가등급으로 평가한다. 다만, 합병 후 새로운 신용평가등급이 없는 경우에는 입찰공고일 이전에 평가하고 유효기간 내에 있는 신용평가등급으로서 합병 대상자 중 가장 낮은 신용평가등급을 받은 자의 신용평가등급으로 평가한다.\n 4. 추정가격이 고시금액 미만인 입찰에서 입찰공고일을 기준으로 최근 7년 이내에 사업을 개시한 창업기업에 대해서는 신용평가등급 점수상의 배점 한도를 부여한다. 이 경우 창업기업에 대한 확인은 「중소기업제품공공구매 종합정보망」에 등재된 자료로 확인하며, 창업기업확인서의 유효기간 내에 있어야 한다. 다만, 제안서 평가일 전일까지 발급된 자료도 심사에 포함하며, 이 경우 입찰공고일 이전 창업을 확인 할 수 있는 자료(법인인 경우 법인등기부상 법인설립등기일, 개인사업자인 경우에는 사업자등록증명서 상 사업자등록일)를 제출하여야 한다.(이하 창업기업에 대한 확인방법은 같다)\n 5. 공동수급"", ""다. IoT(RFID) 기술 지원, 사후 관리, 운영자 교육 및 시험 결과물 관리지침 마련\n   1) 환경 분석, 시스템 구성, 표준화, 시험 절차 등 RFID 적용방안 지침\n   2) 시스템 분석·설계, 구축, 설치 경과 등 구축 방법 관련 지침\n   3) 사용 매뉴얼, 운영 절차·전략 등 운영 관련 지침 마련 및 교육 실시  \n4. 납품 조건 및 유지보수 관련 사항\n  가. 납품완료일 : 계약 협의 시 별도로 정함\n   1) 납품 완료는 계약체결물의 설치 및 성능시험, 검수를 완료하여야 함\n   2) 계약체결물 중 개발 소프트웨어의 소스 코드를 포함한 운영소프트웨어가 탑재된 하드웨어 결과물 등을 제출하여야 함\n  나. 납품 장소: 공단 지정장소(서울지역본부, 울산지사, 국가자격채점센터)\n  다. 설치 및 검수에 관한 기준\n   ○ 검수는 발주자가 시행하고 장비의 시범운영, 정상 동작 등을 확인하고, 감독관이 적합하다고 최종 승인한 시점을 검수 완료 시점으로 함\n   ○ RFID 태그 부착 및 시험 결과물 실사에 대해서는 공단에서 샘플링으로 확인을 할 수 있으며, 보완을 요구할 수 있음\n  라. 본 계약체결물의 하자보증기간은 12개월로 하며, 관련하자 이행보험 증권을 제출하여야 함\n  마. 하자보증기간 중 발주자의 고의나 중대한 과실이 아닌 사유로 발생한 계약체결물의 고장 또는 파손은 계약상대자의 부담으로 수리하거나 교환하여야 함\n  바. 제반 비용\n   ○ 사업 추진을 위한 네트워크, 전기·전원 또는 바닥 시설공사 등 시스템의 설치, 구축 등에 소요되는 일체의 경비는 본 사업에 포함함\n   ○ 본 사업에서 생산된 사용자 지침서, 운영자 가이드 등 각종 용역산출물을 디지털 형태로 제작 관리하는 방안을 제시하고, 관련된 비용은 본 사업에 포함함\n   ○ 납품하는 장비에 대해 검사 완료까지 소요되는 제반 경비는 본 사업에 포함함\n     ※ RFID 국가자격 시험 결과물 스마트 관리시스템 운영 관련 하드웨어 및 솔루션\n      \n<표>"", ""나. 제안서에는 제안요청서에서 요구하는 사항에 대해 자세하게 기술\n  다. 제안서는 제안서 작성순서 및 작성지침을 참조하여 순서대로 각 요구조건에 대해 간단·명료하게 작성하고, 추가적인 설명자료 및 증빙자료는 별첨으로 작성·첨부하여야 함\n  라. 제안서의 내용은 명확한 용어를 사용하여 표현하여야 하며, “～할 수도 있다”, “～이 가능하다”, “～을 고려하고 있다”, “～에 동의한다” 등과 같은 모호한 표현은 제안서 평가 시 불가능한 것으로 간주함\n  마. 제안내용에 대한 확인을 위하여 추가자료 요청을 할 수 있음\n  바. 제안에 관한 증명 내용은 반드시 “사실과 상위 없음” 증빙자료를 첨부해야 함\n  사. 제안과 관련되어 제출된 자료일체는 반환하지 않으며 본 제안과 관련된 일체의 소요비용은 제안업체가 부담함\n  아. 제안사는 본 사업에 적용할 기술적용계획표를 검토하여 그 적용결과표를 제안서에 첨부하여 제출하여야 함\n  자. 제안서의 모든 기재사항은 객관적으로 입증할 수 있는 관계서류를 첨부해야 하며, 평가 시 영향을 미칠 중대한 내용에 대해 허위 작성한 사실이 판명될 시 평가대상에서 제외됨은 물론 계약 후에도 계약파기와 함께 인적, 물적, 기간적 손실에 따른 손해배상을 청구할 수 있음\n  차. 선정된 사업자는 사업추진, 품질보증, 모든 협력사업자 관리 등의 전체적 사업관리에 대한 권한 및 책임을 가짐\n3. 제안서 제출 서류\n  가. 제출 장소 및 기한은 입찰공고문에서 정한 바에 따름\n  나. 입찰에 제출되는 서류는 원본 제출을 원칙으로 하며, 제출서류가 사본일 경우에는 “사실과 상위 없음”을 확인·날인하여 제출\n4. 보안 준수사항\n  가. 제안요청일 이후 제안서 제출 시까지 발생하는 모든 사안에 대해제안 참여기관의 제안관계자 이외의 인원에 대해서는 대외비로 취급되어야 하며, 본 제안요청서의 전체 또는 일부가 제안서 제출 이외의 다른 목적으로 사용될 수 없음  \n  나. 본 사업의 입찰에 참여하여 기관이 획득한 발주기관에 대한 정보는 공단의 서면에 의한 승인 ""]",,
A_single_pipeline,1,한국생산기술연구원_2세대 전자조달시스템  기반구축사업.hwp,central,사업기간은 어떻게 되나요?,계약체결일로부터 2024년 12월 31일까지,해당 정보를 찾을 수 없습니다.,[],,
B_rule_single_route,1,한국생산기술연구원_2세대 전자조달시스템  기반구축사업.hwp,central,사업기간은 어떻게 되나요?,계약체결일로부터 2024년 12월 31일까지,협상절차 및 낙찰자 결정 방식,"[""1. 협상절차 및 낙찰자 결정 방식\n ㅇ 공정한 기술능력평가를 위해 제안서평가위원회를 구성하여 평가항목에 의하여 평가\n ㅇ 본 용역의 평가는 기술능력평가와 입찰가격평가로 구분하여 실시하되, 기술능력평가의 비중을 100분의 90으로 하고, 입찰가격평가의 비중을 100분의 10으로 적용\n ㅇ 제안서 평가결과 기술능력평가 점수가 기술능력평가분야 배점한도의 85% 이상인 자를 협상적격자로 선정\n   - 업체별 최고점수와 최저점수 1개씩을 제외하여 산술평균하여 산출\n   - 다만, 최저 또는 최고 점수가 각 2개 이상일 때는 이 중 하나만 제외\n ㅇ 협상적격자의 기술능력평가 점수와 입찰가격평가 점수를 합산하여 합산점수의 고득점 순으로 우선 협상대상자로 선정\n ㅇ 가격제안서(입찰서)의 입찰가격이 사업예산 또는 예정가격을 초과하는 자는 협상적격자에서 제외함\n ㅇ 합산점수가 동일한 제안자가 2인 이상일 경우에는 기술능력 평가점수가 높은 제안자를 우선순위자로 하고, 기술능력 평가점수도 동일한 경우에는 기술능력의 세부평가항목 중 배점이 큰 항목에서 높은 점수를 얻은 자를 우선순위자로 함\n ㅇ 우선협상대상자가 협상내용에 대해 합의할 경우 다른 협상대상자와의 협상은 미실시\n ㅇ 우선협상대상자와의 협상이 성립되지 않으면 동일한 기준과 절차에 따라 순차적으로 차순위 협상적격자와 협상을 실시\n ㅇ 협상대상자가 제안한 사업내용 및 이행일정 등 제안서 내용을 대상으로 협상을 하며, 협상을 통하여 그 내용의 일부를 조정할 수 있음\n ㅇ기술능력은 하기와 같이 평가위원회를 구성하여 평가하며, 평가 위원회와 관련된 제반사항(명단) 등은 비공개를 원칙으로 함\n     \n<표>"", ""[주]\n 1.「신용정보의 이용 및 보호에 관한 법률」제4조제1항제1호 또는「자본시장과 금융투자업에 관한 법률」제335조의3에 따라 업무를 영위하는 신용조회사 또는 신용평가사가 입찰공고일 이전에 평가하고 유효기간 내에 있는 회사채, 기업어음 및 기업신용평가등급으로 평가하되, 가장 최근의 신용평가등급으로 평가한다. 다만, 가장 최근의 신용평가등급이 다수가 있으며 그 결과가 서로 다른 경우에는 가장 낮은 등급으로 평가한다.\n 2. 신용평가등급 확인서를 제출하지 않은 경우에는 최저등급으로 평가하며, 유효기간 만료일이 입찰공고일인 경우에도 유효한 것으로 평가한다.\n 3. 주 1에도 불구하고, 합병 또는 분할한 자가 입찰공고일 이전에 평가한 신용평가등급이 없는 경우에는 입찰서 제출 마감일 전일까지 발급된 유효기간 내에 있는 가장 최근의 신용평가등급으로 평가한다. 다만, 합병 후 새로운 신용평가등급이 없는 경우에는 입찰공고일 이전에 평가하고 유효기간 내에 있는 신용평가등급으로서 합병 대상자 중 가장 낮은 신용평가등급을 받은 자의 신용평가등급으로 평가한다.\n 4. 추정가격이 고시금액 미만인 입찰에서 입찰공고일을 기준으로 최근 7년 이내에 사업을 개시한 창업기업에 대해서는 신용평가등급 점수상의 배점 한도를 부여한다. 이 경우 창업기업에 대한 기간계산은 법인인 경우에는 법인등기부상 법인설립등기일을, 개인사업자인 경우에는 사업자등록증명서상 사업자등록일을 기준으로 한다.(이하 창업기업에 대한 기간계산은 같다)\n 5. 공동수급체의 경우 구성원별 해당 점수에 지분율을 곱한 후 그 점수들을 합산하여 최종 평가하고, 평가 결과 소수점 이하의 숫자가 있는 경우 소수점 다섯째자리에서 반올림 한다.\n    (예) (A사 점수×A사 지분율)+(B사 점수×B사 지분율)…"", ""1. 과업개요\n ㅇ 용 역 명 : 2세대 전자조달시스템 기반구축사업\n ㅇ 과업기간 : 계약체결일로부터 ‘24년 12월 31일까지\n ㅇ 배정예산 : 94,000,000원(VAT 포함)\n ㅇ 낙찰방식 : 협상에 의한 계약 체결""]",,
C_rule_multi_route,1,한국생산기술연구원_2세대 전자조달시스템  기반구축사업.hwp,central,사업기간은 어떻게 되나요?,계약체결일로부터 2024년 12월 31일까지,협상절차 및 낙찰자 결정 방식,"[""1. 협상절차 및 낙찰자 결정 방식\n ㅇ 공정한 기술능력평가를 위해 제안서평가위원회를 구성하여 평가항목에 의하여 평가\n ㅇ 본 용역의 평가는 기술능력평가와 입찰가격평가로 구분하여 실시하되, 기술능력평가의 비중을 100분의 90으로 하고, 입찰가격평가의 비중을 100분의 10으로 적용\n ㅇ 제안서 평가결과 기술능력평가 점수가 기술능력평가분야 배점한도의 85% 이상인 자를 협상적격자로 선정\n   - 업체별 최고점수와 최저점수 1개씩을 제외하여 산술평균하여 산출\n   - 다만, 최저 또는 최고 점수가 각 2개 이상일 때는 이 중 하나만 제외\n ㅇ 협상적격자의 기술능력평가 점수와 입찰가격평가 점수를 합산하여 합산점수의 고득점 순으로 우선 협상대상자로 선정\n ㅇ 가격제안서(입찰서)의 입찰가격이 사업예산 또는 예정가격을 초과하는 자는 협상적격자에서 제외함\n ㅇ 합산점수가 동일한 제안자가 2인 이상일 경우에는 기술능력 평가점수가 높은 제안자를 우선순위자로 하고, 기술능력 평가점수도 동일한 경우에는 기술능력의 세부평가항목 중 배점이 큰 항목에서 높은 점수를 얻은 자를 우선순위자로 함\n ㅇ 우선협상대상자가 협상내용에 대해 합의할 경우 다른 협상대상자와의 협상은 미실시\n ㅇ 우선협상대상자와의 협상이 성립되지 않으면 동일한 기준과 절차에 따라 순차적으로 차순위 협상적격자와 협상을 실시\n ㅇ 협상대상자가 제안한 사업내용 및 이행일정 등 제안서 내용을 대상으로 협상을 하며, 협상을 통하여 그 내용의 일부를 조정할 수 있음\n ㅇ기술능력은 하기와 같이 평가위원회를 구성하여 평가하며, 평가 위원회와 관련된 제반사항(명단) 등은 비공개를 원칙으로 함\n     \n<표>"", ""[주]\n 1.「신용정보의 이용 및 보호에 관한 법률」제4조제1항제1호 또는「자본시장과 금융투자업에 관한 법률」제335조의3에 따라 업무를 영위하는 신용조회사 또는 신용평가사가 입찰공고일 이전에 평가하고 유효기간 내에 있는 회사채, 기업어음 및 기업신용평가등급으로 평가하되, 가장 최근의 신용평가등급으로 평가한다. 다만, 가장 최근의 신용평가등급이 다수가 있으며 그 결과가 서로 다른 경우에는 가장 낮은 등급으로 평가한다.\n 2. 신용평가등급 확인서를 제출하지 않은 경우에는 최저등급으로 평가하며, 유효기간 만료일이 입찰공고일인 경우에도 유효한 것으로 평가한다.\n 3. 주 1에도 불구하고, 합병 또는 분할한 자가 입찰공고일 이전에 평가한 신용평가등급이 없는 경우에는 입찰서 제출 마감일 전일까지 발급된 유효기간 내에 있는 가장 최근의 신용평가등급으로 평가한다. 다만, 합병 후 새로운 신용평가등급이 없는 경우에는 입찰공고일 이전에 평가하고 유효기간 내에 있는 신용평가등급으로서 합병 대상자 중 가장 낮은 신용평가등급을 받은 자의 신용평가등급으로 평가한다.\n 4. 추정가격이 고시금액 미만인 입찰에서 입찰공고일을 기준으로 최근 7년 이내에 사업을 개시한 창업기업에 대해서는 신용평가등급 점수상의 배점 한도를 부여한다. 이 경우 창업기업에 대한 기간계산은 법인인 경우에는 법인등기부상 법인설립등기일을, 개인사업자인 경우에는 사업자등록증명서상 사업자등록일을 기준으로 한다.(이하 창업기업에 대한 기간계산은 같다)\n 5. 공동수급체의 경우 구성원별 해당 점수에 지분율을 곱한 후 그 점수들을 합산하여 최종 평가하고, 평가 결과 소수점 이하의 숫자가 있는 경우 소수점 다섯째자리에서 반올림 한다.\n    (예) (A사 점수×A사 지분율)+(B사 점수×B사 지분율)…"", ""1. 과업개요\n ㅇ 용 역 명 : 2세대 전자조달시스템 기반구축사업\n ㅇ 과업기간 : 계약체결일로부터 ‘24년 12월 31일까지\n ㅇ 배정예산 : 94,000,000원(VAT 포함)\n ㅇ 낙찰방식 : 협상에 의한 계약 체결"", ""3. 과업내용 및 과업기간 변경\n ㅇ 과업 수행 중에 다음사항이 발견된 경우에는 한국생산기술연구원의 승인을 받아 계약금액 범위 내에서 내용 및 기간 등을 변경할 수 있음\n   - 과업내용 등이 현저하게 변경될 때\n   - 과업수행 중 참여인력 등 중요사항이 변경될 때\n   - 기타변경이 필요하다고 한국생산기술연구원에서 인정할 때\n ㅇ 계약을 체결한 후 제안요청서의 내용은 한국생산기술연구원의 사정에 따라 변경될 수 있으며, 이로 인한 과업 범위는 한국생산기술연구원과 과업수행자 간의 협의에 의하여 결정함\n ㅇ 제안요청서에 명시되지 않은 사항은 수시로 한국생산기술연구원과 협의하여야 하고 이견이 있을 때에는 한국생산기술연구원의 의견을 따라야 함""]",,
A_single_pipeline,1,한국생산기술연구원_EIP3.0 고압가스 안전관리 시스템 구축 용역.hwp,extreme,이 사업의 사업기간은 어떻게 되나요?,계약체결일 ~ 2024.12.27.(5.5M/M),"2) 사업 진행 중 취득한 관련 정보는 외부로 누설하여서는 아니 되며, 정보누설로 인한 문제발생 시 해당자는 한국생산기술연구원에서 취하는 조치에 이의를 제기할 수 없다는 비밀유지계약서와 사업의 청렴이행을 위한 청렴 계약이행 서약서를 작성하여 제출하여야 합니다","[""2) 사업 진행 중 취득한 관련 정보는 외부로 누설하여서는 아니 되며, 정보누설로 인한 문제발생 시 해당자는 한국생산기술연구원에서 취하는 조치에 이의를 제기할 수 없다는 비밀유지계약서와 사업의 청렴이행을 위한 청렴 계약이행 서약서를 작성하여 제출하여야 합니다. (붙임 10, 12호 서식)\n   3) 「정보보안규정」 등 보안 관련 제반사항을 반드시 준수해야 하며, 사업 진행 중 보안관련 사항을 위반 시에는 해당 인원의 출입 및 선정업체에 대한 추후 관련사업 입찰을 제한합니다.\n   4) 본 사업과 관련된 사업 산출물은 발주기관에 귀속하며, 사업 진행 중 제공된 자료는 일체 반납하여야 합니다.\n   5) 사업수행자가 제출한 중간 및 최종 산출물에 대하여 발주기관은 보완을 요구할 수 있으며, 보완 요구 시 사업수행자는 즉시 산출물을 보완하여야 합니다.  \n라. SW 산출물 반출절차 등\n   1) 공급자는 지식재산권의 활용을 위하여 SW산출물의 반출을 요청할 수 있으며, 발주기관에서는 「보안업무규정」 제4조 및 제안요청서에 명시된 누출금지정보에 해당하지 않을 경우 SW산출물을 제공함.(단 공급자는 아래 내용을 준수하여야 함)\n   2) 공급자는 공급받은 SW산출물에 대하여 제안요청서, 계약서 등에 누출금지정보로 명시한 정보를 삭제하고 활용하여야 하며, 이를 확인하는 공급자 대표명의의 확약서를 발주기관에 제출하여야 함\n   3) 공급자가 반출된 SW산출물을 제3자에게 제공하려는 경우 반드시 발주기관으로부터 사전승인을 받아야 함\n   4) 발주기관은 공급자가 제공받은 SW산출물을 무단으로 유출하거나 누출되는 경우 및 누출금지정보를 삭제하지 않고 활용하는 경우에는 「국가계약법 시행령」제76조제1항제3호 및「지방계약법」제92조제1항제19호에 따라 입찰참가자격을 제한함\n마. 계약 관련사항\n  1) 일반사항\n    가) 최종 선정된 제안업체는 선정결과를 통보 받은 날부터 10일 이내에 계약체결에 응해야 하며, 제안업체 귀책사유로 인하여 계약이 지연될 경우 선정을 무효화하고 재선"", ""※ 본 사업의 과업 내용은 과업심의 결과를 계약 체결 전에 최종 확정하여 반영할 예정입니다. 따라서 제안된 과업 범위 및 수행 방법은 과업심의 결과에 따라 변경될 수 있으며, 이는 계약 체결 시 최종 확정된 과업지시서에 반영됩니다.\n아. 소프트웨어 사업 적정기간 산정결과""]",,
B_rule_single_route,1,한국생산기술연구원_EIP3.0 고압가스 안전관리 시스템 구축 용역.hwp,extreme,이 사업의 사업기간은 어떻게 되나요?,계약체결일 ~ 2024.12.27.(5.5M/M),제안 안내사항,"[""6. 제안 안내사항\n가. 입찰방식\n   1) 사업자 선정 방식 \n가)『국가를 당사자로 하는 계약에 관한 법률시행령 제43조 및 제43조의2』에 의거 “협상에 의한 계약체결” 방법을 적용합니다.\n나) 계약체결에 필요한 세부적인 사항은 기획재정부 계약예규 제471호 “협상에 의한 계약체결기준”을 적용합니다.\n   \n   2) 입찰 참가자격 : 입찰공고서에 의함\n가) “국가를 당사자로 하는 계약에 관한 법률시행령” 제12조 및 동법 시행규칙 제14조에 따라 입찰 참가 자격을 갖추어야 합니다.\n나) 소프트웨어산업 진흥법 제24조에 의한 소프트웨어 사업자(컴퓨터관련 서비스 사업)로 등록되어 있는 업체여야 합니다. \n다) 제안업체는 국가를 당사자로 하는 계약에 관한 법률 시행령 제76조 제1항의 규정에 의한 부정당업체로 지정되지 않은 업체이어야 합니다. \n라)「소프트웨어산업 진흥법(2018.8.22.)」제24조의2 제2항 및「대기업인 소프트웨어 사업자가 참여할 수 있는 사업금액의 하한」에 해당하는 대기업의 사업 참여 제한\n마) 공동수급을 허용하며, 공동수급업체 구성원은 국가를 당사자로 하는 계약에 관한 법률 시행령 제12조 및 동법 시행규칙 제14조 규정에 따른 입찰참가 자격을 갖추어야 합니다.\n바) 공동수급을 구성할 경우 입찰참가등록 신청 시 공동수급표준협정서(공동이행방식만 허용)를 제출하여야 한다.\n사) 공동수급체 구성원은 대표사를 포함하여 5개 이하로 구성하여야 하며, 공동이행방식에 의한 경우 구성원별 계약참여 최소지분율은 10%이상으로 하여야 한다.\n아) 공동수급체를 중복 결성하여 입찰에 참여할 수 없으며, 입찰서를 제출한 후에는 공동수급협정서를 제출할 수 없다.\n자) 기타사항은 한국생산기술연구원 공고사항에 따른다.\n나. 제안서 평가 방법 \n1) 평가 기관 : 한국생산기술연구원\n2) 평가 방침 : 기술평가와 가격평가를 실시하여 종합평가점수로 평가\n가) 평가비율 : 기술평가(90%), 가격평가(10%)\n나) 종합평가점수 = 기술평가점수 + 입찰가격 평가점수\n3) 기"", ""[주]\n 1.「신용정보의 이용 및 보호에 관한 법률」제4조제1항제1호 또는「자본시장과 금융투자업에 관한 법률」제335조의3에 따라 업무를 영위하는 신용조회사 또는 신용평가사가 입찰공고일 이전에 평가하고 유효기간 내에 있는 회사채, 기업어음 및 기업신용평가등급으로 평가하되, 가장 최근의 신용평가등급으로 평가한다. 다만, 가장 최근의 신용평가등급이 다수가 있으며 그 결과가 서로 다른 경우에는 가장 낮은 등급으로 평가한다.\n 2. 신용평가등급 확인서를 제출하지 않은 경우에는 최저등급으로 평가하며, 유효기간 만료일이 입찰공고일인 경우에도 유효한 것으로 평가한다.\n 3. 주 1에도 불구하고, 합병 또는 분할한 자가 입찰공고일 이전에 평가한 신용평가등급이 없는 경우에는 입찰서 제출 마감일 전일까지 발급된 유효기간 내에 있는 가장 최근의 신용평가등급으로 평가한다. 다만, 합병 후 새로운 신용평가등급이 없는 경우에는 입찰공고일 이전에 평가하고 유효기간 내에 있는 신용평가등급으로서 합병 대상자 중 가장 낮은 신용평가등급을 받은 자의 신용평가등급으로 평가한다.\n 4. 추정가격이 고시금액 미만인 입찰에서 입찰공고일을 기준으로 최근 7년 이내에 사업을 개시한 창업기업에 대해서는 신용평가등급 점수상의 배점 한도를 부여한다. 이 경우 창업기업에 대한 기간계산은 법인인 경우에는 법인등기부상 법인설립등기일을, 개인사업자인 경우에는 사업자등록증명서상 사업자등록일을 기준으로 한다.(이하 창업기업에 대한 기간계산은 같다)\n 5. 공동수급체의 경우 구성원별 해당 점수에 지분율을 곱한 후 그 점수들을 합산하여 최종 평가하고, 평가 결과 소수점 이하의 숫자가 있는 경우 소수점 다섯째자리에서 반올림 한다.\n    (예) (A사 점수×A사 지분율)+(B사 점수×B사 지분율)…"", ""※ “파견근로자보호등에관한법률” 등에 의한 파견근로자인 경우에는 파견업체명과 원소속사를 함께 명기하여야 함  (예시) 업체명 (원소속사명) \n   ※ 근무 경력확인서, 기술 경력확인서는 소프트웨어산업 진흥법 시행규칙(과학기술정보통신부령 제1호, 2017.7.26.) 제13조(소프트웨어기술자의 신고절차 등)에 근거하여 근무 경력확인서 및 기술 경력확인서를 사용자(대표자) 또는 소프트웨어 사업 발주자 확인을 받아 제출(소프트웨어기술자 경력관리기관의 소프트웨어 기술경력증명서) \n  ※ 자격증, 경력 및 수행업무와 관련된 사항을 증명할 수 있는 자료를 붙임으로 첨부하여야 하며, 첨부되지 않은 자료에 대하여는 인정하지 않음\n[서식 #9]\n공동수급표준협정서(공동이행방식)\n제1조(목적) 이 협정서는 아래 계약을 공동수급체의 구성원이 재정, 경영 및 기술능력과 인원 및 기자재를 동원하여 공사․물품 또는 용역에 대한 계획․입찰․시공 등을 위하여 일정 출자비율에 따라 공동연대하여 계약을 이행할 것을 약속하는 협약을 정함에 있다.\n    1. 계약건명 :\n    2. 계약금액 :\n    3. 발주자명 : 한국연구재단\n제2조(공동수급체) 공동수급체의 명칭, 사업소의 소재지, 대표자는 다음과 같다.\n    1. 명          칭 : ㅇㅇㅇ\n    2. 주사무소소재지 :\n    3. 대 표 자 성 명 :\n제3조(공동수급체의 구성원) ①공동수급체의 구성원은 다음과 같다.\n    1. ㅇㅇㅇ회사(대표자 :   )\n    2. ㅇㅇㅇ회사(대표자 :   )\n  ②공동수급체의 대표자는 ㅇㅇㅇ로 한다.\n  ③대표자는 발주자 및 제3자에 대하여 공동수급체를 대표하며, 공동수급체의 재산의 관리 및 대금청구 등의 권한을 가진다.\n제4조(효력기간) 본 협정서는 당사자간의 서명과 동시에 발효하며, 해당계약의 이행으로 종결된다. 다만, 발주자 또는 제3자에 대하여 공사와 관련한 권리․의무관계가 남아있는 한 본 협정서의 효력은 존속된다.\n제5조(의무) 공동수급체구성원은 제1조에서 규정한 목적을 수행하기""]",,
C_rule_multi_route,1,한국생산기술연구원_EIP3.0 고압가스 안전관리 시스템 구축 용역.hwp,extreme,이 사업의 사업기간은 어떻게 되나요?,계약체결일 ~ 2024.12.27.(5.5M/M),제안 안내사항,"[""6. 제안 안내사항\n가. 입찰방식\n   1) 사업자 선정 방식 \n가)『국가를 당사자로 하는 계약에 관한 법률시행령 제43조 및 제43조의2』에 의거 “협상에 의한 계약체결” 방법을 적용합니다.\n나) 계약체결에 필요한 세부적인 사항은 기획재정부 계약예규 제471호 “협상에 의한 계약체결기준”을 적용합니다.\n   \n   2) 입찰 참가자격 : 입찰공고서에 의함\n가) “국가를 당사자로 하는 계약에 관한 법률시행령” 제12조 및 동법 시행규칙 제14조에 따라 입찰 참가 자격을 갖추어야 합니다.\n나) 소프트웨어산업 진흥법 제24조에 의한 소프트웨어 사업자(컴퓨터관련 서비스 사업)로 등록되어 있는 업체여야 합니다. \n다) 제안업체는 국가를 당사자로 하는 계약에 관한 법률 시행령 제76조 제1항의 규정에 의한 부정당업체로 지정되지 않은 업체이어야 합니다. \n라)「소프트웨어산업 진흥법(2018.8.22.)」제24조의2 제2항 및「대기업인 소프트웨어 사업자가 참여할 수 있는 사업금액의 하한」에 해당하는 대기업의 사업 참여 제한\n마) 공동수급을 허용하며, 공동수급업체 구성원은 국가를 당사자로 하는 계약에 관한 법률 시행령 제12조 및 동법 시행규칙 제14조 규정에 따른 입찰참가 자격을 갖추어야 합니다.\n바) 공동수급을 구성할 경우 입찰참가등록 신청 시 공동수급표준협정서(공동이행방식만 허용)를 제출하여야 한다.\n사) 공동수급체 구성원은 대표사를 포함하여 5개 이하로 구성하여야 하며, 공동이행방식에 의한 경우 구성원별 계약참여 최소지분율은 10%이상으로 하여야 한다.\n아) 공동수급체를 중복 결성하여 입찰에 참여할 수 없으며, 입찰서를 제출한 후에는 공동수급협정서를 제출할 수 없다.\n자) 기타사항은 한국생산기술연구원 공고사항에 따른다.\n나. 제안서 평가 방법 \n1) 평가 기관 : 한국생산기술연구원\n2) 평가 방침 : 기술평가와 가격평가를 실시하여 종합평가점수로 평가\n가) 평가비율 : 기술평가(90%), 가격평가(10%)\n나) 종합평가점수 = 기술평가점수 + 입찰가격 평가점수\n3) 기"", ""[주]\n 1.「신용정보의 이용 및 보호에 관한 법률」제4조제1항제1호 또는「자본시장과 금융투자업에 관한 법률」제335조의3에 따라 업무를 영위하는 신용조회사 또는 신용평가사가 입찰공고일 이전에 평가하고 유효기간 내에 있는 회사채, 기업어음 및 기업신용평가등급으로 평가하되, 가장 최근의 신용평가등급으로 평가한다. 다만, 가장 최근의 신용평가등급이 다수가 있으며 그 결과가 서로 다른 경우에는 가장 낮은 등급으로 평가한다.\n 2. 신용평가등급 확인서를 제출하지 않은 경우에는 최저등급으로 평가하며, 유효기간 만료일이 입찰공고일인 경우에도 유효한 것으로 평가한다.\n 3. 주 1에도 불구하고, 합병 또는 분할한 자가 입찰공고일 이전에 평가한 신용평가등급이 없는 경우에는 입찰서 제출 마감일 전일까지 발급된 유효기간 내에 있는 가장 최근의 신용평가등급으로 평가한다. 다만, 합병 후 새로운 신용평가등급이 없는 경우에는 입찰공고일 이전에 평가하고 유효기간 내에 있는 신용평가등급으로서 합병 대상자 중 가장 낮은 신용평가등급을 받은 자의 신용평가등급으로 평가한다.\n 4. 추정가격이 고시금액 미만인 입찰에서 입찰공고일을 기준으로 최근 7년 이내에 사업을 개시한 창업기업에 대해서는 신용평가등급 점수상의 배점 한도를 부여한다. 이 경우 창업기업에 대한 기간계산은 법인인 경우에는 법인등기부상 법인설립등기일을, 개인사업자인 경우에는 사업자등록증명서상 사업자등록일을 기준으로 한다.(이하 창업기업에 대한 기간계산은 같다)\n 5. 공동수급체의 경우 구성원별 해당 점수에 지분율을 곱한 후 그 점수들을 합산하여 최종 평가하고, 평가 결과 소수점 이하의 숫자가 있는 경우 소수점 다섯째자리에서 반올림 한다.\n    (예) (A사 점수×A사 지분율)+(B사 점수×B사 지분율)…"", ""※ “파견근로자보호등에관한법률” 등에 의한 파견근로자인 경우에는 파견업체명과 원소속사를 함께 명기하여야 함  (예시) 업체명 (원소속사명) \n   ※ 근무 경력확인서, 기술 경력확인서는 소프트웨어산업 진흥법 시행규칙(과학기술정보통신부령 제1호, 2017.7.26.) 제13조(소프트웨어기술자의 신고절차 등)에 근거하여 근무 경력확인서 및 기술 경력확인서를 사용자(대표자) 또는 소프트웨어 사업 발주자 확인을 받아 제출(소프트웨어기술자 경력관리기관의 소프트웨어 기술경력증명서) \n  ※ 자격증, 경력 및 수행업무와 관련된 사항을 증명할 수 있는 자료를 붙임으로 첨부하여야 하며, 첨부되지 않은 자료에 대하여는 인정하지 않음\n[서식 #9]\n공동수급표준협정서(공동이행방식)\n제1조(목적) 이 협정서는 아래 계약을 공동수급체의 구성원이 재정, 경영 및 기술능력과 인원 및 기자재를 동원하여 공사․물품 또는 용역에 대한 계획․입찰․시공 등을 위하여 일정 출자비율에 따라 공동연대하여 계약을 이행할 것을 약속하는 협약을 정함에 있다.\n    1. 계약건명 :\n    2. 계약금액 :\n    3. 발주자명 : 한국연구재단\n제2조(공동수급체) 공동수급체의 명칭, 사업소의 소재지, 대표자는 다음과 같다.\n    1. 명          칭 : ㅇㅇㅇ\n    2. 주사무소소재지 :\n    3. 대 표 자 성 명 :\n제3조(공동수급체의 구성원) ①공동수급체의 구성원은 다음과 같다.\n    1. ㅇㅇㅇ회사(대표자 :   )\n    2. ㅇㅇㅇ회사(대표자 :   )\n  ②공동수급체의 대표자는 ㅇㅇㅇ로 한다.\n  ③대표자는 발주자 및 제3자에 대하여 공동수급체를 대표하며, 공동수급체의 재산의 관리 및 대금청구 등의 권한을 가진다.\n제4조(효력기간) 본 협정서는 당사자간의 서명과 동시에 발효하며, 해당계약의 이행으로 종결된다. 다만, 발주자 또는 제3자에 대하여 공사와 관련한 권리․의무관계가 남아있는 한 본 협정서의 효력은 존속된다.\n제5조(의무) 공동수급체구성원은 제1조에서 규정한 목적을 수행하기""]",,
A_single_pipeline,1,한국수자원공사_건설통합시스템(CMS) 고도화.hwp,central,과업수행 기간(사업기간)은 얼마인가요?,착수일로부터 365일간 (12개월),과업수행 기간 : 착수일로부터 365일간 (12개월),"[""5. 과업수행 기간 : 착수일로부터 365일간 (12개월)\n※ 소프트웨어 개발사업 적정 사업기간 산정기준에 따른 사업임\n   ([별표1] 소프트웨어 개발사업의 적정 사업기간 종합 산정서 참조)"", ""3. 과업수행 기간 및 장소\n과업수행기간 \n  본 과업의 과업수행기간은 착수일로부터 365일간(12개월)으로 하고, 다음의 경우 감독원과 협의하여 조정할 수 있다.""]",,
B_rule_single_route,1,한국수자원공사_건설통합시스템(CMS) 고도화.hwp,central,과업수행 기간(사업기간)은 얼마인가요?,착수일로부터 365일간 (12개월),과업수행 기간 : 착수일로부터 365일간 (12개월),"[""5. 과업수행 기간 : 착수일로부터 365일간 (12개월)\n※ 소프트웨어 개발사업 적정 사업기간 산정기준에 따른 사업임\n   ([별표1] 소프트웨어 개발사업의 적정 사업기간 종합 산정서 참조)"", ""4. 과업범위\n  □ 위원회\n   ◦ 업무별 수요조사 및 사전협의를 할 수 있는 기능 구축\n   ◦ 위원 Pool 관리 기능의 문제점 분석 및 개선방안 제시\n   ◦ 위원별 활동 실적 집계·관리 및 평가 점수 부여 경향 분석한 기능 구축\n   ◦ 위원회별 평가 항목, 조건 및 양식을 관리할 수 있는 기능 구축\n   ◦ 위원회별 임시계정 발급 및 해당 평가만을 위한 별도의 로그인 및 평가 기능 구축\n   ◦ 평가 안건에 대해 디지털 서류로 확인할 수 있는 기능 구축\n   ◦ 위원이 제출한 채점표, 사유서 등의 현황을 업무 담당자가 실시간으로 확인할 수 있는 기능 구축\n   ◦ 위원수당, 회의비 등 위원회 소요 경비를 입력하고, 재무시스템과 연계하여 회계처리 등을 진행할 수 있는 기능 구축\n   ◦ 위원회별 업무 성격과 프로세스에 따라 관리할 수 있는 기능 구축"", ""12. 과업심의위원회\n가. 본 사업은 「소프트웨어 진흥법」 제50조에 따른 과업내용 확정을 위하여 과업심의위원회를 개최한 사업임 [별표2] \n나. 본 사업은 「소프트웨어 진흥법」 제50조, 같은 법 시행령 제47조 제1항 제2호, 제3호에 따른 과업내용 변경 및 그에 따른 계약금액·계약기간 조정이 필요한 경우, 계약상대자는 국가기관 등의 장에게 소프트웨어사업 과업변경요청서*를 제출하여 과업심의위원회 개최를 요청할 수 있으며, 국가기관등의 장은 과업심의위원회 개최요청에 대해서 특별한 사정이 없으면 수용해야 함\n   * 「소프트웨어사업 계약 및 관리감독에 관한 지침」 별지 13호 서식 참조""]",,
C_rule_multi_route,1,한국수자원공사_건설통합시스템(CMS) 고도화.hwp,central,과업수행 기간(사업기간)은 얼마인가요?,착수일로부터 365일간 (12개월),과업수행 기간 : 착수일로부터 365일간 (12개월),"[""5. 과업수행 기간 : 착수일로부터 365일간 (12개월)\n※ 소프트웨어 개발사업 적정 사업기간 산정기준에 따른 사업임\n   ([별표1] 소프트웨어 개발사업의 적정 사업기간 종합 산정서 참조)"", ""4. 과업범위\n  □ 위원회\n   ◦ 업무별 수요조사 및 사전협의를 할 수 있는 기능 구축\n   ◦ 위원 Pool 관리 기능의 문제점 분석 및 개선방안 제시\n   ◦ 위원별 활동 실적 집계·관리 및 평가 점수 부여 경향 분석한 기능 구축\n   ◦ 위원회별 평가 항목, 조건 및 양식을 관리할 수 있는 기능 구축\n   ◦ 위원회별 임시계정 발급 및 해당 평가만을 위한 별도의 로그인 및 평가 기능 구축\n   ◦ 평가 안건에 대해 디지털 서류로 확인할 수 있는 기능 구축\n   ◦ 위원이 제출한 채점표, 사유서 등의 현황을 업무 담당자가 실시간으로 확인할 수 있는 기능 구축\n   ◦ 위원수당, 회의비 등 위원회 소요 경비를 입력하고, 재무시스템과 연계하여 회계처리 등을 진행할 수 있는 기능 구축\n   ◦ 위원회별 업무 성격과 프로세스에 따라 관리할 수 있는 기능 구축"", ""12. 과업심의위원회\n가. 본 사업은 「소프트웨어 진흥법」 제50조에 따른 과업내용 확정을 위하여 과업심의위원회를 개최한 사업임 [별표2] \n나. 본 사업은 「소프트웨어 진흥법」 제50조, 같은 법 시행령 제47조 제1항 제2호, 제3호에 따른 과업내용 변경 및 그에 따른 계약금액·계약기간 조정이 필요한 경우, 계약상대자는 국가기관 등의 장에게 소프트웨어사업 과업변경요청서*를 제출하여 과업심의위원회 개최를 요청할 수 있으며, 국가기관등의 장은 과업심의위원회 개최요청에 대해서 특별한 사정이 없으면 수용해야 함\n   * 「소프트웨어사업 계약 및 관리감독에 관한 지침」 별지 13호 서식 참조"", ""10. 하도급\n계약상대자는 당해 용역의 과업대상 일부를 제3자에게 하도급하거나, 승인을 받은 하도급 조건을 변경하고자 하는 경우에는 하도급거래 공정화에 관한 법률 제3조의2 규정에 의한 소프트웨어사업 표준하도급계약서 등 관련 자료를 첨부하여 K-water의 사전승인을 요청하여야 한다.\n요청을 받은 K-water는 계약의 품질확보 등 적정성 여부를 판단하여 14일 이내에 그 승인 여부를 계약상대자에게 통지하여야 한다. 다만, K-water는 정당한 사유에 따라 통지기간을 연장하고자 할 경우에는 그 연장사유와 통지예정기한을 지체 없이 계약상대자에게 통지하여야 한다.\nK-water가 계약당사자에게 나항의 하도급 승인여부를 기간 내에 통지하지 아니하거나 통지기간연장을 통지하지 아니한 경우에는 가항의 하도급을 승인한 것으로 본다.\n계약상대자는 하도급계약과 관련 하도급거래 공정화에 관한 법률의 규정을 준수하여야 하며, K-water의 요청이 있는 경우 하도급계약의 준수실태 등을 K-water가 확인할 수 있도록 표준하도급계약서상의 주요내용에 대하여 K-water에게 보고하여야 한다.""]",,
A_single_pipeline,1,한국수자원공사_수도사업장 통합 사고분석솔루션 시범구축 용역.hwp,central,이 사업의 사업기간은 어떻게 되나요?,착수일로부터 120일간,하도급 사전승인본 사업의 하도급의 경우「소프트웨어 진흥법」 및 「소프트웨어사업 계약 및 관리감독에 관한 지침」(과학기술정보통신부 고시)의 규정에 의하여 반드시 하도급계약 전에 발주기관으로부터 사전승인을 받아야 함,"[""1.1.6 하도급에 관한 사항\n   가. 하도급 사전승인본 사업의 하도급의 경우「소프트웨어 진흥법」 및 「소프트웨어사업 계약 및 관리감독에 관한 지침」(과학기술정보통신부 고시)의 규정에 의하여 반드시 하도급계약 전에 발주기관으로부터 사전승인을 받아야 함\n   나. 하도급 비율제한본 사업의 과업의 일부를 하도급하려는 경우 「소프트웨어 진흥법」 제51조제1항 에 따라 사업금액의 100분의 50을 초과할 수 없으며, 소프트웨어 진흥법 제51조 제3항에 따라 재하도급은 원칙적으로 불허함. 다만, 같은 항 제1호 및 제2호에 에 해당하는 경우 허가\n       * 소프트웨어 진흥법 제51조에 따라 하도급계약전 발주기관으로부터 승인을 받아야함\n   다. 하도급 계획서 제출본 사업 과업의 일부를 하도급하려는 경우입찰 시 및 계약체결 시 「소프트웨어사업 계약 및 관리감독에 관한 지침」(과학기술정보통신부 고시)의 별지 서식 제7호의 소프트웨어사업 하도급계획서를 제출하여야 함\n   라. 하도급 계약의 적정성 판단 세부기준하도급계약의 승인을 신청하는 경우, 「소프트웨어사업 계약 및 관리감독에 관한 지침」별표3에 따른 [하도급계약의 적정성 판단 세부기준]에 따라 적정성 여부를 판단하며, 평가점수가 85점 이상인 경우에 한하여 하도급계약을 승인함. 다만, 85점 이상인 경우라 하더라도 하도급 계약의 세부 조건 등으로 인하여 사업의 원활한 수행이 불가능하다고 인정되는 경우 그 사유를 기재하여 하도급 승인 거절을 통보할 수 있음"", ""1.1.7 사업자 선정 방식\n   가. 본 사업의 사업자 선정은 「국가를 당사자로 하는 계약에 관한 법률」시행령 제43조 및 제43조의2의 규정에 따라 한국수자원공사(이하 “K-water”라 함) 「협상에 의한 계약 체결기준」을 적용함\n   나. 제안서 평가항목 및 배점한도는 별첨의 “제안서 평가기준 및 작성양식” 참고""]",,
B_rule_single_route,1,한국수자원공사_수도사업장 통합 사고분석솔루션 시범구축 용역.hwp,central,이 사업의 사업기간은 어떻게 되나요?,착수일로부터 120일간,하도급 사전승인본 사업의 하도급의 경우「소프트웨어 진흥법」 및 「소프트웨어사업 계약 및 관리감독에 관한 지침」(과학기술정보통신부 고시)의 규정에 의하여 반드시 하도급계약 전에 발주기관으로부터 사전승인을 받아야 함,"[""1.1.6 하도급에 관한 사항\n   가. 하도급 사전승인본 사업의 하도급의 경우「소프트웨어 진흥법」 및 「소프트웨어사업 계약 및 관리감독에 관한 지침」(과학기술정보통신부 고시)의 규정에 의하여 반드시 하도급계약 전에 발주기관으로부터 사전승인을 받아야 함\n   나. 하도급 비율제한본 사업의 과업의 일부를 하도급하려는 경우 「소프트웨어 진흥법」 제51조제1항 에 따라 사업금액의 100분의 50을 초과할 수 없으며, 소프트웨어 진흥법 제51조 제3항에 따라 재하도급은 원칙적으로 불허함. 다만, 같은 항 제1호 및 제2호에 에 해당하는 경우 허가\n       * 소프트웨어 진흥법 제51조에 따라 하도급계약전 발주기관으로부터 승인을 받아야함\n   다. 하도급 계획서 제출본 사업 과업의 일부를 하도급하려는 경우입찰 시 및 계약체결 시 「소프트웨어사업 계약 및 관리감독에 관한 지침」(과학기술정보통신부 고시)의 별지 서식 제7호의 소프트웨어사업 하도급계획서를 제출하여야 함\n   라. 하도급 계약의 적정성 판단 세부기준하도급계약의 승인을 신청하는 경우, 「소프트웨어사업 계약 및 관리감독에 관한 지침」별표3에 따른 [하도급계약의 적정성 판단 세부기준]에 따라 적정성 여부를 판단하며, 평가점수가 85점 이상인 경우에 한하여 하도급계약을 승인함. 다만, 85점 이상인 경우라 하더라도 하도급 계약의 세부 조건 등으로 인하여 사업의 원활한 수행이 불가능하다고 인정되는 경우 그 사유를 기재하여 하도급 승인 거절을 통보할 수 있음"", ""1.1.7 사업자 선정 방식\n   가. 본 사업의 사업자 선정은 「국가를 당사자로 하는 계약에 관한 법률」시행령 제43조 및 제43조의2의 규정에 따라 한국수자원공사(이하 “K-water”라 함) 「협상에 의한 계약 체결기준」을 적용함\n   나. 제안서 평가항목 및 배점한도는 별첨의 “제안서 평가기준 및 작성양식” 참고""]",,
C_rule_multi_route,1,한국수자원공사_수도사업장 통합 사고분석솔루션 시범구축 용역.hwp,central,이 사업의 사업기간은 어떻게 되나요?,착수일로부터 120일간,하도급 사전승인본 사업의 하도급의 경우「소프트웨어 진흥법」 및 「소프트웨어사업 계약 및 관리감독에 관한 지침」(과학기술정보통신부 고시)의 규정에 의하여 반드시 하도급계약 전에 발주기관으로부터 사전승인을 받아야 함,"[""1.1.6 하도급에 관한 사항\n   가. 하도급 사전승인본 사업의 하도급의 경우「소프트웨어 진흥법」 및 「소프트웨어사업 계약 및 관리감독에 관한 지침」(과학기술정보통신부 고시)의 규정에 의하여 반드시 하도급계약 전에 발주기관으로부터 사전승인을 받아야 함\n   나. 하도급 비율제한본 사업의 과업의 일부를 하도급하려는 경우 「소프트웨어 진흥법」 제51조제1항 에 따라 사업금액의 100분의 50을 초과할 수 없으며, 소프트웨어 진흥법 제51조 제3항에 따라 재하도급은 원칙적으로 불허함. 다만, 같은 항 제1호 및 제2호에 에 해당하는 경우 허가\n       * 소프트웨어 진흥법 제51조에 따라 하도급계약전 발주기관으로부터 승인을 받아야함\n   다. 하도급 계획서 제출본 사업 과업의 일부를 하도급하려는 경우입찰 시 및 계약체결 시 「소프트웨어사업 계약 및 관리감독에 관한 지침」(과학기술정보통신부 고시)의 별지 서식 제7호의 소프트웨어사업 하도급계획서를 제출하여야 함\n   라. 하도급 계약의 적정성 판단 세부기준하도급계약의 승인을 신청하는 경우, 「소프트웨어사업 계약 및 관리감독에 관한 지침」별표3에 따른 [하도급계약의 적정성 판단 세부기준]에 따라 적정성 여부를 판단하며, 평가점수가 85점 이상인 경우에 한하여 하도급계약을 승인함. 다만, 85점 이상인 경우라 하더라도 하도급 계약의 세부 조건 등으로 인하여 사업의 원활한 수행이 불가능하다고 인정되는 경우 그 사유를 기재하여 하도급 승인 거절을 통보할 수 있음"", ""1.1.7 사업자 선정 방식\n   가. 본 사업의 사업자 선정은 「국가를 당사자로 하는 계약에 관한 법률」시행령 제43조 및 제43조의2의 규정에 따라 한국수자원공사(이하 “K-water”라 함) 「협상에 의한 계약 체결기준」을 적용함\n   나. 제안서 평가항목 및 배점한도는 별첨의 “제안서 평가기준 및 작성양식” 참고""]",,
A_single_pipeline,1,한국수자원공사_용인 첨단 시스템반도체 국가산단 용수공급사업 타당성.hwp,central,이 용역의 과업수행기간(사업기간)은 착수일로부터 몇 개월이며 일수로는 몇 일입니까?,착수일로부터 14개월(420일간),"이 용역의 과업기간은 착수일로부터 14개월(420일간)로 하고, 계약상대자는 「용역계약일반조건」 제18조의 3항, 제19조, 제24조 및 다음의 경우에 사장 또는 그 위임을 받은 자에게 서면으로 계약기간의 변경을 청구할 수 있다","[""1.5 과업수행기간\n이 용역의 과업기간은 착수일로부터 14개월(420일간)로 하고, 계약상대자는 「용역계약일반조건」 제18조의 3항, 제19조, 제24조 및 다음의 경우에 사장 또는 그 위임을 받은 자에게 서면으로 계약기간의 변경을 청구할 수 있다.\n(1) 관계기관의 협의 및 검토가 관계기관의 사유로 지연되었을 때\n(2) 민원발생에 의해 조사업무 수행이 불가능할 때\n(3) 본 과업과 관련된 상위계획 변경으로 인해 과업수행이 불가능할 때\n1.6 과업의 범위 및 내용\n본 용역은 용인 첨단 시스템반도체 국가산업단지 적기 용수공급을 위한 타당성 조사 및 기본계획 수립으로 건설기술진흥법, 「건설공사 타당성 조사지침」(‘16.5, 국토부), 건설기술관리규정(K-water) 관련 법령 및 규정에서 정하는 관련업무 수행을 과업범위로 하며, 그 주요내용은 다음과 같다.\n1.6.1 자료 수집 및 기초 현황 조사\n(1) 관련 법령 및 기준, 선행 조사, 국가 및 지자체 관련 계획 등 수집 분석\n(2) 건설공사와 관련된 계획, 사회경제적 지표 등 수요예측을 위한 기초 자료\n(3) 교통량, 시설물 등에 대한 현지조사 결과 및 현황 자료\n1.6.2 현지조사\n(1) 측량조사\n(2) 지질 및 토질조사\n(3) 보상조사\n1.6.3 타당성 조사\n(1) 취수원 선정 \n(2) 용수수급전망 및 용수공급계획 수립(수요분석 및 예측의 방법, 수요예측 결과 등 수요분석 및 예측을 수행한 자료)\n(3) 주요시설물 계획(대안의 제시 및 검토 등을 수행한 자료)\n(4) 타당성 평가(기본계획 수립 포함)\n(5) 사업집행방안 검토\n1.6.4 사업 홍보 및 설명자료 제작(필요시)\n1.6.5 기술심의 및 보완\n1.6.6 보고서 및 성과품 제출 등\n  1.7 계약변경 조건\n「계약일반조건 제15조」, 「계약일반조건 제16조」, 「계약일반조건 제17조」 및 다음의 경우 계약상대자는 이 과업을 감독원(“감독원”이라 함은 사장으로부터 감독에 관한 업무를 위임받아 수행하는 자를 말한다. 이하 같다.)과 협의하여 변경할 수 있다"", "" 검토 내용은 본 과업의 특별과업지시서를 따른다.\n① 자료 수집 및 기초 현황 조사\n② 현지 조사 \n③ 취수원 선정\n④ 용수수급전망 및 용수공급계획\n⑤ 주요시설물계획\n⑥ 타당성 평가\n⑦ 사업집행방안 검토(기본계획(안))\n⑧ 기타 감독원이 요구하는 사항 등\n(3) 현지조사 과업의 일정 및 소요 기간으로 인해 초기보고서 작성시까지 현지조사 분석 결과의 도출이 어렵다고 판단되는 경우, 감독원과 협의하여 조사계획 부분 및 진행 결과를 수록할 수 있다.\n1.9.7 민원 및 인․허가\n계약상대자는 과업과정에서 민원 또는 행정처분이 발생치 않도록 민원 및 대관 인․허가 업무를 수행하여야 한다.\n1.9.8 관계기관 협의 등\n(1) 계약상대자는 주민·이해당사자 의견수렴 및 관계기관 협의 등 K-water가 시행하는 업무를 충실히 지원하여야 하며, K-water의 요구에 의해 필요한 경우 업무를 대행하여야 한다.\n(2) 계약상대자는 주요시설물의 규모, 용수배분량, 지자체 상수도 설치현황 및 계획, 관로노선 및 시공한계, 인․허가 등과 관련, 과업수행기간 중 관련지자체 등과 협의가 필요한 사항에 대해서는 협의를 실시하고 그 결과를 검토하여 적정방안을 수립․제시하여야 한다.\n1.9.9 계약자통합정보시스템(cts.kwater.or.kr) 활용\n계약자통합정보시스템은 계약상대자가 용역을 수행함에 있어 K-water 보유 시스템을 활용하여 발주자에게 전자적 문서 및 정보를 제출토록 하여 계약상대자와 발주자간의 정보 교환 및 활용을 목적으로 하며(일명 “수자원CTS”라고 지칭한다), 종이문서를 최소화하여 용역을 지원함으로써 건설CALS를 구현하기 위한 것이다.\n(1) 계약상대자는 수자원CTS에 접속하여 용역의 착공, 기성, 공정보고 등의 업무수행시 수자원CTS에 등록된 표준양식으로 전자문서를 작성하여 발주자에게 자료제출, 보고, 승인요청 등의 업무를 수행하여야 한다.\n(2) 계약상대자는 수자원CTS 활용을 위하여 필요한 사용법을 숙달하여 업무를 수행해야 하며, 컴퓨터, 네트워크 등 시스템 사""]",,
B_rule_single_route,1,한국수자원공사_용인 첨단 시스템반도체 국가산단 용수공급사업 타당성.hwp,central,이 용역의 과업수행기간(사업기간)은 착수일로부터 몇 개월이며 일수로는 몇 일입니까?,착수일로부터 14개월(420일간),"이 용역의 과업기간은 착수일로부터 14개월(420일간)로 하고, 계약상대자는 「용역계약일반조건」 제18조의 3항, 제19조, 제24조 및 다음의 경우에 사장 또는 그 위임을 받은 자에게 서면으로 계약기간의 변경을 청구할 수 있다","[""1.5 과업수행기간\n이 용역의 과업기간은 착수일로부터 14개월(420일간)로 하고, 계약상대자는 「용역계약일반조건」 제18조의 3항, 제19조, 제24조 및 다음의 경우에 사장 또는 그 위임을 받은 자에게 서면으로 계약기간의 변경을 청구할 수 있다.\n(1) 관계기관의 협의 및 검토가 관계기관의 사유로 지연되었을 때\n(2) 민원발생에 의해 조사업무 수행이 불가능할 때\n(3) 본 과업과 관련된 상위계획 변경으로 인해 과업수행이 불가능할 때\n1.6 과업의 범위 및 내용\n본 용역은 용인 첨단 시스템반도체 국가산업단지 적기 용수공급을 위한 타당성 조사 및 기본계획 수립으로 건설기술진흥법, 「건설공사 타당성 조사지침」(‘16.5, 국토부), 건설기술관리규정(K-water) 관련 법령 및 규정에서 정하는 관련업무 수행을 과업범위로 하며, 그 주요내용은 다음과 같다.\n1.6.1 자료 수집 및 기초 현황 조사\n(1) 관련 법령 및 기준, 선행 조사, 국가 및 지자체 관련 계획 등 수집 분석\n(2) 건설공사와 관련된 계획, 사회경제적 지표 등 수요예측을 위한 기초 자료\n(3) 교통량, 시설물 등에 대한 현지조사 결과 및 현황 자료\n1.6.2 현지조사\n(1) 측량조사\n(2) 지질 및 토질조사\n(3) 보상조사\n1.6.3 타당성 조사\n(1) 취수원 선정 \n(2) 용수수급전망 및 용수공급계획 수립(수요분석 및 예측의 방법, 수요예측 결과 등 수요분석 및 예측을 수행한 자료)\n(3) 주요시설물 계획(대안의 제시 및 검토 등을 수행한 자료)\n(4) 타당성 평가(기본계획 수립 포함)\n(5) 사업집행방안 검토\n1.6.4 사업 홍보 및 설명자료 제작(필요시)\n1.6.5 기술심의 및 보완\n1.6.6 보고서 및 성과품 제출 등\n  1.7 계약변경 조건\n「계약일반조건 제15조」, 「계약일반조건 제16조」, 「계약일반조건 제17조」 및 다음의 경우 계약상대자는 이 과업을 감독원(“감독원”이라 함은 사장으로부터 감독에 관한 업무를 위임받아 수행하는 자를 말한다. 이하 같다.)과 협의하여 변경할 수 있다"", "" 검토 내용은 본 과업의 특별과업지시서를 따른다.\n① 자료 수집 및 기초 현황 조사\n② 현지 조사 \n③ 취수원 선정\n④ 용수수급전망 및 용수공급계획\n⑤ 주요시설물계획\n⑥ 타당성 평가\n⑦ 사업집행방안 검토(기본계획(안))\n⑧ 기타 감독원이 요구하는 사항 등\n(3) 현지조사 과업의 일정 및 소요 기간으로 인해 초기보고서 작성시까지 현지조사 분석 결과의 도출이 어렵다고 판단되는 경우, 감독원과 협의하여 조사계획 부분 및 진행 결과를 수록할 수 있다.\n1.9.7 민원 및 인․허가\n계약상대자는 과업과정에서 민원 또는 행정처분이 발생치 않도록 민원 및 대관 인․허가 업무를 수행하여야 한다.\n1.9.8 관계기관 협의 등\n(1) 계약상대자는 주민·이해당사자 의견수렴 및 관계기관 협의 등 K-water가 시행하는 업무를 충실히 지원하여야 하며, K-water의 요구에 의해 필요한 경우 업무를 대행하여야 한다.\n(2) 계약상대자는 주요시설물의 규모, 용수배분량, 지자체 상수도 설치현황 및 계획, 관로노선 및 시공한계, 인․허가 등과 관련, 과업수행기간 중 관련지자체 등과 협의가 필요한 사항에 대해서는 협의를 실시하고 그 결과를 검토하여 적정방안을 수립․제시하여야 한다.\n1.9.9 계약자통합정보시스템(cts.kwater.or.kr) 활용\n계약자통합정보시스템은 계약상대자가 용역을 수행함에 있어 K-water 보유 시스템을 활용하여 발주자에게 전자적 문서 및 정보를 제출토록 하여 계약상대자와 발주자간의 정보 교환 및 활용을 목적으로 하며(일명 “수자원CTS”라고 지칭한다), 종이문서를 최소화하여 용역을 지원함으로써 건설CALS를 구현하기 위한 것이다.\n(1) 계약상대자는 수자원CTS에 접속하여 용역의 착공, 기성, 공정보고 등의 업무수행시 수자원CTS에 등록된 표준양식으로 전자문서를 작성하여 발주자에게 자료제출, 보고, 승인요청 등의 업무를 수행하여야 한다.\n(2) 계약상대자는 수자원CTS 활용을 위하여 필요한 사용법을 숙달하여 업무를 수행해야 하며, 컴퓨터, 네트워크 등 시스템 사""]",,
C_rule_multi_route,1,한국수자원공사_용인 첨단 시스템반도체 국가산단 용수공급사업 타당성.hwp,central,이 용역의 과업수행기간(사업기간)은 착수일로부터 몇 개월이며 일수로는 몇 일입니까?,착수일로부터 14개월(420일간),"이 용역의 과업기간은 착수일로부터 14개월(420일간)로 하고, 계약상대자는 「용역계약일반조건」 제18조의 3항, 제19조, 제24조 및 다음의 경우에 사장 또는 그 위임을 받은 자에게 서면으로 계약기간의 변경을 청구할 수 있다","[""1.5 과업수행기간\n이 용역의 과업기간은 착수일로부터 14개월(420일간)로 하고, 계약상대자는 「용역계약일반조건」 제18조의 3항, 제19조, 제24조 및 다음의 경우에 사장 또는 그 위임을 받은 자에게 서면으로 계약기간의 변경을 청구할 수 있다.\n(1) 관계기관의 협의 및 검토가 관계기관의 사유로 지연되었을 때\n(2) 민원발생에 의해 조사업무 수행이 불가능할 때\n(3) 본 과업과 관련된 상위계획 변경으로 인해 과업수행이 불가능할 때\n1.6 과업의 범위 및 내용\n본 용역은 용인 첨단 시스템반도체 국가산업단지 적기 용수공급을 위한 타당성 조사 및 기본계획 수립으로 건설기술진흥법, 「건설공사 타당성 조사지침」(‘16.5, 국토부), 건설기술관리규정(K-water) 관련 법령 및 규정에서 정하는 관련업무 수행을 과업범위로 하며, 그 주요내용은 다음과 같다.\n1.6.1 자료 수집 및 기초 현황 조사\n(1) 관련 법령 및 기준, 선행 조사, 국가 및 지자체 관련 계획 등 수집 분석\n(2) 건설공사와 관련된 계획, 사회경제적 지표 등 수요예측을 위한 기초 자료\n(3) 교통량, 시설물 등에 대한 현지조사 결과 및 현황 자료\n1.6.2 현지조사\n(1) 측량조사\n(2) 지질 및 토질조사\n(3) 보상조사\n1.6.3 타당성 조사\n(1) 취수원 선정 \n(2) 용수수급전망 및 용수공급계획 수립(수요분석 및 예측의 방법, 수요예측 결과 등 수요분석 및 예측을 수행한 자료)\n(3) 주요시설물 계획(대안의 제시 및 검토 등을 수행한 자료)\n(4) 타당성 평가(기본계획 수립 포함)\n(5) 사업집행방안 검토\n1.6.4 사업 홍보 및 설명자료 제작(필요시)\n1.6.5 기술심의 및 보완\n1.6.6 보고서 및 성과품 제출 등\n  1.7 계약변경 조건\n「계약일반조건 제15조」, 「계약일반조건 제16조」, 「계약일반조건 제17조」 및 다음의 경우 계약상대자는 이 과업을 감독원(“감독원”이라 함은 사장으로부터 감독에 관한 업무를 위임받아 수행하는 자를 말한다. 이하 같다.)과 협의하여 변경할 수 있다"", "" 검토 내용은 본 과업의 특별과업지시서를 따른다.\n① 자료 수집 및 기초 현황 조사\n② 현지 조사 \n③ 취수원 선정\n④ 용수수급전망 및 용수공급계획\n⑤ 주요시설물계획\n⑥ 타당성 평가\n⑦ 사업집행방안 검토(기본계획(안))\n⑧ 기타 감독원이 요구하는 사항 등\n(3) 현지조사 과업의 일정 및 소요 기간으로 인해 초기보고서 작성시까지 현지조사 분석 결과의 도출이 어렵다고 판단되는 경우, 감독원과 협의하여 조사계획 부분 및 진행 결과를 수록할 수 있다.\n1.9.7 민원 및 인․허가\n계약상대자는 과업과정에서 민원 또는 행정처분이 발생치 않도록 민원 및 대관 인․허가 업무를 수행하여야 한다.\n1.9.8 관계기관 협의 등\n(1) 계약상대자는 주민·이해당사자 의견수렴 및 관계기관 협의 등 K-water가 시행하는 업무를 충실히 지원하여야 하며, K-water의 요구에 의해 필요한 경우 업무를 대행하여야 한다.\n(2) 계약상대자는 주요시설물의 규모, 용수배분량, 지자체 상수도 설치현황 및 계획, 관로노선 및 시공한계, 인․허가 등과 관련, 과업수행기간 중 관련지자체 등과 협의가 필요한 사항에 대해서는 협의를 실시하고 그 결과를 검토하여 적정방안을 수립․제시하여야 한다.\n1.9.9 계약자통합정보시스템(cts.kwater.or.kr) 활용\n계약자통합정보시스템은 계약상대자가 용역을 수행함에 있어 K-water 보유 시스템을 활용하여 발주자에게 전자적 문서 및 정보를 제출토록 하여 계약상대자와 발주자간의 정보 교환 및 활용을 목적으로 하며(일명 “수자원CTS”라고 지칭한다), 종이문서를 최소화하여 용역을 지원함으로써 건설CALS를 구현하기 위한 것이다.\n(1) 계약상대자는 수자원CTS에 접속하여 용역의 착공, 기성, 공정보고 등의 업무수행시 수자원CTS에 등록된 표준양식으로 전자문서를 작성하여 발주자에게 자료제출, 보고, 승인요청 등의 업무를 수행하여야 한다.\n(2) 계약상대자는 수자원CTS 활용을 위하여 필요한 사용법을 숙달하여 업무를 수행해야 하며, 컴퓨터, 네트워크 등 시스템 사""]",,
A_single_pipeline,1,한국수자원조사기술원_수문자료정보관리시스템(HDIMS) 재구축 용역(3단계.hwp,central,사업명,수문자료정보관리시스템(HDIMS) 재구축사업(3단계),해당 정보를 찾을 수 없습니다.,[],,
B_rule_single_route,1,한국수자원조사기술원_수문자료정보관리시스템(HDIMS) 재구축 용역(3단계.hwp,central,사업명,수문자료정보관리시스템(HDIMS) 재구축사업(3단계),해당 정보를 찾을 수 없습니다.,[],,
C_rule_multi_route,1,한국수자원조사기술원_수문자료정보관리시스템(HDIMS) 재구축 용역(3단계.hwp,central,사업명,수문자료정보관리시스템(HDIMS) 재구축사업(3단계),해당 정보를 찾을 수 없습니다.,[],,
A_single_pipeline,1,한국수출입은행_(긴급) 모잠비크 마푸토 지능형교통시스템(ITS) 구축사업.hwp,central,이 사업의 입찰 방법과 낙찰자 결정방식은 무엇인가요?,"입찰 방법은 제한경쟁입찰이며, 낙찰자 결정방식은 협상에 의한 계약방식이다.",입찰 및 계약 방법,"[""제출 가능)\nⅡ. 제안 일반사항\n입찰 및 계약 방법\n    □ 입찰 방법 : 제한경쟁입찰\n    □ 낙찰자 결정방식 : 협상에 의한 계약방식\n      ◦「국가를 당사자로 하는 계약에 관한 법률 시행령」제43조 및 \""협상에 의한 계약체결 기준(기획재정부예규 제721호, 2024.9.13, 일부개정)”에 의거, “협상에 의한 계약방식”을 적용 \n 입찰공고\n    □ 공고방법 : 국가종합전자조달시스템(나라장터)과 당행 홈페이지 공고\n    □ 공고기간 : “입찰공고”에 의함 \n입찰 참가자격\n    □ 공통사항\n      ◦ 입찰마감일 기준「국가를 당사자로 하는 계약에 관한 법률 시행령」제12조 및 동법 시행규칙 제14조 규정에 의한 유자격자\n      ◦ 입찰마감일 기준「국가를 당사자로 하는 계약에 관한 법률」, 「지방자치단체를 당사자로 하는 계약에 관한 법률」,「공공기관의 운영에 관한 법률」에 의한 부정당업자에 해당하지 않는 업체 또는 기관\n      ◦ 국가종합전자조달시스템 입찰참가자격등록규정(조달청고시 제2024-1호, 2024.1.19)에 의하여 입찰일 전일까지 조달청 경쟁입찰참가자격 등록을 마친 업체 또는 기관\n        - 공동도급이 가능하며, 이 경우 “공동계약운용요령(기획재정부 계약예규 제721호, 2024.9.13, 일부개정)”에 명시된 공동이행방식 적용\n    □ 실적 및 역량\n      ◦ 참여사는 아래의 분야별 요구조건을 모두 충족하여야 하며, 요구되는 실적은 공동도급을 통해 보완 가능"", ""      ◦ 기타 입찰등록 마감일 현재 당행 규정 및 국가계약법상 하자가 있거나, 전국은행연합회의 “신용정보관리규약”에서 정하는 연체, 대위변제･대지급, 부도, 관련인에 의한 신용거래정보 및 금융질서문란정보의 등록대상자, 국세 및 지방세 체납기관 등은 입찰에 참가할 수 없음\n      ◦ 국가계약법 제27조의5 및 동법 시행령 제12조 제3항에 따라 조세포탈 등을 한 자로서 유죄판결이 확정된 날부터 2년이 지나지 아니한 자는 동 입찰에 참여 불가\n- 입찰자는 동법 시행령 제12조 제3항 각 호에 해당하지 아니한다는 서약서를 입찰시 제출하며, 만일 서약내용이 허위로 판명될 경우 계약의 해제‧해지를 당할 수 있고 부정당업자 입찰참가자격제한 처분을 받을 수 있음\n      ◦ 당행이 제한한 자격요건 등을 충족하지 아니한 자는 입찰참가자격 미충족으로 결격 처리됨\n      ◦ 본 용역에 고용된 업체(관계회사 포함)는 당해 사업의 공급자 (예 : 건설시공사, 기자재공급사 등) 참여에 제한될 수 있음. 다만, 일괄수주방식의 사업에 컨설턴트 역할만을 수행할 목적으로 참여하는 경우에는 그러하지 아니함.\n    □ 기타사항\n      ◦ 본 입찰은「지문인식 신원확인 입찰」이 적용되므로 개인인증서를 보유한 대표자 또는 입찰대리인은 국가종합전자조달시스템 전자입찰특별유의서 제7조 제1항 제5호에 따라 미리 지문정보를 등록하여 전자입찰서 제출이 가능함.\n- 단, “지문인식 신원확인 폐지에 따른 조달업무처리 특례 안내(조달청 고시 제2023-51호(2023.12.21.제정)”에 따라 지문정보를 등록하지 않아도 전자입찰에 참가할 수 있으므로 관련 절차는 해당 고시를 참고하기 바람""]",,
B_rule_single_route,1,한국수출입은행_(긴급) 모잠비크 마푸토 지능형교통시스템(ITS) 구축사업.hwp,central,이 사업의 입찰 방법과 낙찰자 결정방식은 무엇인가요?,"입찰 방법은 제한경쟁입찰이며, 낙찰자 결정방식은 협상에 의한 계약방식이다.","당행을 퇴직한 후 2년이 지나지 않은 퇴직자를 고용한 업체로서, 퇴직자가 당행의 입찰 또는 계약과 직접 관련된 업무를 담당하고 있는 업체","[""1. 금번 입찰에 공동도급으로 참여하는 경우, 평가대상항목 건수/금액/해외 결과(점수)를 아래 수식에 따라 합산\n         - 유사사업 수행실적 점수 = ITS 현장시스템 구축 계획 점수(70%) + ICT 시스템 구축 계획 점수(30%)\n            * 상기의 수식 및 비율은 공동도급사 간 실제 참여지분율 구성과는 관련 없음\n         - 동일 분야에 복수의 기업이 공동으로 참여 또는 참여기업이 복수의 분야에 수행실적을 제출하는 경우, 참여지분율(동일업종 참여지분율 합을 100%로 합산)을 고려하여 실적 산정(공동수급 약정서에 참여사별 담당 업무범위 명시 필수)"", ""□ 유의사항\n      ◦ 공동수급체의 대표자가 부도, 부정당업자제재, 영업정지 등의 상태인 경우에는 해당 공동수급체의 결격사유로 평가하며(제안서 평가를 종료 후 평가 당시 그 결격사유가 있었던 사실이 확인된 경우이거나 제안서 평가 종료 후부터 계약체결 전까지 결격사유가 발생하고 해소되지 않은 경우에도 같다), 공동수급체 구성원 중 부도, 부정당업자제재, 영업정지, 입찰무효 등의 상태인 자가 있는 경우에는 제안서 평가를 할 수 있다. 이 경우 출자비율 또는 분담비율은 입찰서 제출 마감일 전날까지 확정ㆍ제출된 비율로 하며, 결격사유가 있는 구성원의 출자비율 또는 분담비율을 남은 구성원에게 배분하지 않는다.\n- 위에 따라 공동수급체를 평가할 경우 결격사유 있는 구성원의 출자비율 또는 분담비율을 전체 사업에 대한 비율로 환산하여 기술능력평가점수에서 환산 비율에 해당하는 점수(소수점 다섯째 자리에서 반올림하여 산출)만큼 감점한다. 다만, 제안서 평가를 종료 후 평가당시 그 결격사유가 있었던 사실이 확인된 경우에는 감점처리한 후 재산정한 점수로 평가 절차를 다시 진행한다.\n      ◦ 당행 계약관련 내규에 의거하여 계약의 투명성 및 공정성을 위하여 아래 각 호에 해당하는 업체는 계약상대자가 될 수 없음. (단, 사업목적 달성을 위한 불가피한 경우는 예외로 함)\n           당행을 퇴직한 후 2년이 지나지 않은 퇴직자를 고용한 업체로서, 퇴직자가 당행의 입찰 또는 계약과 직접 관련된 업무를 담당하고 있는 업체 \n            당행의 현직 임직원이 설립한 업체\n      ◦ 위에 따라 계약 상대자의 자격이 제한되는 기간은 아래와 같음.\n           퇴직자가 당행을 퇴직한 날로부터 2년이 되는 날 또는 업체와의 고용관계가 종료되는 날 중 빠른 날까지\n           현직 임직원이 당행을 퇴직하는 날로부터 2년이 되는 날 또는 업체에 대한 지배관계가 종료되는 날 중 빠른 날까지\n               * 서식 16 「퇴직자 영입현황 확인서」제출\n"", ""제안서 평가방법\n    □ 평가위원회 구성\n      ◦ 당행 내규에 따라 평가위원회를 구성\n      ◦ 정량평가는 제안서 및 증빙서류를 기반으로 입찰 담당부서에서 평가\n    □ 평가분야별 배점\n      ◦ 평가는 기술평가와 가격평가로 구분하며, 기술ㆍ가격평가 비중은 기술평가(90%) + 입찰가격 평가(10%)임\n        ※ 본 건은 기술능력이 사업수행에 중대한 영향을 미치는 바, 기재부 계약예규 ‘협상에 의한 계약체결기준’ 제7조 2항에 따른 기술 중시형 사업으로, 기술능력평가 및 입찰가격평가 배점한도를 20점 범위 내에서 조정하였음\n    □ 기술평가\n      ◦ 기술능력평가는 세부항목별로 5등급(A, B, C, D, E)으로 평가하고, 이를 합산하여 제안서별로 점수 산정\n      ◦ 평가등급별 점수""]",,
C_rule_multi_route,1,한국수출입은행_(긴급) 모잠비크 마푸토 지능형교통시스템(ITS) 구축사업.hwp,central,이 사업의 입찰 방법과 낙찰자 결정방식은 무엇인가요?,"입찰 방법은 제한경쟁입찰이며, 낙찰자 결정방식은 협상에 의한 계약방식이다.","당행을 퇴직한 후 2년이 지나지 않은 퇴직자를 고용한 업체로서, 퇴직자가 당행의 입찰 또는 계약과 직접 관련된 업무를 담당하고 있는 업체","[""1. 금번 입찰에 공동도급으로 참여하는 경우, 평가대상항목 건수/금액/해외 결과(점수)를 아래 수식에 따라 합산\n         - 유사사업 수행실적 점수 = ITS 현장시스템 구축 계획 점수(70%) + ICT 시스템 구축 계획 점수(30%)\n            * 상기의 수식 및 비율은 공동도급사 간 실제 참여지분율 구성과는 관련 없음\n         - 동일 분야에 복수의 기업이 공동으로 참여 또는 참여기업이 복수의 분야에 수행실적을 제출하는 경우, 참여지분율(동일업종 참여지분율 합을 100%로 합산)을 고려하여 실적 산정(공동수급 약정서에 참여사별 담당 업무범위 명시 필수)"", ""□ 유의사항\n      ◦ 공동수급체의 대표자가 부도, 부정당업자제재, 영업정지 등의 상태인 경우에는 해당 공동수급체의 결격사유로 평가하며(제안서 평가를 종료 후 평가 당시 그 결격사유가 있었던 사실이 확인된 경우이거나 제안서 평가 종료 후부터 계약체결 전까지 결격사유가 발생하고 해소되지 않은 경우에도 같다), 공동수급체 구성원 중 부도, 부정당업자제재, 영업정지, 입찰무효 등의 상태인 자가 있는 경우에는 제안서 평가를 할 수 있다. 이 경우 출자비율 또는 분담비율은 입찰서 제출 마감일 전날까지 확정ㆍ제출된 비율로 하며, 결격사유가 있는 구성원의 출자비율 또는 분담비율을 남은 구성원에게 배분하지 않는다.\n- 위에 따라 공동수급체를 평가할 경우 결격사유 있는 구성원의 출자비율 또는 분담비율을 전체 사업에 대한 비율로 환산하여 기술능력평가점수에서 환산 비율에 해당하는 점수(소수점 다섯째 자리에서 반올림하여 산출)만큼 감점한다. 다만, 제안서 평가를 종료 후 평가당시 그 결격사유가 있었던 사실이 확인된 경우에는 감점처리한 후 재산정한 점수로 평가 절차를 다시 진행한다.\n      ◦ 당행 계약관련 내규에 의거하여 계약의 투명성 및 공정성을 위하여 아래 각 호에 해당하는 업체는 계약상대자가 될 수 없음. (단, 사업목적 달성을 위한 불가피한 경우는 예외로 함)\n           당행을 퇴직한 후 2년이 지나지 않은 퇴직자를 고용한 업체로서, 퇴직자가 당행의 입찰 또는 계약과 직접 관련된 업무를 담당하고 있는 업체 \n            당행의 현직 임직원이 설립한 업체\n      ◦ 위에 따라 계약 상대자의 자격이 제한되는 기간은 아래와 같음.\n           퇴직자가 당행을 퇴직한 날로부터 2년이 되는 날 또는 업체와의 고용관계가 종료되는 날 중 빠른 날까지\n           현직 임직원이 당행을 퇴직하는 날로부터 2년이 되는 날 또는 업체에 대한 지배관계가 종료되는 날 중 빠른 날까지\n               * 서식 16 「퇴직자 영입현황 확인서」제출\n"", ""제안서 평가방법\n    □ 평가위원회 구성\n      ◦ 당행 내규에 따라 평가위원회를 구성\n      ◦ 정량평가는 제안서 및 증빙서류를 기반으로 입찰 담당부서에서 평가\n    □ 평가분야별 배점\n      ◦ 평가는 기술평가와 가격평가로 구분하며, 기술ㆍ가격평가 비중은 기술평가(90%) + 입찰가격 평가(10%)임\n        ※ 본 건은 기술능력이 사업수행에 중대한 영향을 미치는 바, 기재부 계약예규 ‘협상에 의한 계약체결기준’ 제7조 2항에 따른 기술 중시형 사업으로, 기술능력평가 및 입찰가격평가 배점한도를 20점 범위 내에서 조정하였음\n    □ 기술평가\n      ◦ 기술능력평가는 세부항목별로 5등급(A, B, C, D, E)으로 평가하고, 이를 합산하여 제안서별로 점수 산정\n      ◦ 평가등급별 점수"", ""4. 기술제안서 작성지침\n   □ 제안서 본문과 첨부물은 합쳐서 양면 제본하여 한 권으로 제출\n    ◦ 제안서 본문(30페이지 이내, 제목, 목차, 간지 제외) + 제안서 첨부물(50페이지 이내) = 제안서 1권(총 80페이지(40장) 이내)\n    ◦ 첨부물은 (별첨)의 제출서류목록 중 「서식 4, 5, 6, 7, 8, 9」를 의미\n    ◦ 제안서 본문 및 첨부물은 ᄒᆞᆫ글(hwp)로 작성하며, 글자크기 본문기준 13포인트, 글꼴 휴먼명조(영문글꼴 Times New Roman), 줄간격 160%, 좌우여백 25mm, 상하여백 각각 20mm, 15mm로 작성\n    ◦ 단, 표 안의 글자 크기는 12포인트 사용 가능(단, (서식 6) 및 (서식 9)는 글자 크기의 제한 없음)\n    ◦ A4 용지 세로로 작성\n      - A4로 작성하지 못하는 경우 A3를 A4 사이즈로 접어서 붙이며, 이 경우 2페이지로 간주(A3 최대 6페이지(3장)까지 허용)\n    ◦ 과다한 비용이 지출되는 오프셋 인쇄 등 금지(컬러인쇄물은 용지 크기에 관계 없이 단면 3페이지 이내로 제한)\n   □ 각종 증빙서류는 별권(1권)으로 제본하여 제출\n    ◦ 사업수행실적 관련 실적증명서는 발주처가 발급한 실적증명서 또는 해외건설협회 등 관련 기관이 발급한 증명서를 의미함.\n      - 단, 민간거래 실적은 실적증명서와 더불어 세금계산서 및 계약서 사본(인감으로 원본대조필) 또는 낙찰통보공문을 첨부하여야 함.\n      - 실적증명서는 사본(인감으로 원본대조필)도 가능\n      - 실적증명서는 (서식 6)의 유사사업실적 기재 순번과 동일한 번호 견출지 부착 및 용역 종류, 용역기간, 지분금액에 형광펜으로 표시\n    ◦ 해당 분야 조직․인력․기술․지식 보유현황 관련 증명서는 관련 협회 또는 기관에서 발급한 경력증명서를 의미함.\n      - 단, 등록되지 않은 자는 본 제안요청서에 첨부된 ‘(참고 2) 참여인력의 등급 및 자격기준’을 참조하여 제안사의 대표이사가 날인한 이력서, 경""]",,
A_single_pipeline,1,한국어촌어항공단_한국어촌어항공단 경영관리시스템(ERP·GW) 기능 고도.hwp,extreme,이 사업의 계약방법(입찰방식)과 평가기준은 무엇인가?,"제한경쟁입찰(협상에 의한 계약), 평가기준: 기술평가 90%, 가격평가 10%",□ 계약방법 : 제한경쟁입찰(협상에 의한 계약),"[""□ 계약방법 : 제한경쟁입찰(협상에 의한 계약)\n  - 평가기준 : 기술평가(90%), 가격평가(10%)\n □ 기타사항 : 상용소프트웨어 발주 과업 미포함"", ""가. 사업수행 요건\n  ❍ 본 사업은 공인된 패키지솔루션 기반으로 우리 공단의 경영관리시스템 및 그룹웨어 구축 연동 사업임. 제안사는 동 시스템의 구축, 개발 경험 및 해당 기술자를 보유하여 기능 고도화 수행이 가능하여야 하며, 사업관리시스템․홈페이지 등 향후 연계될 시스템을 고려하여 제안하여야 함.\n     ※ 해당 시스템 구축개발 경험에 대한 증빙과 납품하는 상용 소프트웨어별 제조사의 제품공급 및 기술지원 확약서 제출 필요\n  ❍ 제안사는 사업의 성공적 추진을 위하여 신의와 성실 의무를 가져야 함.\n  ❍ 본 사업은 제안요청서 및 발주처의 지시에 따라 성실히 수행하여야 함.\n  ❍ 전산시스템 운용 및 유지관리에 대처할 수 있는 구체적 기술이전, 교육계획, 유지관리 계획을 포함한 지원계획을 제시하여야 함.\n  ❍ 기존 정보시스템의 자료는 신규시스템으로 이관 후에도 충돌 또는 오류 없이 운영되어야 하며, 기존 데이터 또한 지속·유지되어야 함.\n  ❍ 사업 내용이 변경되는 경우 과업 변경 절차에 따라 상호 협의하여 결정하며, 제안서 작성 시 제안요청서 요구사항에 명시되지 않았으나 제안사 판단으로 추가되어야 할 요구사항에 대해서는 별도 표시하여 추가 작성 가능함\n  ❍ 사업수행은 국가를 당사자로 하는 계약에 관한 법률, 계약예규 등 관련 법규와 제반 계약 내용을 준수하여야 함.""]",,
B_rule_single_route,1,한국어촌어항공단_한국어촌어항공단 경영관리시스템(ERP·GW) 기능 고도.hwp,extreme,이 사업의 계약방법(입찰방식)과 평가기준은 무엇인가?,"제한경쟁입찰(협상에 의한 계약), 평가기준: 기술평가 90%, 가격평가 10%","❍ 본 사업의 과업 일부를 하도급하려는 경우 「소프트웨어 진흥법」 제51조제1항에 따라 물품(상용소프트웨어 포함) 구매금액을 제외한 소프트웨어사업금액의 100분의 50을 초과할 수 없으며, 같은 법 제3항에 따라 다시 하도급은 원칙적으로 불허함","[""□ 하도급\n ❍ 제안사(원도급자)와 하도급자는 [별지8] 하도급계약의 적정성 판단 세부기준 평가의 증빙서류를 입찰 시 제안서에 첨부하여야 한다.\n ❍ 본사업 관련해서 발주기관은 「소프트웨어 진흥법」 제51조제7항에 따라 하도급 제한 규정 준수 여부를 지속적으로 관리·감독하여야 하고, 제1항부터 제5항까지의 규정을 위반한 계약상대자에게 시정을 요구하여야 함\n ❍ 본 사업 하도급의 경우 「소프트웨어 진흥법」 제51조제5항 및 「소프트웨어사업 계약 및 관리감독에 관한 지침」의 규정에 의하여 반드시 하도급계약 전에 발주기관으로부터 사전승인을 받아야 함(하도급 사전승인)\n ❍ 본 사업의 과업 일부를 하도급하려는 경우 「소프트웨어 진흥법」 제51조제1항에 따라 물품(상용소프트웨어 포함) 구매금액을 제외한 소프트웨어사업금액의 100분의 50을 초과할 수 없으며, 같은 법 제3항에 따라 다시 하도급은 원칙적으로 불허함. 다만, 같은 법 제51조제2항 각 호 및 제3항 각 호에 해당하는 경우 그러하지 아니함(하도급 비율제한)\n ❍ 본 사업 과업의 일부를 하도급하려는 경우 계약체결 시 「소프트웨어사업 계약 및 관리감독에 관한 지침」의 별지 제7호서식 ‘소프트웨어사업 하도급 계획서’를 제출하여야 함(하도급 계획서 제출)\n ❍ 본 사업은 기술성 평가 시 ‘하도급계획적정성’을 평가 항목에 포함하는 사업으로 「소프트웨어 기술성 평가기준 지침」 별지 제4호서식 소프트웨어사업 ‘하도급 계획 적정성 확인서’를 제출해야 함​ \n ❍ 하도급계약의 승인을 신청하는 경우, 「소프트웨어사업 계약 및 관리감독에 관한 지침」의 별표 3 [하도급계약의 적정성 판단 세부기준]에 따라 적정성여부를 판단하며, 평가점수가 85점 이상인 경우에 한하여 하도급계약을 승인함. 다만, 85점 이상인 경우라 하더라도 하도급 계약의 세부 조건 등으로 인하여 사업의 원활한 수행이 불가능하다고 인정되는 경우 그 사유를 기재하여 하도급 승인 거절을 통보할 수 있음\n ❍ 본 사업에서 전체 사업금액 대비 10%를 초과하여 하도급하"", ""제1조(목적) 이 협정서는 아래 계약을 공동수급체의 구성원이 재정, 경영 및 기술능력과 인원 및 기자재를 동원하여 공사․물품 또는 용역에 대한 계획․입찰․시공 등을 위하여 일정 출자비율에 따라 공동연대하여 계약을 이행할 것을 약속하는 협약을 정함에 있다.\n  1. 계약건명 :\n  2. 계약금액 :\n  3. 발주자명 :\n제2조(공동수급체) 공동수급체의 명칭, 사업소의 소재지, 대표자는 다음과 같다.\n  1. 명          칭 : ㅇㅇㅇ\n  2. 주사무소소재지 :\n  3. 대 표 자 성 명 :\n제3조(공동수급체의 구성원) ①공동수급체의 구성원은 다음과 같다.\n  1. ㅇㅇㅇ회사(대표자 :   )\n  2. ㅇㅇㅇ회사(대표자 :   )\n  ②공동수급체의 대표자는 ㅇㅇㅇ로 한다.\n  ③대표자는 발주자 및 제3자에 대하여 공동수급체를 대표하며, 공동수급체의 재산의 관리 및 대금청구 등의 권한을 가진다.\n제4조(효력기간) 본 협정서는 당사자간의 서명과 동시에 발효하며, 당해계약의 이행으로 종결된다. 다만, 발주자 또는 제3자에 대하여 공사와 관련한 권리․의무관계가 남아있는 한 본 협정서의 효력은 존속된다.\n제5조(의무) 공동수급체구성원은 제1조에서 규정한 목적을 수행하기 위하여 성실․근면 및 신의를 바탕으로 하여 필요한 모든 지식과 기술을 활용할 것을 약속한다.\n제6조(책임) 공동수급체의 구성원은 발주기관에 대한 계약상의 의무이행에 대하여 연대하여 책임을 진다.\n제7조(하도급) 공동수급체 구성원 중 일부 구성원이 단독으로 하도급계약을 체결하고자 하는 경우에는 다른 구성원의 동의를 받아야 한다.\n제8조(거래계좌) 회계예규 「공동계약운용요령」제11조의 규정에 정한 바에 의한 선금, 기성대가 등은 다음계좌로 지급받는다.\n  1. ㅇㅇㅇ회사(공동수급체대표자) : ㅇㅇ은행, 계좌번호 ㅇㅇㅇ, 예금주 ㅇㅇㅇ\n  2. ㅇㅇㅇ회사 : ㅇㅇ은행, 계좌번호 ㅇㅇㅇ, 예금주 ㅇㅇㅇ\n제9조(구성원의 출자비율) ①당 공동수급체의 출자비율은 다음과 같이 정한다.\n  1. ㅇㅇㅇ :    %\n"", ""□ 입찰 및 낙찰 방식\n ❍ 입찰방식 : 제한경쟁에 의한 입찰\n   - 「국가를 당사자로 하는 계약에 관한 법률」 제7조\n   - 본 사업에 응찰하고자 하는 사업자는 제안요청서에 따라 제안서를 작성하여 제출하여야 한다.\n ❍ 낙찰자 결정방식 : 협상에 의한 계약\n   - 국가를 당사자로 하는 계약에 관한 법률 시행령 제43조 및 제43조의2 「협상에 의한 계약체결기준」에 의해 제안서를 평가한 후 협상절차를 통하여 사업자를 선정한다.\n   - 협상적격자 및 협상 순위 결정\n     ․ 제안서 평가 결과, 기술평가 및 입찰가격 평가점수에 대한 종합평가를 거쳐 고득점 순위로 협상 우선순위를 결정한다.\n        ※ 기술능력평가 점수가 기술능력평가분야 배점한도의 85% 미만인 업체는 협상적격자에서 제외\n     ․ 협상적격자 중 평가점수가 가장 높은 자를 우선협상대상자로 선정한다.\n     ․ 제안서 평가 결과 합산점수가 동점이면 기술평가 점수가 높은 제안사를 우선 순위자로 하고, 기술평가 점수도 같은 경우에는 기술평가의 세부 평가항목 중 배점이 큰 항목에서 높은 점수를 얻은 자를 우선 순위자로 한다.\n        ※ 본 항목에 기술하지 아니한 사항은 「협상에 의한 계약 체결기준」(기획재정부 계약예규 538호, 2020.12.28)에 따름\n ❍ 협상 및 계약\n   - 선정된 사업자는 발주기관의 보완요청사항과 협상에 의한 조정결과를 반영하여 계약을 체결하여야 한다.\n   - 제안사의 제안내용 중 수정, 보완, 변경이 필요한 경우 발주기관은 이를 요구할 수 있으며 제안사는 요구를 성실히 수용해야 한다.\n   - 협상 및 계약의 상세 방법 및 절차는 조달청 기준에 따른다.""]",,
C_rule_multi_route,1,한국어촌어항공단_한국어촌어항공단 경영관리시스템(ERP·GW) 기능 고도.hwp,extreme,이 사업의 계약방법(입찰방식)과 평가기준은 무엇인가?,"제한경쟁입찰(협상에 의한 계약), 평가기준: 기술평가 90%, 가격평가 10%","❍ 본 사업의 과업 일부를 하도급하려는 경우 「소프트웨어 진흥법」 제51조제1항에 따라 물품(상용소프트웨어 포함) 구매금액을 제외한 소프트웨어사업금액의 100분의 50을 초과할 수 없으며, 같은 법 제3항에 따라 다시 하도급은 원칙적으로 불허함","[""□ 하도급\n ❍ 제안사(원도급자)와 하도급자는 [별지8] 하도급계약의 적정성 판단 세부기준 평가의 증빙서류를 입찰 시 제안서에 첨부하여야 한다.\n ❍ 본사업 관련해서 발주기관은 「소프트웨어 진흥법」 제51조제7항에 따라 하도급 제한 규정 준수 여부를 지속적으로 관리·감독하여야 하고, 제1항부터 제5항까지의 규정을 위반한 계약상대자에게 시정을 요구하여야 함\n ❍ 본 사업 하도급의 경우 「소프트웨어 진흥법」 제51조제5항 및 「소프트웨어사업 계약 및 관리감독에 관한 지침」의 규정에 의하여 반드시 하도급계약 전에 발주기관으로부터 사전승인을 받아야 함(하도급 사전승인)\n ❍ 본 사업의 과업 일부를 하도급하려는 경우 「소프트웨어 진흥법」 제51조제1항에 따라 물품(상용소프트웨어 포함) 구매금액을 제외한 소프트웨어사업금액의 100분의 50을 초과할 수 없으며, 같은 법 제3항에 따라 다시 하도급은 원칙적으로 불허함. 다만, 같은 법 제51조제2항 각 호 및 제3항 각 호에 해당하는 경우 그러하지 아니함(하도급 비율제한)\n ❍ 본 사업 과업의 일부를 하도급하려는 경우 계약체결 시 「소프트웨어사업 계약 및 관리감독에 관한 지침」의 별지 제7호서식 ‘소프트웨어사업 하도급 계획서’를 제출하여야 함(하도급 계획서 제출)\n ❍ 본 사업은 기술성 평가 시 ‘하도급계획적정성’을 평가 항목에 포함하는 사업으로 「소프트웨어 기술성 평가기준 지침」 별지 제4호서식 소프트웨어사업 ‘하도급 계획 적정성 확인서’를 제출해야 함​ \n ❍ 하도급계약의 승인을 신청하는 경우, 「소프트웨어사업 계약 및 관리감독에 관한 지침」의 별표 3 [하도급계약의 적정성 판단 세부기준]에 따라 적정성여부를 판단하며, 평가점수가 85점 이상인 경우에 한하여 하도급계약을 승인함. 다만, 85점 이상인 경우라 하더라도 하도급 계약의 세부 조건 등으로 인하여 사업의 원활한 수행이 불가능하다고 인정되는 경우 그 사유를 기재하여 하도급 승인 거절을 통보할 수 있음\n ❍ 본 사업에서 전체 사업금액 대비 10%를 초과하여 하도급하"", ""제1조(목적) 이 협정서는 아래 계약을 공동수급체의 구성원이 재정, 경영 및 기술능력과 인원 및 기자재를 동원하여 공사․물품 또는 용역에 대한 계획․입찰․시공 등을 위하여 일정 출자비율에 따라 공동연대하여 계약을 이행할 것을 약속하는 협약을 정함에 있다.\n  1. 계약건명 :\n  2. 계약금액 :\n  3. 발주자명 :\n제2조(공동수급체) 공동수급체의 명칭, 사업소의 소재지, 대표자는 다음과 같다.\n  1. 명          칭 : ㅇㅇㅇ\n  2. 주사무소소재지 :\n  3. 대 표 자 성 명 :\n제3조(공동수급체의 구성원) ①공동수급체의 구성원은 다음과 같다.\n  1. ㅇㅇㅇ회사(대표자 :   )\n  2. ㅇㅇㅇ회사(대표자 :   )\n  ②공동수급체의 대표자는 ㅇㅇㅇ로 한다.\n  ③대표자는 발주자 및 제3자에 대하여 공동수급체를 대표하며, 공동수급체의 재산의 관리 및 대금청구 등의 권한을 가진다.\n제4조(효력기간) 본 협정서는 당사자간의 서명과 동시에 발효하며, 당해계약의 이행으로 종결된다. 다만, 발주자 또는 제3자에 대하여 공사와 관련한 권리․의무관계가 남아있는 한 본 협정서의 효력은 존속된다.\n제5조(의무) 공동수급체구성원은 제1조에서 규정한 목적을 수행하기 위하여 성실․근면 및 신의를 바탕으로 하여 필요한 모든 지식과 기술을 활용할 것을 약속한다.\n제6조(책임) 공동수급체의 구성원은 발주기관에 대한 계약상의 의무이행에 대하여 연대하여 책임을 진다.\n제7조(하도급) 공동수급체 구성원 중 일부 구성원이 단독으로 하도급계약을 체결하고자 하는 경우에는 다른 구성원의 동의를 받아야 한다.\n제8조(거래계좌) 회계예규 「공동계약운용요령」제11조의 규정에 정한 바에 의한 선금, 기성대가 등은 다음계좌로 지급받는다.\n  1. ㅇㅇㅇ회사(공동수급체대표자) : ㅇㅇ은행, 계좌번호 ㅇㅇㅇ, 예금주 ㅇㅇㅇ\n  2. ㅇㅇㅇ회사 : ㅇㅇ은행, 계좌번호 ㅇㅇㅇ, 예금주 ㅇㅇㅇ\n제9조(구성원의 출자비율) ①당 공동수급체의 출자비율은 다음과 같이 정한다.\n  1. ㅇㅇㅇ :    %\n"", ""□ 입찰 및 낙찰 방식\n ❍ 입찰방식 : 제한경쟁에 의한 입찰\n   - 「국가를 당사자로 하는 계약에 관한 법률」 제7조\n   - 본 사업에 응찰하고자 하는 사업자는 제안요청서에 따라 제안서를 작성하여 제출하여야 한다.\n ❍ 낙찰자 결정방식 : 협상에 의한 계약\n   - 국가를 당사자로 하는 계약에 관한 법률 시행령 제43조 및 제43조의2 「협상에 의한 계약체결기준」에 의해 제안서를 평가한 후 협상절차를 통하여 사업자를 선정한다.\n   - 협상적격자 및 협상 순위 결정\n     ․ 제안서 평가 결과, 기술평가 및 입찰가격 평가점수에 대한 종합평가를 거쳐 고득점 순위로 협상 우선순위를 결정한다.\n        ※ 기술능력평가 점수가 기술능력평가분야 배점한도의 85% 미만인 업체는 협상적격자에서 제외\n     ․ 협상적격자 중 평가점수가 가장 높은 자를 우선협상대상자로 선정한다.\n     ․ 제안서 평가 결과 합산점수가 동점이면 기술평가 점수가 높은 제안사를 우선 순위자로 하고, 기술평가 점수도 같은 경우에는 기술평가의 세부 평가항목 중 배점이 큰 항목에서 높은 점수를 얻은 자를 우선 순위자로 한다.\n        ※ 본 항목에 기술하지 아니한 사항은 「협상에 의한 계약 체결기준」(기획재정부 계약예규 538호, 2020.12.28)에 따름\n ❍ 협상 및 계약\n   - 선정된 사업자는 발주기관의 보완요청사항과 협상에 의한 조정결과를 반영하여 계약을 체결하여야 한다.\n   - 제안사의 제안내용 중 수정, 보완, 변경이 필요한 경우 발주기관은 이를 요구할 수 있으며 제안사는 요구를 성실히 수용해야 한다.\n   - 협상 및 계약의 상세 방법 및 절차는 조달청 기준에 따른다.""]",,
A_single_pipeline,1,한국연구재단_2024년 기초학문자료센터 시스템 운영 및 연구성과물 DB구.hwp,central,이 사업의 사업기간은 언제부터 언제까지인가?,2024년 10월 1일부터 2025년 9월 30일까지,"❍ 6개월 이상 장기사업의 경우, 참여인력을 대상으로 연1회 이상 보안 및 근무규정 준수 교육(1년 이상 사업의 경우는 연 2회 이상)을 실시하고, “용역사업 수행 보안 점검표”[재단서식]에 준하는 보안점검을 분기별로 실시하여야함","[""❍ 사업 수행과정에서 취득한 자료와 정보에 관하여 사업수행 중은 물론 사업 완료 후에도 이를 외부에 유출해서는 안 되며, 사업 완료 시 반납 및 정보보안담당자 입회하에 완전 폐기해야 함.\n  ❍ 사업자는 사업 최종 산출물에 대해 정보보안전문가 또는 전문보안 점검도구를 활용하여 보안 취약점을 점검, 도출된 취약점에 대한 개선을 완료하고 그 결과를 제출해야함.\n □ 보안관리 임무\n  ❍ “재단”의 사업 담당자는 “용역업체”의 참여인력, 장비, 소프트웨어, 문서, 기타 자료에 대한 보안 관리와 보안대책 수립ㆍ시행 등 제반사항에 대한 보안업무를 총괄함.\n  ❍ 사업과 관련한 보안관리 책임은 “용역업체”의 대표에게 있으며 대표는 사업 전반의 보안업무를 수행하는 관리책임자를 지정하여야함.\n  ❍ “수행사”의 관리책임자는 이 사업과 관련된 인원, 장비, 자료에 대한 보안업무 및 사업과 관련된 하도급업체의 보안관리 전반을 총괄함.\n □ “용역업체” 준수사항\n  ❍ 용역사업의 참여인력이 교체되거나 신상변동(해외여행 포함) 상황 발생 시 “재단”에 즉시 보고하여야함.\n  ❍ 과업내용서 또는 유지관리 수행계획서에 자료 보안관리 방법, 인원, 장비, 소프트웨어, 시설 등에 대한 보안점검ㆍ교육 등 보안관련 제반사항을 상세히 기술하여야함.\n  ❍ 6개월 이상 장기사업의 경우, 참여인력을 대상으로 연1회 이상 보안 및 근무규정 준수 교육(1년 이상 사업의 경우는 연 2회 이상)을 실시하고, “용역사업 수행 보안 점검표”[재단서식]에 준하는 보안점검을 분기별로 실시하여야함.\n  ❍ 사업에 대한 하도급 계약을 체결할 경우 본 사업계약 수준의 비밀(유출 시 “재단”에 피해가 발생될 수 있는 모든 정보)유지 조항을 포함하여야함.\n □ 참여인력에 대한 보안관리\n  ❍ 대표이사 및 참여인력에 대해서는 “보안서약서(대표자 : 직인, 참여인력 : 친필서명)”과 건강보험료 납부확인서(재직 및 신원확인용), “참여인력 현황표”[재단서식]를 J-Tops에 제출하여야함\n  ❍ 참여인력은 사업 수행 전 참여인"", ""력에 대해 법적 또는 “재단”의 내부 규정에 따른 비밀유지 의무 준수 및 위반 시 처벌내용 등 보안교육에 응해야함.\n □ 자료 보안관리\n  ❍ 전산망도, IP현황, 개인정보, 소프트웨어, 문서, 기타자료 등 “재단”에서 제공하는 “누출금지 대상 정보”는 ”자료관리대장”[재단서식]을 작성하여 “재단”의 사업 담당자와 “용역업체” 관리책임자가 직접 서명한 후 인계ㆍ인수하여야함.\n  ❍ 누출금지 대상 정보, 사업 관련 자료 및 사업과정에서 생산된 모든 산출물은 웹하드, P2P, 웹오피스, 클라우드 서비스 등 인터넷 자료공유 사이트 및 비인가 사이트에 저장하거나 참여인력 개인이 보관할 수 없으며, 재단의 파일서버에 저장하거나 사업 담당자가 지정한 PC에 저장 및 관리하여야함.(파일 저장 서버는 인터넷 연결 금지)\n  ❍ 비공개 자료는 매일 퇴근 시 반납하고, 일반문서의 경우, 잠금장치가 된 보관함 등 안전한 장소에 보관함.\n  ❍ 사업 수행으로 생산되는 산출물 및 기록은 비인가자에게 제공ㆍ대여ㆍ열람을 금지함.\n  ❍ 수행사업 관련 자료는 개인 메일함에 저장을 금지하고 전자우편을 이용해 자료전송이 필요한 경우에는 자체 전자우편을 이용하고(상용메일 사용 금지), 첨부 자료는 암호화 후 수ㆍ발신해야 한다. 단, 대외비 이상의 비밀은 전자우편으로 수ㆍ발신을 금지함.\n □ 사무실ㆍ장비에 대한 보안관리\n  ❍ 사업의 수행 장소는 원격지 개발을 원칙으로 하며, “재단”과 상호 협의하여 정함. 단, 설비 및 기타 작업환경은 사업자가 구비하여야 함. \n     ※ 외부 작업 장소 소요비용은 프로젝트 비용에 포함되어 있음.\n  ❍ 정보시스템(PC, 노트북, 서버, USB 등)을 반입ㆍ출할 때마다 “재단”에 “전산장비 반입ㆍ반출 확인서”[재단서식]를 J-Tops에 등록하고 승인받아야 하며, “재단”이 제공하는 보안 프로그램 설치, 악성코드 감염여부 확인 및 보안점검을 수행하여야함\n  ❍ 반입된 PC, 노트북의 컴퓨터명은 참여인력 성명으로 설정하고, 그룹명은 소속 업체 명으로 설정하여야함""]",,
B_rule_single_route,1,한국연구재단_2024년 기초학문자료센터 시스템 운영 및 연구성과물 DB구.hwp,central,이 사업의 사업기간은 언제부터 언제까지인가?,2024년 10월 1일부터 2025년 9월 30일까지,"❍ 본 사업의 과업의 일부를 하도급하려는 경우 「소프트웨어 진흥법」 제51조제1항에 따라 사업금액의 100분의 50을 초과할 수 없으며, 제3항에 따라 재하도급은 원칙적으로 불허함","[""󰏅 평가점수 산출\n  ❍ 평가비율 : 기술평가(90%), 가격평가(10%)\n  ❍ 종합평가점수 산출 = 기술 평가점수 + 입찰가격 평가점수 \n  ❍ 동점 시 처리방침\n    ※ 종합평가점수가 동점인 경우 기술평가 점수가 높은 업체를 선정  \n    ※ 기술평가점수도 동일한 경우 배점이 높은 평가항목에서 점수가 높은 업체 선정"", ""5. 하도급 관련 준수사항\n 󰏅 하도급 사전승인\n  ❍ 사업 관련하여 하도급 계약 시에는 관련규정(소프트웨어 진흥법, 하도급거래 공정화에 관한 법률, 국가계약법, 계약예규, 소프트웨어사업 계약 및 관리감독에 관한 지침 등)에 따라 사전 서면승인을 반드시 받아야 함. 다만, 이 경우에는 계약상의 모든 책임은 주 사업자가 지는 것으로 함\n ※ 「소프트웨어 진흥법』 제51조(하도급 제한 등) 및 「소프트웨어사업 계약 및 관리감독에 관한 지침」등\n 󰏅 하도급 비율제한\n  ❍ 본 사업의 과업의 일부를 하도급하려는 경우 「소프트웨어 진흥법」 제51조제1항에 따라 사업금액의 100분의 50을 초과할 수 없으며, 제3항에 따라 재하도급은 원칙적으로 불허함. 다만, 같은 법 제51조 제3항 각 호에 해당하는 경우 그러하지 아니함\n 󰏅 하도급 계획서 제출 요청\n  ❍ 본 사업 과업의 일부를 하도급하려는 경우 입찰 시 및 계약체결 시 「소프트웨어사업 계약 및 관리감독에 관한 지침」(과학기술정보통신부고시 제2023-15호)의 별지 서식의 소프트웨어사업 하도급계획서를 제출하여야 함\n 󰏅 하도급 계약의 적정성 판단 세부기준\n  ❍ 하도급계약의 승인을 신청하는 경우,「소「소프트웨어사업 계약 및 관리감독에 관한 지침」(과학기술정보통신부고시 제2023-15호)」에 따른 [하도급계약의 적정성 판단 세부기준]에 따라 적정성여부를 판단하며, 평가점수가 85점 이상인 경우에 한하여 하도급계약을 승인함. 다만, 85점 이상인 경우라 하더라도 하도급 계약의 세부 조건 등으로 인하여 사업의 원활한 수행이 불가능하다고 인정되는 경우 그 사유를 기재하여 하도급 승인 거절을 통보할 수 있음.\n  ❍ 하도급 적정성 평가에 필요한 관련 자료 및 제안내용을 제출하여야 함\n 󰏅 공동수급체 구성\n  ❍ 하도급 비율이 사업금액의 10% 초과하는 경우 하수급인과 공동수급체로 참여할 것을 권고함\n 󰏅 하도급 대금 지급\n  ❍ 본 과업은 하도급 가능 사업으로 계약상대자는 대가를 지급받은 경우 15일 이내에 하도급대금을 하수"", ""󰏅 평가방법\n  가. 기술평가 방법\n   ❍ 제안서의 공정한 평가를 위하여 전문가로 구성된 기술평가위원회를 구성하고, 제안서에 대한 기술평가는 제안사항 전반을 종합적으로 고려하여 평가한다.\n   ❍ 기술평가 항목 및 배점은 협상에 의한 계약 제안서 평가 세부 기준 및 소프트웨어 기술성 평가기준 지침을 준용한다.\n  ❍ 기술평가 점수는 평가위원이 평가한 점수를 최고점과 최저점을 제외(최저 또는 최고 점수가 2개 이상일 경우 이중 하나만 제외)한 나머지 점수를 산술평균한 점수를 90점 만점으로 환산하며 기술능력평가 분야 배점한도의 85% 이상인 자를 협상 적격자로 선정한다.\n   ❍ 평가점수에서 소수점 이하가 있는 경우 소수점 다섯째 자리에서 반올림한다.""]",,
C_rule_multi_route,1,한국연구재단_2024년 기초학문자료센터 시스템 운영 및 연구성과물 DB구.hwp,central,이 사업의 사업기간은 언제부터 언제까지인가?,2024년 10월 1일부터 2025년 9월 30일까지,"❍ 본 사업의 과업의 일부를 하도급하려는 경우 「소프트웨어 진흥법」 제51조제1항에 따라 사업금액의 100분의 50을 초과할 수 없으며, 제3항에 따라 재하도급은 원칙적으로 불허함","[""󰏅 평가점수 산출\n  ❍ 평가비율 : 기술평가(90%), 가격평가(10%)\n  ❍ 종합평가점수 산출 = 기술 평가점수 + 입찰가격 평가점수 \n  ❍ 동점 시 처리방침\n    ※ 종합평가점수가 동점인 경우 기술평가 점수가 높은 업체를 선정  \n    ※ 기술평가점수도 동일한 경우 배점이 높은 평가항목에서 점수가 높은 업체 선정"", ""5. 하도급 관련 준수사항\n 󰏅 하도급 사전승인\n  ❍ 사업 관련하여 하도급 계약 시에는 관련규정(소프트웨어 진흥법, 하도급거래 공정화에 관한 법률, 국가계약법, 계약예규, 소프트웨어사업 계약 및 관리감독에 관한 지침 등)에 따라 사전 서면승인을 반드시 받아야 함. 다만, 이 경우에는 계약상의 모든 책임은 주 사업자가 지는 것으로 함\n ※ 「소프트웨어 진흥법』 제51조(하도급 제한 등) 및 「소프트웨어사업 계약 및 관리감독에 관한 지침」등\n 󰏅 하도급 비율제한\n  ❍ 본 사업의 과업의 일부를 하도급하려는 경우 「소프트웨어 진흥법」 제51조제1항에 따라 사업금액의 100분의 50을 초과할 수 없으며, 제3항에 따라 재하도급은 원칙적으로 불허함. 다만, 같은 법 제51조 제3항 각 호에 해당하는 경우 그러하지 아니함\n 󰏅 하도급 계획서 제출 요청\n  ❍ 본 사업 과업의 일부를 하도급하려는 경우 입찰 시 및 계약체결 시 「소프트웨어사업 계약 및 관리감독에 관한 지침」(과학기술정보통신부고시 제2023-15호)의 별지 서식의 소프트웨어사업 하도급계획서를 제출하여야 함\n 󰏅 하도급 계약의 적정성 판단 세부기준\n  ❍ 하도급계약의 승인을 신청하는 경우,「소「소프트웨어사업 계약 및 관리감독에 관한 지침」(과학기술정보통신부고시 제2023-15호)」에 따른 [하도급계약의 적정성 판단 세부기준]에 따라 적정성여부를 판단하며, 평가점수가 85점 이상인 경우에 한하여 하도급계약을 승인함. 다만, 85점 이상인 경우라 하더라도 하도급 계약의 세부 조건 등으로 인하여 사업의 원활한 수행이 불가능하다고 인정되는 경우 그 사유를 기재하여 하도급 승인 거절을 통보할 수 있음.\n  ❍ 하도급 적정성 평가에 필요한 관련 자료 및 제안내용을 제출하여야 함\n 󰏅 공동수급체 구성\n  ❍ 하도급 비율이 사업금액의 10% 초과하는 경우 하수급인과 공동수급체로 참여할 것을 권고함\n 󰏅 하도급 대금 지급\n  ❍ 본 과업은 하도급 가능 사업으로 계약상대자는 대가를 지급받은 경우 15일 이내에 하도급대금을 하수"", ""󰏅 평가방법\n  가. 기술평가 방법\n   ❍ 제안서의 공정한 평가를 위하여 전문가로 구성된 기술평가위원회를 구성하고, 제안서에 대한 기술평가는 제안사항 전반을 종합적으로 고려하여 평가한다.\n   ❍ 기술평가 항목 및 배점은 협상에 의한 계약 제안서 평가 세부 기준 및 소프트웨어 기술성 평가기준 지침을 준용한다.\n  ❍ 기술평가 점수는 평가위원이 평가한 점수를 최고점과 최저점을 제외(최저 또는 최고 점수가 2개 이상일 경우 이중 하나만 제외)한 나머지 점수를 산술평균한 점수를 90점 만점으로 환산하며 기술능력평가 분야 배점한도의 85% 이상인 자를 협상 적격자로 선정한다.\n   ❍ 평가점수에서 소수점 이하가 있는 경우 소수점 다섯째 자리에서 반올림한다."", ""[주]\n 1.「신용정보의 이용 및 보호에 관한 법률」제2조 제8의3에 해당하는 신용조회사  또는「자본시장과 금융투자업에 관한 법률」제335조의3에 따라 업무를 영위하는신용평가사가 입찰공고일 이전에 평가하고 유효기간 내에 있는 회사채, 기업어음 및 기업신용평가등급을 국가종합전자조달시스템에 조회된 신용평가등급으로 평가하되, 가장 최근의 신용평가등급으로 평가한다. 다만, 가장 최근의 신용평가등급이 다수가 있으며 그 결과가 서로 다른 경우에는 가장 낮은 등급으로 평가한다.\n 2. 국가종합전자조달시스템에서 신용평가등급 확인서가 확인되지 않은 경우에는 최저등급으로 평가하며, 유효기간 시작일 또는 만료일이 입찰공고일인 경우에도 유효한 것으로 평가한다. 다만, 입찰공고일 다음날 이후에 발생 또는 수정된 자료는 평가에서 제외한다.\n 3. 주 1에도 불구하고, 합병 또는 분할한 자가 입찰공고일 이전에 평가한 신용평가등급이 없는 경우에는 입찰서 제출 마감일 전일까지 발급된 유효기간 내에 있는 가장 최근의 신용평가등급으로 평가한다. 다만, 합병 후 새로운 신용평가등급이 없는 경우에는 입찰공고일 이전에 평가하고 유효기간 내에 있는 신용평가등급으로서 합병 대상자 중 가장 낮은 신용평가등급을 받은 자의 신용평가등급으로 평가한다.\n 4. 추정가격이 고시금액 미만인 입찰에서 입찰공고일을 기준으로 최근 7년 이내에 사업을 개시한 창업기업에 대해서는 신용평가등급 점수상의 배점 한도를 부여한다. 이 경우 창업기업에 대한 확인은 「중소기업제품공공구매 종합정보망」에 등재된 자료로 확인하며, 창업기업확인서의 유효기간 내에 있어야 한다. 다만, 제안서 평가일 전일까지 발급된 자료도 심사에 포함하며, 이 경우 입찰공고일 이전 창업을 확인 할 수 있는 자료(법인인 경우 법인등기부상 법인설립등기일, 개인사업자인 경우에는 사업자등록증명서 상 사업자등록일)를 제출하여야 한다.(이하 창업기업에 대한 확인방법은 같다)\n 5. 공동수급체의 경우 구성원별 해당 점수에 지분율을 곱한 후 그 점수들을 합산하여 최종 평가하""]",,
A_single_pipeline,1,한국연구재단_2024년 대학산학협력활동 실태조사 시스템(UICC) 기능개선.hwp,extreme,사업기간은 어떻게 되나요?,계약일로부터 210일,해당 정보를 찾을 수 없습니다.,[],,
B_rule_single_route,1,한국연구재단_2024년 대학산학협력활동 실태조사 시스템(UICC) 기능개선.hwp,extreme,사업기간은 어떻게 되나요?,계약일로부터 210일,"※ 기술평가는 90점 만점(정량 + 정성)으로 실시하고, 종합평가 반영 시 90점으로 적용","[""※ 기술평가는 90점 만점(정량 + 정성)으로 실시하고, 종합평가 반영 시 90점으로 적용\n □ 제안 평가(평가회의)\n ◦ 장소 및 일시 : 제안서 접수마감 후 입찰업체 개별 통보\n ◦ 방법 : 발표(대면 또는 온라인) 평가\n   - 발표평가는 발표 15분, 질의응답 10분으로 운영\n    ※ 업체별 설명(PT) 순서는 제안서 접수순이며, 제안발표는 PM이 해야 함\n □ 우선협상대상자 선정\n   ㅇ 협상대상자 중 기술평가점수와 가격평가점수를 합한 점수가 1위인 제안사를 우선협상대상자로 선정하여 ‘협상에 의한 계약체결기준’에 따라 협상한다.\n     - 협상이 성립된 때에는 다른 협상적격자와의 협상은 실시하지 않는다.\n   ㅇ 협상대상자와 협상이 모두 결렬되면 재공고 입찰을 추진할 수 있다.\n   ㅇ 기타 규정되지 않은 사항은 관련 법령 및 재단 계약사무규칙에 의한다.\n □ 협상방법 및 기준\n   ㅇ 협상대상자가 제안한 사업내용, 이행방법, 이행일정 등 제안서의 내용을 대상으로 협상을 실시한다. (협상대상자와 협상을 통해 내용 일부 조정 가능)\n   ㅇ 가격은 당해 사업예산(또는 예정가격) 이하로 협상하되 협상대상자가 제안한 가격을 기준 가격으로 한다.\n □ 가격평가\n   ㅇ 협상에 의한 계약체결 기준에 따라 평가점수를 산출한다.\n □ 기타사항\n   ◦ 평가위원 명단은 공개하지 않으며 제안업체는 평가결과에 대하여 이의가 있는 경우 관련 법령을 따른다.\n   ㅇ 제안 세부 내용, 협상 결과는 공개하지 않음을 원칙으로 한다.\n   ㅇ 본 사업은 총 사업예산이 20억 미만인 사업으로, 「소프트웨어 진흥법」 제52조(소프트웨어사업 제안서 보상)에서 명시한 “제안서 보상 대상사업”이 아님.\n   ㅇ 제안가격부분은 시스템 구축에 필요한 각 항목별 세부비용을 구분 하여 제안토록 하고 금액에 대한 산출근거 및 기준을 부가가치세를 포함하여 구체적으로 제시하여야 하며, 소프트웨어 개발 업무에 대하여 ⌜개발규모에 의한 산정 방법(기능점수방식)⌟ 을 준용하여 산정하여야 한다.\n   "", ""1. 사업명: 2024년 대학 산학협력활동 실태조사 시스템(UICC) 기능개선\n2. 추진배경 및 필요성\n □ 한국연구재단법 제5조, 산업교육진흥 및 산학연협력촉진에 관한 법률 제39조의2 및 제43조에 따라 실시하는 대학 산학협력활동 실태조사를 안정적으로 운영 필요 \n □ 항목 지침 변경사항 등 변화에 신속하고 정확하게 대응하며, 기능개선에 대한 사용자 요구를 반영하여 사용자 편의성 강화 필요\n □ UICC의 효율적인 관리와 운영을 위한 지원 체계 및 각종 기관 요구사항에 대응 필요\n3. 주관기관 : 한국연구재단\n4. 사업기간 및 사업비\n □ 사업기간 : 계약일로부터 210일\n □ 사업금액 : 129,300,000원(부가세 포함)\n  ㅇ 예산 세부내역"", ""□ 공동수급(공동이행방식)의 형태로 참가할 경우, 아래 사항을 준수하여야 한다.\n ㅇ 본 사업은 공동수급을 허용하며, 공동수급업체 구성원은 국가를 당사자로 하는 계약에 관한 법률 시행령 제12조(경쟁입찰의 참가자격) 및 동법 시행규칙 제14조 규정에 저촉되지 않아야 한다.\n ㅇ 공동수급체는 5개 이하로 구성하여야 하며, 구성원별 계약참여 최소지분율은 10% 이상으로 하여야 한다.\n     - [공동계약운용요령 (계약예규651호) 참조] \n ㅇ 공동수급은 공동이행방식을 원칙으로 하며, 공동계약운용요령 상의 공동수급표준협정서(공동이행방식)는 G2B를 통해 등록한다.\n  □ 본 사업의 하도급의 경우 「소프트웨어 진흥법」 제51조제5항 및 「소프트웨어사업 계약 및 관리감독에관한 지침」의 규정에 의하여 반드시 발주기관으로부터 사전승인을 받고 하도급 계약을 하여야 한다. 다만, 이 경우에는 계약상의 모든 책임은 주 사업자가 진다.\n ㅇ 본 사업의 과업의 일부를 하도급하려는 경우 「소프트웨어 진흥법」 제51조제1항에 따라 물품(상용소프트웨어포함) 구매금액을 제외한 소프트웨어사업금액의 100분의 50을 초과할 수 없으며, 같은 법 제3항에 따라 다시 하도급은 원칙적으로 불허한다. 다만, 같은 법 제51조제2항 각 호 및 제3항 각 호에 해당하는 경우 그러하지 아니한다.\n ㅇ 본 사업 과업의 일부를 하도급하려는 경우 계약체결 후 「소프트웨어사업 계약 및 관리감독에 관한 지침」의 별지 제7호서식 소프트웨어사업 하도급 계획서를 제출하여야 한다.\n ㅇ 하도급계약의 승인을 신청하는 경우, 「소프트웨어사업 계약 및 관리감독에 관한 지침」의 별표 3 [하도급계약의 적정성 판단 세부기준]에 따라 적정성여부를 판단하며, 평가점수가 85점 이상인 경우에 한하여 하도급계약을 승인한다. 다만, 85점 이상인 경우라 하더라도 하도급 계약의 세부 조건 등으로 인하여 사업의원활한 수행이 불가능하다고 인정되는 경우 그 사유를 기재하여 하도급 승인 거절을 통보할 수 있다.\n ㅇ 본 사업에서 전체 사업금액""]",,
C_rule_multi_route,1,한국연구재단_2024년 대학산학협력활동 실태조사 시스템(UICC) 기능개선.hwp,extreme,사업기간은 어떻게 되나요?,계약일로부터 210일,"※ 기술평가는 90점 만점(정량 + 정성)으로 실시하고, 종합평가 반영 시 90점으로 적용","[""※ 기술평가는 90점 만점(정량 + 정성)으로 실시하고, 종합평가 반영 시 90점으로 적용\n □ 제안 평가(평가회의)\n ◦ 장소 및 일시 : 제안서 접수마감 후 입찰업체 개별 통보\n ◦ 방법 : 발표(대면 또는 온라인) 평가\n   - 발표평가는 발표 15분, 질의응답 10분으로 운영\n    ※ 업체별 설명(PT) 순서는 제안서 접수순이며, 제안발표는 PM이 해야 함\n □ 우선협상대상자 선정\n   ㅇ 협상대상자 중 기술평가점수와 가격평가점수를 합한 점수가 1위인 제안사를 우선협상대상자로 선정하여 ‘협상에 의한 계약체결기준’에 따라 협상한다.\n     - 협상이 성립된 때에는 다른 협상적격자와의 협상은 실시하지 않는다.\n   ㅇ 협상대상자와 협상이 모두 결렬되면 재공고 입찰을 추진할 수 있다.\n   ㅇ 기타 규정되지 않은 사항은 관련 법령 및 재단 계약사무규칙에 의한다.\n □ 협상방법 및 기준\n   ㅇ 협상대상자가 제안한 사업내용, 이행방법, 이행일정 등 제안서의 내용을 대상으로 협상을 실시한다. (협상대상자와 협상을 통해 내용 일부 조정 가능)\n   ㅇ 가격은 당해 사업예산(또는 예정가격) 이하로 협상하되 협상대상자가 제안한 가격을 기준 가격으로 한다.\n □ 가격평가\n   ㅇ 협상에 의한 계약체결 기준에 따라 평가점수를 산출한다.\n □ 기타사항\n   ◦ 평가위원 명단은 공개하지 않으며 제안업체는 평가결과에 대하여 이의가 있는 경우 관련 법령을 따른다.\n   ㅇ 제안 세부 내용, 협상 결과는 공개하지 않음을 원칙으로 한다.\n   ㅇ 본 사업은 총 사업예산이 20억 미만인 사업으로, 「소프트웨어 진흥법」 제52조(소프트웨어사업 제안서 보상)에서 명시한 “제안서 보상 대상사업”이 아님.\n   ㅇ 제안가격부분은 시스템 구축에 필요한 각 항목별 세부비용을 구분 하여 제안토록 하고 금액에 대한 산출근거 및 기준을 부가가치세를 포함하여 구체적으로 제시하여야 하며, 소프트웨어 개발 업무에 대하여 ⌜개발규모에 의한 산정 방법(기능점수방식)⌟ 을 준용하여 산정하여야 한다.\n   "", ""1. 사업명: 2024년 대학 산학협력활동 실태조사 시스템(UICC) 기능개선\n2. 추진배경 및 필요성\n □ 한국연구재단법 제5조, 산업교육진흥 및 산학연협력촉진에 관한 법률 제39조의2 및 제43조에 따라 실시하는 대학 산학협력활동 실태조사를 안정적으로 운영 필요 \n □ 항목 지침 변경사항 등 변화에 신속하고 정확하게 대응하며, 기능개선에 대한 사용자 요구를 반영하여 사용자 편의성 강화 필요\n □ UICC의 효율적인 관리와 운영을 위한 지원 체계 및 각종 기관 요구사항에 대응 필요\n3. 주관기관 : 한국연구재단\n4. 사업기간 및 사업비\n □ 사업기간 : 계약일로부터 210일\n □ 사업금액 : 129,300,000원(부가세 포함)\n  ㅇ 예산 세부내역"", ""□ 공동수급(공동이행방식)의 형태로 참가할 경우, 아래 사항을 준수하여야 한다.\n ㅇ 본 사업은 공동수급을 허용하며, 공동수급업체 구성원은 국가를 당사자로 하는 계약에 관한 법률 시행령 제12조(경쟁입찰의 참가자격) 및 동법 시행규칙 제14조 규정에 저촉되지 않아야 한다.\n ㅇ 공동수급체는 5개 이하로 구성하여야 하며, 구성원별 계약참여 최소지분율은 10% 이상으로 하여야 한다.\n     - [공동계약운용요령 (계약예규651호) 참조] \n ㅇ 공동수급은 공동이행방식을 원칙으로 하며, 공동계약운용요령 상의 공동수급표준협정서(공동이행방식)는 G2B를 통해 등록한다.\n  □ 본 사업의 하도급의 경우 「소프트웨어 진흥법」 제51조제5항 및 「소프트웨어사업 계약 및 관리감독에관한 지침」의 규정에 의하여 반드시 발주기관으로부터 사전승인을 받고 하도급 계약을 하여야 한다. 다만, 이 경우에는 계약상의 모든 책임은 주 사업자가 진다.\n ㅇ 본 사업의 과업의 일부를 하도급하려는 경우 「소프트웨어 진흥법」 제51조제1항에 따라 물품(상용소프트웨어포함) 구매금액을 제외한 소프트웨어사업금액의 100분의 50을 초과할 수 없으며, 같은 법 제3항에 따라 다시 하도급은 원칙적으로 불허한다. 다만, 같은 법 제51조제2항 각 호 및 제3항 각 호에 해당하는 경우 그러하지 아니한다.\n ㅇ 본 사업 과업의 일부를 하도급하려는 경우 계약체결 후 「소프트웨어사업 계약 및 관리감독에 관한 지침」의 별지 제7호서식 소프트웨어사업 하도급 계획서를 제출하여야 한다.\n ㅇ 하도급계약의 승인을 신청하는 경우, 「소프트웨어사업 계약 및 관리감독에 관한 지침」의 별표 3 [하도급계약의 적정성 판단 세부기준]에 따라 적정성여부를 판단하며, 평가점수가 85점 이상인 경우에 한하여 하도급계약을 승인한다. 다만, 85점 이상인 경우라 하더라도 하도급 계약의 세부 조건 등으로 인하여 사업의원활한 수행이 불가능하다고 인정되는 경우 그 사유를 기재하여 하도급 승인 거절을 통보할 수 있다.\n ㅇ 본 사업에서 전체 사업금액""]",,
A_single_pipeline,1,한국원자력연구원_한국원자력연구원 선량평가시스템 고도화.hwp,central,이 사업의 입찰방식은 무엇인가?,제한경쟁입찰 (중소기업간 제한경쟁입찰),해당 정보를 찾을 수 없습니다.,[],,
B_rule_single_route,1,한국원자력연구원_한국원자력연구원 선량평가시스템 고도화.hwp,central,이 사업의 입찰방식은 무엇인가?,제한경쟁입찰 (중소기업간 제한경쟁입찰),- 협상순서는 종합평가점수의 고득점 순에 의하여 결정,"[""- 협상순서는 종합평가점수의 고득점 순에 의하여 결정 \n• 협상이 성립된 때에는 다른 협상적격자와의 협상은 실시하지 않음\n• 모든 협상적격자와 협상 결렬 시 재공고 입찰에 부칠 수 있음\n○ 협상방법 및 기준\n- 협상대상자가 제안한 사업내용, 이행방법, 이행일정, 제안가격 등 제안서의 내용을 대상으로 협상 실시 \n• 협상대상자와 협상을 통해 그 내용의 일부를 조정 가능 \n- 가격협상에서는 당해 사업예산(또는 예정가격) 이하로서 협상 대상자가 제안한 가격이 기준 가격이 됨\n• 협상 대상자가 제안한 가격이 사업예산(또는 예정가격) 이상인 경우에는 사업예산(또는 예정가격) 범위 내에서 가격 협상 \n○ 기타사항\n- 제안 세부 내용, 협상 결과는 공개하지 않음을 원칙으로 함\n- 제안가격 부분은 시스템 구축에 필요한 각 항목별 세부비용을 구분하여 제안하여야 하며, 금액에 대한 산출근거 및 기준을 부가가치세를 포함하여 구체적으로 제시하여야 하며, 본 프로젝트의 총 구축기간을 고려한 투입공수를 준용하여 산정하여야 함\n- 입찰 및 낙찰방식에 관하여는 국가를 당사자로 하는 계약에 관한 법률과 이에 근거한 관련 규정, 용역입찰유의서, 협상에 의한 계약 체결기준, 소프트웨어 기술성 평가기준 등과 일반원칙을 따름\n5.3. 기술성 평가기준\n5.3.1. 정성평가 항목 및 배점\n<표>"", ""1.1 사업 개요\n가. 사업명 : 한국원자력연구원 선량평가시스템 고도화\n나. 사업 기간 : 계약일로부터 6개월\n다. 사업비 : 금 46,600 천원 (부가가치세 포함)\n라. 입찰방법 : 제한경쟁입찰\n○ 「소프트웨어산업진흥법 제24조의2 제2항」 및 「대기업인 소프트웨어 사업자가 참여할 수 있는 사업금액의 하한」에 따라 중소기업간 제한경쟁입찰\n마. 계약방법 : 협상에 의한 계약 (기술평가90%, 가격평가10%)\n○ 「국가를 당사자로 하는 계약에 관한 법률시행령 제43조(협상에 의한 계약체결) 및 제43조의2(지식기반사업의 계약방법)」에 의거 “협상에 의한 계약체결” 방법을 적용 \n1.2. 추진배경 및 필요성\n가. 규제요건 준수 필요\n○ 원자력안전위원회고시 제2019-10호 ｢방사선방호 등에 관한 기준｣ 제16조(환경상의 위해방지)에서 제시하는 제한구역경계에서의 연간선량 준수 여부를 확인할 수 있는 체계 구축 필요\n○ ICRP60 기반 평가장기 개선 필요\n○ 액체유출물에 의한 주민피폭선량평가 수행 필요\n나. 업무생산성 향상 필요\n○ UI 개선을 통한 업무개선 및 신속한 의사결정 환경 구축 필요\n○ 출력 기능 고도화를 통한 생산성 향상 필요\n1.3. 사업 범위\n가. 평가장기(Organ) 개선\n○ 포트란 모듈 평가장기 개선\n○ 웹시스템 평가장기 개선\n나. 액체유출물에 의한 선량평가 기능 추가\n○ 포트란 모듈 액체 선량평가 추가\n○ 웹시스템 액체 선량평가 추가\n1.4. 기대 효과\n○ 정상운전 시 선량평가 관련 규제 수요에 대응\n○ 선량평가 시스템 고도화를 통한 데이터 신뢰성 확보 및 생산성 향상"", ""5.2. 협상적격자 선정 및 협상 방법\n○ 기술평가와 가격평가를 실시하여 종합평가점수로 산출\n- 평가비율 : 기술평가(90%, 정성80:정량10), 가격평가(10%)\n- 종합평가점수 산출 = 기술 평가점수 + 입찰가격 평가점수\n- 동점 시 처리방침""]",,
C_rule_multi_route,1,한국원자력연구원_한국원자력연구원 선량평가시스템 고도화.hwp,central,이 사업의 입찰방식은 무엇인가?,제한경쟁입찰 (중소기업간 제한경쟁입찰),- 협상순서는 종합평가점수의 고득점 순에 의하여 결정,"[""- 협상순서는 종합평가점수의 고득점 순에 의하여 결정 \n• 협상이 성립된 때에는 다른 협상적격자와의 협상은 실시하지 않음\n• 모든 협상적격자와 협상 결렬 시 재공고 입찰에 부칠 수 있음\n○ 협상방법 및 기준\n- 협상대상자가 제안한 사업내용, 이행방법, 이행일정, 제안가격 등 제안서의 내용을 대상으로 협상 실시 \n• 협상대상자와 협상을 통해 그 내용의 일부를 조정 가능 \n- 가격협상에서는 당해 사업예산(또는 예정가격) 이하로서 협상 대상자가 제안한 가격이 기준 가격이 됨\n• 협상 대상자가 제안한 가격이 사업예산(또는 예정가격) 이상인 경우에는 사업예산(또는 예정가격) 범위 내에서 가격 협상 \n○ 기타사항\n- 제안 세부 내용, 협상 결과는 공개하지 않음을 원칙으로 함\n- 제안가격 부분은 시스템 구축에 필요한 각 항목별 세부비용을 구분하여 제안하여야 하며, 금액에 대한 산출근거 및 기준을 부가가치세를 포함하여 구체적으로 제시하여야 하며, 본 프로젝트의 총 구축기간을 고려한 투입공수를 준용하여 산정하여야 함\n- 입찰 및 낙찰방식에 관하여는 국가를 당사자로 하는 계약에 관한 법률과 이에 근거한 관련 규정, 용역입찰유의서, 협상에 의한 계약 체결기준, 소프트웨어 기술성 평가기준 등과 일반원칙을 따름\n5.3. 기술성 평가기준\n5.3.1. 정성평가 항목 및 배점\n<표>"", ""1.1 사업 개요\n가. 사업명 : 한국원자력연구원 선량평가시스템 고도화\n나. 사업 기간 : 계약일로부터 6개월\n다. 사업비 : 금 46,600 천원 (부가가치세 포함)\n라. 입찰방법 : 제한경쟁입찰\n○ 「소프트웨어산업진흥법 제24조의2 제2항」 및 「대기업인 소프트웨어 사업자가 참여할 수 있는 사업금액의 하한」에 따라 중소기업간 제한경쟁입찰\n마. 계약방법 : 협상에 의한 계약 (기술평가90%, 가격평가10%)\n○ 「국가를 당사자로 하는 계약에 관한 법률시행령 제43조(협상에 의한 계약체결) 및 제43조의2(지식기반사업의 계약방법)」에 의거 “협상에 의한 계약체결” 방법을 적용 \n1.2. 추진배경 및 필요성\n가. 규제요건 준수 필요\n○ 원자력안전위원회고시 제2019-10호 ｢방사선방호 등에 관한 기준｣ 제16조(환경상의 위해방지)에서 제시하는 제한구역경계에서의 연간선량 준수 여부를 확인할 수 있는 체계 구축 필요\n○ ICRP60 기반 평가장기 개선 필요\n○ 액체유출물에 의한 주민피폭선량평가 수행 필요\n나. 업무생산성 향상 필요\n○ UI 개선을 통한 업무개선 및 신속한 의사결정 환경 구축 필요\n○ 출력 기능 고도화를 통한 생산성 향상 필요\n1.3. 사업 범위\n가. 평가장기(Organ) 개선\n○ 포트란 모듈 평가장기 개선\n○ 웹시스템 평가장기 개선\n나. 액체유출물에 의한 선량평가 기능 추가\n○ 포트란 모듈 액체 선량평가 추가\n○ 웹시스템 액체 선량평가 추가\n1.4. 기대 효과\n○ 정상운전 시 선량평가 관련 규제 수요에 대응\n○ 선량평가 시스템 고도화를 통한 데이터 신뢰성 확보 및 생산성 향상"", ""5.2. 협상적격자 선정 및 협상 방법\n○ 기술평가와 가격평가를 실시하여 종합평가점수로 산출\n- 평가비율 : 기술평가(90%, 정성80:정량10), 가격평가(10%)\n- 종합평가점수 산출 = 기술 평가점수 + 입찰가격 평가점수\n- 동점 시 처리방침"", ""- 평가점수에서 소수점 이하가 있는 경우 소수점 5자리에서 반올림\n- 평가결과 공개는 조달청 규정에 따름\n○ 가격평가 : 󰡔국가를 당사자로 하는 계약에 관한 법률 시행령󰡕 제43조의2에 의한 가격평가(10점)\n○ 협상적격자 선정 및 협상순서\n- 기술평가 점수(90점)만을 기준으로 일정 비율(85%) 이상인 자를 협상적격자로 선정하되, 협상적격자가 없는 경우 재공고 입찰에 부칠 수 있음""]",,
A_single_pipeline,1,한국재정정보원_e나라도움 업무시스템 웹 접근성 컨설팅.hwp,central,사업기간은 언제부터 언제까지인가요?,계약일로부터 120일(약 4개월간),해당 정보를 찾을 수 없습니다.,[],,
B_rule_single_route,1,한국재정정보원_e나라도움 업무시스템 웹 접근성 컨설팅.hwp,central,사업기간은 언제부터 언제까지인가요?,계약일로부터 120일(약 4개월간),4) 추정가격이 고시금액 미만인 입찰에서 입찰공고일을 기준으로 최근 7년 이내에 사업을 개시한 창업기업에 대해서는 신용평가등급 점수상의 배점 한도를 부여한다,"[""4) 추정가격이 고시금액 미만인 입찰에서 입찰공고일을 기준으로 최근 7년 이내에 사업을 개시한 창업기업에 대해서는 신용평가등급 점수상의 배점 한도를 부여한다. 이 경우 창업기업에 대한 확인은 「중소기업제품공공구매 종합정보망」에 등재된 자료로 확인하며, 창업기업확인서의 유효기간 내에 있어야 한다. 다만, 제안서 평가일 전일까지 발급된 자료도 심사에 포함하며, 이 경우 입찰공고일 이전 창업을 확인 할 수 있는 자료(법인인 경우 법인등기부상 법인설립등기일, 개인사업자인 경우에는 사업자등록증명서 상 사업자등록일)를 제출하여야 한다.(이하 창업기업에 대한 확인방법은 같다)"", ""○ 하도급 계획서 제출 요청\n   - 본 사업 과업의 일부를 하도급하려는 경우 입찰 시 및 계약체결 시 「소프트웨어사업의 계약 및 관리감독 지침」(과학기술정보통신부고시 제2023-15호)의 별지 서식 별지 제7호의 소프트웨어사업 하도급계획서를 제출하여야 함\n   - 본 사업은 기술성 평가 시 ‘하도급계획적정성’을 평가항목에 포함하는 사업으로 「소프트웨어 기술성 평가기준 지침」별지 제4호서식 ‘소프트웨어사업 하도급 계획 적정성 확인서’를 제출해야 함​\n ○ 본 사업의 과업 일부를 하도급하려는 경우\n   - 하도급 계획의 적정성 평가를 위하여 입찰 시 ｢조달청 협상에 의한 계약 제안서평가 세부기준｣의 별지 14호 서식인 “소프트웨어사업 하도급 계획서”를 제출하고,\n   - 계약체결 시 ｢소프트웨어사업 계약 및 관리감독에 관한 지침｣의 별지 제7호 서식인 “소프트웨어사업 하도급 계획서”를 제출하여야 함\n ○ 하도급 계약의 적정성 판단 세부기준 명시\n   - 하도급계약의 승인을 신청하는 경우,「소프트웨어사업의 계약 및 관리감독 지침」에 따른 [하도급계약의 적정성 판단 세부기준]에 따라 적정성여부를 판단하며, 평가점수가 85점 이상인 경우에 한하여 하도급계약을 승인함. 다만, 85점 이상인 경우라 하더라도 하도급 계약의 세부 조건 등으로 인하여 사업의 원활한 수행이 불가능하다고 인정되는 경우 그 사유를 기재하여 하도급 승인 거절을 통보할 수 있음\n ○ 공동수급체 구성\n   - 본 사업에서 전체 사업금액 대비 10%를 초과하여 하도급하려는 경우, ‘소프트웨어진흥법’ 제51조제6항 및 동 법 시행령 제48조제5항에 따라 하도급이 아닌 공동수급체를 구성하여 참여해야하며, 공동수급체를 구성하지 못하는 불가피한 사정이 있는 경우 그 사유를 제시하여야 함\n ○ 상세사항은 ‘소프트웨어진흥법 제51조’, ‘소프트웨어진흥법 시행령 제48조‘, ’소프트웨어진흥법 시행규칙 제14조’, ‘소프트웨어사업의 계약 및 관리감독 지침(과학기술정보통신부고시 제2023-15호)’ 준수"", ""- 기술능력 평가점수도 동일한 경우, 기술능력의 세부평가 항목 중 배점이 높은 평가항목에서 점수가 높은 업체를 선정""]",,
C_rule_multi_route,1,한국재정정보원_e나라도움 업무시스템 웹 접근성 컨설팅.hwp,central,사업기간은 언제부터 언제까지인가요?,계약일로부터 120일(약 4개월간),4) 추정가격이 고시금액 미만인 입찰에서 입찰공고일을 기준으로 최근 7년 이내에 사업을 개시한 창업기업에 대해서는 신용평가등급 점수상의 배점 한도를 부여한다,"[""4) 추정가격이 고시금액 미만인 입찰에서 입찰공고일을 기준으로 최근 7년 이내에 사업을 개시한 창업기업에 대해서는 신용평가등급 점수상의 배점 한도를 부여한다. 이 경우 창업기업에 대한 확인은 「중소기업제품공공구매 종합정보망」에 등재된 자료로 확인하며, 창업기업확인서의 유효기간 내에 있어야 한다. 다만, 제안서 평가일 전일까지 발급된 자료도 심사에 포함하며, 이 경우 입찰공고일 이전 창업을 확인 할 수 있는 자료(법인인 경우 법인등기부상 법인설립등기일, 개인사업자인 경우에는 사업자등록증명서 상 사업자등록일)를 제출하여야 한다.(이하 창업기업에 대한 확인방법은 같다)"", ""○ 하도급 계획서 제출 요청\n   - 본 사업 과업의 일부를 하도급하려는 경우 입찰 시 및 계약체결 시 「소프트웨어사업의 계약 및 관리감독 지침」(과학기술정보통신부고시 제2023-15호)의 별지 서식 별지 제7호의 소프트웨어사업 하도급계획서를 제출하여야 함\n   - 본 사업은 기술성 평가 시 ‘하도급계획적정성’을 평가항목에 포함하는 사업으로 「소프트웨어 기술성 평가기준 지침」별지 제4호서식 ‘소프트웨어사업 하도급 계획 적정성 확인서’를 제출해야 함​\n ○ 본 사업의 과업 일부를 하도급하려는 경우\n   - 하도급 계획의 적정성 평가를 위하여 입찰 시 ｢조달청 협상에 의한 계약 제안서평가 세부기준｣의 별지 14호 서식인 “소프트웨어사업 하도급 계획서”를 제출하고,\n   - 계약체결 시 ｢소프트웨어사업 계약 및 관리감독에 관한 지침｣의 별지 제7호 서식인 “소프트웨어사업 하도급 계획서”를 제출하여야 함\n ○ 하도급 계약의 적정성 판단 세부기준 명시\n   - 하도급계약의 승인을 신청하는 경우,「소프트웨어사업의 계약 및 관리감독 지침」에 따른 [하도급계약의 적정성 판단 세부기준]에 따라 적정성여부를 판단하며, 평가점수가 85점 이상인 경우에 한하여 하도급계약을 승인함. 다만, 85점 이상인 경우라 하더라도 하도급 계약의 세부 조건 등으로 인하여 사업의 원활한 수행이 불가능하다고 인정되는 경우 그 사유를 기재하여 하도급 승인 거절을 통보할 수 있음\n ○ 공동수급체 구성\n   - 본 사업에서 전체 사업금액 대비 10%를 초과하여 하도급하려는 경우, ‘소프트웨어진흥법’ 제51조제6항 및 동 법 시행령 제48조제5항에 따라 하도급이 아닌 공동수급체를 구성하여 참여해야하며, 공동수급체를 구성하지 못하는 불가피한 사정이 있는 경우 그 사유를 제시하여야 함\n ○ 상세사항은 ‘소프트웨어진흥법 제51조’, ‘소프트웨어진흥법 시행령 제48조‘, ’소프트웨어진흥법 시행규칙 제14조’, ‘소프트웨어사업의 계약 및 관리감독 지침(과학기술정보통신부고시 제2023-15호)’ 준수"", ""- 기술능력 평가점수도 동일한 경우, 기술능력의 세부평가 항목 중 배점이 높은 평가항목에서 점수가 높은 업체를 선정"", ""<표>\n  ㅇ 평가항목 및 배점한도""]",,
A_single_pipeline,1,한국전기안전공사_전기안전 관제시스템 보안 모듈 개발 용역.hwp,central,이 사업의 사업예산은 얼마인가?,"220,000천원(VAT 포함)",본 사업의 하도급 계약은 불허함.,"[""2. 하도급 계약\n    가. 본 사업의 하도급 계약은 불허함."", ""6. 하자담보 책임기간 및 범위\n    가. ‘(계약예규) 용역계약일반조건’제58조 제2항과 제3항에 따라, 정한 기한 내 하자가 발생하여 발주자가 하자보수를 계약상대자에게 요청한 경우 하자를 조치하여야 함. 단 58조 제2항 각 호의 경우는 유상 유지보수 또는 재개발로 봄, 또한 계약상대자는 제58조 제3항에 각 호의 어느 하나의 사유로 인하여 발생한 하자에는 하자보수의 책임이 없음.\n    나. 본 사업의 하자담보 책임 기간은 발주사가 검사에 의하여 사업의 완성을 확인한 후 1년으로 함.""]",,
B_rule_single_route,1,한국전기안전공사_전기안전 관제시스템 보안 모듈 개발 용역.hwp,central,이 사업의 사업예산은 얼마인가?,"220,000천원(VAT 포함)",본 사업의 하도급 계약은 불허함.,"[""2. 하도급 계약\n    가. 본 사업의 하도급 계약은 불허함."", ""6. 하자담보 책임기간 및 범위\n    가. ‘(계약예규) 용역계약일반조건’제58조 제2항과 제3항에 따라, 정한 기한 내 하자가 발생하여 발주자가 하자보수를 계약상대자에게 요청한 경우 하자를 조치하여야 함. 단 58조 제2항 각 호의 경우는 유상 유지보수 또는 재개발로 봄, 또한 계약상대자는 제58조 제3항에 각 호의 어느 하나의 사유로 인하여 발생한 하자에는 하자보수의 책임이 없음.\n    나. 본 사업의 하자담보 책임 기간은 발주사가 검사에 의하여 사업의 완성을 확인한 후 1년으로 함.""]",,
C_rule_multi_route,1,한국전기안전공사_전기안전 관제시스템 보안 모듈 개발 용역.hwp,central,이 사업의 사업예산은 얼마인가?,"220,000천원(VAT 포함)",본 사업의 하도급 계약은 불허함.,"[""2. 하도급 계약\n    가. 본 사업의 하도급 계약은 불허함."", ""6. 하자담보 책임기간 및 범위\n    가. ‘(계약예규) 용역계약일반조건’제58조 제2항과 제3항에 따라, 정한 기한 내 하자가 발생하여 발주자가 하자보수를 계약상대자에게 요청한 경우 하자를 조치하여야 함. 단 58조 제2항 각 호의 경우는 유상 유지보수 또는 재개발로 봄, 또한 계약상대자는 제58조 제3항에 각 호의 어느 하나의 사유로 인하여 발생한 하자에는 하자보수의 책임이 없음.\n    나. 본 사업의 하자담보 책임 기간은 발주사가 검사에 의하여 사업의 완성을 확인한 후 1년으로 함.""]",,
A_single_pipeline,1,한국지식재산보호원_IP-NAVI  해외지식재산센터 사업관리 시스템 기능개.hwp,central,무상 하자지원 기간은 얼마입니까?,12개월,※ 과업종료 후 안정적인 시스템 운영을 위해 무상 하자지원 : 12개월,"[""ㅇ 사업기간 : 계약체결일 ~ 3개월\n   ※ 과업종료 후 안정적인 시스템 운영을 위해 무상 하자지원 : 12개월""]",,
B_rule_single_route,1,한국지식재산보호원_IP-NAVI  해외지식재산센터 사업관리 시스템 기능개.hwp,central,무상 하자지원 기간은 얼마입니까?,12개월,"- 평가비율은 기술평가(90%), 가격평가(10%)로 하며, 기술평가점수와 가격평가점수를 합산하여 종합평가점수를 산출함","[""- 평가비율은 기술평가(90%), 가격평가(10%)로 하며, 기술평가점수와 가격평가점수를 합산하여 종합평가점수를 산출함\n   ※ 행정기관 및 공공기관 정보시스템 구축‧운영 지침 제18조에 따라 해당 사업의 기술평가에 대한 배점을 90점으로 하며, 입찰가격 평가점수 산출방법은 기획재정부 계약예규의 산식에 따름"", ""- 기술평가항목 및 배점기준은 “[별첨 1] 기술심의 평가표”에 의함\n   ※ 평가항목 : 개발 전략방법론, 개발기술 및 성능 부문, 프로젝트 관리 부문 등"", ""- 기술평가 시 각 평가위원의 평가점수 중 최고점수와 최저점수를 제외한 나머지 점수를 산술평균한 점수를 90점 만점으로 환산하며, 기술능력평가 분야 배점한도의 85%(76.5점) 이상인 자를 협상적격자로 선정""]",,
C_rule_multi_route,1,한국지식재산보호원_IP-NAVI  해외지식재산센터 사업관리 시스템 기능개.hwp,central,무상 하자지원 기간은 얼마입니까?,12개월,※ 과업종료 후 안정적인 시스템 운영을 위해 무상 하자지원 : 12개월,"[""- 평가비율은 기술평가(90%), 가격평가(10%)로 하며, 기술평가점수와 가격평가점수를 합산하여 종합평가점수를 산출함\n   ※ 행정기관 및 공공기관 정보시스템 구축‧운영 지침 제18조에 따라 해당 사업의 기술평가에 대한 배점을 90점으로 하며, 입찰가격 평가점수 산출방법은 기획재정부 계약예규의 산식에 따름"", ""- 기술평가항목 및 배점기준은 “[별첨 1] 기술심의 평가표”에 의함\n   ※ 평가항목 : 개발 전략방법론, 개발기술 및 성능 부문, 프로젝트 관리 부문 등"", ""- 기술평가 시 각 평가위원의 평가점수 중 최고점수와 최저점수를 제외한 나머지 점수를 산술평균한 점수를 90점 만점으로 환산하며, 기술능력평가 분야 배점한도의 85%(76.5점) 이상인 자를 협상적격자로 선정"", ""ㅇ 사업기간 : 계약체결일 ~ 3개월\n   ※ 과업종료 후 안정적인 시스템 운영을 위해 무상 하자지원 : 12개월""]",,
A_single_pipeline,1,한국철도공사 (용역)_[재공고][긴급][협상형]운행정보기록 자동분석시스.hwp,extreme,이 사업의 입찰/계약 방식은 무엇인가?,"일반경쟁입찰 / 협상에 의한 계약(기술 90%, 가격 10%)","◦(입찰/계약) 일반경쟁입찰 / 협상에 의한 계약(기술 90%, 가격 10%)","[""가. 사업개요\n ◦(사 업 명) 운행정보기록 자동분석시스템 개량\n ◦(사업기간) 착수일로부터 180일\n ◦(입찰/계약) 일반경쟁입찰 / 협상에 의한 계약(기술 90%, 가격 10%)"", ""1) 계약서 내용 중 계약자와 우리공사의 해석이 상이한 부분은 우리공사의 해석이 우선하며, 명시되지 아니한 사항은 우리공사의 제반규정을 따른다.\n   2) 본 계약과 관련하여 생산된 산출물은 우리공사에서 보수교재로 활용해도 이의를 제기하지 않는다.\n   3) 계약자가 제공한 시스템은 우리공사의 업무 수행에 지장이 없도록 품질의 신뢰성, 안정성을 갖추어야 하며, 우리공사가 사용하고 있는 기존 시스템에 대한 호환성 및 연계성을 갖추어야 한다.\n   4) 과업달성을 위해 납품된 장비(H/W)가 있는 경우, 그 장비의 파손이나 시험운영 중 장애가 발생한 때에는 A/S(수리)는 불허하며 동일규격 이상의 신규제품으로 교체 하여야 한다.\n   5) 투입인력 변동사항 발생 시 우리공사 사전 승인 하 동급 이상 인력으로 교체해야 한다.\n   6) 제안사 또는 계약자는 본 제안요청서, 입찰제안서 등 입찰 및 계약수행 과정에서 취득한 정보를 누설하여서는 아니 되며, 제3자에게 제공하거나 다른 목적에 이용해서는 안 된다. 이를 위반하여 구매자에게 손해를 끼쳤을 경우 계약자는 이에 대한 민․형사상의 모든 책임을 지고 구매자가 요구하는 손해배상(보상)에 대해 조건 없이 이행해야 한다.\n   7) 기타 계약의 체결 및 이행에 관하여는 국가계약 및 소프트웨어산업 관련 법령, 고시, 예규, 지침 등 일반원칙에 따른다.\n   8) 과업 수행 결과 사용된 모든 소프트웨어, 이미지 및 폰트 등은 저작권에 문제가 없어야하며 저작권과 관련 분쟁 발생 시 계약자가 모든 책임을 다한다.\n   9) 계약자는 본 과업의 원활한 수행을 위하여 운용중인 시스템에 대한 최적의 인터페이스와 기술지원 방안을 제시하고 이를 보증해야 하며, 또한 공사가 수행하는 관련 작업 및 시험에 대해서는 적극적으로 기술지원을 해야 한다.\n   10) 수행업체는 계약 제반조건에 누락되었거나 불분명한 사항이라도 성질상 당연히 수행되어야 할 내용은 공사와 협의하여 결정한다.\n   11) 본 사업은 소프트웨어 진흥법 제50조, 같은 법 ""]",,
B_rule_single_route,1,한국철도공사 (용역)_[재공고][긴급][협상형]운행정보기록 자동분석시스.hwp,extreme,이 사업의 입찰/계약 방식은 무엇인가?,"일반경쟁입찰 / 협상에 의한 계약(기술 90%, 가격 10%)",※ 평가 이후 점수를 90%로 환산하여 기술평가 점수 산정,"[""※ 평가 이후 점수를 90%로 환산하여 기술평가 점수 산정\n  ※ 평가세부 항목 및 배점은 공사의 방침, 평가위원회의 결정에 따라 조정될 수 있음\n   4) 평가표 및 배점 등급"", ""9) 계량평가 배점기준\n  ※ 주의 : 계량평가는 자체 계량평가 점수를 산출하여 제안서와 구분하여 제출하여야 함\n  ※ 공동수급(공동이행 방식)의 경우 각 구성원의 참여비율은 사업금액에 각 구성원이 차지하는 금액을 기준으로 비율로 산정하며, 사업대상 이외의 추정금액은 참여비율 산정 시 적용하지 아니한다.\n  ※ 공동수급의 경우 각 구성원이 차지하는 금액에 대해 각 구성원 대표의 서명이 날인된 증빙서류(각 구성원의 산출내역서)를 제출하여야 한다. \n  ※ 최근 5년간 유사분야 수행실적은 공동수급체 각각의 해당 업종의 실적에 참여비율을 곱하여 합산한 실적을 기준으로 평가한다. \n  ※ 경영상태 평가는 공동수급체 각각 평가한 점수에 참여비율을 곱한 후 그 점수를 합산하여 평가한다. \n    ◦ 신용평가 등급에 따른 경영상태(10점)"", ""4) 평가비율 : 기술평가(90%), 가격평가(10%)\n    * 종합평가점수 산출 : 평가점수 = 기술평가 점수 + 가격평가 점수\n    * 행정기관 및 공공기관 정보시스템 구축‧운영지침(행정안전부고시 제2023-27호, 2022.4.18.) 제18조(평가배점)""]",,
C_rule_multi_route,1,한국철도공사 (용역)_[재공고][긴급][협상형]운행정보기록 자동분석시스.hwp,extreme,이 사업의 입찰/계약 방식은 무엇인가?,"일반경쟁입찰 / 협상에 의한 계약(기술 90%, 가격 10%)",※ 평가 이후 점수를 90%로 환산하여 기술평가 점수 산정,"[""※ 평가 이후 점수를 90%로 환산하여 기술평가 점수 산정\n  ※ 평가세부 항목 및 배점은 공사의 방침, 평가위원회의 결정에 따라 조정될 수 있음\n   4) 평가표 및 배점 등급"", ""9) 계량평가 배점기준\n  ※ 주의 : 계량평가는 자체 계량평가 점수를 산출하여 제안서와 구분하여 제출하여야 함\n  ※ 공동수급(공동이행 방식)의 경우 각 구성원의 참여비율은 사업금액에 각 구성원이 차지하는 금액을 기준으로 비율로 산정하며, 사업대상 이외의 추정금액은 참여비율 산정 시 적용하지 아니한다.\n  ※ 공동수급의 경우 각 구성원이 차지하는 금액에 대해 각 구성원 대표의 서명이 날인된 증빙서류(각 구성원의 산출내역서)를 제출하여야 한다. \n  ※ 최근 5년간 유사분야 수행실적은 공동수급체 각각의 해당 업종의 실적에 참여비율을 곱하여 합산한 실적을 기준으로 평가한다. \n  ※ 경영상태 평가는 공동수급체 각각 평가한 점수에 참여비율을 곱한 후 그 점수를 합산하여 평가한다. \n    ◦ 신용평가 등급에 따른 경영상태(10점)"", ""4) 평가비율 : 기술평가(90%), 가격평가(10%)\n    * 종합평가점수 산출 : 평가점수 = 기술평가 점수 + 가격평가 점수\n    * 행정기관 및 공공기관 정보시스템 구축‧운영지침(행정안전부고시 제2023-27호, 2022.4.18.) 제18조(평가배점)""]",,
A_single_pipeline,1,한국철도공사 (용역)_모바일오피스 시스템 고도화 용역(총체 및 1차).hwp,central,입찰방식은 무엇인가요?,"제한경쟁입찰 / 협상에 의한 계약(기술 90%, 가격 10%)",해당 정보를 찾을 수 없습니다.,[],,
B_rule_single_route,1,한국철도공사 (용역)_모바일오피스 시스템 고도화 용역(총체 및 1차).hwp,central,입찰방식은 무엇인가요?,"제한경쟁입찰 / 협상에 의한 계약(기술 90%, 가격 10%)",해당 정보를 찾을 수 없습니다.,[],,
C_rule_multi_route,1,한국철도공사 (용역)_모바일오피스 시스템 고도화 용역(총체 및 1차).hwp,central,입찰방식은 무엇인가요?,"제한경쟁입찰 / 협상에 의한 계약(기술 90%, 가격 10%)",해당 정보를 찾을 수 없습니다.,[],,
A_single_pipeline,1,한국철도공사 (용역)_예약발매시스템 개량 ISMP 용역.hwp,central,사업예산은 얼마인가요?,470백만원 (VAT포함),해당 정보를 찾을 수 없습니다.,[],,
B_rule_single_route,1,한국철도공사 (용역)_예약발매시스템 개량 ISMP 용역.hwp,central,사업예산은 얼마인가요?,470백만원 (VAT포함),* 지체상금 부과율 = 지체상금 부과액/지체발생 계약(납품요구)종결물품대 =,"[""* 지체상금 부과율 = 지체상금 부과액/지체발생 계약(납품요구)종결물품대 = \n   \n   1.7. 계량평가 배점기준\n     ※ 주의 : 계량평가는 자체 계량평가 점수를 산출하여 기술제안서와 구분하여 제출하여야 함\n     ※ 공동수급(공동이행 방식)의 경우 각 구성원의 참여비율은 사업금액에 각 구성원이 차지하는 금액을 기준으로 비율로 산정하며, 사업대상 이외의 추정금액은 참여비율 산정 시 적용하지 아니한다.\n     ※ 공동수급의 경우 각 구성원이 차지하는 금액에 대해 각 구성원 대표의 서명이 날인된 증빙서류(각 구성원의 산출내역서)를 제출하여야 한다. \n     ※ 최근 5년간 유사분야 수행실적은 공동수급체 각각의 해당 업종의 실적에 참여비율을 곱하여 합산한 실적을 기준으로 평가한다. \n     ※ 경영상태 평가는 공동수급체 각각 평가한 점수에 참여비율을 곱한 후 그 점수를 합산하여 평가한다.\n      (1) 사업실적(10점)"", ""(가) 평가대상자에게 기본점수(배점한도의 40%, 창업초기기업의 경우는 50%)를 부여한 후 배점한도 범위 내에서 기본점수에 “가” 평가항목과 “나” 평가항목의 평점을 합산하여 평가하며, 배점(10점)을 초과할 수 없다."", ""12. 수행제안서·과업지시서 등 본사업에 필요한 종합설계 산출물 확립\n    * 기능, 비기능 요건 정의 및 성능 목표 설정, 업무연관도·개념ER 작성\n    ** 소요기간, 단계별 이행계획, 제안요청서, 과업지시서, 예측 문제 대응 방안, 기간별·연도별 소요예산 산정, 정량·정성 기대효과 분석, 인프라 개선·운영 계획 등 포함\n라. 기대효과""]",,
C_rule_multi_route,1,한국철도공사 (용역)_예약발매시스템 개량 ISMP 용역.hwp,central,사업예산은 얼마인가요?,470백만원 (VAT포함),* 지체상금 부과율 = 지체상금 부과액/지체발생 계약(납품요구)종결물품대 =,"[""* 지체상금 부과율 = 지체상금 부과액/지체발생 계약(납품요구)종결물품대 = \n   \n   1.7. 계량평가 배점기준\n     ※ 주의 : 계량평가는 자체 계량평가 점수를 산출하여 기술제안서와 구분하여 제출하여야 함\n     ※ 공동수급(공동이행 방식)의 경우 각 구성원의 참여비율은 사업금액에 각 구성원이 차지하는 금액을 기준으로 비율로 산정하며, 사업대상 이외의 추정금액은 참여비율 산정 시 적용하지 아니한다.\n     ※ 공동수급의 경우 각 구성원이 차지하는 금액에 대해 각 구성원 대표의 서명이 날인된 증빙서류(각 구성원의 산출내역서)를 제출하여야 한다. \n     ※ 최근 5년간 유사분야 수행실적은 공동수급체 각각의 해당 업종의 실적에 참여비율을 곱하여 합산한 실적을 기준으로 평가한다. \n     ※ 경영상태 평가는 공동수급체 각각 평가한 점수에 참여비율을 곱한 후 그 점수를 합산하여 평가한다.\n      (1) 사업실적(10점)"", ""(가) 평가대상자에게 기본점수(배점한도의 40%, 창업초기기업의 경우는 50%)를 부여한 후 배점한도 범위 내에서 기본점수에 “가” 평가항목과 “나” 평가항목의 평점을 합산하여 평가하며, 배점(10점)을 초과할 수 없다."", ""12. 수행제안서·과업지시서 등 본사업에 필요한 종합설계 산출물 확립\n    * 기능, 비기능 요건 정의 및 성능 목표 설정, 업무연관도·개념ER 작성\n    ** 소요기간, 단계별 이행계획, 제안요청서, 과업지시서, 예측 문제 대응 방안, 기간별·연도별 소요예산 산정, 정량·정성 기대효과 분석, 인프라 개선·운영 계획 등 포함\n라. 기대효과"", ""2.3. 각 평가위원의 평가점수(100점 만점) 중 최고점수와 최저검수를 제외한 나머지 점수를 산술평균한 점수를 90점(80점) 만점으로 환산하며 기술능력평가 분야 배점한도의 85% 이상인 자를 협상적격자로 선정한다.""]",,
A_single_pipeline,1,한국한의학연구원_통합정보시스템 고도화 용역.hwp,central,본 사업의 입찰방식은 무엇인가?,협상에 의한 계약(제한경쟁입찰),ㅇ 본 사업의 계약목적물 귀속에 관한 사항을 다음과 같이 정함,"[""ㅇ 본 사업의 계약목적물 귀속에 관한 사항을 다음과 같이 정함\n   \n<표>"", ""ㅇ 제안사는 공급하는 제품의 품질에 대하여 최종적인 책임을 져야 하며 기술환경 및 기타사정 등으로 인하여 일부 사업의 내용 및 범위 등의 변경이 필요한 경우에는 협의에 의해 조정 가능""]",,
B_rule_single_route,1,한국한의학연구원_통합정보시스템 고도화 용역.hwp,central,본 사업의 입찰방식은 무엇인가?,협상에 의한 계약(제한경쟁입찰),ㅇ 본 사업의 계약목적물 귀속에 관한 사항을 다음과 같이 정함,"[""ㅇ 제안서 발표는 제안서 제출 순서로 진행하며 제안서 발표는 발표(20분) 질문(10분)으로 제한함\n  ㅇ 본 용역사업에 대한 평가는 기술점수(90점)를 기준으로 동 점수의 일정한 비율(85%) 이상인 업체를 협상대상 후보자로 선정하고 선정된 협상대상 후보자에 대하여 가격평가를 실시하여 기술평가점수와 가격평가점수를 합한 점수의 고득점 순으로 협상대상자를 선정하며, 협상대상자 중 가장 점수가 높은 자를 우선협상대상자로 선정함\n  ㅇ 평가결과는 공개하지 않는 것을 원칙으로 하며, 제안사는 기술평가 결과에 대해 일체의 이의를 제기 할 수 없음"", ""ㅇ 제안서 평가결과 기술능력 평가점수가 기술능력 평가분야 배점한도의 85% 이상인 제안사를 협상적격자로 선정하며,"", ""ㅇ 본 사업의 계약목적물 귀속에 관한 사항을 다음과 같이 정함\n   \n<표>""]",,
C_rule_multi_route,1,한국한의학연구원_통합정보시스템 고도화 용역.hwp,central,본 사업의 입찰방식은 무엇인가?,협상에 의한 계약(제한경쟁입찰),ㅇ 본 사업의 계약목적물 귀속에 관한 사항을 다음과 같이 정함,"[""ㅇ 제안서 발표는 제안서 제출 순서로 진행하며 제안서 발표는 발표(20분) 질문(10분)으로 제한함\n  ㅇ 본 용역사업에 대한 평가는 기술점수(90점)를 기준으로 동 점수의 일정한 비율(85%) 이상인 업체를 협상대상 후보자로 선정하고 선정된 협상대상 후보자에 대하여 가격평가를 실시하여 기술평가점수와 가격평가점수를 합한 점수의 고득점 순으로 협상대상자를 선정하며, 협상대상자 중 가장 점수가 높은 자를 우선협상대상자로 선정함\n  ㅇ 평가결과는 공개하지 않는 것을 원칙으로 하며, 제안사는 기술평가 결과에 대해 일체의 이의를 제기 할 수 없음"", ""ㅇ 제안서 평가결과 기술능력 평가점수가 기술능력 평가분야 배점한도의 85% 이상인 제안사를 협상적격자로 선정하며,"", ""ㅇ 본 사업의 계약목적물 귀속에 관한 사항을 다음과 같이 정함\n   \n<표>"", ""ㅇ 본 사업은 소프트웨어 진흥법 제50조, 같은 법 시행령 제47조 제1항 제2호, 제3호에 따른 과업내용 변경 및 그에 따른 계약금액ㆍ계약기간 조정이 필요한 경우, 계약상대자는 소프트웨어사업 과업변경요청서를 제출하여야 함\n □ 소프트웨어사업 영향평가 제외대상 사업""]",,
A_single_pipeline,1,한국해양조사협회_2024년 항해용 간행물 품질관리 업무보조 시스템 구축.hwp,central,입찰방식은 무엇인가요?,제한입찰(협상에 의한 계약),해당 정보를 찾을 수 없습니다.,[],,
B_rule_single_route,1,한국해양조사협회_2024년 항해용 간행물 품질관리 업무보조 시스템 구축.hwp,central,입찰방식은 무엇인가요?,제한입찰(협상에 의한 계약),해당 정보를 찾을 수 없습니다.,[],,
C_rule_multi_route,1,한국해양조사협회_2024년 항해용 간행물 품질관리 업무보조 시스템 구축.hwp,central,입찰방식은 무엇인가요?,제한입찰(협상에 의한 계약),해당 정보를 찾을 수 없습니다.,[],,
A_single_pipeline,1,한영대학_한영대학교 특성화 맞춤형 교육환경 구축 - 트랙운영 학사정보.hwp,central,사업예산은 얼마로 책정되어 있나요?,"130,000,000원 범위 내 (VAT 포함)",해당 정보를 찾을 수 없습니다.,[],,
B_rule_single_route,1,한영대학_한영대학교 특성화 맞춤형 교육환경 구축 - 트랙운영 학사정보.hwp,central,사업예산은 얼마로 책정되어 있나요?,"130,000,000원 범위 내 (VAT 포함)",□ 평가 및 선정,"[""□ 평가 및 선정\n  1) 기술평가와 가격평가를 실시하여 종합평가점수로 평가\n  ○ 평가비율 : 기술평가(90%), 가격평가(10%)\n  ○ 종합평가점수 = 기술평가점수 + 입찰가격 평가점수\n  ○ 종합평가점수가 동점인 경우 기술능력 평가점수가 높은 업체를 선정\n  ○ 기술평가점수도 동일한 경우 기술능력의 평가부문 중 배점이 큰 항목에서 점수가 \n     높은 업체 선정"", ""2) 기술평가 방법\n  ○ 제안서의 공정한 평가를 위해 본교에서 기술평가위원회 구성\n  ○ 기술평가는 제안서 및 프리젠테이션을 기준으로 본교 기술평가위원회에서 평가\n  ○ 기술평가를 위하여 프리젠테이션을 실시한다.\n    - 프리젠테이션 및 질의응답 시간은 업체당 30분(PT 20분/질의응답 10분) 이내 \n  ○ 각 항목별 평가배점과 방법은 『다. 기술성평가기준』에 의한다\n  ○ 각 평가위원의 평가점수 중 최고점수와 최저점수를 제외한 나머지 점수를 산술평균한 점수(90점 만점)가 기술능력평가 분야 배점한도의 85% 이상인 자를 협상적격자로 선정한다.\n  ○ 평가점수가 85% 미만인 업체는 부적격업체로 판정함\n  ○ 평가점수 결과는 소수점 셋째 자리에서 반올림"", ""□ 사 업 명 : 한영대학교 특성화 맞춤형 교육환경 구축 - \n             트랙운영 학사정보시스템 고도화\n□ 사업예산 : 130,000,000원 범위 내 (VAT 포함)\n□ 사업기간 : 계약일로부터 3개월 (안정화기간 1개월 포함)\n  * 기간 및 일정은 학교 사정과 용역대상자와의 협의에 따라 조정될 수 있음\n□ 입찰방법 : 제한경쟁입찰(협상에 의한 계약 체결)""]",,
C_rule_multi_route,1,한영대학_한영대학교 특성화 맞춤형 교육환경 구축 - 트랙운영 학사정보.hwp,central,사업예산은 얼마로 책정되어 있나요?,"130,000,000원 범위 내 (VAT 포함)",□ 평가 및 선정,"[""□ 평가 및 선정\n  1) 기술평가와 가격평가를 실시하여 종합평가점수로 평가\n  ○ 평가비율 : 기술평가(90%), 가격평가(10%)\n  ○ 종합평가점수 = 기술평가점수 + 입찰가격 평가점수\n  ○ 종합평가점수가 동점인 경우 기술능력 평가점수가 높은 업체를 선정\n  ○ 기술평가점수도 동일한 경우 기술능력의 평가부문 중 배점이 큰 항목에서 점수가 \n     높은 업체 선정"", ""2) 기술평가 방법\n  ○ 제안서의 공정한 평가를 위해 본교에서 기술평가위원회 구성\n  ○ 기술평가는 제안서 및 프리젠테이션을 기준으로 본교 기술평가위원회에서 평가\n  ○ 기술평가를 위하여 프리젠테이션을 실시한다.\n    - 프리젠테이션 및 질의응답 시간은 업체당 30분(PT 20분/질의응답 10분) 이내 \n  ○ 각 항목별 평가배점과 방법은 『다. 기술성평가기준』에 의한다\n  ○ 각 평가위원의 평가점수 중 최고점수와 최저점수를 제외한 나머지 점수를 산술평균한 점수(90점 만점)가 기술능력평가 분야 배점한도의 85% 이상인 자를 협상적격자로 선정한다.\n  ○ 평가점수가 85% 미만인 업체는 부적격업체로 판정함\n  ○ 평가점수 결과는 소수점 셋째 자리에서 반올림"", ""□ 사 업 명 : 한영대학교 특성화 맞춤형 교육환경 구축 - \n             트랙운영 학사정보시스템 고도화\n□ 사업예산 : 130,000,000원 범위 내 (VAT 포함)\n□ 사업기간 : 계약일로부터 3개월 (안정화기간 1개월 포함)\n  * 기간 및 일정은 학교 사정과 용역대상자와의 협의에 따라 조정될 수 있음\n□ 입찰방법 : 제한경쟁입찰(협상에 의한 계약 체결)"", ""❍ 구축기간 : 계약일로부터 3개월 (안정화기간 1개월 포함)\n    \n<표>\n   \n    ※ 추진일정은 “발주기관” 와 “계약상대자”의 상호협의를 통해 변경할 수 있음.""]",,
A_single_pipeline,1,고려대학교_차세대 포털·학사 정보시스템 구축사업.pdf,extreme,이 입찰 문서의 사업명은 무엇인가요?,차세대 포털·학사 정보시스템 구축 사업,입찰 참가 신청 방법 ························································································· 230,"[""2. 입찰 참가 신청 방법 ························································································· 230"", ""마. 입찰 및 계약 방법: 제한 경쟁 입찰(협상에 의한 계약)""]",,
B_rule_single_route,1,고려대학교_차세대 포털·학사 정보시스템 구축사업.pdf,extreme,이 입찰 문서의 사업명은 무엇인가요?,차세대 포털·학사 정보시스템 구축 사업,가) 기술능력 평가 점수 배점의 85%(76.5점) 이상인 제안사를 협상 적격자로,"[""가) 기술능력 평가 점수 배점의 85%(76.5점) 이상인 제안사를 협상 적격자로"", ""※ 동점자 처리기준: ①기술평가점수가 높은자, ②배점이 큰 항목의 평가"", ""- 제안사항에 대해 기술평가 항목별 배점 기준표를 기준으로 조견표를 작성하고, 제""]",,
C_rule_multi_route,1,고려대학교_차세대 포털·학사 정보시스템 구축사업.pdf,extreme,이 입찰 문서의 사업명은 무엇인가요?,차세대 포털·학사 정보시스템 구축 사업,가) 기술능력 평가 점수 배점의 85%(76.5점) 이상인 제안사를 협상 적격자로,"[""가) 기술능력 평가 점수 배점의 85%(76.5점) 이상인 제안사를 협상 적격자로"", ""※ 동점자 처리기준: ①기술평가점수가 높은자, ②배점이 큰 항목의 평가"", ""- 제안사항에 대해 기술평가 항목별 배점 기준표를 기준으로 조견표를 작성하고, 제""]",,
A_single_pipeline,1,기초과학연구원_2025년도 중이온가속기용 극저온시스템 운전 용역.pdf,central,사업기간은 언제부터 언제까지인가?,2025년 1월 1일부터 2025년 12월 31일까지,해당 정보를 찾을 수 없습니다.,[],,
B_rule_single_route,1,기초과학연구원_2025년도 중이온가속기용 극저온시스템 운전 용역.pdf,central,사업기간은 언제부터 언제까지인가?,2025년 1월 1일부터 2025년 12월 31일까지,"3.2 (해상도) 이미지파일은 화면검색 및 출력 시 판독이 가능한 해상도 (200 DPI 이상, 권","[""3.2 (해상도) 이미지파일은 화면검색 및 출력 시 판독이 가능한 해상도 (200 DPI 이상, 권"", ""1 SCL3 극저온플랜트 WinCC GUI"", ""2 SCL2 극저온플랜트 WinCC GUI""]",,
C_rule_multi_route,1,기초과학연구원_2025년도 중이온가속기용 극저온시스템 운전 용역.pdf,central,사업기간은 언제부터 언제까지인가?,2025년 1월 1일부터 2025년 12월 31일까지,"3.2 (해상도) 이미지파일은 화면검색 및 출력 시 판독이 가능한 해상도 (200 DPI 이상, 권","[""3.2 (해상도) 이미지파일은 화면검색 및 출력 시 판독이 가능한 해상도 (200 DPI 이상, 권"", ""1 SCL3 극저온플랜트 WinCC GUI"", ""2 SCL2 극저온플랜트 WinCC GUI"", ""3 SCL3 LINAC CS-studio GUI""]",,
A_single_pipeline,1,서울시립대학교_[사전공개] 학업성취도 다차원 종단분석 통합시스템 1차.pdf,extreme,이 사업의 사업기간은 어떻게 되나요?,계약체결일로부터 5개월,- 목표 사업의 원활한 수행 및 운영을 위해 관리가 필요한,"[""- 목표 사업의 원활한 수행 및 운영을 위해 관리가 필요한"", ""m 성과지표는 본 사업의 추진 배경 및 목적을 이해하고 작성하여야 하며, 객관적""]",,
B_rule_single_route,1,서울시립대학교_[사전공개] 학업성취도 다차원 종단분석 통합시스템 1차.pdf,extreme,이 사업의 사업기간은 어떻게 되나요?,계약체결일로부터 5개월,․입찰금액 대비 하도급 비율 50%초과금지,"[""․입찰금액 대비 하도급 비율 50%초과금지"", ""❍ 제안서 평가결과 기술능력 평가점수가 기술능력 평가분야 배점한도의 85%"", ""점수 비율은 기술능력 평가 80/100과 입찰가격 평가 20/100으로 한다. 평가항목 및 배""]",,
C_rule_multi_route,1,서울시립대학교_[사전공개] 학업성취도 다차원 종단분석 통합시스템 1차.pdf,extreme,이 사업의 사업기간은 어떻게 되나요?,계약체결일로부터 5개월,․입찰금액 대비 하도급 비율 50%초과금지,"[""․입찰금액 대비 하도급 비율 50%초과금지"", ""❍ 제안서 평가결과 기술능력 평가점수가 기술능력 평가분야 배점한도의 85%"", ""점수 비율은 기술능력 평가 80/100과 입찰가격 평가 20/100으로 한다. 평가항목 및 배""]",,
A_single_pipeline,1,서울특별시_2024년 지도정보 플랫폼 및 전문활용 연계 시스템 고도화 용.pdf,extreme,사업기간은 어떻게 되나요?,계약체결일로부터 7개월(210일),해당 정보를 찾을 수 없습니다.,[],,
B_rule_single_route,1,서울특별시_2024년 지도정보 플랫폼 및 전문활용 연계 시스템 고도화 용.pdf,extreme,사업기간은 어떻게 되나요?,계약체결일로부터 7개월(210일),❍ 제안서 평가결과 기술능력 평가점수가 기술능력 평가분야 배점한도의 85%,"[""❍ 제안서 평가결과 기술능력 평가점수가 기술능력 평가분야 배점한도의 85%"", ""점수 비율은 기술능력 평가 90/100과 입찰가격 평가 10/100으로 한다. 평가항목 및 배"", ""정량적 지표의 평가기준 규모비율 100% 이상 1 8 0 0 0 % % ~ 이 미 상 만 6 8 0 0 % % ~ 이 미 상 만 4 6 0 0 % % ~ 이 미 상 만 미 40 만 % (자료미 하 제출시)""]",,
C_rule_multi_route,1,서울특별시_2024년 지도정보 플랫폼 및 전문활용 연계 시스템 고도화 용.pdf,extreme,사업기간은 어떻게 되나요?,계약체결일로부터 7개월(210일),❍ 제안서 평가결과 기술능력 평가점수가 기술능력 평가분야 배점한도의 85%,"[""❍ 제안서 평가결과 기술능력 평가점수가 기술능력 평가분야 배점한도의 85%"", ""점수 비율은 기술능력 평가 90/100과 입찰가격 평가 10/100으로 한다. 평가항목 및 배"", ""정량적 지표의 평가기준 규모비율 100% 이상 1 8 0 0 0 % % ~ 이 미 상 만 6 8 0 0 % % ~ 이 미 상 만 4 6 0 0 % % ~ 이 미 상 만 미 40 만 % (자료미 하 제출시)""]",,
